aiter/configs/model_configs/gptoss_bf16_tuned_gemm.csv
cu_num,M,N,K,bias,dtype,outdtype,scaleAB,bpreshuffle,libtype,solidx,splitK,us,kernelName,err_ratio,tflops,bw
256,1,128,2880,True,torch.bfloat16,torch.bfloat16,False,False,asm,1,11,4.4021,_ZN5aiter39bf16gemm_fp32bf16_tn_32x64_splitk_cleanE,0.0156,0.17,168.85
256,1,2560,2880,True,torch.bfloat16,torch.bfloat16,False,False,asm,1,3,9.7108,_ZN5aiter39bf16gemm_fp32bf16_tn_32x64_splitk_cleanE,0.0082,1.52,1519.59
256,1,2880,2048,True,torch.bfloat16,torch.bfloat16,False,False,asm,1,5,8.6543,_ZN5aiter39bf16gemm_fp32bf16_tn_32x64_splitk_cleanE,0.0097,1.36,1364.22
256,1,2880,4096,True,torch.bfloat16,torch.bfloat16,False,False,triton,0,0,9.1855,auto,0.0,2.57,2570.02
256,1,5120,2880,True,torch.bfloat16,torch.bfloat16,False,False,asm,1,3,11.2012,_ZN5aiter39bf16gemm_fp32bf16_tn_32x64_splitk_cleanE,0.008,2.63,2634.29
256,2,128,2880,True,torch.bfloat16,torch.bfloat16,False,False,asm,1,11,4.4168,_ZN5aiter39bf16gemm_fp32bf16_tn_32x64_splitk_cleanE,0.0156,0.33,169.65
256,2,2560,2880,True,torch.bfloat16,torch.bfloat16,False,False,asm,1,4,9.1765,_ZN5aiter39bf16gemm_fp32bf16_tn_32x64_splitk_cleanE,0.0109,3.21,1609.26
256,2,2880,2048,True,torch.bfloat16,torch.bfloat16,False,False,asm,1,4,8.4399,_ZN5aiter39bf16gemm_fp32bf16_tn_32x64_splitk_cleanE,0.0102,2.8,1400.04
256,2,2880,4096,True,torch.bfloat16,torch.bfloat16,False,False,triton,0,0,9.4381,auto,0.0,5.0,2502.71
256,2,5120,2880,True,torch.bfloat16,torch.bfloat16,False,False,asm,1,3,11.402,_ZN5aiter39bf16gemm_fp32bf16_tn_32x64_splitk_cleanE,0.0075,5.17,2589.3
256,4,128,2880,True,torch.bfloat16,torch.bfloat16,False,False,asm,1,9,4.4035,_ZN5aiter39bf16gemm_fp32bf16_tn_32x64_splitk_cleanE,0.0098,0.67,172.9
256,4,2560,2880,True,torch.bfloat16,torch.bfloat16,False,False,asm,5,5,9.9316,_ZN5aiter39bf16gemm_fp32bf16_tn_64x64_splitk_cleanE,0.0122,5.94,1489.1
256,4,2880,2048,True,torch.bfloat16,torch.bfloat16,False,False,asm,3,4,8.1855,_ZN5aiter39bf16gemm_fp32bf16_tn_48x64_splitk_cleanE,0.0091,5.76,1445.96
256,4,2880,4096,True,torch.bfloat16,torch.bfloat16,False,False,triton,0,0,9.7799,auto,0.0,9.65,2418.1
256,4,5120,2880,True,torch.bfloat16,torch.bfloat16,False,False,asm,1,3,11.5586,_ZN5aiter39bf16gemm_fp32bf16_tn_32x64_splitk_cleanE,0.0074,10.21,2556.99
256,8,128,2880,True,torch.bfloat16,torch.bfloat16,False,False,asm,1,9,4.4643,_ZN5aiter39bf16gemm_fp32bf16_tn_32x64_splitk_cleanE,0.0127,1.32,175.93
256,8,2560,2880,True,torch.bfloat16,torch.bfloat16,False,False,asm,3,4,9.7728,_ZN5aiter39bf16gemm_fp32bf16_tn_48x64_splitk_cleanE,0.0104,12.07,1517.75
256,8,2880,2048,True,torch.bfloat16,torch.bfloat16,False,False,asm,5,3,8.6642,_ZN5aiter39bf16gemm_fp32bf16_tn_64x64_splitk_cleanE,0.0064,10.89,1370.62
256,8,2880,4096,True,torch.bfloat16,torch.bfloat16,False,False,triton,0,0,10.2907,auto,0.0,18.34,2303.5
256,8,5120,2880,True,torch.bfloat16,torch.bfloat16,False,False,asm,1,3,11.7116,_ZN5aiter39bf16gemm_fp32bf16_tn_32x64_splitk_cleanE,0.0077,20.14,2529.05
256,16,128,2880,True,torch.bfloat16,torch.bfloat16,False,False,asm,3,10,4.8658,_ZN5aiter39bf16gemm_fp32bf16_tn_48x64_splitk_cleanE,0.0146,2.42,171.31
256,16,2560,2880,True,torch.bfloat16,torch.bfloat16,False,False,asm,3,4,9.8954,_ZN5aiter39bf16gemm_fp32bf16_tn_48x64_splitk_cleanE,0.01,23.84,1507.74
256,16,2880,2048,True,torch.bfloat16,torch.bfloat16,False,False,asm,1,3,8.7178,_ZN5aiter39bf16gemm_fp32bf16_tn_32x64_splitk_cleanE,0.0062,21.65,1371.24
256,16,2880,4096,True,torch.bfloat16,torch.bfloat16,False,False,triton,0,0,10.4181,auto,0.0,36.23,2286.04
256,16,5120,2880,True,torch.bfloat16,torch.bfloat16,False,False,asm,1,3,12.0177,_ZN5aiter39bf16gemm_fp32bf16_tn_32x64_splitk_cleanE,0.0077,39.26,2475.28
256,32,128,2880,True,torch.bfloat16,torch.bfloat16,False,False,asm,3,15,4.3956,_ZN5aiter39bf16gemm_fp32bf16_tn_48x64_splitk_cleanE,0.0234,5.37,211.53
256,32,2560,2880,True,torch.bfloat16,torch.bfloat16,False,False,asm,1,4,9.7246,_ZN5aiter39bf16gemm_fp32bf16_tn_32x64_splitk_cleanE,0.0099,48.52,1552.12
256,32,2880,2048,True,torch.bfloat16,torch.bfloat16,False,False,asm,3,5,9.5423,_ZN5aiter39bf16gemm_fp32bf16_tn_48x64_splitk_cleanE,0.0107,39.56,1269.28
256,32,2880,4096,True,torch.bfloat16,torch.bfloat16,False,False,asm,1,5,11.2956,_ZN5aiter39bf16gemm_fp32bf16_tn_32x64_splitk_cleanE,0.0138,66.84,2128.21
256,32,5120,2880,True,torch.bfloat16,torch.bfloat16,False,False,asm,1,3,12.2183,_ZN5aiter39bf16gemm_fp32bf16_tn_32x64_splitk_cleanE,0.0077,77.24,2455.6
256,48,128,2880,True,torch.bfloat16,torch.bfloat16,False,False,asm,3,13,4.7396,_ZN5aiter39bf16gemm_fp32bf16_tn_48x64_splitk_cleanE,0.0199,7.47,216.48
256,48,2560,2880,True,torch.bfloat16,torch.bfloat16,False,False,asm,3,4,10.6698,_ZN5aiter39bf16gemm_fp32bf16_tn_48x64_splitk_cleanE,0.0101,66.34,1430.94
256,48,2880,2048,True,torch.bfloat16,torch.bfloat16,False,False,asm,5,4,9.5586,_ZN5aiter39bf16gemm_fp32bf16_tn_64x64_splitk_cleanE,0.009,59.24,1283.62
256,48,2880,4096,True,torch.bfloat16,torch.bfloat16,False,False,asm,3,5,11.8153,_ZN5aiter39bf16gemm_fp32bf16_tn_48x64_splitk_cleanE,0.0134,95.85,2053.49
256,48,5120,2880,True,torch.bfloat16,torch.bfloat16,False,False,asm,3,3,13.0321,_ZN5aiter39bf16gemm_fp32bf16_tn_48x64_splitk_cleanE,0.0077,108.62,2321.9
256,64,128,2880,True,torch.bfloat16,torch.bfloat16,False,False,asm,5,15,4.9073,_ZN5aiter39bf16gemm_fp32bf16_tn_64x64_splitk_cleanE,0.025,9.62,228.7
256,64,2560,2880,True,torch.bfloat16,torch.bfloat16,False,False,asm,1,3,10.5605,_ZN5aiter39bf16gemm_fp32bf16_tn_32x64_splitk_cleanE,0.0074,89.36,1462.23
256,64,2880,2048,True,torch.bfloat16,torch.bfloat16,False,False,asm,5,3,9.6563,_ZN5aiter39bf16gemm_fp32bf16_tn_64x64_splitk_cleanE,0.0067,78.18,1286.96
256,64,2880,4096,True,torch.bfloat16,torch.bfloat16,False,False,asm,5,5,12.3105,_ZN5aiter39bf16gemm_fp32bf16_tn_64x64_splitk_cleanE,0.0137,122.66,1989.02
256,64,5120,2880,True,torch.bfloat16,torch.bfloat16,False,False,asm,5,3,13.5485,_ZN5aiter39bf16gemm_fp32bf16_tn_64x64_splitk_cleanE,0.0077,139.31,2252.29
256,80,128,2880,True,torch.bfloat16,torch.bfloat16,False,False,asm,3,9,4.8408,_ZN5aiter39bf16gemm_fp32bf16_tn_48x64_splitk_cleanE,0.0184,12.18,251.73
256,80,2880,4096,True,torch.bfloat16,torch.bfloat16,False,False,asm,7,5,12.6552,_ZN5aiter39bf16gemm_fp32bf16_tn_80x64_splitk_cleanE,0.0135,149.14,1952.49
256,80,5120,2880,True,torch.bfloat16,torch.bfloat16,False,False,asm,7,3,14.0135,_ZN5aiter39bf16gemm_fp32bf16_tn_80x64_splitk_cleanE,0.0076,168.36,2195.83
256,96,128,2880,True,torch.bfloat16,torch.bfloat16,False,False,asm,8,15,5.1844,_ZN5aiter39bf16gemm_fp32bf16_tn_96x64_splitk_cleanE,0.026,13.65,253.61
256,96,2880,4096,True,torch.bfloat16,torch.bfloat16,False,False,asm,8,5,13.2504,_ZN5aiter39bf16gemm_fp32bf16_tn_96x64_splitk_cleanE,0.0137,170.93,1881.63
256,96,5120,2880,True,torch.bfloat16,torch.bfloat16,False,False,asm,8,3,14.5394,_ZN5aiter39bf16gemm_fp32bf16_tn_96x64_splitk_cleanE,0.0076,194.72,2134.01
256,112,128,2880,True,torch.bfloat16,torch.bfloat16,False,False,asm,5,9,5.0344,_ZN5aiter39bf16gemm_fp32bf16_tn_64x64_splitk_cleanE,0.0162,16.4,280.29
256,112,2880,4096,True,torch.bfloat16,torch.bfloat16,False,False,asm,5,2,17.4414,_ZN5aiter39bf16gemm_fp32bf16_tn_64x64_splitk_cleanE,0.0048,151.5,1442.29
256,112,5120,2880,True,torch.bfloat16,torch.bfloat16,False,False,asm,4,1,19.2107,_ZN5aiter37bf16gemm_fp32bf16_tn_48x64_pf3_splitkE,0.0,171.94,1628.43
256,128,128,2880,True,torch.bfloat16,torch.bfloat16,False,False,asm,5,8,4.7402,_ZN5aiter39bf16gemm_fp32bf16_tn_64x64_splitk_cleanE,0.016,19.91,317.99
256,128,2560,2880,True,torch.bfloat16,torch.bfloat16,False,False,asm,7,3,11.9095,_ZN5aiter39bf16gemm_fp32bf16_tn_80x64_splitk_cleanE,0.0074,158.48,1355.07
256,128,2880,2048,True,torch.bfloat16,torch.bfloat16,False,False,asm,5,2,11.2484,_ZN5aiter39bf16gemm_fp32bf16_tn_64x64_splitk_cleanE,0.0035,134.24,1160.88
256,128,2880,4096,True,torch.bfloat16,torch.bfloat16,False,False,asm,5,2,17.5461,_ZN5aiter39bf16gemm_fp32bf16_tn_64x64_splitk_cleanE,0.0048,172.11,1446.41
256,128,5120,2880,True,torch.bfloat16,torch.bfloat16,False,False,asm,4,1,19.2945,_ZN5aiter37bf16gemm_fp32bf16_tn_48x64_pf3_splitkE,0.0,195.65,1634.62
256,256,128,2880,True,torch.bfloat16,torch.bfloat16,False,False,asm,5,7,6.5053,_ZN5aiter39bf16gemm_fp32bf16_tn_64x64_splitk_cleanE,0.0157,29.01,350.08
256,256,2560,2880,True,torch.bfloat16,torch.bfloat16,False,False,asm,8,2,15.4372,_ZN5aiter39bf16gemm_fp32bf16_tn_96x64_splitk_cleanE,0.0041,244.53,1135.63
256,256,2880,2048,True,torch.bfloat16,torch.bfloat16,False,False,asm,6,1,15.4366,_ZN5aiter37bf16gemm_fp32bf16_tn_64x64_pf3_splitkE,0.0,195.63,927.64
304,1,5120,2880,True,torch.bfloat16,torch.bfloat16,False,False,triton,618599,0,17.0412,auto,0.0,1.73,1731.52
304,1,2880,4096,True,torch.bfloat16,torch.bfloat16,False,False,triton,618608,0,10.1359,auto,0.0,2.33,2329.04
304,1,128,2880,True,torch.bfloat16,torch.bfloat16,False,False,triton,618603,0,10.3001,auto,0.0,0.07,72.16
304,2,5120,2880,True,torch.bfloat16,torch.bfloat16,False,False,triton,618591,0,17.2327,auto,0.0,3.42,1713.21
304,2,2880,4096,True,torch.bfloat16,torch.bfloat16,False,False,triton,618603,0,10.1022,auto,0.0,4.67,2338.19
304,2,128,2880,True,torch.bfloat16,torch.bfloat16,False,False,triton,618601,0,10.4159,auto,0.0,0.14,71.94
304,4,5120,2880,True,torch.bfloat16,torch.bfloat16,False,False,triton,618599,0,17.3212,auto,0.0,6.81,1706.3
304,4,2880,4096,True,torch.bfloat16,torch.bfloat16,False,False,triton,618603,0,10.3169,auto,0.0,9.15,2292.24
304,4,128,2880,True,torch.bfloat16,torch.bfloat16,False,False,triton,618601,0,10.3779,auto,0.0,0.28,73.36
304,8,5120,2880,True,torch.bfloat16,torch.bfloat16,False,False,triton,618599,0,17.2979,auto,0.0,13.64,1712.3
304,8,2880,4096,True,torch.bfloat16,torch.bfloat16,False,False,triton,618603,0,10.1527,auto,0.0,18.59,2334.81
304,8,128,2880,True,torch.bfloat16,torch.bfloat16,False,False,triton,618603,0,10.8012,auto,0.0,0.55,72.71
304,16,5120,2880,True,torch.bfloat16,torch.bfloat16,False,False,triton,618599,0,17.3674,auto,0.0,27.17,1712.82
304,16,2880,4096,True,torch.bfloat16,torch.bfloat16,False,False,triton,618603,0,10.3801,auto,0.0,36.37,2294.41
304,16,128,2880,True,torch.bfloat16,torch.bfloat16,False,False,triton,618601,0,11.1528,auto,0.0,1.06,74.74
304,32,5120,2880,True,torch.bfloat16,torch.bfloat16,False,False,triton,618591,0,18.8286,auto,0.0,50.12,1593.49
304,32,2880,4096,True,torch.bfloat16,torch.bfloat16,False,False,triton,618604,0,12.1128,auto,0.0,62.33,1984.63
304,32,128,2880,True,torch.bfloat16,torch.bfloat16,False,False,triton,618603,0,11.4643,auto,0.0,2.06,81.1
304,48,5120,2880,True,torch.bfloat16,torch.bfloat16,False,False,triton,618578,0,21.9233,auto,0.0,64.57,1380.23
304,48,2880,4096,True,torch.bfloat16,torch.bfloat16,False,False,triton,618592,0,13.6643,auto,0.0,82.88,1775.62
304,48,128,2880,True,torch.bfloat16,torch.bfloat16,False,False,triton,618603,0,11.7001,auto,0.0,3.02,87.7
304,64,5120,2880,True,torch.bfloat16,torch.bfloat16,False,False,triton,618571,0,22.6181,auto,0.0,83.45,1349.15
304,64,2880,4096,True,torch.bfloat16,torch.bfloat16,False,False,triton,618592,0,14.0454,auto,0.0,107.5,1743.34
304,64,128,2880,True,torch.bfloat16,torch.bfloat16,False,False,triton,618593,0,11.8327,auto,0.0,3.99,94.85
304,80,5120,2880,True,torch.bfloat16,torch.bfloat16,False,False,triton,618571,0,22.5254,auto,0.0,104.74,1366.07
304,80,2880,4096,True,torch.bfloat16,torch.bfloat16,False,False,triton,618590,0,15.9991,auto,0.0,117.97,1544.41
304,80,128,2880,True,torch.bfloat16,torch.bfloat16,False,False,triton,618593,0,11.6769,auto,0.0,5.05,104.36
304,96,5120,2880,True,torch.bfloat16,torch.bfloat16,False,False,triton,618571,0,22.5065,auto,0.0,125.79,1378.59
304,96,2880,4096,True,torch.bfloat16,torch.bfloat16,False,False,triton,618590,0,16.6728,auto,0.0,135.85,1495.39
304,96,128,2880,True,torch.bfloat16,torch.bfloat16,False,False,triton,618593,0,11.8916,auto,0.0,5.95,110.57
304,112,5120,2880,True,torch.bfloat16,torch.bfloat16,False,False,triton,618570,0,24.6222,auto,0.0,134.15,1270.53
304,112,2880,4096,True,torch.bfloat16,torch.bfloat16,False,False,triton,618590,0,17.3106,auto,0.0,152.65,1453.19
304,112,128,2880,True,torch.bfloat16,torch.bfloat16,False,False,triton,618593,0,11.9001,auto,0.0,6.94,118.58
304,128,5120,2880,True,torch.bfloat16,torch.bfloat16,False,False,triton,618570,0,24.8097,auto,0.0,152.15,1271.24
304,128,2880,4096,True,torch.bfloat16,torch.bfloat16,False,False,triton,618590,0,17.9002,auto,0.0,168.71,1417.8
304,128,128,2880,True,torch.bfloat16,torch.bfloat16,False,False,triton,618593,0,11.5906,auto,0.0,8.14,130.05
80,1,5120,2880,True,torch.bfloat16,torch.bfloat16,False,False,triton,618599,0,17.0412,auto,0.0,1.73,1731.52
80,1,2880,4096,True,torch.bfloat16,torch.bfloat16,False,False,triton,618608,0,10.1359,auto,0.0,2.33,2329.04
80,1,128,2880,True,torch.bfloat16,torch.bfloat16,False,False,triton,618603,0,10.3001,auto,0.0,0.07,72.16
80,2,5120,2880,True,torch.bfloat16,torch.bfloat16,False,False,triton,618591,0,17.2327,auto,0.0,3.42,1713.21
80,2,2880,4096,True,torch.bfloat16,torch.bfloat16,False,False,triton,618603,0,10.1022,auto,0.0,4.67,2338.19
80,2,128,2880,True,torch.bfloat16,torch.bfloat16,False,False,triton,618601,0,10.4159,auto,0.0,0.14,71.94
80,4,5120,2880,True,torch.bfloat16,torch.bfloat16,False,False,triton,618599,0,17.3212,auto,0.0,6.81,1706.3
80,4,2880,4096,True,torch.bfloat16,torch.bfloat16,False,False,triton,618603,0,10.3169,auto,0.0,9.15,2292.24
80,4,128,2880,True,torch.bfloat16,torch.bfloat16,False,False,triton,618601,0,10.3779,auto,0.0,0.28,73.36
80,8,5120,2880,True,torch.bfloat16,torch.bfloat16,False,False,triton,618599,0,17.2979,auto,0.0,13.64,1712.3
80,8,2880,4096,True,torch.bfloat16,torch.bfloat16,False,False,triton,618603,0,10.1527,auto,0.0,18.59,2334.81
80,8,128,2880,True,torch.bfloat16,torch.bfloat16,False,False,triton,618603,0,10.8012,auto,0.0,0.55,72.71
80,16,5120,2880,True,torch.bfloat16,torch.bfloat16,False,False,triton,618599,0,17.3674,auto,0.0,27.17,1712.82
80,16,2880,4096,True,torch.bfloat16,torch.bfloat16,False,False,triton,618603,0,10.3801,auto,0.0,36.37,2294.41
80,16,128,2880,True,torch.bfloat16,torch.bfloat16,False,False,triton,618601,0,11.1528,auto,0.0,1.06,74.74
80,32,5120,2880,True,torch.bfloat16,torch.bfloat16,False,False,triton,618591,0,18.8286,auto,0.0,50.12,1593.49
80,32,2880,4096,True,torch.bfloat16,torch.bfloat16,False,False,triton,618604,0,12.1128,auto,0.0,62.33,1984.63
80,32,128,2880,True,torch.bfloat16,torch.bfloat16,False,False,triton,618603,0,11.4643,auto,0.0,2.06,81.1
80,48,5120,2880,True,torch.bfloat16,torch.bfloat16,False,False,triton,618578,0,21.9233,auto,0.0,64.57,1380.23
80,48,2880,4096,True,torch.bfloat16,torch.bfloat16,False,False,triton,618592,0,13.6643,auto,0.0,82.88,1775.62
80,48,128,2880,True,torch.bfloat16,torch.bfloat16,False,False,triton,618603,0,11.7001,auto,0.0,3.02,87.7
80,64,5120,2880,True,torch.bfloat16,torch.bfloat16,False,False,triton,618571,0,22.6181,auto,0.0,83.45,1349.15
80,64,2880,4096,True,torch.bfloat16,torch.bfloat16,False,False,triton,618592,0,14.0454,auto,0.0,107.5,1743.34
80,64,128,2880,True,torch.bfloat16,torch.bfloat16,False,False,triton,618593,0,11.8327,auto,0.0,3.99,94.85
80,80,5120,2880,True,torch.bfloat16,torch.bfloat16,False,False,triton,618571,0,22.5254,auto,0.0,104.74,1366.07
80,80,2880,4096,True,torch.bfloat16,torch.bfloat16,False,False,triton,618590,0,15.9991,auto,0.0,117.97,1544.41
80,80,128,2880,True,torch.bfloat16,torch.bfloat16,False,False,triton,618593,0,11.6769,auto,0.0,5.05,104.36
80,96,5120,2880,True,torch.bfloat16,torch.bfloat16,False,False,triton,618571,0,22.5065,auto,0.0,125.79,1378.59
80,96,2880,4096,True,torch.bfloat16,torch.bfloat16,False,False,triton,618590,0,16.6728,auto,0.0,135.85,1495.39
80,96,128,2880,True,torch.bfloat16,torch.bfloat16,False,False,triton,618593,0,11.8916,auto,0.0,5.95,110.57
80,112,5120,2880,True,torch.bfloat16,torch.bfloat16,False,False,triton,618570,0,24.6222,auto,0.0,134.15,1270.53
80,112,2880,4096,True,torch.bfloat16,torch.bfloat16,False,False,triton,618590,0,17.3106,auto,0.0,152.65,1453.19
80,112,128,2880,True,torch.bfloat16,torch.bfloat16,False,False,triton,618593,0,11.9001,auto,0.0,6.94,118.58
80,128,5120,2880,True,torch.bfloat16,torch.bfloat16,False,False,triton,618570,0,24.8097,auto,0.0,152.15,1271.24
80,128,2880,4096,True,torch.bfloat16,torch.bfloat16,False,False,triton,618590,0,17.9002,auto,0.0,168.71,1417.8
80,128,128,2880,True,torch.bfloat16,torch.bfloat16,False,False,triton,618593,0,11.5906,auto,0.0,8.14,130.05
80,64,256,5120,False,torch.bfloat16,torch.float32,False,False,asm,1,10,9.3967,_ZN5aiter30bf16gemm_fp32bf16_tn_32x64_pf3E,0.0,17.85,355.69
80,80,256,5120,False,torch.bfloat16,torch.float32,False,False,asm,2,10,9.7635,_ZN5aiter30bf16gemm_fp32bf16_tn_48x64_pf3E,0.0,21.48,360.79
80,128,256,5120,False,torch.bfloat16,torch.float32,False,False,asm,3,10,10.8196,_ZN5aiter30bf16gemm_fp32bf16_tn_64x64_pf3E,0.0,31.01,375.54
80,150,256,5120,False,torch.bfloat16,torch.float32,False,False,asm,2,5,13.2734,_ZN5aiter30bf16gemm_fp32bf16_tn_48x64_pf3E,0.0,29.62,324.79
80,192,256,5120,False,torch.bfloat16,torch.float32,False,False,asm,2,5,15.0013,_ZN5aiter30bf16gemm_fp32bf16_tn_48x64_pf3E,0.0,33.55,318.91
80,220,256,5120,False,torch.bfloat16,torch.float32,False,False,asm,3,5,14.6675,_ZN5aiter30bf16gemm_fp32bf16_tn_64x64_pf3E,0.0,39.32,347.67
80,256,256,5120,False,torch.bfloat16,torch.float32,False,False,asm,3,5,16.2047,_ZN5aiter30bf16gemm_fp32bf16_tn_64x64_pf3E,0.0,41.41,339.72
256,16384,640,2880,True,torch.bfloat16,torch.bfloat16,False,False,hipblaslt,388231,0,53.1907,Cijk_Alik_Bljk_BBS_BH_Bias_HA_S_SAV_UserArgs_MT160x256x64_MI16x16x1_SN_LDSB0_AFC1_AFEM1_AFEM1_ASEM1_CLR1_CADS0_DTLA0_DTLB0_DTVA0_DTVB0_EPS0_FDSI0_GRPM1_GRVWA8_GRVWB8_GSU0_GSUAMB_GLS0_ISA950_IU1_K1_LBSPPA256_LBSPPB512_LBSPPM0_LPA16_LPB16_LPM0_LRVW8_LWPMn1_MIAV0_MIWT10_4_MO40_NTn1_NTA1_NTB3_NTC1_NTD7_NTM0_NEPBS0_NLCA1_NLCB1_ONLL1_PGR2_PLR1_PKA1_SIA3_SS1_SPO0_SRVW0_SSO1_SVW2_SK3_SKXCCM8_TLDS1_ULSGRO0_USL1_UIOFGRO0_USFGROn1_VSn1_VWA2_VWB4_WSGRA0_WSGRB0_WS64_WG16_16_1,0.0,1135.5,2237.79
256,16384,2880,512,True,torch.bfloat16,torch.bfloat16,False,False,hipblaslt,387817,0,61.2834,Cijk_Alik_Bljk_BBS_BH_Bias_HA_S_SAV_UserArgs_MT192x256x64_MI16x16x1_SN_LDSB0_AFC1_AFEM1_AFEM1_ASEM1_CLR1_CADS0_DTLA1_DTLB1_DTVA0_DTVB0_EPS0_FDSI0_GRPM1_GRVWA2_GRVWB8_GSU0_GSUAMB_GLS0_ISA950_IU1_K1_LBSPPA512_LBSPPB1024_LBSPPM0_LPA16_LPB16_LPM0_LRVW8_LWPMn1_MIAV0_MIWT12_4_MO40_NTn1_NTA2_NTB3_NTC7_NTD4_NTM0_NEPBS0_NLCA1_NLCB1_ONLL1_PGR2_PLR1_PKA1_SIA3_SS1_SPO1_SRVW0_SSO0_SVW4_SK3_SKXCCM4_TLDS1_ULSGRO0_USL1_UIOFGRO0_USFGRO0_VSn1_VWA4_VWB4_WSGRA0_WSGRB0_WS64_WG16_16_1,0.0,788.44,1861.81
256,16384,128,2880,True,torch.bfloat16,torch.bfloat16,False,False,hipblaslt,388303,0,27.0496,Cijk_Alik_Bljk_BBS_BH_Bias_HA_S_SAV_UserArgs_MT128x64x128_MI16x16x1_SN_LDSB0_AFC1_AFEM1_AFEM1_ASEM1_CLR1_CADS0_DTLA0_DTLB0_DTVA0_DTVB0_EPS0_FDSI0_GRPM1_GRVWA8_GRVWB8_GSUAMB_GLS0_ISA950_IU1_K1_LBSPPA512_LBSPPB1024_LBSPPM0_LPA16_LPB16_LPM0_LRVW8_LWPMn1_MIAV0_MIWT2_4_MO40_NTn1_NTA0_NTB1_NTC1_NTD5_NTM0_NEPBS16_NLCA1_NLCB1_ONLL1_PGR2_PLR1_PKA1_SIA3_SS1_SPO1_SRVW0_SSO0_SVW2_SK0_SKXCCM0_TLDS1_ULSGRO0_USL1_UIOFGRO0_USFGROn1_VSn1_VWA2_VWB4_WSGRA0_WSGRB0_WS64_WG64_4_1,0.0,446.57,3671.16
256,1,25136,2880,False,torch.bfloat16,torch.bfloat16,False,False,hipblaslt,388274,0,27.8453,Cijk_Alik_Bljk_BBS_BH_Bias_HA_S_SAV_UserArgs_MT16x16x64_MI16x16x1_SN_LDSB0_AFC1_AFEM1_AFEM1_ASEM1_CLR1_CADS0_DTLA1_DTLB1_DTVA0_DTVB0_EPS0_FDSI0_GRPM1_GRVWA8_GRVWB8_GSUAMB_GLS0_ISA950_IU1_K1_LBSPPA1024_LBSPPB1024_LBSPPM0_LPA16_LPB16_LPM0_LRVW8_LWPMn1_MIAV0_MIWT1_1_MO40_NTn1_NTA3_NTB0_NTC0_NTD2_NTM0_NEPBS8_NLCA1_NLCB1_ONLL1_PGR2_PLR1_PKA1_SIA3_SS1_SPO1_SRVW0_SSO0_SVW1_SK0_SKXCCM0_TLDS2_ULSGRO0_USL1_UIOFGRO0_USFGROn1_VSn1_VWA1_VWB1_WSGRA0_WSGRB0_WS64_WG16_4_1,0.0,5.2,5201.57
256,256,640,2880,True,torch.bfloat16,torch.bfloat16,False,False,asm,2,4,9.4896,_ZN5aiter37bf16gemm_fp32bf16_tn_48x64_pf3_splitkE,0.0103,99.45,578.38
256,256,2880,512,True,torch.bfloat16,torch.bfloat16,False,False,hipblaslt,387931,0,6.3274,Cijk_Alik_Bljk_BBS_BH_Bias_HA_S_SAV_UserArgs_MT64x64x128_MI16x16x1_SN_LDSB0_AFC1_AFEM1_AFEM1_ASEM1_CLR0_CADS0_DTLA1_DTLB1_DTVA0_DTVB0_EPS0_FDSI0_GRPM1_GRVWA8_GRVWB8_GSU0_GSUAMB_GLS0_ISA950_IU1_K1_LBSPPA1024_LBSPPB1024_LBSPPM0_LPA16_LPB16_LPM0_LRVW8_LWPMn1_MIAV1_MIWT2_2_MO40_NTn1_NTA1_NTB0_NTC4_NTD7_NTM0_NEPBS10_NLCA1_NLCB1_ONLL1_PGR2_PLR1_PKA1_SIA3_SS1_SPO0_SRVW0_SSO0_SVW2_SK3_SKXCCM4_TLDS1_ULSGRO0_USL1_UIOFGRO0_USFGRO1_VSn1_VWA2_VWB2_WSGRA0_WSGRB0_WS64_WG32_8_1,0.0,119.32,740.56
256,128,640,2880,True,torch.bfloat16,torch.bfloat16,False,False,asm,4,9,7.0866,_ZN5aiter37bf16gemm_fp32bf16_tn_96x64_pf3_splitkE,0.0185,66.58,647.35
256,128,2880,512,True,torch.bfloat16,torch.bfloat16,False,False,hipblaslt,387659,0,5.6495,Cijk_Alik_Bljk_BBS_BH_Bias_HA_S_SAV_UserArgs_MT32x64x256_MI16x16x1_SN_LDSB0_AFC1_AFEM1_AFEM1_ASEM1_CLR1_CADS0_DTLA1_DTLB1_DTVA0_DTVB0_EPS0_FDSI0_GRPM1_GRVWA8_GRVWB8_GSU0_GSUAMB_GLS0_ISA950_IU1_K1_LBSPPA1024_LBSPPB1024_LBSPPM0_LPA16_LPB16_LPM0_LRVW8_LWPMn1_MIAV0_MIWT2_1_MO40_NTn1_NTA6_NTB3_NTC3_NTD7_NTM0_NEPBS10_NLCA1_NLCB1_ONLL1_PGR2_PLR1_PKA1_SIA3_SS1_SPO0_SRVW0_SSO0_SVW2_SK3_SKXCCM4_TLDS1_ULSGRO0_USL1_UIOFGRO0_USFGROn1_VSn1_VWA2_VWB1_WSGRA0_WSGRB0_WS64_WG16_16_1,0.0,66.82,675.72
256,64,640,2880,True,torch.bfloat16,torch.bfloat16,False,False,asm,1,11,5.7497,_ZN5aiter37bf16gemm_fp32bf16_tn_32x64_pf3_splitkE,0.0211,41.03,719.51
256,64,2880,512,True,torch.bfloat16,torch.bfloat16,False,False,triton,0,0,4.4895,auto,0.0,42.04,753.6
256,48,640,2880,True,torch.bfloat16,torch.bfloat16,False,False,asm,1,11,5.6345,_ZN5aiter37bf16gemm_fp32bf16_tn_32x64_pf3_splitkE,0.0203,31.4,714.23
256,48,2880,512,True,torch.bfloat16,torch.bfloat16,False,False,triton,0,0,4.496,auto,0.0,31.49,728.37
256,32,640,2880,True,torch.bfloat16,torch.bfloat16,False,False,asm,1,15,5.8601,_ZN5aiter37bf16gemm_fp32bf16_tn_32x64_pf3_splitkE,0.0237,20.13,667.51
256,32,2880,512,True,torch.bfloat16,torch.bfloat16,False,False,hipblaslt,387518,0,4.7127,Cijk_Alik_Bljk_BBS_BH_Bias_HA_S_SAV_UserArgs_MT32x16x256_MI16x16x1_SN_LDSB0_AFC1_AFEM1_AFEM1_ASEM1_CLR1_CADS0_DTLA1_DTLB1_DTVA0_DTVB0_EPS0_FDSI0_GRPM1_GRVWA8_GRVWB8_GSU0_GSUAMB_GLS0_ISA950_IU1_K1_LBSPPA1024_LBSPPB1024_LBSPPM0_LPA16_LPB16_LPM0_LRVW8_LWPMn1_MIAV1_MIWT1_1_MO40_NTn1_NTA1_NTB2_NTC1_NTD4_NTM0_NEPBS8_NLCA1_NLCB1_ONLL1_PGR2_PLR1_PKA1_SIA3_SS1_SPO1_SRVW0_SSO1_SVW1_SK3_SKXCCM8_TLDS1_ULSGRO0_USL1_UIOFGRO0_USFGRO1_VSn1_VWA1_VWB1_WSGRA0_WSGRB0_WS64_WG32_4_1,0.0,20.03,671.85
256,16,640,2880,True,torch.bfloat16,torch.bfloat16,False,False,asm,1,15,5.547,_ZN5aiter37bf16gemm_fp32bf16_tn_32x64_pf3_splitkE,0.0262,10.63,684.88
256,16,2880,512,True,torch.bfloat16,torch.bfloat16,False,False,triton,0,0,4.5912,auto,0.0,10.28,665.98
256,8,640,2880,True,torch.bfloat16,torch.bfloat16,False,False,asm,1,22,4.9343,_ZN5aiter37bf16gemm_fp32bf16_tn_32x64_pf3_splitkE,0.0285,5.98,758.51
256,8,2880,512,True,torch.bfloat16,torch.bfloat16,False,False,triton,0,0,4.3175,auto,0.0,5.46,695.63
256,4,640,2880,True,torch.bfloat16,torch.bfloat16,False,False,asm,3,15,5.2978,_ZN5aiter37bf16gemm_fp32bf16_tn_64x64_pf3_splitkE,0.0219,2.78,701.15
256,4,2880,512,True,torch.bfloat16,torch.bfloat16,False,False,triton,0,0,3.6767,auto,0.0,3.21,809.49
256,2,640,2880,True,torch.bfloat16,torch.bfloat16,False,False,asm,2,15,5.9091,_ZN5aiter37bf16gemm_fp32bf16_tn_48x64_pf3_splitkE,0.0227,1.25,626.23
256,2,2880,512,True,torch.bfloat16,torch.bfloat16,False,False,triton,0,0,4.0519,auto,0.0,1.46,731.18
256,1,640,2880,True,torch.bfloat16,torch.bfloat16,False,False,asm,2,22,5.8471,_ZN5aiter37bf16gemm_fp32bf16_tn_48x64_pf3_splitkE,0.0203,0.63,631.67
256,1,2880,512,True,torch.bfloat16,torch.bfloat16,False,False,triton,0,0,3.8378,auto,0.0,0.77,770.21
256,2,25136,2880,False,torch.bfloat16,torch.bfloat16,False,False,hipblaslt,387930,0,27.9338,Cijk_Alik_Bljk_BBS_BH_Bias_HA_S_SAV_UserArgs_MT64x16x128_MI16x16x1_SN_LDSB0_AFC1_AFEM1_AFEM1_ASEM1_CLR1_CADS0_DTLA0_DTLB0_DTVA0_DTVB0_EPS0_FDSI0_GRPM1_GRVWA8_GRVWB8_GSU0_GSUAMB_GLS0_ISA950_IU1_K1_LBSPPA256_LBSPPB256_LBSPPM0_LPA16_LPB16_LPM0_LRVW8_LWPMn1_MIAV0_MIWT1_1_MO40_NTn1_NTA0_NTB1_NTC2_NTD0_NTM0_NEPBS0_NLCA1_NLCB1_ONLL1_PGR2_PLR1_PKA1_SIA3_SS1_SPO1_SRVW0_SSO0_SVW1_SK3_SKXCCM0_TLDS1_ULSGRO0_USL1_UIOFGRO0_USFGRO1_VSn1_VWA1_VWB1_WSGRA0_WSGRB0_WS64_WG64_4_1,0.0,10.37,5187.1
256,3,640,2880,True,torch.bfloat16,torch.bfloat16,False,False,asm,2,21,5.3362,_ZN5aiter37bf16gemm_fp32bf16_tn_48x64_pf3_splitkE,0.0281,2.07,694.79
256,3,2880,512,True,torch.bfloat16,torch.bfloat16,False,False,triton,0,0,4.1305,auto,0.0,2.14,718.91
256,3,128,2880,True,torch.bfloat16,torch.bfloat16,False,False,asm,1,45,4.342,_ZN5aiter37bf16gemm_fp32bf16_tn_32x64_pf3_splitkE,0.0391,0.51,173.96
256,3,25136,2880,False,torch.bfloat16,torch.bfloat16,False,False,hipblaslt,388274,0,27.9169,Cijk_Alik_Bljk_BBS_BH_Bias_HA_S_SAV_UserArgs_MT16x16x64_MI16x16x1_SN_LDSB0_AFC1_AFEM1_AFEM1_ASEM1_CLR1_CADS0_DTLA1_DTLB1_DTVA0_DTVB0_EPS0_FDSI0_GRPM1_GRVWA8_GRVWB8_GSUAMB_GLS0_ISA950_IU1_K1_LBSPPA1024_LBSPPB1024_LBSPPM0_LPA16_LPB16_LPM0_LRVW8_LWPMn1_MIAV0_MIWT1_1_MO40_NTn1_NTA3_NTB0_NTC0_NTD2_NTM0_NEPBS8_NLCA1_NLCB1_ONLL1_PGR2_PLR1_PKA1_SIA3_SS1_SPO1_SRVW0_SSO0_SVW1_SK0_SKXCCM0_TLDS2_ULSGRO0_USL1_UIOFGRO0_USFGROn1_VSn1_VWA1_VWB1_WSGRA0_WSGRB0_WS64_WG16_4_1,0.0,15.56,5192.25
256,4,25136,2880,False,torch.bfloat16,torch.bfloat16,False,False,hipblaslt,388274,0,28.2285,Cijk_Alik_Bljk_BBS_BH_Bias_HA_S_SAV_UserArgs_MT16x16x64_MI16x16x1_SN_LDSB0_AFC1_AFEM1_AFEM1_ASEM1_CLR1_CADS0_DTLA1_DTLB1_DTVA0_DTVB0_EPS0_FDSI0_GRPM1_GRVWA8_GRVWB8_GSUAMB_GLS0_ISA950_IU1_K1_LBSPPA1024_LBSPPB1024_LBSPPM0_LPA16_LPB16_LPM0_LRVW8_LWPMn1_MIAV0_MIWT1_1_MO40_NTn1_NTA3_NTB0_NTC0_NTD2_NTM0_NEPBS8_NLCA1_NLCB1_ONLL1_PGR2_PLR1_PKA1_SIA3_SS1_SPO1_SRVW0_SSO0_SVW1_SK0_SKXCCM0_TLDS2_ULSGRO0_USL1_UIOFGRO0_USFGROn1_VSn1_VWA1_VWB1_WSGRA0_WSGRB0_WS64_WG16_4_1,0.0,20.52,5136.92
256,7,640,2880,True,torch.bfloat16,torch.bfloat16,False,False,asm,1,22,5.0742,_ZN5aiter37bf16gemm_fp32bf16_tn_32x64_pf3_splitkE,0.0328,5.09,736.21
256,7,2880,512,True,torch.bfloat16,torch.bfloat16,False,False,triton,0,0,3.8849,auto,0.0,5.31,771.35
256,7,128,2880,True,torch.bfloat16,torch.bfloat16,False,False,asm,1,44,4.3313,_ZN5aiter37bf16gemm_fp32bf16_tn_32x64_pf3_splitkE,0.0446,1.19,179.94
256,7,25136,2880,False,torch.bfloat16,torch.bfloat16,False,False,hipblaslt,388274,0,28.4116,Cijk_Alik_Bljk_BBS_BH_Bias_HA_S_SAV_UserArgs_MT16x16x64_MI16x16x1_SN_LDSB0_AFC1_AFEM1_AFEM1_ASEM1_CLR1_CADS0_DTLA1_DTLB1_DTVA0_DTVB0_EPS0_FDSI0_GRPM1_GRVWA8_GRVWB8_GSUAMB_GLS0_ISA950_IU1_K1_LBSPPA1024_LBSPPB1024_LBSPPM0_LPA16_LPB16_LPM0_LRVW8_LWPMn1_MIAV0_MIWT1_1_MO40_NTn1_NTA3_NTB0_NTC0_NTD2_NTM0_NEPBS8_NLCA1_NLCB1_ONLL1_PGR2_PLR1_PKA1_SIA3_SS1_SPO1_SRVW0_SSO0_SVW1_SK0_SKXCCM0_TLDS2_ULSGRO0_USL1_UIOFGRO0_USFGROn1_VSn1_VWA1_VWB1_WSGRA0_WSGRB0_WS64_WG16_4_1,0.0,35.67,5109.73
256,8,25136,2880,False,torch.bfloat16,torch.bfloat16,False,False,hipblaslt,388274,0,28.5506,Cijk_Alik_Bljk_BBS_BH_Bias_HA_S_SAV_UserArgs_MT16x16x64_MI16x16x1_SN_LDSB0_AFC1_AFEM1_AFEM1_ASEM1_CLR1_CADS0_DTLA1_DTLB1_DTVA0_DTVB0_EPS0_FDSI0_GRPM1_GRVWA8_GRVWB8_GSUAMB_GLS0_ISA950_IU1_K1_LBSPPA1024_LBSPPB1024_LBSPPM0_LPA16_LPB16_LPM0_LRVW8_LWPMn1_MIAV0_MIWT1_1_MO40_NTn1_NTA3_NTB0_NTC0_NTD2_NTM0_NEPBS8_NLCA1_NLCB1_ONLL1_PGR2_PLR1_PKA1_SIA3_SS1_SPO1_SRVW0_SSO0_SVW1_SK0_SKXCCM0_TLDS2_ULSGRO0_USL1_UIOFGRO0_USFGROn1_VSn1_VWA1_VWB1_WSGRA0_WSGRB0_WS64_WG16_4_1,0.0,40.57,5086.81
256,6,640,2880,True,torch.bfloat16,torch.bfloat16,False,False,asm,2,22,5.0493,_ZN5aiter37bf16gemm_fp32bf16_tn_48x64_pf3_splitkE,0.0315,4.38,738.45
256,6,2880,512,True,torch.bfloat16,torch.bfloat16,False,False,triton,0,0,3.8159,auto,0.0,4.64,783.52
256,6,128,2880,True,torch.bfloat16,torch.bfloat16,False,False,asm,1,42,4.5551,_ZN5aiter37bf16gemm_fp32bf16_tn_32x64_pf3_splitkE,0.0417,0.97,169.78
256,6,25136,2880,False,torch.bfloat16,torch.bfloat16,False,False,hipblaslt,387739,0,28.3591,Cijk_Alik_Bljk_BBS_BH_Bias_HA_S_SAV_UserArgs_MT64x64x64_MI16x16x1_SN_LDSB0_AFC1_AFEM1_AFEM1_ASEM1_CLR0_CADS0_DTLA1_DTLB1_DTVA0_DTVB0_EPS0_FDSI0_GRPM1_GRVWA2_GRVWB8_GSU0_GSUAMB_GLS0_ISA950_IU1_K1_LBSPPA512_LBSPPB1024_LBSPPM0_LPA16_LPB16_LPM0_LRVW8_LWPMn1_MIAV0_MIWT4_1_MO40_NTn1_NTA3_NTB0_NTC7_NTD5_NTM0_NEPBS8_NLCA1_NLCB1_ONLL1_PGR2_PLR1_PKA1_SIA3_SS1_SPO1_SRVW0_SSO1_SVW4_SK3_SKXCCM8_TLDS1_ULSGRO0_USL1_UIOFGRO0_USFGRO0_VSn1_VWA4_VWB1_WSGRA0_WSGRB0_WS64_WG16_16_1,0.0,30.63,5117.21
256,15,640,2880,True,torch.bfloat16,torch.bfloat16,False,False,asm,1,22,5.7374,_ZN5aiter37bf16gemm_fp32bf16_tn_32x64_pf3_splitkE,0.0331,9.64,660.93
256,15,2880,512,True,torch.bfloat16,torch.bfloat16,False,False,triton,0,0,4.538,auto,0.0,9.75,672.3
256,15,128,2880,True,torch.bfloat16,torch.bfloat16,False,False,asm,1,43,4.3989,_ZN5aiter37bf16gemm_fp32bf16_tn_32x64_pf3_splitkE,0.0438,2.51,188.12
256,15,25136,2880,False,torch.bfloat16,torch.bfloat16,False,False,hipblaslt,387739,0,28.8433,Cijk_Alik_Bljk_BBS_BH_Bias_HA_S_SAV_UserArgs_MT64x64x64_MI16x16x1_SN_LDSB0_AFC1_AFEM1_AFEM1_ASEM1_CLR0_CADS0_DTLA1_DTLB1_DTVA0_DTVB0_EPS0_FDSI0_GRPM1_GRVWA2_GRVWB8_GSU0_GSUAMB_GLS0_ISA950_IU1_K1_LBSPPA512_LBSPPB1024_LBSPPM0_LPA16_LPB16_LPM0_LRVW8_LWPMn1_MIAV0_MIWT4_1_MO40_NTn1_NTA3_NTB0_NTC7_NTD5_NTM0_NEPBS8_NLCA1_NLCB1_ONLL1_PGR2_PLR1_PKA1_SIA3_SS1_SPO1_SRVW0_SSO1_SVW4_SK3_SKXCCM8_TLDS1_ULSGRO0_USL1_UIOFGRO0_USFGRO0_VSn1_VWA4_VWB1_WSGRA0_WSGRB0_WS64_WG16_16_1,0.0,75.29,5048.79
256,16,25136,2880,False,torch.bfloat16,torch.bfloat16,False,False,hipblaslt,387691,0,28.7696,Cijk_Alik_Bljk_BBS_BH_Bias_HA_S_SAV_UserArgs_MT112x16x64_MI16x16x1_SN_LDSB0_AFC1_AFEM1_AFEM1_ASEM1_CLR1_CADS0_DTLA1_DTLB1_DTVA0_DTVB0_EPS0_FDSI0_GRPM1_GRVWA8_GRVWB8_GSU0_GSUAMB_GLS0_ISA950_IU1_K1_LBSPPA1024_LBSPPB1024_LBSPPM0_LPA16_LPB16_LPM0_LRVW8_LWPMn1_MIAV0_MIWT7_1_MO40_NTn1_NTA2_NTB3_NTC3_NTD4_NTM0_NEPBS12_NLCA1_NLCB1_ONLL1_PGR2_PLR1_PKA1_SIA3_SS0_SPO0_SRVW0_SSO1_SVW4_SK3_SKXCCM4_TLDS1_ULSGRO0_USL1_UIOFGRO0_USFGRO0_VSn1_VWA1_VWB1_WSGRA0_WSGRB0_WS64_WG16_4_1,0.0,80.52,5063.67
256,31,640,2880,True,torch.bfloat16,torch.bfloat16,False,False,asm,3,11,6.7424,_ZN5aiter37bf16gemm_fp32bf16_tn_64x64_pf3_splitkE,0.0212,16.95,579.12
256,31,2880,512,True,torch.bfloat16,torch.bfloat16,False,False,triton,0,0,5.1446,auto,0.0,17.77,614.12
256,31,128,2880,True,torch.bfloat16,torch.bfloat16,False,False,asm,2,45,4.5773,_ZN5aiter37bf16gemm_fp32bf16_tn_48x64_pf3_splitkE,0.0436,4.99,201.82
256,31,25136,2880,False,torch.bfloat16,torch.bfloat16,False,False,hipblaslt,387761,0,29.6222,Cijk_Alik_Bljk_BBS_BH_Bias_HA_S_SAV_UserArgs_MT112x32x64_MI16x16x1_SN_LDSB0_AFC1_AFEM1_AFEM1_ASEM1_CLR0_CADS0_DTLA1_DTLB1_DTVA0_DTVB0_EPS0_FDSI0_GRPM1_GRVWA8_GRVWB8_GSU0_GSUAMB_GLS0_ISA950_IU1_K1_LBSPPA1024_LBSPPB1024_LBSPPM0_LPA16_LPB16_LPM0_LRVW8_LWPMn1_MIAV1_MIWT7_1_MO40_NTn1_NTA1_NTB3_NTC3_NTD5_NTM0_NEPBS10_NLCA1_NLCB1_ONLL1_PGR2_PLR1_PKA1_SIA3_SS0_SPO0_SRVW0_SSO0_SVW4_SK3_SKXCCM0_TLDS2_ULSGRO0_USL1_UIOFGRO0_USFGROn1_VSn1_VWA1_VWB1_WSGRA0_WSGRB0_WS64_WG16_8_1,0.0,151.52,4946.3
256,32,25136,2880,False,torch.bfloat16,torch.bfloat16,False,False,hipblaslt,387831,0,29.7127,Cijk_Alik_Bljk_BBS_BH_Bias_HA_S_SAV_UserArgs_MT112x32x64_MI16x16x1_SN_LDSB0_AFC1_AFEM1_AFEM1_ASEM1_CLR1_CADS0_DTLA1_DTLB1_DTVA0_DTVB0_EPS0_FDSI0_GRPM1_GRVWA8_GRVWB8_GSU0_GSUAMB_GLS0_ISA950_IU1_K1_LBSPPA1024_LBSPPB1024_LBSPPM0_LPA16_LPB16_LPM0_LRVW8_LWPMn1_MIAV0_MIWT7_1_MO40_NTn1_NTA3_NTB3_NTC2_NTD5_NTM0_NEPBS16_NLCA1_NLCB1_ONLL1_PGR2_PLR1_PKA1_SIA3_SS0_SPO0_SRVW0_SSO1_SVW4_SK3_SKXCCM4_TLDS1_ULSGRO0_USL1_UIOFGRO0_USFGRO1_VSn1_VWA1_VWB1_WSGRA0_WSGRB0_WS64_WG16_8_1,0.0,155.93,4933.12
256,30,640,2880,True,torch.bfloat16,torch.bfloat16,False,False,asm,4,15,6.2457,_ZN5aiter37bf16gemm_fp32bf16_tn_96x64_pf3_splitkE,0.0255,17.71,624.05
256,30,2880,512,True,torch.bfloat16,torch.bfloat16,False,False,triton,0,0,5.1475,auto,0.0,17.19,612.46
256,30,128,2880,True,torch.bfloat16,torch.bfloat16,False,False,asm,2,39,4.5317,_ZN5aiter37bf16gemm_fp32bf16_tn_48x64_pf3_splitkE,0.0396,4.88,202.52
256,30,25136,2880,False,torch.bfloat16,torch.bfloat16,False,False,hipblaslt,387962,0,29.5801,Cijk_Alik_Bljk_BBS_BH_Bias_HA_S_SAV_UserArgs_MT112x32x64_MI16x16x1_SN_LDSB0_AFC1_AFEM1_AFEM1_ASEM1_CLR1_CADS0_DTLA1_DTLB1_DTVA0_DTVB0_EPS0_FDSI0_GRPM1_GRVWA8_GRVWB8_GSU0_GSUAMB_GLS0_ISA950_IU1_K1_LBSPPA1024_LBSPPB1024_LBSPPM0_LPA16_LPB16_LPM0_LRVW8_LWPMn1_MIAV0_MIWT7_1_MO40_NTn1_NTA1_NTB2_NTC0_NTD5_NTM0_NEPBS12_NLCA1_NLCB1_ONLL1_PGR2_PLR1_PKA1_SIA3_SS0_SPO0_SRVW0_SSO0_SVW4_SK3_SKXCCM0_TLDS1_ULSGRO0_USL1_UIOFGRO0_USFGROn1_VSn1_VWA1_VWB1_WSGRA0_WSGRB0_WS64_WG16_8_1,0.0,146.84,4951.45
256,63,640,2880,True,torch.bfloat16,torch.bfloat16,False,False,asm,1,11,5.8351,_ZN5aiter37bf16gemm_fp32bf16_tn_32x64_pf3_splitkE,0.0211,39.8,707.77
256,63,2880,512,True,torch.bfloat16,torch.bfloat16,False,False,triton,0,0,4.8099,auto,0.0,38.63,701.99
256,63,128,2880,True,torch.bfloat16,torch.bfloat16,False,False,asm,1,45,4.65,_ZN5aiter37bf16gemm_fp32bf16_tn_32x64_pf3_splitkE,0.047,9.99,240.06
256,63,25136,2880,False,torch.bfloat16,torch.bfloat16,False,False,hipblaslt,387923,0,30.2938,Cijk_Alik_Bljk_BBS_BH_Bias_HA_S_SAV_UserArgs_MT128x64x64_MI16x16x1_SN_LDSB0_AFC1_AFEM1_AFEM1_ASEM1_CLR0_CADS0_DTLA1_DTLB1_DTVA0_DTVB0_EPS0_FDSI0_GRPM1_GRVWA8_GRVWB2_GSU0_GSUAMB_GLS0_ISA950_IU1_K1_LBSPPA1024_LBSPPB256_LBSPPM0_LPA16_LPB16_LPM0_LRVW8_LWPMn1_MIAV1_MIWT4_2_MO40_NTn1_NTA2_NTB3_NTC7_NTD1_NTM0_NEPBS14_NLCA1_NLCB1_ONLL1_PGR2_PLR1_PKA1_SIA3_SS1_SPO0_SRVW0_SSO0_SVW4_SK3_SKXCCM4_TLDS1_ULSGRO0_USL1_UIOFGRO0_USFGROn1_VSn1_VWA4_VWB2_WSGRA0_WSGRB0_WS64_WG32_8_1,0.0,301.1,4895.83
256,64,25136,2880,False,torch.bfloat16,torch.bfloat16,False,False,hipblaslt,387922,0,30.3759,Cijk_Alik_Bljk_BBS_BH_Bias_HA_S_SAV_UserArgs_MT128x64x64_MI16x16x1_SN_LDSB0_AFC1_AFEM1_AFEM1_ASEM1_CLR0_CADS0_DTLA1_DTLB1_DTVA0_DTVB0_EPS0_FDSI0_GRPM1_GRVWA8_GRVWB2_GSU0_GSUAMB_GLS0_ISA950_IU1_K1_LBSPPA1024_LBSPPB256_LBSPPM0_LPA16_LPB16_LPM0_LRVW8_LWPMn1_MIAV1_MIWT4_2_MO40_NTn1_NTA1_NTB3_NTC4_NTD0_NTM0_NEPBS12_NLCA1_NLCB1_ONLL1_PGR2_PLR1_PKA1_SIA3_SS1_SPO0_SRVW0_SSO0_SVW4_SK3_SKXCCM4_TLDS1_ULSGRO0_USL1_UIOFGRO0_USFGROn1_VSn1_VWA4_VWB2_WSGRA0_WSGRB0_WS64_WG32_8_1,0.0,305.05,4884.44
256,60,640,2880,True,torch.bfloat16,torch.bfloat16,False,False,asm,2,11,5.8122,_ZN5aiter37bf16gemm_fp32bf16_tn_48x64_pf3_splitkE,0.021,38.06,706.93
256,60,2880,512,True,torch.bfloat16,torch.bfloat16,False,False,triton,0,0,4.7596,auto,0.0,37.18,705.13
256,60,128,2880,True,torch.bfloat16,torch.bfloat16,False,False,asm,1,42,4.4821,_ZN5aiter37bf16gemm_fp32bf16_tn_32x64_pf3_splitkE,0.0406,9.87,245.03
256,60,25136,2880,False,torch.bfloat16,torch.bfloat16,False,False,hipblaslt,387585,0,30.3811,Cijk_Alik_Bljk_BBS_BH_Bias_HA_S_SAV_UserArgs_MT128x64x64_MI16x16x1_SN_LDSB0_AFC1_AFEM1_AFEM1_ASEM1_CLR0_CADS0_DTLA1_DTLB1_DTVA0_DTVB0_EPS0_FDSI0_GRPM1_GRVWA8_GRVWB2_GSU0_GSUAMB_GLS0_ISA950_IU1_K1_LBSPPA1024_LBSPPB256_LBSPPM0_LPA16_LPB16_LPM0_LRVW8_LWPMn1_MIAV0_MIWT4_2_MO40_NTn1_NTA3_NTB0_NTC4_NTD1_NTM0_NEPBS16_NLCA1_NLCB1_ONLL1_PGR2_PLR1_PKA1_SIA3_SS1_SPO0_SRVW0_SSO0_SVW4_SK3_SKXCCM7_TLDS1_ULSGRO0_USL1_UIOFGRO0_USFGRO1_VSn1_VWA4_VWB2_WSGRA0_WSGRB0_WS64_WG32_8_1,0.0,285.93,4876.23
256,123,640,2880,True,torch.bfloat16,torch.bfloat16,False,False,asm,1,5,6.9924,_ZN5aiter37bf16gemm_fp32bf16_tn_32x64_pf3_splitkE,0.0122,64.85,651.04
256,123,2880,512,True,torch.bfloat16,torch.bfloat16,False,False,hipblaslt,387728,0,5.7444,Cijk_Alik_Bljk_BBS_BH_Bias_HA_S_SAV_UserArgs_MT32x64x256_MI16x16x1_SN_LDSB0_AFC1_AFEM1_AFEM1_ASEM1_CLR1_CADS0_DTLA1_DTLB1_DTVA0_DTVB0_EPS0_FDSI0_GRPM1_GRVWA8_GRVWB8_GSU0_GSUAMB_GLS0_ISA950_IU1_K1_LBSPPA1024_LBSPPB1024_LBSPPM0_LPA16_LPB16_LPM0_LRVW8_LWPMn1_MIAV0_MIWT2_1_MO40_NTn1_NTA6_NTB2_NTC2_NTD6_NTM0_NEPBS10_NLCA1_NLCB1_ONLL1_PGR2_PLR1_PKA1_SIA3_SS1_SPO1_SRVW0_SSO0_SVW2_SK3_SKXCCM4_TLDS2_ULSGRO0_USL1_UIOFGRO0_USFGRO1_VSn1_VWA2_VWB1_WSGRA0_WSGRB0_WS64_WG16_16_1,0.0,63.15,658.65
256,123,128,2880,True,torch.bfloat16,torch.bfloat16,False,False,asm,1,15,4.949,_ZN5aiter37bf16gemm_fp32bf16_tn_32x64_pf3_splitkE,0.0243,18.32,298.49
256,123,25136,2880,False,torch.bfloat16,torch.bfloat16,False,False,hipblaslt,387891,0,36.9999,Cijk_Alik_Bljk_BBS_BH_Bias_HA_S_SAV_UserArgs_MT128x128x64_MI16x16x1_SN_LDSB0_AFC1_AFEM1_AFEM1_ASEM1_CLR1_CADS0_DTLA1_DTLB1_DTVA0_DTVB0_EPS0_FDSI0_GRPM1_GRVWA8_GRVWB8_GSU0_GSUAMB_GLS0_ISA950_IU1_K1_LBSPPA1024_LBSPPB1024_LBSPPM0_LPA16_LPB16_LPM0_LRVW8_LWPMn1_MIAV0_MIWT8_2_MO40_NTn1_NTA2_NTB3_NTC6_NTD5_NTM0_NEPBS12_NLCA1_NLCB1_ONLL1_PGR2_PLR1_PKA1_SIA3_SS1_SPO0_SRVW0_SSO0_SVW8_SK3_SKXCCM0_TLDS1_ULSGRO0_USL1_UIOFGRO0_USFGRO0_VSn1_VWA8_VWB2_WSGRA0_WSGRB0_WS64_WG16_16_1,0.0,481.31,4099.34
256,128,25136,2880,False,torch.bfloat16,torch.bfloat16,False,False,hipblaslt,387891,0,37.301,Cijk_Alik_Bljk_BBS_BH_Bias_HA_S_SAV_UserArgs_MT128x128x64_MI16x16x1_SN_LDSB0_AFC1_AFEM1_AFEM1_ASEM1_CLR1_CADS0_DTLA1_DTLB1_DTVA0_DTVB0_EPS0_FDSI0_GRPM1_GRVWA8_GRVWB8_GSU0_GSUAMB_GLS0_ISA950_IU1_K1_LBSPPA1024_LBSPPB1024_LBSPPM0_LPA16_LPB16_LPM0_LRVW8_LWPMn1_MIAV0_MIWT8_2_MO40_NTn1_NTA2_NTB3_NTC6_NTD5_NTM0_NEPBS12_NLCA1_NLCB1_ONLL1_PGR2_PLR1_PKA1_SIA3_SS1_SPO0_SRVW0_SSO0_SVW8_SK3_SKXCCM0_TLDS1_ULSGRO0_USL1_UIOFGRO0_USFGRO0_VSn1_VWA8_VWB2_WSGRA0_WSGRB0_WS64_WG16_16_1,0.0,496.83,4073.76
256,127,25136,2880,False,torch.bfloat16,torch.bfloat16,False,False,hipblaslt,387614,0,37.3157,Cijk_Alik_Bljk_BBS_BH_Bias_HA_S_SAV_UserArgs_MT128x128x64_MI32x32x1_SN_LDSB0_AFC1_AFEM1_AFEM1_ASEM1_CLR1_CADS0_DTLA1_DTLB1_DTVA0_DTVB0_EPS0_FDSI0_GRPM1_GRVWA2_GRVWB8_GSU0_GSUAMB_GLS0_ISA950_IU1_K1_LBSPPA512_LBSPPB1024_LBSPPM0_LPA8_LPB8_LPM0_LRVW8_LWPMn1_MIAV0_MIWT4_1_MO40_NTn1_NTA7_NTB3_NTC0_NTD3_NTM0_NEPBS16_NLCA1_NLCB1_ONLL1_PGR2_PLR1_PKA1_SIA3_SS1_SPO1_SRVW0_SSO0_SVW4_SK3_SKXCCM5_TLDS2_ULSGRO0_USL1_UIOFGRO0_USFGRO0_VSn1_VWA4_VWB1_WSGRA0_WSGRB0_WS64_WG32_8_1,0.0,492.75,4070.66
256,46,640,2880,True,torch.bfloat16,torch.bfloat16,False,False,asm,2,15,6.112,_ZN5aiter37bf16gemm_fp32bf16_tn_48x64_pf3_splitkE,0.026,27.74,656.13
256,46,2880,512,True,torch.bfloat16,torch.bfloat16,False,False,triton,0,0,4.4908,auto,0.0,30.21,726.19
256,46,128,2880,True,torch.bfloat16,torch.bfloat16,False,False,asm,1,40,4.3962,_ZN5aiter37bf16gemm_fp32bf16_tn_32x64_pf3_splitkE,0.0391,7.71,230.66
256,46,25136,2880,False,torch.bfloat16,torch.bfloat16,False,False,hipblaslt,387858,0,29.3955,Cijk_Alik_Bljk_BBS_BH_Bias_HA_S_SAV_UserArgs_MT128x64x64_MI16x16x1_SN_LDSB0_AFC1_AFEM1_AFEM1_ASEM1_CLR1_CADS0_DTLA1_DTLB1_DTVA0_DTVB0_EPS0_FDSI0_GRPM1_GRVWA2_GRVWB2_GSU0_GSUAMB_GLS0_ISA950_IU1_K1_LBSPPA512_LBSPPB256_LBSPPM0_LPA16_LPB16_LPM0_LRVW8_LWPMn1_MIAV1_MIWT4_2_MO40_NTn1_NTA1_NTB3_NTC6_NTD1_NTM0_NEPBS12_NLCA1_NLCB1_ONLL1_PGR2_PLR1_PKA1_SIA3_SS1_SPO0_SRVW0_SSO0_SVW4_SK3_SKXCCM7_TLDS1_ULSGRO0_USL1_UIOFGRO0_USFGRO0_VSn1_VWA4_VWB2_WSGRA0_WSGRB0_WS64_WG32_8_1,0.0,226.57,5013.04
256,81,640,2880,True,torch.bfloat16,torch.bfloat16,False,False,asm,3,11,6.0197,_ZN5aiter37bf16gemm_fp32bf16_tn_64x64_pf3_splitkE,0.0215,49.6,707.12
256,81,2880,512,True,torch.bfloat16,torch.bfloat16,False,False,asm,3,1,5.6383,_ZN5aiter37bf16gemm_fp32bf16_tn_64x64_pf3_splitkE,0.0,42.37,620.51
256,81,128,2880,True,torch.bfloat16,torch.bfloat16,False,False,asm,2,45,5.0957,_ZN5aiter37bf16gemm_fp32bf16_tn_48x64_pf3_splitkE,0.0449,11.72,240.32
256,81,25136,2880,False,torch.bfloat16,torch.bfloat16,False,False,hipblaslt,387384,0,32.8017,Cijk_Alik_Bljk_BBS_BH_Bias_HA_S_SAV_UserArgs_MT128x96x128_MI16x16x1_SN_LDSB0_AFC0_AFEM1_AFEM1_ASEM1_CLR1_CADS0_DTLA0_DTLB0_DTVA0_DTVB0_EPS0_FDSI0_GRPM1_GRVWA8_GRVWB8_GSU0_GSUAMB_GLS0_ISA950_IU1_K1_LBSPPA1024_LBSPPB256_LBSPPM0_LPA16_LPB16_LPM0_LRVW8_LWPMn1_MIAV0_MIWT4_3_MO40_NTn1_NTA3_NTB3_NTC2_NTD0_NTM0_NEPBS14_NLCA1_NLCB1_ONLL1_PGR2_PLR1_PKA1_SIA3_SS1_SPO1_SRVW0_SSO1_SVW4_SK3_SKXCCM8_TLDS1_ULSGRO0_USL1_UIOFGRO0_USFGRO0_VSn1_VWA4_VWB1_WSGRA0_WSGRB0_WS64_WG32_8_1,0.0,357.53,4552.26
256,127,640,2880,True,torch.bfloat16,torch.bfloat16,False,False,asm,3,9,7.1515,_ZN5aiter37bf16gemm_fp32bf16_tn_64x64_pf3_splitkE,0.0184,65.46,640.49
256,127,2880,512,True,torch.bfloat16,torch.bfloat16,False,False,hipblaslt,387996,0,5.7445,Cijk_Alik_Bljk_BBS_BH_Bias_HA_S_SAV_UserArgs_MT32x64x256_MI16x16x1_SN_LDSB0_AFC1_AFEM1_AFEM1_ASEM1_CLR1_CADS0_DTLA1_DTLB1_DTVA0_DTVB0_EPS0_FDSI0_GRPM1_GRVWA8_GRVWB8_GSU0_GSUAMB_GLS0_ISA950_IU1_K1_LBSPPA1024_LBSPPB1024_LBSPPM0_LPA16_LPB16_LPM0_LRVW8_LWPMn1_MIAV1_MIWT2_1_MO40_NTn1_NTA4_NTB0_NTC2_NTD6_NTM0_NEPBS10_NLCA1_NLCB1_ONLL1_PGR2_PLR1_PKA1_SIA3_SS1_SPO0_SRVW0_SSO0_SVW2_SK3_SKXCCM4_TLDS1_ULSGRO0_USL1_UIOFGRO0_USFGROn1_VSn1_VWA2_VWB1_WSGRA0_WSGRB0_WS64_WG16_16_1,0.0,65.2,663.36
256,127,128,2880,True,torch.bfloat16,torch.bfloat16,False,False,asm,1,22,4.9665,_ZN5aiter37bf16gemm_fp32bf16_tn_32x64_pf3_splitkE,0.0326,18.85,302.29
256,255,640,2880,True,torch.bfloat16,torch.bfloat16,False,False,asm,4,7,8.9736,_ZN5aiter37bf16gemm_fp32bf16_tn_96x64_pf3_splitkE,0.016,104.76,610.86
256,255,2880,512,True,torch.bfloat16,torch.bfloat16,False,False,asm,3,1,6.1855,_ZN5aiter37bf16gemm_fp32bf16_tn_64x64_pf3_splitkE,0.0,121.58,756.45
256,255,128,2880,True,torch.bfloat16,torch.bfloat16,False,False,asm,1,15,5.2148,_ZN5aiter37bf16gemm_fp32bf16_tn_32x64_pf3_splitkE,0.0244,36.05,435.56
256,255,25136,2880,False,torch.bfloat16,torch.bfloat16,False,False,hipblaslt,388089,0,49.4503,Cijk_Alik_Bljk_BBS_BH_Bias_HA_S_SAV_UserArgs_MT256x128x64_MI32x32x1_SN_LDSB0_AFC1_AFEM1_AFEM1_ASEM1_CLR1_CADS0_DTLA0_DTLB0_DTVA0_DTVB0_EPS0_FDSI0_GRPM1_GRVWA8_GRVWB8_GSU0_GSUAMB_GLS0_ISA950_IU1_K1_LBSPPA512_LBSPPB256_LBSPPM0_LPA8_LPB8_LPM0_LRVW8_LWPMn1_MIAV0_MIWT4_2_MO40_NTn1_NTA3_NTB1_NTC5_NTD7_NTM0_NEPBS0_NLCA1_NLCB1_ONLL1_PGR2_PLR1_PKA1_SIA3_SS1_SPO1_SRVW0_SSO1_SVW4_SK3_SKXCCM4_TLDS1_ULSGRO0_USL1_UIOFGRO0_USFGRO0_VSn1_VWA4_VWB2_WSGRA0_WSGRB0_WS64_WG64_4_1,0.0,746.6,3216.8
256,256,25136,2880,False,torch.bfloat16,torch.bfloat16,False,False,hipblaslt,387480,0,46.8986,Cijk_Alik_Bljk_BBS_BH_Bias_HA_S_SAV_UserArgs_MT128x256x64_MI16x16x1_SN_LDSB0_AFC0_AFEM1_AFEM1_ASEM1_CLR0_CADS0_DTLA0_DTLB0_DTVA0_DTVB0_EPS0_FDSI0_GRPM1_GRVWA8_GRVWB8_GSU0_GSUAMB_GLS0_ISA950_IU1_K1_LBSPPA1024_LBSPPB512_LBSPPM0_LPA16_LPB16_LPM0_LRVW8_LWPMn1_MIAV0_MIWT8_4_MO40_NTn1_NTA3_NTB1_NTC7_NTD4_NTM0_NEPBS0_NLCA1_NLCB1_ONLL1_PGR2_PLR1_PKA1_SIA3_SS1_SPO0_SRVW0_SSO1_SVW8_SK3_SKXCCM0_TLDS2_ULSGRO0_USL1_UIOFGRO0_USFGROn1_VSn1_VWA8_VWB4_WSGRA0_WSGRB0_WS64_WG16_16_1,0.0,790.31,3393.01
256,28,640,2880,True,torch.bfloat16,torch.bfloat16,False,False,asm,2,22,5.7386,_ZN5aiter37bf16gemm_fp32bf16_tn_48x64_pf3_splitkE,0.0331,17.99,676.74
256,28,2880,512,True,torch.bfloat16,torch.bfloat16,False,False,hipblaslt,387795,0,4.957,Cijk_Alik_Bljk_BBS_BH_Bias_HA_S_SAV_UserArgs_MT16x32x512_MI16x16x1_SN_LDSB0_AFC1_AFEM1_AFEM1_ASEM1_CLR0_CADS0_DTLA1_DTLB1_DTVA0_DTVB0_EPS0_FDSI0_GRPM1_GRVWA8_GRVWB8_GSU0_GSUAMB_GLS0_ISA950_IU1_K1_LBSPPA1024_LBSPPB2048_LBSPPM0_LPA16_LPB16_LPM0_LRVW8_LWPMn1_MIAV0_MIWT1_2_MO40_NTn1_NTA4_NTB2_NTC3_NTD2_NTM0_NEPBS10_NLCA1_NLCB1_ONLL1_PGR2_PLR1_PKA1_SIA3_SS1_SPO0_SRVW0_SSO0_SVW1_SK3_SKXCCM4_TLDS1_ULSGRO0_USL1_UIOFGRO0_USFGRO1_VSn1_VWA1_VWB2_WSGRA0_WSGRB0_WS64_WG16_4_4,0.0,16.66,633.26
256,28,128,2880,True,torch.bfloat16,torch.bfloat16,False,False,asm,1,22,4.6293,_ZN5aiter37bf16gemm_fp32bf16_tn_32x64_pf3_splitkE,0.0304,4.46,195.65
256,28,25136,2880,False,torch.bfloat16,torch.bfloat16,False,False,hipblaslt,388488,0,29.4562,Cijk_Alik_Bljk_BBS_BH_Bias_HA_S_SAV_UserArgs_MT128x32x128_MI16x16x1_SN_LDSB1_AFC1_AFEM1_AFEM1_ASEM1_CLR0_CADS0_DTLA0_DTLB0_DTVA0_DTVB0_EPS0_FDSI0_GRPM1_GRVWA8_GRVWB8_GSU0_GSUAMB_GLS0_ISA950_IU1_K1_LBSPPA512_LBSPPB512_LBSPPM0_LPA16_LPB16_LPM0_LRVW8_LWPMn1_MIAV1_MIWT2_2_MO40_NTn1_NTA0_NTB0_NTC3_NTD3_NTM0_NEPBS16_NLCA1_NLCB1_ONLL1_PGR2_PLR1_PKA1_SIA3_SS1_SPO0_SRVW0_SSO0_SVW2_SK3_SKXCCM0_TLDS1_ULSGRO0_USL1_UIOFGRO0_USFGRO1_VSn1_VWA2_VWB2_WSGRA0_WSGRB0_WS64_WG64_4_1,0.0,137.63,4968.47
256,227,640,2880,True,torch.bfloat16,torch.bfloat16,False,False,asm,2,5,8.3805,_ZN5aiter37bf16gemm_fp32bf16_tn_48x64_pf3_splitkE,0.0127,99.85,630.57
256,227,2880,512,True,torch.bfloat16,torch.bfloat16,False,False,asm,2,1,5.6117,_ZN5aiter37bf16gemm_fp32bf16_tn_48x64_pf3_splitkE,0.0,119.3,799.95
256,227,128,2880,True,torch.bfloat16,torch.bfloat16,False,False,asm,3,15,5.7091,_ZN5aiter37bf16gemm_fp32bf16_tn_64x64_pf3_splitkE,0.0244,29.32,368.34
256,227,25136,2880,False,torch.bfloat16,torch.bfloat16,False,False,hipblaslt,388088,0,48.2838,Cijk_Alik_Bljk_BBS_BH_Bias_HA_S_SAV_UserArgs_MT256x128x64_MI16x16x1_SN_LDSB0_AFC1_AFEM1_AFEM1_ASEM1_CLR1_CADS0_DTLA1_DTLB1_DTVA0_DTVB0_EPS0_FDSI0_GRPM1_GRVWA8_GRVWB8_GSU0_GSUAMB_GLS0_ISA950_IU1_K1_LBSPPA1024_LBSPPB1024_LBSPPM0_LPA16_LPB16_LPM0_LRVW8_LWPMn1_MIAV0_MIWT8_4_MO40_NTn1_NTA1_NTB0_NTC2_NTD7_NTM0_NEPBS16_NLCA1_NLCB1_ONLL1_PGR2_PLR1_PKA1_SIA3_SS1_SPO1_SRVW0_SSO1_SVW8_SK3_SKXCCM4_TLDS2_ULSGRO0_USL1_UIOFGRO0_USFGROn1_VSn1_VWA8_VWB4_WSGRA0_WSGRB0_WS64_WG32_8_1,0.0,680.68,3262.02
256,19,640,2880,True,torch.bfloat16,torch.bfloat16,False,False,asm,2,22,5.8006,_ZN5aiter37bf16gemm_fp32bf16_tn_48x64_pf3_splitkE,0.031,12.07,658.58
256,19,2880,512,True,torch.bfloat16,torch.bfloat16,False,False,triton,0,0,5.0068,auto,0.0,11.19,614.77
256,19,128,2880,True,torch.bfloat16,torch.bfloat16,False,False,asm,1,39,4.3494,_ZN5aiter37bf16gemm_fp32bf16_tn_32x64_pf3_splitkE,0.0354,3.22,195.79
256,19,25136,2880,False,torch.bfloat16,torch.bfloat16,False,False,hipblaslt,387962,0,29.2267,Cijk_Alik_Bljk_BBS_BH_Bias_HA_S_SAV_UserArgs_MT112x32x64_MI16x16x1_SN_LDSB0_AFC1_AFEM1_AFEM1_ASEM1_CLR1_CADS0_DTLA1_DTLB1_DTVA0_DTVB0_EPS0_FDSI0_GRPM1_GRVWA8_GRVWB8_GSU0_GSUAMB_GLS0_ISA950_IU1_K1_LBSPPA1024_LBSPPB1024_LBSPPM0_LPA16_LPB16_LPM0_LRVW8_LWPMn1_MIAV0_MIWT7_1_MO40_NTn1_NTA1_NTB2_NTC0_NTD5_NTM0_NEPBS12_NLCA1_NLCB1_ONLL1_PGR2_PLR1_PKA1_SIA3_SS0_SPO0_SRVW0_SSO0_SVW4_SK3_SKXCCM0_TLDS1_ULSGRO0_USL1_UIOFGRO0_USFGROn1_VSn1_VWA1_VWB1_WSGRA0_WSGRB0_WS64_WG16_8_1,0.0,94.12,4990.23
256,20,25136,2880,False,torch.bfloat16,torch.bfloat16,False,False,hipblaslt,387692,0,29.4204,Cijk_Alik_Bljk_BBS_BH_Bias_HA_S_SAV_UserArgs_MT112x32x64_MI16x16x1_SN_LDSB0_AFC1_AFEM1_AFEM1_ASEM1_CLR1_CADS0_DTLA1_DTLB1_DTVA0_DTVB0_EPS0_FDSI0_GRPM1_GRVWA8_GRVWB8_GSU0_GSUAMB_GLS0_ISA950_IU1_K1_LBSPPA1024_LBSPPB1024_LBSPPM0_LPA16_LPB16_LPM0_LRVW8_LWPMn1_MIAV1_MIWT7_1_MO40_NTn1_NTA1_NTB3_NTC2_NTD5_NTM0_NEPBS10_NLCA1_NLCB1_ONLL1_PGR2_PLR1_PKA1_SIA3_SS0_SPO0_SRVW0_SSO0_SVW4_SK3_SKXCCM8_TLDS1_ULSGRO0_USL1_UIOFGRO0_USFGROn1_VSn1_VWA1_VWB1_WSGRA0_WSGRB0_WS64_WG16_8_1,0.0,98.42,4959.28
256,92,640,2880,True,torch.bfloat16,torch.bfloat16,False,False,asm,1,7,6.9268,_ZN5aiter37bf16gemm_fp32bf16_tn_32x64_pf3_splitkE,0.0151,48.96,625.7
256,92,2880,512,True,torch.bfloat16,torch.bfloat16,False,False,asm,3,1,5.6298,_ZN5aiter37bf16gemm_fp32bf16_tn_64x64_pf3_splitkE,0.0,48.19,634.7
256,92,128,2880,True,torch.bfloat16,torch.bfloat16,False,False,asm,2,43,5.2001,_ZN5aiter37bf16gemm_fp32bf16_tn_48x64_pf3_splitkE,0.0448,13.04,248.22
256,92,25136,2880,False,torch.bfloat16,torch.bfloat16,False,False,hipblaslt,387557,0,34.4099,Cijk_Alik_Bljk_BBS_BH_Bias_HA_S_SAV_UserArgs_MT128x96x64_MI16x16x1_SN_LDSB0_AFC1_AFEM1_AFEM1_ASEM1_CLR1_CADS0_DTLA1_DTLB1_DTVA0_DTVB0_EPS0_FDSI0_GRPM1_GRVWA8_GRVWB8_GSU0_GSUAMB_GLS0_ISA950_IU1_K1_LBSPPA1024_LBSPPB1024_LBSPPM0_LPA16_LPB16_LPM0_LRVW8_LWPMn1_MIAV1_MIWT4_3_MO40_NTn1_NTA2_NTB3_NTC1_NTD5_NTM0_NEPBS16_NLCA1_NLCB1_ONLL1_PGR2_PLR1_PKA1_SIA3_SS1_SPO0_SRVW0_SSO0_SVW4_SK3_SKXCCM0_TLDS1_ULSGRO0_USL1_UIOFGRO0_USFGROn1_VSn1_VWA4_VWB1_WSGRA0_WSGRB0_WS64_WG32_8_1,0.0,387.1,4357.42
256,137,640,2880,True,torch.bfloat16,torch.bfloat16,False,False,asm,1,5,6.9742,_ZN5aiter37bf16gemm_fp32bf16_tn_32x64_pf3_splitkE,0.0123,72.42,666.87
256,137,2880,512,True,torch.bfloat16,torch.bfloat16,False,False,hipblaslt,387592,0,5.7254,Cijk_Alik_Bljk_BBS_BH_Bias_HA_S_SAV_UserArgs_MT64x32x256_MI16x16x1_SN_LDSB0_AFC1_AFEM1_AFEM1_ASEM1_CLR1_CADS0_DTLA1_DTLB1_DTVA0_DTVB0_EPS0_FDSI0_GRPM1_GRVWA8_GRVWB8_GSU0_GSUAMB_GLS0_ISA950_IU1_K1_LBSPPA1024_LBSPPB1024_LBSPPM0_LPA16_LPB16_LPM0_LRVW8_LWPMn1_MIAV0_MIWT2_1_MO40_NTn1_NTA0_NTB3_NTC5_NTD4_NTM0_NEPBS12_NLCA1_NLCB1_ONLL1_PGR2_PLR1_PKA1_SIA3_SS1_SPO1_SRVW0_SSO0_SVW2_SK3_SKXCCM5_TLDS2_ULSGRO0_USL1_UIOFGRO0_USFGRO1_VSn1_VWA2_VWB1_WSGRA0_WSGRB0_WS64_WG32_8_1,0.0,70.57,677.42
256,137,128,2880,True,torch.bfloat16,torch.bfloat16,False,False,asm,2,22,5.3181,_ZN5aiter37bf16gemm_fp32bf16_tn_48x64_pf3_splitkE,0.0303,18.99,293.61
256,137,25136,2880,False,torch.bfloat16,torch.bfloat16,False,False,hipblaslt,387683,0,37.8962,Cijk_Alik_Bljk_BBS_BH_Bias_HA_S_SAV_UserArgs_MT128x160x64_MI16x16x1_SN_LDSB0_AFC1_AFEM1_AFEM1_ASEM1_CLR0_CADS0_DTLA1_DTLB1_DTVA0_DTVB0_EPS0_FDSI0_GRPM1_GRVWA8_GRVWB8_GSU0_GSUAMB_GLS0_ISA950_IU1_K1_LBSPPA1024_LBSPPB1024_LBSPPM0_LPA16_LPB16_LPM0_LRVW8_LWPMn1_MIAV0_MIWT4_5_MO40_NTn1_NTA4_NTB0_NTC1_NTD3_NTM0_NEPBS0_NLCA1_NLCB1_ONLL1_PGR2_PLR1_PKA1_SIA3_SS1_SPO0_SRVW0_SSO0_SVW4_SK3_SKXCCM5_TLDS1_ULSGRO0_USL1_UIOFGRO0_USFGROn1_VSn1_VWA4_VWB1_WSGRA0_WSGRB0_WS64_WG32_8_1,0.0,523.41,4023.09
256,236,25136,2880,False,torch.bfloat16,torch.bfloat16,False,False,hipblaslt,387480,0,45.4521,Cijk_Alik_Bljk_BBS_BH_Bias_HA_S_SAV_UserArgs_MT128x256x64_MI16x16x1_SN_LDSB0_AFC0_AFEM1_AFEM1_ASEM1_CLR0_CADS0_DTLA0_DTLB0_DTVA0_DTVB0_EPS0_FDSI0_GRPM1_GRVWA8_GRVWB8_GSU0_GSUAMB_GLS0_ISA950_IU1_K1_LBSPPA1024_LBSPPB512_LBSPPM0_LPA16_LPB16_LPM0_LRVW8_LWPMn1_MIAV0_MIWT8_4_MO40_NTn1_NTA3_NTB1_NTC7_NTD4_NTM0_NEPBS0_NLCA1_NLCB1_ONLL1_PGR2_PLR1_PKA1_SIA3_SS1_SPO0_SRVW0_SSO1_SVW8_SK3_SKXCCM0_TLDS2_ULSGRO0_USL1_UIOFGRO0_USFGROn1_VSn1_VWA8_VWB4_WSGRA0_WSGRB0_WS64_WG16_16_1,0.0,751.76,3476.34
256,254,640,2880,True,torch.bfloat16,torch.bfloat16,False,False,asm,3,4,8.6459,_ZN5aiter37bf16gemm_fp32bf16_tn_64x64_pf3_splitkE,0.0102,108.3,633.2
256,254,2880,512,True,torch.bfloat16,torch.bfloat16,False,False,asm,3,1,6.0479,_ZN5aiter37bf16gemm_fp32bf16_tn_64x64_pf3_splitkE,0.0,123.86,772.54
256,254,128,2880,True,torch.bfloat16,torch.bfloat16,False,False,asm,3,21,5.8145,_ZN5aiter37bf16gemm_fp32bf16_tn_64x64_pf3_splitkE,0.0312,32.21,389.6
256,254,25136,2880,False,torch.bfloat16,torch.bfloat16,False,False,hipblaslt,387480,0,46.7805,Cijk_Alik_Bljk_BBS_BH_Bias_HA_S_SAV_UserArgs_MT128x256x64_MI16x16x1_SN_LDSB0_AFC0_AFEM1_AFEM1_ASEM1_CLR0_CADS0_DTLA0_DTLB0_DTVA0_DTVB0_EPS0_FDSI0_GRPM1_GRVWA8_GRVWB8_GSU0_GSUAMB_GLS0_ISA950_IU1_K1_LBSPPA1024_LBSPPB512_LBSPPM0_LPA16_LPB16_LPM0_LRVW8_LWPMn1_MIAV0_MIWT8_4_MO40_NTn1_NTA3_NTB1_NTC7_NTD4_NTM0_NEPBS0_NLCA1_NLCB1_ONLL1_PGR2_PLR1_PKA1_SIA3_SS1_SPO0_SRVW0_SSO1_SVW8_SK3_SKXCCM0_TLDS2_ULSGRO0_USL1_UIOFGRO0_USFGROn1_VSn1_VWA8_VWB4_WSGRA0_WSGRB0_WS64_WG16_16_1,0.0,786.12,3399.18
256,505,640,2880,True,torch.bfloat16,torch.bfloat16,False,False,hipblaslt,387987,0,12.2391,Cijk_Alik_Bljk_BBS_BH_Bias_HA_S_SAV_UserArgs_MT64x64x64_MI16x16x1_SN_LDSB0_AFC1_AFEM1_AFEM1_ASEM1_CLR1_CADS0_DTLA1_DTLB1_DTVA0_DTVB0_EPS0_FDSI0_GRPM1_GRVWA2_GRVWB2_GSU0_GSUAMB_GLS0_ISA950_IU1_K1_LBSPPA512_LBSPPB256_LBSPPM0_LPA16_LPB16_LPM0_LRVW8_LWPMn1_MIAV1_MIWT4_1_MO40_NTn1_NTA3_NTB2_NTC7_NTD0_NTM0_NEPBS4_NLCA1_NLCB1_ONLL1_PGR2_PLR1_PKA1_SIA3_SS1_SPO0_SRVW0_SSO0_SVW4_SK3_SKXCCM4_TLDS1_ULSGRO0_USL1_UIOFGRO0_USFGRO0_VSn1_VWA4_VWB1_WSGRA0_WSGRB0_WS64_WG16_16_1,0.0,152.11,591.68
256,505,2880,512,True,torch.bfloat16,torch.bfloat16,False,False,hipblaslt,387668,0,7.3169,Cijk_Alik_Bljk_BBS_BH_Bias_HA_S_SAV_UserArgs_MT64x128x128_MI16x16x1_SN_LDSB0_AFC1_AFEM1_AFEM1_ASEM1_CLR0_CADS0_DTLA1_DTLB1_DTVA0_DTVB0_EPS0_FDSI0_GRPM1_GRVWA8_GRVWB8_GSU0_GSUAMB_GLS0_ISA950_IU1_K1_LBSPPA1024_LBSPPB1024_LBSPPM0_LPA16_LPB16_LPM0_LRVW8_LWPMn1_MIAV0_MIWT4_2_MO40_NTn1_NTA1_NTB0_NTC6_NTD5_NTM0_NEPBS12_NLCA1_NLCB1_ONLL1_PGR2_PLR1_PKA1_SIA3_SS1_SPO1_SRVW0_SSO0_SVW4_SK3_SKXCCM8_TLDS2_ULSGRO0_USL1_UIOFGRO0_USFGRO1_VSn1_VWA4_VWB2_WSGRA0_WSGRB0_WS64_WG16_16_1,0.0,203.54,871.28
256,505,128,2880,True,torch.bfloat16,torch.bfloat16,False,False,asm,2,11,5.8389,_ZN5aiter37bf16gemm_fp32bf16_tn_48x64_pf3_splitkE,0.0209,63.77,646.59
256,505,25136,2880,False,torch.bfloat16,torch.bfloat16,False,False,hipblaslt,388553,0,67.5216,Custom_Cijk_Alik_Bljk_BBS_BH_MT256x256x64_MI16x16x1_UserArgs_shortname1_gfx950,0.0,1082.85,2563.32
256,512,640,2880,True,torch.bfloat16,torch.bfloat16,False,False,hipblaslt,387987,0,12.5507,Cijk_Alik_Bljk_BBS_BH_Bias_HA_S_SAV_UserArgs_MT64x64x64_MI16x16x1_SN_LDSB0_AFC1_AFEM1_AFEM1_ASEM1_CLR1_CADS0_DTLA1_DTLB1_DTVA0_DTVB0_EPS0_FDSI0_GRPM1_GRVWA2_GRVWB2_GSU0_GSUAMB_GLS0_ISA950_IU1_K1_LBSPPA512_LBSPPB256_LBSPPM0_LPA16_LPB16_LPM0_LRVW8_LWPMn1_MIAV1_MIWT4_1_MO40_NTn1_NTA3_NTB2_NTC7_NTD0_NTM0_NEPBS4_NLCA1_NLCB1_ONLL1_PGR2_PLR1_PKA1_SIA3_SS1_SPO0_SRVW0_SSO0_SVW4_SK3_SKXCCM4_TLDS1_ULSGRO0_USL1_UIOFGRO0_USFGRO0_VSn1_VWA4_VWB1_WSGRA0_WSGRB0_WS64_WG16_16_1,0.0,150.38,580.91
256,512,2880,512,True,torch.bfloat16,torch.bfloat16,False,False,hipblaslt,387937,0,7.1211,Cijk_Alik_Bljk_BBS_BH_Bias_HA_S_SAV_UserArgs_MT64x128x128_MI16x16x1_SN_LDSB0_AFC1_AFEM1_AFEM1_ASEM1_CLR1_CADS0_DTLA1_DTLB1_DTVA0_DTVB0_EPS0_FDSI0_GRPM1_GRVWA8_GRVWB8_GSU0_GSUAMB_GLS0_ISA950_IU1_K1_LBSPPA1024_LBSPPB1024_LBSPPM0_LPA16_LPB16_LPM0_LRVW8_LWPMn1_MIAV1_MIWT4_2_MO40_NTn1_NTA1_NTB1_NTC7_NTD5_NTM0_NEPBS0_NLCA1_NLCB1_ONLL1_PGR2_PLR1_PKA1_SIA3_SS1_SPO0_SRVW0_SSO0_SVW4_SK3_SKXCCM0_TLDS1_ULSGRO0_USL1_UIOFGRO0_USFGRO1_VSn1_VWA4_VWB2_WSGRA0_WSGRB0_WS64_WG16_16_1,0.0,212.04,901.9
256,512,128,2880,True,torch.bfloat16,torch.bfloat16,False,False,asm,2,11,5.8071,_ZN5aiter37bf16gemm_fp32bf16_tn_48x64_pf3_splitkE,0.0206,65.0,657.38
256,512,25136,2880,False,torch.bfloat16,torch.bfloat16,False,False,hipblaslt,388552,0,66.5827,Custom_Cijk_Alik_Bljk_BBS_BH_MT256x256x64_MI16x16x1_UserArgs_shortname0_gfx950,0.0,1113.34,2605.36
256,110,640,2880,True,torch.bfloat16,torch.bfloat16,False,False,asm,3,8,8.4754,_ZN5aiter37bf16gemm_fp32bf16_tn_64x64_pf3_splitkE,0.0178,47.84,526.32
256,110,2880,512,True,torch.bfloat16,torch.bfloat16,False,False,hipblaslt,387998,0,5.7106,Cijk_Alik_Bljk_BBS_BH_Bias_HA_S_SAV_UserArgs_MT64x32x256_MI16x16x1_SN_LDSB0_AFC1_AFEM1_AFEM1_ASEM1_CLR1_CADS0_DTLA1_DTLB1_DTVA0_DTVB0_EPS0_FDSI0_GRPM1_GRVWA8_GRVWB8_GSU0_GSUAMB_GLS0_ISA950_IU1_K1_LBSPPA1024_LBSPPB1024_LBSPPM0_LPA16_LPB16_LPM0_LRVW8_LWPMn1_MIAV0_MIWT2_1_MO40_NTn1_NTA0_NTB1_NTC7_NTD5_NTM0_NEPBS16_NLCA1_NLCB1_ONLL1_PGR2_PLR1_PKA1_SIA3_SS1_SPO0_SRVW0_SSO0_SVW2_SK3_SKXCCM8_TLDS1_ULSGRO0_USL1_UIOFGRO0_USFGROn1_VSn1_VWA2_VWB1_WSGRA0_WSGRB0_WS64_WG32_8_1,0.0,56.81,647.11
256,110,128,2880,True,torch.bfloat16,torch.bfloat16,False,False,asm,4,44,5.746,_ZN5aiter37bf16gemm_fp32bf16_tn_96x64_pf3_splitkE,0.0458,14.11,243.48
256,110,25136,2880,False,torch.bfloat16,torch.bfloat16,False,False,hipblaslt,387888,0,36.2182,Cijk_Alik_Bljk_BBS_BH_Bias_HA_S_SAV_UserArgs_MT128x128x64_MI16x16x1_SN_LDSB0_AFC1_AFEM1_AFEM1_ASEM1_CLR1_CADS0_DTLA1_DTLB1_DTVA0_DTVB0_EPS0_FDSI0_GRPM1_GRVWA8_GRVWB8_GSU0_GSUAMB_GLS0_ISA950_IU1_K1_LBSPPA1024_LBSPPB1024_LBSPPM0_LPA16_LPB16_LPM0_LRVW8_LWPMn1_MIAV1_MIWT4_4_MO40_NTn1_NTA6_NTB3_NTC2_NTD2_NTM0_NEPBS16_NLCA1_NLCB1_ONLL1_PGR2_PLR1_PKA1_SIA3_SS1_SPO0_SRVW0_SSO0_SVW4_SK3_SKXCCM5_TLDS1_ULSGRO0_USL1_UIOFGRO0_USFGRO1_VSn1_VWA4_VWB4_WSGRA0_WSGRB0_WS64_WG32_8_1,0.0,439.73,4167.71
256,202,640,2880,True,torch.bfloat16,torch.bfloat16,False,False,asm,4,7,8.372,_ZN5aiter37bf16gemm_fp32bf16_tn_96x64_pf3_splitkE,0.016,88.95,610.19
256,202,2880,512,True,torch.bfloat16,torch.bfloat16,False,False,asm,2,1,5.7161,_ZN5aiter37bf16gemm_fp32bf16_tn_48x64_pf3_splitkE,0.0,104.22,755.67
256,202,128,2880,True,torch.bfloat16,torch.bfloat16,False,False,asm,1,15,5.3269,_ZN5aiter37bf16gemm_fp32bf16_tn_32x64_pf3_splitkE,0.0246,27.96,366.54
256,202,25136,2880,False,torch.bfloat16,torch.bfloat16,False,False,hipblaslt,387475,0,42.3193,Cijk_Alik_Bljk_BBS_BH_Bias_HA_S_SAV_UserArgs_MT128x224x64_MI16x16x1_SN_LDSB1_AFC0_AFEM1_AFEM1_ASEM1_CLR0_CADS0_DTLA0_DTLB0_DTVA0_DTVB0_EPS0_FDSI0_GRPM1_GRVWA8_GRVWB8_GSU0_GSUAMB_GLS0_ISA950_IU1_K1_LBSPPA512_LBSPPB128_LBSPPM0_LPA16_LPB16_LPM0_LRVW8_LWPMn1_MIAV0_MIWT4_7_MO40_NTn1_NTA2_NTB2_NTC7_NTD4_NTM0_NEPBS0_NLCA1_NLCB1_ONLL1_PGR2_PLR1_PKA1_SIA3_SS1_SPO0_SRVW0_SSO1_SVW4_SK3_SKXCCM8_TLDS2_ULSGRO0_USL1_UIOFGRO0_USFGRO1_VSn1_VWA4_VWB1_WSGRA0_WSGRB0_WS64_WG32_8_1,0.0,691.09,3688.67
256,346,640,2880,True,torch.bfloat16,torch.bfloat16,False,False,hipblaslt,387326,0,10.0559,Cijk_Alik_Bljk_BBS_BH_Bias_HA_S_SAV_UserArgs_MT32x32x256_MI16x16x1_SN_LDSB1_AFC0_AFEM1_AFEM1_ASEM1_CLR1_CADS0_DTLA0_DTLB0_DTVA0_DTVB0_EPS0_FDSI0_GRPM1_GRVWA8_GRVWB8_GSU0_GSUAMB_GLS0_ISA950_IU1_K1_LBSPPA512_LBSPPB512_LBSPPM0_LPA16_LPB16_LPM0_LRVW8_LWPMn1_MIAV0_MIWT1_1_MO40_NTn1_NTA0_NTB1_NTC0_NTD0_NTM0_NEPBS4_NLCA1_NLCB1_ONLL1_PGR2_PLR1_PKA1_SIA3_SS1_SPO1_SRVW0_SSO0_SVW1_SK3_SKXCCM4_TLDS2_ULSGRO0_USL1_UIOFGRO0_USFGRO1_VSn1_VWA1_VWB1_WSGRA0_WSGRB0_WS64_WG32_8_1,0.0,126.84,608.82
256,346,2880,512,True,torch.bfloat16,torch.bfloat16,False,False,hipblaslt,387934,0,7.0874,Cijk_Alik_Bljk_BBS_BH_Bias_HA_S_SAV_UserArgs_MT64x32x128_MI16x16x1_SN_LDSB0_AFC1_AFEM1_AFEM1_ASEM1_CLR1_CADS0_DTLA0_DTLB0_DTVA0_DTVB0_EPS0_FDSI0_GRPM1_GRVWA8_GRVWB8_GSU0_GSUAMB_GLS0_ISA950_IU1_K1_LBSPPA512_LBSPPB256_LBSPPM0_LPA16_LPB16_LPM0_LRVW8_LWPMn1_MIAV0_MIWT2_1_MO40_NTn1_NTA3_NTB1_NTC6_NTD5_NTM0_NEPBS12_NLCA1_NLCB1_ONLL1_PGR2_PLR1_PKA1_SIA3_SS1_SPO1_SRVW0_SSO1_SVW2_SK3_SKXCCM4_TLDS1_ULSGRO0_USL1_UIOFGRO0_USFGROn1_VSn1_VWA2_VWB1_WSGRA0_WSGRB0_WS64_WG32_8_1,0.0,143.97,747.3
256,346,128,2880,True,torch.bfloat16,torch.bfloat16,False,False,asm,2,15,6.3172,_ZN5aiter37bf16gemm_fp32bf16_tn_48x64_pf3_splitkE,0.0241,40.38,446.21
256,346,25136,2880,False,torch.bfloat16,torch.bfloat16,False,False,hipblaslt,387396,0,56.0163,Cijk_Alik_Bljk_BBS_BH_Bias_HA_S_SAV_UserArgs_MT256x192x64_MI32x32x1_SN_LDSB0_AFC0_AFEM1_AFEM1_ASEM1_CLR0_CADS0_DTLA0_DTLB0_DTVA0_DTVB0_EPS0_FDSI0_GRPM1_GRVWA8_GRVWB8_GSU0_GSUAMB_GLS0_ISA950_IU1_K1_LBSPPA512_LBSPPB128_LBSPPM0_LPA8_LPB8_LPM0_LRVW8_LWPMn1_MIAV0_MIWT4_3_MO40_NTn1_NTA0_NTB0_NTC6_NTD3_NTM0_NEPBS16_NLCA1_NLCB1_ONLL1_PGR2_PLR1_PKA1_SIA3_SS1_SPO0_SRVW0_SSO0_SVW4_SK3_SKXCCM8_TLDS2_ULSGRO0_USL1_UIOFGRO0_USFGROn1_VSn1_VWA4_VWB1_WSGRA0_WSGRB0_WS64_WG64_4_1,0.0,894.29,2930.76
256,166,640,2880,True,torch.bfloat16,torch.bfloat16,False,False,asm,3,7,7.5335,_ZN5aiter37bf16gemm_fp32bf16_tn_64x64_pf3_splitkE,0.0162,81.23,644.46
256,166,2880,512,True,torch.bfloat16,torch.bfloat16,False,False,asm,3,1,6.2176,_ZN5aiter37bf16gemm_fp32bf16_tn_64x64_pf3_splitkE,0.0,78.74,655.44
256,166,128,2880,True,torch.bfloat16,torch.bfloat16,False,False,asm,2,21,5.5206,_ZN5aiter37bf16gemm_fp32bf16_tn_48x64_pf3_splitkE,0.0316,22.17,314.45
256,166,25136,2880,False,torch.bfloat16,torch.bfloat16,False,False,hipblaslt,388262,0,39.1424,Cijk_Alik_Bljk_BBS_BH_Bias_HA_S_SAV_UserArgs_MT128x192x64_MI16x16x1_SN_LDSB0_AFC1_AFEM1_AFEM1_ASEM1_CLR1_CADS0_DTLA1_DTLB1_DTVA0_DTVB0_EPS0_FDSI0_GRPM1_GRVWA2_GRVWB8_GSU0_GSUAMB_GLS0_ISA950_IU1_K1_LBSPPA1024_LBSPPB1024_LBSPPM0_LPA16_LPB16_LPM0_LRVW8_LWPMn1_MIAV0_MIWT8_3_MO40_NTn1_NTA2_NTB1_NTC5_NTD5_NTM0_NEPBS14_NLCA1_NLCB1_ONLL1_PGR2_PLR1_PKA1_SIA3_SS1_SPO0_SRVW0_SSO1_SVW8_SK3_SKXCCM0_TLDS1_ULSGRO0_USL1_UIOFGRO0_USFGRO0_VSn1_VWA8_VWB1_WSGRA0_WSGRB0_WS64_WG16_16_1,0.0,614.02,3936.52
256,38,640,2880,True,torch.bfloat16,torch.bfloat16,False,False,asm,1,11,5.9937,_ZN5aiter37bf16gemm_fp32bf16_tn_32x64_pf3_splitkE,0.0221,23.37,659.68
256,38,2880,512,True,torch.bfloat16,torch.bfloat16,False,False,triton,0,0,4.4304,auto,0.0,25.29,723.84
256,38,128,2880,True,torch.bfloat16,torch.bfloat16,False,False,asm,1,44,4.5967,_ZN5aiter37bf16gemm_fp32bf16_tn_32x64_pf3_splitkE,0.0436,6.09,210.13
256,38,25136,2880,False,torch.bfloat16,torch.bfloat16,False,False,hipblaslt,387899,0,30.6868,Cijk_Alik_Bljk_BBS_BH_Bias_HA_S_SAV_UserArgs_MT128x48x64_MI16x16x1_SN_LDSB0_AFC1_AFEM1_AFEM1_ASEM1_CLR0_CADS0_DTLA1_DTLB1_DTVA0_DTVB0_EPS0_FDSI0_GRPM1_GRVWA2_GRVWB2_GSU0_GSUAMB_GLS0_ISA950_IU1_K1_LBSPPA256_LBSPPB256_LBSPPM0_LPA16_LPB16_LPM0_LRVW8_LWPMn1_MIAV0_MIWT2_3_MO40_NTn1_NTA2_NTB3_NTC6_NTD5_NTM0_NEPBS0_NLCA1_NLCB1_ONLL1_PGR2_PLR1_PKA1_SIA3_SS1_SPO0_SRVW0_SSO0_SVW2_SK3_SKXCCM4_TLDS1_ULSGRO0_USL1_UIOFGRO0_USFGRO0_VSn1_VWA2_VWB1_WSGRA0_WSGRB0_WS64_WG64_4_1,0.0,179.29,4787.48
256,41,25136,2880,False,torch.bfloat16,torch.bfloat16,False,False,hipblaslt,387899,0,28.6953,Cijk_Alik_Bljk_BBS_BH_Bias_HA_S_SAV_UserArgs_MT128x48x64_MI16x16x1_SN_LDSB0_AFC1_AFEM1_AFEM1_ASEM1_CLR0_CADS0_DTLA1_DTLB1_DTVA0_DTVB0_EPS0_FDSI0_GRPM1_GRVWA2_GRVWB2_GSU0_GSUAMB_GLS0_ISA950_IU1_K1_LBSPPA256_LBSPPB256_LBSPPM0_LPA16_LPB16_LPM0_LRVW8_LWPMn1_MIAV0_MIWT2_3_MO40_NTn1_NTA2_NTB3_NTC6_NTD5_NTM0_NEPBS0_NLCA1_NLCB1_ONLL1_PGR2_PLR1_PKA1_SIA3_SS1_SPO0_SRVW0_SSO0_SVW2_SK3_SKXCCM4_TLDS1_ULSGRO0_USL1_UIOFGRO0_USFGRO0_VSn1_VWA2_VWB1_WSGRA0_WSGRB0_WS64_WG64_4_1,0.0,206.87,5125.6
256,468,640,2880,True,torch.bfloat16,torch.bfloat16,False,False,hipblaslt,387987,0,12.2746,Cijk_Alik_Bljk_BBS_BH_Bias_HA_S_SAV_UserArgs_MT64x64x64_MI16x16x1_SN_LDSB0_AFC1_AFEM1_AFEM1_ASEM1_CLR1_CADS0_DTLA1_DTLB1_DTVA0_DTVB0_EPS0_FDSI0_GRPM1_GRVWA2_GRVWB2_GSU0_GSUAMB_GLS0_ISA950_IU1_K1_LBSPPA512_LBSPPB256_LBSPPM0_LPA16_LPB16_LPM0_LRVW8_LWPMn1_MIAV1_MIWT4_1_MO40_NTn1_NTA3_NTB2_NTC7_NTD0_NTM0_NEPBS4_NLCA1_NLCB1_ONLL1_PGR2_PLR1_PKA1_SIA3_SS1_SPO0_SRVW0_SSO0_SVW4_SK3_SKXCCM4_TLDS1_ULSGRO0_USL1_UIOFGRO0_USFGRO0_VSn1_VWA4_VWB1_WSGRA0_WSGRB0_WS64_WG16_16_1,0.0,140.55,568.75
256,468,2880,512,True,torch.bfloat16,torch.bfloat16,False,False,hipblaslt,387937,0,7.5274,Cijk_Alik_Bljk_BBS_BH_Bias_HA_S_SAV_UserArgs_MT64x128x128_MI16x16x1_SN_LDSB0_AFC1_AFEM1_AFEM1_ASEM1_CLR1_CADS0_DTLA1_DTLB1_DTVA0_DTVB0_EPS0_FDSI0_GRPM1_GRVWA8_GRVWB8_GSU0_GSUAMB_GLS0_ISA950_IU1_K1_LBSPPA1024_LBSPPB1024_LBSPPM0_LPA16_LPB16_LPM0_LRVW8_LWPMn1_MIAV1_MIWT4_2_MO40_NTn1_NTA1_NTB1_NTC7_NTD5_NTM0_NEPBS0_NLCA1_NLCB1_ONLL1_PGR2_PLR1_PKA1_SIA3_SS1_SPO0_SRVW0_SSO0_SVW4_SK3_SKXCCM0_TLDS1_ULSGRO0_USL1_UIOFGRO0_USFGRO1_VSn1_VWA4_VWB2_WSGRA0_WSGRB0_WS64_WG16_16_1,0.0,183.36,813.57
256,468,128,2880,True,torch.bfloat16,torch.bfloat16,False,False,asm,2,9,6.0587,_ZN5aiter37bf16gemm_fp32bf16_tn_48x64_pf3_splitkE,0.0178,56.95,586.39
256,468,25136,2880,False,torch.bfloat16,torch.bfloat16,False,False,hipblaslt,388552,0,66.5412,Custom_Cijk_Alik_Bljk_BBS_BH_MT256x256x64_MI16x16x1_UserArgs_shortname0_gfx950,0.0,1018.3,2569.93
256,471,640,2880,True,torch.bfloat16,torch.bfloat16,False,False,hipblaslt,387660,0,12.3673,Cijk_Alik_Bljk_BBS_BH_Bias_HA_S_SAV_UserArgs_MT64x32x256_MI16x16x1_SN_LDSB0_AFC1_AFEM1_AFEM1_ASEM1_CLR1_CADS0_DTLA0_DTLB0_DTVA0_DTVB0_EPS0_FDSI0_GRPM1_GRVWA8_GRVWB8_GSU0_GSUAMB_GLS0_ISA950_IU1_K1_LBSPPA1024_LBSPPB512_LBSPPM0_LPA16_LPB16_LPM0_LRVW8_LWPMn1_MIAV0_MIWT2_1_MO40_NTn1_NTA3_NTB1_NTC2_NTD7_NTM0_NEPBS0_NLCA1_NLCB1_ONLL1_PGR2_PLR1_PKA1_SIA3_SS1_SPO1_SRVW0_SSO0_SVW2_SK3_SKXCCM0_TLDS1_ULSGRO0_USL1_UIOFGRO0_USFGRO0_VSn1_VWA2_VWB1_WSGRA0_WSGRB0_WS64_WG32_8_1,0.0,140.39,566.19
256,471,2880,512,True,torch.bfloat16,torch.bfloat16,False,False,asm,4,1,7.1283,_ZN5aiter37bf16gemm_fp32bf16_tn_96x64_pf3_splitkE,0.0,194.86,861.97
256,471,128,2880,True,torch.bfloat16,torch.bfloat16,False,False,asm,2,11,6.0833,_ZN5aiter37bf16gemm_fp32bf16_tn_48x64_pf3_splitkE,0.0206,57.08,586.99
256,471,25136,2880,False,torch.bfloat16,torch.bfloat16,False,False,hipblaslt,388553,0,66.2403,Custom_Cijk_Alik_Bljk_BBS_BH_MT256x256x64_MI16x16x1_UserArgs_shortname1_gfx950,0.0,1029.48,2584.14
256,40,640,2880,True,torch.bfloat16,torch.bfloat16,False,False,asm,1,11,5.7998,_ZN5aiter37bf16gemm_fp32bf16_tn_32x64_pf3_splitkE,0.0197,25.42,684.16
256,40,2880,512,True,torch.bfloat16,torch.bfloat16,False,False,triton,0,0,4.4181,auto,0.0,26.7,728.93
256,40,128,2880,True,torch.bfloat16,torch.bfloat16,False,False,asm,1,43,4.3494,_ZN5aiter37bf16gemm_fp32bf16_tn_32x64_pf3_splitkE,0.0412,6.78,224.84
256,40,25136,2880,False,torch.bfloat16,torch.bfloat16,False,False,hipblaslt,388303,0,30.6451,Cijk_Alik_Bljk_BBS_BH_Bias_HA_S_SAV_UserArgs_MT128x64x128_MI16x16x1_SN_LDSB0_AFC1_AFEM1_AFEM1_ASEM1_CLR1_CADS0_DTLA0_DTLB0_DTVA0_DTVB0_EPS0_FDSI0_GRPM1_GRVWA8_GRVWB8_GSUAMB_GLS0_ISA950_IU1_K1_LBSPPA512_LBSPPB1024_LBSPPM0_LPA16_LPB16_LPM0_LRVW8_LWPMn1_MIAV0_MIWT2_4_MO40_NTn1_NTA0_NTB1_NTC1_NTD5_NTM0_NEPBS16_NLCA1_NLCB1_ONLL1_PGR2_PLR1_PKA1_SIA3_SS1_SPO1_SRVW0_SSO0_SVW2_SK0_SKXCCM0_TLDS1_ULSGRO0_USL1_UIOFGRO0_USFGROn1_VSn1_VWA2_VWB4_WSGRA0_WSGRB0_WS64_WG64_4_1,0.0,188.98,4797.66
256,134,640,2880,True,torch.bfloat16,torch.bfloat16,False,False,asm,1,5,6.7208,_ZN5aiter37bf16gemm_fp32bf16_tn_32x64_pf3_splitkE,0.0127,73.5,688.87
256,134,2880,512,True,torch.bfloat16,torch.bfloat16,False,False,asm,1,1,5.8998,_ZN5aiter37bf16gemm_fp32bf16_tn_32x64_pf3_splitkE,0.0,66.98,653.95
256,134,128,2880,True,torch.bfloat16,torch.bfloat16,False,False,asm,1,11,5.139,_ZN5aiter37bf16gemm_fp32bf16_tn_32x64_pf3_splitkE,0.0191,19.22,300.34
256,134,25136,2880,False,torch.bfloat16,torch.bfloat16,False,False,hipblaslt,388025,0,38.1587,Cijk_Alik_Bljk_BBS_BH_Bias_HA_S_SAV_UserArgs_MT128x160x64_MI16x16x1_SN_LDSB0_AFC1_AFEM1_AFEM1_ASEM1_CLR1_CADS0_DTLA1_DTLB1_DTVA0_DTVB0_EPS0_FDSI0_GRPM1_GRVWA8_GRVWB8_GSUAMB_GLS0_ISA950_IU1_K1_LBSPPA1024_LBSPPB1024_LBSPPM0_LPA16_LPB16_LPM0_LRVW8_LWPMn1_MIAV0_MIWT4_5_MO40_NTn1_NTA7_NTB0_NTC1_NTD5_NTM0_NEPBS0_NLCA1_NLCB1_ONLL1_PGR2_PLR1_PKA1_SIA3_SS1_SPO0_SRVW0_SSO0_SVW4_SK0_SKXCCM0_TLDS2_ULSGRO0_USL1_UIOFGRO0_USFGRO0_VSn1_VWA4_VWB1_WSGRA0_WSGRB0_WS64_WG32_8_1,0.0,508.43,3991.01
256,286,640,2880,True,torch.bfloat16,torch.bfloat16,False,False,hipblaslt,387326,0,9.7968,Cijk_Alik_Bljk_BBS_BH_Bias_HA_S_SAV_UserArgs_MT32x32x256_MI16x16x1_SN_LDSB1_AFC0_AFEM1_AFEM1_ASEM1_CLR1_CADS0_DTLA0_DTLB0_DTVA0_DTVB0_EPS0_FDSI0_GRPM1_GRVWA8_GRVWB8_GSU0_GSUAMB_GLS0_ISA950_IU1_K1_LBSPPA512_LBSPPB512_LBSPPM0_LPA16_LPB16_LPM0_LRVW8_LWPMn1_MIAV0_MIWT1_1_MO40_NTn1_NTA0_NTB1_NTC0_NTD0_NTM0_NEPBS4_NLCA1_NLCB1_ONLL1_PGR2_PLR1_PKA1_SIA3_SS1_SPO1_SRVW0_SSO0_SVW1_SK3_SKXCCM4_TLDS2_ULSGRO0_USL1_UIOFGRO0_USFGRO1_VSn1_VWA1_VWB1_WSGRA0_WSGRB0_WS64_WG32_8_1,0.0,107.62,581.81
256,286,2880,512,True,torch.bfloat16,torch.bfloat16,False,False,asm,3,1,6.561,_ZN5aiter37bf16gemm_fp32bf16_tn_64x64_pf3_splitkE,0.0,128.55,745.21
256,286,128,2880,True,torch.bfloat16,torch.bfloat16,False,False,asm,1,9,5.5727,_ZN5aiter37bf16gemm_fp32bf16_tn_32x64_pf3_splitkE,0.0174,37.84,441.05
256,286,25136,2880,False,torch.bfloat16,torch.bfloat16,False,False,hipblaslt,388306,0,52.0345,Cijk_Alik_Bljk_BBS_BH_Bias_HA_S_SAV_UserArgs_MT256x160x64_MI16x16x1_SN_LDSB0_AFC1_AFEM1_AFEM1_ASEM1_CLR0_CADS0_DTLA1_DTLB1_DTVA0_DTVB0_EPS0_FDSI0_GRPM1_GRVWA8_GRVWB8_GSUAMB_GLS0_ISA950_IU1_K1_LBSPPA1024_LBSPPB1024_LBSPPM0_LPA16_LPB16_LPM0_LRVW8_LWPMn1_MIAV0_MIWT8_5_MO40_NTn1_NTA2_NTB3_NTC5_NTD5_NTM0_NEPBS14_NLCA1_NLCB1_ONLL1_PGR2_PLR1_PKA1_SIA3_SS1_SPO0_SRVW0_SSO1_SVW8_SK0_SKXCCM0_TLDS2_ULSGRO0_USL1_UIOFGRO0_USFGRO0_VSn1_VWA8_VWB1_WSGRA0_WSGRB0_WS64_WG32_8_1,0.0,795.78,3090.42
256,509,640,2880,True,torch.bfloat16,torch.bfloat16,False,False,hipblaslt,387511,0,12.4158,Cijk_Alik_Bljk_BBS_BH_Bias_HA_S_SAV_UserArgs_MT64x64x64_MI16x16x1_SN_LDSB0_AFC1_AFEM1_AFEM1_ASEM1_CLR0_CADS0_DTLA1_DTLB1_DTVA0_DTVB0_EPS0_FDSI0_GRPM1_GRVWA2_GRVWB2_GSU0_GSUAMB_GLS0_ISA950_IU1_K1_LBSPPA512_LBSPPB256_LBSPPM0_LPA16_LPB16_LPM0_LRVW8_LWPMn1_MIAV1_MIWT4_1_MO40_NTn1_NTA2_NTB3_NTC7_NTD0_NTM0_NEPBS16_NLCA1_NLCB1_ONLL1_PGR2_PLR1_PKA1_SIA3_SS1_SPO0_SRVW0_SSO0_SVW4_SK3_SKXCCM8_TLDS2_ULSGRO0_USL1_UIOFGRO0_USFGRO0_VSn1_VWA4_VWB1_WSGRA0_WSGRB0_WS64_WG16_16_1,0.0,151.13,585.52
256,509,2880,512,True,torch.bfloat16,torch.bfloat16,False,False,hipblaslt,387937,0,7.3674,Cijk_Alik_Bljk_BBS_BH_Bias_HA_S_SAV_UserArgs_MT64x128x128_MI16x16x1_SN_LDSB0_AFC1_AFEM1_AFEM1_ASEM1_CLR1_CADS0_DTLA1_DTLB1_DTVA0_DTVB0_EPS0_FDSI0_GRPM1_GRVWA8_GRVWB8_GSU0_GSUAMB_GLS0_ISA950_IU1_K1_LBSPPA1024_LBSPPB1024_LBSPPM0_LPA16_LPB16_LPM0_LRVW8_LWPMn1_MIAV1_MIWT4_2_MO40_NTn1_NTA1_NTB1_NTC7_NTD5_NTM0_NEPBS0_NLCA1_NLCB1_ONLL1_PGR2_PLR1_PKA1_SIA3_SS1_SPO0_SRVW0_SSO0_SVW4_SK3_SKXCCM0_TLDS1_ULSGRO0_USL1_UIOFGRO0_USFGRO1_VSn1_VWA4_VWB2_WSGRA0_WSGRB0_WS64_WG16_16_1,0.0,203.75,868.99
256,509,128,2880,True,torch.bfloat16,torch.bfloat16,False,False,asm,2,11,5.8694,_ZN5aiter37bf16gemm_fp32bf16_tn_48x64_pf3_splitkE,0.0211,63.94,647.33
256,509,25136,2880,False,torch.bfloat16,torch.bfloat16,False,False,hipblaslt,388552,0,67.1524,Custom_Cijk_Alik_Bljk_BBS_BH_MT256x256x64_MI16x16x1_UserArgs_shortname0_gfx950,0.0,1097.43,2580.75
