aiter/configs/model_configs/hunyuan3_fp8_per_tensor_tuned_fmoe.csv
gfx,cu_num,token,model_dim,inter_dim,expert,topk,act_type,dtype,q_dtype_a,q_dtype_w,q_type,use_g1u1,doweight_stage1,block_m,ksplit,us1,kernelName1,err1,us2,kernelName2,err2,us,run_1stage,xbf16,flat,tflops,bw,_tag
gfx942,80,1,4096,192,192,8,ActivationType.Silu,torch.bfloat16,torch.float8_e4m3fnuz,torch.float8_e4m3fnuz,QuantType.per_Tensor,1,0,16,0,15.788151515151668,fused_moe_gfx942__16_16_16_False,5.57%,0.0,,0%,15.788151515151668,1,0,0,0,0,
gfx942,80,2,4096,192,192,8,ActivationType.Silu,torch.bfloat16,torch.float8_e4m3fnuz,torch.float8_e4m3fnuz,QuantType.per_Tensor,1,0,16,0,30.734989130435398,fused_moe_gfx942__16_16_16_False,4.60%,0.0,,0%,30.734989130435398,1,0,0,0,0,
gfx942,80,4,4096,192,192,8,ActivationType.Silu,torch.bfloat16,torch.float8_e4m3fnuz,torch.float8_e4m3fnuz,QuantType.per_Tensor,1,0,16,0,42.48821428571428,fused_moe_gfx942__16_16_16_False,3.35%,0.0,,0%,42.48821428571428,1,0,0,0,0,
gfx942,80,8,4096,192,192,8,ActivationType.Silu,torch.bfloat16,torch.float8_e4m3fnuz,torch.float8_e4m3fnuz,QuantType.per_Tensor,1,0,16,0,59.92572727272711,fused_moe_gfx942__16_16_16_False,3.73%,0.0,,0%,59.92572727272711,1,0,0,0,0,
gfx942,80,16,4096,192,192,8,ActivationType.Silu,torch.bfloat16,torch.float8_e4m3fnuz,torch.float8_e4m3fnuz,QuantType.per_Tensor,1,0,16,0,93.77338888888885,fused_moe_gfx942__16_16_16_False,3.62%,0.0,,0%,93.77338888888885,1,0,0,0,0,
gfx942,80,32,4096,192,192,8,ActivationType.Silu,torch.bfloat16,torch.float8_e4m3fnuz,torch.float8_e4m3fnuz,QuantType.per_Tensor,1,0,16,0,128.46114000000034,fused_moe_gfx942__16_16_16_False,3.47%,0.0,,0%,128.46114000000034,1,0,0,0,0,
