aiter/configs/model_configs/kimik2_bf16_tuned_gemm.csv
gfx,cu_num,M,N,K,bias,dtype,outdtype,scaleAB,bpreshuffle,libtype,solidx,splitK,us,kernelName,err_ratio,tflops,bw
gfx950,256,1,2112,7168,False,torch.bfloat16,torch.bfloat16,False,False,flydsl,39,16,11.088,flydsl_gemm2_abf16_wbf16_bf16_t32x64x64_split_k16_block_m_warp2_block_n_warp2_async_copyTrue_b_to_ldsTrue_b_preshuffleFalse_c_to_ldsFalse_gfx950,0.0,2.73,2732.34
gfx950,256,2,2112,7168,False,torch.bfloat16,torch.bfloat16,False,False,flydsl,39,16,10.057,flydsl_gemm2_abf16_wbf16_bf16_t32x64x64_split_k16_block_m_warp2_block_n_warp2_async_copyTrue_b_to_ldsTrue_b_preshuffleFalse_c_to_ldsFalse_gfx950,0.0,6.02,3014.29
gfx950,256,4,2112,7168,False,torch.bfloat16,torch.bfloat16,False,False,flydsl,39,16,10.088,flydsl_gemm2_abf16_wbf16_bf16_t32x64x64_split_k16_block_m_warp2_block_n_warp2_async_copyTrue_b_to_ldsTrue_b_preshuffleFalse_c_to_ldsFalse_gfx950,0.0,12.01,3008.71
gfx950,256,8,2112,7168,False,torch.bfloat16,torch.bfloat16,False,False,flydsl,217,8,11.1236,flydsl_gemm2_abf16_wbf16_bf16_t32x64x128_split_k8_block_m_warp2_block_n_warp2_async_copyTrue_b_to_ldsTrue_b_preshuffleFalse_c_to_ldsFalse_gfx950,0.0,21.78,2735.29
gfx950,256,16,2112,7168,False,torch.bfloat16,torch.bfloat16,False,False,flydsl,217,8,11.6168,flydsl_gemm2_abf16_wbf16_bf16_t32x64x128_split_k8_block_m_warp2_block_n_warp2_async_copyTrue_b_to_ldsTrue_b_preshuffleFalse_c_to_ldsFalse_gfx950,0.0,41.7,2631.93
gfx950,256,24,2112,7168,False,torch.bfloat16,torch.bfloat16,False,False,flydsl,217,8,12.9327,flydsl_gemm2_abf16_wbf16_bf16_t32x64x128_split_k8_block_m_warp2_block_n_warp2_async_copyTrue_b_to_ldsTrue_b_preshuffleFalse_c_to_ldsFalse_gfx950,0.0,56.19,2375.62
gfx950,256,32,2112,7168,False,torch.bfloat16,torch.bfloat16,False,False,flydsl,217,8,13.4834,flydsl_gemm2_abf16_wbf16_bf16_t32x64x128_split_k8_block_m_warp2_block_n_warp2_async_copyTrue_b_to_ldsTrue_b_preshuffleFalse_c_to_ldsFalse_gfx950,0.0,71.86,2289.59
gfx950,256,40,2112,7168,False,torch.bfloat16,torch.bfloat16,False,False,asm,3,7,14.3139,_ZN5aiter39bf16gemm_fp32bf16_tn_48x64_splitk_cleanE,0.0194,84.61,2167.13
gfx950,256,48,2112,7168,False,torch.bfloat16,torch.bfloat16,False,False,asm,3,6,14.6708,_ZN5aiter39bf16gemm_fp32bf16_tn_48x64_splitk_cleanE,0.018,99.06,2124.53
gfx950,256,56,2112,7168,False,torch.bfloat16,torch.bfloat16,False,False,asm,5,6,15.0293,_ZN5aiter39bf16gemm_fp32bf16_tn_64x64_splitk_cleanE,0.0176,112.82,2083.73
gfx950,256,64,2112,7168,False,torch.bfloat16,torch.bfloat16,False,False,asm,5,6,14.6227,_ZN5aiter39bf16gemm_fp32bf16_tn_64x64_splitk_cleanE,0.018,132.52,2151.82
gfx950,256,72,2112,7168,False,torch.bfloat16,torch.bfloat16,False,False,asm,8,7,15.0844,_ZN5aiter39bf16gemm_fp32bf16_tn_96x64_splitk_cleanE,0.0198,144.52,2095.8
gfx950,256,80,2112,7168,False,torch.bfloat16,torch.bfloat16,False,False,asm,7,6,15.8189,_ZN5aiter39bf16gemm_fp32bf16_tn_80x64_splitk_cleanE,0.0175,153.12,2007.88
gfx950,256,88,2112,7168,False,torch.bfloat16,torch.bfloat16,False,False,asm,8,7,16.1244,_ZN5aiter39bf16gemm_fp32bf16_tn_96x64_splitk_cleanE,0.02,165.24,1979.04
gfx950,256,96,2112,7168,False,torch.bfloat16,torch.bfloat16,False,False,asm,8,6,16.2338,_ZN5aiter39bf16gemm_fp32bf16_tn_96x64_splitk_cleanE,0.0182,179.05,1974.85
gfx950,256,112,2112,7168,False,torch.bfloat16,torch.bfloat16,False,False,asm,5,3,19.5749,_ZN5aiter39bf16gemm_fp32bf16_tn_64x64_splitk_cleanE,0.0104,173.24,1652.95
gfx950,256,128,2112,7168,False,torch.bfloat16,torch.bfloat16,False,False,asm,5,3,19.9118,_ZN5aiter39bf16gemm_fp32bf16_tn_64x64_splitk_cleanE,0.0105,194.64,1639.9
gfx950,256,136,2112,7168,False,torch.bfloat16,torch.bfloat16,False,False,flydsl,305,4,26.1149,flydsl_gemm2_abf16_wbf16_bf16_t96x64x128_split_k4_block_m_warp2_block_n_warp2_async_copyTrue_b_to_ldsTrue_b_preshuffleFalse_c_to_ldsFalse_gfx950,0.0,157.68,1256.06
gfx950,256,144,2112,7168,False,torch.bfloat16,torch.bfloat16,False,False,flydsl,305,4,27.1549,flydsl_gemm2_abf16_wbf16_bf16_t96x64x128_split_k4_block_m_warp2_block_n_warp2_async_copyTrue_b_to_ldsTrue_b_preshuffleFalse_c_to_ldsFalse_gfx950,0.0,160.56,1213.42
gfx950,256,256,2112,7168,False,torch.bfloat16,torch.bfloat16,False,False,asm,8,2,28.5227,_ZN5aiter39bf16gemm_fp32bf16_tn_96x64_splitk_cleanE,0.006,271.75,1228.11
gfx950,256,360,2112,7168,False,torch.bfloat16,torch.bfloat16,False,False,flydsl,332,2,46.4618,flydsl_gemm2_abf16_wbf16_bf16_t128x64x128_split_k2_block_m_warp1_block_n_warp4_async_copyTrue_b_to_ldsFalse_b_preshuffleFalse_c_to_ldsFalse_gfx950,0.0,234.6,795.48
gfx950,256,368,2112,7168,False,torch.bfloat16,torch.bfloat16,False,False,flydsl,332,2,47.2929,flydsl_gemm2_abf16_wbf16_bf16_t128x64x128_split_k2_block_m_warp1_block_n_warp4_async_copyTrue_b_to_ldsFalse_b_preshuffleFalse_c_to_ldsFalse_gfx950,0.0,235.6,784.64
gfx950,256,376,2112,7168,False,torch.bfloat16,torch.bfloat16,False,False,flydsl,332,2,47.6129,flydsl_gemm2_abf16_wbf16_bf16_t128x64x128_split_k2_block_m_warp1_block_n_warp4_async_copyTrue_b_to_ldsFalse_b_preshuffleFalse_c_to_ldsFalse_gfx950,0.0,239.1,782.48
gfx950,256,384,2112,7168,False,torch.bfloat16,torch.bfloat16,False,False,flydsl,332,2,48.4307,flydsl_gemm2_abf16_wbf16_bf16_t128x64x128_split_k2_block_m_warp1_block_n_warp4_async_copyTrue_b_to_ldsFalse_b_preshuffleFalse_c_to_ldsFalse_gfx950,0.0,240.07,772.33
gfx950,256,1,3072,1536,False,torch.bfloat16,torch.bfloat16,False,False,flydsl,215,4,5.2524,flydsl_gemm2_abf16_wbf16_bf16_t32x64x128_split_k4_block_m_warp2_block_n_warp2_async_copyTrue_b_to_ldsTrue_b_preshuffleFalse_c_to_ldsFalse_gfx950,0.0,1.8,1798.48
gfx950,256,2,3072,1536,False,torch.bfloat16,torch.bfloat16,False,False,flydsl,35,4,6.0523,flydsl_gemm2_abf16_wbf16_bf16_t32x64x64_split_k4_block_m_warp2_block_n_warp2_async_copyTrue_b_to_ldsTrue_b_preshuffleFalse_c_to_ldsFalse_gfx950,0.0,3.12,1562.31
gfx950,256,4,3072,1536,False,torch.bfloat16,torch.bfloat16,False,False,flydsl,215,4,5.3902,flydsl_gemm2_abf16_wbf16_bf16_t32x64x128_split_k4_block_m_warp2_block_n_warp2_async_copyTrue_b_to_ldsTrue_b_preshuffleFalse_c_to_ldsFalse_gfx950,0.0,7.0,1757.64
gfx950,256,8,3072,1536,False,torch.bfloat16,torch.bfloat16,False,False,flydsl,215,4,5.4523,flydsl_gemm2_abf16_wbf16_bf16_t32x64x128_split_k4_block_m_warp2_block_n_warp2_async_copyTrue_b_to_ldsTrue_b_preshuffleFalse_c_to_ldsFalse_gfx950,0.0,13.85,1744.37
gfx950,256,16,3072,1536,False,torch.bfloat16,torch.bfloat16,False,False,flydsl,215,4,5.8082,flydsl_gemm2_abf16_wbf16_bf16_t32x64x128_split_k4_block_m_warp2_block_n_warp2_async_copyTrue_b_to_ldsTrue_b_preshuffleFalse_c_to_ldsFalse_gfx950,0.0,26.0,1650.18
gfx950,256,24,3072,1536,False,torch.bfloat16,torch.bfloat16,False,False,flydsl,215,4,6.3368,flydsl_gemm2_abf16_wbf16_bf16_t32x64x128_split_k4_block_m_warp2_block_n_warp2_async_copyTrue_b_to_ldsTrue_b_preshuffleFalse_c_to_ldsFalse_gfx950,0.0,35.74,1524.18
gfx950,256,32,3072,1536,False,torch.bfloat16,torch.bfloat16,False,False,flydsl,213,2,7.2968,flydsl_gemm2_abf16_wbf16_bf16_t32x64x128_split_k2_block_m_warp2_block_n_warp2_async_copyTrue_b_to_ldsTrue_b_preshuffleFalse_c_to_ldsFalse_gfx950,0.0,41.39,1333.75
gfx950,256,48,3072,1536,False,torch.bfloat16,torch.bfloat16,False,False,asm,3,3,9.043,_ZN5aiter39bf16gemm_fp32bf16_tn_48x64_splitk_cleanE,0.0058,50.09,1092.51
gfx950,256,64,3072,1536,False,torch.bfloat16,torch.bfloat16,False,False,asm,7,4,9.2849,_ZN5aiter39bf16gemm_fp32bf16_tn_80x64_splitk_cleanE,0.0078,65.05,1079.93
gfx950,256,80,3072,1536,False,torch.bfloat16,torch.bfloat16,False,False,asm,7,4,9.3113,_ZN5aiter39bf16gemm_fp32bf16_tn_80x64_splitk_cleanE,0.0076,81.08,1092.7
gfx950,256,96,3072,1536,False,torch.bfloat16,torch.bfloat16,False,False,asm,8,4,9.668,_ZN5aiter39bf16gemm_fp32bf16_tn_96x64_splitk_cleanE,0.0076,93.71,1067.64
gfx950,256,112,3072,1536,False,torch.bfloat16,torch.bfloat16,False,False,asm,7,2,10.1342,_ZN5aiter39bf16gemm_fp32bf16_tn_80x64_splitk_cleanE,0.0028,104.3,1033.07
gfx950,256,128,3072,1536,False,torch.bfloat16,torch.bfloat16,False,False,asm,5,2,10.3007,_ZN5aiter39bf16gemm_fp32bf16_tn_64x64_splitk_cleanE,0.0028,117.27,1030.69
gfx950,256,176,3072,1536,False,torch.bfloat16,torch.bfloat16,False,False,asm,8,2,10.6186,_ZN5aiter39bf16gemm_fp32bf16_tn_96x64_splitk_cleanE,0.0028,156.42,1041.49
gfx950,256,184,3072,1536,False,torch.bfloat16,torch.bfloat16,False,False,asm,8,2,10.8345,_ZN5aiter39bf16gemm_fp32bf16_tn_96x64_splitk_cleanE,0.0028,160.27,1027.54
gfx950,256,192,3072,1536,False,torch.bfloat16,torch.bfloat16,False,False,asm,8,2,11.0118,_ZN5aiter39bf16gemm_fp32bf16_tn_96x64_splitk_cleanE,0.0028,164.55,1017.7
gfx950,256,256,3072,1536,False,torch.bfloat16,torch.bfloat16,False,False,asm,6,1,12.0939,_ZN5aiter37bf16gemm_fp32bf16_tn_64x64_pf3_splitkE,0.0,199.76,975.41
gfx950,256,1,4096,512,False,torch.bfloat16,torch.bfloat16,False,False,flydsl,211,1,4.4612,flydsl_gemm2_abf16_wbf16_bf16_t32x64x128_split_k1_block_m_warp2_block_n_warp2_async_copyTrue_b_to_ldsTrue_b_preshuffleFalse_c_to_ldsFalse_gfx950,0.0,0.94,942.24
gfx950,256,2,4096,512,False,torch.bfloat16,torch.bfloat16,False,False,flydsl,211,1,4.7679,flydsl_gemm2_abf16_wbf16_bf16_t32x64x128_split_k1_block_m_warp2_block_n_warp2_async_copyTrue_b_to_ldsTrue_b_preshuffleFalse_c_to_ldsFalse_gfx950,0.0,1.76,883.56
gfx950,256,24,4096,512,False,torch.bfloat16,torch.bfloat16,False,False,flydsl,211,1,4.8257,flydsl_gemm2_abf16_wbf16_bf16_t32x64x128_split_k1_block_m_warp2_block_n_warp2_async_copyTrue_b_to_ldsTrue_b_preshuffleFalse_c_to_ldsFalse_gfx950,0.0,20.86,915.0
gfx950,256,32,4096,512,False,torch.bfloat16,torch.bfloat16,False,False,flydsl,211,1,4.7057,flydsl_gemm2_abf16_wbf16_bf16_t32x64x128_split_k1_block_m_warp2_block_n_warp2_async_copyTrue_b_to_ldsTrue_b_preshuffleFalse_c_to_ldsFalse_gfx950,0.0,28.52,954.0
gfx950,256,40,4096,512,False,torch.bfloat16,torch.bfloat16,False,False,flydsl,211,1,4.7457,flydsl_gemm2_abf16_wbf16_bf16_t32x64x128_split_k1_block_m_warp2_block_n_warp2_async_copyTrue_b_to_ldsTrue_b_preshuffleFalse_c_to_ldsFalse_gfx950,0.0,35.35,961.5
gfx950,256,48,4096,512,False,torch.bfloat16,torch.bfloat16,False,False,flydsl,211,1,4.6879,flydsl_gemm2_abf16_wbf16_bf16_t32x64x128_split_k1_block_m_warp2_block_n_warp2_async_copyTrue_b_to_ldsTrue_b_preshuffleFalse_c_to_ldsFalse_gfx950,0.0,42.95,989.07
gfx950,256,56,4096,512,False,torch.bfloat16,torch.bfloat16,False,False,flydsl,211,1,4.7503,flydsl_gemm2_abf16_wbf16_bf16_t32x64x128_split_k1_block_m_warp2_block_n_warp2_async_copyTrue_b_to_ldsTrue_b_preshuffleFalse_c_to_ldsFalse_gfx950,0.0,49.45,991.59
gfx950,256,64,4096,512,False,torch.bfloat16,torch.bfloat16,False,False,flydsl,211,1,4.7813,flydsl_gemm2_abf16_wbf16_bf16_t32x64x128_split_k1_block_m_warp2_block_n_warp2_async_copyTrue_b_to_ldsTrue_b_preshuffleFalse_c_to_ldsFalse_gfx950,0.0,56.14,1000.58
gfx950,256,80,4096,512,False,torch.bfloat16,torch.bfloat16,False,False,asm,2,1,6.011,_ZN5aiter37bf16gemm_fp32bf16_tn_32x64_pf3_splitkE,0.0,55.82,820.43
gfx950,256,88,4096,512,False,torch.bfloat16,torch.bfloat16,False,False,flydsl,211,1,5.079,flydsl_gemm2_abf16_wbf16_bf16_t32x64x128_split_k1_block_m_warp2_block_n_warp2_async_copyTrue_b_to_ldsTrue_b_preshuffleFalse_c_to_ldsFalse_gfx950,0.0,72.67,985.49
gfx950,256,96,4096,512,False,torch.bfloat16,torch.bfloat16,False,False,flydsl,211,1,5.0834,flydsl_gemm2_abf16_wbf16_bf16_t32x64x128_split_k1_block_m_warp2_block_n_warp2_async_copyTrue_b_to_ldsTrue_b_preshuffleFalse_c_to_ldsFalse_gfx950,0.0,79.21,999.13
gfx950,256,104,4096,512,False,torch.bfloat16,torch.bfloat16,False,False,flydsl,271,1,5.3502,flydsl_gemm2_abf16_wbf16_bf16_t64x64x128_split_k1_block_m_warp2_block_n_warp2_async_copyTrue_b_to_ldsTrue_b_preshuffleFalse_c_to_ldsFalse_gfx950,0.0,81.53,963.09
gfx950,256,112,4096,512,False,torch.bfloat16,torch.bfloat16,False,False,flydsl,211,1,5.5636,flydsl_gemm2_abf16_wbf16_bf16_t32x64x128_split_k1_block_m_warp2_block_n_warp2_async_copyTrue_b_to_ldsTrue_b_preshuffleFalse_c_to_ldsFalse_gfx950,0.0,84.44,939.42
gfx950,256,120,4096,512,False,torch.bfloat16,torch.bfloat16,False,False,flydsl,271,1,5.2434,flydsl_gemm2_abf16_wbf16_bf16_t64x64x128_split_k1_block_m_warp2_block_n_warp2_async_copyTrue_b_to_ldsTrue_b_preshuffleFalse_c_to_ldsFalse_gfx950,0.0,95.99,1010.83
gfx950,256,128,4096,512,False,torch.bfloat16,torch.bfloat16,False,False,flydsl,211,1,5.5101,flydsl_gemm2_abf16_wbf16_bf16_t32x64x128_split_k1_block_m_warp2_block_n_warp2_async_copyTrue_b_to_ldsTrue_b_preshuffleFalse_c_to_ldsFalse_gfx950,0.0,97.43,975.29
gfx950,256,136,4096,512,False,torch.bfloat16,torch.bfloat16,False,False,flydsl,211,1,5.8569,flydsl_gemm2_abf16_wbf16_bf16_t32x64x128_split_k1_block_m_warp2_block_n_warp2_async_copyTrue_b_to_ldsTrue_b_preshuffleFalse_c_to_ldsFalse_gfx950,0.0,97.39,930.13
gfx950,256,144,4096,512,False,torch.bfloat16,torch.bfloat16,False,False,flydsl,211,1,5.9501,flydsl_gemm2_abf16_wbf16_bf16_t32x64x128_split_k1_block_m_warp2_block_n_warp2_async_copyTrue_b_to_ldsTrue_b_preshuffleFalse_c_to_ldsFalse_gfx950,0.0,101.51,927.95
gfx950,256,152,4096,512,False,torch.bfloat16,torch.bfloat16,False,False,flydsl,211,1,5.8923,flydsl_gemm2_abf16_wbf16_bf16_t32x64x128_split_k1_block_m_warp2_block_n_warp2_async_copyTrue_b_to_ldsTrue_b_preshuffleFalse_c_to_ldsFalse_gfx950,0.0,108.2,949.56
gfx950,256,160,4096,512,False,torch.bfloat16,torch.bfloat16,False,False,flydsl,31,1,6.3592,flydsl_gemm2_abf16_wbf16_bf16_t32x64x64_split_k1_block_m_warp2_block_n_warp2_async_copyTrue_b_to_ldsTrue_b_preshuffleFalse_c_to_ldsFalse_gfx950,0.0,105.53,891.44
gfx950,256,168,4096,512,False,torch.bfloat16,torch.bfloat16,False,False,flydsl,271,1,5.6257,flydsl_gemm2_abf16_wbf16_bf16_t64x64x128_split_k1_block_m_warp2_block_n_warp2_async_copyTrue_b_to_ldsTrue_b_preshuffleFalse_c_to_ldsFalse_gfx950,0.0,125.26,1020.78
gfx950,256,176,4096,512,False,torch.bfloat16,torch.bfloat16,False,False,flydsl,31,1,6.5014,flydsl_gemm2_abf16_wbf16_bf16_t32x64x64_split_k1_block_m_warp2_block_n_warp2_async_copyTrue_b_to_ldsTrue_b_preshuffleFalse_c_to_ldsFalse_gfx950,0.0,113.54,894.62
gfx950,256,184,4096,512,False,torch.bfloat16,torch.bfloat16,False,False,flydsl,31,1,6.4704,flydsl_gemm2_abf16_wbf16_bf16_t32x64x64_split_k1_block_m_warp2_block_n_warp2_async_copyTrue_b_to_ldsTrue_b_preshuffleFalse_c_to_ldsFalse_gfx950,0.0,119.27,910.3
gfx950,256,192,4096,512,False,torch.bfloat16,torch.bfloat16,False,False,flydsl,31,1,6.5057,flydsl_gemm2_abf16_wbf16_bf16_t32x64x64_split_k1_block_m_warp2_block_n_warp2_async_copyTrue_b_to_ldsTrue_b_preshuffleFalse_c_to_ldsFalse_gfx950,0.0,123.79,916.7
gfx950,256,200,4096,512,False,torch.bfloat16,torch.bfloat16,False,False,flydsl,301,1,6.1546,flydsl_gemm2_abf16_wbf16_bf16_t96x64x128_split_k1_block_m_warp2_block_n_warp2_async_copyTrue_b_to_ldsTrue_b_preshuffleFalse_c_to_ldsFalse_gfx950,0.0,136.3,980.98
gfx950,256,208,4096,512,False,torch.bfloat16,torch.bfloat16,False,False,flydsl,271,1,6.1812,flydsl_gemm2_abf16_wbf16_bf16_t64x64x128_split_k1_block_m_warp2_block_n_warp2_async_copyTrue_b_to_ldsTrue_b_preshuffleFalse_c_to_ldsFalse_gfx950,0.0,141.14,988.68
gfx950,256,216,4096,512,False,torch.bfloat16,torch.bfloat16,False,False,flydsl,271,1,6.1679,flydsl_gemm2_abf16_wbf16_bf16_t64x64x128_split_k1_block_m_warp2_block_n_warp2_async_copyTrue_b_to_ldsTrue_b_preshuffleFalse_c_to_ldsFalse_gfx950,0.0,146.88,1002.77
gfx950,256,224,4096,512,False,torch.bfloat16,torch.bfloat16,False,False,flydsl,271,1,6.1903,flydsl_gemm2_abf16_wbf16_bf16_t64x64x128_split_k1_block_m_warp2_block_n_warp2_async_copyTrue_b_to_ldsTrue_b_preshuffleFalse_c_to_ldsFalse_gfx950,0.0,151.77,1011.04
gfx950,256,232,4096,512,False,torch.bfloat16,torch.bfloat16,False,False,flydsl,271,1,6.1902,flydsl_gemm2_abf16_wbf16_bf16_t64x64x128_split_k1_block_m_warp2_block_n_warp2_async_copyTrue_b_to_ldsTrue_b_preshuffleFalse_c_to_ldsFalse_gfx950,0.0,157.2,1022.97
gfx950,256,240,4096,512,False,torch.bfloat16,torch.bfloat16,False,False,flydsl,271,1,6.1902,flydsl_gemm2_abf16_wbf16_bf16_t64x64x128_split_k1_block_m_warp2_block_n_warp2_async_copyTrue_b_to_ldsTrue_b_preshuffleFalse_c_to_ldsFalse_gfx950,0.0,162.62,1034.88
gfx950,256,248,4096,512,False,torch.bfloat16,torch.bfloat16,False,False,flydsl,271,1,6.2168,flydsl_gemm2_abf16_wbf16_bf16_t64x64x128_split_k1_block_m_warp2_block_n_warp2_async_copyTrue_b_to_ldsTrue_b_preshuffleFalse_c_to_ldsFalse_gfx950,0.0,167.32,1042.32
gfx950,256,256,4096,512,False,torch.bfloat16,torch.bfloat16,False,False,flydsl,271,1,6.2034,flydsl_gemm2_abf16_wbf16_bf16_t64x64x128_split_k1_block_m_warp2_block_n_warp2_async_copyTrue_b_to_ldsTrue_b_preshuffleFalse_c_to_ldsFalse_gfx950,0.0,173.09,1056.45
gfx950,256,264,4096,512,False,torch.bfloat16,torch.bfloat16,False,False,flydsl,301,1,6.288,flydsl_gemm2_abf16_wbf16_bf16_t96x64x128_split_k1_block_m_warp2_block_n_warp2_async_copyTrue_b_to_ldsTrue_b_preshuffleFalse_c_to_ldsFalse_gfx950,0.0,176.1,1053.96
gfx950,256,272,4096,512,False,torch.bfloat16,torch.bfloat16,False,False,flydsl,301,1,6.2657,flydsl_gemm2_abf16_wbf16_bf16_t96x64x128_split_k1_block_m_warp2_block_n_warp2_async_copyTrue_b_to_ldsTrue_b_preshuffleFalse_c_to_ldsFalse_gfx950,0.0,182.08,1069.49
gfx950,256,280,4096,512,False,torch.bfloat16,torch.bfloat16,False,False,flydsl,301,1,6.359,flydsl_gemm2_abf16_wbf16_bf16_t96x64x128_split_k1_block_m_warp2_block_n_warp2_async_copyTrue_b_to_ldsTrue_b_preshuffleFalse_c_to_ldsFalse_gfx950,0.0,184.68,1065.39
gfx950,256,288,4096,512,False,torch.bfloat16,torch.bfloat16,False,False,flydsl,301,1,6.4124,flydsl_gemm2_abf16_wbf16_bf16_t96x64x128_split_k1_block_m_warp2_block_n_warp2_async_copyTrue_b_to_ldsTrue_b_preshuffleFalse_c_to_ldsFalse_gfx950,0.0,188.38,1068.0
gfx950,256,320,4096,512,False,torch.bfloat16,torch.bfloat16,False,False,asm,9,1,7.4419,_ZN5aiter37bf16gemm_fp32bf16_tn_96x64_pf3_splitkE,0.0,180.35,959.89
gfx950,256,328,4096,512,False,torch.bfloat16,torch.bfloat16,False,False,flydsl,271,1,6.977,flydsl_gemm2_abf16_wbf16_bf16_t64x64x128_split_k1_block_m_warp2_block_n_warp2_async_copyTrue_b_to_ldsTrue_b_preshuffleFalse_c_to_ldsFalse_gfx950,0.0,197.18,1034.42
gfx950,256,344,4096,512,False,torch.bfloat16,torch.bfloat16,False,False,flydsl,91,1,7.5102,flydsl_gemm2_abf16_wbf16_bf16_t64x64x64_split_k1_block_m_warp2_block_n_warp2_async_copyTrue_b_to_ldsTrue_b_preshuffleFalse_c_to_ldsFalse_gfx950,0.0,192.12,980.61
gfx950,256,352,4096,512,False,torch.bfloat16,torch.bfloat16,False,False,flydsl,91,1,7.5502,flydsl_gemm2_abf16_wbf16_bf16_t64x64x64_split_k1_block_m_warp2_block_n_warp2_async_copyTrue_b_to_ldsTrue_b_preshuffleFalse_c_to_ldsFalse_gfx950,0.0,195.54,985.18
gfx950,256,360,4096,512,False,torch.bfloat16,torch.bfloat16,False,False,flydsl,271,1,7.1858,flydsl_gemm2_abf16_wbf16_bf16_t64x64x128_split_k1_block_m_warp2_block_n_warp2_async_copyTrue_b_to_ldsTrue_b_preshuffleFalse_c_to_ldsFalse_gfx950,0.0,210.13,1045.41
gfx950,256,368,4096,512,False,torch.bfloat16,torch.bfloat16,False,False,flydsl,271,1,7.0437,flydsl_gemm2_abf16_wbf16_bf16_t64x64x128_split_k1_block_m_warp2_block_n_warp2_async_copyTrue_b_to_ldsTrue_b_preshuffleFalse_c_to_ldsFalse_gfx950,0.0,219.13,1076.97
gfx950,256,376,4096,512,False,torch.bfloat16,torch.bfloat16,False,False,flydsl,271,1,7.0213,flydsl_gemm2_abf16_wbf16_bf16_t64x64x128_split_k1_block_m_warp2_block_n_warp2_async_copyTrue_b_to_ldsTrue_b_preshuffleFalse_c_to_ldsFalse_gfx950,0.0,224.61,1090.89
gfx950,256,384,4096,512,False,torch.bfloat16,torch.bfloat16,False,False,flydsl,271,1,7.1058,flydsl_gemm2_abf16_wbf16_bf16_t64x64x128_split_k1_block_m_warp2_block_n_warp2_async_copyTrue_b_to_ldsTrue_b_preshuffleFalse_c_to_ldsFalse_gfx950,0.0,226.66,1088.3
gfx950,256,392,4096,512,False,torch.bfloat16,torch.bfloat16,False,False,flydsl,121,1,7.8613,flydsl_gemm2_abf16_wbf16_bf16_t96x64x64_split_k1_block_m_warp2_block_n_warp2_async_copyTrue_b_to_ldsTrue_b_preshuffleFalse_c_to_ldsFalse_gfx950,0.0,209.15,993.09
gfx950,256,400,4096,512,False,torch.bfloat16,torch.bfloat16,False,False,flydsl,121,1,7.9502,flydsl_gemm2_abf16_wbf16_bf16_t96x64x64_split_k1_block_m_warp2_block_n_warp2_async_copyTrue_b_to_ldsTrue_b_preshuffleFalse_c_to_ldsFalse_gfx950,0.0,211.03,991.26
gfx950,256,424,4096,512,False,torch.bfloat16,torch.bfloat16,False,False,flydsl,121,1,7.8259,flydsl_gemm2_abf16_wbf16_bf16_t96x64x64_split_k1_block_m_warp2_block_n_warp2_async_copyTrue_b_to_ldsTrue_b_preshuffleFalse_c_to_ldsFalse_gfx950,0.0,227.24,1035.27
gfx950,256,448,4096,512,False,torch.bfloat16,torch.bfloat16,False,False,flydsl,301,1,7.408,flydsl_gemm2_abf16_wbf16_bf16_t96x64x128_split_k1_block_m_warp2_block_n_warp2_async_copyTrue_b_to_ldsTrue_b_preshuffleFalse_c_to_ldsFalse_gfx950,0.0,253.65,1123.52
gfx950,256,456,4096,512,False,torch.bfloat16,torch.bfloat16,False,False,flydsl,301,1,7.5947,flydsl_gemm2_abf16_wbf16_bf16_t96x64x128_split_k1_block_m_warp2_block_n_warp2_async_copyTrue_b_to_ldsTrue_b_preshuffleFalse_c_to_ldsFalse_gfx950,0.0,251.83,1105.62
gfx950,256,488,4096,512,False,torch.bfloat16,torch.bfloat16,False,False,flydsl,301,1,7.9014,flydsl_gemm2_abf16_wbf16_bf16_t96x64x128_split_k1_block_m_warp2_block_n_warp2_async_copyTrue_b_to_ldsTrue_b_preshuffleFalse_c_to_ldsFalse_gfx950,0.0,259.04,1100.02
gfx950,256,496,4096,512,False,torch.bfloat16,torch.bfloat16,False,False,flydsl,301,1,7.8612,flydsl_gemm2_abf16_wbf16_bf16_t96x64x128_split_k1_block_m_warp2_block_n_warp2_async_copyTrue_b_to_ldsTrue_b_preshuffleFalse_c_to_ldsFalse_gfx950,0.0,264.64,1115.02
gfx950,256,1,7168,2048,False,torch.bfloat16,torch.bfloat16,False,False,asm,1,2,11.2499,_ZN5aiter39bf16gemm_fp32bf16_tn_32x64_splitk_cleanE,0.0025,2.61,2611.45
gfx950,256,2,7168,2048,False,torch.bfloat16,torch.bfloat16,False,False,flydsl,47,8,9.297,flydsl_gemm2_abf16_wbf16_bf16_t32x128x64_split_k8_block_m_warp2_block_n_warp2_async_copyTrue_b_to_ldsTrue_b_preshuffleFalse_c_to_ldsFalse_gfx950,0.0,6.32,3161.99
gfx950,256,4,7168,2048,False,torch.bfloat16,torch.bfloat16,False,False,flydsl,215,4,9.7946,flydsl_gemm2_abf16_wbf16_bf16_t32x64x128_split_k4_block_m_warp2_block_n_warp2_async_copyTrue_b_to_ldsTrue_b_preshuffleFalse_c_to_ldsFalse_gfx950,0.0,11.99,3005.12
gfx950,256,8,7168,2048,False,torch.bfloat16,torch.bfloat16,False,False,flydsl,215,4,9.6613,flydsl_gemm2_abf16_wbf16_bf16_t32x64x128_split_k4_block_m_warp2_block_n_warp2_async_copyTrue_b_to_ldsTrue_b_preshuffleFalse_c_to_ldsFalse_gfx950,0.0,24.31,3054.19
gfx950,256,16,7168,2048,False,torch.bfloat16,torch.bfloat16,False,False,asm,1,2,11.9934,_ZN5aiter39bf16gemm_fp32bf16_tn_32x64_splitk_cleanE,0.0034,39.17,2472.61
gfx950,256,32,7168,2048,False,torch.bfloat16,torch.bfloat16,False,False,asm,1,2,12.3935,_ZN5aiter39bf16gemm_fp32bf16_tn_32x64_splitk_cleanE,0.0034,75.81,2416.59
gfx950,256,48,7168,2048,False,torch.bfloat16,torch.bfloat16,False,False,asm,3,2,13.0225,_ZN5aiter39bf16gemm_fp32bf16_tn_48x64_splitk_cleanE,0.0034,108.22,2322.51
gfx950,256,64,7168,2048,False,torch.bfloat16,torch.bfloat16,False,False,asm,5,2,13.5831,_ZN5aiter39bf16gemm_fp32bf16_tn_64x64_splitk_cleanE,0.0034,138.34,2248.37
gfx950,256,80,7168,2048,False,torch.bfloat16,torch.bfloat16,False,False,asm,7,2,14.0021,_ZN5aiter39bf16gemm_fp32bf16_tn_80x64_splitk_cleanE,0.0034,167.75,2202.15
gfx950,256,96,7168,2048,False,torch.bfloat16,torch.bfloat16,False,False,asm,8,2,14.2839,_ZN5aiter39bf16gemm_fp32bf16_tn_96x64_splitk_cleanE,0.0034,197.33,2179.35
gfx950,256,112,7168,2048,False,torch.bfloat16,torch.bfloat16,False,False,asm,6,1,15.5527,_ZN5aiter37bf16gemm_fp32bf16_tn_64x64_pf3_splitkE,0.0,211.43,2020.52
gfx950,256,128,7168,2048,False,torch.bfloat16,torch.bfloat16,False,False,asm,6,1,15.8395,_ZN5aiter37bf16gemm_fp32bf16_tn_64x64_pf3_splitkE,0.0,237.26,2002.55
gfx950,256,200,7168,2048,False,torch.bfloat16,torch.bfloat16,False,False,flydsl,301,1,22.377,flydsl_gemm2_abf16_wbf16_bf16_t96x64x128_split_k1_block_m_warp2_block_n_warp2_async_copyTrue_b_to_ldsTrue_b_preshuffleFalse_c_to_ldsFalse_gfx950,0.0,262.41,1476.81
gfx950,256,208,7168,2048,False,torch.bfloat16,torch.bfloat16,False,False,flydsl,330,1,22.7327,flydsl_gemm2_abf16_wbf16_bf16_t128x64x128_split_k1_block_m_warp1_block_n_warp4_async_copyTrue_b_to_ldsFalse_b_preshuffleFalse_c_to_ldsFalse_gfx950,0.0,268.64,1460.19
gfx950,256,216,7168,2048,False,torch.bfloat16,torch.bfloat16,False,False,flydsl,301,1,22.4438,flydsl_gemm2_abf16_wbf16_bf16_t96x64x128_split_k1_block_m_warp2_block_n_warp2_async_copyTrue_b_to_ldsTrue_b_preshuffleFalse_c_to_ldsFalse_gfx950,0.0,282.56,1485.55
gfx950,256,224,7168,2048,False,torch.bfloat16,torch.bfloat16,False,False,flydsl,330,1,23.017,flydsl_gemm2_abf16_wbf16_bf16_t128x64x128_split_k1_block_m_warp1_block_n_warp4_async_copyTrue_b_to_ldsFalse_b_preshuffleFalse_c_to_ldsFalse_gfx950,0.0,285.73,1454.96
gfx950,256,232,7168,2048,False,torch.bfloat16,torch.bfloat16,False,False,flydsl,330,1,23.2703,flydsl_gemm2_abf16_wbf16_bf16_t128x64x128_split_k1_block_m_warp1_block_n_warp4_async_copyTrue_b_to_ldsFalse_b_preshuffleFalse_c_to_ldsFalse_gfx950,0.0,292.71,1445.46
gfx950,256,240,7168,2048,False,torch.bfloat16,torch.bfloat16,False,False,flydsl,330,1,23.0171,flydsl_gemm2_abf16_wbf16_bf16_t128x64x128_split_k1_block_m_warp1_block_n_warp4_async_copyTrue_b_to_ldsFalse_b_preshuffleFalse_c_to_ldsFalse_gfx950,0.0,306.14,1467.77
gfx950,256,248,7168,2048,False,torch.bfloat16,torch.bfloat16,False,False,flydsl,330,1,23.2037,flydsl_gemm2_abf16_wbf16_bf16_t128x64x128_split_k1_block_m_warp1_block_n_warp4_async_copyTrue_b_to_ldsFalse_b_preshuffleFalse_c_to_ldsFalse_gfx950,0.0,313.8,1462.32
gfx950,256,256,7168,2048,False,torch.bfloat16,torch.bfloat16,False,False,flydsl,301,1,23.488,flydsl_gemm2_abf16_wbf16_bf16_t96x64x128_split_k1_block_m_warp2_block_n_warp2_async_copyTrue_b_to_ldsTrue_b_preshuffleFalse_c_to_ldsFalse_gfx950,0.0,320.0,1450.9
gfx950,256,1,384,7168,False,torch.bfloat16,torch.bfloat16,False,False,flydsl,39,16,6.3457,flydsl_gemm2_abf16_wbf16_bf16_t32x64x64_split_k16_block_m_warp2_block_n_warp2_async_copyTrue_b_to_ldsTrue_b_preshuffleFalse_c_to_ldsFalse_gfx950,0.0,0.87,869.91
gfx950,256,2,384,7168,False,torch.bfloat16,torch.bfloat16,False,False,flydsl,39,16,6.4879,flydsl_gemm2_abf16_wbf16_bf16_t32x64x64_split_k16_block_m_warp2_block_n_warp2_async_copyTrue_b_to_ldsTrue_b_preshuffleFalse_c_to_ldsFalse_gfx950,0.0,1.7,853.16
gfx950,256,4,384,7168,False,torch.bfloat16,torch.bfloat16,False,False,flydsl,39,16,6.4257,flydsl_gemm2_abf16_wbf16_bf16_t32x64x64_split_k16_block_m_warp2_block_n_warp2_async_copyTrue_b_to_ldsTrue_b_preshuffleFalse_c_to_ldsFalse_gfx950,0.0,3.43,866.13
gfx950,256,8,384,7168,False,torch.bfloat16,torch.bfloat16,False,False,flydsl,39,16,6.4791,flydsl_gemm2_abf16_wbf16_bf16_t32x64x64_split_k16_block_m_warp2_block_n_warp2_async_copyTrue_b_to_ldsTrue_b_preshuffleFalse_c_to_ldsFalse_gfx950,0.0,6.8,868.31
gfx950,256,16,384,7168,False,torch.bfloat16,torch.bfloat16,False,False,flydsl,39,16,6.599,flydsl_gemm2_abf16_wbf16_bf16_t32x64x64_split_k16_block_m_warp2_block_n_warp2_async_copyTrue_b_to_ldsTrue_b_preshuffleFalse_c_to_ldsFalse_gfx950,0.0,13.35,870.84
gfx950,256,24,384,7168,False,torch.bfloat16,torch.bfloat16,False,False,flydsl,39,16,6.6523,flydsl_gemm2_abf16_wbf16_bf16_t32x64x64_split_k16_block_m_warp2_block_n_warp2_async_copyTrue_b_to_ldsTrue_b_preshuffleFalse_c_to_ldsFalse_gfx950,0.0,19.86,882.02
gfx950,256,32,384,7168,False,torch.bfloat16,torch.bfloat16,False,False,flydsl,39,16,6.7813,flydsl_gemm2_abf16_wbf16_bf16_t32x64x64_split_k16_block_m_warp2_block_n_warp2_async_copyTrue_b_to_ldsTrue_b_preshuffleFalse_c_to_ldsFalse_gfx950,0.0,25.98,883.06
gfx950,256,40,384,7168,False,torch.bfloat16,torch.bfloat16,False,False,flydsl,39,16,7.5812,flydsl_gemm2_abf16_wbf16_bf16_t32x64x64_split_k16_block_m_warp2_block_n_warp2_async_copyTrue_b_to_ldsTrue_b_preshuffleFalse_c_to_ldsFalse_gfx950,0.0,29.05,805.83
gfx950,256,48,384,7168,False,torch.bfloat16,torch.bfloat16,False,False,flydsl,217,8,7.6969,flydsl_gemm2_abf16_wbf16_bf16_t32x64x128_split_k8_block_m_warp2_block_n_warp2_async_copyTrue_b_to_ldsTrue_b_preshuffleFalse_c_to_ldsFalse_gfx950,0.0,34.33,809.42
gfx950,256,56,384,7168,False,torch.bfloat16,torch.bfloat16,False,False,flydsl,217,8,7.8879,flydsl_gemm2_abf16_wbf16_bf16_t32x64x128_split_k8_block_m_warp2_block_n_warp2_async_copyTrue_b_to_ldsTrue_b_preshuffleFalse_c_to_ldsFalse_gfx950,0.0,39.08,805.14
gfx950,256,64,384,7168,False,torch.bfloat16,torch.bfloat16,False,False,flydsl,217,8,7.9546,flydsl_gemm2_abf16_wbf16_bf16_t32x64x128_split_k8_block_m_warp2_block_n_warp2_async_copyTrue_b_to_ldsTrue_b_preshuffleFalse_c_to_ldsFalse_gfx950,0.0,44.29,813.58
gfx950,256,72,384,7168,False,torch.bfloat16,torch.bfloat16,False,False,flydsl,217,8,8.1726,flydsl_gemm2_abf16_wbf16_bf16_t32x64x128_split_k8_block_m_warp2_block_n_warp2_async_copyTrue_b_to_ldsTrue_b_preshuffleFalse_c_to_ldsFalse_gfx950,0.0,48.5,806.66
gfx950,256,80,384,7168,False,torch.bfloat16,torch.bfloat16,False,False,flydsl,217,8,8.2523,flydsl_gemm2_abf16_wbf16_bf16_t32x64x128_split_k8_block_m_warp2_block_n_warp2_async_copyTrue_b_to_ldsTrue_b_preshuffleFalse_c_to_ldsFalse_gfx950,0.0,53.37,813.51
gfx950,256,88,384,7168,False,torch.bfloat16,torch.bfloat16,False,False,asm,8,11,9.8537,_ZN5aiter39bf16gemm_fp32bf16_tn_96x64_splitk_cleanE,0.0254,49.16,693.56
gfx950,256,96,384,7168,False,torch.bfloat16,torch.bfloat16,False,False,asm,8,14,9.8386,_ZN5aiter39bf16gemm_fp32bf16_tn_96x64_splitk_cleanE,0.0287,53.72,706.91
gfx950,256,104,384,7168,False,torch.bfloat16,torch.bfloat16,False,False,flydsl,217,8,9.0301,flydsl_gemm2_abf16_wbf16_bf16_t32x64x128_split_k8_block_m_warp2_block_n_warp2_async_copyTrue_b_to_ldsTrue_b_preshuffleFalse_c_to_ldsFalse_gfx950,0.0,63.4,783.58
gfx950,256,112,384,7168,False,torch.bfloat16,torch.bfloat16,False,False,flydsl,217,8,9.0126,flydsl_gemm2_abf16_wbf16_bf16_t32x64x128_split_k8_block_m_warp2_block_n_warp2_async_copyTrue_b_to_ldsTrue_b_preshuffleFalse_c_to_ldsFalse_gfx950,0.0,68.41,798.52
gfx950,256,120,384,7168,False,torch.bfloat16,torch.bfloat16,False,False,flydsl,217,8,9.0081,flydsl_gemm2_abf16_wbf16_bf16_t32x64x128_split_k8_block_m_warp2_block_n_warp2_async_copyTrue_b_to_ldsTrue_b_preshuffleFalse_c_to_ldsFalse_gfx950,0.0,73.33,812.32
gfx950,256,136,384,7168,False,torch.bfloat16,torch.bfloat16,False,False,flydsl,307,8,11.2568,flydsl_gemm2_abf16_wbf16_bf16_t96x64x128_split_k8_block_m_warp2_block_n_warp2_async_copyTrue_b_to_ldsTrue_b_preshuffleFalse_c_to_ldsFalse_gfx950,0.0,66.51,671.52
gfx950,256,168,384,7168,False,torch.bfloat16,torch.bfloat16,False,False,asm,8,10,12.3531,_ZN5aiter39bf16gemm_fp32bf16_tn_96x64_splitk_cleanE,0.0249,74.87,651.05
gfx950,256,176,384,7168,False,torch.bfloat16,torch.bfloat16,False,False,asm,8,10,12.2978,_ZN5aiter39bf16gemm_fp32bf16_tn_96x64_splitk_cleanE,0.0245,78.79,663.8
gfx950,256,184,384,7168,False,torch.bfloat16,torch.bfloat16,False,False,asm,8,8,12.4417,_ZN5aiter39bf16gemm_fp32bf16_tn_96x64_splitk_cleanE,0.0218,81.41,665.84
gfx950,256,192,384,7168,False,torch.bfloat16,torch.bfloat16,False,False,flydsl,307,8,12.3237,flydsl_gemm2_abf16_wbf16_bf16_t96x64x128_split_k8_block_m_warp2_block_n_warp2_async_copyTrue_b_to_ldsTrue_b_preshuffleFalse_c_to_ldsFalse_gfx950,0.0,85.77,682.02
gfx950,256,200,384,7168,False,torch.bfloat16,torch.bfloat16,False,False,asm,3,6,12.7982,_ZN5aiter39bf16gemm_fp32bf16_tn_48x64_splitk_cleanE,0.0184,86.03,666.17
gfx950,256,208,384,7168,False,torch.bfloat16,torch.bfloat16,False,False,flydsl,277,8,11.9012,flydsl_gemm2_abf16_wbf16_bf16_t64x64x128_split_k8_block_m_warp2_block_n_warp2_async_copyTrue_b_to_ldsTrue_b_preshuffleFalse_c_to_ldsFalse_gfx950,0.0,96.21,726.54
gfx950,256,216,384,7168,False,torch.bfloat16,torch.bfloat16,False,False,flydsl,277,8,12.2349,flydsl_gemm2_abf16_wbf16_bf16_t64x64x128_split_k8_block_m_warp2_block_n_warp2_async_copyTrue_b_to_ldsTrue_b_preshuffleFalse_c_to_ldsFalse_gfx950,0.0,97.19,716.6
gfx950,256,224,384,7168,False,torch.bfloat16,torch.bfloat16,False,False,flydsl,277,8,12.1192,flydsl_gemm2_abf16_wbf16_bf16_t64x64x128_split_k8_block_m_warp2_block_n_warp2_async_copyTrue_b_to_ldsTrue_b_preshuffleFalse_c_to_ldsFalse_gfx950,0.0,101.75,733.41
gfx950,256,232,384,7168,False,torch.bfloat16,torch.bfloat16,False,False,asm,3,6,13.7502,_ZN5aiter39bf16gemm_fp32bf16_tn_48x64_splitk_cleanE,0.0185,92.88,655.2
gfx950,256,240,384,7168,False,torch.bfloat16,torch.bfloat16,False,False,asm,3,6,13.205,_ZN5aiter39bf16gemm_fp32bf16_tn_48x64_splitk_cleanE,0.0184,100.05,691.4
gfx950,256,248,384,7168,False,torch.bfloat16,torch.bfloat16,False,False,asm,3,6,13.0434,_ZN5aiter39bf16gemm_fp32bf16_tn_48x64_splitk_cleanE,0.0188,104.67,709.23
gfx950,256,256,384,7168,False,torch.bfloat16,torch.bfloat16,False,False,asm,1,5,13.2953,_ZN5aiter39bf16gemm_fp32bf16_tn_32x64_splitk_cleanE,0.0162,106.0,704.88
gfx950,256,264,384,7168,False,torch.bfloat16,torch.bfloat16,False,False,asm,3,6,13.997,_ZN5aiter39bf16gemm_fp32bf16_tn_48x64_splitk_cleanE,0.0187,103.83,678.18
gfx950,256,272,384,7168,False,torch.bfloat16,torch.bfloat16,False,False,asm,7,6,13.9879,_ZN5aiter39bf16gemm_fp32bf16_tn_80x64_splitk_cleanE,0.0185,107.05,687.26
gfx950,256,280,384,7168,False,torch.bfloat16,torch.bfloat16,False,False,asm,3,6,13.2923,_ZN5aiter39bf16gemm_fp32bf16_tn_48x64_splitk_cleanE,0.0185,115.96,732.31
gfx950,256,288,384,7168,False,torch.bfloat16,torch.bfloat16,False,False,asm,5,6,13.328,_ZN5aiter39bf16gemm_fp32bf16_tn_64x64_splitk_cleanE,0.0187,118.96,739.42
gfx950,256,296,384,7168,False,torch.bfloat16,torch.bfloat16,False,False,asm,5,6,13.5641,_ZN5aiter39bf16gemm_fp32bf16_tn_64x64_splitk_cleanE,0.0189,120.13,735.46
gfx950,256,304,384,7168,False,torch.bfloat16,torch.bfloat16,False,False,asm,3,6,13.6234,_ZN5aiter39bf16gemm_fp32bf16_tn_48x64_splitk_cleanE,0.0188,122.84,741.12
gfx950,256,312,384,7168,False,torch.bfloat16,torch.bfloat16,False,False,asm,5,6,14.4104,_ZN5aiter39bf16gemm_fp32bf16_tn_64x64_splitk_cleanE,0.0186,119.19,709.03
gfx950,256,320,384,7168,False,torch.bfloat16,torch.bfloat16,False,False,asm,3,6,13.5745,_ZN5aiter39bf16gemm_fp32bf16_tn_48x64_splitk_cleanE,0.019,129.77,761.6
gfx950,256,328,384,7168,False,torch.bfloat16,torch.bfloat16,False,False,asm,5,6,14.4505,_ZN5aiter39bf16gemm_fp32bf16_tn_64x64_splitk_cleanE,0.0189,124.95,723.79
gfx950,256,336,384,7168,False,torch.bfloat16,torch.bfloat16,False,False,asm,3,6,13.618,_ZN5aiter39bf16gemm_fp32bf16_tn_48x64_splitk_cleanE,0.0189,135.83,776.91
gfx950,256,344,384,7168,False,torch.bfloat16,torch.bfloat16,False,False,asm,3,5,14.2888,_ZN5aiter39bf16gemm_fp32bf16_tn_48x64_splitk_cleanE,0.0163,132.53,748.89
gfx950,256,352,384,7168,False,torch.bfloat16,torch.bfloat16,False,False,asm,5,6,14.1549,_ZN5aiter39bf16gemm_fp32bf16_tn_64x64_splitk_cleanE,0.0187,136.9,764.51
gfx950,256,360,384,7168,False,torch.bfloat16,torch.bfloat16,False,False,asm,5,6,14.2618,_ZN5aiter39bf16gemm_fp32bf16_tn_64x64_splitk_cleanE,0.0188,138.96,767.26
gfx950,256,368,384,7168,False,torch.bfloat16,torch.bfloat16,False,False,asm,7,6,14.5374,_ZN5aiter39bf16gemm_fp32bf16_tn_80x64_splitk_cleanE,0.0185,139.35,761.02
gfx950,256,376,384,7168,False,torch.bfloat16,torch.bfloat16,False,False,asm,5,5,14.5684,_ZN5aiter39bf16gemm_fp32bf16_tn_64x64_splitk_cleanE,0.0158,142.08,767.7
gfx950,256,384,384,7168,False,torch.bfloat16,torch.bfloat16,False,False,asm,3,5,14.0534,_ZN5aiter39bf16gemm_fp32bf16_tn_48x64_splitk_cleanE,0.0164,150.42,804.43
gfx950,256,392,384,7168,False,torch.bfloat16,torch.bfloat16,False,False,asm,5,5,14.4563,_ZN5aiter39bf16gemm_fp32bf16_tn_64x64_splitk_cleanE,0.0162,149.28,790.37
gfx950,256,400,384,7168,False,torch.bfloat16,torch.bfloat16,False,False,asm,5,5,14.3612,_ZN5aiter39bf16gemm_fp32bf16_tn_64x64_splitk_cleanE,0.0162,153.33,804.02
gfx950,256,408,384,7168,False,torch.bfloat16,torch.bfloat16,False,False,asm,5,5,13.865,_ZN5aiter39bf16gemm_fp32bf16_tn_64x64_splitk_cleanE,0.0162,161.99,841.5
gfx950,256,416,384,7168,False,torch.bfloat16,torch.bfloat16,False,False,asm,5,5,14.7943,_ZN5aiter39bf16gemm_fp32bf16_tn_64x64_splitk_cleanE,0.0163,154.8,796.81
gfx950,256,424,384,7168,False,torch.bfloat16,torch.bfloat16,False,False,asm,5,5,14.716,_ZN5aiter39bf16gemm_fp32bf16_tn_64x64_splitk_cleanE,0.0163,158.61,809.26
gfx950,256,432,384,7168,False,torch.bfloat16,torch.bfloat16,False,False,asm,5,5,14.7842,_ZN5aiter39bf16gemm_fp32bf16_tn_64x64_splitk_cleanE,0.0163,160.86,813.7
gfx950,256,440,384,7168,False,torch.bfloat16,torch.bfloat16,False,False,asm,5,5,15.2959,_ZN5aiter39bf16gemm_fp32bf16_tn_64x64_splitk_cleanE,0.0161,158.36,794.38
gfx950,256,448,384,7168,False,torch.bfloat16,torch.bfloat16,False,False,asm,7,5,14.6067,_ZN5aiter39bf16gemm_fp32bf16_tn_80x64_splitk_cleanE,0.0162,168.84,840.14
gfx950,256,456,384,7168,False,torch.bfloat16,torch.bfloat16,False,False,asm,5,5,15.0889,_ZN5aiter39bf16gemm_fp32bf16_tn_64x64_splitk_cleanE,0.0163,166.37,821.3
gfx950,256,464,384,7168,False,torch.bfloat16,torch.bfloat16,False,False,asm,5,5,15.177,_ZN5aiter39bf16gemm_fp32bf16_tn_64x64_splitk_cleanE,0.0162,168.3,824.49
gfx950,256,472,384,7168,False,torch.bfloat16,torch.bfloat16,False,False,asm,7,5,15.4615,_ZN5aiter39bf16gemm_fp32bf16_tn_80x64_splitk_cleanE,0.0162,168.05,817.13
gfx950,256,480,384,7168,False,torch.bfloat16,torch.bfloat16,False,False,asm,5,5,15.2604,_ZN5aiter39bf16gemm_fp32bf16_tn_64x64_splitk_cleanE,0.0162,173.15,835.82
gfx950,256,488,384,7168,False,torch.bfloat16,torch.bfloat16,False,False,asm,7,5,15.3556,_ZN5aiter39bf16gemm_fp32bf16_tn_80x64_splitk_cleanE,0.0161,174.95,838.51
gfx950,256,496,384,7168,False,torch.bfloat16,torch.bfloat16,False,False,asm,7,6,15.6215,_ZN5aiter39bf16gemm_fp32bf16_tn_80x64_splitk_cleanE,0.0185,174.79,831.97
gfx950,256,504,384,7168,False,torch.bfloat16,torch.bfloat16,False,False,asm,7,5,15.4477,_ZN5aiter39bf16gemm_fp32bf16_tn_80x64_splitk_cleanE,0.016,179.61,849.15
gfx950,256,512,384,7168,False,torch.bfloat16,torch.bfloat16,False,False,asm,5,5,15.6923,_ZN5aiter39bf16gemm_fp32bf16_tn_64x64_splitk_cleanE,0.0161,179.61,843.62
gfx950,256,1,1024,7168,False,torch.bfloat16,torch.bfloat16,False,False,flydsl,217,8,7.6212,flydsl_gemm2_abf16_wbf16_bf16_t32x64x128_split_k8_block_m_warp2_block_n_warp2_async_copyTrue_b_to_ldsTrue_b_preshuffleFalse_c_to_ldsFalse_gfx950,0.0,1.93,1928.36
gfx950,256,2,1024,7168,False,torch.bfloat16,torch.bfloat16,False,False,flydsl,39,16,7.6834,flydsl_gemm2_abf16_wbf16_bf16_t32x64x64_split_k16_block_m_warp2_block_n_warp2_async_copyTrue_b_to_ldsTrue_b_preshuffleFalse_c_to_ldsFalse_gfx950,0.0,3.82,1914.87
gfx950,256,4,1024,7168,False,torch.bfloat16,torch.bfloat16,False,False,flydsl,39,16,7.8479,flydsl_gemm2_abf16_wbf16_bf16_t32x64x64_split_k16_block_m_warp2_block_n_warp2_async_copyTrue_b_to_ldsTrue_b_preshuffleFalse_c_to_ldsFalse_gfx950,0.0,7.48,1878.93
gfx950,256,8,1024,7168,False,torch.bfloat16,torch.bfloat16,False,False,flydsl,39,16,7.9012,flydsl_gemm2_abf16_wbf16_bf16_t32x64x64_split_k16_block_m_warp2_block_n_warp2_async_copyTrue_b_to_ldsTrue_b_preshuffleFalse_c_to_ldsFalse_gfx950,0.0,14.86,1874.54
gfx950,256,16,1024,7168,False,torch.bfloat16,torch.bfloat16,False,False,flydsl,217,8,7.9634,flydsl_gemm2_abf16_wbf16_bf16_t32x64x128_split_k8_block_m_warp2_block_n_warp2_async_copyTrue_b_to_ldsTrue_b_preshuffleFalse_c_to_ldsFalse_gfx950,0.0,29.49,1876.35
gfx950,256,24,1024,7168,False,torch.bfloat16,torch.bfloat16,False,False,flydsl,217,8,8.4746,flydsl_gemm2_abf16_wbf16_bf16_t32x64x128_split_k8_block_m_warp2_block_n_warp2_async_copyTrue_b_to_ldsTrue_b_preshuffleFalse_c_to_ldsFalse_gfx950,0.0,41.57,1778.65
gfx950,256,32,1024,7168,False,torch.bfloat16,torch.bfloat16,False,False,flydsl,217,8,8.8126,flydsl_gemm2_abf16_wbf16_bf16_t32x64x128_split_k8_block_m_warp2_block_n_warp2_async_copyTrue_b_to_ldsTrue_b_preshuffleFalse_c_to_ldsFalse_gfx950,0.0,53.31,1725.31
gfx950,256,40,1024,7168,False,torch.bfloat16,torch.bfloat16,False,False,flydsl,277,8,9.959,flydsl_gemm2_abf16_wbf16_bf16_t64x64x128_split_k8_block_m_warp2_block_n_warp2_async_copyTrue_b_to_ldsTrue_b_preshuffleFalse_c_to_ldsFalse_gfx950,0.0,58.96,1539.86
gfx950,256,72,1024,7168,False,torch.bfloat16,torch.bfloat16,False,False,asm,7,7,14.202,_ZN5aiter39bf16gemm_fp32bf16_tn_80x64_splitk_cleanE,0.0197,74.42,1116.72
gfx950,256,80,1024,7168,False,torch.bfloat16,torch.bfloat16,False,False,asm,3,6,13.5885,_ZN5aiter39bf16gemm_fp32bf16_tn_48x64_splitk_cleanE,0.0179,86.43,1176.79
gfx950,256,88,1024,7168,False,torch.bfloat16,torch.bfloat16,False,False,asm,5,7,13.365,_ZN5aiter39bf16gemm_fp32bf16_tn_64x64_splitk_cleanE,0.0192,96.66,1206.27
gfx950,256,96,1024,7168,False,torch.bfloat16,torch.bfloat16,False,False,asm,3,8,13.5905,_ZN5aiter39bf16gemm_fp32bf16_tn_48x64_splitk_cleanE,0.0212,103.7,1195.9
gfx950,256,104,1024,7168,False,torch.bfloat16,torch.bfloat16,False,False,asm,3,5,14.1683,_ZN5aiter39bf16gemm_fp32bf16_tn_48x64_splitk_cleanE,0.0157,107.76,1156.38
gfx950,256,112,1024,7168,False,torch.bfloat16,torch.bfloat16,False,False,asm,5,7,13.7867,_ZN5aiter39bf16gemm_fp32bf16_tn_64x64_splitk_cleanE,0.0199,119.26,1197.9
gfx950,256,120,1024,7168,False,torch.bfloat16,torch.bfloat16,False,False,asm,3,5,13.8184,_ZN5aiter39bf16gemm_fp32bf16_tn_48x64_splitk_cleanE,0.0159,127.48,1204.64
gfx950,256,128,1024,7168,False,torch.bfloat16,torch.bfloat16,False,False,asm,3,5,13.7146,_ZN5aiter39bf16gemm_fp32bf16_tn_48x64_splitk_cleanE,0.0159,137.01,1223.31
gfx950,256,136,1024,7168,False,torch.bfloat16,torch.bfloat16,False,False,asm,3,5,14.0374,_ZN5aiter39bf16gemm_fp32bf16_tn_48x64_splitk_cleanE,0.0166,142.23,1204.52
gfx950,256,144,1024,7168,False,torch.bfloat16,torch.bfloat16,False,False,asm,7,6,14.6981,_ZN5aiter39bf16gemm_fp32bf16_tn_80x64_splitk_cleanE,0.0185,143.82,1159.29
gfx950,256,152,1024,7168,False,torch.bfloat16,torch.bfloat16,False,False,asm,7,6,14.7928,_ZN5aiter39bf16gemm_fp32bf16_tn_80x64_splitk_cleanE,0.0186,150.84,1160.73
gfx950,256,160,1024,7168,False,torch.bfloat16,torch.bfloat16,False,False,asm,5,5,15.0151,_ZN5aiter39bf16gemm_fp32bf16_tn_64x64_splitk_cleanE,0.0161,156.43,1152.27
gfx950,256,168,1024,7168,False,torch.bfloat16,torch.bfloat16,False,False,asm,5,5,14.9258,_ZN5aiter39bf16gemm_fp32bf16_tn_64x64_splitk_cleanE,0.0162,165.23,1167.95
gfx950,256,176,1024,7168,False,torch.bfloat16,torch.bfloat16,False,False,asm,7,5,15.2082,_ZN5aiter39bf16gemm_fp32bf16_tn_80x64_splitk_cleanE,0.0162,169.89,1154.88
gfx950,256,184,1024,7168,False,torch.bfloat16,torch.bfloat16,False,False,asm,7,5,14.7758,_ZN5aiter39bf16gemm_fp32bf16_tn_80x64_splitk_cleanE,0.0163,182.81,1197.55
gfx950,256,192,1024,7168,False,torch.bfloat16,torch.bfloat16,False,False,asm,5,5,14.6664,_ZN5aiter39bf16gemm_fp32bf16_tn_64x64_splitk_cleanE,0.0162,192.18,1215.42
gfx950,256,200,1024,7168,False,torch.bfloat16,torch.bfloat16,False,False,asm,8,5,15.7943,_ZN5aiter39bf16gemm_fp32bf16_tn_96x64_splitk_cleanE,0.0164,185.89,1136.92
gfx950,256,208,1024,7168,False,torch.bfloat16,torch.bfloat16,False,False,asm,7,5,15.5239,_ZN5aiter39bf16gemm_fp32bf16_tn_80x64_splitk_cleanE,0.0162,196.69,1165.17
gfx950,256,216,1024,7168,False,torch.bfloat16,torch.bfloat16,False,False,asm,7,5,15.5874,_ZN5aiter39bf16gemm_fp32bf16_tn_80x64_splitk_cleanE,0.0163,203.43,1168.83
gfx950,256,224,1024,7168,False,torch.bfloat16,torch.bfloat16,False,False,asm,5,4,16.4255,_ZN5aiter39bf16gemm_fp32bf16_tn_64x64_splitk_cleanE,0.0143,200.2,1117.17
gfx950,256,232,1024,7168,False,torch.bfloat16,torch.bfloat16,False,False,asm,8,5,16.0293,_ZN5aiter39bf16gemm_fp32bf16_tn_96x64_splitk_cleanE,0.0162,212.47,1152.96
gfx950,256,240,1024,7168,False,torch.bfloat16,torch.bfloat16,False,False,asm,7,5,15.7945,_ZN5aiter39bf16gemm_fp32bf16_tn_80x64_splitk_cleanE,0.0159,223.07,1178.4
gfx950,256,248,1024,7168,False,torch.bfloat16,torch.bfloat16,False,False,asm,5,4,16.5684,_ZN5aiter39bf16gemm_fp32bf16_tn_64x64_splitk_cleanE,0.0139,219.73,1131.27
gfx950,256,256,1024,7168,False,torch.bfloat16,torch.bfloat16,False,False,asm,8,5,16.2678,_ZN5aiter39bf16gemm_fp32bf16_tn_96x64_splitk_cleanE,0.0162,231.01,1160.23
gfx950,256,264,1024,7168,False,torch.bfloat16,torch.bfloat16,False,False,asm,8,5,16.408,_ZN5aiter39bf16gemm_fp32bf16_tn_96x64_splitk_cleanE,0.0162,236.2,1158.3
gfx950,256,272,1024,7168,False,torch.bfloat16,torch.bfloat16,False,False,asm,8,5,16.465,_ZN5aiter39bf16gemm_fp32bf16_tn_96x64_splitk_cleanE,0.0162,242.51,1162.25
gfx950,256,280,1024,7168,False,torch.bfloat16,torch.bfloat16,False,False,asm,8,5,16.8196,_ZN5aiter39bf16gemm_fp32bf16_tn_96x64_splitk_cleanE,0.0161,244.38,1145.54
gfx950,256,288,1024,7168,False,torch.bfloat16,torch.bfloat16,False,False,asm,8,5,17.1636,_ZN5aiter39bf16gemm_fp32bf16_tn_96x64_splitk_cleanE,0.0162,246.33,1130.22
gfx950,256,296,1024,7168,False,torch.bfloat16,torch.bfloat16,False,False,asm,7,4,17.3667,_ZN5aiter39bf16gemm_fp32bf16_tn_80x64_splitk_cleanE,0.0138,250.21,1124.55
gfx950,256,304,1024,7168,False,torch.bfloat16,torch.bfloat16,False,False,asm,7,4,17.623,_ZN5aiter39bf16gemm_fp32bf16_tn_80x64_splitk_cleanE,0.0137,253.23,1115.63
gfx950,256,312,1024,7168,False,torch.bfloat16,torch.bfloat16,False,False,asm,7,4,17.8372,_ZN5aiter39bf16gemm_fp32bf16_tn_80x64_splitk_cleanE,0.0138,256.78,1109.58
gfx950,256,320,1024,7168,False,torch.bfloat16,torch.bfloat16,False,False,asm,7,4,17.7354,_ZN5aiter39bf16gemm_fp32bf16_tn_80x64_splitk_cleanE,0.0138,264.87,1123.34
gfx950,256,328,1024,7168,False,torch.bfloat16,torch.bfloat16,False,False,asm,8,4,18.226,_ZN5aiter39bf16gemm_fp32bf16_tn_96x64_splitk_cleanE,0.0137,264.19,1100.3
gfx950,256,336,1024,7168,False,torch.bfloat16,torch.bfloat16,False,False,asm,8,4,18.1608,_ZN5aiter39bf16gemm_fp32bf16_tn_96x64_splitk_cleanE,0.0139,271.6,1111.46
gfx950,256,344,1024,7168,False,torch.bfloat16,torch.bfloat16,False,False,asm,8,4,18.5378,_ZN5aiter39bf16gemm_fp32bf16_tn_96x64_splitk_cleanE,0.0137,272.41,1095.93
gfx950,256,352,1024,7168,False,torch.bfloat16,torch.bfloat16,False,False,asm,8,4,18.3661,_ZN5aiter39bf16gemm_fp32bf16_tn_96x64_splitk_cleanE,0.0137,281.35,1113.31
gfx950,256,360,1024,7168,False,torch.bfloat16,torch.bfloat16,False,False,asm,8,4,18.675,_ZN5aiter39bf16gemm_fp32bf16_tn_96x64_splitk_cleanE,0.0137,282.99,1101.92
gfx950,256,368,1024,7168,False,torch.bfloat16,torch.bfloat16,False,False,asm,8,4,18.8126,_ZN5aiter39bf16gemm_fp32bf16_tn_96x64_splitk_cleanE,0.0138,287.16,1100.82
gfx950,256,376,1024,7168,False,torch.bfloat16,torch.bfloat16,False,False,asm,8,4,18.9182,_ZN5aiter39bf16gemm_fp32bf16_tn_96x64_splitk_cleanE,0.0139,291.77,1101.61
gfx950,256,384,1024,7168,False,torch.bfloat16,torch.bfloat16,False,False,asm,8,4,18.9233,_ZN5aiter39bf16gemm_fp32bf16_tn_96x64_splitk_cleanE,0.0139,297.89,1108.24
gfx950,256,392,1024,7168,False,torch.bfloat16,torch.bfloat16,False,False,flydsl,334,4,27.1104,flydsl_gemm2_abf16_wbf16_bf16_t128x64x128_split_k4_block_m_warp1_block_n_warp4_async_copyTrue_b_to_ldsFalse_b_preshuffleFalse_c_to_ldsFalse_gfx950,0.0,212.26,778.39
gfx950,256,400,1024,7168,False,torch.bfloat16,torch.bfloat16,False,False,flydsl,334,4,26.8482,flydsl_gemm2_abf16_wbf16_bf16_t128x64x128_split_k4_block_m_warp1_block_n_warp4_async_copyTrue_b_to_ldsFalse_b_preshuffleFalse_c_to_ldsFalse_gfx950,0.0,218.71,790.88
gfx950,256,2,7168,512,False,torch.bfloat16,torch.bfloat16,False,False,flydsl,235,4,5.7057,flydsl_gemm2_abf16_wbf16_bf16_t32x256x128_split_k4_block_m_warp2_block_n_warp2_async_copyTrue_b_to_ldsTrue_b_preshuffleFalse_c_to_ldsFalse_gfx950,0.0,2.57,1291.83
gfx950,256,4,7168,512,False,torch.bfloat16,torch.bfloat16,False,False,flydsl,211,1,5.2213,flydsl_gemm2_abf16_wbf16_bf16_t32x64x128_split_k1_block_m_warp2_block_n_warp2_async_copyTrue_b_to_ldsTrue_b_preshuffleFalse_c_to_ldsFalse_gfx950,0.0,5.62,1417.54
gfx950,256,8,7168,512,False,torch.bfloat16,torch.bfloat16,False,False,flydsl,211,1,5.2301,flydsl_gemm2_abf16_wbf16_bf16_t32x64x128_split_k1_block_m_warp2_block_n_warp2_async_copyTrue_b_to_ldsTrue_b_preshuffleFalse_c_to_ldsFalse_gfx950,0.0,11.23,1426.91
gfx950,256,16,7168,512,False,torch.bfloat16,torch.bfloat16,False,False,flydsl,211,1,5.2524,flydsl_gemm2_abf16_wbf16_bf16_t32x64x128_split_k1_block_m_warp2_block_n_warp2_async_copyTrue_b_to_ldsTrue_b_preshuffleFalse_c_to_ldsFalse_gfx950,0.0,22.36,1444.24
gfx950,256,24,7168,512,False,torch.bfloat16,torch.bfloat16,False,False,flydsl,211,1,5.2079,flydsl_gemm2_abf16_wbf16_bf16_t32x64x128_split_k1_block_m_warp2_block_n_warp2_async_copyTrue_b_to_ldsTrue_b_preshuffleFalse_c_to_ldsFalse_gfx950,0.0,33.83,1480.19
gfx950,256,32,7168,512,False,torch.bfloat16,torch.bfloat16,False,False,flydsl,211,1,5.3101,flydsl_gemm2_abf16_wbf16_bf16_t32x64x128_split_k1_block_m_warp2_block_n_warp2_async_copyTrue_b_to_ldsTrue_b_preshuffleFalse_c_to_ldsFalse_gfx950,0.0,44.23,1474.84
gfx950,256,40,7168,512,False,torch.bfloat16,torch.bfloat16,False,False,asm,4,1,6.4351,_ZN5aiter37bf16gemm_fp32bf16_tn_48x64_pf3_splitkE,0.0,45.62,1236.1
gfx950,256,48,7168,512,False,torch.bfloat16,torch.bfloat16,False,False,flydsl,211,1,5.7057,flydsl_gemm2_abf16_wbf16_bf16_t32x64x128_split_k1_block_m_warp2_block_n_warp2_async_copyTrue_b_to_ldsTrue_b_preshuffleFalse_c_to_ldsFalse_gfx950,0.0,61.75,1415.66
gfx950,256,56,7168,512,False,torch.bfloat16,torch.bfloat16,False,False,asm,2,1,6.2766,_ZN5aiter37bf16gemm_fp32bf16_tn_32x64_pf3_splitkE,0.0,65.49,1306.47
gfx950,256,64,7168,512,False,torch.bfloat16,torch.bfloat16,False,False,flydsl,211,1,5.8301,flydsl_gemm2_abf16_wbf16_bf16_t32x64x128_split_k1_block_m_warp2_block_n_warp2_async_copyTrue_b_to_ldsTrue_b_preshuffleFalse_c_to_ldsFalse_gfx950,0.0,80.58,1427.6
gfx950,256,72,7168,512,False,torch.bfloat16,torch.bfloat16,False,False,asm,4,1,6.5373,_ZN5aiter37bf16gemm_fp32bf16_tn_48x64_pf3_splitkE,0.0,80.84,1291.96
gfx950,256,80,7168,512,False,torch.bfloat16,torch.bfloat16,False,False,asm,6,1,6.8603,_ZN5aiter37bf16gemm_fp32bf16_tn_64x64_pf3_splitkE,0.0,85.59,1249.05
gfx950,256,96,7168,512,False,torch.bfloat16,torch.bfloat16,False,False,asm,6,1,6.8492,_ZN5aiter37bf16gemm_fp32bf16_tn_64x64_pf3_splitkE,0.0,102.88,1286.95
gfx950,256,104,7168,512,False,torch.bfloat16,torch.bfloat16,False,False,asm,6,1,6.8366,_ZN5aiter37bf16gemm_fp32bf16_tn_64x64_pf3_splitkE,0.0,111.66,1307.3
gfx950,256,112,7168,512,False,torch.bfloat16,torch.bfloat16,False,False,asm,6,1,6.839,_ZN5aiter37bf16gemm_fp32bf16_tn_64x64_pf3_splitkE,0.0,120.21,1324.81
gfx950,256,128,7168,512,False,torch.bfloat16,torch.bfloat16,False,False,asm,6,1,7.0215,_ZN5aiter37bf16gemm_fp32bf16_tn_64x64_pf3_splitkE,0.0,133.81,1325.37
gfx950,256,136,7168,512,False,torch.bfloat16,torch.bfloat16,False,False,flydsl,91,1,7.6926,flydsl_gemm2_abf16_wbf16_bf16_t64x64x64_split_k1_block_m_warp2_block_n_warp2_async_copyTrue_b_to_ldsTrue_b_preshuffleFalse_c_to_ldsFalse_gfx950,0.0,129.77,1225.73
gfx950,256,144,7168,512,False,torch.bfloat16,torch.bfloat16,False,False,flydsl,91,1,7.6612,flydsl_gemm2_abf16_wbf16_bf16_t64x64x64_split_k1_block_m_warp2_block_n_warp2_async_copyTrue_b_to_ldsTrue_b_preshuffleFalse_c_to_ldsFalse_gfx950,0.0,137.96,1246.78
gfx950,256,152,7168,512,False,torch.bfloat16,torch.bfloat16,False,False,flydsl,91,1,7.6968,flydsl_gemm2_abf16_wbf16_bf16_t64x64x64_split_k1_block_m_warp2_block_n_warp2_async_copyTrue_b_to_ldsTrue_b_preshuffleFalse_c_to_ldsFalse_gfx950,0.0,144.95,1256.99
gfx950,256,160,7168,512,False,torch.bfloat16,torch.bfloat16,False,False,flydsl,91,1,7.7593,flydsl_gemm2_abf16_wbf16_bf16_t64x64x64_split_k1_block_m_warp2_block_n_warp2_async_copyTrue_b_to_ldsTrue_b_preshuffleFalse_c_to_ldsFalse_gfx950,0.0,151.35,1262.69
gfx950,256,168,7168,512,False,torch.bfloat16,torch.bfloat16,False,False,asm,9,1,7.7434,_ZN5aiter37bf16gemm_fp32bf16_tn_96x64_pf3_splitkE,0.0,159.25,1281.16
gfx950,256,192,7168,512,False,torch.bfloat16,torch.bfloat16,False,False,asm,9,1,7.1076,_ZN5aiter37bf16gemm_fp32bf16_tn_96x64_pf3_splitkE,0.0,198.28,1447.63
gfx950,256,208,7168,512,False,torch.bfloat16,torch.bfloat16,False,False,flydsl,91,1,8.4168,flydsl_gemm2_abf16_wbf16_bf16_t64x64x64_split_k1_block_m_warp2_block_n_warp2_async_copyTrue_b_to_ldsTrue_b_preshuffleFalse_c_to_ldsFalse_gfx950,0.0,181.39,1251.66
gfx950,256,224,7168,512,False,torch.bfloat16,torch.bfloat16,False,False,flydsl,91,1,8.4301,flydsl_gemm2_abf16_wbf16_bf16_t64x64x64_split_k1_block_m_warp2_block_n_warp2_async_copyTrue_b_to_ldsTrue_b_preshuffleFalse_c_to_ldsFalse_gfx950,0.0,195.04,1278.83
gfx950,256,240,7168,512,False,torch.bfloat16,torch.bfloat16,False,False,flydsl,91,1,8.4392,flydsl_gemm2_abf16_wbf16_bf16_t64x64x64_split_k1_block_m_warp2_block_n_warp2_async_copyTrue_b_to_ldsTrue_b_preshuffleFalse_c_to_ldsFalse_gfx950,0.0,208.74,1306.57
gfx950,256,248,7168,512,False,torch.bfloat16,torch.bfloat16,False,False,flydsl,91,1,8.4123,flydsl_gemm2_abf16_wbf16_bf16_t64x64x64_split_k1_block_m_warp2_block_n_warp2_async_copyTrue_b_to_ldsTrue_b_preshuffleFalse_c_to_ldsFalse_gfx950,0.0,216.39,1325.35
gfx950,256,264,7168,512,False,torch.bfloat16,torch.bfloat16,False,False,flydsl,121,1,8.5724,flydsl_gemm2_abf16_wbf16_bf16_t96x64x64_split_k1_block_m_warp2_block_n_warp2_async_copyTrue_b_to_ldsTrue_b_preshuffleFalse_c_to_ldsFalse_gfx950,0.0,226.05,1329.27
gfx950,256,272,7168,512,False,torch.bfloat16,torch.bfloat16,False,False,flydsl,121,1,8.6837,flydsl_gemm2_abf16_wbf16_bf16_t96x64x64_split_k1_block_m_warp2_block_n_warp2_async_copyTrue_b_to_ldsTrue_b_preshuffleFalse_c_to_ldsFalse_gfx950,0.0,229.91,1326.39
gfx950,256,280,7168,512,False,torch.bfloat16,torch.bfloat16,False,False,flydsl,121,1,8.6968,flydsl_gemm2_abf16_wbf16_bf16_t96x64x64_split_k1_block_m_warp2_block_n_warp2_async_copyTrue_b_to_ldsTrue_b_preshuffleFalse_c_to_ldsFalse_gfx950,0.0,236.32,1338.52
gfx950,256,288,7168,512,False,torch.bfloat16,torch.bfloat16,False,False,flydsl,121,1,8.6123,flydsl_gemm2_abf16_wbf16_bf16_t96x64x64_split_k1_block_m_warp2_block_n_warp2_async_copyTrue_b_to_ldsTrue_b_preshuffleFalse_c_to_ldsFalse_gfx950,0.0,245.45,1365.91
gfx950,256,296,7168,512,False,torch.bfloat16,torch.bfloat16,False,False,flydsl,121,1,9.3946,flydsl_gemm2_abf16_wbf16_bf16_t96x64x64_split_k1_block_m_warp2_block_n_warp2_async_copyTrue_b_to_ldsTrue_b_preshuffleFalse_c_to_ldsFalse_gfx950,0.0,231.27,1265.26
gfx950,256,304,7168,512,False,torch.bfloat16,torch.bfloat16,False,False,flydsl,121,1,9.3279,flydsl_gemm2_abf16_wbf16_bf16_t96x64x64_split_k1_block_m_warp2_block_n_warp2_async_copyTrue_b_to_ldsTrue_b_preshuffleFalse_c_to_ldsFalse_gfx950,0.0,239.21,1287.48
gfx950,256,312,7168,512,False,torch.bfloat16,torch.bfloat16,False,False,flydsl,121,1,9.4482,flydsl_gemm2_abf16_wbf16_bf16_t96x64x64_split_k1_block_m_warp2_block_n_warp2_async_copyTrue_b_to_ldsTrue_b_preshuffleFalse_c_to_ldsFalse_gfx950,0.0,242.38,1284.09
gfx950,256,320,7168,512,False,torch.bfloat16,torch.bfloat16,False,False,flydsl,121,1,9.4168,flydsl_gemm2_abf16_wbf16_bf16_t96x64x64_split_k1_block_m_warp2_block_n_warp2_async_copyTrue_b_to_ldsTrue_b_preshuffleFalse_c_to_ldsFalse_gfx950,0.0,249.43,1301.43
gfx950,256,328,7168,512,False,torch.bfloat16,torch.bfloat16,False,False,flydsl,121,1,9.5059,flydsl_gemm2_abf16_wbf16_bf16_t96x64x64_split_k1_block_m_warp2_block_n_warp2_async_copyTrue_b_to_ldsTrue_b_preshuffleFalse_c_to_ldsFalse_gfx950,0.0,253.27,1302.15
gfx950,256,336,7168,512,False,torch.bfloat16,torch.bfloat16,False,False,flydsl,121,1,9.3812,flydsl_gemm2_abf16_wbf16_bf16_t96x64x64_split_k1_block_m_warp2_block_n_warp2_async_copyTrue_b_to_ldsTrue_b_preshuffleFalse_c_to_ldsFalse_gfx950,0.0,262.89,1332.55
gfx950,256,344,7168,512,False,torch.bfloat16,torch.bfloat16,False,False,flydsl,301,1,9.2258,flydsl_gemm2_abf16_wbf16_bf16_t96x64x128_split_k1_block_m_warp2_block_n_warp2_async_copyTrue_b_to_ldsTrue_b_preshuffleFalse_c_to_ldsFalse_gfx950,0.0,273.69,1368.33
gfx950,256,352,7168,512,False,torch.bfloat16,torch.bfloat16,False,False,flydsl,121,1,9.9193,flydsl_gemm2_abf16_wbf16_bf16_t96x64x64_split_k1_block_m_warp2_block_n_warp2_async_copyTrue_b_to_ldsTrue_b_preshuffleFalse_c_to_ldsFalse_gfx950,0.0,260.47,1285.04
gfx950,256,360,7168,512,False,torch.bfloat16,torch.bfloat16,False,False,flydsl,121,1,9.439,flydsl_gemm2_abf16_wbf16_bf16_t96x64x64_split_k1_block_m_warp2_block_n_warp2_async_copyTrue_b_to_ldsTrue_b_preshuffleFalse_c_to_ldsFalse_gfx950,0.0,279.95,1363.45
gfx950,256,368,7168,512,False,torch.bfloat16,torch.bfloat16,False,False,flydsl,121,1,9.3323,flydsl_gemm2_abf16_wbf16_bf16_t96x64x64_split_k1_block_m_warp2_block_n_warp2_async_copyTrue_b_to_ldsTrue_b_preshuffleFalse_c_to_ldsFalse_gfx950,0.0,289.44,1392.2
gfx950,256,376,7168,512,False,torch.bfloat16,torch.bfloat16,False,False,flydsl,121,1,9.3857,flydsl_gemm2_abf16_wbf16_bf16_t96x64x64_split_k1_block_m_warp2_block_n_warp2_async_copyTrue_b_to_ldsTrue_b_preshuffleFalse_c_to_ldsFalse_gfx950,0.0,294.05,1397.39
gfx950,256,384,7168,512,False,torch.bfloat16,torch.bfloat16,False,False,flydsl,121,1,9.4657,flydsl_gemm2_abf16_wbf16_bf16_t96x64x64_split_k1_block_m_warp2_block_n_warp2_async_copyTrue_b_to_ldsTrue_b_preshuffleFalse_c_to_ldsFalse_gfx950,0.0,297.77,1398.56
gfx950,256,392,7168,512,False,torch.bfloat16,torch.bfloat16,False,False,flydsl,151,1,9.9282,flydsl_gemm2_abf16_wbf16_bf16_t128x64x64_split_k1_block_m_warp2_block_n_warp2_async_copyTrue_b_to_ldsTrue_b_preshuffleFalse_c_to_ldsFalse_gfx950,0.0,289.81,1345.77
gfx950,256,400,7168,512,False,torch.bfloat16,torch.bfloat16,False,False,flydsl,151,1,10.0169,flydsl_gemm2_abf16_wbf16_bf16_t128x64x64_split_k1_block_m_warp2_block_n_warp2_async_copyTrue_b_to_ldsTrue_b_preshuffleFalse_c_to_ldsFalse_gfx950,0.0,293.11,1346.13
gfx950,256,408,7168,512,False,torch.bfloat16,torch.bfloat16,False,False,flydsl,151,1,10.506,flydsl_gemm2_abf16_wbf16_bf16_t128x64x64_split_k1_block_m_warp2_block_n_warp2_async_copyTrue_b_to_ldsTrue_b_preshuffleFalse_c_to_ldsFalse_gfx950,0.0,285.05,1295.16
gfx950,256,416,7168,512,False,torch.bfloat16,torch.bfloat16,False,False,flydsl,151,1,9.8214,flydsl_gemm2_abf16_wbf16_bf16_t128x64x64_split_k1_block_m_warp2_block_n_warp2_async_copyTrue_b_to_ldsTrue_b_preshuffleFalse_c_to_ldsFalse_gfx950,0.0,310.9,1397.94
gfx950,256,424,7168,512,False,torch.bfloat16,torch.bfloat16,False,False,flydsl,151,1,10.0524,flydsl_gemm2_abf16_wbf16_bf16_t128x64x64_split_k1_block_m_warp2_block_n_warp2_async_copyTrue_b_to_ldsTrue_b_preshuffleFalse_c_to_ldsFalse_gfx950,0.0,309.59,1378.04
gfx950,256,432,7168,512,False,torch.bfloat16,torch.bfloat16,False,False,flydsl,151,1,10.3771,flydsl_gemm2_abf16_wbf16_bf16_t128x64x64_split_k1_block_m_warp2_block_n_warp2_async_copyTrue_b_to_ldsTrue_b_preshuffleFalse_c_to_ldsFalse_gfx950,0.0,305.57,1346.77
gfx950,256,440,7168,512,False,torch.bfloat16,torch.bfloat16,False,False,flydsl,151,1,9.8701,flydsl_gemm2_abf16_wbf16_bf16_t128x64x64_split_k1_block_m_warp2_block_n_warp2_async_copyTrue_b_to_ldsTrue_b_preshuffleFalse_c_to_ldsFalse_gfx950,0.0,327.21,1428.4
gfx950,256,448,7168,512,False,torch.bfloat16,torch.bfloat16,False,False,flydsl,151,1,10.1638,flydsl_gemm2_abf16_wbf16_bf16_t128x64x64_split_k1_block_m_warp2_block_n_warp2_async_copyTrue_b_to_ldsTrue_b_preshuffleFalse_c_to_ldsFalse_gfx950,0.0,323.53,1399.22
gfx950,256,456,7168,512,False,torch.bfloat16,torch.bfloat16,False,False,flydsl,151,1,10.5237,flydsl_gemm2_abf16_wbf16_bf16_t128x64x64_split_k1_block_m_warp2_block_n_warp2_async_copyTrue_b_to_ldsTrue_b_preshuffleFalse_c_to_ldsFalse_gfx950,0.0,318.05,1363.04
gfx950,256,464,7168,512,False,torch.bfloat16,torch.bfloat16,False,False,flydsl,151,1,10.0748,flydsl_gemm2_abf16_wbf16_bf16_t128x64x64_split_k1_block_m_warp2_block_n_warp2_async_copyTrue_b_to_ldsTrue_b_preshuffleFalse_c_to_ldsFalse_gfx950,0.0,338.05,1435.97
gfx950,256,472,7168,512,False,torch.bfloat16,torch.bfloat16,False,False,flydsl,151,1,9.9901,flydsl_gemm2_abf16_wbf16_bf16_t128x64x64_split_k1_block_m_warp2_block_n_warp2_async_copyTrue_b_to_ldsTrue_b_preshuffleFalse_c_to_ldsFalse_gfx950,0.0,346.79,1460.44
gfx950,256,480,7168,512,False,torch.bfloat16,torch.bfloat16,False,False,flydsl,151,1,10.0612,flydsl_gemm2_abf16_wbf16_bf16_t128x64x64_split_k1_block_m_warp2_block_n_warp2_async_copyTrue_b_to_ldsTrue_b_preshuffleFalse_c_to_ldsFalse_gfx950,0.0,350.18,1462.33
gfx950,256,488,7168,512,False,torch.bfloat16,torch.bfloat16,False,False,flydsl,151,1,10.0971,flydsl_gemm2_abf16_wbf16_bf16_t128x64x64_split_k1_block_m_warp2_block_n_warp2_async_copyTrue_b_to_ldsTrue_b_preshuffleFalse_c_to_ldsFalse_gfx950,0.0,354.75,1469.3
gfx950,256,496,7168,512,False,torch.bfloat16,torch.bfloat16,False,False,flydsl,151,1,10.1501,flydsl_gemm2_abf16_wbf16_bf16_t128x64x64_split_k1_block_m_warp2_block_n_warp2_async_copyTrue_b_to_ldsTrue_b_preshuffleFalse_c_to_ldsFalse_gfx950,0.0,358.68,1473.74
gfx950,256,504,7168,512,False,torch.bfloat16,torch.bfloat16,False,False,flydsl,151,1,10.0038,flydsl_gemm2_abf16_wbf16_bf16_t128x64x64_split_k1_block_m_warp2_block_n_warp2_async_copyTrue_b_to_ldsTrue_b_preshuffleFalse_c_to_ldsFalse_gfx950,0.0,369.8,1507.58
gfx950,256,512,7168,512,False,torch.bfloat16,torch.bfloat16,False,False,flydsl,151,1,10.2436,flydsl_gemm2_abf16_wbf16_bf16_t128x64x64_split_k1_block_m_warp2_block_n_warp2_async_copyTrue_b_to_ldsTrue_b_preshuffleFalse_c_to_ldsFalse_gfx950,0.0,366.87,1484.28
gfx950,256,136,2112,7168,False,torch.bfloat16,torch.bfloat16,False,False,asm,7,3,20.2326,_ZN5aiter39bf16gemm_fp32bf16_tn_80x64_splitk_cleanE,0.0106,203.52,1621.23
gfx950,256,144,2112,7168,False,torch.bfloat16,torch.bfloat16,False,False,asm,7,3,20.2948,_ZN5aiter39bf16gemm_fp32bf16_tn_80x64_splitk_cleanE,0.0106,214.83,1623.58
gfx950,256,360,2112,7168,False,torch.bfloat16,torch.bfloat16,False,False,asm,6,1,43.3357,_ZN5aiter37bf16gemm_fp32bf16_tn_64x64_pf3_splitkE,0.0,251.52,852.86
gfx950,256,368,2112,7168,False,torch.bfloat16,torch.bfloat16,False,False,asm,6,1,44.0418,_ZN5aiter37bf16gemm_fp32bf16_tn_64x64_pf3_splitkE,0.0,252.99,842.56
gfx950,256,376,2112,7168,False,torch.bfloat16,torch.bfloat16,False,False,asm,6,1,43.5006,_ZN5aiter37bf16gemm_fp32bf16_tn_64x64_pf3_splitkE,0.0,261.71,856.45
gfx950,256,384,2112,7168,False,torch.bfloat16,torch.bfloat16,False,False,asm,6,1,44.2105,_ZN5aiter37bf16gemm_fp32bf16_tn_64x64_pf3_splitkE,0.0,262.98,846.06
gfx950,256,1,4096,512,False,torch.bfloat16,torch.bfloat16,False,False,triton,0,0,4.4851,auto,0.0,0.94,937.22
gfx950,256,2,4096,512,False,torch.bfloat16,torch.bfloat16,False,False,triton,0,0,5.0614,auto,0.0,1.66,832.33
gfx950,256,24,4096,512,False,torch.bfloat16,torch.bfloat16,False,False,triton,0,0,4.4326,auto,0.0,22.71,996.14
gfx950,256,32,4096,512,False,torch.bfloat16,torch.bfloat16,False,False,triton,0,0,4.5855,auto,0.0,29.27,979.0
gfx950,256,40,4096,512,False,torch.bfloat16,torch.bfloat16,False,False,triton,0,0,5.5363,auto,0.0,30.3,824.19
gfx950,256,64,4096,512,False,torch.bfloat16,torch.bfloat16,False,False,triton,0,0,5.0343,auto,0.0,53.32,950.31
gfx950,256,80,4096,512,False,torch.bfloat16,torch.bfloat16,False,False,flydsl,211,1,5.9722,flydsl_gemm2_abf16_wbf16_bf16_t32x64x128_split_k1_block_m_warp2_block_n_warp2_async_copyTrue_b_to_ldsTrue_b_preshuffleFalse_c_to_ldsFalse_gfx950,0.0,56.18,825.76
gfx950,256,112,4096,512,False,torch.bfloat16,torch.bfloat16,False,False,asm,2,1,6.1142,_ZN5aiter37bf16gemm_fp32bf16_tn_32x64_pf3_splitkE,0.0,76.83,854.81
gfx950,256,128,4096,512,False,torch.bfloat16,torch.bfloat16,False,False,triton,0,0,5.7015,auto,0.0,94.16,942.55
gfx950,256,136,4096,512,False,torch.bfloat16,torch.bfloat16,False,False,asm,4,1,6.4072,_ZN5aiter37bf16gemm_fp32bf16_tn_48x64_pf3_splitkE,0.0,89.03,850.24
gfx950,256,240,4096,512,False,torch.bfloat16,torch.bfloat16,False,False,asm,6,1,6.8718,_ZN5aiter37bf16gemm_fp32bf16_tn_64x64_pf3_splitkE,0.0,146.49,932.24
gfx950,256,256,4096,512,False,torch.bfloat16,torch.bfloat16,False,False,asm,6,1,6.8851,_ZN5aiter37bf16gemm_fp32bf16_tn_64x64_pf3_splitkE,0.0,155.95,951.85
gfx950,256,320,4096,512,False,torch.bfloat16,torch.bfloat16,False,False,flydsl,91,1,8.8313,flydsl_gemm2_abf16_wbf16_bf16_t64x64x64_split_k1_block_m_warp2_block_n_warp2_async_copyTrue_b_to_ldsTrue_b_preshuffleFalse_c_to_ldsFalse_gfx950,0.0,151.98,808.88
gfx950,256,352,4096,512,False,torch.bfloat16,torch.bfloat16,False,False,asm,9,1,7.7114,_ZN5aiter37bf16gemm_fp32bf16_tn_96x64_pf3_splitkE,0.0,191.46,964.59
gfx950,256,1,7168,2048,False,torch.bfloat16,torch.bfloat16,False,False,flydsl,47,8,9.1452,flydsl_gemm2_abf16_wbf16_bf16_t32x128x64_split_k8_block_m_warp2_block_n_warp2_async_copyTrue_b_to_ldsTrue_b_preshuffleFalse_c_to_ldsFalse_gfx950,0.0,3.21,3212.46
gfx950,256,16,7168,2048,False,torch.bfloat16,torch.bfloat16,False,False,triton,0,0,10.6246,auto,0.0,44.21,2791.17
gfx950,256,32,7168,2048,False,torch.bfloat16,torch.bfloat16,False,False,triton,0,0,11.3815,auto,0.0,82.55,2631.46
gfx950,256,64,7168,2048,False,torch.bfloat16,torch.bfloat16,False,False,triton,0,0,11.9472,auto,0.0,157.28,2556.23
gfx950,256,128,7168,2048,False,torch.bfloat16,torch.bfloat16,False,False,triton,0,0,15.4031,auto,0.0,243.98,2059.29
gfx950,256,88,384,7168,False,torch.bfloat16,torch.bfloat16,False,False,flydsl,217,8,10.9286,flydsl_gemm2_abf16_wbf16_bf16_t32x64x128_split_k8_block_m_warp2_block_n_warp2_async_copyTrue_b_to_ldsTrue_b_preshuffleFalse_c_to_ldsFalse_gfx950,0.0,44.33,625.35
gfx950,256,96,384,7168,False,torch.bfloat16,torch.bfloat16,False,False,flydsl,277,8,11.4666,flydsl_gemm2_abf16_wbf16_bf16_t64x64x128_split_k8_block_m_warp2_block_n_warp2_async_copyTrue_b_to_ldsTrue_b_preshuffleFalse_c_to_ldsFalse_gfx950,0.0,46.09,606.55
gfx950,256,136,384,7168,False,torch.bfloat16,torch.bfloat16,False,False,asm,7,8,12.5129,_ZN5aiter39bf16gemm_fp32bf16_tn_80x64_splitk_cleanE,0.0225,59.83,604.11
gfx950,256,192,384,7168,False,torch.bfloat16,torch.bfloat16,False,False,asm,8,9,13.1416,_ZN5aiter39bf16gemm_fp32bf16_tn_96x64_splitk_cleanE,0.023,80.43,639.57
gfx950,256,200,384,7168,False,torch.bfloat16,torch.bfloat16,False,False,flydsl,277,8,13.3939,flydsl_gemm2_abf16_wbf16_bf16_t64x64x128_split_k8_block_m_warp2_block_n_warp2_async_copyTrue_b_to_ldsTrue_b_preshuffleFalse_c_to_ldsFalse_gfx950,0.0,82.2,636.55
gfx950,256,224,384,7168,False,torch.bfloat16,torch.bfloat16,False,False,asm,5,7,13.7138,_ZN5aiter39bf16gemm_fp32bf16_tn_64x64_splitk_cleanE,0.0206,89.92,648.13
gfx950,256,392,1024,7168,False,torch.bfloat16,torch.bfloat16,False,False,asm,7,3,20.4007,_ZN5aiter39bf16gemm_fp32bf16_tn_80x64_splitk_cleanE,0.0105,282.08,1034.41
gfx950,256,400,1024,7168,False,torch.bfloat16,torch.bfloat16,False,False,asm,7,3,20.3122,_ZN5aiter39bf16gemm_fp32bf16_tn_80x64_splitk_cleanE,0.0106,289.09,1045.37
gfx950,256,2,7168,512,False,torch.bfloat16,torch.bfloat16,False,False,triton,0,0,4.9943,auto,0.0,2.94,1475.83
gfx950,256,4,7168,512,False,torch.bfloat16,torch.bfloat16,False,False,triton,0,0,4.9934,auto,0.0,5.88,1482.25
gfx950,256,8,7168,512,False,torch.bfloat16,torch.bfloat16,False,False,triton,0,0,5.5511,auto,0.0,10.58,1344.4
gfx950,256,16,7168,512,False,torch.bfloat16,torch.bfloat16,False,False,triton,0,0,4.7742,auto,0.0,24.6,1588.91
gfx950,256,24,7168,512,False,torch.bfloat16,torch.bfloat16,False,False,triton,0,0,5.4124,auto,0.0,32.55,1424.26
gfx950,256,32,7168,512,False,torch.bfloat16,torch.bfloat16,False,False,triton,0,0,4.9819,auto,0.0,47.15,1572.0
gfx950,256,40,7168,512,False,torch.bfloat16,torch.bfloat16,False,False,triton,0,0,6.0779,auto,0.0,48.31,1308.75
gfx950,256,56,7168,512,False,torch.bfloat16,torch.bfloat16,False,False,flydsl,211,1,6.4529,flydsl_gemm2_abf16_wbf16_bf16_t32x64x128_split_k1_block_m_warp2_block_n_warp2_async_copyTrue_b_to_ldsTrue_b_preshuffleFalse_c_to_ldsFalse_gfx950,0.0,63.7,1270.77
gfx950,256,64,7168,512,False,torch.bfloat16,torch.bfloat16,False,False,triton,0,0,6.0235,auto,0.0,77.99,1381.77
gfx950,256,80,7168,512,False,torch.bfloat16,torch.bfloat16,False,False,flydsl,211,1,6.8698,flydsl_gemm2_abf16_wbf16_bf16_t32x64x128_split_k1_block_m_warp2_block_n_warp2_async_copyTrue_b_to_ldsTrue_b_preshuffleFalse_c_to_ldsFalse_gfx950,0.0,85.48,1247.32
gfx950,256,96,7168,512,False,torch.bfloat16,torch.bfloat16,False,False,flydsl,211,1,7.3467,flydsl_gemm2_abf16_wbf16_bf16_t32x64x128_split_k1_block_m_warp2_block_n_warp2_async_copyTrue_b_to_ldsTrue_b_preshuffleFalse_c_to_ldsFalse_gfx950,0.0,95.91,1199.81
gfx950,256,104,7168,512,False,torch.bfloat16,torch.bfloat16,False,False,flydsl,271,1,7.4742,flydsl_gemm2_abf16_wbf16_bf16_t64x64x128_split_k1_block_m_warp2_block_n_warp2_async_copyTrue_b_to_ldsTrue_b_preshuffleFalse_c_to_ldsFalse_gfx950,0.0,102.13,1195.77
gfx950,256,128,7168,512,False,torch.bfloat16,torch.bfloat16,False,False,triton,0,0,6.8915,auto,0.0,136.33,1350.38
gfx950,256,168,7168,512,False,torch.bfloat16,torch.bfloat16,False,False,flydsl,271,1,7.951,flydsl_gemm2_abf16_wbf16_bf16_t64x64x128_split_k1_block_m_warp2_block_n_warp2_async_copyTrue_b_to_ldsTrue_b_preshuffleFalse_c_to_ldsFalse_gfx950,0.0,155.09,1247.7
gfx950,256,192,7168,512,False,torch.bfloat16,torch.bfloat16,False,False,flydsl,271,1,7.9723,flydsl_gemm2_abf16_wbf16_bf16_t64x64x128_split_k1_block_m_warp2_block_n_warp2_async_copyTrue_b_to_ldsTrue_b_preshuffleFalse_c_to_ldsFalse_gfx950,0.0,176.77,1290.61
gfx950,256,144,384,7168,False,torch.bfloat16,torch.bfloat16,False,False,asm,7,10,12.5466,_ZN5aiter39bf16gemm_fp32bf16_tn_80x64_splitk_cleanE,0.0241,63.18,612.12
gfx950,256,152,384,7168,False,torch.bfloat16,torch.bfloat16,False,False,asm,7,8,12.6565,_ZN5aiter39bf16gemm_fp32bf16_tn_80x64_splitk_cleanE,0.0222,66.11,616.35
gfx950,256,160,384,7168,False,torch.bfloat16,torch.bfloat16,False,False,asm,7,9,12.8035,_ZN5aiter39bf16gemm_fp32bf16_tn_80x64_splitk_cleanE,0.0224,68.79,618.71
gfx950,256,456,1024,7168,False,torch.bfloat16,torch.bfloat16,False,False,asm,8,3,21.5821,_ZN5aiter39bf16gemm_fp32bf16_tn_96x64_splitk_cleanE,0.0107,310.17,1026.37
gfx950,256,464,1024,7168,False,torch.bfloat16,torch.bfloat16,False,False,asm,8,3,21.6839,_ZN5aiter39bf16gemm_fp32bf16_tn_96x64_splitk_cleanE,0.0107,314.13,1027.59
gfx950,256,472,1024,7168,False,torch.bfloat16,torch.bfloat16,False,False,asm,8,3,21.9029,_ZN5aiter39bf16gemm_fp32bf16_tn_96x64_splitk_cleanE,0.0107,316.35,1023.3
gfx950,256,480,1024,7168,False,torch.bfloat16,torch.bfloat16,False,False,asm,8,3,21.9079,_ZN5aiter39bf16gemm_fp32bf16_tn_96x64_splitk_cleanE,0.0108,321.64,1029.05
gfx950,256,488,1024,7168,False,torch.bfloat16,torch.bfloat16,False,False,asm,5,2,25.5097,_ZN5aiter39bf16gemm_fp32bf16_tn_64x64_splitk_cleanE,0.0061,280.83,888.9
gfx950,256,496,1024,7168,False,torch.bfloat16,torch.bfloat16,False,False,asm,5,2,25.6402,_ZN5aiter39bf16gemm_fp32bf16_tn_64x64_splitk_cleanE,0.0061,283.98,889.48
gfx950,256,504,1024,7168,False,torch.bfloat16,torch.bfloat16,False,False,asm,5,2,25.7917,_ZN5aiter39bf16gemm_fp32bf16_tn_64x64_splitk_cleanE,0.0061,286.87,889.34
gfx950,256,88,1536,1536,False,torch.bfloat16,torch.bfloat16,False,False,asm,1,3,8.1679,_ZN5aiter39bf16gemm_fp32bf16_tn_32x64_splitk_cleanE,0.0058,50.84,643.89
gfx950,256,96,1536,1536,False,torch.bfloat16,torch.bfloat16,False,False,asm,1,3,8.2325,_ZN5aiter39bf16gemm_fp32bf16_tn_32x64_splitk_cleanE,0.0058,55.02,644.81
gfx950,256,168,1536,1536,False,torch.bfloat16,torch.bfloat16,False,False,asm,5,3,8.8181,_ZN5aiter39bf16gemm_fp32bf16_tn_64x64_splitk_cleanE,0.0058,89.9,652.16
gfx950,256,176,1536,1536,False,torch.bfloat16,torch.bfloat16,False,False,asm,5,3,9.0191,_ZN5aiter39bf16gemm_fp32bf16_tn_64x64_splitk_cleanE,0.0057,92.08,643.07
gfx950,256,184,1536,1536,False,torch.bfloat16,torch.bfloat16,False,False,asm,5,3,9.0376,_ZN5aiter39bf16gemm_fp32bf16_tn_64x64_splitk_cleanE,0.0057,96.07,647.19
gfx950,256,192,1536,1536,False,torch.bfloat16,torch.bfloat16,False,False,asm,5,3,8.9939,_ZN5aiter39bf16gemm_fp32bf16_tn_64x64_splitk_cleanE,0.0058,100.73,655.8
gfx950,256,200,1536,1536,False,torch.bfloat16,torch.bfloat16,False,False,asm,7,3,9.2267,_ZN5aiter39bf16gemm_fp32bf16_tn_80x64_splitk_cleanE,0.0057,102.28,644.58
gfx950,256,208,1536,1536,False,torch.bfloat16,torch.bfloat16,False,False,asm,7,3,9.3175,_ZN5aiter39bf16gemm_fp32bf16_tn_80x64_splitk_cleanE,0.0058,105.34,643.58
gfx950,256,216,1536,1536,False,torch.bfloat16,torch.bfloat16,False,False,asm,7,3,9.2818,_ZN5aiter39bf16gemm_fp32bf16_tn_80x64_splitk_cleanE,0.0057,109.81,651.35
gfx950,256,224,1536,1536,False,torch.bfloat16,torch.bfloat16,False,False,asm,7,3,9.5115,_ZN5aiter39bf16gemm_fp32bf16_tn_80x64_splitk_cleanE,0.0057,111.12,640.79
gfx950,256,232,1536,1536,False,torch.bfloat16,torch.bfloat16,False,False,asm,8,3,9.6187,_ZN5aiter39bf16gemm_fp32bf16_tn_96x64_splitk_cleanE,0.0058,113.81,638.76
gfx950,256,240,1536,1536,False,torch.bfloat16,torch.bfloat16,False,False,asm,7,3,9.5099,_ZN5aiter39bf16gemm_fp32bf16_tn_80x64_splitk_cleanE,0.0057,119.08,651.23
gfx950,256,328,1536,1536,False,torch.bfloat16,torch.bfloat16,False,False,asm,7,2,10.3411,_ZN5aiter39bf16gemm_fp32bf16_tn_80x64_splitk_cleanE,0.0028,149.66,651.17
gfx950,256,120,2112,7168,False,torch.bfloat16,torch.bfloat16,False,False,asm,5,3,19.5331,_ZN5aiter39bf16gemm_fp32bf16_tn_64x64_splitk_cleanE,0.0106,186.01,1664.09
gfx950,256,152,2112,7168,False,torch.bfloat16,torch.bfloat16,False,False,asm,7,3,20.6393,_ZN5aiter39bf16gemm_fp32bf16_tn_80x64_splitk_cleanE,0.0107,222.98,1603.68
gfx950,256,160,2112,7168,False,torch.bfloat16,torch.bfloat16,False,False,asm,7,3,20.8121,_ZN5aiter39bf16gemm_fp32bf16_tn_80x64_splitk_cleanE,0.0106,232.77,1597.5
gfx950,256,168,2112,7168,False,torch.bfloat16,torch.bfloat16,False,False,asm,8,3,21.2508,_ZN5aiter39bf16gemm_fp32bf16_tn_96x64_splitk_cleanE,0.0106,239.36,1571.5
gfx950,256,176,2112,7168,False,torch.bfloat16,torch.bfloat16,False,False,asm,8,3,21.4824,_ZN5aiter39bf16gemm_fp32bf16_tn_96x64_splitk_cleanE,0.0106,248.06,1561.47
gfx950,256,184,2112,7168,False,torch.bfloat16,torch.bfloat16,False,False,asm,8,3,21.6938,_ZN5aiter39bf16gemm_fp32bf16_tn_96x64_splitk_cleanE,0.0107,256.81,1553.1
gfx950,256,192,2112,7168,False,torch.bfloat16,torch.bfloat16,False,False,asm,8,3,21.8515,_ZN5aiter39bf16gemm_fp32bf16_tn_96x64_splitk_cleanE,0.0106,266.04,1548.69
gfx950,256,200,2112,7168,False,torch.bfloat16,torch.bfloat16,False,False,asm,7,2,26.2125,_ZN5aiter39bf16gemm_fp32bf16_tn_80x64_splitk_cleanE,0.006,231.02,1296.7
gfx950,256,208,2112,7168,False,torch.bfloat16,torch.bfloat16,False,False,asm,7,2,26.5685,_ZN5aiter39bf16gemm_fp32bf16_tn_80x64_splitk_cleanE,0.006,237.04,1284.91
gfx950,256,216,2112,7168,False,torch.bfloat16,torch.bfloat16,False,False,asm,7,2,26.6477,_ZN5aiter39bf16gemm_fp32bf16_tn_80x64_splitk_cleanE,0.006,245.42,1286.66
gfx950,256,224,2112,7168,False,torch.bfloat16,torch.bfloat16,False,False,asm,7,2,26.8323,_ZN5aiter39bf16gemm_fp32bf16_tn_80x64_splitk_cleanE,0.006,252.76,1283.34
gfx950,256,232,2112,7168,False,torch.bfloat16,torch.bfloat16,False,False,asm,7,2,27.1967,_ZN5aiter39bf16gemm_fp32bf16_tn_80x64_splitk_cleanE,0.006,258.28,1271.61
gfx950,256,240,2112,7168,False,torch.bfloat16,torch.bfloat16,False,False,asm,7,2,27.3724,_ZN5aiter39bf16gemm_fp32bf16_tn_80x64_splitk_cleanE,0.006,265.47,1268.87
gfx950,256,264,2112,7168,False,torch.bfloat16,torch.bfloat16,False,False,asm,8,2,28.4038,_ZN5aiter39bf16gemm_fp32bf16_tn_96x64_splitk_cleanE,0.006,281.42,1238.48
gfx950,256,272,2112,7168,False,torch.bfloat16,torch.bfloat16,False,False,asm,8,2,28.5123,_ZN5aiter39bf16gemm_fp32bf16_tn_96x64_splitk_cleanE,0.0061,288.84,1238.97
gfx950,256,280,2112,7168,False,torch.bfloat16,torch.bfloat16,False,False,asm,8,2,28.8775,_ZN5aiter39bf16gemm_fp32bf16_tn_96x64_splitk_cleanE,0.0061,293.58,1228.45
gfx950,256,288,2112,7168,False,torch.bfloat16,torch.bfloat16,False,False,asm,8,2,28.9429,_ZN5aiter39bf16gemm_fp32bf16_tn_96x64_splitk_cleanE,0.0061,301.28,1230.8
gfx950,256,104,3072,1536,False,torch.bfloat16,torch.bfloat16,False,False,asm,7,2,9.9897,_ZN5aiter39bf16gemm_fp32bf16_tn_80x64_splitk_cleanE,0.0028,98.25,1040.64
gfx950,256,136,3072,1536,False,torch.bfloat16,torch.bfloat16,False,False,asm,7,2,10.6637,_ZN5aiter39bf16gemm_fp32bf16_tn_80x64_splitk_cleanE,0.0028,120.36,1002.52
gfx950,256,144,3072,1536,False,torch.bfloat16,torch.bfloat16,False,False,asm,7,2,10.5831,_ZN5aiter39bf16gemm_fp32bf16_tn_80x64_splitk_cleanE,0.0027,128.41,1017.12
gfx950,256,152,3072,1536,False,torch.bfloat16,torch.bfloat16,False,False,asm,7,2,11.0581,_ZN5aiter39bf16gemm_fp32bf16_tn_80x64_splitk_cleanE,0.0028,129.72,980.1
gfx950,256,160,3072,1536,False,torch.bfloat16,torch.bfloat16,False,False,asm,8,2,10.9111,_ZN5aiter39bf16gemm_fp32bf16_tn_96x64_splitk_cleanE,0.0028,138.39,1000.06
gfx950,256,168,3072,1536,False,torch.bfloat16,torch.bfloat16,False,False,asm,8,2,11.0756,_ZN5aiter39bf16gemm_fp32bf16_tn_96x64_splitk_cleanE,0.0028,143.15,991.86
gfx950,256,200,3072,1536,False,torch.bfloat16,torch.bfloat16,False,False,asm,4,1,12.2001,_ZN5aiter37bf16gemm_fp32bf16_tn_48x64_pf3_splitkE,0.0,154.71,924.61
gfx950,256,208,3072,1536,False,torch.bfloat16,torch.bfloat16,False,False,asm,4,1,12.0106,_ZN5aiter37bf16gemm_fp32bf16_tn_48x64_pf3_splitkE,0.0,163.43,945.34
gfx950,256,216,3072,1536,False,torch.bfloat16,torch.bfloat16,False,False,asm,4,1,11.7401,_ZN5aiter37bf16gemm_fp32bf16_tn_48x64_pf3_splitkE,0.0,173.63,973.4
gfx950,256,224,3072,1536,False,torch.bfloat16,torch.bfloat16,False,False,asm,6,1,12.2504,_ZN5aiter37bf16gemm_fp32bf16_tn_64x64_pf3_splitkE,0.0,172.56,938.87
gfx950,256,232,3072,1536,False,torch.bfloat16,torch.bfloat16,False,False,asm,6,1,12.1948,_ZN5aiter37bf16gemm_fp32bf16_tn_64x64_pf3_splitkE,0.0,179.54,949.2
gfx950,256,240,3072,1536,False,torch.bfloat16,torch.bfloat16,False,False,asm,4,1,11.8776,_ZN5aiter37bf16gemm_fp32bf16_tn_48x64_pf3_splitkE,0.0,190.69,980.76
gfx950,256,416,3072,1536,False,torch.bfloat16,torch.bfloat16,False,False,asm,9,1,13.9463,_ZN5aiter37bf16gemm_fp32bf16_tn_96x64_pf3_splitkE,0.0,281.5,951.58
gfx950,256,424,3072,1536,False,torch.bfloat16,torch.bfloat16,False,False,flydsl,271,1,16.3511,flydsl_gemm2_abf16_wbf16_bf16_t64x64x128_split_k1_block_m_warp2_block_n_warp2_async_copyTrue_b_to_ldsTrue_b_preshuffleFalse_c_to_ldsFalse_gfx950,0.0,244.72,816.14
gfx950,256,432,3072,1536,False,torch.bfloat16,torch.bfloat16,False,False,asm,9,1,14.0366,_ZN5aiter37bf16gemm_fp32bf16_tn_96x64_pf3_splitkE,0.0,290.45,955.96
gfx950,256,440,3072,1536,False,torch.bfloat16,torch.bfloat16,False,False,asm,9,1,13.6186,_ZN5aiter37bf16gemm_fp32bf16_tn_96x64_pf3_splitkE,0.0,304.9,990.72
gfx950,256,456,3072,1536,False,torch.bfloat16,torch.bfloat16,False,False,asm,9,1,13.8104,_ZN5aiter37bf16gemm_fp32bf16_tn_96x64_pf3_splitkE,0.0,311.6,987.64
gfx950,256,4,4096,512,False,torch.bfloat16,torch.bfloat16,False,False,triton,0,0,4.5506,auto,0.0,3.69,929.8
gfx950,256,8,4096,512,False,torch.bfloat16,torch.bfloat16,False,False,triton,0,0,4.5407,auto,0.0,7.39,939.95
gfx950,256,16,4096,512,False,torch.bfloat16,torch.bfloat16,False,False,triton,0,0,4.3534,auto,0.0,15.42,997.33
gfx950,256,72,4096,512,False,torch.bfloat16,torch.bfloat16,False,False,flydsl,211,1,6.2647,flydsl_gemm2_abf16_wbf16_bf16_t32x64x128_split_k1_block_m_warp2_block_n_warp2_async_copyTrue_b_to_ldsTrue_b_preshuffleFalse_c_to_ldsFalse_gfx950,0.0,48.21,775.44
gfx950,256,296,4096,512,False,torch.bfloat16,torch.bfloat16,False,False,flydsl,91,1,8.868,flydsl_gemm2_abf16_wbf16_bf16_t64x64x64_split_k1_block_m_warp2_block_n_warp2_async_copyTrue_b_to_ldsTrue_b_preshuffleFalse_c_to_ldsFalse_gfx950,0.0,140.0,780.59
gfx950,256,304,4096,512,False,torch.bfloat16,torch.bfloat16,False,False,flydsl,271,1,7.5545,flydsl_gemm2_abf16_wbf16_bf16_t64x64x128_split_k1_block_m_warp2_block_n_warp2_async_copyTrue_b_to_ldsTrue_b_preshuffleFalse_c_to_ldsFalse_gfx950,0.0,168.78,926.06
gfx950,256,312,4096,512,False,torch.bfloat16,torch.bfloat16,False,False,asm,9,1,7.9431,_ZN5aiter37bf16gemm_fp32bf16_tn_96x64_pf3_splitkE,0.0,164.75,890.04
gfx950,256,336,4096,512,False,torch.bfloat16,torch.bfloat16,False,False,flydsl,271,1,7.5014,flydsl_gemm2_abf16_wbf16_bf16_t64x64x128_split_k1_block_m_warp2_block_n_warp2_async_copyTrue_b_to_ldsTrue_b_preshuffleFalse_c_to_ldsFalse_gfx950,0.0,187.87,971.94
gfx950,256,512,4096,512,False,torch.bfloat16,torch.bfloat16,False,False,triton,0,0,8.2983,auto,0.0,258.79,1074.06
gfx950,256,1,7168,512,False,torch.bfloat16,torch.bfloat16,False,False,triton,0,0,5.3382,auto,0.0,1.38,1377.88
gfx950,256,1,7168,1024,False,torch.bfloat16,torch.bfloat16,False,False,flydsl,227,8,6.4796,flydsl_gemm2_abf16_wbf16_bf16_t32x128x128_split_k8_block_m_warp2_block_n_warp2_async_copyTrue_b_to_ldsTrue_b_preshuffleFalse_c_to_ldsFalse_gfx950,0.0,2.27,2268.11
gfx950,256,2,7168,1024,False,torch.bfloat16,torch.bfloat16,False,False,flydsl,237,8,6.8986,flydsl_gemm2_abf16_wbf16_bf16_t32x256x128_split_k8_block_m_warp2_block_n_warp2_async_copyTrue_b_to_ldsTrue_b_preshuffleFalse_c_to_ldsFalse_gfx950,0.0,4.26,2132.73
gfx950,256,16,7168,1024,False,torch.bfloat16,torch.bfloat16,False,False,triton,0,0,7.4158,auto,0.0,31.67,2014.92
gfx950,256,24,7168,1024,False,torch.bfloat16,torch.bfloat16,False,False,triton,0,0,7.5691,auto,0.0,46.55,1991.42
gfx950,256,24,7168,2048,False,torch.bfloat16,torch.bfloat16,False,False,triton,0,0,11.3968,auto,0.0,61.83,2614.99
gfx950,256,32,7168,1024,False,torch.bfloat16,torch.bfloat16,False,False,triton,0,0,6.5764,auto,0.0,71.43,2311.96
gfx950,256,40,7168,1024,False,torch.bfloat16,torch.bfloat16,False,False,triton,0,0,7.9803,auto,0.0,73.58,1921.66
gfx950,256,40,7168,2048,False,torch.bfloat16,torch.bfloat16,False,False,triton,0,0,12.1517,auto,0.0,96.65,2476.81
gfx950,256,48,7168,1024,False,torch.bfloat16,torch.bfloat16,False,False,triton,0,0,8.5938,auto,0.0,81.99,1799.73
gfx950,256,56,7168,1024,False,torch.bfloat16,torch.bfloat16,False,False,triton,0,0,8.8118,auto,0.0,93.29,1770.08
gfx950,256,56,7168,2048,False,torch.bfloat16,torch.bfloat16,False,False,triton,0,0,12.6431,auto,0.0,130.04,2403.87
gfx950,256,64,7168,1024,False,torch.bfloat16,torch.bfloat16,False,False,triton,0,0,8.0737,auto,0.0,116.37,1948.13
gfx950,256,72,7168,1024,False,torch.bfloat16,torch.bfloat16,False,False,flydsl,301,1,11.3646,flydsl_gemm2_abf16_wbf16_bf16_t96x64x128_split_k1_block_m_warp2_block_n_warp2_async_copyTrue_b_to_ldsTrue_b_preshuffleFalse_c_to_ldsFalse_gfx950,0.0,93.01,1395.54
gfx950,256,80,7168,1024,False,torch.bfloat16,torch.bfloat16,False,False,flydsl,301,1,11.4417,flydsl_gemm2_abf16_wbf16_bf16_t96x64x128_split_k1_block_m_warp2_block_n_warp2_async_copyTrue_b_to_ldsTrue_b_preshuffleFalse_c_to_ldsFalse_gfx950,0.0,102.64,1397.59
gfx950,256,88,7168,512,False,torch.bfloat16,torch.bfloat16,False,False,flydsl,211,1,7.2019,flydsl_gemm2_abf16_wbf16_bf16_t32x64x128_split_k1_block_m_warp2_block_n_warp2_async_copyTrue_b_to_ldsTrue_b_preshuffleFalse_c_to_ldsFalse_gfx950,0.0,89.69,1206.86
gfx950,256,88,7168,1024,False,torch.bfloat16,torch.bfloat16,False,False,flydsl,301,1,11.327,flydsl_gemm2_abf16_wbf16_bf16_t96x64x128_split_k1_block_m_warp2_block_n_warp2_async_copyTrue_b_to_ldsTrue_b_preshuffleFalse_c_to_ldsFalse_gfx950,0.0,114.05,1423.31
gfx950,256,96,7168,1024,False,torch.bfloat16,torch.bfloat16,False,False,flydsl,301,1,11.5201,flydsl_gemm2_abf16_wbf16_bf16_t96x64x128_split_k1_block_m_warp2_block_n_warp2_async_copyTrue_b_to_ldsTrue_b_preshuffleFalse_c_to_ldsFalse_gfx950,0.0,122.33,1410.83
gfx950,256,104,7168,2048,False,torch.bfloat16,torch.bfloat16,False,False,asm,6,1,15.4702,_ZN5aiter37bf16gemm_fp32bf16_tn_64x64_pf3_splitkE,0.0,197.38,2021.76
gfx950,256,120,7168,512,False,torch.bfloat16,torch.bfloat16,False,False,asm,6,1,6.9667,_ZN5aiter37bf16gemm_fp32bf16_tn_64x64_pf3_splitkE,0.0,126.43,1318.16
gfx950,256,120,7168,2048,False,torch.bfloat16,torch.bfloat16,False,False,asm,6,1,15.9439,_ZN5aiter37bf16gemm_fp32bf16_tn_64x64_pf3_splitkE,0.0,220.98,1980.19
gfx950,256,136,7168,2048,False,torch.bfloat16,torch.bfloat16,False,False,asm,9,1,17.2568,_ZN5aiter37bf16gemm_fp32bf16_tn_96x64_pf3_splitkE,0.0,231.39,1846.63
gfx950,256,144,7168,1024,False,torch.bfloat16,torch.bfloat16,False,False,asm,9,1,10.3748,_ZN5aiter37bf16gemm_fp32bf16_tn_96x64_pf3_splitkE,0.0,203.76,1642.38
gfx950,256,144,7168,2048,False,torch.bfloat16,torch.bfloat16,False,False,asm,9,1,17.4208,_ZN5aiter37bf16gemm_fp32bf16_tn_96x64_pf3_splitkE,0.0,242.69,1837.71
gfx950,256,152,7168,2048,False,torch.bfloat16,torch.bfloat16,False,False,asm,9,1,16.9128,_ZN5aiter37bf16gemm_fp32bf16_tn_96x64_pf3_splitkE,0.0,263.87,1901.62
gfx950,256,160,7168,2048,False,torch.bfloat16,torch.bfloat16,False,False,asm,9,1,17.185,_ZN5aiter37bf16gemm_fp32bf16_tn_96x64_pf3_splitkE,0.0,273.36,1880.08
gfx950,256,168,7168,1024,False,torch.bfloat16,torch.bfloat16,False,False,asm,9,1,10.5421,_ZN5aiter37bf16gemm_fp32bf16_tn_96x64_pf3_splitkE,0.0,233.94,1653.62
gfx950,256,168,7168,2048,False,torch.bfloat16,torch.bfloat16,False,False,asm,9,1,17.6956,_ZN5aiter37bf16gemm_fp32bf16_tn_96x64_pf3_splitkE,0.0,278.74,1834.17
gfx950,256,176,7168,512,False,torch.bfloat16,torch.bfloat16,False,False,flydsl,301,1,8.2681,flydsl_gemm2_abf16_wbf16_bf16_t96x64x128_split_k1_block_m_warp2_block_n_warp2_async_copyTrue_b_to_ldsTrue_b_preshuffleFalse_c_to_ldsFalse_gfx950,0.0,156.25,1214.72
gfx950,256,176,7168,1024,False,torch.bfloat16,torch.bfloat16,False,False,flydsl,271,1,11.5344,flydsl_gemm2_abf16_wbf16_bf16_t64x64x128_split_k1_block_m_warp2_block_n_warp2_async_copyTrue_b_to_ldsTrue_b_preshuffleFalse_c_to_ldsFalse_gfx950,0.0,224.0,1522.72
gfx950,256,176,7168,2048,False,torch.bfloat16,torch.bfloat16,False,False,asm,9,1,17.4199,_ZN5aiter37bf16gemm_fp32bf16_tn_96x64_pf3_splitkE,0.0,296.64,1871.66
gfx950,256,184,7168,1024,False,torch.bfloat16,torch.bfloat16,False,False,asm,9,1,11.3243,_ZN5aiter37bf16gemm_fp32bf16_tn_96x64_pf3_splitkE,0.0,238.53,1562.54
gfx950,256,184,7168,2048,False,torch.bfloat16,torch.bfloat16,False,False,asm,9,1,17.2726,_ZN5aiter37bf16gemm_fp32bf16_tn_96x64_pf3_splitkE,0.0,312.76,1896.16
gfx950,256,192,7168,1024,False,torch.bfloat16,torch.bfloat16,False,False,asm,9,1,11.2561,_ZN5aiter37bf16gemm_fp32bf16_tn_96x64_pf3_splitkE,0.0,250.4,1583.66
gfx950,256,192,7168,2048,False,torch.bfloat16,torch.bfloat16,False,False,asm,9,1,17.9259,_ZN5aiter37bf16gemm_fp32bf16_tn_96x64_pf3_splitkE,0.0,314.47,1835.28
gfx950,256,256,7168,512,False,torch.bfloat16,torch.bfloat16,False,False,triton,0,0,8.7892,auto,0.0,213.79,1282.5
gfx950,256,1,1536,1536,False,torch.bfloat16,torch.bfloat16,False,False,flydsl,36,8,6.0032,flydsl_gemm2_abf16_wbf16_bf16_t32x64x64_split_k8_block_m_warp1_block_n_warp4_async_copyTrue_b_to_ldsFalse_b_preshuffleFalse_c_to_ldsFalse_gfx950,0.0,0.79,787.04
gfx950,256,2,1536,1536,False,torch.bfloat16,torch.bfloat16,False,False,flydsl,36,8,5.6343,flydsl_gemm2_abf16_wbf16_bf16_t32x64x64_split_k8_block_m_warp1_block_n_warp4_async_copyTrue_b_to_ldsFalse_b_preshuffleFalse_c_to_ldsFalse_gfx950,0.0,1.67,839.66
gfx950,256,32,1536,1536,False,torch.bfloat16,torch.bfloat16,False,False,flydsl,215,4,6.5514,flydsl_gemm2_abf16_wbf16_bf16_t32x64x128_split_k4_block_m_warp2_block_n_warp2_async_copyTrue_b_to_ldsTrue_b_preshuffleFalse_c_to_ldsFalse_gfx950,0.0,23.05,750.25
gfx950,256,40,1536,1536,False,torch.bfloat16,torch.bfloat16,False,False,flydsl,215,4,6.9801,flydsl_gemm2_abf16_wbf16_bf16_t32x64x128_split_k4_block_m_warp2_block_n_warp2_async_copyTrue_b_to_ldsTrue_b_preshuffleFalse_c_to_ldsFalse_gfx950,0.0,27.04,711.21
gfx950,256,48,1536,1536,False,torch.bfloat16,torch.bfloat16,False,False,flydsl,215,4,7.3909,flydsl_gemm2_abf16_wbf16_bf16_t32x64x128_split_k4_block_m_warp2_block_n_warp2_async_copyTrue_b_to_ldsTrue_b_preshuffleFalse_c_to_ldsFalse_gfx950,0.0,30.64,678.33
gfx950,256,56,1536,1536,False,torch.bfloat16,torch.bfloat16,False,False,flydsl,215,4,7.7636,flydsl_gemm2_abf16_wbf16_bf16_t32x64x128_split_k4_block_m_warp2_block_n_warp2_async_copyTrue_b_to_ldsTrue_b_preshuffleFalse_c_to_ldsFalse_gfx950,0.0,34.04,652.1
gfx950,256,152,7168,1024,False,torch.bfloat16,torch.bfloat16,False,False,flydsl,271,1,11.208,flydsl_gemm2_abf16_wbf16_bf16_t64x64x128_split_k1_block_m_warp2_block_n_warp2_async_copyTrue_b_to_ldsTrue_b_preshuffleFalse_c_to_ldsFalse_gfx950,0.0,199.09,1531.98
gfx950,256,160,7168,1024,False,torch.bfloat16,torch.bfloat16,False,False,flydsl,301,1,12.0205,flydsl_gemm2_abf16_wbf16_bf16_t96x64x128_split_k1_block_m_warp2_block_n_warp2_async_copyTrue_b_to_ldsTrue_b_preshuffleFalse_c_to_ldsFalse_gfx950,0.0,195.4,1439.33
gfx950,256,264,7168,1024,False,torch.bfloat16,torch.bfloat16,False,False,flydsl,301,1,13.0316,flydsl_gemm2_abf16_wbf16_bf16_t96x64x128_split_k1_block_m_warp2_block_n_warp2_async_copyTrue_b_to_ldsTrue_b_preshuffleFalse_c_to_ldsFalse_gfx950,0.0,297.39,1458.41
gfx950,256,272,7168,1024,False,torch.bfloat16,torch.bfloat16,False,False,flydsl,301,1,13.1377,flydsl_gemm2_abf16_wbf16_bf16_t96x64x128_split_k1_block_m_warp2_block_n_warp2_async_copyTrue_b_to_ldsTrue_b_preshuffleFalse_c_to_ldsFalse_gfx950,0.0,303.93,1456.61
gfx950,256,296,7168,1024,False,torch.bfloat16,torch.bfloat16,False,False,flydsl,301,1,13.164,flydsl_gemm2_abf16_wbf16_bf16_t96x64x128_split_k1_block_m_warp2_block_n_warp2_async_copyTrue_b_to_ldsTrue_b_preshuffleFalse_c_to_ldsFalse_gfx950,0.0,330.09,1483.57
gfx950,256,304,7168,1024,False,torch.bfloat16,torch.bfloat16,False,False,flydsl,301,1,13.4057,flydsl_gemm2_abf16_wbf16_bf16_t96x64x128_split_k1_block_m_warp2_block_n_warp2_async_copyTrue_b_to_ldsTrue_b_preshuffleFalse_c_to_ldsFalse_gfx950,0.0,332.9,1466.61
gfx950,256,312,7168,1024,False,torch.bfloat16,torch.bfloat16,False,False,flydsl,301,1,13.5965,flydsl_gemm2_abf16_wbf16_bf16_t96x64x128_split_k1_block_m_warp2_block_n_warp2_async_copyTrue_b_to_ldsTrue_b_preshuffleFalse_c_to_ldsFalse_gfx950,0.0,336.87,1455.66
gfx950,256,320,7168,1024,False,torch.bfloat16,torch.bfloat16,False,False,flydsl,301,1,13.4864,flydsl_gemm2_abf16_wbf16_bf16_t96x64x128_split_k1_block_m_warp2_block_n_warp2_async_copyTrue_b_to_ldsTrue_b_preshuffleFalse_c_to_ldsFalse_gfx950,0.0,348.32,1477.26
gfx950,256,328,7168,1024,False,torch.bfloat16,torch.bfloat16,False,False,flydsl,301,1,13.5958,flydsl_gemm2_abf16_wbf16_bf16_t96x64x128_split_k1_block_m_warp2_block_n_warp2_async_copyTrue_b_to_ldsTrue_b_preshuffleFalse_c_to_ldsFalse_gfx950,0.0,354.16,1475.01
gfx950,256,336,7168,1024,False,torch.bfloat16,torch.bfloat16,False,False,flydsl,301,1,13.7168,flydsl_gemm2_abf16_wbf16_bf16_t96x64x128_split_k1_block_m_warp2_block_n_warp2_async_copyTrue_b_to_ldsTrue_b_preshuffleFalse_c_to_ldsFalse_gfx950,0.0,359.6,1471.56
gfx950,256,344,7168,1024,False,torch.bfloat16,torch.bfloat16,False,False,flydsl,301,1,13.8203,flydsl_gemm2_abf16_wbf16_bf16_t96x64x128_split_k1_block_m_warp2_block_n_warp2_async_copyTrue_b_to_ldsTrue_b_preshuffleFalse_c_to_ldsFalse_gfx950,0.0,365.4,1470.02
gfx950,256,352,7168,1024,False,torch.bfloat16,torch.bfloat16,False,False,flydsl,301,1,14.1414,flydsl_gemm2_abf16_wbf16_bf16_t96x64x128_split_k1_block_m_warp2_block_n_warp2_async_copyTrue_b_to_ldsTrue_b_preshuffleFalse_c_to_ldsFalse_gfx950,0.0,365.41,1445.91
gfx950,256,360,7168,1024,False,torch.bfloat16,torch.bfloat16,False,False,flydsl,301,1,14.1018,flydsl_gemm2_abf16_wbf16_bf16_t96x64x128_split_k1_block_m_warp2_block_n_warp2_async_copyTrue_b_to_ldsTrue_b_preshuffleFalse_c_to_ldsFalse_gfx950,0.0,374.76,1459.27
gfx950,256,368,7168,1024,False,torch.bfloat16,torch.bfloat16,False,False,flydsl,301,1,14.6026,flydsl_gemm2_abf16_wbf16_bf16_t96x64x128_split_k1_block_m_warp2_block_n_warp2_async_copyTrue_b_to_ldsTrue_b_preshuffleFalse_c_to_ldsFalse_gfx950,0.0,369.95,1418.2
gfx950,256,376,7168,1024,False,torch.bfloat16,torch.bfloat16,False,False,flydsl,301,1,14.543,flydsl_gemm2_abf16_wbf16_bf16_t96x64x128_split_k1_block_m_warp2_block_n_warp2_async_copyTrue_b_to_ldsTrue_b_preshuffleFalse_c_to_ldsFalse_gfx950,0.0,379.54,1433.02
gfx950,256,408,4096,512,False,torch.bfloat16,torch.bfloat16,False,False,flydsl,301,1,8.3591,flydsl_gemm2_abf16_wbf16_bf16_t96x64x128_split_k1_block_m_warp2_block_n_warp2_async_copyTrue_b_to_ldsTrue_b_preshuffleFalse_c_to_ldsFalse_gfx950,0.0,204.72,951.59
gfx950,256,416,4096,512,False,torch.bfloat16,torch.bfloat16,False,False,flydsl,301,1,8.3326,flydsl_gemm2_abf16_wbf16_bf16_t96x64x128_split_k1_block_m_warp2_block_n_warp2_async_copyTrue_b_to_ldsTrue_b_preshuffleFalse_c_to_ldsFalse_gfx950,0.0,209.4,963.47
gfx950,256,464,4096,512,False,torch.bfloat16,torch.bfloat16,False,False,flydsl,121,1,9.6804,flydsl_gemm2_abf16_wbf16_bf16_t96x64x64_split_k1_block_m_warp2_block_n_warp2_async_copyTrue_b_to_ldsTrue_b_preshuffleFalse_c_to_ldsFalse_gfx950,0.0,201.04,875.02
gfx950,256,472,4096,512,False,torch.bfloat16,torch.bfloat16,False,False,flydsl,121,1,9.6761,flydsl_gemm2_abf16_wbf16_bf16_t96x64x64_split_k1_block_m_warp2_block_n_warp2_async_copyTrue_b_to_ldsTrue_b_preshuffleFalse_c_to_ldsFalse_gfx950,0.0,204.6,883.03
gfx950,256,480,4096,512,False,torch.bfloat16,torch.bfloat16,False,False,flydsl,301,1,8.7323,flydsl_gemm2_abf16_wbf16_bf16_t96x64x128_split_k1_block_m_warp2_block_n_warp2_async_copyTrue_b_to_ldsTrue_b_preshuffleFalse_c_to_ldsFalse_gfx950,0.0,230.55,986.91
gfx950,256,504,4096,512,False,torch.bfloat16,torch.bfloat16,False,False,flydsl,301,1,8.4812,flydsl_gemm2_abf16_wbf16_bf16_t96x64x128_split_k1_block_m_warp2_block_n_warp2_async_copyTrue_b_to_ldsTrue_b_preshuffleFalse_c_to_ldsFalse_gfx950,0.0,249.25,1042.21
gfx950,256,128,384,7168,False,torch.bfloat16,torch.bfloat16,False,False,flydsl,217,8,11.5909,flydsl_gemm2_abf16_wbf16_bf16_t32x64x128_split_k8_block_m_warp2_block_n_warp2_async_copyTrue_b_to_ldsTrue_b_preshuffleFalse_c_to_ldsFalse_gfx950,0.0,60.79,641.74
gfx950,256,200,7168,512,False,torch.bfloat16,torch.bfloat16,False,False,flydsl,301,1,8.505,flydsl_gemm2_abf16_wbf16_bf16_t96x64x128_split_k1_block_m_warp2_block_n_warp2_async_copyTrue_b_to_ldsTrue_b_preshuffleFalse_c_to_ldsFalse_gfx950,0.0,172.6,1224.22
gfx950,256,232,7168,512,False,torch.bfloat16,torch.bfloat16,False,False,flydsl,271,1,8.6378,flydsl_gemm2_abf16_wbf16_bf16_t64x64x128_split_k1_block_m_warp2_block_n_warp2_async_copyTrue_b_to_ldsTrue_b_preshuffleFalse_c_to_ldsFalse_gfx950,0.0,197.14,1262.31
gfx950,256,24,1536,1536,False,torch.bfloat16,torch.bfloat16,False,False,flydsl,215,4,6.8803,flydsl_gemm2_abf16_wbf16_bf16_t32x64x128_split_k4_block_m_warp2_block_n_warp2_async_copyTrue_b_to_ldsTrue_b_preshuffleFalse_c_to_ldsFalse_gfx950,0.0,16.46,707.25
gfx950,256,432,4096,512,False,torch.bfloat16,torch.bfloat16,False,False,flydsl,271,1,8.1125,flydsl_gemm2_abf16_wbf16_bf16_t64x64x128_split_k1_block_m_warp2_block_n_warp2_async_copyTrue_b_to_ldsTrue_b_preshuffleFalse_c_to_ldsFalse_gfx950,0.0,223.35,1007.78
gfx950,256,440,4096,512,False,torch.bfloat16,torch.bfloat16,False,False,flydsl,121,1,9.56,flydsl_gemm2_abf16_wbf16_bf16_t96x64x64_split_k1_block_m_warp2_block_n_warp2_async_copyTrue_b_to_ldsTrue_b_preshuffleFalse_c_to_ldsFalse_gfx950,0.0,193.04,862.9
gfx950,256,4,7168,1024,False,torch.bfloat16,torch.bfloat16,False,False,flydsl,45,4,7.3877,flydsl_gemm2_abf16_wbf16_bf16_t32x128x64_split_k4_block_m_warp2_block_n_warp2_async_copyTrue_b_to_ldsTrue_b_preshuffleFalse_c_to_ldsFalse_gfx950,0.0,7.95,1995.96
gfx950,256,184,7168,512,False,torch.bfloat16,torch.bfloat16,False,False,flydsl,271,1,7.7607,flydsl_gemm2_abf16_wbf16_bf16_t64x64x128_split_k1_block_m_warp2_block_n_warp2_async_copyTrue_b_to_ldsTrue_b_preshuffleFalse_c_to_ldsFalse_gfx950,0.0,174.03,1309.97
gfx950,256,216,7168,512,False,torch.bfloat16,torch.bfloat16,False,False,flydsl,91,1,9.8614,flydsl_gemm2_abf16_wbf16_bf16_t64x64x64_split_k1_block_m_warp2_block_n_warp2_async_copyTrue_b_to_ldsTrue_b_preshuffleFalse_c_to_ldsFalse_gfx950,0.0,160.77,1080.76
gfx950,256,48,1024,7168,False,torch.bfloat16,torch.bfloat16,False,False,flydsl,277,8,12.0728,flydsl_gemm2_abf16_wbf16_bf16_t64x64x128_split_k8_block_m_warp2_block_n_warp2_async_copyTrue_b_to_ldsTrue_b_preshuffleFalse_c_to_ldsFalse_gfx950,0.0,58.37,1281.1
