aiter/configs/model_configs/kimi_bf16_tuned_gemm.csv
gfx,cu_num,M,N,K,bias,dtype,outdtype,scaleAB,bpreshuffle,libtype,solidx,splitK,us,kernelName,err_ratio,tflops,bw
gfx950,256,32,384,7168,False,torch.bfloat16,torch.bfloat16,False,False,flydsl,40,7,8.7903,flydsl_gemm2_abf16_wbf16_bf16_t16x64x256_split_k7_block_m_warp1_block_n_warp2_async_copyTrue_b_to_ldsFalse_b_preshuffleFalse_c_to_ldsFalse_gfx950,0.0194,20.04,681.25
gfx950,256,64,384,7168,False,torch.bfloat16,torch.bfloat16,False,False,flydsl,281,7,9.3621,flydsl_gemm2_abf16_wbf16_bf16_t32x64x256_split_k7_block_m_warp1_block_n_warp4_async_copyTrue_b_to_ldsFalse_b_preshuffleFalse_c_to_ldsFalse_gfx950,0.0204,37.63,691.26
gfx950,256,96,384,7168,False,torch.bfloat16,torch.bfloat16,False,False,flydsl,280,7,9.3101,flydsl_gemm2_abf16_wbf16_bf16_t32x64x256_split_k7_block_m_warp1_block_n_warp2_async_copyTrue_b_to_ldsFalse_b_preshuffleFalse_c_to_ldsFalse_gfx950,0.0205,56.76,747.04
gfx950,256,256,384,7168,False,torch.bfloat16,torch.bfloat16,False,False,opus,1212,8,13.4977,opus_gemm_flatmm_splitk_256x32x96x64_2x1_16x16x32_0x0x0_wgpcu2_nooob,0.0,104.41,694.31
gfx950,256,512,384,7168,False,torch.bfloat16,torch.bfloat16,False,False,opus,1200,5,14.9901,opus_gemm_flatmm_splitk_256x64x64x64_2x1_16x16x32_0x0x0_wgpcu2_nooob,0.0,188.03,883.13
gfx950,256,1024,384,7168,False,torch.bfloat16,torch.bfloat16,False,False,asm,7,3,20.5706,_ZN5aiter39bf16gemm_fp32bf16_tn_80x64_splitk_cleanE,0.0104,274.04,1019.49
gfx950,256,2048,384,7168,False,torch.bfloat16,torch.bfloat16,False,False,torch,0,0,28.3933,native,0.0,397.08,1283.33
gfx950,256,4096,384,7168,False,torch.bfloat16,torch.bfloat16,False,False,torch,0,0,48.3114,native,0.0,466.73,1394.52
gfx950,256,8192,384,7168,False,torch.bfloat16,torch.bfloat16,False,False,torch,0,0,73.9355,native,0.0,609.95,1747.97
gfx950,256,16384,384,7168,False,torch.bfloat16,torch.bfloat16,False,False,torch,0,0,99.8904,native,0.0,902.93,2532.47
gfx950,256,96,1024,7168,False,torch.bfloat16,torch.bfloat16,False,False,opus,1218,8,12.8348,opus_gemm_flatmm_splitk_256x96x32x64_2x1_16x16x32_0x0x0_wgpcu2_nooob,0.0,109.8,1266.32
gfx950,256,128,1024,7168,False,torch.bfloat16,torch.bfloat16,False,False,opus,1200,8,13.3287,opus_gemm_flatmm_splitk_256x64x64x64_2x1_16x16x32_0x0x0_wgpcu2_nooob,0.0,140.98,1258.73
gfx950,256,256,1024,7168,False,torch.bfloat16,torch.bfloat16,False,False,asm,8,5,16.3421,_ZN5aiter39bf16gemm_fp32bf16_tn_96x64_splitk_cleanE,0.0164,229.96,1154.95
gfx950,256,512,1024,7168,False,torch.bfloat16,torch.bfloat16,False,False,torch,0,0,19.4215,native,0.0,387.0,1187.79
gfx950,256,1024,1024,7168,False,torch.bfloat16,torch.bfloat16,False,False,torch,0,0,28.046,native,0.0,535.99,1121.63
gfx950,256,2048,1024,7168,False,torch.bfloat16,torch.bfloat16,False,False,torch,0,0,43.9829,native,0.0,683.56,1096.66
gfx950,256,4096,1024,7168,False,torch.bfloat16,torch.bfloat16,False,False,torch,0,0,68.9699,native,0.0,871.82,1185.86
gfx950,256,8192,1024,7168,False,torch.bfloat16,torch.bfloat16,False,False,opus,1401,0,107.1617,opus_gemm_mono_tile_512x128x256x64_2x4_16x16x32_0x0x0_nooob,0.0,1122.22,1389.47
gfx950,256,16384,1024,7168,False,torch.bfloat16,torch.bfloat16,False,False,torch,0,0,167.2162,native,0.0,1438.37,1693.11
gfx950,256,32,2112,7168,False,torch.bfloat16,torch.bfloat16,False,False,flydsl,55,7,12.3351,flydsl_gemm2_abf16_wbf16_bf16_t32x64x256_split_k7_block_m_warp1_block_n_warp4_async_copyTrue_b_to_ldsFalse_b_preshuffleFalse_c_to_ldsFalse_gfx950,0.0196,78.55,2502.74
gfx950,256,64,2112,7168,False,torch.bfloat16,torch.bfloat16,False,False,opus,200,7,14.2911,opus_gemm_flatmm_splitk_256x64x64x64_2x1_16x16x32_0x0x0_wgpcu2,0.0,135.59,2201.75
gfx950,256,256,2112,7168,False,torch.bfloat16,torch.bfloat16,False,False,asm,8,2,28.3005,_ZN5aiter39bf16gemm_fp32bf16_tn_96x64_splitk_cleanE,0.006,273.88,1237.75
gfx950,256,1024,2112,7168,False,torch.bfloat16,torch.bfloat16,False,False,torch,0,0,51.9154,native,0.0,597.21,949.3
gfx950,256,4096,2112,7168,False,torch.bfloat16,torch.bfloat16,False,False,torch,0,0,114.1594,native,0.0,1086.35,931.15
gfx950,256,16384,2112,7168,False,torch.bfloat16,torch.bfloat16,False,False,opus,2009,0,442.3447,opus_gemm_512x256x256x64_2x4_16x16x32_0x0x0_cA1cB17,0.0,1121.45,755.89
gfx950,256,256,3072,1536,False,torch.bfloat16,torch.bfloat16,False,False,torch,0,0,10.5882,native,0.0,228.17,1114.12
gfx950,256,1024,3072,1536,False,torch.bfloat16,torch.bfloat16,False,False,torch,0,0,17.9972,native,0.0,536.95,1048.74
gfx950,256,4096,3072,1536,False,torch.bfloat16,torch.bfloat16,False,False,torch,0,0,39.7173,native,0.0,973.25,1188.04
gfx950,256,16384,3072,1536,False,torch.bfloat16,torch.bfloat16,False,False,torch,0,0,127.3489,native,0.0,1214.14,1259.78
gfx950,256,256,4096,512,False,torch.bfloat16,torch.bfloat16,False,False,flydsl,522,1,5.7974,flydsl_gemm2_abf16_wbf16_bf16_t64x64x256_split_k1_block_m_warp2_block_n_warp2_async_copyTrue_b_to_ldsTrue_b_preshuffleFalse_c_to_ldsFalse_gfx950,0.0,185.21,1130.44
gfx950,256,1024,4096,512,False,torch.bfloat16,torch.bfloat16,False,False,torch,0,0,10.1942,native,0.0,421.31,1337.18
gfx950,256,4096,4096,512,False,torch.bfloat16,torch.bfloat16,False,False,torch,0,0,21.2784,native,0.0,807.39,1971.16
gfx950,256,16384,4096,512,False,torch.bfloat16,torch.bfloat16,False,False,torch,0,0,78.0099,native,0.0,880.91,1989.35
gfx950,256,96,7168,512,False,torch.bfloat16,torch.bfloat16,False,False,flydsl,435,1,6.007,flydsl_gemm2_abf16_wbf16_bf16_t64x64x256_split_k1_block_m_warp1_block_n_warp4_async_copyTrue_b_to_ldsTrue_b_preshuffleFalse_c_to_ldsFalse_gfx950,0.0,117.3,1467.39
gfx950,256,128,7168,512,False,torch.bfloat16,torch.bfloat16,False,False,flydsl,522,1,6.0398,flydsl_gemm2_abf16_wbf16_bf16_t64x64x256_split_k1_block_m_warp2_block_n_warp2_async_copyTrue_b_to_ldsTrue_b_preshuffleFalse_c_to_ldsFalse_gfx950,0.0,155.56,1540.8
gfx950,256,256,7168,512,False,torch.bfloat16,torch.bfloat16,False,False,flydsl,507,1,7.3211,flydsl_gemm2_abf16_wbf16_bf16_t64x64x128_split_k1_block_m_warp2_block_n_warp2_async_copyTrue_b_to_ldsTrue_b_preshuffleFalse_c_to_ldsFalse_gfx950,0.0,256.66,1539.69
gfx950,256,1024,7168,512,False,torch.bfloat16,torch.bfloat16,False,False,flydsl,25,1,14.0004,flydsl_gemm2_abf16_wbf16_bf16_t128x128x64_split_k1_block_m_warp2_block_n_warp2_async_copyTrue_b_to_ldsTrue_b_preshuffleFalse_c_to_ldsFalse_gfx950,0.0,536.86,1647.72
gfx950,256,4096,7168,512,False,torch.bfloat16,torch.bfloat16,False,False,asm,10,1,40.4141,_ZN5aiter24bf16gemm_bf16_tn_256x256E,0.0,743.92,1738.37
gfx950,256,16384,7168,512,False,torch.bfloat16,torch.bfloat16,False,False,torch,0,0,131.6552,native,0.0,913.44,1967.25
gfx950,256,8192,8192,8192,False,torch.bfloat16,torch.bfloat16,False,False,asm,10,1,688.6517,_ZN5aiter24bf16gemm_bf16_tn_256x256E,0.0,1596.61,584.7
