aiter/configs/model_configs/kimi-2_fp4_tuned_fmoe.csv
cu_num,token,model_dim,inter_dim,expert,topk,act_type,dtype,q_dtype_a,q_dtype_w,q_type,use_g1u1,doweight_stage1,block_m,ksplit,us1,kernelName1,err1,us2,kernelName2,err2,us,run_1stage,tflops,bw,_tag
256,1,7168,256,384,8,ActivationType.Silu,torch.bfloat16,torch.float4_e2m1fn_x2,torch.float4_e2m1fn_x2,QuantType.per_1x32,1,0,32,0,13.0327,flydsl_moe1_afp4_wfp4_bf16_t32x128x256_w3_kb14_go_fq,18.4%,6.9305,moe_ck2stages_gemm2_64x32x32x128_1x1_MulABScaleExpertWeightShuffled_v1_Nswizzle0_Quant3_MulRoutedWeight1_FP4X2_FP4X2_B16,1.2%,19.9632,0,4.41,105892.38,
256,2,7168,256,384,8,ActivationType.Silu,torch.bfloat16,torch.float4_e2m1fn_x2,torch.float4_e2m1fn_x2,QuantType.per_1x32,1,0,32,0,15.3559,flydsl_moe1_afp4_wfp4_bf16_t32x128x256_w3_kb7_go_fq,16.6%,8.9699,moe_ck2stages_gemm2_64x32x32x128_1x1_MulABScaleExpertWeightShuffled_v1_Nswizzle0_Quant3_MulRoutedWeight1_FP4X2_FP4X2_B16,1.3%,24.3258,0,7.24,86902.47,
256,4,7168,256,384,8,ActivationType.Silu,torch.bfloat16,torch.float4_e2m1fn_x2,torch.float4_e2m1fn_x2,QuantType.per_1x32,1,0,32,0,20.4692,flydsl_moe1_afp4_wfp4_bf16_t32x128x256_w3_kb4_go_fq,15.7%,12.3738,flydsl_moe2_afp4_wfp4_bf16_t32x128x256_atomic,1.2%,32.843,0,10.73,64367.3,
256,8,7168,256,384,8,ActivationType.Silu,torch.bfloat16,torch.float4_e2m1fn_x2,torch.float4_e2m1fn_x2,QuantType.per_1x32,1,0,32,0,29.9834,flydsl_moe1_afp4_wfp4_bf16_t32x32x256_w4_bnt0,0.0%,18.0739,flydsl_moe2_afp4_wfp4_bf16_t32x256x256_atomic,1.2%,48.0573,0,14.66,43991.26,
256,16,7168,256,384,8,ActivationType.Silu,torch.bfloat16,torch.float4_e2m1fn_x2,torch.float4_e2m1fn_x2,QuantType.per_1x32,1,0,32,0,44.8593,flydsl_moe1_afp4_wfp4_bf16_t32x64x256_w3,0.0%,27.708,flydsl_moe2_afp4_wfp4_bf16_t32x256x256_atomic,1.2%,72.5673,0,19.42,29135.34,
256,32,7168,256,384,8,ActivationType.Silu,torch.bfloat16,torch.float4_e2m1fn_x2,torch.float4_e2m1fn_x2,QuantType.per_1x32,1,0,32,0,79.8461,flydsl_moe1_afp4_wfp4_bf16_t32x64x256_w4_fq,17.6%,47.118,flydsl_moe2_afp4_wfp4_bf16_t32x128x256_atomic,1.2%,126.9641,0,22.2,16655.24,
256,64,7168,256,384,8,ActivationType.Silu,torch.bfloat16,torch.float4_e2m1fn_x2,torch.float4_e2m1fn_x2,QuantType.per_1x32,1,0,32,0,120.0415,flydsl_moe1_afp4_wfp4_bf16_t32x128x256_w4,0.0%,69.907,flydsl_moe2_afp4_wfp4_bf16_t16x128x256_atomic_sbm32,1.1%,189.9485,0,29.68,11136.21,
256,128,7168,256,384,8,ActivationType.Silu,torch.bfloat16,torch.float4_e2m1fn_x2,torch.float4_e2m1fn_x2,QuantType.per_1x32,1,0,32,0,121.1553,flydsl_moe1_afp4_wfp4_bf16_t32x128x256_w4,0.0%,72.1231,flydsl_moe2_afp4_wfp4_bf16_t16x128x256_atomic_persist_sbm32,1.2%,193.2784,0,58.33,10951.47,
256,256,7168,256,384,8,ActivationType.Silu,torch.bfloat16,torch.float4_e2m1fn_x2,torch.float4_e2m1fn_x2,QuantType.per_1x32,1,0,32,0,117.5863,flydsl_moe1_afp4_wfp4_bf16_t32x128x256_w4_fq,17.6%,77.0339,flydsl_moe2_afp4_wfp4_bf16_t16x128x256_atomic_persist_sbm32,1.2%,194.6202,0,115.86,10890.1,
256,512,7168,256,384,8,ActivationType.Silu,torch.bfloat16,torch.float4_e2m1fn_x2,torch.float4_e2m1fn_x2,QuantType.per_1x32,1,0,32,0,118.1348,flydsl_moe1_afp4_wfp4_bf16_t32x128x256_w3_fq,17.0%,83.2687,flydsl_moe2_afp4_wfp4_bf16_t16x128x256_atomic_sbm32,1.2%,201.4035,0,223.91,10550.66,
256,1024,7168,256,384,8,ActivationType.Silu,torch.bfloat16,torch.float4_e2m1fn_x2,torch.float4_e2m1fn_x2,QuantType.per_1x32,1,0,32,0,121.1038,flydsl_moe1_afp4_wfp4_bf16_t32x128x256_w4_fq,17.3%,106.4711,flydsl_moe2_afp4_wfp4_bf16_t32x128x256_atomic,1.2%,227.5749,0,396.33,9385.7,
256,2048,7168,256,384,8,ActivationType.Silu,torch.bfloat16,torch.float4_e2m1fn_x2,torch.float4_e2m1fn_x2,QuantType.per_1x32,1,0,64,0,133.35320000000002,flydsl_moe1_afp4_wfp4_bf16_t64x64x256_w3,0.0%,157.831,flydsl_moe2_afp4_wfp4_bf16_t64x256x256_reduce,0.0%,291.1842,0,619.5,7411.01,
256,4096,7168,256,384,8,ActivationType.Silu,torch.bfloat16,torch.float4_e2m1fn_x2,torch.float4_e2m1fn_x2,QuantType.per_1x32,1,0,128,0,155.4298,flydsl_moe1_afp4_wfp4_bf16_t128x128x256,0.0%,259.4575,flydsl_moe2_afp4_wfp4_bf16_t64x256x256_reduce_sbm128,0.0%,414.8873,0,869.58,5307.49,
256,8192,7168,256,384,8,ActivationType.Silu,torch.bfloat16,torch.float4_e2m1fn_x2,torch.float4_e2m1fn_x2,QuantType.per_1x32,1,0,128,0,256.5029,moe_ck2stages_gemm1_256x128x128x128_1x4_MulABScaleShuffled_v3_Nswizzle0_Quant3_MulRoutedWeight0_silu_FP4X2_FP4X2_B16,0.0%,449.4816,flydsl_moe2_afp4_wfp4_bf16_t64x256x256_reduce_persist_sbm128,0.0%,705.9845,0,1022.05,3243.82,
256,16384,7168,256,384,8,ActivationType.Silu,torch.bfloat16,torch.float4_e2m1fn_x2,torch.float4_e2m1fn_x2,QuantType.per_1x32,1,0,128,0,410.265,flydsl_moe1_afp4_wfp4_bf16_t128x64x256_w4_bnt0,0.0%,931.3993,flydsl_moe2_afp4_wfp4_bf16_t64x256x256_reduce_sbm128,0.0%,1341.6643,0,1075.61,1838.2,
256,32768,7168,256,384,8,ActivationType.Silu,torch.bfloat16,torch.float4_e2m1fn_x2,torch.float4_e2m1fn_x2,QuantType.per_1x32,1,0,128,0,643.6717000000001,moe_ck2stages_gemm1_256x128x128x128_1x4_MulABScaleShuffled_v3_Nswizzle0_Quant3_MulRoutedWeight0_silu_FP4X2_FP4X2_B16,0.0%,1732.0907,flydsl_moe2_afp4_wfp4_bf16_t64x256x256_reduce_sbm128,0.0%,2375.7624,0,1214.86,1186.39,
256,1,7168,512,384,8,ActivationType.Silu,torch.bfloat16,torch.float4_e2m1fn_x2,torch.float4_e2m1fn_x2,QuantType.per_1x32,1,0,32,0,16.0124,flydsl_moe1_afp4_wfp4_bf16_t32x128x256_w3_kb7_go_fq,12.9%,7.3772,moe_ck2stages_gemm2_256x32x128x128_1x4_MulABScaleExpertWeightShuffled_v3_Nswizzle0_Quant3_MulRoutedWeight1_FP4X2_FP4X2_B16,2.7%,23.3896,0,7.53,180758.97,
256,2,7168,512,384,8,ActivationType.Silu,torch.bfloat16,torch.float4_e2m1fn_x2,torch.float4_e2m1fn_x2,QuantType.per_1x32,1,0,32,0,21.6164,flydsl_moe1_afp4_wfp4_bf16_t32x128x256_w3_kb4_go_fq,15.7%,12.4595,moe_ck2stages_gemm2_256x32x128x128_1x4_MulABScaleExpertWeightShuffled_v3_Nswizzle0_Quant3_MulRoutedWeight1_FP4X2_FP4X2_B16,2.9%,34.0759,0,10.34,124073.07,
256,4,7168,512,384,8,ActivationType.Silu,torch.bfloat16,torch.float4_e2m1fn_x2,torch.float4_e2m1fn_x2,QuantType.per_1x32,1,0,32,0,29.5175,flydsl_moe1_afp4_wfp4_bf16_t32x32x256_w3,0.0%,16.9126,moe_ck2stages_gemm2_64x32x32x128_1x1_MulABScaleExpertWeightShuffled_v1_Nswizzle0_Quant3_MulRoutedWeight1_FP4X2_FP4X2_B16,2.7%,46.4301,0,15.18,91060.42,
256,8,7168,512,384,8,ActivationType.Silu,torch.bfloat16,torch.float4_e2m1fn_x2,torch.float4_e2m1fn_x2,QuantType.per_1x32,1,0,32,0,44.7118,flydsl_moe1_afp4_wfp4_bf16_t32x64x256_w4,0.0%,28.3435,flydsl_moe2_afp4_wfp4_bf16_t32x128x256_atomic,2.7%,73.0553,0,19.29,57874.38,
256,16,7168,512,384,8,ActivationType.Silu,torch.bfloat16,torch.float4_e2m1fn_x2,torch.float4_e2m1fn_x2,QuantType.per_1x32,1,0,32,0,83.20060000000001,flydsl_moe1_afp4_wfp4_bf16_t32x64x256_w2,0.0%,46.7144,moe_ck2stages_gemm2_64x32x32x128_1x1_MulABScaleExpertWeightShuffled_v1_Nswizzle0_Quant3_MulRoutedWeight1_FP4X2_FP4X2_B16,2.7%,129.915,0,21.7,32545.91,
256,32,7168,512,384,8,ActivationType.Silu,torch.bfloat16,torch.float4_e2m1fn_x2,torch.float4_e2m1fn_x2,QuantType.per_1x32,1,0,64,0,152.8222,flydsl_moe1_afp4_wfp4_bf16_t64x128x256_w4_fq,17.0%,87.3053,flydsl_moe2_afp4_wfp4_bf16_t32x128x256_atomic_sbm64,2.8%,240.1275,0,23.48,17609.59,
256,64,7168,512,384,8,ActivationType.Silu,torch.bfloat16,torch.float4_e2m1fn_x2,torch.float4_e2m1fn_x2,QuantType.per_1x32,1,0,32,0,231.2608,flydsl_moe1_afp4_wfp4_bf16_t32x64x256_w2,0.0%,122.1947,moe_ck2stages_gemm2_64x32x32x128_1x1_MulABScaleExpertWeightShuffled_v1_Nswizzle0_Quant3_MulRoutedWeight1_FP4X2_FP4X2_B16,2.7%,353.4555,0,31.9,11965.4,
256,128,7168,512,384,8,ActivationType.Silu,torch.bfloat16,torch.float4_e2m1fn_x2,torch.float4_e2m1fn_x2,QuantType.per_1x32,1,0,32,0,229.0831,flydsl_moe1_afp4_wfp4_bf16_t32x64x256_w3_fq,17.7%,127.5809,moe_ck2stages_gemm2_64x32x32x128_1x1_MulABScaleExpertWeightShuffled_v1_Nswizzle0_Quant3_MulRoutedWeight1_FP4X2_FP4X2_B16,2.7%,356.664,0,63.22,11861.61,
256,256,7168,512,384,8,ActivationType.Silu,torch.bfloat16,torch.float4_e2m1fn_x2,torch.float4_e2m1fn_x2,QuantType.per_1x32,1,0,32,0,229.7597,flydsl_moe1_afp4_wfp4_bf16_t32x128x256_w3_fq,17.5%,134.4165,moe_ck2stages_gemm2_256x32x128x128_1x4_MulABScaleExpertWeightShuffled_v3_Nswizzle0_Quant3_MulRoutedWeight1_FP4X2_FP4X2_B16,2.7%,364.1762,0,123.83,11624.49,
256,512,7168,512,384,8,ActivationType.Silu,torch.bfloat16,torch.float4_e2m1fn_x2,torch.float4_e2m1fn_x2,QuantType.per_1x32,1,0,32,0,229.9123,flydsl_moe1_afp4_wfp4_bf16_t32x128x256_w3_fq,17.3%,144.5169,flydsl_moe2_afp4_wfp4_bf16_t32x256x256_atomic_persist,2.7%,374.4292,0,240.88,11320.88,
256,1024,7168,512,384,8,ActivationType.Silu,torch.bfloat16,torch.float4_e2m1fn_x2,torch.float4_e2m1fn_x2,QuantType.per_1x32,1,0,32,0,234.2343,flydsl_moe1_afp4_wfp4_bf16_t32x128x256_w3_fq,17.3%,159.2849,flydsl_moe2_afp4_wfp4_bf16_t32x256x256_atomic,2.7%,393.5192,0,458.4,10799.67,
256,2048,7168,512,384,8,ActivationType.Silu,torch.bfloat16,torch.float4_e2m1fn_x2,torch.float4_e2m1fn_x2,QuantType.per_1x32,1,0,64,0,241.4759,flydsl_moe1_afp4_wfp4_bf16_t64x128x256_w4_fq,17.3%,207.1299,flydsl_moe2_afp4_wfp4_bf16_t64x128x256_atomic,2.7%,448.6058,0,804.22,9522.61,
256,4096,7168,512,384,8,ActivationType.Silu,torch.bfloat16,torch.float4_e2m1fn_x2,torch.float4_e2m1fn_x2,QuantType.per_1x32,1,0,128,0,295.9746,flydsl_moe1_afp4_wfp4_bf16_t128x128x256_w3,0.0%,369.7372,flydsl_moe2_afp4_wfp4_bf16_t64x128x256_reduce_persist_sbm128,0.3%,665.7118,0,1083.88,6483.19,
256,8192,7168,512,384,8,ActivationType.Silu,torch.bfloat16,torch.float4_e2m1fn_x2,torch.float4_e2m1fn_x2,QuantType.per_1x32,1,0,128,0,485.9614,moe_ck2stages_gemm1_256x128x128x128_1x4_MulABScaleShuffled_v3_Nswizzle0_Quant3_MulRoutedWeight0_silu_FP4X2_FP4X2_B16,0.0%,602.2726,flydsl_moe2_afp4_wfp4_bf16_t64x128x256_reduce_persist_sbm128,0.3%,1088.234,0,1326.1,4046.94,
256,16384,7168,512,384,8,ActivationType.Silu,torch.bfloat16,torch.float4_e2m1fn_x2,torch.float4_e2m1fn_x2,QuantType.per_1x32,1,0,128,0,660.9272,moe_ck2stages_gemm1_256x128x128x128_1x4_MulABScaleShuffled_v3_Nswizzle0_Quant3_MulRoutedWeight0_silu_FP4X2_FP4X2_B16,0.0%,1190.5697,flydsl_moe2_afp4_wfp4_bf16_t64x128x256_reduce_sbm128,0.3%,1851.4969,0,1558.86,2473.77,
256,32768,7168,512,384,8,ActivationType.Silu,torch.bfloat16,torch.float4_e2m1fn_x2,torch.float4_e2m1fn_x2,QuantType.per_1x32,1,0,128,0,1183.0443,moe_ck2stages_gemm1_256x128x128x128_1x4_MulABScaleShuffled_v3_Nswizzle0_Quant3_MulRoutedWeight0_silu_FP4X2_FP4X2_B16,0.0%,2300.0423,flydsl_moe2_afp4_wfp4_bf16_t64x128x256_reduce_sbm128,0.3%,3483.0866,0,1657.28,1416.13,
256,1,7168,256,384,8,ActivationType.Silu,torch.bfloat16,torch.float4_e2m1fn_x2,torch.float4_e2m1fn_x2,QuantType.per_1x32,1,0,32,0,25.1598,moe_ck2stages_gemm1_64x32x32x128_1x1_MulABScaleShuffled_v3_Nswizzle0_Quant3_MulRoutedWeight0_silu_FP4X2_FP4X2_B16,0.0,6.9305,moe_ck2stages_gemm2_64x32x32x128_1x1_MulABScaleExpertWeightShuffled_v1_Nswizzle0_Quant3_MulRoutedWeight1_FP4X2_FP4X2_B16,0.0124,32.0903,0,0.0,0.0,flydsl_fallback
256,2,7168,256,384,8,ActivationType.Silu,torch.bfloat16,torch.float4_e2m1fn_x2,torch.float4_e2m1fn_x2,QuantType.per_1x32,1,0,32,0,25.5847,moe_ck2stages_gemm1_64x32x32x128_1x1_MulABScaleShuffled_v3_Nswizzle0_Quant3_MulRoutedWeight0_silu_FP4X2_FP4X2_B16,0.0,8.9699,moe_ck2stages_gemm2_64x32x32x128_1x1_MulABScaleExpertWeightShuffled_v1_Nswizzle0_Quant3_MulRoutedWeight1_FP4X2_FP4X2_B16,0.0133,34.5546,0,0.0,0.0,flydsl_fallback
256,4,7168,256,384,8,ActivationType.Silu,torch.bfloat16,torch.float4_e2m1fn_x2,torch.float4_e2m1fn_x2,QuantType.per_1x32,1,0,32,0,27.5806,moe_ck2stages_gemm1_64x32x32x128_1x1_MulABScaleShuffled_v3_Nswizzle0_Quant3_MulRoutedWeight0_silu_FP4X2_FP4X2_B16,0.0,13.9769,moe_ck2stages_gemm2_64x32x32x128_1x1_MulABScaleExpertWeightShuffled_v1_Nswizzle0_Quant3_MulRoutedWeight1_FP4X2_FP4X2_B16,0.0119,41.5575,0,0.0,0.0,flydsl_fallback
256,8,7168,256,384,8,ActivationType.Silu,torch.bfloat16,torch.float4_e2m1fn_x2,torch.float4_e2m1fn_x2,QuantType.per_1x32,1,0,32,0,32.1719,moe_ck2stages_gemm1_64x32x32x128_1x1_MulABScaleShuffled_v3_Nswizzle0_Quant3_MulRoutedWeight0_silu_FP4X2_FP4X2_B16,0.0,18.4884,moe_ck2stages_gemm2_64x32x32x128_1x1_MulABScaleExpertWeightShuffled_v1_Nswizzle0_Quant3_MulRoutedWeight1_FP4X2_FP4X2_B16,0.0122,50.6603,0,0.0,0.0,flydsl_fallback
256,16,7168,256,384,8,ActivationType.Silu,torch.bfloat16,torch.float4_e2m1fn_x2,torch.float4_e2m1fn_x2,QuantType.per_1x32,1,0,32,0,50.0999,moe_ck2stages_gemm1_64x32x32x128_1x1_MulABScaleShuffled_v3_Nswizzle0_Quant3_MulRoutedWeight0_silu_FP4X2_FP4X2_B16,0.0,29.2858,moe_ck2stages_gemm2_64x32x32x128_1x1_MulABScaleExpertWeightShuffled_v1_Nswizzle0_Quant3_MulRoutedWeight1_FP4X2_FP4X2_B16,0.0124,79.3857,0,0.0,0.0,flydsl_fallback
256,32,7168,256,384,8,ActivationType.Silu,torch.bfloat16,torch.float4_e2m1fn_x2,torch.float4_e2m1fn_x2,QuantType.per_1x32,1,0,32,0,92.3419,moe_ck2stages_gemm1_64x32x32x128_1x1_MulABScaleShuffled_v3_Nswizzle0_Quant3_MulRoutedWeight0_silu_FP4X2_FP4X2_B16,0.0,49.1302,moe_ck2stages_gemm2_64x32x32x128_1x1_MulABScaleExpertWeightShuffled_v1_Nswizzle0_Quant3_MulRoutedWeight1_FP4X2_FP4X2_B16,0.012,141.4721,0,0.0,0.0,flydsl_fallback
256,64,7168,256,384,8,ActivationType.Silu,torch.bfloat16,torch.float4_e2m1fn_x2,torch.float4_e2m1fn_x2,QuantType.per_1x32,1,0,32,0,132.7895,moe_ck2stages_gemm1_64x32x32x128_1x1_MulABScaleShuffled_v3_Nswizzle0_Quant3_MulRoutedWeight0_silu_FP4X2_FP4X2_B16,0.0,70.7631,moe_ck2stages_gemm2_64x32x32x128_1x1_MulABScaleExpertWeightShuffled_v1_Nswizzle0_Quant3_MulRoutedWeight1_FP4X2_FP4X2_B16,0.011,203.5526,0,0.0,0.0,flydsl_fallback
256,128,7168,256,384,8,ActivationType.Silu,torch.bfloat16,torch.float4_e2m1fn_x2,torch.float4_e2m1fn_x2,QuantType.per_1x32,1,0,32,0,134.3482,moe_ck2stages_gemm1_256x32x128x128_1x4_MulABScaleShuffled_v3_Nswizzle0_Quant3_MulRoutedWeight0_silu_FP4X2_FP4X2_B16,0.0,73.8827,moe_ck2stages_gemm2_64x32x32x128_1x1_MulABScaleExpertWeightShuffled_v1_Nswizzle0_Quant3_MulRoutedWeight1_FP4X2_FP4X2_B16,0.0117,208.2309,0,0.0,0.0,flydsl_fallback
256,256,7168,256,384,8,ActivationType.Silu,torch.bfloat16,torch.float4_e2m1fn_x2,torch.float4_e2m1fn_x2,QuantType.per_1x32,1,0,32,0,134.174,moe_ck2stages_gemm1_64x32x32x128_1x1_MulABScaleShuffled_v3_Nswizzle0_Quant3_MulRoutedWeight0_silu_FP4X2_FP4X2_B16,0.0,78.0407,moe_ck2stages_gemm2_64x32x32x128_1x1_MulABScaleExpertWeightShuffled_v1_Nswizzle0_Quant3_MulRoutedWeight1_FP4X2_FP4X2_B16,0.0116,212.2147,0,0.0,0.0,flydsl_fallback
256,512,7168,256,384,8,ActivationType.Silu,torch.bfloat16,torch.float4_e2m1fn_x2,torch.float4_e2m1fn_x2,QuantType.per_1x32,1,0,32,0,136.7853,moe_ck2stages_gemm1_256x32x128x128_1x4_MulABScaleShuffled_v3_Nswizzle0_Quant3_MulRoutedWeight0_silu_FP4X2_FP4X2_B16,0.0,88.7699,moe_ck2stages_gemm2_64x32x32x128_1x1_MulABScaleExpertWeightShuffled_v1_Nswizzle0_Quant3_MulRoutedWeight1_FP4X2_FP4X2_B16,0.0117,225.5552,0,0.0,0.0,flydsl_fallback
256,1024,7168,256,384,8,ActivationType.Silu,torch.bfloat16,torch.float4_e2m1fn_x2,torch.float4_e2m1fn_x2,QuantType.per_1x32,1,0,32,0,139.8855,moe_ck2stages_gemm1_64x32x32x128_1x1_MulABScaleShuffled_v3_Nswizzle0_Quant3_MulRoutedWeight0_silu_FP4X2_FP4X2_B16,0.0,117.4703,moe_ck2stages_gemm2_64x32x32x128_1x1_MulABScaleExpertWeightShuffled_v1_Nswizzle0_Quant3_MulRoutedWeight1_FP4X2_FP4X2_B16,0.0116,257.3558,0,0.0,0.0,flydsl_fallback
256,2048,7168,256,384,8,ActivationType.Silu,torch.bfloat16,torch.float4_e2m1fn_x2,torch.float4_e2m1fn_x2,QuantType.per_1x32,1,0,64,0,148.2599,moe_ck2stages_gemm1_256x64x128x128_1x4_MulABScaleShuffled_v3_Nswizzle0_Quant3_MulRoutedWeight0_silu_FP4X2_FP4X2_B16,0.0,217.4236,moe_ck2stages_gemm2_64x64x128x128_1x1_MulABScaleExpertWeightShuffled_v3_Nswizzle0_Quant3_MulRoutedWeight1_FP4X2_FP4X2_B16,0.0116,365.6835,0,0.0,0.0,flydsl_fallback
256,4096,7168,256,384,8,ActivationType.Silu,torch.bfloat16,torch.float4_e2m1fn_x2,torch.float4_e2m1fn_x2,QuantType.per_1x32,1,0,128,0,164.6062,moe_ck2stages_gemm1_256x128x128x128_1x4_MulABScaleShuffled_v3_Nswizzle0_Quant3_MulRoutedWeight0_silu_FP4X2_FP4X2_B16,0.0,399.926,moe_ck2stages_gemm2_64x128x128x128_1x1_MulABScaleExpertWeightShuffled_v3_Nswizzle0_Quant3_MulRoutedWeight1_FP4X2_FP4X2_B16,0.0116,564.5322,0,0.0,0.0,flydsl_fallback
256,8192,7168,256,384,8,ActivationType.Silu,torch.bfloat16,torch.float4_e2m1fn_x2,torch.float4_e2m1fn_x2,QuantType.per_1x32,1,0,128,0,256.5029,moe_ck2stages_gemm1_256x128x128x128_1x4_MulABScaleShuffled_v3_Nswizzle0_Quant3_MulRoutedWeight0_silu_FP4X2_FP4X2_B16,0.0,757.0793,moe_ck2stages_gemm2_64x128x128x128_1x1_MulABScaleExpertWeightShuffled_v3_Nswizzle0_Quant3_MulRoutedWeight1_FP4X2_FP4X2_B16,0.0117,1013.5822,0,0.0,0.0,flydsl_fallback
256,16384,7168,256,384,8,ActivationType.Silu,torch.bfloat16,torch.float4_e2m1fn_x2,torch.float4_e2m1fn_x2,QuantType.per_1x32,1,0,128,0,428.1145,moe_ck2stages_gemm1_256x128x128x128_1x4_MulABScaleShuffled_v3_Nswizzle0_Quant3_MulRoutedWeight0_silu_FP4X2_FP4X2_B16,0.0,1455.6588,moe_ck2stages_gemm2_64x128x128x128_1x1_MulABScaleExpertWeightShuffled_v3_Nswizzle0_Quant3_MulRoutedWeight1_FP4X2_FP4X2_B16,0.0116,1883.7733,0,0.0,0.0,flydsl_fallback
256,32768,7168,256,384,8,ActivationType.Silu,torch.bfloat16,torch.float4_e2m1fn_x2,torch.float4_e2m1fn_x2,QuantType.per_1x32,1,0,128,0,643.6717000000001,moe_ck2stages_gemm1_256x128x128x128_1x4_MulABScaleShuffled_v3_Nswizzle0_Quant3_MulRoutedWeight0_silu_FP4X2_FP4X2_B16,0.0,2868.8802,moe_ck2stages_gemm2_64x128x128x128_1x1_MulABScaleExpertWeightShuffled_v3_Nswizzle0_Quant3_MulRoutedWeight1_FP4X2_FP4X2_B16,0.0116,3512.5519,0,0.0,0.0,flydsl_fallback
256,1,7168,512,384,8,ActivationType.Silu,torch.bfloat16,torch.float4_e2m1fn_x2,torch.float4_e2m1fn_x2,QuantType.per_1x32,1,0,32,0,25.5559,moe_ck2stages_gemm1_64x32x32x128_1x1_MulABScaleShuffled_v3_Nswizzle0_Quant3_MulRoutedWeight0_silu_FP4X2_FP4X2_B16,0.0,7.3772,moe_ck2stages_gemm2_256x32x128x128_1x4_MulABScaleExpertWeightShuffled_v3_Nswizzle0_Quant3_MulRoutedWeight1_FP4X2_FP4X2_B16,0.0268,32.9331,0,0.0,0.0,flydsl_fallback
256,2,7168,512,384,8,ActivationType.Silu,torch.bfloat16,torch.float4_e2m1fn_x2,torch.float4_e2m1fn_x2,QuantType.per_1x32,1,0,32,0,27.0342,moe_ck2stages_gemm1_64x32x32x128_1x1_MulABScaleShuffled_v3_Nswizzle0_Quant3_MulRoutedWeight0_silu_FP4X2_FP4X2_B16,0.0,12.4595,moe_ck2stages_gemm2_256x32x128x128_1x4_MulABScaleExpertWeightShuffled_v3_Nswizzle0_Quant3_MulRoutedWeight1_FP4X2_FP4X2_B16,0.0289,39.4937,0,0.0,0.0,flydsl_fallback
256,4,7168,512,384,8,ActivationType.Silu,torch.bfloat16,torch.float4_e2m1fn_x2,torch.float4_e2m1fn_x2,QuantType.per_1x32,1,0,32,0,32.6542,moe_ck2stages_gemm1_64x32x32x128_1x1_MulABScaleShuffled_v3_Nswizzle0_Quant3_MulRoutedWeight0_silu_FP4X2_FP4X2_B16,0.0,16.9126,moe_ck2stages_gemm2_64x32x32x128_1x1_MulABScaleExpertWeightShuffled_v1_Nswizzle0_Quant3_MulRoutedWeight1_FP4X2_FP4X2_B16,0.027,49.5668,0,0.0,0.0,flydsl_fallback
256,8,7168,512,384,8,ActivationType.Silu,torch.bfloat16,torch.float4_e2m1fn_x2,torch.float4_e2m1fn_x2,QuantType.per_1x32,1,0,32,0,49.5682,moe_ck2stages_gemm1_64x32x32x128_1x1_MulABScaleShuffled_v3_Nswizzle0_Quant3_MulRoutedWeight0_silu_FP4X2_FP4X2_B16,0.0,28.382,moe_ck2stages_gemm2_64x32x32x128_1x1_MulABScaleExpertWeightShuffled_v1_Nswizzle0_Quant3_MulRoutedWeight1_FP4X2_FP4X2_B16,0.0264,77.9502,0,0.0,0.0,flydsl_fallback
256,16,7168,512,384,8,ActivationType.Silu,torch.bfloat16,torch.float4_e2m1fn_x2,torch.float4_e2m1fn_x2,QuantType.per_1x32,1,0,32,0,92.2932,moe_ck2stages_gemm1_64x32x32x128_1x1_MulABScaleShuffled_v3_Nswizzle0_Quant3_MulRoutedWeight0_silu_FP4X2_FP4X2_B16,0.0,46.7144,moe_ck2stages_gemm2_64x32x32x128_1x1_MulABScaleExpertWeightShuffled_v1_Nswizzle0_Quant3_MulRoutedWeight1_FP4X2_FP4X2_B16,0.0268,139.0076,0,0.0,0.0,flydsl_fallback
256,32,7168,512,384,8,ActivationType.Silu,torch.bfloat16,torch.float4_e2m1fn_x2,torch.float4_e2m1fn_x2,QuantType.per_1x32,1,0,32,0,174.3662,moe_ck2stages_gemm1_64x32x32x128_1x1_MulABScaleShuffled_v3_Nswizzle0_Quant3_MulRoutedWeight0_silu_FP4X2_FP4X2_B16,0.0,84.5662,moe_ck2stages_gemm2_64x32x32x128_1x1_MulABScaleExpertWeightShuffled_v1_Nswizzle0_Quant3_MulRoutedWeight1_FP4X2_FP4X2_B16,0.0276,258.9324,0,0.0,0.0,flydsl_fallback
256,64,7168,512,384,8,ActivationType.Silu,torch.bfloat16,torch.float4_e2m1fn_x2,torch.float4_e2m1fn_x2,QuantType.per_1x32,1,0,32,0,258.0861,moe_ck2stages_gemm1_64x32x32x128_1x1_MulABScaleShuffled_v3_Nswizzle0_Quant3_MulRoutedWeight0_silu_FP4X2_FP4X2_B16,0.0,122.1947,moe_ck2stages_gemm2_64x32x32x128_1x1_MulABScaleExpertWeightShuffled_v1_Nswizzle0_Quant3_MulRoutedWeight1_FP4X2_FP4X2_B16,0.0272,380.2808,0,0.0,0.0,flydsl_fallback
256,128,7168,512,384,8,ActivationType.Silu,torch.bfloat16,torch.float4_e2m1fn_x2,torch.float4_e2m1fn_x2,QuantType.per_1x32,1,0,32,0,257.8842,moe_ck2stages_gemm1_256x32x128x128_1x4_MulABScaleShuffled_v3_Nswizzle0_Quant3_MulRoutedWeight0_silu_FP4X2_FP4X2_B16,0.0,127.5809,moe_ck2stages_gemm2_64x32x32x128_1x1_MulABScaleExpertWeightShuffled_v1_Nswizzle0_Quant3_MulRoutedWeight1_FP4X2_FP4X2_B16,0.0269,385.4651,0,0.0,0.0,flydsl_fallback
256,256,7168,512,384,8,ActivationType.Silu,torch.bfloat16,torch.float4_e2m1fn_x2,torch.float4_e2m1fn_x2,QuantType.per_1x32,1,0,32,0,259.5637,moe_ck2stages_gemm1_256x32x128x128_1x4_MulABScaleShuffled_v3_Nswizzle0_Quant3_MulRoutedWeight0_silu_FP4X2_FP4X2_B16,0.0,134.4165,moe_ck2stages_gemm2_256x32x128x128_1x4_MulABScaleExpertWeightShuffled_v3_Nswizzle0_Quant3_MulRoutedWeight1_FP4X2_FP4X2_B16,0.0272,393.9802,0,0.0,0.0,flydsl_fallback
256,512,7168,512,384,8,ActivationType.Silu,torch.bfloat16,torch.float4_e2m1fn_x2,torch.float4_e2m1fn_x2,QuantType.per_1x32,1,0,32,0,263.58070000000004,moe_ck2stages_gemm1_256x32x128x128_1x4_MulABScaleShuffled_v3_Nswizzle0_Quant3_MulRoutedWeight0_silu_FP4X2_FP4X2_B16,0.0,147.1485,moe_ck2stages_gemm2_64x32x32x128_1x1_MulABScaleExpertWeightShuffled_v1_Nswizzle0_Quant3_MulRoutedWeight1_FP4X2_FP4X2_B16,0.0273,410.7292,0,0.0,0.0,flydsl_fallback
256,1024,7168,512,384,8,ActivationType.Silu,torch.bfloat16,torch.float4_e2m1fn_x2,torch.float4_e2m1fn_x2,QuantType.per_1x32,1,0,32,0,267.7604,moe_ck2stages_gemm1_256x32x128x128_1x4_MulABScaleShuffled_v3_Nswizzle0_Quant3_MulRoutedWeight0_silu_FP4X2_FP4X2_B16,0.0,180.1391,moe_ck2stages_gemm2_64x32x32x128_1x1_MulABScaleExpertWeightShuffled_v1_Nswizzle0_Quant3_MulRoutedWeight1_FP4X2_FP4X2_B16,0.0273,447.8995,0,0.0,0.0,flydsl_fallback
256,2048,7168,512,384,8,ActivationType.Silu,torch.bfloat16,torch.float4_e2m1fn_x2,torch.float4_e2m1fn_x2,QuantType.per_1x32,1,0,32,0,339.71790000000004,moe_ck2stages_gemm1_64x32x32x128_1x1_MulABScaleShuffled_v3_Nswizzle0_Quant3_MulRoutedWeight0_silu_FP4X2_FP4X2_B16,0.0,277.2314,moe_ck2stages_gemm2_64x32x32x128_1x1_MulABScaleExpertWeightShuffled_v1_Nswizzle0_Quant3_MulRoutedWeight1_FP4X2_FP4X2_B16,0.0273,616.9493,0,0.0,0.0,flydsl_fallback
256,4096,7168,512,384,8,ActivationType.Silu,torch.bfloat16,torch.float4_e2m1fn_x2,torch.float4_e2m1fn_x2,QuantType.per_1x32,1,0,32,0,456.9757,moe_ck2stages_gemm1_64x32x32x128_1x1_MulABScaleShuffled_v3_Nswizzle0_Quant3_MulRoutedWeight0_silu_FP4X2_FP4X2_B16,0.0,455.6054,moe_ck2stages_gemm2_64x32x32x128_1x1_MulABScaleExpertWeightShuffled_v1_Nswizzle0_Quant3_MulRoutedWeight1_FP4X2_FP4X2_B16,0.0273,912.5811,0,0.0,0.0,flydsl_fallback
256,8192,7168,512,384,8,ActivationType.Silu,torch.bfloat16,torch.float4_e2m1fn_x2,torch.float4_e2m1fn_x2,QuantType.per_1x32,1,0,64,0,512.9737,moe_ck2stages_gemm1_256x64x128x128_1x4_MulABScaleShuffled_v3_Nswizzle0_Quant3_MulRoutedWeight0_silu_FP4X2_FP4X2_B16,0.0,947.4037,moe_ck2stages_gemm2_64x64x128x128_1x1_MulABScaleExpertWeightShuffled_v3_Nswizzle0_Quant3_MulRoutedWeight1_FP4X2_FP4X2_B16,0.0273,1460.3774,0,0.0,0.0,flydsl_fallback
256,16384,7168,512,384,8,ActivationType.Silu,torch.bfloat16,torch.float4_e2m1fn_x2,torch.float4_e2m1fn_x2,QuantType.per_1x32,1,0,64,0,819.954,moe_ck2stages_gemm1_256x64x128x128_1x4_MulABScaleShuffled_v3_Nswizzle0_Quant3_MulRoutedWeight0_silu_FP4X2_FP4X2_B16,0.0,1830.457,moe_ck2stages_gemm2_64x64x128x128_1x1_MulABScaleExpertWeightShuffled_v3_Nswizzle0_Quant3_MulRoutedWeight1_FP4X2_FP4X2_B16,0.0273,2650.411,0,0.0,0.0,flydsl_fallback
256,32768,7168,512,384,8,ActivationType.Silu,torch.bfloat16,torch.float4_e2m1fn_x2,torch.float4_e2m1fn_x2,QuantType.per_1x32,1,0,64,0,1439.3674999999998,moe_ck2stages_gemm1_256x64x128x128_1x4_MulABScaleShuffled_v3_Nswizzle0_Quant3_MulRoutedWeight0_silu_FP4X2_FP4X2_B16,0.0,3506.9829,moe_ck2stages_gemm2_64x64x128x128_1x1_MulABScaleExpertWeightShuffled_v3_Nswizzle0_Quant3_MulRoutedWeight1_FP4X2_FP4X2_B16,0.0273,4946.3504,0,0.0,0.0,flydsl_fallback
