aiter/configs/model_configs/kimik2_fp4_tuned_fmoe.csv
cu_num,token,model_dim,inter_dim,expert,topk,act_type,dtype,q_dtype_a,q_dtype_w,q_type,use_g1u1,doweight_stage1,block_m,ksplit,us1,kernelName1,err1,us2,kernelName2,err2,us,run_1stage,tflops,bw,_tag
256,1,7168,256,384,8,ActivationType.Silu,torch.bfloat16,torch.float4_e2m1fn_x2,torch.float4_e2m1fn_x2,QuantType.per_1x32,1,0,32,0,22.1354,moe_ck2stages_gemm1_64x32x32x128_1x1_MulABScaleShuffled_v3_Nswizzle0_Quant3_MulRoutedWeight0_silu_FP4X2_FP4X2_B16,0.0%,6.8659,moe_ck2stages_gemm2_256x32x128x128_1x4_MulABScaleExpertWeightShuffled_v3_Nswizzle0_Quant3_MulRoutedWeight1_FP4X2_FP4X2_B16,1.3%,29.0013,0,3.04,72891.58,
256,1,7168,512,384,8,ActivationType.Silu,torch.bfloat16,torch.float4_e2m1fn_x2,torch.float4_e2m1fn_x2,QuantType.per_1x32,1,0,32,0,22.5302,moe_ck2stages_gemm1_64x32x32x128_1x1_MulABScaleShuffled_v3_Nswizzle0_Quant3_MulRoutedWeight0_silu_FP4X2_FP4X2_B16,0.0%,7.4442,moe_ck2stages_gemm2_256x32x128x128_1x4_MulABScaleExpertWeightShuffled_v3_Nswizzle0_Quant3_MulRoutedWeight1_FP4X2_FP4X2_B16,2.5%,29.9744,0,5.88,141049.69,
256,2,7168,256,384,8,ActivationType.Silu,torch.bfloat16,torch.float4_e2m1fn_x2,torch.float4_e2m1fn_x2,QuantType.per_1x32,1,0,32,0,23.2474,moe_ck2stages_gemm1_64x32x32x128_1x1_MulABScaleShuffled_v3_Nswizzle0_Quant3_MulRoutedWeight0_silu_FP4X2_FP4X2_B16,0.0%,10.1038,moe_ck2stages_gemm2_256x32x128x128_1x4_MulABScaleExpertWeightShuffled_v3_Nswizzle0_Quant3_MulRoutedWeight1_FP4X2_FP4X2_B16,1.4%,33.3512,0,5.28,63385.19,
256,2,7168,512,384,8,ActivationType.Silu,torch.bfloat16,torch.float4_e2m1fn_x2,torch.float4_e2m1fn_x2,QuantType.per_1x32,1,0,32,0,24.6105,moe_ck2stages_gemm1_64x32x32x128_1x1_MulABScaleShuffled_v3_Nswizzle0_Quant3_MulRoutedWeight0_silu_FP4X2_FP4X2_B16,0.0%,12.6141,moe_ck2stages_gemm2_256x32x128x128_1x4_MulABScaleExpertWeightShuffled_v3_Nswizzle0_Quant3_MulRoutedWeight1_FP4X2_FP4X2_B16,2.6%,37.2246,0,9.46,113578.16,
256,4,7168,256,384,8,ActivationType.Silu,torch.bfloat16,torch.float4_e2m1fn_x2,torch.float4_e2m1fn_x2,QuantType.per_1x32,1,0,32,0,24.6165,moe_ck2stages_gemm1_64x32x32x128_1x1_MulABScaleShuffled_v3_Nswizzle0_Quant3_MulRoutedWeight0_silu_FP4X2_FP4X2_B16,0.0%,12.7446,moe_ck2stages_gemm2_256x32x128x128_1x4_MulABScaleExpertWeightShuffled_v3_Nswizzle0_Quant3_MulRoutedWeight1_FP4X2_FP4X2_B16,1.2%,37.3611,0,9.43,56583.32,
256,4,7168,512,384,8,ActivationType.Silu,torch.bfloat16,torch.float4_e2m1fn_x2,torch.float4_e2m1fn_x2,QuantType.per_1x32,1,0,32,0,27.6115,moe_ck2stages_gemm1_64x32x32x128_1x1_MulABScaleShuffled_v3_Nswizzle0_Quant3_MulRoutedWeight0_silu_FP4X2_FP4X2_B16,0.0%,21.239,moe_ck2stages_gemm2_256x32x128x128_1x4_MulABScaleExpertWeightShuffled_v3_Nswizzle0_Quant3_MulRoutedWeight1_FP4X2_FP4X2_B16,2.5%,48.8505,0,14.42,86548.64,
256,8,7168,256,384,8,ActivationType.Silu,torch.bfloat16,torch.float4_e2m1fn_x2,torch.float4_e2m1fn_x2,QuantType.per_1x32,1,0,32,0,27.7866,moe_ck2stages_gemm1_64x32x32x128_1x1_MulABScaleShuffled_v3_Nswizzle0_Quant3_MulRoutedWeight0_silu_FP4X2_FP4X2_B16,0.0%,17.7521,moe_ck2stages_gemm2_64x32x32x128_1x1_MulABScaleExpertWeightShuffled_v1_Nswizzle0_Quant3_MulRoutedWeight1_FP4X2_FP4X2_B16,1.4%,45.5387,0,15.47,46424.28,
256,8,7168,512,384,8,ActivationType.Silu,torch.bfloat16,torch.float4_e2m1fn_x2,torch.float4_e2m1fn_x2,QuantType.per_1x32,1,0,32,0,44.973,moe_ck2stages_gemm1_64x32x32x128_1x1_MulABScaleShuffled_v3_Nswizzle0_Quant3_MulRoutedWeight0_silu_FP4X2_FP4X2_B16,0.0%,30.6158,moe_ck2stages_gemm2_256x32x128x128_1x4_MulABScaleExpertWeightShuffled_v3_Nswizzle0_Quant3_MulRoutedWeight1_FP4X2_FP4X2_B16,2.6%,75.5888,0,18.64,55934.62,
256,16,7168,256,384,8,ActivationType.Silu,torch.bfloat16,torch.float4_e2m1fn_x2,torch.float4_e2m1fn_x2,QuantType.per_1x32,1,0,32,0,41.0653,moe_ck2stages_gemm1_256x32x128x128_1x4_MulABScaleShuffled_v3_Nswizzle0_Quant3_MulRoutedWeight0_silu_FP4X2_FP4X2_B16,0.0%,27.9281,moe_ck2stages_gemm2_64x32x32x128_1x1_MulABScaleExpertWeightShuffled_v1_Nswizzle0_Quant3_MulRoutedWeight1_FP4X2_FP4X2_B16,1.3%,68.9934,0,20.43,30644.57,
256,16,7168,512,384,8,ActivationType.Silu,torch.bfloat16,torch.float4_e2m1fn_x2,torch.float4_e2m1fn_x2,QuantType.per_1x32,1,0,32,0,75.458,moe_ck2stages_gemm1_256x32x128x128_1x4_MulABScaleShuffled_v3_Nswizzle0_Quant3_MulRoutedWeight0_silu_FP4X2_FP4X2_B16,0.0%,44.9587,moe_ck2stages_gemm2_256x32x128x128_1x4_MulABScaleExpertWeightShuffled_v3_Nswizzle0_Quant3_MulRoutedWeight1_FP4X2_FP4X2_B16,2.8%,120.4167,0,23.41,35113.09,
256,24,7168,256,384,8,ActivationType.Silu,torch.bfloat16,torch.float4_e2m1fn_x2,torch.float4_e2m1fn_x2,QuantType.per_1x32,1,0,32,0,54.0641,moe_ck2stages_gemm1_64x32x32x128_1x1_MulABScaleShuffled_v3_Nswizzle0_Quant3_MulRoutedWeight0_silu_FP4X2_FP4X2_B16,0.0%,35.434,moe_ck2stages_gemm2_64x32x32x128_1x1_MulABScaleExpertWeightShuffled_v1_Nswizzle0_Quant3_MulRoutedWeight1_FP4X2_FP4X2_B16,1.2%,89.4981,0,23.62,23625.59,
256,24,7168,512,384,8,ActivationType.Silu,torch.bfloat16,torch.float4_e2m1fn_x2,torch.float4_e2m1fn_x2,QuantType.per_1x32,1,0,32,0,107.3225,moe_ck2stages_gemm1_64x32x32x128_1x1_MulABScaleShuffled_v3_Nswizzle0_Quant3_MulRoutedWeight0_silu_FP4X2_FP4X2_B16,0.0%,58.092,moe_ck2stages_gemm2_256x32x128x128_1x4_MulABScaleExpertWeightShuffled_v3_Nswizzle0_Quant3_MulRoutedWeight1_FP4X2_FP4X2_B16,2.8%,165.4145,0,25.56,25562.3,
256,32,7168,256,384,8,ActivationType.Silu,torch.bfloat16,torch.float4_e2m1fn_x2,torch.float4_e2m1fn_x2,QuantType.per_1x32,1,0,32,0,68.4377,moe_ck2stages_gemm1_64x32x32x128_1x1_MulABScaleShuffled_v3_Nswizzle0_Quant3_MulRoutedWeight0_silu_FP4X2_FP4X2_B16,0.0%,40.7808,moe_ck2stages_gemm2_64x32x32x128_1x1_MulABScaleExpertWeightShuffled_v1_Nswizzle0_Quant3_MulRoutedWeight1_FP4X2_FP4X2_B16,1.3%,109.2185,0,25.81,19361.35,
256,32,7168,512,384,8,ActivationType.Silu,torch.bfloat16,torch.float4_e2m1fn_x2,torch.float4_e2m1fn_x2,QuantType.per_1x32,1,0,32,0,136.1635,moe_ck2stages_gemm1_64x32x32x128_1x1_MulABScaleShuffled_v3_Nswizzle0_Quant3_MulRoutedWeight0_silu_FP4X2_FP4X2_B16,0.0%,71.942,moe_ck2stages_gemm2_256x32x128x128_1x4_MulABScaleExpertWeightShuffled_v3_Nswizzle0_Quant3_MulRoutedWeight1_FP4X2_FP4X2_B16,2.8%,208.1055,0,27.09,20319.24,
256,40,7168,256,384,8,ActivationType.Silu,torch.bfloat16,torch.float4_e2m1fn_x2,torch.float4_e2m1fn_x2,QuantType.per_1x32,1,0,32,0,77.3742,moe_ck2stages_gemm1_256x32x128x128_1x4_MulABScaleShuffled_v3_Nswizzle0_Quant3_MulRoutedWeight0_silu_FP4X2_FP4X2_B16,0.0%,45.5207,moe_ck2stages_gemm2_64x32x32x128_1x1_MulABScaleExpertWeightShuffled_v1_Nswizzle0_Quant3_MulRoutedWeight1_FP4X2_FP4X2_B16,1.3%,122.8949,0,28.67,17208.11,
256,40,7168,512,384,8,ActivationType.Silu,torch.bfloat16,torch.float4_e2m1fn_x2,torch.float4_e2m1fn_x2,QuantType.per_1x32,1,0,32,0,155.2052,moe_ck2stages_gemm1_256x32x128x128_1x4_MulABScaleShuffled_v3_Nswizzle0_Quant3_MulRoutedWeight0_silu_FP4X2_FP4X2_B16,0.0%,80.6653,moe_ck2stages_gemm2_256x32x128x128_1x4_MulABScaleExpertWeightShuffled_v3_Nswizzle0_Quant3_MulRoutedWeight1_FP4X2_FP4X2_B16,2.8%,235.8705,0,29.87,17928.14,
256,48,7168,256,384,8,ActivationType.Silu,torch.bfloat16,torch.float4_e2m1fn_x2,torch.float4_e2m1fn_x2,QuantType.per_1x32,1,0,32,0,84.4286,moe_ck2stages_gemm1_256x32x128x128_1x4_MulABScaleShuffled_v3_Nswizzle0_Quant3_MulRoutedWeight0_silu_FP4X2_FP4X2_B16,0.0%,51.4107,moe_ck2stages_gemm2_64x32x32x128_1x1_MulABScaleExpertWeightShuffled_v1_Nswizzle0_Quant3_MulRoutedWeight1_FP4X2_FP4X2_B16,1.3%,135.8393,0,31.12,15569.58,
256,48,7168,512,384,8,ActivationType.Silu,torch.bfloat16,torch.float4_e2m1fn_x2,torch.float4_e2m1fn_x2,QuantType.per_1x32,1,0,32,0,165.1571,moe_ck2stages_gemm1_256x32x128x128_1x4_MulABScaleShuffled_v3_Nswizzle0_Quant3_MulRoutedWeight0_silu_FP4X2_FP4X2_B16,0.0%,85.6671,moe_ck2stages_gemm2_256x32x128x128_1x4_MulABScaleExpertWeightShuffled_v3_Nswizzle0_Quant3_MulRoutedWeight1_FP4X2_FP4X2_B16,2.8%,250.8242,0,33.71,16859.98,
256,56,7168,256,384,8,ActivationType.Silu,torch.bfloat16,torch.float4_e2m1fn_x2,torch.float4_e2m1fn_x2,QuantType.per_1x32,1,0,32,0,99.1755,moe_ck2stages_gemm1_64x32x32x128_1x1_MulABScaleShuffled_v3_Nswizzle0_Quant3_MulRoutedWeight0_silu_FP4X2_FP4X2_B16,0.0%,55.8215,moe_ck2stages_gemm2_64x32x32x128_1x1_MulABScaleExpertWeightShuffled_v1_Nswizzle0_Quant3_MulRoutedWeight1_FP4X2_FP4X2_B16,1.3%,154.997,0,31.82,13646.29,
256,56,7168,512,384,8,ActivationType.Silu,torch.bfloat16,torch.float4_e2m1fn_x2,torch.float4_e2m1fn_x2,QuantType.per_1x32,1,0,32,0,187.8494,moe_ck2stages_gemm1_64x32x32x128_1x1_MulABScaleShuffled_v3_Nswizzle0_Quant3_MulRoutedWeight0_silu_FP4X2_FP4X2_B16,0.0%,93.9837,moe_ck2stages_gemm2_256x32x128x128_1x4_MulABScaleExpertWeightShuffled_v3_Nswizzle0_Quant3_MulRoutedWeight1_FP4X2_FP4X2_B16,2.8%,281.8331,0,35.0,15005.56,
256,64,7168,256,384,8,ActivationType.Silu,torch.bfloat16,torch.float4_e2m1fn_x2,torch.float4_e2m1fn_x2,QuantType.per_1x32,1,0,32,0,102.1883,moe_ck2stages_gemm1_64x32x32x128_1x1_MulABScaleShuffled_v3_Nswizzle0_Quant3_MulRoutedWeight0_silu_FP4X2_FP4X2_B16,0.0%,56.6262,moe_ck2stages_gemm2_64x32x32x128_1x1_MulABScaleExpertWeightShuffled_v1_Nswizzle0_Quant3_MulRoutedWeight1_FP4X2_FP4X2_B16,1.3%,158.8145,0,35.5,13319.35,
256,64,7168,512,384,8,ActivationType.Silu,torch.bfloat16,torch.float4_e2m1fn_x2,torch.float4_e2m1fn_x2,QuantType.per_1x32,1,0,32,0,195.1921,moe_ck2stages_gemm1_256x32x128x128_1x4_MulABScaleShuffled_v3_Nswizzle0_Quant3_MulRoutedWeight0_silu_FP4X2_FP4X2_B16,0.0%,103.2147,moe_ck2stages_gemm2_256x32x128x128_1x4_MulABScaleExpertWeightShuffled_v3_Nswizzle0_Quant3_MulRoutedWeight1_FP4X2_FP4X2_B16,2.8%,298.4068,0,37.78,14172.72,
256,72,7168,256,384,8,ActivationType.Silu,torch.bfloat16,torch.float4_e2m1fn_x2,torch.float4_e2m1fn_x2,QuantType.per_1x32,1,0,32,0,109.4582,moe_ck2stages_gemm1_64x32x32x128_1x1_MulABScaleShuffled_v3_Nswizzle0_Quant3_MulRoutedWeight0_silu_FP4X2_FP4X2_B16,0.0%,60.9024,moe_ck2stages_gemm2_64x32x32x128_1x1_MulABScaleExpertWeightShuffled_v1_Nswizzle0_Quant3_MulRoutedWeight1_FP4X2_FP4X2_B16,1.3%,170.3606,0,37.23,12417.65,
256,72,7168,512,384,8,ActivationType.Silu,torch.bfloat16,torch.float4_e2m1fn_x2,torch.float4_e2m1fn_x2,QuantType.per_1x32,1,0,32,0,203.1917,moe_ck2stages_gemm1_64x32x32x128_1x1_MulABScaleShuffled_v3_Nswizzle0_Quant3_MulRoutedWeight0_silu_FP4X2_FP4X2_B16,0.0%,104.1013,moe_ck2stages_gemm2_256x32x128x128_1x4_MulABScaleExpertWeightShuffled_v3_Nswizzle0_Quant3_MulRoutedWeight1_FP4X2_FP4X2_B16,2.8%,307.293,0,41.28,13763.43,
256,80,7168,256,384,8,ActivationType.Silu,torch.bfloat16,torch.float4_e2m1fn_x2,torch.float4_e2m1fn_x2,QuantType.per_1x32,1,0,32,0,112.0962,moe_ck2stages_gemm1_64x32x32x128_1x1_MulABScaleShuffled_v3_Nswizzle0_Quant3_MulRoutedWeight0_silu_FP4X2_FP4X2_B16,0.0%,64.5083,moe_ck2stages_gemm2_64x32x32x128_1x1_MulABScaleExpertWeightShuffled_v1_Nswizzle0_Quant3_MulRoutedWeight1_FP4X2_FP4X2_B16,1.3%,176.6045,0,39.9,11979.59,
256,80,7168,512,384,8,ActivationType.Silu,torch.bfloat16,torch.float4_e2m1fn_x2,torch.float4_e2m1fn_x2,QuantType.per_1x32,1,0,32,0,209.5008,moe_ck2stages_gemm1_256x32x128x128_1x4_MulABScaleShuffled_v3_Nswizzle0_Quant3_MulRoutedWeight0_silu_FP4X2_FP4X2_B16,0.0%,108.6734,moe_ck2stages_gemm2_256x32x128x128_1x4_MulABScaleExpertWeightShuffled_v3_Nswizzle0_Quant3_MulRoutedWeight1_FP4X2_FP4X2_B16,2.8%,318.1742,0,44.29,13293.28,
256,88,7168,256,384,8,ActivationType.Silu,torch.bfloat16,torch.float4_e2m1fn_x2,torch.float4_e2m1fn_x2,QuantType.per_1x32,1,0,32,0,115.626,moe_ck2stages_gemm1_64x32x32x128_1x1_MulABScaleShuffled_v3_Nswizzle0_Quant3_MulRoutedWeight0_silu_FP4X2_FP4X2_B16,0.0%,64.8413,moe_ck2stages_gemm2_64x32x32x128_1x1_MulABScaleExpertWeightShuffled_v1_Nswizzle0_Quant3_MulRoutedWeight1_FP4X2_FP4X2_B16,1.3%,180.4673,0,42.95,11724.13,
256,88,7168,512,384,8,ActivationType.Silu,torch.bfloat16,torch.float4_e2m1fn_x2,torch.float4_e2m1fn_x2,QuantType.per_1x32,1,0,32,0,218.235,moe_ck2stages_gemm1_64x32x32x128_1x1_MulABScaleShuffled_v3_Nswizzle0_Quant3_MulRoutedWeight0_silu_FP4X2_FP4X2_B16,0.0%,111.6662,moe_ck2stages_gemm2_256x32x128x128_1x4_MulABScaleExpertWeightShuffled_v3_Nswizzle0_Quant3_MulRoutedWeight1_FP4X2_FP4X2_B16,2.8%,329.9012,0,46.99,12821.27,
256,96,7168,256,384,8,ActivationType.Silu,torch.bfloat16,torch.float4_e2m1fn_x2,torch.float4_e2m1fn_x2,QuantType.per_1x32,1,0,32,0,116.6673,moe_ck2stages_gemm1_64x32x32x128_1x1_MulABScaleShuffled_v3_Nswizzle0_Quant3_MulRoutedWeight0_silu_FP4X2_FP4X2_B16,0.0%,67.7604,moe_ck2stages_gemm2_64x32x32x128_1x1_MulABScaleExpertWeightShuffled_v1_Nswizzle0_Quant3_MulRoutedWeight1_FP4X2_FP4X2_B16,1.3%,184.4277,0,45.85,11473.3,
256,96,7168,512,384,8,ActivationType.Silu,torch.bfloat16,torch.float4_e2m1fn_x2,torch.float4_e2m1fn_x2,QuantType.per_1x32,1,0,32,0,230.0178,moe_ck2stages_gemm1_64x32x32x128_1x1_MulABScaleShuffled_v3_Nswizzle0_Quant3_MulRoutedWeight0_silu_FP4X2_FP4X2_B16,0.0%,115.6174,moe_ck2stages_gemm2_256x32x128x128_1x4_MulABScaleExpertWeightShuffled_v3_Nswizzle0_Quant3_MulRoutedWeight1_FP4X2_FP4X2_B16,2.8%,345.6352,0,48.93,12238.11,
256,104,7168,256,384,8,ActivationType.Silu,torch.bfloat16,torch.float4_e2m1fn_x2,torch.float4_e2m1fn_x2,QuantType.per_1x32,1,0,32,0,118.5712,moe_ck2stages_gemm1_256x32x128x128_1x4_MulABScaleShuffled_v3_Nswizzle0_Quant3_MulRoutedWeight0_silu_FP4X2_FP4X2_B16,0.0%,67.306,moe_ck2stages_gemm2_64x32x32x128_1x1_MulABScaleExpertWeightShuffled_v1_Nswizzle0_Quant3_MulRoutedWeight1_FP4X2_FP4X2_B16,1.3%,185.8772,0,49.28,11384.75,
256,104,7168,512,384,8,ActivationType.Silu,torch.bfloat16,torch.float4_e2m1fn_x2,torch.float4_e2m1fn_x2,QuantType.per_1x32,1,0,32,0,232.5482,moe_ck2stages_gemm1_64x32x32x128_1x1_MulABScaleShuffled_v3_Nswizzle0_Quant3_MulRoutedWeight0_silu_FP4X2_FP4X2_B16,0.0%,120.8903,moe_ck2stages_gemm2_256x32x128x128_1x4_MulABScaleExpertWeightShuffled_v3_Nswizzle0_Quant3_MulRoutedWeight1_FP4X2_FP4X2_B16,2.8%,353.4385,0,51.84,11968.4,
256,112,7168,256,384,8,ActivationType.Silu,torch.bfloat16,torch.float4_e2m1fn_x2,torch.float4_e2m1fn_x2,QuantType.per_1x32,1,0,32,0,119.9325,moe_ck2stages_gemm1_256x32x128x128_1x4_MulABScaleShuffled_v3_Nswizzle0_Quant3_MulRoutedWeight0_silu_FP4X2_FP4X2_B16,0.0%,70.8396,moe_ck2stages_gemm2_64x32x32x128_1x1_MulABScaleExpertWeightShuffled_v1_Nswizzle0_Quant3_MulRoutedWeight1_FP4X2_FP4X2_B16,1.3%,190.7721,0,51.71,11093.54,
256,112,7168,512,384,8,ActivationType.Silu,torch.bfloat16,torch.float4_e2m1fn_x2,torch.float4_e2m1fn_x2,QuantType.per_1x32,1,0,32,0,235.7195,moe_ck2stages_gemm1_64x32x32x128_1x1_MulABScaleShuffled_v3_Nswizzle0_Quant3_MulRoutedWeight0_silu_FP4X2_FP4X2_B16,0.0%,122.5376,moe_ck2stages_gemm2_256x32x128x128_1x4_MulABScaleExpertWeightShuffled_v3_Nswizzle0_Quant3_MulRoutedWeight1_FP4X2_FP4X2_B16,2.8%,358.2571,0,55.07,11807.91,
256,120,7168,256,384,8,ActivationType.Silu,torch.bfloat16,torch.float4_e2m1fn_x2,torch.float4_e2m1fn_x2,QuantType.per_1x32,1,0,32,0,122.4644,moe_ck2stages_gemm1_256x32x128x128_1x4_MulABScaleShuffled_v3_Nswizzle0_Quant3_MulRoutedWeight0_silu_FP4X2_FP4X2_B16,0.0%,72.6486,moe_ck2stages_gemm2_64x32x32x128_1x1_MulABScaleExpertWeightShuffled_v1_Nswizzle0_Quant3_MulRoutedWeight1_FP4X2_FP4X2_B16,1.3%,195.113,0,54.17,10847.61,
256,120,7168,512,384,8,ActivationType.Silu,torch.bfloat16,torch.float4_e2m1fn_x2,torch.float4_e2m1fn_x2,QuantType.per_1x32,1,0,32,0,237.4122,moe_ck2stages_gemm1_64x32x32x128_1x1_MulABScaleShuffled_v3_Nswizzle0_Quant3_MulRoutedWeight0_silu_FP4X2_FP4X2_B16,0.0%,124.4174,moe_ck2stages_gemm2_256x32x128x128_1x4_MulABScaleExpertWeightShuffled_v3_Nswizzle0_Quant3_MulRoutedWeight1_FP4X2_FP4X2_B16,2.8%,361.8296,0,58.42,11691.8,
256,128,7168,256,384,8,ActivationType.Silu,torch.bfloat16,torch.float4_e2m1fn_x2,torch.float4_e2m1fn_x2,QuantType.per_1x32,1,0,32,0,123.2716,moe_ck2stages_gemm1_256x32x128x128_1x4_MulABScaleShuffled_v3_Nswizzle0_Quant3_MulRoutedWeight0_silu_FP4X2_FP4X2_B16,0.0%,70.9839,moe_ck2stages_gemm2_64x32x32x128_1x1_MulABScaleExpertWeightShuffled_v1_Nswizzle0_Quant3_MulRoutedWeight1_FP4X2_FP4X2_B16,1.3%,194.2555,0,58.04,10896.38,
256,128,7168,512,384,8,ActivationType.Silu,torch.bfloat16,torch.float4_e2m1fn_x2,torch.float4_e2m1fn_x2,QuantType.per_1x32,1,0,32,0,239.4929,moe_ck2stages_gemm1_256x32x128x128_1x4_MulABScaleShuffled_v3_Nswizzle0_Quant3_MulRoutedWeight0_silu_FP4X2_FP4X2_B16,0.0%,123.3423,moe_ck2stages_gemm2_256x32x128x128_1x4_MulABScaleExpertWeightShuffled_v3_Nswizzle0_Quant3_MulRoutedWeight1_FP4X2_FP4X2_B16,2.8%,362.8352,0,62.15,11659.87,
256,136,7168,256,384,8,ActivationType.Silu,torch.bfloat16,torch.float4_e2m1fn_x2,torch.float4_e2m1fn_x2,QuantType.per_1x32,1,0,32,0,124.6496,moe_ck2stages_gemm1_256x32x128x128_1x4_MulABScaleShuffled_v3_Nswizzle0_Quant3_MulRoutedWeight0_silu_FP4X2_FP4X2_B16,0.0%,74.2768,moe_ck2stages_gemm2_64x32x32x128_1x1_MulABScaleExpertWeightShuffled_v1_Nswizzle0_Quant3_MulRoutedWeight1_FP4X2_FP4X2_B16,1.3%,198.9264,0,60.22,10641.39,
256,136,7168,512,384,8,ActivationType.Silu,torch.bfloat16,torch.float4_e2m1fn_x2,torch.float4_e2m1fn_x2,QuantType.per_1x32,1,0,32,0,242.0264,moe_ck2stages_gemm1_256x32x128x128_1x4_MulABScaleShuffled_v3_Nswizzle0_Quant3_MulRoutedWeight0_silu_FP4X2_FP4X2_B16,0.0%,129.6395,moe_ck2stages_gemm2_256x32x128x128_1x4_MulABScaleExpertWeightShuffled_v3_Nswizzle0_Quant3_MulRoutedWeight1_FP4X2_FP4X2_B16,2.8%,371.6659,0,64.46,11383.3,
256,144,7168,256,384,8,ActivationType.Silu,torch.bfloat16,torch.float4_e2m1fn_x2,torch.float4_e2m1fn_x2,QuantType.per_1x32,1,0,32,0,126.1375,moe_ck2stages_gemm1_64x32x32x128_1x1_MulABScaleShuffled_v3_Nswizzle0_Quant3_MulRoutedWeight0_silu_FP4X2_FP4X2_B16,0.0%,71.8248,moe_ck2stages_gemm2_64x32x32x128_1x1_MulABScaleExpertWeightShuffled_v1_Nswizzle0_Quant3_MulRoutedWeight1_FP4X2_FP4X2_B16,1.3%,197.9623,0,64.07,10694.09,
256,144,7168,512,384,8,ActivationType.Silu,torch.bfloat16,torch.float4_e2m1fn_x2,torch.float4_e2m1fn_x2,QuantType.per_1x32,1,0,32,0,246.1034,moe_ck2stages_gemm1_256x32x128x128_1x4_MulABScaleShuffled_v3_Nswizzle0_Quant3_MulRoutedWeight0_silu_FP4X2_FP4X2_B16,0.0%,128.5183,moe_ck2stages_gemm2_256x32x128x128_1x4_MulABScaleExpertWeightShuffled_v3_Nswizzle0_Quant3_MulRoutedWeight1_FP4X2_FP4X2_B16,2.8%,374.6217,0,67.71,11293.94,
256,152,7168,256,384,8,ActivationType.Silu,torch.bfloat16,torch.float4_e2m1fn_x2,torch.float4_e2m1fn_x2,QuantType.per_1x32,1,0,32,0,125.6498,moe_ck2stages_gemm1_256x32x128x128_1x4_MulABScaleShuffled_v3_Nswizzle0_Quant3_MulRoutedWeight0_silu_FP4X2_FP4X2_B16,0.0%,73.6396,moe_ck2stages_gemm2_64x32x32x128_1x1_MulABScaleExpertWeightShuffled_v1_Nswizzle0_Quant3_MulRoutedWeight1_FP4X2_FP4X2_B16,1.3%,199.2894,0,67.18,10623.74,
256,152,7168,512,384,8,ActivationType.Silu,torch.bfloat16,torch.float4_e2m1fn_x2,torch.float4_e2m1fn_x2,QuantType.per_1x32,1,0,32,0,248.8944,moe_ck2stages_gemm1_64x32x32x128_1x1_MulABScaleShuffled_v3_Nswizzle0_Quant3_MulRoutedWeight0_silu_FP4X2_FP4X2_B16,0.0%,131.4336,moe_ck2stages_gemm2_256x32x128x128_1x4_MulABScaleExpertWeightShuffled_v3_Nswizzle0_Quant3_MulRoutedWeight1_FP4X2_FP4X2_B16,2.8%,380.328,0,70.4,11124.94,
256,160,7168,256,384,8,ActivationType.Silu,torch.bfloat16,torch.float4_e2m1fn_x2,torch.float4_e2m1fn_x2,QuantType.per_1x32,1,0,32,0,126.6307,moe_ck2stages_gemm1_256x32x128x128_1x4_MulABScaleShuffled_v3_Nswizzle0_Quant3_MulRoutedWeight0_silu_FP4X2_FP4X2_B16,0.0%,71.9374,moe_ck2stages_gemm2_64x32x32x128_1x1_MulABScaleExpertWeightShuffled_v1_Nswizzle0_Quant3_MulRoutedWeight1_FP4X2_FP4X2_B16,1.3%,198.5681,0,70.97,10663.19,
256,160,7168,512,384,8,ActivationType.Silu,torch.bfloat16,torch.float4_e2m1fn_x2,torch.float4_e2m1fn_x2,QuantType.per_1x32,1,0,32,0,248.1919,moe_ck2stages_gemm1_64x32x32x128_1x1_MulABScaleShuffled_v3_Nswizzle0_Quant3_MulRoutedWeight0_silu_FP4X2_FP4X2_B16,0.0%,131.6822,moe_ck2stages_gemm2_256x32x128x128_1x4_MulABScaleExpertWeightShuffled_v3_Nswizzle0_Quant3_MulRoutedWeight1_FP4X2_FP4X2_B16,2.8%,379.8741,0,74.2,11138.69,
256,168,7168,256,384,8,ActivationType.Silu,torch.bfloat16,torch.float4_e2m1fn_x2,torch.float4_e2m1fn_x2,QuantType.per_1x32,1,0,32,0,128.0017,moe_ck2stages_gemm1_64x32x32x128_1x1_MulABScaleShuffled_v3_Nswizzle0_Quant3_MulRoutedWeight0_silu_FP4X2_FP4X2_B16,0.0%,75.1216,moe_ck2stages_gemm2_64x32x32x128_1x1_MulABScaleExpertWeightShuffled_v1_Nswizzle0_Quant3_MulRoutedWeight1_FP4X2_FP4X2_B16,1.2%,203.1233,0,72.85,10424.91,
256,168,7168,512,384,8,ActivationType.Silu,torch.bfloat16,torch.float4_e2m1fn_x2,torch.float4_e2m1fn_x2,QuantType.per_1x32,1,0,32,0,250.1872,moe_ck2stages_gemm1_256x32x128x128_1x4_MulABScaleShuffled_v3_Nswizzle0_Quant3_MulRoutedWeight0_silu_FP4X2_FP4X2_B16,0.0%,136.6548,moe_ck2stages_gemm2_256x32x128x128_1x4_MulABScaleExpertWeightShuffled_v3_Nswizzle0_Quant3_MulRoutedWeight1_FP4X2_FP4X2_B16,2.8%,386.842,0,76.5,10938.5,
256,176,7168,256,384,8,ActivationType.Silu,torch.bfloat16,torch.float4_e2m1fn_x2,torch.float4_e2m1fn_x2,QuantType.per_1x32,1,0,32,0,129.5504,moe_ck2stages_gemm1_64x32x32x128_1x1_MulABScaleShuffled_v3_Nswizzle0_Quant3_MulRoutedWeight0_silu_FP4X2_FP4X2_B16,0.0%,76.3816,moe_ck2stages_gemm2_64x32x32x128_1x1_MulABScaleExpertWeightShuffled_v1_Nswizzle0_Quant3_MulRoutedWeight1_FP4X2_FP4X2_B16,1.2%,205.932,0,75.28,10283.56,
256,176,7168,512,384,8,ActivationType.Silu,torch.bfloat16,torch.float4_e2m1fn_x2,torch.float4_e2m1fn_x2,QuantType.per_1x32,1,0,32,0,251.7887,moe_ck2stages_gemm1_64x32x32x128_1x1_MulABScaleShuffled_v3_Nswizzle0_Quant3_MulRoutedWeight0_silu_FP4X2_FP4X2_B16,0.0%,134.0008,moe_ck2stages_gemm2_256x32x128x128_1x4_MulABScaleExpertWeightShuffled_v3_Nswizzle0_Quant3_MulRoutedWeight1_FP4X2_FP4X2_B16,2.8%,385.7895,0,80.37,10968.79,
256,184,7168,256,384,8,ActivationType.Silu,torch.bfloat16,torch.float4_e2m1fn_x2,torch.float4_e2m1fn_x2,QuantType.per_1x32,1,0,32,0,129.7654,moe_ck2stages_gemm1_256x32x128x128_1x4_MulABScaleShuffled_v3_Nswizzle0_Quant3_MulRoutedWeight0_silu_FP4X2_FP4X2_B16,0.0%,74.5849,moe_ck2stages_gemm2_64x32x32x128_1x1_MulABScaleExpertWeightShuffled_v1_Nswizzle0_Quant3_MulRoutedWeight1_FP4X2_FP4X2_B16,1.2%,204.3503,0,79.31,10364.0,
256,184,7168,512,384,8,ActivationType.Silu,torch.bfloat16,torch.float4_e2m1fn_x2,torch.float4_e2m1fn_x2,QuantType.per_1x32,1,0,32,0,252.927,moe_ck2stages_gemm1_64x32x32x128_1x1_MulABScaleShuffled_v3_Nswizzle0_Quant3_MulRoutedWeight0_silu_FP4X2_FP4X2_B16,0.0%,130.906,moe_ck2stages_gemm2_256x32x128x128_1x4_MulABScaleExpertWeightShuffled_v3_Nswizzle0_Quant3_MulRoutedWeight1_FP4X2_FP4X2_B16,2.7%,383.833,0,84.45,11025.15,
256,192,7168,256,384,8,ActivationType.Silu,torch.bfloat16,torch.float4_e2m1fn_x2,torch.float4_e2m1fn_x2,QuantType.per_1x32,1,0,32,0,128.2034,moe_ck2stages_gemm1_64x32x32x128_1x1_MulABScaleShuffled_v3_Nswizzle0_Quant3_MulRoutedWeight0_silu_FP4X2_FP4X2_B16,0.0%,74.434,moe_ck2stages_gemm2_64x32x32x128_1x1_MulABScaleExpertWeightShuffled_v1_Nswizzle0_Quant3_MulRoutedWeight1_FP4X2_FP4X2_B16,1.2%,202.6374,0,83.46,10452.45,
256,192,7168,512,384,8,ActivationType.Silu,torch.bfloat16,torch.float4_e2m1fn_x2,torch.float4_e2m1fn_x2,QuantType.per_1x32,1,0,32,0,252.5204,moe_ck2stages_gemm1_256x32x128x128_1x4_MulABScaleShuffled_v3_Nswizzle0_Quant3_MulRoutedWeight0_silu_FP4X2_FP4X2_B16,0.0%,133.8194,moe_ck2stages_gemm2_256x32x128x128_1x4_MulABScaleExpertWeightShuffled_v3_Nswizzle0_Quant3_MulRoutedWeight1_FP4X2_FP4X2_B16,2.8%,386.3398,0,87.55,10954.05,
256,200,7168,256,384,8,ActivationType.Silu,torch.bfloat16,torch.float4_e2m1fn_x2,torch.float4_e2m1fn_x2,QuantType.per_1x32,1,0,32,0,129.0858,moe_ck2stages_gemm1_64x32x32x128_1x1_MulABScaleShuffled_v3_Nswizzle0_Quant3_MulRoutedWeight0_silu_FP4X2_FP4X2_B16,0.0%,79.6651,moe_ck2stages_gemm2_64x32x32x128_1x1_MulABScaleExpertWeightShuffled_v1_Nswizzle0_Quant3_MulRoutedWeight1_FP4X2_FP4X2_B16,1.2%,208.7509,0,84.39,10147.17,
256,200,7168,512,384,8,ActivationType.Silu,torch.bfloat16,torch.float4_e2m1fn_x2,torch.float4_e2m1fn_x2,QuantType.per_1x32,1,0,32,0,253.5241,moe_ck2stages_gemm1_256x32x128x128_1x4_MulABScaleShuffled_v3_Nswizzle0_Quant3_MulRoutedWeight0_silu_FP4X2_FP4X2_B16,0.0%,137.4836,moe_ck2stages_gemm2_256x32x128x128_1x4_MulABScaleExpertWeightShuffled_v3_Nswizzle0_Quant3_MulRoutedWeight1_FP4X2_FP4X2_B16,2.8%,391.0077,0,90.11,10823.72,
256,208,7168,256,384,8,ActivationType.Silu,torch.bfloat16,torch.float4_e2m1fn_x2,torch.float4_e2m1fn_x2,QuantType.per_1x32,1,0,32,0,129.8672,moe_ck2stages_gemm1_64x32x32x128_1x1_MulABScaleShuffled_v3_Nswizzle0_Quant3_MulRoutedWeight0_silu_FP4X2_FP4X2_B16,0.0%,80.05,moe_ck2stages_gemm2_64x32x32x128_1x1_MulABScaleExpertWeightShuffled_v1_Nswizzle0_Quant3_MulRoutedWeight1_FP4X2_FP4X2_B16,1.2%,209.9172,0,87.28,10091.61,
256,208,7168,512,384,8,ActivationType.Silu,torch.bfloat16,torch.float4_e2m1fn_x2,torch.float4_e2m1fn_x2,QuantType.per_1x32,1,0,32,0,252.6934,moe_ck2stages_gemm1_64x32x32x128_1x1_MulABScaleShuffled_v3_Nswizzle0_Quant3_MulRoutedWeight0_silu_FP4X2_FP4X2_B16,0.0%,137.316,moe_ck2stages_gemm2_256x32x128x128_1x4_MulABScaleExpertWeightShuffled_v3_Nswizzle0_Quant3_MulRoutedWeight1_FP4X2_FP4X2_B16,2.8%,390.0094,0,93.95,10851.87,
256,216,7168,256,384,8,ActivationType.Silu,torch.bfloat16,torch.float4_e2m1fn_x2,torch.float4_e2m1fn_x2,QuantType.per_1x32,1,0,32,0,130.2525,moe_ck2stages_gemm1_256x32x128x128_1x4_MulABScaleShuffled_v3_Nswizzle0_Quant3_MulRoutedWeight0_silu_FP4X2_FP4X2_B16,0.0%,76.7116,moe_ck2stages_gemm2_64x32x32x128_1x1_MulABScaleExpertWeightShuffled_v1_Nswizzle0_Quant3_MulRoutedWeight1_FP4X2_FP4X2_B16,1.2%,206.9641,0,91.93,10236.43,
256,216,7168,512,384,8,ActivationType.Silu,torch.bfloat16,torch.float4_e2m1fn_x2,torch.float4_e2m1fn_x2,QuantType.per_1x32,1,0,32,0,255.4184,moe_ck2stages_gemm1_64x32x32x128_1x1_MulABScaleShuffled_v3_Nswizzle0_Quant3_MulRoutedWeight0_silu_FP4X2_FP4X2_B16,0.0%,138.2688,moe_ck2stages_gemm2_256x32x128x128_1x4_MulABScaleExpertWeightShuffled_v3_Nswizzle0_Quant3_MulRoutedWeight1_FP4X2_FP4X2_B16,2.8%,393.6872,0,96.65,10750.93,
256,224,7168,256,384,8,ActivationType.Silu,torch.bfloat16,torch.float4_e2m1fn_x2,torch.float4_e2m1fn_x2,QuantType.per_1x32,1,0,32,0,130.0571,moe_ck2stages_gemm1_64x32x32x128_1x1_MulABScaleShuffled_v3_Nswizzle0_Quant3_MulRoutedWeight0_silu_FP4X2_FP4X2_B16,0.0%,76.4829,moe_ck2stages_gemm2_64x32x32x128_1x1_MulABScaleExpertWeightShuffled_v1_Nswizzle0_Quant3_MulRoutedWeight1_FP4X2_FP4X2_B16,1.2%,206.54,0,95.53,10258.28,
256,224,7168,512,384,8,ActivationType.Silu,torch.bfloat16,torch.float4_e2m1fn_x2,torch.float4_e2m1fn_x2,QuantType.per_1x32,1,0,32,0,255.6594,moe_ck2stages_gemm1_256x32x128x128_1x4_MulABScaleShuffled_v3_Nswizzle0_Quant3_MulRoutedWeight0_silu_FP4X2_FP4X2_B16,0.0%,135.5183,moe_ck2stages_gemm2_256x32x128x128_1x4_MulABScaleExpertWeightShuffled_v3_Nswizzle0_Quant3_MulRoutedWeight1_FP4X2_FP4X2_B16,2.8%,391.1777,0,100.87,10820.34,
256,232,7168,256,384,8,ActivationType.Silu,torch.bfloat16,torch.float4_e2m1fn_x2,torch.float4_e2m1fn_x2,QuantType.per_1x32,1,0,32,0,131.9434,moe_ck2stages_gemm1_64x32x32x128_1x1_MulABScaleShuffled_v3_Nswizzle0_Quant3_MulRoutedWeight0_silu_FP4X2_FP4X2_B16,0.0%,78.4604,moe_ck2stages_gemm2_64x32x32x128_1x1_MulABScaleExpertWeightShuffled_v1_Nswizzle0_Quant3_MulRoutedWeight1_FP4X2_FP4X2_B16,1.2%,210.4038,0,97.12,10070.72,
256,232,7168,512,384,8,ActivationType.Silu,torch.bfloat16,torch.float4_e2m1fn_x2,torch.float4_e2m1fn_x2,QuantType.per_1x32,1,0,32,0,255.9996,moe_ck2stages_gemm1_256x32x128x128_1x4_MulABScaleShuffled_v3_Nswizzle0_Quant3_MulRoutedWeight0_silu_FP4X2_FP4X2_B16,0.0%,141.8348,moe_ck2stages_gemm2_256x32x128x128_1x4_MulABScaleExpertWeightShuffled_v3_Nswizzle0_Quant3_MulRoutedWeight1_FP4X2_FP4X2_B16,2.8%,397.8344,0,102.73,10639.72,
256,240,7168,256,384,8,ActivationType.Silu,torch.bfloat16,torch.float4_e2m1fn_x2,torch.float4_e2m1fn_x2,QuantType.per_1x32,1,0,32,0,133.0806,moe_ck2stages_gemm1_64x32x32x128_1x1_MulABScaleShuffled_v3_Nswizzle0_Quant3_MulRoutedWeight0_silu_FP4X2_FP4X2_B16,0.0%,80.7431,moe_ck2stages_gemm2_64x32x32x128_1x1_MulABScaleExpertWeightShuffled_v1_Nswizzle0_Quant3_MulRoutedWeight1_FP4X2_FP4X2_B16,1.2%,213.8237,0,98.86,9910.46,
256,240,7168,512,384,8,ActivationType.Silu,torch.bfloat16,torch.float4_e2m1fn_x2,torch.float4_e2m1fn_x2,QuantType.per_1x32,1,0,32,0,256.7593,moe_ck2stages_gemm1_64x32x32x128_1x1_MulABScaleShuffled_v3_Nswizzle0_Quant3_MulRoutedWeight0_silu_FP4X2_FP4X2_B16,0.0%,140.4541,moe_ck2stages_gemm2_256x32x128x128_1x4_MulABScaleExpertWeightShuffled_v3_Nswizzle0_Quant3_MulRoutedWeight1_FP4X2_FP4X2_B16,2.8%,397.2134,0,106.44,10656.79,
256,248,7168,256,384,8,ActivationType.Silu,torch.bfloat16,torch.float4_e2m1fn_x2,torch.float4_e2m1fn_x2,QuantType.per_1x32,1,0,32,0,132.5416,moe_ck2stages_gemm1_64x32x32x128_1x1_MulABScaleShuffled_v3_Nswizzle0_Quant3_MulRoutedWeight0_silu_FP4X2_FP4X2_B16,0.0%,78.0288,moe_ck2stages_gemm2_64x32x32x128_1x1_MulABScaleExpertWeightShuffled_v1_Nswizzle0_Quant3_MulRoutedWeight1_FP4X2_FP4X2_B16,1.2%,210.5704,0,103.74,10064.39,
256,248,7168,512,384,8,ActivationType.Silu,torch.bfloat16,torch.float4_e2m1fn_x2,torch.float4_e2m1fn_x2,QuantType.per_1x32,1,0,32,0,254.3261,moe_ck2stages_gemm1_64x32x32x128_1x1_MulABScaleShuffled_v3_Nswizzle0_Quant3_MulRoutedWeight0_silu_FP4X2_FP4X2_B16,0.0%,142.3192,moe_ck2stages_gemm2_256x32x128x128_1x4_MulABScaleExpertWeightShuffled_v3_Nswizzle0_Quant3_MulRoutedWeight1_FP4X2_FP4X2_B16,2.8%,396.6453,0,110.14,10672.49,
256,256,7168,256,384,8,ActivationType.Silu,torch.bfloat16,torch.float4_e2m1fn_x2,torch.float4_e2m1fn_x2,QuantType.per_1x32,1,0,32,0,131.6157,moe_ck2stages_gemm1_64x32x32x128_1x1_MulABScaleShuffled_v3_Nswizzle0_Quant3_MulRoutedWeight0_silu_FP4X2_FP4X2_B16,0.0%,78.2213,moe_ck2stages_gemm2_64x32x32x128_1x1_MulABScaleExpertWeightShuffled_v1_Nswizzle0_Quant3_MulRoutedWeight1_FP4X2_FP4X2_B16,1.2%,209.837,0,107.46,10100.38,
256,256,7168,512,384,8,ActivationType.Silu,torch.bfloat16,torch.float4_e2m1fn_x2,torch.float4_e2m1fn_x2,QuantType.per_1x32,1,0,32,0,255.8085,moe_ck2stages_gemm1_256x32x128x128_1x4_MulABScaleShuffled_v3_Nswizzle0_Quant3_MulRoutedWeight0_silu_FP4X2_FP4X2_B16,0.0%,139.1236,moe_ck2stages_gemm2_256x32x128x128_1x4_MulABScaleExpertWeightShuffled_v3_Nswizzle0_Quant3_MulRoutedWeight1_FP4X2_FP4X2_B16,2.8%,394.9321,0,114.19,10719.22,
256,264,7168,256,384,8,ActivationType.Silu,torch.bfloat16,torch.float4_e2m1fn_x2,torch.float4_e2m1fn_x2,QuantType.per_1x32,1,0,32,0,131.9885,moe_ck2stages_gemm1_64x32x32x128_1x1_MulABScaleShuffled_v3_Nswizzle0_Quant3_MulRoutedWeight0_silu_FP4X2_FP4X2_B16,0.0%,80.3984,moe_ck2stages_gemm2_64x32x32x128_1x1_MulABScaleExpertWeightShuffled_v1_Nswizzle0_Quant3_MulRoutedWeight1_FP4X2_FP4X2_B16,1.2%,212.3869,0,109.49,9979.93,
256,264,7168,512,384,8,ActivationType.Silu,torch.bfloat16,torch.float4_e2m1fn_x2,torch.float4_e2m1fn_x2,QuantType.per_1x32,1,0,32,0,254.7132,moe_ck2stages_gemm1_64x32x32x128_1x1_MulABScaleShuffled_v3_Nswizzle0_Quant3_MulRoutedWeight0_silu_FP4X2_FP4X2_B16,0.0%,139.176,moe_ck2stages_gemm2_256x32x128x128_1x4_MulABScaleExpertWeightShuffled_v3_Nswizzle0_Quant3_MulRoutedWeight1_FP4X2_FP4X2_B16,2.8%,393.8892,0,118.07,10748.04,
256,272,7168,256,384,8,ActivationType.Silu,torch.bfloat16,torch.float4_e2m1fn_x2,torch.float4_e2m1fn_x2,QuantType.per_1x32,1,0,32,0,133.1383,moe_ck2stages_gemm1_64x32x32x128_1x1_MulABScaleShuffled_v3_Nswizzle0_Quant3_MulRoutedWeight0_silu_FP4X2_FP4X2_B16,0.0%,81.6457,moe_ck2stages_gemm2_64x32x32x128_1x1_MulABScaleExpertWeightShuffled_v1_Nswizzle0_Quant3_MulRoutedWeight1_FP4X2_FP4X2_B16,1.2%,214.784,0,111.54,9869.35,
256,272,7168,512,384,8,ActivationType.Silu,torch.bfloat16,torch.float4_e2m1fn_x2,torch.float4_e2m1fn_x2,QuantType.per_1x32,1,0,32,0,255.4287,moe_ck2stages_gemm1_64x32x32x128_1x1_MulABScaleShuffled_v3_Nswizzle0_Quant3_MulRoutedWeight0_silu_FP4X2_FP4X2_B16,0.0%,138.3824,moe_ck2stages_gemm2_256x32x128x128_1x4_MulABScaleExpertWeightShuffled_v3_Nswizzle0_Quant3_MulRoutedWeight1_FP4X2_FP4X2_B16,2.8%,393.8111,0,121.67,10750.6,
256,280,7168,256,384,8,ActivationType.Silu,torch.bfloat16,torch.float4_e2m1fn_x2,torch.float4_e2m1fn_x2,QuantType.per_1x32,1,0,32,0,131.7107,moe_ck2stages_gemm1_256x32x128x128_1x4_MulABScaleShuffled_v3_Nswizzle0_Quant3_MulRoutedWeight0_silu_FP4X2_FP4X2_B16,0.0%,81.7456,moe_ck2stages_gemm2_64x32x32x128_1x1_MulABScaleExpertWeightShuffled_v1_Nswizzle0_Quant3_MulRoutedWeight1_FP4X2_FP4X2_B16,1.2%,213.4563,0,115.54,9931.54,
256,280,7168,512,384,8,ActivationType.Silu,torch.bfloat16,torch.float4_e2m1fn_x2,torch.float4_e2m1fn_x2,QuantType.per_1x32,1,0,32,0,254.4503,moe_ck2stages_gemm1_64x32x32x128_1x1_MulABScaleShuffled_v3_Nswizzle0_Quant3_MulRoutedWeight0_silu_FP4X2_FP4X2_B16,0.0%,142.0936,moe_ck2stages_gemm2_256x32x128x128_1x4_MulABScaleExpertWeightShuffled_v3_Nswizzle0_Quant3_MulRoutedWeight1_FP4X2_FP4X2_B16,2.8%,396.5439,0,124.39,10676.95,
256,288,7168,256,384,8,ActivationType.Silu,torch.bfloat16,torch.float4_e2m1fn_x2,torch.float4_e2m1fn_x2,QuantType.per_1x32,1,0,32,0,131.8405,moe_ck2stages_gemm1_256x32x128x128_1x4_MulABScaleShuffled_v3_Nswizzle0_Quant3_MulRoutedWeight0_silu_FP4X2_FP4X2_B16,0.0%,81.6295,moe_ck2stages_gemm2_64x32x32x128_1x1_MulABScaleExpertWeightShuffled_v1_Nswizzle0_Quant3_MulRoutedWeight1_FP4X2_FP4X2_B16,1.2%,213.47,0,118.83,9931.71,
256,288,7168,512,384,8,ActivationType.Silu,torch.bfloat16,torch.float4_e2m1fn_x2,torch.float4_e2m1fn_x2,QuantType.per_1x32,1,0,32,0,254.5444,moe_ck2stages_gemm1_64x32x32x128_1x1_MulABScaleShuffled_v3_Nswizzle0_Quant3_MulRoutedWeight0_silu_FP4X2_FP4X2_B16,0.0%,139.1256,moe_ck2stages_gemm2_256x32x128x128_1x4_MulABScaleExpertWeightShuffled_v3_Nswizzle0_Quant3_MulRoutedWeight1_FP4X2_FP4X2_B16,2.8%,393.67,0,128.88,10755.33,
256,296,7168,256,384,8,ActivationType.Silu,torch.bfloat16,torch.float4_e2m1fn_x2,torch.float4_e2m1fn_x2,QuantType.per_1x32,1,0,32,0,132.1948,moe_ck2stages_gemm1_64x32x32x128_1x1_MulABScaleShuffled_v3_Nswizzle0_Quant3_MulRoutedWeight0_silu_FP4X2_FP4X2_B16,0.0%,81.7592,moe_ck2stages_gemm2_64x32x32x128_1x1_MulABScaleExpertWeightShuffled_v1_Nswizzle0_Quant3_MulRoutedWeight1_FP4X2_FP4X2_B16,1.3%,213.954,0,121.86,9910.05,
256,296,7168,512,384,8,ActivationType.Silu,torch.bfloat16,torch.float4_e2m1fn_x2,torch.float4_e2m1fn_x2,QuantType.per_1x32,1,0,32,0,256.1068,moe_ck2stages_gemm1_64x32x32x128_1x1_MulABScaleShuffled_v3_Nswizzle0_Quant3_MulRoutedWeight0_silu_FP4X2_FP4X2_B16,0.0%,139.4148,moe_ck2stages_gemm2_256x32x128x128_1x4_MulABScaleExpertWeightShuffled_v3_Nswizzle0_Quant3_MulRoutedWeight1_FP4X2_FP4X2_B16,2.8%,395.5216,0,131.83,10705.42,
256,304,7168,256,384,8,ActivationType.Silu,torch.bfloat16,torch.float4_e2m1fn_x2,torch.float4_e2m1fn_x2,QuantType.per_1x32,1,0,32,0,133.2322,moe_ck2stages_gemm1_64x32x32x128_1x1_MulABScaleShuffled_v3_Nswizzle0_Quant3_MulRoutedWeight0_silu_FP4X2_FP4X2_B16,0.0%,83.1171,moe_ck2stages_gemm2_64x32x32x128_1x1_MulABScaleExpertWeightShuffled_v1_Nswizzle0_Quant3_MulRoutedWeight1_FP4X2_FP4X2_B16,1.3%,216.3493,0,123.76,9801.12,
256,304,7168,512,384,8,ActivationType.Silu,torch.bfloat16,torch.float4_e2m1fn_x2,torch.float4_e2m1fn_x2,QuantType.per_1x32,1,0,32,0,255.1772,moe_ck2stages_gemm1_256x32x128x128_1x4_MulABScaleShuffled_v3_Nswizzle0_Quant3_MulRoutedWeight0_silu_FP4X2_FP4X2_B16,0.0%,145.627,moe_ck2stages_gemm2_256x32x128x128_1x4_MulABScaleExpertWeightShuffled_v3_Nswizzle0_Quant3_MulRoutedWeight1_FP4X2_FP4X2_B16,2.8%,400.8042,0,133.61,10564.75,
256,312,7168,256,384,8,ActivationType.Silu,torch.bfloat16,torch.float4_e2m1fn_x2,torch.float4_e2m1fn_x2,QuantType.per_1x32,1,0,32,0,131.3437,moe_ck2stages_gemm1_64x32x32x128_1x1_MulABScaleShuffled_v3_Nswizzle0_Quant3_MulRoutedWeight0_silu_FP4X2_FP4X2_B16,0.0%,82.6263,moe_ck2stages_gemm2_64x32x32x128_1x1_MulABScaleExpertWeightShuffled_v1_Nswizzle0_Quant3_MulRoutedWeight1_FP4X2_FP4X2_B16,1.3%,213.97,0,128.43,9910.91,
256,312,7168,512,384,8,ActivationType.Silu,torch.bfloat16,torch.float4_e2m1fn_x2,torch.float4_e2m1fn_x2,QuantType.per_1x32,1,0,32,0,257.7733,moe_ck2stages_gemm1_256x32x128x128_1x4_MulABScaleShuffled_v3_Nswizzle0_Quant3_MulRoutedWeight0_silu_FP4X2_FP4X2_B16,0.0%,145.2641,moe_ck2stages_gemm2_256x32x128x128_1x4_MulABScaleExpertWeightShuffled_v3_Nswizzle0_Quant3_MulRoutedWeight1_FP4X2_FP4X2_B16,2.8%,403.0374,0,136.37,10506.64,
256,320,7168,256,384,8,ActivationType.Silu,torch.bfloat16,torch.float4_e2m1fn_x2,torch.float4_e2m1fn_x2,QuantType.per_1x32,1,0,32,0,132.3397,moe_ck2stages_gemm1_256x32x128x128_1x4_MulABScaleShuffled_v3_Nswizzle0_Quant3_MulRoutedWeight0_silu_FP4X2_FP4X2_B16,0.0%,82.8242,moe_ck2stages_gemm2_64x32x32x128_1x1_MulABScaleExpertWeightShuffled_v1_Nswizzle0_Quant3_MulRoutedWeight1_FP4X2_FP4X2_B16,1.3%,215.1639,0,131.0,9856.72,
256,320,7168,512,384,8,ActivationType.Silu,torch.bfloat16,torch.float4_e2m1fn_x2,torch.float4_e2m1fn_x2,QuantType.per_1x32,1,0,32,0,256.1588,moe_ck2stages_gemm1_256x32x128x128_1x4_MulABScaleShuffled_v3_Nswizzle0_Quant3_MulRoutedWeight0_silu_FP4X2_FP4X2_B16,0.0%,142.9144,moe_ck2stages_gemm2_256x32x128x128_1x4_MulABScaleExpertWeightShuffled_v3_Nswizzle0_Quant3_MulRoutedWeight1_FP4X2_FP4X2_B16,2.7%,399.0732,0,141.26,10611.44,
256,328,7168,256,384,8,ActivationType.Silu,torch.bfloat16,torch.float4_e2m1fn_x2,torch.float4_e2m1fn_x2,QuantType.per_1x32,1,0,32,0,131.7804,moe_ck2stages_gemm1_256x32x128x128_1x4_MulABScaleShuffled_v3_Nswizzle0_Quant3_MulRoutedWeight0_silu_FP4X2_FP4X2_B16,0.0%,82.9968,moe_ck2stages_gemm2_64x32x32x128_1x1_MulABScaleExpertWeightShuffled_v1_Nswizzle0_Quant3_MulRoutedWeight1_FP4X2_FP4X2_B16,1.3%,214.7772,0,134.51,9875.27,
256,328,7168,512,384,8,ActivationType.Silu,torch.bfloat16,torch.float4_e2m1fn_x2,torch.float4_e2m1fn_x2,QuantType.per_1x32,1,0,32,0,255.9989,moe_ck2stages_gemm1_256x32x128x128_1x4_MulABScaleShuffled_v3_Nswizzle0_Quant3_MulRoutedWeight0_silu_FP4X2_FP4X2_B16,0.0%,144.7781,moe_ck2stages_gemm2_256x32x128x128_1x4_MulABScaleExpertWeightShuffled_v3_Nswizzle0_Quant3_MulRoutedWeight1_FP4X2_FP4X2_B16,2.7%,400.777,0,144.17,10566.75,
256,336,7168,256,384,8,ActivationType.Silu,torch.bfloat16,torch.float4_e2m1fn_x2,torch.float4_e2m1fn_x2,QuantType.per_1x32,1,0,32,0,133.1698,moe_ck2stages_gemm1_64x32x32x128_1x1_MulABScaleShuffled_v3_Nswizzle0_Quant3_MulRoutedWeight0_silu_FP4X2_FP4X2_B16,0.0%,83.5561,moe_ck2stages_gemm2_64x32x32x128_1x1_MulABScaleExpertWeightShuffled_v1_Nswizzle0_Quant3_MulRoutedWeight1_FP4X2_FP4X2_B16,1.3%,216.7259,0,136.56,9787.27,
256,336,7168,512,384,8,ActivationType.Silu,torch.bfloat16,torch.float4_e2m1fn_x2,torch.float4_e2m1fn_x2,QuantType.per_1x32,1,0,32,0,255.533,moe_ck2stages_gemm1_64x32x32x128_1x1_MulABScaleShuffled_v3_Nswizzle0_Quant3_MulRoutedWeight0_silu_FP4X2_FP4X2_B16,0.0%,144.1088,moe_ck2stages_gemm2_256x32x128x128_1x4_MulABScaleExpertWeightShuffled_v3_Nswizzle0_Quant3_MulRoutedWeight1_FP4X2_FP4X2_B16,2.7%,399.6418,0,148.11,10597.2,
256,344,7168,256,384,8,ActivationType.Silu,torch.bfloat16,torch.float4_e2m1fn_x2,torch.float4_e2m1fn_x2,QuantType.per_1x32,1,0,32,0,131.4043,moe_ck2stages_gemm1_64x32x32x128_1x1_MulABScaleShuffled_v3_Nswizzle0_Quant3_MulRoutedWeight0_silu_FP4X2_FP4X2_B16,0.0%,83.6397,moe_ck2stages_gemm2_64x32x32x128_1x1_MulABScaleExpertWeightShuffled_v1_Nswizzle0_Quant3_MulRoutedWeight1_FP4X2_FP4X2_B16,1.2%,215.044,0,140.9,9864.62,
256,344,7168,512,384,8,ActivationType.Silu,torch.bfloat16,torch.float4_e2m1fn_x2,torch.float4_e2m1fn_x2,QuantType.per_1x32,1,0,32,0,256.0388,moe_ck2stages_gemm1_256x32x128x128_1x4_MulABScaleShuffled_v3_Nswizzle0_Quant3_MulRoutedWeight0_silu_FP4X2_FP4X2_B16,0.0%,143.824,moe_ck2stages_gemm2_256x32x128x128_1x4_MulABScaleExpertWeightShuffled_v3_Nswizzle0_Quant3_MulRoutedWeight1_FP4X2_FP4X2_B16,2.7%,399.8628,0,151.55,10591.77,
256,352,7168,256,384,8,ActivationType.Silu,torch.bfloat16,torch.float4_e2m1fn_x2,torch.float4_e2m1fn_x2,QuantType.per_1x32,1,0,32,0,133.7349,moe_ck2stages_gemm1_64x32x32x128_1x1_MulABScaleShuffled_v3_Nswizzle0_Quant3_MulRoutedWeight0_silu_FP4X2_FP4X2_B16,0.0%,83.5366,moe_ck2stages_gemm2_64x32x32x128_1x1_MulABScaleExpertWeightShuffled_v1_Nswizzle0_Quant3_MulRoutedWeight1_FP4X2_FP4X2_B16,1.2%,217.2715,0,142.7,9764.27,
256,352,7168,512,384,8,ActivationType.Silu,torch.bfloat16,torch.float4_e2m1fn_x2,torch.float4_e2m1fn_x2,QuantType.per_1x32,1,0,32,0,257.4021,moe_ck2stages_gemm1_256x32x128x128_1x4_MulABScaleShuffled_v3_Nswizzle0_Quant3_MulRoutedWeight0_silu_FP4X2_FP4X2_B16,0.0%,141.3375,moe_ck2stages_gemm2_256x32x128x128_1x4_MulABScaleExpertWeightShuffled_v3_Nswizzle0_Quant3_MulRoutedWeight1_FP4X2_FP4X2_B16,2.7%,398.7396,0,155.51,10622.04,
256,360,7168,256,384,8,ActivationType.Silu,torch.bfloat16,torch.float4_e2m1fn_x2,torch.float4_e2m1fn_x2,QuantType.per_1x32,1,0,32,0,135.1024,moe_ck2stages_gemm1_256x32x128x128_1x4_MulABScaleShuffled_v3_Nswizzle0_Quant3_MulRoutedWeight0_silu_FP4X2_FP4X2_B16,0.0%,82.6641,moe_ck2stages_gemm2_64x32x32x128_1x1_MulABScaleExpertWeightShuffled_v1_Nswizzle0_Quant3_MulRoutedWeight1_FP4X2_FP4X2_B16,1.3%,217.7665,0,145.61,9742.87,
256,360,7168,512,384,8,ActivationType.Silu,torch.bfloat16,torch.float4_e2m1fn_x2,torch.float4_e2m1fn_x2,QuantType.per_1x32,1,0,32,0,256.3661,moe_ck2stages_gemm1_256x32x128x128_1x4_MulABScaleShuffled_v3_Nswizzle0_Quant3_MulRoutedWeight0_silu_FP4X2_FP4X2_B16,0.0%,144.8631,moe_ck2stages_gemm2_256x32x128x128_1x4_MulABScaleExpertWeightShuffled_v3_Nswizzle0_Quant3_MulRoutedWeight1_FP4X2_FP4X2_B16,2.7%,401.2292,0,158.06,10556.56,
256,368,7168,256,384,8,ActivationType.Silu,torch.bfloat16,torch.float4_e2m1fn_x2,torch.float4_e2m1fn_x2,QuantType.per_1x32,1,0,32,0,132.3079,moe_ck2stages_gemm1_256x32x128x128_1x4_MulABScaleShuffled_v3_Nswizzle0_Quant3_MulRoutedWeight0_silu_FP4X2_FP4X2_B16,0.0%,83.4837,moe_ck2stages_gemm2_64x32x32x128_1x1_MulABScaleExpertWeightShuffled_v1_Nswizzle0_Quant3_MulRoutedWeight1_FP4X2_FP4X2_B16,1.3%,215.7916,0,150.21,9832.83,
256,368,7168,512,384,8,ActivationType.Silu,torch.bfloat16,torch.float4_e2m1fn_x2,torch.float4_e2m1fn_x2,QuantType.per_1x32,1,0,32,0,257.2205,moe_ck2stages_gemm1_256x32x128x128_1x4_MulABScaleShuffled_v3_Nswizzle0_Quant3_MulRoutedWeight0_silu_FP4X2_FP4X2_B16,0.0%,147.5699,moe_ck2stages_gemm2_256x32x128x128_1x4_MulABScaleExpertWeightShuffled_v3_Nswizzle0_Quant3_MulRoutedWeight1_FP4X2_FP4X2_B16,2.7%,404.7904,0,160.15,10464.11,
256,376,7168,256,384,8,ActivationType.Silu,torch.bfloat16,torch.float4_e2m1fn_x2,torch.float4_e2m1fn_x2,QuantType.per_1x32,1,0,32,0,132.8814,moe_ck2stages_gemm1_64x32x32x128_1x1_MulABScaleShuffled_v3_Nswizzle0_Quant3_MulRoutedWeight0_silu_FP4X2_FP4X2_B16,0.0%,84.4181,moe_ck2stages_gemm2_64x32x32x128_1x1_MulABScaleExpertWeightShuffled_v1_Nswizzle0_Quant3_MulRoutedWeight1_FP4X2_FP4X2_B16,1.3%,217.2995,0,152.41,9765.39,
256,376,7168,512,384,8,ActivationType.Silu,torch.bfloat16,torch.float4_e2m1fn_x2,torch.float4_e2m1fn_x2,QuantType.per_1x32,1,0,32,0,257.7192,moe_ck2stages_gemm1_256x32x128x128_1x4_MulABScaleShuffled_v3_Nswizzle0_Quant3_MulRoutedWeight0_silu_FP4X2_FP4X2_B16,0.0%,144.9116,moe_ck2stages_gemm2_256x32x128x128_1x4_MulABScaleExpertWeightShuffled_v3_Nswizzle0_Quant3_MulRoutedWeight1_FP4X2_FP4X2_B16,2.8%,402.6308,0,164.51,10520.67,
256,384,7168,256,384,8,ActivationType.Silu,torch.bfloat16,torch.float4_e2m1fn_x2,torch.float4_e2m1fn_x2,QuantType.per_1x32,1,0,32,0,133.1213,moe_ck2stages_gemm1_64x32x32x128_1x1_MulABScaleShuffled_v3_Nswizzle0_Quant3_MulRoutedWeight0_silu_FP4X2_FP4X2_B16,0.0%,86.1935,moe_ck2stages_gemm2_64x32x32x128_1x1_MulABScaleExpertWeightShuffled_v1_Nswizzle0_Quant3_MulRoutedWeight1_FP4X2_FP4X2_B16,1.3%,219.3148,0,154.22,9676.44,
256,384,7168,512,384,8,ActivationType.Silu,torch.bfloat16,torch.float4_e2m1fn_x2,torch.float4_e2m1fn_x2,QuantType.per_1x32,1,0,32,0,251.2023,moe_ck2stages_gemm1_256x32x128x128_1x4_MulABScaleShuffled_v3_Nswizzle0_Quant3_MulRoutedWeight0_silu_FP4X2_FP4X2_B16,0.0%,141.81,moe_ck2stages_gemm2_256x32x128x128_1x4_MulABScaleExpertWeightShuffled_v3_Nswizzle0_Quant3_MulRoutedWeight1_FP4X2_FP4X2_B16,2.8%,393.0123,0,172.12,10778.58,
256,392,7168,256,384,8,ActivationType.Silu,torch.bfloat16,torch.float4_e2m1fn_x2,torch.float4_e2m1fn_x2,QuantType.per_1x32,1,0,32,0,133.7857,moe_ck2stages_gemm1_256x32x128x128_1x4_MulABScaleShuffled_v3_Nswizzle0_Quant3_MulRoutedWeight0_silu_FP4X2_FP4X2_B16,0.0%,85.2576,moe_ck2stages_gemm2_64x32x32x128_1x1_MulABScaleExpertWeightShuffled_v1_Nswizzle0_Quant3_MulRoutedWeight1_FP4X2_FP4X2_B16,1.3%,219.0433,0,157.63,9689.22,
256,392,7168,512,384,8,ActivationType.Silu,torch.bfloat16,torch.float4_e2m1fn_x2,torch.float4_e2m1fn_x2,QuantType.per_1x32,1,0,32,0,257.2001,moe_ck2stages_gemm1_256x32x128x128_1x4_MulABScaleShuffled_v3_Nswizzle0_Quant3_MulRoutedWeight0_silu_FP4X2_FP4X2_B16,0.0%,145.2804,moe_ck2stages_gemm2_256x32x128x128_1x4_MulABScaleExpertWeightShuffled_v3_Nswizzle0_Quant3_MulRoutedWeight1_FP4X2_FP4X2_B16,2.8%,402.4805,0,171.57,10525.45,
256,400,7168,256,384,8,ActivationType.Silu,torch.bfloat16,torch.float4_e2m1fn_x2,torch.float4_e2m1fn_x2,QuantType.per_1x32,1,0,32,0,132.9658,moe_ck2stages_gemm1_64x32x32x128_1x1_MulABScaleShuffled_v3_Nswizzle0_Quant3_MulRoutedWeight0_silu_FP4X2_FP4X2_B16,0.0%,85.8105,moe_ck2stages_gemm2_64x32x32x128_1x1_MulABScaleExpertWeightShuffled_v1_Nswizzle0_Quant3_MulRoutedWeight1_FP4X2_FP4X2_B16,1.3%,218.7763,0,161.04,9701.83,
256,400,7168,512,384,8,ActivationType.Silu,torch.bfloat16,torch.float4_e2m1fn_x2,torch.float4_e2m1fn_x2,QuantType.per_1x32,1,0,32,0,255.8076,moe_ck2stages_gemm1_64x32x32x128_1x1_MulABScaleShuffled_v3_Nswizzle0_Quant3_MulRoutedWeight0_silu_FP4X2_FP4X2_B16,0.0%,142.6706,moe_ck2stages_gemm2_256x32x128x128_1x4_MulABScaleExpertWeightShuffled_v3_Nswizzle0_Quant3_MulRoutedWeight1_FP4X2_FP4X2_B16,2.8%,398.4782,0,176.83,10631.6,
256,408,7168,256,384,8,ActivationType.Silu,torch.bfloat16,torch.float4_e2m1fn_x2,torch.float4_e2m1fn_x2,QuantType.per_1x32,1,0,32,0,132.7363,moe_ck2stages_gemm1_256x32x128x128_1x4_MulABScaleShuffled_v3_Nswizzle0_Quant3_MulRoutedWeight0_silu_FP4X2_FP4X2_B16,0.0%,85.4674,moe_ck2stages_gemm2_64x32x32x128_1x1_MulABScaleExpertWeightShuffled_v1_Nswizzle0_Quant3_MulRoutedWeight1_FP4X2_FP4X2_B16,1.3%,218.2037,0,164.69,9728.08,
256,408,7168,512,384,8,ActivationType.Silu,torch.bfloat16,torch.float4_e2m1fn_x2,torch.float4_e2m1fn_x2,QuantType.per_1x32,1,0,32,0,257.1604,moe_ck2stages_gemm1_64x32x32x128_1x1_MulABScaleShuffled_v3_Nswizzle0_Quant3_MulRoutedWeight0_silu_FP4X2_FP4X2_B16,0.0%,147.5476,moe_ck2stages_gemm2_256x32x128x128_1x4_MulABScaleExpertWeightShuffled_v3_Nswizzle0_Quant3_MulRoutedWeight1_FP4X2_FP4X2_B16,2.8%,404.708,0,177.59,10468.37,
256,416,7168,256,384,8,ActivationType.Silu,torch.bfloat16,torch.float4_e2m1fn_x2,torch.float4_e2m1fn_x2,QuantType.per_1x32,1,0,32,0,132.7724,moe_ck2stages_gemm1_256x32x128x128_1x4_MulABScaleShuffled_v3_Nswizzle0_Quant3_MulRoutedWeight0_silu_FP4X2_FP4X2_B16,0.0%,86.7297,moe_ck2stages_gemm2_64x32x32x128_1x1_MulABScaleExpertWeightShuffled_v1_Nswizzle0_Quant3_MulRoutedWeight1_FP4X2_FP4X2_B16,1.3%,219.5021,0,166.93,9671.32,
256,416,7168,512,384,8,ActivationType.Silu,torch.bfloat16,torch.float4_e2m1fn_x2,torch.float4_e2m1fn_x2,QuantType.per_1x32,1,0,32,0,256.4949,moe_ck2stages_gemm1_256x32x128x128_1x4_MulABScaleShuffled_v3_Nswizzle0_Quant3_MulRoutedWeight0_silu_FP4X2_FP4X2_B16,0.0%,145.5676,moe_ck2stages_gemm2_256x32x128x128_1x4_MulABScaleExpertWeightShuffled_v3_Nswizzle0_Quant3_MulRoutedWeight1_FP4X2_FP4X2_B16,2.8%,402.0625,0,182.27,10537.68,
256,424,7168,256,384,8,ActivationType.Silu,torch.bfloat16,torch.float4_e2m1fn_x2,torch.float4_e2m1fn_x2,QuantType.per_1x32,1,0,32,0,132.561,moe_ck2stages_gemm1_256x32x128x128_1x4_MulABScaleShuffled_v3_Nswizzle0_Quant3_MulRoutedWeight0_silu_FP4X2_FP4X2_B16,0.0%,86.1593,moe_ck2stages_gemm2_64x32x32x128_1x1_MulABScaleExpertWeightShuffled_v1_Nswizzle0_Quant3_MulRoutedWeight1_FP4X2_FP4X2_B16,1.3%,218.7203,0,170.75,9706.68,
256,424,7168,512,384,8,ActivationType.Silu,torch.bfloat16,torch.float4_e2m1fn_x2,torch.float4_e2m1fn_x2,QuantType.per_1x32,1,0,32,0,259.3193,moe_ck2stages_gemm1_256x32x128x128_1x4_MulABScaleShuffled_v3_Nswizzle0_Quant3_MulRoutedWeight0_silu_FP4X2_FP4X2_B16,0.0%,143.5459,moe_ck2stages_gemm2_256x32x128x128_1x4_MulABScaleExpertWeightShuffled_v3_Nswizzle0_Quant3_MulRoutedWeight1_FP4X2_FP4X2_B16,2.8%,402.8652,0,185.4,10517.11,
256,432,7168,256,384,8,ActivationType.Silu,torch.bfloat16,torch.float4_e2m1fn_x2,torch.float4_e2m1fn_x2,QuantType.per_1x32,1,0,32,0,133.0479,moe_ck2stages_gemm1_64x32x32x128_1x1_MulABScaleShuffled_v3_Nswizzle0_Quant3_MulRoutedWeight0_silu_FP4X2_FP4X2_B16,0.0%,86.6181,moe_ck2stages_gemm2_64x32x32x128_1x1_MulABScaleExpertWeightShuffled_v1_Nswizzle0_Quant3_MulRoutedWeight1_FP4X2_FP4X2_B16,1.3%,219.666,0,173.22,9665.67,
256,432,7168,512,384,8,ActivationType.Silu,torch.bfloat16,torch.float4_e2m1fn_x2,torch.float4_e2m1fn_x2,QuantType.per_1x32,1,0,32,0,256.992,moe_ck2stages_gemm1_256x32x128x128_1x4_MulABScaleShuffled_v3_Nswizzle0_Quant3_MulRoutedWeight0_silu_FP4X2_FP4X2_B16,0.0%,147.5846,moe_ck2stages_gemm2_256x32x128x128_1x4_MulABScaleExpertWeightShuffled_v3_Nswizzle0_Quant3_MulRoutedWeight1_FP4X2_FP4X2_B16,2.8%,404.5766,0,188.1,10473.04,
256,440,7168,256,384,8,ActivationType.Silu,torch.bfloat16,torch.float4_e2m1fn_x2,torch.float4_e2m1fn_x2,QuantType.per_1x32,1,0,32,0,134.215,moe_ck2stages_gemm1_256x32x128x128_1x4_MulABScaleShuffled_v3_Nswizzle0_Quant3_MulRoutedWeight0_silu_FP4X2_FP4X2_B16,0.0%,86.9536,moe_ck2stages_gemm2_64x32x32x128_1x1_MulABScaleExpertWeightShuffled_v1_Nswizzle0_Quant3_MulRoutedWeight1_FP4X2_FP4X2_B16,1.3%,221.1686,0,175.23,9600.78,
256,440,7168,512,384,8,ActivationType.Silu,torch.bfloat16,torch.float4_e2m1fn_x2,torch.float4_e2m1fn_x2,QuantType.per_1x32,1,0,32,0,257.7553,moe_ck2stages_gemm1_64x32x32x128_1x1_MulABScaleShuffled_v3_Nswizzle0_Quant3_MulRoutedWeight0_silu_FP4X2_FP4X2_B16,0.0%,148.0072,moe_ck2stages_gemm2_256x32x128x128_1x4_MulABScaleExpertWeightShuffled_v3_Nswizzle0_Quant3_MulRoutedWeight1_FP4X2_FP4X2_B16,2.8%,405.7625,0,191.02,10442.86,
256,448,7168,256,384,8,ActivationType.Silu,torch.bfloat16,torch.float4_e2m1fn_x2,torch.float4_e2m1fn_x2,QuantType.per_1x32,1,0,32,0,133.2857,moe_ck2stages_gemm1_64x32x32x128_1x1_MulABScaleShuffled_v3_Nswizzle0_Quant3_MulRoutedWeight0_silu_FP4X2_FP4X2_B16,0.0%,87.1084,moe_ck2stages_gemm2_64x32x32x128_1x1_MulABScaleExpertWeightShuffled_v1_Nswizzle0_Quant3_MulRoutedWeight1_FP4X2_FP4X2_B16,1.3%,220.3941,0,179.04,9635.3,
256,448,7168,512,384,8,ActivationType.Silu,torch.bfloat16,torch.float4_e2m1fn_x2,torch.float4_e2m1fn_x2,QuantType.per_1x32,1,0,32,0,258.4937,moe_ck2stages_gemm1_256x32x128x128_1x4_MulABScaleShuffled_v3_Nswizzle0_Quant3_MulRoutedWeight0_silu_FP4X2_FP4X2_B16,0.0%,147.7801,moe_ck2stages_gemm2_256x32x128x128_1x4_MulABScaleExpertWeightShuffled_v3_Nswizzle0_Quant3_MulRoutedWeight1_FP4X2_FP4X2_B16,2.8%,406.2738,0,194.25,10430.14,
256,456,7168,256,384,8,ActivationType.Silu,torch.bfloat16,torch.float4_e2m1fn_x2,torch.float4_e2m1fn_x2,QuantType.per_1x32,1,0,32,0,132.3668,moe_ck2stages_gemm1_64x32x32x128_1x1_MulABScaleShuffled_v3_Nswizzle0_Quant3_MulRoutedWeight0_silu_FP4X2_FP4X2_B16,0.0%,86.7355,moe_ck2stages_gemm2_64x32x32x128_1x1_MulABScaleExpertWeightShuffled_v1_Nswizzle0_Quant3_MulRoutedWeight1_FP4X2_FP4X2_B16,1.3%,219.1023,0,183.31,9692.89,
256,456,7168,512,384,8,ActivationType.Silu,torch.bfloat16,torch.float4_e2m1fn_x2,torch.float4_e2m1fn_x2,QuantType.per_1x32,1,0,32,0,260.3077,moe_ck2stages_gemm1_64x32x32x128_1x1_MulABScaleShuffled_v3_Nswizzle0_Quant3_MulRoutedWeight0_silu_FP4X2_FP4X2_B16,0.0%,147.4528,moe_ck2stages_gemm2_256x32x128x128_1x4_MulABScaleExpertWeightShuffled_v3_Nswizzle0_Quant3_MulRoutedWeight1_FP4X2_FP4X2_B16,2.8%,407.7605,0,197.0,10392.53,
256,464,7168,256,384,8,ActivationType.Silu,torch.bfloat16,torch.float4_e2m1fn_x2,torch.float4_e2m1fn_x2,QuantType.per_1x32,1,0,32,0,133.1024,moe_ck2stages_gemm1_256x32x128x128_1x4_MulABScaleShuffled_v3_Nswizzle0_Quant3_MulRoutedWeight0_silu_FP4X2_FP4X2_B16,0.0%,87.5448,moe_ck2stages_gemm2_64x32x32x128_1x1_MulABScaleExpertWeightShuffled_v1_Nswizzle0_Quant3_MulRoutedWeight1_FP4X2_FP4X2_B16,1.3%,220.6472,0,185.22,9625.81,
256,464,7168,512,384,8,ActivationType.Silu,torch.bfloat16,torch.float4_e2m1fn_x2,torch.float4_e2m1fn_x2,QuantType.per_1x32,1,0,32,0,258.2157,moe_ck2stages_gemm1_256x32x128x128_1x4_MulABScaleShuffled_v3_Nswizzle0_Quant3_MulRoutedWeight0_silu_FP4X2_FP4X2_B16,0.0%,148.6204,moe_ck2stages_gemm2_256x32x128x128_1x4_MulABScaleExpertWeightShuffled_v3_Nswizzle0_Quant3_MulRoutedWeight1_FP4X2_FP4X2_B16,2.8%,406.8361,0,200.91,10416.57,
256,472,7168,256,384,8,ActivationType.Silu,torch.bfloat16,torch.float4_e2m1fn_x2,torch.float4_e2m1fn_x2,QuantType.per_1x32,1,0,32,0,133.2066,moe_ck2stages_gemm1_64x32x32x128_1x1_MulABScaleShuffled_v3_Nswizzle0_Quant3_MulRoutedWeight0_silu_FP4X2_FP4X2_B16,0.0%,88.0878,moe_ck2stages_gemm2_64x32x32x128_1x1_MulABScaleExpertWeightShuffled_v1_Nswizzle0_Quant3_MulRoutedWeight1_FP4X2_FP4X2_B16,1.3%,221.2944,0,187.87,9598.43,
256,472,7168,512,384,8,ActivationType.Silu,torch.bfloat16,torch.float4_e2m1fn_x2,torch.float4_e2m1fn_x2,QuantType.per_1x32,1,0,32,0,258.6777,moe_ck2stages_gemm1_256x32x128x128_1x4_MulABScaleShuffled_v3_Nswizzle0_Quant3_MulRoutedWeight0_silu_FP4X2_FP4X2_B16,0.0%,148.5382,moe_ck2stages_gemm2_256x32x128x128_1x4_MulABScaleExpertWeightShuffled_v3_Nswizzle0_Quant3_MulRoutedWeight1_FP4X2_FP4X2_B16,2.8%,407.2159,0,204.19,10407.28,
256,480,7168,256,384,8,ActivationType.Silu,torch.bfloat16,torch.float4_e2m1fn_x2,torch.float4_e2m1fn_x2,QuantType.per_1x32,1,0,32,0,132.7105,moe_ck2stages_gemm1_64x32x32x128_1x1_MulABScaleShuffled_v3_Nswizzle0_Quant3_MulRoutedWeight0_silu_FP4X2_FP4X2_B16,0.0%,89.5994,moe_ck2stages_gemm2_64x32x32x128_1x1_MulABScaleExpertWeightShuffled_v1_Nswizzle0_Quant3_MulRoutedWeight1_FP4X2_FP4X2_B16,1.3%,222.3099,0,190.18,9555.36,
256,480,7168,512,384,8,ActivationType.Silu,torch.bfloat16,torch.float4_e2m1fn_x2,torch.float4_e2m1fn_x2,QuantType.per_1x32,1,0,32,0,260.8557,moe_ck2stages_gemm1_256x32x128x128_1x4_MulABScaleShuffled_v3_Nswizzle0_Quant3_MulRoutedWeight0_silu_FP4X2_FP4X2_B16,0.0%,149.7273,moe_ck2stages_gemm2_256x32x128x128_1x4_MulABScaleExpertWeightShuffled_v3_Nswizzle0_Quant3_MulRoutedWeight1_FP4X2_FP4X2_B16,2.7%,410.583,0,205.94,10322.35,
256,488,7168,256,384,8,ActivationType.Silu,torch.bfloat16,torch.float4_e2m1fn_x2,torch.float4_e2m1fn_x2,QuantType.per_1x32,1,0,32,0,132.1756,moe_ck2stages_gemm1_64x32x32x128_1x1_MulABScaleShuffled_v3_Nswizzle0_Quant3_MulRoutedWeight0_silu_FP4X2_FP4X2_B16,0.0%,89.2877,moe_ck2stages_gemm2_64x32x32x128_1x1_MulABScaleExpertWeightShuffled_v1_Nswizzle0_Quant3_MulRoutedWeight1_FP4X2_FP4X2_B16,1.3%,221.4633,0,194.09,9592.66,
256,488,7168,512,384,8,ActivationType.Silu,torch.bfloat16,torch.float4_e2m1fn_x2,torch.float4_e2m1fn_x2,QuantType.per_1x32,1,0,32,0,256.2919,moe_ck2stages_gemm1_256x32x128x128_1x4_MulABScaleShuffled_v3_Nswizzle0_Quant3_MulRoutedWeight0_silu_FP4X2_FP4X2_B16,0.0%,149.4257,moe_ck2stages_gemm2_256x32x128x128_1x4_MulABScaleExpertWeightShuffled_v3_Nswizzle0_Quant3_MulRoutedWeight1_FP4X2_FP4X2_B16,2.8%,405.7176,0,211.89,10446.56,
256,496,7168,256,384,8,ActivationType.Silu,torch.bfloat16,torch.float4_e2m1fn_x2,torch.float4_e2m1fn_x2,QuantType.per_1x32,1,0,32,0,134.266,moe_ck2stages_gemm1_64x32x32x128_1x1_MulABScaleShuffled_v3_Nswizzle0_Quant3_MulRoutedWeight0_silu_FP4X2_FP4X2_B16,0.0%,89.1981,moe_ck2stages_gemm2_64x32x32x128_1x1_MulABScaleExpertWeightShuffled_v1_Nswizzle0_Quant3_MulRoutedWeight1_FP4X2_FP4X2_B16,1.3%,223.4641,0,195.5,9507.55,
256,496,7168,512,384,8,ActivationType.Silu,torch.bfloat16,torch.float4_e2m1fn_x2,torch.float4_e2m1fn_x2,QuantType.per_1x32,1,0,32,0,258.3645,moe_ck2stages_gemm1_256x32x128x128_1x4_MulABScaleShuffled_v3_Nswizzle0_Quant3_MulRoutedWeight0_silu_FP4X2_FP4X2_B16,0.0%,150.1304,moe_ck2stages_gemm2_256x32x128x128_1x4_MulABScaleExpertWeightShuffled_v3_Nswizzle0_Quant3_MulRoutedWeight1_FP4X2_FP4X2_B16,2.7%,408.4949,0,213.9,10375.95,
256,504,7168,256,384,8,ActivationType.Silu,torch.bfloat16,torch.float4_e2m1fn_x2,torch.float4_e2m1fn_x2,QuantType.per_1x32,1,0,32,0,133.7242,moe_ck2stages_gemm1_64x32x32x128_1x1_MulABScaleShuffled_v3_Nswizzle0_Quant3_MulRoutedWeight0_silu_FP4X2_FP4X2_B16,0.0%,89.6661,moe_ck2stages_gemm2_64x32x32x128_1x1_MulABScaleExpertWeightShuffled_v1_Nswizzle0_Quant3_MulRoutedWeight1_FP4X2_FP4X2_B16,1.3%,223.3903,0,198.72,9511.46,
256,504,7168,512,384,8,ActivationType.Silu,torch.bfloat16,torch.float4_e2m1fn_x2,torch.float4_e2m1fn_x2,QuantType.per_1x32,1,0,32,0,259.1866,moe_ck2stages_gemm1_256x32x128x128_1x4_MulABScaleShuffled_v3_Nswizzle0_Quant3_MulRoutedWeight0_silu_FP4X2_FP4X2_B16,0.0%,150.2376,moe_ck2stages_gemm2_256x32x128x128_1x4_MulABScaleExpertWeightShuffled_v3_Nswizzle0_Quant3_MulRoutedWeight1_FP4X2_FP4X2_B16,2.7%,409.4242,0,216.85,10352.82,
256,512,7168,256,384,8,ActivationType.Silu,torch.bfloat16,torch.float4_e2m1fn_x2,torch.float4_e2m1fn_x2,QuantType.per_1x32,1,0,32,0,132.3977,moe_ck2stages_gemm1_64x32x32x128_1x1_MulABScaleShuffled_v3_Nswizzle0_Quant3_MulRoutedWeight0_silu_FP4X2_FP4X2_B16,0.0%,89.2093,moe_ck2stages_gemm2_64x32x32x128_1x1_MulABScaleExpertWeightShuffled_v1_Nswizzle0_Quant3_MulRoutedWeight1_FP4X2_FP4X2_B16,1.3%,221.607,0,203.5,9588.77,
256,512,7168,512,384,8,ActivationType.Silu,torch.bfloat16,torch.float4_e2m1fn_x2,torch.float4_e2m1fn_x2,QuantType.per_1x32,1,0,32,0,259.0885,moe_ck2stages_gemm1_256x32x128x128_1x4_MulABScaleShuffled_v3_Nswizzle0_Quant3_MulRoutedWeight0_silu_FP4X2_FP4X2_B16,0.0%,148.4615,moe_ck2stages_gemm2_256x32x128x128_1x4_MulABScaleExpertWeightShuffled_v3_Nswizzle0_Quant3_MulRoutedWeight1_FP4X2_FP4X2_B16,2.7%,407.55,0,221.31,10400.86,
256,1024,7168,256,384,8,ActivationType.Silu,torch.bfloat16,torch.float4_e2m1fn_x2,torch.float4_e2m1fn_x2,QuantType.per_1x32,1,0,32,0,139.8291,moe_ck2stages_gemm1_64x32x32x128_1x1_MulABScaleShuffled_v3_Nswizzle0_Quant3_MulRoutedWeight0_silu_FP4X2_FP4X2_B16,0.0%,116.6655,moe_ck2stages_gemm2_64x32x32x128_1x1_MulABScaleExpertWeightShuffled_v1_Nswizzle0_Quant3_MulRoutedWeight1_FP4X2_FP4X2_B16,1.3%,256.4946,0,351.64,8327.46,
256,1024,7168,512,384,8,ActivationType.Silu,torch.bfloat16,torch.float4_e2m1fn_x2,torch.float4_e2m1fn_x2,QuantType.per_1x32,1,0,64,0,264.9061,moe_ck2stages_gemm1_256x64x128x128_1x4_MulABScaleShuffled_v3_Nswizzle0_Quant3_MulRoutedWeight0_silu_FP4X2_FP4X2_B16,0.0%,210.7301,moe_ck2stages_gemm2_256x64x128x128_1x4_MulABScaleExpertWeightShuffled_v3_Nswizzle0_Quant3_MulRoutedWeight1_FP4X2_FP4X2_B16,2.7%,475.6362,0,379.26,8935.15,
256,2048,7168,256,384,8,ActivationType.Silu,torch.bfloat16,torch.float4_e2m1fn_x2,torch.float4_e2m1fn_x2,QuantType.per_1x32,1,0,64,0,155.7852,moe_ck2stages_gemm1_256x64x128x128_1x4_MulABScaleShuffled_v3_Nswizzle0_Quant3_MulRoutedWeight0_silu_FP4X2_FP4X2_B16,0.0%,209.7107,moe_ck2stages_gemm2_64x64x128x128_1x1_MulABScaleExpertWeightShuffled_v3_Nswizzle0_Quant3_MulRoutedWeight1_FP4X2_FP4X2_B16,1.2%,365.4959,0,493.54,5904.22,
256,2048,7168,512,384,8,ActivationType.Silu,torch.bfloat16,torch.float4_e2m1fn_x2,torch.float4_e2m1fn_x2,QuantType.per_1x32,1,0,64,0,274.0178,moe_ck2stages_gemm1_256x64x128x128_1x4_MulABScaleShuffled_v3_Nswizzle0_Quant3_MulRoutedWeight0_silu_FP4X2_FP4X2_B16,0.0%,338.8011,moe_ck2stages_gemm2_64x64x128x128_1x1_MulABScaleExpertWeightShuffled_v3_Nswizzle0_Quant3_MulRoutedWeight1_FP4X2_FP4X2_B16,2.8%,612.8189,0,588.72,6970.9,
256,4096,7168,256,384,8,ActivationType.Silu,torch.bfloat16,torch.float4_e2m1fn_x2,torch.float4_e2m1fn_x2,QuantType.per_1x32,1,0,128,0,160.3175,moe_ck2stages_gemm1_256x128x128x128_1x4_MulABScaleShuffled_v3_Nswizzle0_Quant3_MulRoutedWeight0_silu_FP4X2_FP4X2_B16,0.0%,401.5219,moe_ck2stages_gemm2_64x128x128x128_1x1_MulABScaleExpertWeightShuffled_v3_Nswizzle0_Quant3_MulRoutedWeight1_FP4X2_FP4X2_B16,1.3%,561.8394,0,642.14,3919.29,
256,4096,7168,512,384,8,ActivationType.Silu,torch.bfloat16,torch.float4_e2m1fn_x2,torch.float4_e2m1fn_x2,QuantType.per_1x32,1,0,64,0,501.8382,moe_ck2stages_gemm1_256x64x128x128_1x4_MulABScaleShuffled_v3_Nswizzle0_Quant3_MulRoutedWeight0_silu_FP4X2_FP4X2_B16,0.0%,563.9833,moe_ck2stages_gemm2_64x64x128x128_1x1_MulABScaleExpertWeightShuffled_v3_Nswizzle0_Quant3_MulRoutedWeight1_FP4X2_FP4X2_B16,2.7%,1065.8215,0,676.99,4049.4,
256,8192,7168,256,384,8,ActivationType.Silu,torch.bfloat16,torch.float4_e2m1fn_x2,torch.float4_e2m1fn_x2,QuantType.per_1x32,1,0,128,0,286.0669,moe_ck2stages_gemm1_256x128x128x128_1x4_MulABScaleShuffled_v3_Nswizzle0_Quant3_MulRoutedWeight0_silu_FP4X2_FP4X2_B16,0.0%,758.8479,moe_ck2stages_gemm2_64x128x128x128_1x1_MulABScaleExpertWeightShuffled_v3_Nswizzle0_Quant3_MulRoutedWeight1_FP4X2_FP4X2_B16,1.2%,1044.9148,0,690.54,2191.65,
256,8192,7168,512,384,8,ActivationType.Silu,torch.bfloat16,torch.float4_e2m1fn_x2,torch.float4_e2m1fn_x2,QuantType.per_1x32,1,0,64,0,543.2178,moe_ck2stages_gemm1_256x64x128x128_1x4_MulABScaleShuffled_v3_Nswizzle0_Quant3_MulRoutedWeight0_silu_FP4X2_FP4X2_B16,0.0%,959.3602,moe_ck2stages_gemm2_64x64x128x128_1x1_MulABScaleExpertWeightShuffled_v3_Nswizzle0_Quant3_MulRoutedWeight1_FP4X2_FP4X2_B16,2.7%,1502.578,0,960.42,2930.98,
256,16384,7168,256,384,8,ActivationType.Silu,torch.bfloat16,torch.float4_e2m1fn_x2,torch.float4_e2m1fn_x2,QuantType.per_1x32,1,0,128,0,465.0118,moe_ck2stages_gemm1_256x128x128x128_1x4_MulABScaleShuffled_v3_Nswizzle0_Quant3_MulRoutedWeight0_silu_FP4X2_FP4X2_B16,0.0%,1478.56,moe_ck2stages_gemm2_64x128x128x128_1x1_MulABScaleExpertWeightShuffled_v3_Nswizzle0_Quant3_MulRoutedWeight1_FP4X2_FP4X2_B16,1.2%,1943.5718,0,742.5,1268.93,
256,16384,7168,512,384,8,ActivationType.Silu,torch.bfloat16,torch.float4_e2m1fn_x2,torch.float4_e2m1fn_x2,QuantType.per_1x32,1,0,64,0,792.1551,moe_ck2stages_gemm1_256x64x128x128_1x4_MulABScaleShuffled_v3_Nswizzle0_Quant3_MulRoutedWeight0_silu_FP4X2_FP4X2_B16,0.0%,1910.4314,moe_ck2stages_gemm2_64x64x128x128_1x1_MulABScaleExpertWeightShuffled_v3_Nswizzle0_Quant3_MulRoutedWeight1_FP4X2_FP4X2_B16,2.8%,2702.5865,0,1067.95,1694.74,
256,32768,7168,256,384,8,ActivationType.Silu,torch.bfloat16,torch.float4_e2m1fn_x2,torch.float4_e2m1fn_x2,QuantType.per_1x32,1,0,128,0,706.3118,moe_ck2stages_gemm1_256x128x128x128_1x4_MulABScaleShuffled_v3_Nswizzle0_Quant3_MulRoutedWeight0_silu_FP4X2_FP4X2_B16,0.0%,3010.0562,moe_ck2stages_gemm2_64x128x128x128_1x1_MulABScaleExpertWeightShuffled_v3_Nswizzle0_Quant3_MulRoutedWeight1_FP4X2_FP4X2_B16,1.2%,3716.368,0,776.62,758.42,
256,32768,7168,512,384,8,ActivationType.Silu,torch.bfloat16,torch.float4_e2m1fn_x2,torch.float4_e2m1fn_x2,QuantType.per_1x32,1,0,64,0,1390.7691,moe_ck2stages_gemm1_256x64x128x128_1x4_MulABScaleShuffled_v3_Nswizzle0_Quant3_MulRoutedWeight0_silu_FP4X2_FP4X2_B16,0.0%,3822.7502,moe_ck2stages_gemm2_64x64x128x128_1x1_MulABScaleExpertWeightShuffled_v3_Nswizzle0_Quant3_MulRoutedWeight1_FP4X2_FP4X2_B16,2.7%,5213.5193,0,1107.21,946.1,
