aiter/configs/model_configs/kimik2_bf16_tuned_gemm.csv
cu_num,M,N,K,bias,dtype,outdtype,scaleAB,bpreshuffle,libtype,solidx,splitK,us,kernelName,err_ratio,tflops,bw
256,1,2112,7168,False,torch.bfloat16,torch.bfloat16,False,False,flydsl,39,16,10.5991,flydsl_gemm2_abf16_wbf16_bf16_t32x64x64_split_k16_block_m_warp2_block_n_warp2_async_copyTrue_b_to_ldsTrue_b_preshuffleFalse_c_to_ldsFalse_gfx950,0.0,2.86,2858.37
256,2,2112,7168,False,torch.bfloat16,torch.bfloat16,False,False,flydsl,39,16,10.1591,flydsl_gemm2_abf16_wbf16_bf16_t32x64x64_split_k16_block_m_warp2_block_n_warp2_async_copyTrue_b_to_ldsTrue_b_preshuffleFalse_c_to_ldsFalse_gfx950,0.0,5.96,2984.0
256,4,2112,7168,False,torch.bfloat16,torch.bfloat16,False,False,flydsl,39,16,10.1901,flydsl_gemm2_abf16_wbf16_bf16_t32x64x64_split_k16_block_m_warp2_block_n_warp2_async_copyTrue_b_to_ldsTrue_b_preshuffleFalse_c_to_ldsFalse_gfx950,0.0,11.89,2978.56
256,8,2112,7168,False,torch.bfloat16,torch.bfloat16,False,False,flydsl,217,8,11.2658,flydsl_gemm2_abf16_wbf16_bf16_t32x64x128_split_k8_block_m_warp2_block_n_warp2_async_copyTrue_b_to_ldsTrue_b_preshuffleFalse_c_to_ldsFalse_gfx950,0.0,21.5,2700.76
256,16,2112,7168,False,torch.bfloat16,torch.bfloat16,False,False,flydsl,217,8,11.8301,flydsl_gemm2_abf16_wbf16_bf16_t32x64x128_split_k8_block_m_warp2_block_n_warp2_async_copyTrue_b_to_ldsTrue_b_preshuffleFalse_c_to_ldsFalse_gfx950,0.0,40.95,2584.47
256,24,2112,7168,False,torch.bfloat16,torch.bfloat16,False,False,flydsl,217,8,12.7013,flydsl_gemm2_abf16_wbf16_bf16_t32x64x128_split_k8_block_m_warp2_block_n_warp2_async_copyTrue_b_to_ldsTrue_b_preshuffleFalse_c_to_ldsFalse_gfx950,0.0,57.21,2418.89
256,32,2112,7168,False,torch.bfloat16,torch.bfloat16,False,False,flydsl,217,8,13.5858,flydsl_gemm2_abf16_wbf16_bf16_t32x64x128_split_k8_block_m_warp2_block_n_warp2_async_copyTrue_b_to_ldsTrue_b_preshuffleFalse_c_to_ldsFalse_gfx950,0.0,71.32,2272.34
256,40,2112,7168,False,torch.bfloat16,torch.bfloat16,False,False,flydsl,277,8,15.4658,flydsl_gemm2_abf16_wbf16_bf16_t64x64x128_split_k8_block_m_warp2_block_n_warp2_async_copyTrue_b_to_ldsTrue_b_preshuffleFalse_c_to_ldsFalse_gfx950,0.0,78.31,2005.72
256,48,2112,7168,False,torch.bfloat16,torch.bfloat16,False,False,flydsl,277,8,16.4036,flydsl_gemm2_abf16_wbf16_bf16_t64x64x128_split_k8_block_m_warp2_block_n_warp2_async_copyTrue_b_to_ldsTrue_b_preshuffleFalse_c_to_ldsFalse_gfx950,0.0,88.6,1900.11
256,56,2112,7168,False,torch.bfloat16,torch.bfloat16,False,False,asm,5,7,15.2765,_ZN5aiter39bf16gemm_fp32bf16_tn_64x64_splitk_cleanE,0.0195,110.99,2050.01
256,64,2112,7168,False,torch.bfloat16,torch.bfloat16,False,False,asm,5,6,14.6227,_ZN5aiter39bf16gemm_fp32bf16_tn_64x64_splitk_cleanE,0.018,132.52,2151.82
256,72,2112,7168,False,torch.bfloat16,torch.bfloat16,False,False,asm,7,7,15.6467,_ZN5aiter39bf16gemm_fp32bf16_tn_80x64_splitk_cleanE,0.0192,139.33,2020.49
256,80,2112,7168,False,torch.bfloat16,torch.bfloat16,False,False,asm,7,6,15.8189,_ZN5aiter39bf16gemm_fp32bf16_tn_80x64_splitk_cleanE,0.0175,153.12,2007.88
256,88,2112,7168,False,torch.bfloat16,torch.bfloat16,False,False,asm,8,7,16.2422,_ZN5aiter39bf16gemm_fp32bf16_tn_96x64_splitk_cleanE,0.0196,164.04,1964.69
256,96,2112,7168,False,torch.bfloat16,torch.bfloat16,False,False,asm,8,6,16.2338,_ZN5aiter39bf16gemm_fp32bf16_tn_96x64_splitk_cleanE,0.0182,179.05,1974.85
256,112,2112,7168,False,torch.bfloat16,torch.bfloat16,False,False,asm,5,3,19.5749,_ZN5aiter39bf16gemm_fp32bf16_tn_64x64_splitk_cleanE,0.0104,173.24,1652.95
256,128,2112,7168,False,torch.bfloat16,torch.bfloat16,False,False,asm,5,3,19.9118,_ZN5aiter39bf16gemm_fp32bf16_tn_64x64_splitk_cleanE,0.0105,194.64,1639.9
256,144,2112,7168,False,torch.bfloat16,torch.bfloat16,False,False,flydsl,305,4,27.9682,flydsl_gemm2_abf16_wbf16_bf16_t96x64x128_split_k4_block_m_warp2_block_n_warp2_async_copyTrue_b_to_ldsTrue_b_preshuffleFalse_c_to_ldsFalse_gfx950,0.0,155.89,1178.13
256,152,2112,7168,False,torch.bfloat16,torch.bfloat16,False,False,flydsl,305,4,28.3192,flydsl_gemm2_abf16_wbf16_bf16_t96x64x128_split_k4_block_m_warp2_block_n_warp2_async_copyTrue_b_to_ldsTrue_b_preshuffleFalse_c_to_ldsFalse_gfx950,0.0,162.51,1168.77
256,256,2112,7168,False,torch.bfloat16,torch.bfloat16,False,False,asm,8,2,28.5227,_ZN5aiter39bf16gemm_fp32bf16_tn_96x64_splitk_cleanE,0.006,271.75,1228.11
256,264,2112,7168,False,torch.bfloat16,torch.bfloat16,False,False,flydsl,305,4,36.7061,flydsl_gemm2_abf16_wbf16_bf16_t96x64x128_split_k4_block_m_warp2_block_n_warp2_async_copyTrue_b_to_ldsTrue_b_preshuffleFalse_c_to_ldsFalse_gfx950,0.0,217.76,958.35
256,360,2112,7168,False,torch.bfloat16,torch.bfloat16,False,False,flydsl,332,2,46.3017,flydsl_gemm2_abf16_wbf16_bf16_t128x64x128_split_k2_block_m_warp1_block_n_warp4_async_copyTrue_b_to_ldsFalse_b_preshuffleFalse_c_to_ldsFalse_gfx950,0.0,235.41,798.23
256,368,2112,7168,False,torch.bfloat16,torch.bfloat16,False,False,flydsl,332,2,47.4396,flydsl_gemm2_abf16_wbf16_bf16_t128x64x128_split_k2_block_m_warp1_block_n_warp4_async_copyTrue_b_to_ldsFalse_b_preshuffleFalse_c_to_ldsFalse_gfx950,0.0,234.87,782.21
256,376,2112,7168,False,torch.bfloat16,torch.bfloat16,False,False,flydsl,332,2,47.5907,flydsl_gemm2_abf16_wbf16_bf16_t128x64x128_split_k2_block_m_warp1_block_n_warp4_async_copyTrue_b_to_ldsFalse_b_preshuffleFalse_c_to_ldsFalse_gfx950,0.0,239.21,782.85
256,384,2112,7168,False,torch.bfloat16,torch.bfloat16,False,False,flydsl,332,2,47.9951,flydsl_gemm2_abf16_wbf16_bf16_t128x64x128_split_k2_block_m_warp1_block_n_warp4_async_copyTrue_b_to_ldsFalse_b_preshuffleFalse_c_to_ldsFalse_gfx950,0.0,242.25,779.34
256,1,3072,1536,False,torch.bfloat16,torch.bfloat16,False,False,flydsl,37,8,5.7634,flydsl_gemm2_abf16_wbf16_bf16_t32x64x64_split_k8_block_m_warp2_block_n_warp2_async_copyTrue_b_to_ldsTrue_b_preshuffleFalse_c_to_ldsFalse_gfx950,0.0,1.64,1639.02
256,2,3072,1536,False,torch.bfloat16,torch.bfloat16,False,False,flydsl,37,8,5.9723,flydsl_gemm2_abf16_wbf16_bf16_t32x64x64_split_k8_block_m_warp2_block_n_warp2_async_copyTrue_b_to_ldsTrue_b_preshuffleFalse_c_to_ldsFalse_gfx950,0.0,3.16,1583.24
256,4,3072,1536,False,torch.bfloat16,torch.bfloat16,False,False,flydsl,37,8,6.0747,flydsl_gemm2_abf16_wbf16_bf16_t32x64x64_split_k8_block_m_warp2_block_n_warp2_async_copyTrue_b_to_ldsTrue_b_preshuffleFalse_c_to_ldsFalse_gfx950,0.0,6.21,1559.6
256,8,3072,1536,False,torch.bfloat16,torch.bfloat16,False,False,flydsl,215,4,5.9634,flydsl_gemm2_abf16_wbf16_bf16_t32x64x128_split_k4_block_m_warp2_block_n_warp2_async_copyTrue_b_to_ldsTrue_b_preshuffleFalse_c_to_ldsFalse_gfx950,0.0,12.66,1594.87
256,16,3072,1536,False,torch.bfloat16,torch.bfloat16,False,False,flydsl,215,4,6.1546,flydsl_gemm2_abf16_wbf16_bf16_t32x64x128_split_k4_block_m_warp2_block_n_warp2_async_copyTrue_b_to_ldsTrue_b_preshuffleFalse_c_to_ldsFalse_gfx950,0.0,24.53,1557.32
256,24,3072,1536,False,torch.bfloat16,torch.bfloat16,False,False,flydsl,215,4,6.6036,flydsl_gemm2_abf16_wbf16_bf16_t32x64x128_split_k4_block_m_warp2_block_n_warp2_async_copyTrue_b_to_ldsTrue_b_preshuffleFalse_c_to_ldsFalse_gfx950,0.0,34.3,1462.6
256,32,3072,1536,False,torch.bfloat16,torch.bfloat16,False,False,asm,1,4,8.7013,_ZN5aiter39bf16gemm_fp32bf16_tn_32x64_splitk_cleanE,0.0075,34.71,1118.46
256,48,3072,1536,False,torch.bfloat16,torch.bfloat16,False,False,asm,3,3,9.043,_ZN5aiter39bf16gemm_fp32bf16_tn_48x64_splitk_cleanE,0.0058,50.09,1092.51
256,64,3072,1536,False,torch.bfloat16,torch.bfloat16,False,False,asm,7,4,9.2849,_ZN5aiter39bf16gemm_fp32bf16_tn_80x64_splitk_cleanE,0.0078,65.05,1079.93
256,80,3072,1536,False,torch.bfloat16,torch.bfloat16,False,False,asm,7,4,9.3113,_ZN5aiter39bf16gemm_fp32bf16_tn_80x64_splitk_cleanE,0.0076,81.08,1092.7
256,96,3072,1536,False,torch.bfloat16,torch.bfloat16,False,False,asm,8,4,9.668,_ZN5aiter39bf16gemm_fp32bf16_tn_96x64_splitk_cleanE,0.0076,93.71,1067.64
256,112,3072,1536,False,torch.bfloat16,torch.bfloat16,False,False,asm,7,2,10.1342,_ZN5aiter39bf16gemm_fp32bf16_tn_80x64_splitk_cleanE,0.0028,104.3,1033.07
256,128,3072,1536,False,torch.bfloat16,torch.bfloat16,False,False,asm,5,2,10.3007,_ZN5aiter39bf16gemm_fp32bf16_tn_64x64_splitk_cleanE,0.0028,117.27,1030.69
256,176,3072,1536,False,torch.bfloat16,torch.bfloat16,False,False,asm,8,2,10.6186,_ZN5aiter39bf16gemm_fp32bf16_tn_96x64_splitk_cleanE,0.0028,156.42,1041.49
256,184,3072,1536,False,torch.bfloat16,torch.bfloat16,False,False,asm,8,2,10.8345,_ZN5aiter39bf16gemm_fp32bf16_tn_96x64_splitk_cleanE,0.0028,160.27,1027.54
256,192,3072,1536,False,torch.bfloat16,torch.bfloat16,False,False,asm,8,2,11.0118,_ZN5aiter39bf16gemm_fp32bf16_tn_96x64_splitk_cleanE,0.0028,164.55,1017.7
256,256,3072,1536,False,torch.bfloat16,torch.bfloat16,False,False,asm,6,1,12.0939,_ZN5aiter37bf16gemm_fp32bf16_tn_64x64_pf3_splitkE,0.0,199.76,975.41
256,1,4096,512,False,torch.bfloat16,torch.bfloat16,False,False,flydsl,211,1,4.7546,flydsl_gemm2_abf16_wbf16_bf16_t32x64x128_split_k1_block_m_warp2_block_n_warp2_async_copyTrue_b_to_ldsTrue_b_preshuffleFalse_c_to_ldsFalse_gfx950,0.0,0.88,884.1
256,40,4096,512,False,torch.bfloat16,torch.bfloat16,False,False,flydsl,211,1,4.9813,flydsl_gemm2_abf16_wbf16_bf16_t32x64x128_split_k1_block_m_warp2_block_n_warp2_async_copyTrue_b_to_ldsTrue_b_preshuffleFalse_c_to_ldsFalse_gfx950,0.0,33.68,916.01
256,48,4096,512,False,torch.bfloat16,torch.bfloat16,False,False,flydsl,211,1,4.9013,flydsl_gemm2_abf16_wbf16_bf16_t32x64x128_split_k1_block_m_warp2_block_n_warp2_async_copyTrue_b_to_ldsTrue_b_preshuffleFalse_c_to_ldsFalse_gfx950,0.0,41.08,946.0
256,56,4096,512,False,torch.bfloat16,torch.bfloat16,False,False,flydsl,211,1,4.8923,flydsl_gemm2_abf16_wbf16_bf16_t32x64x128_split_k1_block_m_warp2_block_n_warp2_async_copyTrue_b_to_ldsTrue_b_preshuffleFalse_c_to_ldsFalse_gfx950,0.0,48.01,962.81
256,64,4096,512,False,torch.bfloat16,torch.bfloat16,False,False,flydsl,211,1,4.9501,flydsl_gemm2_abf16_wbf16_bf16_t32x64x128_split_k1_block_m_warp2_block_n_warp2_async_copyTrue_b_to_ldsTrue_b_preshuffleFalse_c_to_ldsFalse_gfx950,0.0,54.23,966.47
256,72,4096,512,False,torch.bfloat16,torch.bfloat16,False,False,flydsl,211,1,5.2168,flydsl_gemm2_abf16_wbf16_bf16_t32x64x128_split_k1_block_m_warp2_block_n_warp2_async_copyTrue_b_to_ldsTrue_b_preshuffleFalse_c_to_ldsFalse_gfx950,0.0,57.89,931.2
256,80,4096,512,False,torch.bfloat16,torch.bfloat16,False,False,flydsl,211,1,5.248,flydsl_gemm2_abf16_wbf16_bf16_t32x64x128_split_k1_block_m_warp2_block_n_warp2_async_copyTrue_b_to_ldsTrue_b_preshuffleFalse_c_to_ldsFalse_gfx950,0.0,63.94,939.71
256,88,4096,512,False,torch.bfloat16,torch.bfloat16,False,False,flydsl,211,1,5.2434,flydsl_gemm2_abf16_wbf16_bf16_t32x64x128_split_k1_block_m_warp2_block_n_warp2_async_copyTrue_b_to_ldsTrue_b_preshuffleFalse_c_to_ldsFalse_gfx950,0.0,70.39,954.58
256,96,4096,512,False,torch.bfloat16,torch.bfloat16,False,False,flydsl,211,1,5.2792,flydsl_gemm2_abf16_wbf16_bf16_t32x64x128_split_k1_block_m_warp2_block_n_warp2_async_copyTrue_b_to_ldsTrue_b_preshuffleFalse_c_to_ldsFalse_gfx950,0.0,76.27,962.08
256,104,4096,512,False,torch.bfloat16,torch.bfloat16,False,False,flydsl,211,1,5.7279,flydsl_gemm2_abf16_wbf16_bf16_t32x64x128_split_k1_block_m_warp2_block_n_warp2_async_copyTrue_b_to_ldsTrue_b_preshuffleFalse_c_to_ldsFalse_gfx950,0.0,76.16,899.59
256,112,4096,512,False,torch.bfloat16,torch.bfloat16,False,False,flydsl,211,1,5.7637,flydsl_gemm2_abf16_wbf16_bf16_t32x64x128_split_k1_block_m_warp2_block_n_warp2_async_copyTrue_b_to_ldsTrue_b_preshuffleFalse_c_to_ldsFalse_gfx950,0.0,81.5,906.8
256,120,4096,512,False,torch.bfloat16,torch.bfloat16,False,False,flydsl,211,1,5.608,flydsl_gemm2_abf16_wbf16_bf16_t32x64x128_split_k1_block_m_warp2_block_n_warp2_async_copyTrue_b_to_ldsTrue_b_preshuffleFalse_c_to_ldsFalse_gfx950,0.0,89.75,945.12
256,128,4096,512,False,torch.bfloat16,torch.bfloat16,False,False,flydsl,211,1,5.6879,flydsl_gemm2_abf16_wbf16_bf16_t32x64x128_split_k1_block_m_warp2_block_n_warp2_async_copyTrue_b_to_ldsTrue_b_preshuffleFalse_c_to_ldsFalse_gfx950,0.0,94.39,944.81
256,136,4096,512,False,torch.bfloat16,torch.bfloat16,False,False,flydsl,271,1,6.0124,flydsl_gemm2_abf16_wbf16_bf16_t64x64x128_split_k1_block_m_warp2_block_n_warp2_async_copyTrue_b_to_ldsTrue_b_preshuffleFalse_c_to_ldsFalse_gfx950,0.0,94.87,906.07
256,144,4096,512,False,torch.bfloat16,torch.bfloat16,False,False,flydsl,211,1,6.048,flydsl_gemm2_abf16_wbf16_bf16_t32x64x128_split_k1_block_m_warp2_block_n_warp2_async_copyTrue_b_to_ldsTrue_b_preshuffleFalse_c_to_ldsFalse_gfx950,0.0,99.86,912.93
256,152,4096,512,False,torch.bfloat16,torch.bfloat16,False,False,flydsl,271,1,5.9768,flydsl_gemm2_abf16_wbf16_bf16_t64x64x128_split_k1_block_m_warp2_block_n_warp2_async_copyTrue_b_to_ldsTrue_b_preshuffleFalse_c_to_ldsFalse_gfx950,0.0,106.67,936.15
256,160,4096,512,False,torch.bfloat16,torch.bfloat16,False,False,flydsl,211,1,6.0481,flydsl_gemm2_abf16_wbf16_bf16_t32x64x128_split_k1_block_m_warp2_block_n_warp2_async_copyTrue_b_to_ldsTrue_b_preshuffleFalse_c_to_ldsFalse_gfx950,0.0,110.96,937.29
256,168,4096,512,False,torch.bfloat16,torch.bfloat16,False,False,flydsl,271,1,6.0612,flydsl_gemm2_abf16_wbf16_bf16_t64x64x128_split_k1_block_m_warp2_block_n_warp2_async_copyTrue_b_to_ldsTrue_b_preshuffleFalse_c_to_ldsFalse_gfx950,0.0,116.25,947.43
256,176,4096,512,False,torch.bfloat16,torch.bfloat16,False,False,flydsl,271,1,6.0569,flydsl_gemm2_abf16_wbf16_bf16_t64x64x128_split_k1_block_m_warp2_block_n_warp2_async_copyTrue_b_to_ldsTrue_b_preshuffleFalse_c_to_ldsFalse_gfx950,0.0,121.88,960.28
256,184,4096,512,False,torch.bfloat16,torch.bfloat16,False,False,flydsl,271,1,6.0657,flydsl_gemm2_abf16_wbf16_bf16_t64x64x128_split_k1_block_m_warp2_block_n_warp2_async_copyTrue_b_to_ldsTrue_b_preshuffleFalse_c_to_ldsFalse_gfx950,0.0,127.23,971.05
256,192,4096,512,False,torch.bfloat16,torch.bfloat16,False,False,flydsl,271,1,6.0971,flydsl_gemm2_abf16_wbf16_bf16_t64x64x128_split_k1_block_m_warp2_block_n_warp2_async_copyTrue_b_to_ldsTrue_b_preshuffleFalse_c_to_ldsFalse_gfx950,0.0,132.08,978.13
256,240,4096,512,False,torch.bfloat16,torch.bfloat16,False,False,flydsl,271,1,6.5769,flydsl_gemm2_abf16_wbf16_bf16_t64x64x128_split_k1_block_m_warp2_block_n_warp2_async_copyTrue_b_to_ldsTrue_b_preshuffleFalse_c_to_ldsFalse_gfx950,0.0,153.06,974.04
256,248,4096,512,False,torch.bfloat16,torch.bfloat16,False,False,flydsl,271,1,6.5634,flydsl_gemm2_abf16_wbf16_bf16_t64x64x128_split_k1_block_m_warp2_block_n_warp2_async_copyTrue_b_to_ldsTrue_b_preshuffleFalse_c_to_ldsFalse_gfx950,0.0,158.48,987.27
256,264,4096,512,False,torch.bfloat16,torch.bfloat16,False,False,flydsl,301,1,6.6701,flydsl_gemm2_abf16_wbf16_bf16_t96x64x128_split_k1_block_m_warp2_block_n_warp2_async_copyTrue_b_to_ldsTrue_b_preshuffleFalse_c_to_ldsFalse_gfx950,0.0,166.01,993.59
256,272,4096,512,False,torch.bfloat16,torch.bfloat16,False,False,flydsl,271,1,6.9324,flydsl_gemm2_abf16_wbf16_bf16_t64x64x128_split_k1_block_m_warp2_block_n_warp2_async_copyTrue_b_to_ldsTrue_b_preshuffleFalse_c_to_ldsFalse_gfx950,0.0,164.57,966.62
256,280,4096,512,False,torch.bfloat16,torch.bfloat16,False,False,flydsl,301,1,6.7414,flydsl_gemm2_abf16_wbf16_bf16_t96x64x128_split_k1_block_m_warp2_block_n_warp2_async_copyTrue_b_to_ldsTrue_b_preshuffleFalse_c_to_ldsFalse_gfx950,0.0,174.21,1004.95
256,296,4096,512,False,torch.bfloat16,torch.bfloat16,False,False,flydsl,271,1,6.9813,flydsl_gemm2_abf16_wbf16_bf16_t64x64x128_split_k1_block_m_warp2_block_n_warp2_async_copyTrue_b_to_ldsTrue_b_preshuffleFalse_c_to_ldsFalse_gfx950,0.0,177.83,991.54
256,304,4096,512,False,torch.bfloat16,torch.bfloat16,False,False,flydsl,271,1,6.9457,flydsl_gemm2_abf16_wbf16_bf16_t64x64x128_split_k1_block_m_warp2_block_n_warp2_async_copyTrue_b_to_ldsTrue_b_preshuffleFalse_c_to_ldsFalse_gfx950,0.0,183.58,1007.24
256,312,4096,512,False,torch.bfloat16,torch.bfloat16,False,False,flydsl,271,1,6.999,flydsl_gemm2_abf16_wbf16_bf16_t64x64x128_split_k1_block_m_warp2_block_n_warp2_async_copyTrue_b_to_ldsTrue_b_preshuffleFalse_c_to_ldsFalse_gfx950,0.0,186.97,1010.1
256,320,4096,512,False,torch.bfloat16,torch.bfloat16,False,False,flydsl,271,1,7.0123,flydsl_gemm2_abf16_wbf16_bf16_t64x64x128_split_k1_block_m_warp2_block_n_warp2_async_copyTrue_b_to_ldsTrue_b_preshuffleFalse_c_to_ldsFalse_gfx950,0.0,191.4,1018.69
256,328,4096,512,False,torch.bfloat16,torch.bfloat16,False,False,flydsl,271,1,7.1457,flydsl_gemm2_abf16_wbf16_bf16_t64x64x128_split_k1_block_m_warp2_block_n_warp2_async_copyTrue_b_to_ldsTrue_b_preshuffleFalse_c_to_ldsFalse_gfx950,0.0,192.53,1010.0
256,336,4096,512,False,torch.bfloat16,torch.bfloat16,False,False,flydsl,271,1,7.1412,flydsl_gemm2_abf16_wbf16_bf16_t64x64x128_split_k1_block_m_warp2_block_n_warp2_async_copyTrue_b_to_ldsTrue_b_preshuffleFalse_c_to_ldsFalse_gfx950,0.0,197.35,1020.96
256,352,4096,512,False,torch.bfloat16,torch.bfloat16,False,False,flydsl,271,1,7.128,flydsl_gemm2_abf16_wbf16_bf16_t64x64x128_split_k1_block_m_warp2_block_n_warp2_async_copyTrue_b_to_ldsTrue_b_preshuffleFalse_c_to_ldsFalse_gfx950,0.0,207.13,1043.54
256,360,4096,512,False,torch.bfloat16,torch.bfloat16,False,False,asm,9,1,7.6864,_ZN5aiter37bf16gemm_fp32bf16_tn_96x64_pf3_splitkE,0.0,196.44,977.32
256,392,4096,512,False,torch.bfloat16,torch.bfloat16,False,False,flydsl,301,1,7.6879,flydsl_gemm2_abf16_wbf16_bf16_t96x64x128_split_k1_block_m_warp2_block_n_warp2_async_copyTrue_b_to_ldsTrue_b_preshuffleFalse_c_to_ldsFalse_gfx950,0.0,213.86,1015.49
256,400,4096,512,False,torch.bfloat16,torch.bfloat16,False,False,flydsl,301,1,7.7859,flydsl_gemm2_abf16_wbf16_bf16_t96x64x128_split_k1_block_m_warp2_block_n_warp2_async_copyTrue_b_to_ldsTrue_b_preshuffleFalse_c_to_ldsFalse_gfx950,0.0,215.48,1012.18
256,416,4096,512,False,torch.bfloat16,torch.bfloat16,False,False,flydsl,271,1,7.7771,flydsl_gemm2_abf16_wbf16_bf16_t64x64x128_split_k1_block_m_warp2_block_n_warp2_async_copyTrue_b_to_ldsTrue_b_preshuffleFalse_c_to_ldsFalse_gfx950,0.0,224.35,1032.28
256,424,4096,512,False,torch.bfloat16,torch.bfloat16,False,False,flydsl,271,1,7.8301,flydsl_gemm2_abf16_wbf16_bf16_t64x64x128_split_k1_block_m_warp2_block_n_warp2_async_copyTrue_b_to_ldsTrue_b_preshuffleFalse_c_to_ldsFalse_gfx950,0.0,227.12,1034.71
256,432,4096,512,False,torch.bfloat16,torch.bfloat16,False,False,flydsl,301,1,7.8659,flydsl_gemm2_abf16_wbf16_bf16_t96x64x128_split_k1_block_m_warp2_block_n_warp2_async_copyTrue_b_to_ldsTrue_b_preshuffleFalse_c_to_ldsFalse_gfx950,0.0,230.35,1039.38
256,440,4096,512,False,torch.bfloat16,torch.bfloat16,False,False,flydsl,271,1,7.8436,flydsl_gemm2_abf16_wbf16_bf16_t64x64x128_split_k1_block_m_warp2_block_n_warp2_async_copyTrue_b_to_ldsTrue_b_preshuffleFalse_c_to_ldsFalse_gfx950,0.0,235.29,1051.74
256,456,4096,512,False,torch.bfloat16,torch.bfloat16,False,False,flydsl,301,1,7.9279,flydsl_gemm2_abf16_wbf16_bf16_t96x64x128_split_k1_block_m_warp2_block_n_warp2_async_copyTrue_b_to_ldsTrue_b_preshuffleFalse_c_to_ldsFalse_gfx950,0.0,241.25,1059.15
256,464,4096,512,False,torch.bfloat16,torch.bfloat16,False,False,flydsl,301,1,7.8347,flydsl_gemm2_abf16_wbf16_bf16_t96x64x128_split_k1_block_m_warp2_block_n_warp2_async_copyTrue_b_to_ldsTrue_b_preshuffleFalse_c_to_ldsFalse_gfx950,0.0,248.4,1081.16
256,472,4096,512,False,torch.bfloat16,torch.bfloat16,False,False,flydsl,301,1,7.8701,flydsl_gemm2_abf16_wbf16_bf16_t96x64x128_split_k1_block_m_warp2_block_n_warp2_async_copyTrue_b_to_ldsTrue_b_preshuffleFalse_c_to_ldsFalse_gfx950,0.0,251.55,1085.66
256,480,4096,512,False,torch.bfloat16,torch.bfloat16,False,False,flydsl,330,1,7.9368,flydsl_gemm2_abf16_wbf16_bf16_t128x64x128_split_k1_block_m_warp1_block_n_warp4_async_copyTrue_b_to_ldsFalse_b_preshuffleFalse_c_to_ldsFalse_gfx950,0.0,253.66,1085.83
256,1,7168,2048,False,torch.bfloat16,torch.bfloat16,False,False,asm,1,2,11.2499,_ZN5aiter39bf16gemm_fp32bf16_tn_32x64_splitk_cleanE,0.0025,2.61,2611.45
256,2,7168,2048,False,torch.bfloat16,torch.bfloat16,False,False,flydsl,47,8,9.0747,flydsl_gemm2_abf16_wbf16_bf16_t32x128x64_split_k8_block_m_warp2_block_n_warp2_async_copyTrue_b_to_ldsTrue_b_preshuffleFalse_c_to_ldsFalse_gfx950,0.0,6.47,3239.46
256,4,7168,2048,False,torch.bfloat16,torch.bfloat16,False,False,flydsl,227,8,9.3723,flydsl_gemm2_abf16_wbf16_bf16_t32x128x128_split_k8_block_m_warp2_block_n_warp2_async_copyTrue_b_to_ldsTrue_b_preshuffleFalse_c_to_ldsFalse_gfx950,0.0,12.53,3140.5
256,8,7168,2048,False,torch.bfloat16,torch.bfloat16,False,False,flydsl,215,4,9.6968,flydsl_gemm2_abf16_wbf16_bf16_t32x64x128_split_k4_block_m_warp2_block_n_warp2_async_copyTrue_b_to_ldsTrue_b_preshuffleFalse_c_to_ldsFalse_gfx950,0.0,24.22,3043.03
256,16,7168,2048,False,torch.bfloat16,torch.bfloat16,False,False,asm,1,2,11.9934,_ZN5aiter39bf16gemm_fp32bf16_tn_32x64_splitk_cleanE,0.0034,39.17,2472.61
256,32,7168,2048,False,torch.bfloat16,torch.bfloat16,False,False,asm,1,2,12.3935,_ZN5aiter39bf16gemm_fp32bf16_tn_32x64_splitk_cleanE,0.0034,75.81,2416.59
256,48,7168,2048,False,torch.bfloat16,torch.bfloat16,False,False,asm,3,2,13.0225,_ZN5aiter39bf16gemm_fp32bf16_tn_48x64_splitk_cleanE,0.0034,108.22,2322.51
256,64,7168,2048,False,torch.bfloat16,torch.bfloat16,False,False,asm,5,2,13.5831,_ZN5aiter39bf16gemm_fp32bf16_tn_64x64_splitk_cleanE,0.0034,138.34,2248.37
256,80,7168,2048,False,torch.bfloat16,torch.bfloat16,False,False,asm,7,2,14.0021,_ZN5aiter39bf16gemm_fp32bf16_tn_80x64_splitk_cleanE,0.0034,167.75,2202.15
256,96,7168,2048,False,torch.bfloat16,torch.bfloat16,False,False,asm,8,2,14.2839,_ZN5aiter39bf16gemm_fp32bf16_tn_96x64_splitk_cleanE,0.0034,197.33,2179.35
256,112,7168,2048,False,torch.bfloat16,torch.bfloat16,False,False,asm,6,1,15.5527,_ZN5aiter37bf16gemm_fp32bf16_tn_64x64_pf3_splitkE,0.0,211.43,2020.52
256,128,7168,2048,False,torch.bfloat16,torch.bfloat16,False,False,asm,6,1,15.8395,_ZN5aiter37bf16gemm_fp32bf16_tn_64x64_pf3_splitkE,0.0,237.26,2002.55
256,200,7168,2048,False,torch.bfloat16,torch.bfloat16,False,False,flydsl,330,1,23.1192,flydsl_gemm2_abf16_wbf16_bf16_t128x64x128_split_k1_block_m_warp1_block_n_warp4_async_copyTrue_b_to_ldsFalse_b_preshuffleFalse_c_to_ldsFalse_gfx950,0.0,253.99,1429.4
256,208,7168,2048,False,torch.bfloat16,torch.bfloat16,False,False,flydsl,330,1,22.9148,flydsl_gemm2_abf16_wbf16_bf16_t128x64x128_split_k1_block_m_warp1_block_n_warp4_async_copyTrue_b_to_ldsFalse_b_preshuffleFalse_c_to_ldsFalse_gfx950,0.0,266.51,1448.58
256,216,7168,2048,False,torch.bfloat16,torch.bfloat16,False,False,flydsl,330,1,22.7814,flydsl_gemm2_abf16_wbf16_bf16_t128x64x128_split_k1_block_m_warp1_block_n_warp4_async_copyTrue_b_to_ldsFalse_b_preshuffleFalse_c_to_ldsFalse_gfx950,0.0,278.38,1463.53
256,224,7168,2048,False,torch.bfloat16,torch.bfloat16,False,False,flydsl,330,1,22.8304,flydsl_gemm2_abf16_wbf16_bf16_t128x64x128_split_k1_block_m_warp1_block_n_warp4_async_copyTrue_b_to_ldsFalse_b_preshuffleFalse_c_to_ldsFalse_gfx950,0.0,288.07,1466.85
256,232,7168,2048,False,torch.bfloat16,torch.bfloat16,False,False,flydsl,330,1,22.8926,flydsl_gemm2_abf16_wbf16_bf16_t128x64x128_split_k1_block_m_warp1_block_n_warp4_async_copyTrue_b_to_ldsFalse_b_preshuffleFalse_c_to_ldsFalse_gfx950,0.0,297.54,1469.31
256,240,7168,2048,False,torch.bfloat16,torch.bfloat16,False,False,flydsl,330,1,22.8702,flydsl_gemm2_abf16_wbf16_bf16_t128x64x128_split_k1_block_m_warp1_block_n_warp4_async_copyTrue_b_to_ldsFalse_b_preshuffleFalse_c_to_ldsFalse_gfx950,0.0,308.11,1477.2
256,248,7168,2048,False,torch.bfloat16,torch.bfloat16,False,False,flydsl,330,1,23.2038,flydsl_gemm2_abf16_wbf16_bf16_t128x64x128_split_k1_block_m_warp1_block_n_warp4_async_copyTrue_b_to_ldsFalse_b_preshuffleFalse_c_to_ldsFalse_gfx950,0.0,313.8,1462.32
256,256,7168,2048,False,torch.bfloat16,torch.bfloat16,False,False,flydsl,330,1,23.6571,flydsl_gemm2_abf16_wbf16_bf16_t128x64x128_split_k1_block_m_warp1_block_n_warp4_async_copyTrue_b_to_ldsFalse_b_preshuffleFalse_c_to_ldsFalse_gfx950,0.0,317.71,1440.53
256,1,384,7168,False,torch.bfloat16,torch.bfloat16,False,False,flydsl,39,16,6.6434,flydsl_gemm2_abf16_wbf16_bf16_t32x64x64_split_k16_block_m_warp2_block_n_warp2_async_copyTrue_b_to_ldsTrue_b_preshuffleFalse_c_to_ldsFalse_gfx950,0.0,0.83,830.91
256,2,384,7168,False,torch.bfloat16,torch.bfloat16,False,False,flydsl,39,16,6.7326,flydsl_gemm2_abf16_wbf16_bf16_t32x64x64_split_k16_block_m_warp2_block_n_warp2_async_copyTrue_b_to_ldsTrue_b_preshuffleFalse_c_to_ldsFalse_gfx950,0.0,1.64,822.16
256,4,384,7168,False,torch.bfloat16,torch.bfloat16,False,False,flydsl,39,16,6.7057,flydsl_gemm2_abf16_wbf16_bf16_t32x64x64_split_k16_block_m_warp2_block_n_warp2_async_copyTrue_b_to_ldsTrue_b_preshuffleFalse_c_to_ldsFalse_gfx950,0.0,3.28,829.96
256,8,384,7168,False,torch.bfloat16,torch.bfloat16,False,False,flydsl,39,16,6.7013,flydsl_gemm2_abf16_wbf16_bf16_t32x64x64_split_k16_block_m_warp2_block_n_warp2_async_copyTrue_b_to_ldsTrue_b_preshuffleFalse_c_to_ldsFalse_gfx950,0.0,6.57,839.51
256,16,384,7168,False,torch.bfloat16,torch.bfloat16,False,False,flydsl,39,16,6.7502,flydsl_gemm2_abf16_wbf16_bf16_t32x64x64_split_k16_block_m_warp2_block_n_warp2_async_copyTrue_b_to_ldsTrue_b_preshuffleFalse_c_to_ldsFalse_gfx950,0.0,13.05,851.33
256,24,384,7168,False,torch.bfloat16,torch.bfloat16,False,False,flydsl,39,16,7.0036,flydsl_gemm2_abf16_wbf16_bf16_t32x64x64_split_k16_block_m_warp2_block_n_warp2_async_copyTrue_b_to_ldsTrue_b_preshuffleFalse_c_to_ldsFalse_gfx950,0.0,18.86,837.79
256,32,384,7168,False,torch.bfloat16,torch.bfloat16,False,False,flydsl,39,16,7.0437,flydsl_gemm2_abf16_wbf16_bf16_t32x64x64_split_k16_block_m_warp2_block_n_warp2_async_copyTrue_b_to_ldsTrue_b_preshuffleFalse_c_to_ldsFalse_gfx950,0.0,25.01,850.18
256,40,384,7168,False,torch.bfloat16,torch.bfloat16,False,False,flydsl,39,16,7.7902,flydsl_gemm2_abf16_wbf16_bf16_t32x64x64_split_k16_block_m_warp2_block_n_warp2_async_copyTrue_b_to_ldsTrue_b_preshuffleFalse_c_to_ldsFalse_gfx950,0.0,28.27,784.21
256,48,384,7168,False,torch.bfloat16,torch.bfloat16,False,False,flydsl,217,8,8.3813,flydsl_gemm2_abf16_wbf16_bf16_t32x64x128_split_k8_block_m_warp2_block_n_warp2_async_copyTrue_b_to_ldsTrue_b_preshuffleFalse_c_to_ldsFalse_gfx950,0.0,31.53,743.32
256,56,384,7168,False,torch.bfloat16,torch.bfloat16,False,False,flydsl,217,8,8.4259,flydsl_gemm2_abf16_wbf16_bf16_t32x64x128_split_k8_block_m_warp2_block_n_warp2_async_copyTrue_b_to_ldsTrue_b_preshuffleFalse_c_to_ldsFalse_gfx950,0.0,36.59,753.73
256,64,384,7168,False,torch.bfloat16,torch.bfloat16,False,False,asm,5,14,9.6229,_ZN5aiter39bf16gemm_fp32bf16_tn_64x64_splitk_cleanE,0.028,36.61,672.53
256,72,384,7168,False,torch.bfloat16,torch.bfloat16,False,False,asm,7,14,9.8399,_ZN5aiter39bf16gemm_fp32bf16_tn_80x64_splitk_cleanE,0.029,40.28,669.98
256,80,384,7168,False,torch.bfloat16,torch.bfloat16,False,False,asm,8,14,9.8919,_ZN5aiter39bf16gemm_fp32bf16_tn_96x64_splitk_cleanE,0.0282,44.52,678.67
256,88,384,7168,False,torch.bfloat16,torch.bfloat16,False,False,asm,8,14,10.1146,_ZN5aiter39bf16gemm_fp32bf16_tn_96x64_splitk_cleanE,0.0286,47.9,675.67
256,96,384,7168,False,torch.bfloat16,torch.bfloat16,False,False,asm,8,16,10.4387,_ZN5aiter39bf16gemm_fp32bf16_tn_96x64_splitk_cleanE,0.0307,50.63,666.27
256,104,384,7168,False,torch.bfloat16,torch.bfloat16,False,False,flydsl,217,8,9.5546,flydsl_gemm2_abf16_wbf16_bf16_t32x64x128_split_k8_block_m_warp2_block_n_warp2_async_copyTrue_b_to_ldsTrue_b_preshuffleFalse_c_to_ldsFalse_gfx950,0.0,59.92,740.57
256,112,384,7168,False,torch.bfloat16,torch.bfloat16,False,False,flydsl,217,8,9.479,flydsl_gemm2_abf16_wbf16_bf16_t32x64x128_split_k8_block_m_warp2_block_n_warp2_async_copyTrue_b_to_ldsTrue_b_preshuffleFalse_c_to_ldsFalse_gfx950,0.0,65.05,759.22
256,120,384,7168,False,torch.bfloat16,torch.bfloat16,False,False,flydsl,217,8,9.5591,flydsl_gemm2_abf16_wbf16_bf16_t32x64x128_split_k8_block_m_warp2_block_n_warp2_async_copyTrue_b_to_ldsTrue_b_preshuffleFalse_c_to_ldsFalse_gfx950,0.0,69.11,765.5
256,128,384,7168,False,torch.bfloat16,torch.bfloat16,False,False,flydsl,217,8,10.208,flydsl_gemm2_abf16_wbf16_bf16_t32x64x128_split_k8_block_m_warp2_block_n_warp2_async_copyTrue_b_to_ldsTrue_b_preshuffleFalse_c_to_ldsFalse_gfx950,0.0,69.03,728.68
256,136,384,7168,False,torch.bfloat16,torch.bfloat16,False,False,flydsl,307,8,11.7147,flydsl_gemm2_abf16_wbf16_bf16_t96x64x128_split_k8_block_m_warp2_block_n_warp2_async_copyTrue_b_to_ldsTrue_b_preshuffleFalse_c_to_ldsFalse_gfx950,0.0,63.91,645.27
256,144,384,7168,False,torch.bfloat16,torch.bfloat16,False,False,flydsl,307,8,11.7992,flydsl_gemm2_abf16_wbf16_bf16_t96x64x128_split_k8_block_m_warp2_block_n_warp2_async_copyTrue_b_to_ldsTrue_b_preshuffleFalse_c_to_ldsFalse_gfx950,0.0,67.18,650.89
256,168,384,7168,False,torch.bfloat16,torch.bfloat16,False,False,flydsl,307,8,12.3236,flydsl_gemm2_abf16_wbf16_bf16_t96x64x128_split_k8_block_m_warp2_block_n_warp2_async_copyTrue_b_to_ldsTrue_b_preshuffleFalse_c_to_ldsFalse_gfx950,0.0,75.05,652.61
256,216,384,7168,False,torch.bfloat16,torch.bfloat16,False,False,flydsl,277,8,12.8746,flydsl_gemm2_abf16_wbf16_bf16_t64x64x128_split_k8_block_m_warp2_block_n_warp2_async_copyTrue_b_to_ldsTrue_b_preshuffleFalse_c_to_ldsFalse_gfx950,0.0,92.36,680.99
256,224,384,7168,False,torch.bfloat16,torch.bfloat16,False,False,flydsl,277,8,13.448,flydsl_gemm2_abf16_wbf16_bf16_t64x64x128_split_k8_block_m_warp2_block_n_warp2_async_copyTrue_b_to_ldsTrue_b_preshuffleFalse_c_to_ldsFalse_gfx950,0.0,91.7,660.94
256,232,384,7168,False,torch.bfloat16,torch.bfloat16,False,False,flydsl,277,8,13.3813,flydsl_gemm2_abf16_wbf16_bf16_t64x64x128_split_k8_block_m_warp2_block_n_warp2_async_copyTrue_b_to_ldsTrue_b_preshuffleFalse_c_to_ldsFalse_gfx950,0.0,95.44,673.26
256,240,384,7168,False,torch.bfloat16,torch.bfloat16,False,False,asm,3,6,13.8548,_ZN5aiter39bf16gemm_fp32bf16_tn_48x64_splitk_cleanE,0.0183,95.36,658.98
256,248,384,7168,False,torch.bfloat16,torch.bfloat16,False,False,flydsl,277,8,13.6257,flydsl_gemm2_abf16_wbf16_bf16_t64x64x128_split_k8_block_m_warp2_block_n_warp2_async_copyTrue_b_to_ldsTrue_b_preshuffleFalse_c_to_ldsFalse_gfx950,0.0,100.2,678.93
256,256,384,7168,False,torch.bfloat16,torch.bfloat16,False,False,flydsl,277,8,13.959,flydsl_gemm2_abf16_wbf16_bf16_t64x64x128_split_k8_block_m_warp2_block_n_warp2_async_copyTrue_b_to_ldsTrue_b_preshuffleFalse_c_to_ldsFalse_gfx950,0.0,100.96,671.37
256,264,384,7168,False,torch.bfloat16,torch.bfloat16,False,False,asm,3,6,13.9183,_ZN5aiter39bf16gemm_fp32bf16_tn_48x64_splitk_cleanE,0.0186,104.42,682.01
256,272,384,7168,False,torch.bfloat16,torch.bfloat16,False,False,asm,3,6,14.0096,_ZN5aiter39bf16gemm_fp32bf16_tn_48x64_splitk_cleanE,0.0184,106.88,686.19
256,280,384,7168,False,torch.bfloat16,torch.bfloat16,False,False,asm,3,6,14.1257,_ZN5aiter39bf16gemm_fp32bf16_tn_48x64_splitk_cleanE,0.0183,109.12,689.11
256,288,384,7168,False,torch.bfloat16,torch.bfloat16,False,False,asm,3,6,14.1052,_ZN5aiter39bf16gemm_fp32bf16_tn_48x64_splitk_cleanE,0.0186,112.4,698.68
256,296,384,7168,False,torch.bfloat16,torch.bfloat16,False,False,asm,5,6,14.2077,_ZN5aiter39bf16gemm_fp32bf16_tn_64x64_splitk_cleanE,0.0186,114.69,702.14
256,304,384,7168,False,torch.bfloat16,torch.bfloat16,False,False,asm,5,7,14.2396,_ZN5aiter39bf16gemm_fp32bf16_tn_64x64_splitk_cleanE,0.02,117.53,709.05
256,312,384,7168,False,torch.bfloat16,torch.bfloat16,False,False,asm,3,6,14.3559,_ZN5aiter39bf16gemm_fp32bf16_tn_48x64_splitk_cleanE,0.0191,119.64,711.73
256,320,384,7168,False,torch.bfloat16,torch.bfloat16,False,False,asm,3,6,14.3098,_ZN5aiter39bf16gemm_fp32bf16_tn_48x64_splitk_cleanE,0.0188,123.1,722.46
256,328,384,7168,False,torch.bfloat16,torch.bfloat16,False,False,asm,3,6,14.2619,_ZN5aiter39bf16gemm_fp32bf16_tn_48x64_splitk_cleanE,0.0184,126.61,733.36
256,336,384,7168,False,torch.bfloat16,torch.bfloat16,False,False,asm,3,5,14.1648,_ZN5aiter39bf16gemm_fp32bf16_tn_48x64_splitk_cleanE,0.0163,130.58,746.92
256,344,384,7168,False,torch.bfloat16,torch.bfloat16,False,False,asm,5,5,14.491,_ZN5aiter39bf16gemm_fp32bf16_tn_64x64_splitk_cleanE,0.0161,130.68,738.44
256,352,384,7168,False,torch.bfloat16,torch.bfloat16,False,False,asm,5,6,14.3505,_ZN5aiter39bf16gemm_fp32bf16_tn_64x64_splitk_cleanE,0.0186,135.03,754.09
256,360,384,7168,False,torch.bfloat16,torch.bfloat16,False,False,asm,5,6,14.3679,_ZN5aiter39bf16gemm_fp32bf16_tn_64x64_splitk_cleanE,0.0189,137.93,761.59
256,368,384,7168,False,torch.bfloat16,torch.bfloat16,False,False,asm,7,6,14.4915,_ZN5aiter39bf16gemm_fp32bf16_tn_80x64_splitk_cleanE,0.0188,139.8,763.43
256,376,384,7168,False,torch.bfloat16,torch.bfloat16,False,False,asm,5,6,14.574,_ZN5aiter39bf16gemm_fp32bf16_tn_64x64_splitk_cleanE,0.0188,142.03,767.4
256,384,384,7168,False,torch.bfloat16,torch.bfloat16,False,False,asm,5,5,14.5331,_ZN5aiter39bf16gemm_fp32bf16_tn_64x64_splitk_cleanE,0.0161,145.46,777.88
256,392,384,7168,False,torch.bfloat16,torch.bfloat16,False,False,asm,5,5,14.7119,_ZN5aiter39bf16gemm_fp32bf16_tn_64x64_splitk_cleanE,0.0163,146.68,776.64
256,400,384,7168,False,torch.bfloat16,torch.bfloat16,False,False,asm,5,5,14.6915,_ZN5aiter39bf16gemm_fp32bf16_tn_64x64_splitk_cleanE,0.0162,149.88,785.94
256,408,384,7168,False,torch.bfloat16,torch.bfloat16,False,False,asm,5,5,14.6799,_ZN5aiter39bf16gemm_fp32bf16_tn_64x64_splitk_cleanE,0.0161,153.0,794.79
256,416,384,7168,False,torch.bfloat16,torch.bfloat16,False,False,asm,5,5,14.7425,_ZN5aiter39bf16gemm_fp32bf16_tn_64x64_splitk_cleanE,0.0161,155.34,799.61
256,424,384,7168,False,torch.bfloat16,torch.bfloat16,False,False,asm,5,5,15.0422,_ZN5aiter39bf16gemm_fp32bf16_tn_64x64_splitk_cleanE,0.016,155.17,791.71
256,432,384,7168,False,torch.bfloat16,torch.bfloat16,False,False,asm,5,5,15.0528,_ZN5aiter39bf16gemm_fp32bf16_tn_64x64_splitk_cleanE,0.0163,157.99,799.18
256,440,384,7168,False,torch.bfloat16,torch.bfloat16,False,False,asm,5,5,14.8407,_ZN5aiter39bf16gemm_fp32bf16_tn_64x64_splitk_cleanE,0.0162,163.21,818.75
256,448,384,7168,False,torch.bfloat16,torch.bfloat16,False,False,asm,5,5,14.9732,_ZN5aiter39bf16gemm_fp32bf16_tn_64x64_splitk_cleanE,0.0163,164.71,819.57
256,456,384,7168,False,torch.bfloat16,torch.bfloat16,False,False,asm,5,5,15.3551,_ZN5aiter39bf16gemm_fp32bf16_tn_64x64_splitk_cleanE,0.0162,163.48,807.06
256,464,384,7168,False,torch.bfloat16,torch.bfloat16,False,False,asm,5,5,15.2807,_ZN5aiter39bf16gemm_fp32bf16_tn_64x64_splitk_cleanE,0.0164,167.16,818.89
256,472,384,7168,False,torch.bfloat16,torch.bfloat16,False,False,asm,5,5,15.3433,_ZN5aiter39bf16gemm_fp32bf16_tn_64x64_splitk_cleanE,0.0163,169.35,823.43
256,480,384,7168,False,torch.bfloat16,torch.bfloat16,False,False,asm,7,5,15.5644,_ZN5aiter39bf16gemm_fp32bf16_tn_80x64_splitk_cleanE,0.0161,169.77,819.49
256,488,384,7168,False,torch.bfloat16,torch.bfloat16,False,False,asm,5,5,15.4836,_ZN5aiter39bf16gemm_fp32bf16_tn_64x64_splitk_cleanE,0.0163,173.5,831.58
256,496,384,7168,False,torch.bfloat16,torch.bfloat16,False,False,asm,7,5,15.7571,_ZN5aiter39bf16gemm_fp32bf16_tn_80x64_splitk_cleanE,0.0162,173.29,824.81
256,504,384,7168,False,torch.bfloat16,torch.bfloat16,False,False,asm,7,5,15.5112,_ZN5aiter39bf16gemm_fp32bf16_tn_80x64_splitk_cleanE,0.0162,178.87,845.68
256,512,384,7168,False,torch.bfloat16,torch.bfloat16,False,False,asm,7,5,15.7511,_ZN5aiter39bf16gemm_fp32bf16_tn_80x64_splitk_cleanE,0.0162,178.94,840.47
256,1,1024,7168,False,torch.bfloat16,torch.bfloat16,False,False,flydsl,39,16,7.0879,flydsl_gemm2_abf16_wbf16_bf16_t32x64x64_split_k16_block_m_warp2_block_n_warp2_async_copyTrue_b_to_ldsTrue_b_preshuffleFalse_c_to_ldsFalse_gfx950,0.0,2.07,2073.46
256,2,1024,7168,False,torch.bfloat16,torch.bfloat16,False,False,flydsl,39,16,7.3146,flydsl_gemm2_abf16_wbf16_bf16_t32x64x64_split_k16_block_m_warp2_block_n_warp2_async_copyTrue_b_to_ldsTrue_b_preshuffleFalse_c_to_ldsFalse_gfx950,0.0,4.01,2011.45
256,4,1024,7168,False,torch.bfloat16,torch.bfloat16,False,False,flydsl,39,16,7.2701,flydsl_gemm2_abf16_wbf16_bf16_t32x64x64_split_k16_block_m_warp2_block_n_warp2_async_copyTrue_b_to_ldsTrue_b_preshuffleFalse_c_to_ldsFalse_gfx950,0.0,8.08,2028.25
256,8,1024,7168,False,torch.bfloat16,torch.bfloat16,False,False,flydsl,39,16,7.3949,flydsl_gemm2_abf16_wbf16_bf16_t32x64x64_split_k16_block_m_warp2_block_n_warp2_async_copyTrue_b_to_ldsTrue_b_preshuffleFalse_c_to_ldsFalse_gfx950,0.0,15.88,2002.89
256,16,1024,7168,False,torch.bfloat16,torch.bfloat16,False,False,flydsl,217,8,8.0301,flydsl_gemm2_abf16_wbf16_bf16_t32x64x128_split_k8_block_m_warp2_block_n_warp2_async_copyTrue_b_to_ldsTrue_b_preshuffleFalse_c_to_ldsFalse_gfx950,0.0,29.25,1860.77
256,24,1024,7168,False,torch.bfloat16,torch.bfloat16,False,False,flydsl,217,8,8.439,flydsl_gemm2_abf16_wbf16_bf16_t32x64x128_split_k8_block_m_warp2_block_n_warp2_async_copyTrue_b_to_ldsTrue_b_preshuffleFalse_c_to_ldsFalse_gfx950,0.0,41.75,1786.15
256,32,1024,7168,False,torch.bfloat16,torch.bfloat16,False,False,flydsl,217,8,8.6123,flydsl_gemm2_abf16_wbf16_bf16_t32x64x128_split_k8_block_m_warp2_block_n_warp2_async_copyTrue_b_to_ldsTrue_b_preshuffleFalse_c_to_ldsFalse_gfx950,0.0,54.55,1765.42
256,40,1024,7168,False,torch.bfloat16,torch.bfloat16,False,False,flydsl,277,8,10.4301,flydsl_gemm2_abf16_wbf16_bf16_t64x64x128_split_k8_block_m_warp2_block_n_warp2_async_copyTrue_b_to_ldsTrue_b_preshuffleFalse_c_to_ldsFalse_gfx950,0.0,56.3,1470.3
256,48,1024,7168,False,torch.bfloat16,torch.bfloat16,False,False,flydsl,277,8,10.7236,flydsl_gemm2_abf16_wbf16_bf16_t64x64x128_split_k8_block_m_warp2_block_n_warp2_async_copyTrue_b_to_ldsTrue_b_preshuffleFalse_c_to_ldsFalse_gfx950,0.0,65.71,1442.29
256,56,1024,7168,False,torch.bfloat16,torch.bfloat16,False,False,flydsl,277,8,11.1234,flydsl_gemm2_abf16_wbf16_bf16_t64x64x128_split_k8_block_m_warp2_block_n_warp2_async_copyTrue_b_to_ldsTrue_b_preshuffleFalse_c_to_ldsFalse_gfx950,0.0,73.91,1402.22
256,64,1024,7168,False,torch.bfloat16,torch.bfloat16,False,False,flydsl,277,8,11.4527,flydsl_gemm2_abf16_wbf16_bf16_t64x64x128_split_k8_block_m_warp2_block_n_warp2_async_copyTrue_b_to_ldsTrue_b_preshuffleFalse_c_to_ldsFalse_gfx950,0.0,82.04,1373.36
256,72,1024,7168,False,torch.bfloat16,torch.bfloat16,False,False,flydsl,307,8,12.8793,flydsl_gemm2_abf16_wbf16_bf16_t96x64x128_split_k8_block_m_warp2_block_n_warp2_async_copyTrue_b_to_ldsTrue_b_preshuffleFalse_c_to_ldsFalse_gfx950,0.0,82.07,1231.41
256,80,1024,7168,False,torch.bfloat16,torch.bfloat16,False,False,flydsl,307,8,13.3147,flydsl_gemm2_abf16_wbf16_bf16_t96x64x128_split_k8_block_m_warp2_block_n_warp2_async_copyTrue_b_to_ldsTrue_b_preshuffleFalse_c_to_ldsFalse_gfx950,0.0,88.2,1200.99
256,88,1024,7168,False,torch.bfloat16,torch.bfloat16,False,False,flydsl,307,8,13.817,flydsl_gemm2_abf16_wbf16_bf16_t96x64x128_split_k8_block_m_warp2_block_n_warp2_async_copyTrue_b_to_ldsTrue_b_preshuffleFalse_c_to_ldsFalse_gfx950,0.0,93.5,1166.81
256,104,1024,7168,False,torch.bfloat16,torch.bfloat16,False,False,flydsl,337,8,15.3549,flydsl_gemm2_abf16_wbf16_bf16_t128x64x128_split_k8_block_m_warp2_block_n_warp2_async_copyTrue_b_to_ldsTrue_b_preshuffleFalse_c_to_ldsFalse_gfx950,0.0,99.43,1067.02
256,112,1024,7168,False,torch.bfloat16,torch.bfloat16,False,False,flydsl,337,8,15.8527,flydsl_gemm2_abf16_wbf16_bf16_t128x64x128_split_k8_block_m_warp2_block_n_warp2_async_copyTrue_b_to_ldsTrue_b_preshuffleFalse_c_to_ldsFalse_gfx950,0.0,103.72,1041.79
256,120,1024,7168,False,torch.bfloat16,torch.bfloat16,False,False,asm,5,7,14.3225,_ZN5aiter39bf16gemm_fp32bf16_tn_64x64_splitk_cleanE,0.0198,123.0,1162.24
256,128,1024,7168,False,torch.bfloat16,torch.bfloat16,False,False,asm,5,7,14.3408,_ZN5aiter39bf16gemm_fp32bf16_tn_64x64_splitk_cleanE,0.0202,131.03,1169.89
256,136,1024,7168,False,torch.bfloat16,torch.bfloat16,False,False,asm,3,5,14.5733,_ZN5aiter39bf16gemm_fp32bf16_tn_48x64_splitk_cleanE,0.0162,137.0,1160.22
256,144,1024,7168,False,torch.bfloat16,torch.bfloat16,False,False,asm,3,5,14.7506,_ZN5aiter39bf16gemm_fp32bf16_tn_48x64_splitk_cleanE,0.0163,143.31,1155.16
256,152,1024,7168,False,torch.bfloat16,torch.bfloat16,False,False,asm,7,7,14.8862,_ZN5aiter39bf16gemm_fp32bf16_tn_80x64_splitk_cleanE,0.0199,149.9,1153.45
256,160,1024,7168,False,torch.bfloat16,torch.bfloat16,False,False,asm,7,6,14.9696,_ZN5aiter39bf16gemm_fp32bf16_tn_80x64_splitk_cleanE,0.0184,156.91,1155.78
256,168,1024,7168,False,torch.bfloat16,torch.bfloat16,False,False,asm,5,5,14.9312,_ZN5aiter39bf16gemm_fp32bf16_tn_64x64_splitk_cleanE,0.0163,165.17,1167.53
256,176,1024,7168,False,torch.bfloat16,torch.bfloat16,False,False,asm,8,7,15.1905,_ZN5aiter39bf16gemm_fp32bf16_tn_96x64_splitk_cleanE,0.0199,170.09,1156.23
256,184,1024,7168,False,torch.bfloat16,torch.bfloat16,False,False,asm,5,5,15.2002,_ZN5aiter39bf16gemm_fp32bf16_tn_64x64_splitk_cleanE,0.0165,177.7,1164.11
256,192,1024,7168,False,torch.bfloat16,torch.bfloat16,False,False,asm,5,5,15.2816,_ZN5aiter39bf16gemm_fp32bf16_tn_64x64_splitk_cleanE,0.0162,184.44,1166.49
256,200,1024,7168,False,torch.bfloat16,torch.bfloat16,False,False,asm,7,5,15.6907,_ZN5aiter39bf16gemm_fp32bf16_tn_80x64_splitk_cleanE,0.0163,187.12,1144.43
256,208,1024,7168,False,torch.bfloat16,torch.bfloat16,False,False,asm,7,5,15.6975,_ZN5aiter39bf16gemm_fp32bf16_tn_80x64_splitk_cleanE,0.0161,194.52,1152.28
256,216,1024,7168,False,torch.bfloat16,torch.bfloat16,False,False,asm,7,5,15.688,_ZN5aiter39bf16gemm_fp32bf16_tn_80x64_splitk_cleanE,0.0161,202.12,1161.33
256,224,1024,7168,False,torch.bfloat16,torch.bfloat16,False,False,asm,7,5,15.9319,_ZN5aiter39bf16gemm_fp32bf16_tn_80x64_splitk_cleanE,0.0164,206.4,1151.78
256,232,1024,7168,False,torch.bfloat16,torch.bfloat16,False,False,asm,7,5,16.0455,_ZN5aiter39bf16gemm_fp32bf16_tn_80x64_splitk_cleanE,0.0161,212.26,1151.8
256,240,1024,7168,False,torch.bfloat16,torch.bfloat16,False,False,asm,7,5,15.9381,_ZN5aiter39bf16gemm_fp32bf16_tn_80x64_splitk_cleanE,0.0163,221.06,1167.78
256,248,1024,7168,False,torch.bfloat16,torch.bfloat16,False,False,asm,8,5,16.1335,_ZN5aiter39bf16gemm_fp32bf16_tn_96x64_splitk_cleanE,0.0162,225.66,1161.76
256,256,1024,7168,False,torch.bfloat16,torch.bfloat16,False,False,asm,8,5,16.2521,_ZN5aiter39bf16gemm_fp32bf16_tn_96x64_splitk_cleanE,0.0163,231.24,1161.35
256,264,1024,7168,False,torch.bfloat16,torch.bfloat16,False,False,asm,8,5,16.387,_ZN5aiter39bf16gemm_fp32bf16_tn_96x64_splitk_cleanE,0.0162,236.5,1159.79
256,272,1024,7168,False,torch.bfloat16,torch.bfloat16,False,False,asm,8,5,16.5602,_ZN5aiter39bf16gemm_fp32bf16_tn_96x64_splitk_cleanE,0.0162,241.12,1155.57
256,280,1024,7168,False,torch.bfloat16,torch.bfloat16,False,False,asm,8,5,16.6617,_ZN5aiter39bf16gemm_fp32bf16_tn_96x64_splitk_cleanE,0.0162,246.7,1156.4
256,288,1024,7168,False,torch.bfloat16,torch.bfloat16,False,False,asm,8,5,16.6314,_ZN5aiter39bf16gemm_fp32bf16_tn_96x64_splitk_cleanE,0.0162,254.21,1166.39
256,296,1024,7168,False,torch.bfloat16,torch.bfloat16,False,False,asm,7,4,17.4987,_ZN5aiter39bf16gemm_fp32bf16_tn_80x64_splitk_cleanE,0.0138,248.32,1116.07
256,304,1024,7168,False,torch.bfloat16,torch.bfloat16,False,False,asm,7,4,17.54,_ZN5aiter39bf16gemm_fp32bf16_tn_80x64_splitk_cleanE,0.0138,254.43,1120.91
256,312,1024,7168,False,torch.bfloat16,torch.bfloat16,False,False,asm,7,4,17.7732,_ZN5aiter39bf16gemm_fp32bf16_tn_80x64_splitk_cleanE,0.0138,257.7,1113.58
256,320,1024,7168,False,torch.bfloat16,torch.bfloat16,False,False,asm,7,4,17.806,_ZN5aiter39bf16gemm_fp32bf16_tn_80x64_splitk_cleanE,0.0138,263.82,1118.89
256,328,1024,7168,False,torch.bfloat16,torch.bfloat16,False,False,asm,8,4,18.0549,_ZN5aiter39bf16gemm_fp32bf16_tn_96x64_splitk_cleanE,0.0137,266.69,1110.72
256,336,1024,7168,False,torch.bfloat16,torch.bfloat16,False,False,asm,8,4,18.1264,_ZN5aiter39bf16gemm_fp32bf16_tn_96x64_splitk_cleanE,0.0138,272.12,1113.57
256,344,1024,7168,False,torch.bfloat16,torch.bfloat16,False,False,asm,8,4,18.2363,_ZN5aiter39bf16gemm_fp32bf16_tn_96x64_splitk_cleanE,0.0137,276.92,1114.05
256,376,1024,7168,False,torch.bfloat16,torch.bfloat16,False,False,asm,8,4,18.917,_ZN5aiter39bf16gemm_fp32bf16_tn_96x64_splitk_cleanE,0.0137,291.79,1101.68
256,384,1024,7168,False,torch.bfloat16,torch.bfloat16,False,False,asm,8,4,19.0033,_ZN5aiter39bf16gemm_fp32bf16_tn_96x64_splitk_cleanE,0.0139,296.64,1103.57
256,392,1024,7168,False,torch.bfloat16,torch.bfloat16,False,False,flydsl,334,4,26.1549,flydsl_gemm2_abf16_wbf16_bf16_t128x64x128_split_k4_block_m_warp1_block_n_warp4_async_copyTrue_b_to_ldsFalse_b_preshuffleFalse_c_to_ldsFalse_gfx950,0.0,220.02,806.83
256,400,1024,7168,False,torch.bfloat16,torch.bfloat16,False,False,flydsl,334,4,26.217,flydsl_gemm2_abf16_wbf16_bf16_t128x64x128_split_k4_block_m_warp1_block_n_warp4_async_copyTrue_b_to_ldsFalse_b_preshuffleFalse_c_to_ldsFalse_gfx950,0.0,223.98,809.92
256,1,7168,512,False,torch.bfloat16,torch.bfloat16,False,False,flydsl,211,1,4.8257,flydsl_gemm2_abf16_wbf16_bf16_t32x64x128_split_k1_block_m_warp2_block_n_warp2_async_copyTrue_b_to_ldsTrue_b_preshuffleFalse_c_to_ldsFalse_gfx950,0.0,1.52,1524.22
256,2,7168,512,False,torch.bfloat16,torch.bfloat16,False,False,flydsl,211,1,4.8301,flydsl_gemm2_abf16_wbf16_bf16_t32x64x128_split_k1_block_m_warp2_block_n_warp2_async_copyTrue_b_to_ldsTrue_b_preshuffleFalse_c_to_ldsFalse_gfx950,0.0,3.04,1526.0
256,4,7168,512,False,torch.bfloat16,torch.bfloat16,False,False,flydsl,211,1,4.9012,flydsl_gemm2_abf16_wbf16_bf16_t32x64x128_split_k1_block_m_warp2_block_n_warp2_async_copyTrue_b_to_ldsTrue_b_preshuffleFalse_c_to_ldsFalse_gfx950,0.0,5.99,1510.13
256,8,7168,512,False,torch.bfloat16,torch.bfloat16,False,False,flydsl,211,1,4.8834,flydsl_gemm2_abf16_wbf16_bf16_t32x64x128_split_k1_block_m_warp2_block_n_warp2_async_copyTrue_b_to_ldsTrue_b_preshuffleFalse_c_to_ldsFalse_gfx950,0.0,12.02,1528.21
256,16,7168,512,False,torch.bfloat16,torch.bfloat16,False,False,flydsl,211,1,4.8523,flydsl_gemm2_abf16_wbf16_bf16_t32x64x128_split_k1_block_m_warp2_block_n_warp2_async_copyTrue_b_to_ldsTrue_b_preshuffleFalse_c_to_ldsFalse_gfx950,0.0,24.2,1563.33
256,24,7168,512,False,torch.bfloat16,torch.bfloat16,False,False,flydsl,211,1,4.9279,flydsl_gemm2_abf16_wbf16_bf16_t32x64x128_split_k1_block_m_warp2_block_n_warp2_async_copyTrue_b_to_ldsTrue_b_preshuffleFalse_c_to_ldsFalse_gfx950,0.0,35.75,1564.3
256,32,7168,512,False,torch.bfloat16,torch.bfloat16,False,False,flydsl,211,1,4.959,flydsl_gemm2_abf16_wbf16_bf16_t32x64x128_split_k1_block_m_warp2_block_n_warp2_async_copyTrue_b_to_ldsTrue_b_preshuffleFalse_c_to_ldsFalse_gfx950,0.0,47.36,1579.26
256,48,7168,512,False,torch.bfloat16,torch.bfloat16,False,False,asm,2,1,6.2951,_ZN5aiter37bf16gemm_fp32bf16_tn_32x64_pf3_splitkE,0.0,55.97,1283.11
256,56,7168,512,False,torch.bfloat16,torch.bfloat16,False,False,flydsl,211,1,5.4348,flydsl_gemm2_abf16_wbf16_bf16_t32x64x128_split_k1_block_m_warp2_block_n_warp2_async_copyTrue_b_to_ldsTrue_b_preshuffleFalse_c_to_ldsFalse_gfx950,0.0,75.63,1508.84
256,64,7168,512,False,torch.bfloat16,torch.bfloat16,False,False,flydsl,211,1,5.4434,flydsl_gemm2_abf16_wbf16_bf16_t32x64x128_split_k1_block_m_warp2_block_n_warp2_async_copyTrue_b_to_ldsTrue_b_preshuffleFalse_c_to_ldsFalse_gfx950,0.0,86.3,1529.01
256,72,7168,512,False,torch.bfloat16,torch.bfloat16,False,False,asm,6,1,6.8531,_ZN5aiter37bf16gemm_fp32bf16_tn_64x64_pf3_splitkE,0.0,77.12,1232.43
256,80,7168,512,False,torch.bfloat16,torch.bfloat16,False,False,asm,4,1,6.6251,_ZN5aiter37bf16gemm_fp32bf16_tn_48x64_pf3_splitkE,0.0,88.63,1293.39
256,120,7168,512,False,torch.bfloat16,torch.bfloat16,False,False,asm,6,1,6.8894,_ZN5aiter37bf16gemm_fp32bf16_tn_64x64_pf3_splitkE,0.0,127.85,1332.95
256,128,7168,512,False,torch.bfloat16,torch.bfloat16,False,False,asm,6,1,7.0447,_ZN5aiter37bf16gemm_fp32bf16_tn_64x64_pf3_splitkE,0.0,133.37,1321.01
256,136,7168,512,False,torch.bfloat16,torch.bfloat16,False,False,flydsl,301,1,6.9634,flydsl_gemm2_abf16_wbf16_bf16_t96x64x128_split_k1_block_m_warp2_block_n_warp2_async_copyTrue_b_to_ldsTrue_b_preshuffleFalse_c_to_ldsFalse_gfx950,0.0,143.35,1354.07
256,144,7168,512,False,torch.bfloat16,torch.bfloat16,False,False,flydsl,271,1,6.8168,flydsl_gemm2_abf16_wbf16_bf16_t64x64x128_split_k1_block_m_warp2_block_n_warp2_async_copyTrue_b_to_ldsTrue_b_preshuffleFalse_c_to_ldsFalse_gfx950,0.0,155.05,1401.23
256,152,7168,512,False,torch.bfloat16,torch.bfloat16,False,False,flydsl,301,1,6.9501,flydsl_gemm2_abf16_wbf16_bf16_t96x64x128_split_k1_block_m_warp2_block_n_warp2_async_copyTrue_b_to_ldsTrue_b_preshuffleFalse_c_to_ldsFalse_gfx950,0.0,160.53,1392.03
256,160,7168,512,False,torch.bfloat16,torch.bfloat16,False,False,flydsl,301,1,7.0212,flydsl_gemm2_abf16_wbf16_bf16_t96x64x128_split_k1_block_m_warp2_block_n_warp2_async_copyTrue_b_to_ldsTrue_b_preshuffleFalse_c_to_ldsFalse_gfx950,0.0,167.27,1395.43
256,168,7168,512,False,torch.bfloat16,torch.bfloat16,False,False,flydsl,301,1,6.9812,flydsl_gemm2_abf16_wbf16_bf16_t96x64x128_split_k1_block_m_warp2_block_n_warp2_async_copyTrue_b_to_ldsTrue_b_preshuffleFalse_c_to_ldsFalse_gfx950,0.0,176.63,1421.03
256,176,7168,512,False,torch.bfloat16,torch.bfloat16,False,False,flydsl,301,1,7.0034,flydsl_gemm2_abf16_wbf16_bf16_t96x64x128_split_k1_block_m_warp2_block_n_warp2_async_copyTrue_b_to_ldsTrue_b_preshuffleFalse_c_to_ldsFalse_gfx950,0.0,184.46,1434.06
256,184,7168,512,False,torch.bfloat16,torch.bfloat16,False,False,flydsl,301,1,7.0434,flydsl_gemm2_abf16_wbf16_bf16_t96x64x128_split_k1_block_m_warp2_block_n_warp2_async_copyTrue_b_to_ldsTrue_b_preshuffleFalse_c_to_ldsFalse_gfx950,0.0,191.75,1443.37
256,192,7168,512,False,torch.bfloat16,torch.bfloat16,False,False,flydsl,301,1,6.999,flydsl_gemm2_abf16_wbf16_bf16_t96x64x128_split_k1_block_m_warp2_block_n_warp2_async_copyTrue_b_to_ldsTrue_b_preshuffleFalse_c_to_ldsFalse_gfx950,0.0,201.36,1470.09
256,248,7168,512,False,torch.bfloat16,torch.bfloat16,False,False,flydsl,271,1,8.399,flydsl_gemm2_abf16_wbf16_bf16_t64x64x128_split_k1_block_m_warp2_block_n_warp2_async_copyTrue_b_to_ldsTrue_b_preshuffleFalse_c_to_ldsFalse_gfx950,0.0,216.73,1327.46
256,264,7168,512,False,torch.bfloat16,torch.bfloat16,False,False,flydsl,121,1,8.4658,flydsl_gemm2_abf16_wbf16_bf16_t96x64x64_split_k1_block_m_warp2_block_n_warp2_async_copyTrue_b_to_ldsTrue_b_preshuffleFalse_c_to_ldsFalse_gfx950,0.0,228.89,1346.02
256,272,7168,512,False,torch.bfloat16,torch.bfloat16,False,False,flydsl,311,1,8.7146,flydsl_gemm2_abf16_wbf16_bf16_t96x128x128_split_k1_block_m_warp2_block_n_warp2_async_copyTrue_b_to_ldsTrue_b_preshuffleFalse_c_to_ldsFalse_gfx950,0.0,229.1,1321.69
256,280,7168,512,False,torch.bfloat16,torch.bfloat16,False,False,flydsl,311,1,8.7412,flydsl_gemm2_abf16_wbf16_bf16_t96x128x128_split_k1_block_m_warp2_block_n_warp2_async_copyTrue_b_to_ldsTrue_b_preshuffleFalse_c_to_ldsFalse_gfx950,0.0,235.12,1331.72
256,288,7168,512,False,torch.bfloat16,torch.bfloat16,False,False,flydsl,301,1,8.1234,flydsl_gemm2_abf16_wbf16_bf16_t96x64x128_split_k1_block_m_warp2_block_n_warp2_async_copyTrue_b_to_ldsTrue_b_preshuffleFalse_c_to_ldsFalse_gfx950,0.0,260.23,1448.12
256,296,7168,512,False,torch.bfloat16,torch.bfloat16,False,False,flydsl,301,1,9.1546,flydsl_gemm2_abf16_wbf16_bf16_t96x64x128_split_k1_block_m_warp2_block_n_warp2_async_copyTrue_b_to_ldsTrue_b_preshuffleFalse_c_to_ldsFalse_gfx950,0.0,237.33,1298.43
256,304,7168,512,False,torch.bfloat16,torch.bfloat16,False,False,flydsl,121,1,9.0523,flydsl_gemm2_abf16_wbf16_bf16_t96x64x64_split_k1_block_m_warp2_block_n_warp2_async_copyTrue_b_to_ldsTrue_b_preshuffleFalse_c_to_ldsFalse_gfx950,0.0,246.5,1326.67
256,312,7168,512,False,torch.bfloat16,torch.bfloat16,False,False,flydsl,301,1,9.0657,flydsl_gemm2_abf16_wbf16_bf16_t96x64x128_split_k1_block_m_warp2_block_n_warp2_async_copyTrue_b_to_ldsTrue_b_preshuffleFalse_c_to_ldsFalse_gfx950,0.0,252.61,1338.27
256,328,7168,512,False,torch.bfloat16,torch.bfloat16,False,False,flydsl,121,1,9.1991,flydsl_gemm2_abf16_wbf16_bf16_t96x64x64_split_k1_block_m_warp2_block_n_warp2_async_copyTrue_b_to_ldsTrue_b_preshuffleFalse_c_to_ldsFalse_gfx950,0.0,261.71,1345.58
256,336,7168,512,False,torch.bfloat16,torch.bfloat16,False,False,flydsl,301,1,9.119,flydsl_gemm2_abf16_wbf16_bf16_t96x64x128_split_k1_block_m_warp2_block_n_warp2_async_copyTrue_b_to_ldsTrue_b_preshuffleFalse_c_to_ldsFalse_gfx950,0.0,270.45,1370.87
256,344,7168,512,False,torch.bfloat16,torch.bfloat16,False,False,flydsl,121,1,9.1502,flydsl_gemm2_abf16_wbf16_bf16_t96x64x64_split_k1_block_m_warp2_block_n_warp2_async_copyTrue_b_to_ldsTrue_b_preshuffleFalse_c_to_ldsFalse_gfx950,0.0,275.95,1379.62
256,352,7168,512,False,torch.bfloat16,torch.bfloat16,False,False,flydsl,121,1,9.1547,flydsl_gemm2_abf16_wbf16_bf16_t96x64x64_split_k1_block_m_warp2_block_n_warp2_async_copyTrue_b_to_ldsTrue_b_preshuffleFalse_c_to_ldsFalse_gfx950,0.0,282.23,1392.38
256,360,7168,512,False,torch.bfloat16,torch.bfloat16,False,False,flydsl,121,1,9.1814,flydsl_gemm2_abf16_wbf16_bf16_t96x64x64_split_k1_block_m_warp2_block_n_warp2_async_copyTrue_b_to_ldsTrue_b_preshuffleFalse_c_to_ldsFalse_gfx950,0.0,287.8,1401.7
256,368,7168,512,False,torch.bfloat16,torch.bfloat16,False,False,flydsl,121,1,9.106,flydsl_gemm2_abf16_wbf16_bf16_t96x64x64_split_k1_block_m_warp2_block_n_warp2_async_copyTrue_b_to_ldsTrue_b_preshuffleFalse_c_to_ldsFalse_gfx950,0.0,296.63,1426.81
256,376,7168,512,False,torch.bfloat16,torch.bfloat16,False,False,flydsl,301,1,9.426,flydsl_gemm2_abf16_wbf16_bf16_t96x64x128_split_k1_block_m_warp2_block_n_warp2_async_copyTrue_b_to_ldsTrue_b_preshuffleFalse_c_to_ldsFalse_gfx950,0.0,292.79,1391.41
256,392,7168,512,False,torch.bfloat16,torch.bfloat16,False,False,flydsl,151,1,10.0614,flydsl_gemm2_abf16_wbf16_bf16_t128x64x64_split_k1_block_m_warp2_block_n_warp2_async_copyTrue_b_to_ldsTrue_b_preshuffleFalse_c_to_ldsFalse_gfx950,0.0,285.97,1327.96
256,400,7168,512,False,torch.bfloat16,torch.bfloat16,False,False,flydsl,151,1,10.0571,flydsl_gemm2_abf16_wbf16_bf16_t128x64x64_split_k1_block_m_warp2_block_n_warp2_async_copyTrue_b_to_ldsTrue_b_preshuffleFalse_c_to_ldsFalse_gfx950,0.0,291.93,1340.75
256,408,7168,512,False,torch.bfloat16,torch.bfloat16,False,False,flydsl,151,1,9.9103,flydsl_gemm2_abf16_wbf16_bf16_t128x64x64_split_k1_block_m_warp2_block_n_warp2_async_copyTrue_b_to_ldsTrue_b_preshuffleFalse_c_to_ldsFalse_gfx950,0.0,302.18,1373.0
256,416,7168,512,False,torch.bfloat16,torch.bfloat16,False,False,flydsl,151,1,10.0616,flydsl_gemm2_abf16_wbf16_bf16_t128x64x64_split_k1_block_m_warp2_block_n_warp2_async_copyTrue_b_to_ldsTrue_b_preshuffleFalse_c_to_ldsFalse_gfx950,0.0,303.48,1364.58
256,424,7168,512,False,torch.bfloat16,torch.bfloat16,False,False,flydsl,151,1,9.9634,flydsl_gemm2_abf16_wbf16_bf16_t128x64x64_split_k1_block_m_warp2_block_n_warp2_async_copyTrue_b_to_ldsTrue_b_preshuffleFalse_c_to_ldsFalse_gfx950,0.0,312.36,1390.35
256,432,7168,512,False,torch.bfloat16,torch.bfloat16,False,False,flydsl,151,1,9.986,flydsl_gemm2_abf16_wbf16_bf16_t128x64x64_split_k1_block_m_warp2_block_n_warp2_async_copyTrue_b_to_ldsTrue_b_preshuffleFalse_c_to_ldsFalse_gfx950,0.0,317.53,1399.51
256,440,7168,512,False,torch.bfloat16,torch.bfloat16,False,False,flydsl,151,1,10.5857,flydsl_gemm2_abf16_wbf16_bf16_t128x64x64_split_k1_block_m_warp2_block_n_warp2_async_copyTrue_b_to_ldsTrue_b_preshuffleFalse_c_to_ldsFalse_gfx950,0.0,305.09,1331.84
256,456,7168,512,False,torch.bfloat16,torch.bfloat16,False,False,flydsl,151,1,10.1458,flydsl_gemm2_abf16_wbf16_bf16_t128x64x64_split_k1_block_m_warp2_block_n_warp2_async_copyTrue_b_to_ldsTrue_b_preshuffleFalse_c_to_ldsFalse_gfx950,0.0,329.9,1413.81
256,464,7168,512,False,torch.bfloat16,torch.bfloat16,False,False,flydsl,151,1,10.159,flydsl_gemm2_abf16_wbf16_bf16_t128x64x64_split_k1_block_m_warp2_block_n_warp2_async_copyTrue_b_to_ldsTrue_b_preshuffleFalse_c_to_ldsFalse_gfx950,0.0,335.25,1424.06
256,472,7168,512,False,torch.bfloat16,torch.bfloat16,False,False,flydsl,151,1,9.9812,flydsl_gemm2_abf16_wbf16_bf16_t128x64x64_split_k1_block_m_warp2_block_n_warp2_async_copyTrue_b_to_ldsTrue_b_preshuffleFalse_c_to_ldsFalse_gfx950,0.0,347.1,1461.74
256,480,7168,512,False,torch.bfloat16,torch.bfloat16,False,False,flydsl,151,1,10.1948,flydsl_gemm2_abf16_wbf16_bf16_t128x64x64_split_k1_block_m_warp2_block_n_warp2_async_copyTrue_b_to_ldsTrue_b_preshuffleFalse_c_to_ldsFalse_gfx950,0.0,345.59,1443.17
256,488,7168,512,False,torch.bfloat16,torch.bfloat16,False,False,flydsl,151,1,9.9368,flydsl_gemm2_abf16_wbf16_bf16_t128x64x64_split_k1_block_m_warp2_block_n_warp2_async_copyTrue_b_to_ldsTrue_b_preshuffleFalse_c_to_ldsFalse_gfx950,0.0,360.47,1493.01
256,496,7168,512,False,torch.bfloat16,torch.bfloat16,False,False,flydsl,151,1,10.0302,flydsl_gemm2_abf16_wbf16_bf16_t128x64x64_split_k1_block_m_warp2_block_n_warp2_async_copyTrue_b_to_ldsTrue_b_preshuffleFalse_c_to_ldsFalse_gfx950,0.0,362.97,1491.35
256,504,7168,512,False,torch.bfloat16,torch.bfloat16,False,False,flydsl,151,1,10.3812,flydsl_gemm2_abf16_wbf16_bf16_t128x64x64_split_k1_block_m_warp2_block_n_warp2_async_copyTrue_b_to_ldsTrue_b_preshuffleFalse_c_to_ldsFalse_gfx950,0.0,356.35,1452.76
256,512,7168,512,False,torch.bfloat16,torch.bfloat16,False,False,flydsl,151,1,10.0393,flydsl_gemm2_abf16_wbf16_bf16_t128x64x64_split_k1_block_m_warp2_block_n_warp2_async_copyTrue_b_to_ldsTrue_b_preshuffleFalse_c_to_ldsFalse_gfx950,0.0,374.34,1514.48
256,176,384,7168,False,torch.bfloat16,torch.bfloat16,False,False,asm,8,10,12.2978,_ZN5aiter39bf16gemm_fp32bf16_tn_96x64_splitk_cleanE,0.0245,78.79,663.8
256,184,384,7168,False,torch.bfloat16,torch.bfloat16,False,False,asm,8,8,12.4417,_ZN5aiter39bf16gemm_fp32bf16_tn_96x64_splitk_cleanE,0.0218,81.41,665.84
256,192,384,7168,False,torch.bfloat16,torch.bfloat16,False,False,asm,8,12,12.5861,_ZN5aiter39bf16gemm_fp32bf16_tn_96x64_splitk_cleanE,0.0265,83.98,667.8
256,200,384,7168,False,torch.bfloat16,torch.bfloat16,False,False,asm,3,6,12.7982,_ZN5aiter39bf16gemm_fp32bf16_tn_48x64_splitk_cleanE,0.0184,86.03,666.17
256,208,384,7168,False,torch.bfloat16,torch.bfloat16,False,False,asm,1,6,13.0167,_ZN5aiter39bf16gemm_fp32bf16_tn_32x64_splitk_cleanE,0.018,87.97,664.27
256,96,1024,7168,False,torch.bfloat16,torch.bfloat16,False,False,asm,3,8,13.5905,_ZN5aiter39bf16gemm_fp32bf16_tn_48x64_splitk_cleanE,0.0212,103.7,1195.9
256,352,1024,7168,False,torch.bfloat16,torch.bfloat16,False,False,asm,8,4,18.3661,_ZN5aiter39bf16gemm_fp32bf16_tn_96x64_splitk_cleanE,0.0137,281.35,1113.31
256,360,1024,7168,False,torch.bfloat16,torch.bfloat16,False,False,asm,8,4,18.675,_ZN5aiter39bf16gemm_fp32bf16_tn_96x64_splitk_cleanE,0.0137,282.99,1101.92
256,368,1024,7168,False,torch.bfloat16,torch.bfloat16,False,False,asm,8,4,18.8126,_ZN5aiter39bf16gemm_fp32bf16_tn_96x64_splitk_cleanE,0.0138,287.16,1100.82
256,40,7168,512,False,torch.bfloat16,torch.bfloat16,False,False,asm,4,1,6.4351,_ZN5aiter37bf16gemm_fp32bf16_tn_48x64_pf3_splitkE,0.0,45.62,1236.1
256,96,7168,512,False,torch.bfloat16,torch.bfloat16,False,False,asm,6,1,6.8492,_ZN5aiter37bf16gemm_fp32bf16_tn_64x64_pf3_splitkE,0.0,102.88,1286.95
256,104,7168,512,False,torch.bfloat16,torch.bfloat16,False,False,asm,6,1,6.8366,_ZN5aiter37bf16gemm_fp32bf16_tn_64x64_pf3_splitkE,0.0,111.66,1307.3
256,112,7168,512,False,torch.bfloat16,torch.bfloat16,False,False,asm,6,1,6.839,_ZN5aiter37bf16gemm_fp32bf16_tn_64x64_pf3_splitkE,0.0,120.21,1324.81
