aiter/configs/model_configs/kimik2_bf16_tuned_gemm.csv
cu_num,M,N,K,bias,dtype,outdtype,scaleAB,bpreshuffle,libtype,solidx,splitK,us,kernelName,err_ratio,tflops,bw
256,8,384,7168,False,torch.bfloat16,torch.bfloat16,False,False,flydsl,180,16,7.8407,flydsl_gemm2_abf16_wbf16_bf16_t32x64x64_split_k16_block_m_warp1_block_n_warp4_async_copyTrue_b_to_ldsFalse_b_preshuffleFalse_c_to_ldsFalse_gfx950,0.027,5.62,717.52
256,16,384,7168,False,torch.bfloat16,torch.bfloat16,False,False,flydsl,180,16,8.0143,flydsl_gemm2_abf16_wbf16_bf16_t32x64x64_split_k16_block_m_warp1_block_n_warp4_async_copyTrue_b_to_ldsFalse_b_preshuffleFalse_c_to_ldsFalse_gfx950,0.0309,10.99,717.05
256,24,384,7168,False,torch.bfloat16,torch.bfloat16,False,False,flydsl,180,16,8.1591,flydsl_gemm2_abf16_wbf16_bf16_t32x64x64_split_k16_block_m_warp1_block_n_warp4_async_copyTrue_b_to_ldsFalse_b_preshuffleFalse_c_to_ldsFalse_gfx950,0.0341,16.19,719.14
256,32,384,7168,False,torch.bfloat16,torch.bfloat16,False,False,flydsl,180,16,8.1403,flydsl_gemm2_abf16_wbf16_bf16_t32x64x64_split_k16_block_m_warp1_block_n_warp4_async_copyTrue_b_to_ldsFalse_b_preshuffleFalse_c_to_ldsFalse_gfx950,0.0317,21.64,735.64
256,40,384,7168,False,torch.bfloat16,torch.bfloat16,False,False,flydsl,180,16,8.0707,flydsl_gemm2_abf16_wbf16_bf16_t32x64x64_split_k16_block_m_warp1_block_n_warp4_async_copyTrue_b_to_ldsFalse_b_preshuffleFalse_c_to_ldsFalse_gfx950,0.0302,27.28,756.96
256,48,384,7168,False,torch.bfloat16,torch.bfloat16,False,False,flydsl,180,16,8.569,flydsl_gemm2_abf16_wbf16_bf16_t32x64x64_split_k16_block_m_warp1_block_n_warp4_async_copyTrue_b_to_ldsFalse_b_preshuffleFalse_c_to_ldsFalse_gfx950,0.0293,30.84,727.04
256,56,384,7168,False,torch.bfloat16,torch.bfloat16,False,False,flydsl,180,16,9.5081,flydsl_gemm2_abf16_wbf16_bf16_t32x64x64_split_k16_block_m_warp1_block_n_warp4_async_copyTrue_b_to_ldsFalse_b_preshuffleFalse_c_to_ldsFalse_gfx950,0.0316,32.42,667.94
256,64,384,7168,False,torch.bfloat16,torch.bfloat16,False,False,flydsl,180,16,9.516,flydsl_gemm2_abf16_wbf16_bf16_t32x64x64_split_k16_block_m_warp1_block_n_warp4_async_copyTrue_b_to_ldsFalse_b_preshuffleFalse_c_to_ldsFalse_gfx950,0.0292,37.02,680.08
256,72,384,7168,False,torch.bfloat16,torch.bfloat16,False,False,flydsl,180,16,9.0712,flydsl_gemm2_abf16_wbf16_bf16_t32x64x64_split_k16_block_m_warp1_block_n_warp4_async_copyTrue_b_to_ldsFalse_b_preshuffleFalse_c_to_ldsFalse_gfx950,0.0314,43.69,726.75
256,80,384,7168,False,torch.bfloat16,torch.bfloat16,False,False,flydsl,179,8,9.4329,flydsl_gemm2_abf16_wbf16_bf16_t32x64x128_split_k8_block_m_warp2_block_n_warp2_async_copyTrue_b_to_ldsTrue_b_preshuffleFalse_c_to_ldsFalse_gfx950,0.0217,46.69,711.69
256,88,384,7168,False,torch.bfloat16,torch.bfloat16,False,False,asm,8,14,10.5793,_ZN5aiter39bf16gemm_fp32bf16_tn_96x64_splitk_cleanE,0.0287,45.79,646.0
256,96,384,7168,False,torch.bfloat16,torch.bfloat16,False,False,flydsl,179,8,10.051,flydsl_gemm2_abf16_wbf16_bf16_t32x64x128_split_k8_block_m_warp2_block_n_warp2_async_copyTrue_b_to_ldsTrue_b_preshuffleFalse_c_to_ldsFalse_gfx950,0.0228,52.58,691.97
256,104,384,7168,False,torch.bfloat16,torch.bfloat16,False,False,flydsl,179,8,10.3236,flydsl_gemm2_abf16_wbf16_bf16_t32x64x128_split_k8_block_m_warp2_block_n_warp2_async_copyTrue_b_to_ldsTrue_b_preshuffleFalse_c_to_ldsFalse_gfx950,0.0215,55.46,685.4
256,112,384,7168,False,torch.bfloat16,torch.bfloat16,False,False,flydsl,179,8,9.7718,flydsl_gemm2_abf16_wbf16_bf16_t32x64x128_split_k8_block_m_warp2_block_n_warp2_async_copyTrue_b_to_ldsTrue_b_preshuffleFalse_c_to_ldsFalse_gfx950,0.0218,63.1,736.47
256,120,384,7168,False,torch.bfloat16,torch.bfloat16,False,False,flydsl,179,8,9.9195,flydsl_gemm2_abf16_wbf16_bf16_t32x64x128_split_k8_block_m_warp2_block_n_warp2_async_copyTrue_b_to_ldsTrue_b_preshuffleFalse_c_to_ldsFalse_gfx950,0.0228,66.6,737.69
256,128,384,7168,False,torch.bfloat16,torch.bfloat16,False,False,flydsl,179,8,10.7789,flydsl_gemm2_abf16_wbf16_bf16_t32x64x128_split_k8_block_m_warp2_block_n_warp2_async_copyTrue_b_to_ldsTrue_b_preshuffleFalse_c_to_ldsFalse_gfx950,0.0216,65.37,690.08
256,136,384,7168,False,torch.bfloat16,torch.bfloat16,False,False,flydsl,179,8,11.1736,flydsl_gemm2_abf16_wbf16_bf16_t32x64x128_split_k8_block_m_warp2_block_n_warp2_async_copyTrue_b_to_ldsTrue_b_preshuffleFalse_c_to_ldsFalse_gfx950,0.0221,67.0,676.52
256,144,384,7168,False,torch.bfloat16,torch.bfloat16,False,False,hipblaslt,441425,0,11.3039,Cijk_Alik_Bljk_BBS_BH_Bias_HA_S_SAV_UserArgs_MT16x16x1024_MI16x16x1_SN_LDSB1_AFC0_AFEM1_AFEM1_ASEM1_CLR1_CADS0_DTLA0_DTLB0_DTVA0_DTVB0_EPS0_FDSI0_GRPM1_GRVWA8_GRVWB8_GSU0_GSUAMB_GLS0_ISA950_IU1_K1_LDSTI0_LBSPPA2048_LBSPPB2048_LBSPPM0_LPA16_LPB16_LPM0_LRVW8_LWPMn1_MIAV0_MIWT1_1_MO40_NTn1_NTA0_NTB0_NTC0_NTD0_NTM0_NEPBS0_NLCA1_NLCB1_ONLL1_PGR2_PLR1_PKA1_SIA3_SS1_SPO0_SRVW0_SSO0_SVW1_SK3_SKFTR0_SKXCCM0_TLDS1_ULSGRO0_USL1_UIOFGRO0_USFGRO0_VSn1_VWA1_VWB1_WSGRA0_WSGRB0_WS64_WG16_4_4,0.0,70.13,679.41
256,168,384,7168,False,torch.bfloat16,torch.bfloat16,False,False,flydsl,177,8,13.0017,flydsl_gemm2_abf16_wbf16_bf16_t32x64x128_split_k8_block_m_warp1_block_n_warp4_async_copyTrue_b_to_ldsFalse_b_preshuffleFalse_c_to_ldsFalse_gfx950,0.0222,71.13,618.57
256,176,384,7168,False,torch.bfloat16,torch.bfloat16,False,False,asm,8,10,12.9091,_ZN5aiter39bf16gemm_fp32bf16_tn_96x64_splitk_cleanE,0.0241,75.05,632.37
256,184,384,7168,False,torch.bfloat16,torch.bfloat16,False,False,asm,8,10,13.0368,_ZN5aiter39bf16gemm_fp32bf16_tn_96x64_splitk_cleanE,0.0241,77.7,635.44
256,192,384,7168,False,torch.bfloat16,torch.bfloat16,False,False,asm,8,9,13.1531,_ZN5aiter39bf16gemm_fp32bf16_tn_96x64_splitk_cleanE,0.0226,80.36,639.01
256,200,384,7168,False,torch.bfloat16,torch.bfloat16,False,False,flydsl,289,8,12.8957,flydsl_gemm2_abf16_wbf16_bf16_t64x64x128_split_k8_block_m_warp2_block_n_warp2_async_copyTrue_b_to_ldsTrue_b_preshuffleFalse_c_to_ldsFalse_gfx950,0.0226,85.38,661.14
256,208,384,7168,False,torch.bfloat16,torch.bfloat16,False,False,flydsl,287,8,13.2158,flydsl_gemm2_abf16_wbf16_bf16_t64x64x128_split_k8_block_m_warp1_block_n_warp4_async_copyTrue_b_to_ldsFalse_b_preshuffleFalse_c_to_ldsFalse_gfx950,0.0218,86.64,654.27
256,216,384,7168,False,torch.bfloat16,torch.bfloat16,False,False,asm,7,7,13.4535,_ZN5aiter39bf16gemm_fp32bf16_tn_80x64_splitk_cleanE,0.0201,88.38,651.69
256,224,384,7168,False,torch.bfloat16,torch.bfloat16,False,False,asm,5,7,13.554,_ZN5aiter39bf16gemm_fp32bf16_tn_64x64_splitk_cleanE,0.0203,90.98,655.77
256,232,384,7168,False,torch.bfloat16,torch.bfloat16,False,False,flydsl,179,8,13.3604,flydsl_gemm2_abf16_wbf16_bf16_t32x64x128_split_k8_block_m_warp2_block_n_warp2_async_copyTrue_b_to_ldsTrue_b_preshuffleFalse_c_to_ldsFalse_gfx950,0.0219,95.59,674.32
256,240,384,7168,False,torch.bfloat16,torch.bfloat16,False,False,flydsl,179,8,13.4529,flydsl_gemm2_abf16_wbf16_bf16_t32x64x128_split_k8_block_m_warp2_block_n_warp2_async_copyTrue_b_to_ldsTrue_b_preshuffleFalse_c_to_ldsFalse_gfx950,0.0216,98.21,678.66
256,248,384,7168,False,torch.bfloat16,torch.bfloat16,False,False,flydsl,179,8,13.7249,flydsl_gemm2_abf16_wbf16_bf16_t32x64x128_split_k8_block_m_warp2_block_n_warp2_async_copyTrue_b_to_ldsTrue_b_preshuffleFalse_c_to_ldsFalse_gfx950,0.0222,99.47,674.02
256,256,384,7168,False,torch.bfloat16,torch.bfloat16,False,False,asm,5,7,13.6667,_ZN5aiter39bf16gemm_fp32bf16_tn_64x64_splitk_cleanE,0.0205,103.12,685.73
256,264,384,7168,False,torch.bfloat16,torch.bfloat16,False,False,asm,3,6,14.0371,_ZN5aiter39bf16gemm_fp32bf16_tn_48x64_splitk_cleanE,0.019,103.53,676.24
256,272,384,7168,False,torch.bfloat16,torch.bfloat16,False,False,asm,5,6,13.7697,_ZN5aiter39bf16gemm_fp32bf16_tn_64x64_splitk_cleanE,0.0183,108.74,698.15
256,280,384,7168,False,torch.bfloat16,torch.bfloat16,False,False,asm,5,6,14.2137,_ZN5aiter39bf16gemm_fp32bf16_tn_64x64_splitk_cleanE,0.0186,108.45,684.84
256,288,384,7168,False,torch.bfloat16,torch.bfloat16,False,False,hipblaslt,440174,0,13.943,Cijk_Alik_Bljk_BBS_BH_Bias_HA_S_SAV_UserArgs_MT32x32x256_MI16x16x1_SN_LDSB0_AFC0_AFEM1_AFEM1_ASEM1_CLR1_CADS0_DTLA0_DTLB0_DTVA0_DTVB0_EPS0_FDSI0_GRPM1_GRVWA8_GRVWB8_GSU0_GSUAMB_GLS0_ISA950_IU1_K1_LDSTI0_LBSPPA512_LBSPPB512_LBSPPM0_LPA16_LPB16_LPM0_LRVW8_LWPMn1_MIAV1_MIWT1_1_MO40_NTn1_NTA1_NTB2_NTC3_NTD1_NTM0_NEPBS14_NLCA1_NLCB1_ONLL1_PGR2_PLR1_PKA1_SIA3_SS1_SPO0_SRVW0_SSO0_SVW1_SK3_SKFTR0_SKXCCM4_TLDS1_ULSGRO0_USL1_UIOFGRO0_USFGRO1_VSn1_VWA1_VWB1_WSGRA0_WSGRB0_WS64_WG32_8_1,0.0,113.71,706.8
256,296,384,7168,False,torch.bfloat16,torch.bfloat16,False,False,asm,5,6,14.254,_ZN5aiter39bf16gemm_fp32bf16_tn_64x64_splitk_cleanE,0.0186,114.32,699.86
256,304,384,7168,False,torch.bfloat16,torch.bfloat16,False,False,asm,3,6,14.1592,_ZN5aiter39bf16gemm_fp32bf16_tn_48x64_splitk_cleanE,0.0187,118.19,713.08
256,312,384,7168,False,torch.bfloat16,torch.bfloat16,False,False,asm,3,6,13.8787,_ZN5aiter39bf16gemm_fp32bf16_tn_48x64_splitk_cleanE,0.0186,123.76,736.2
256,320,384,7168,False,torch.bfloat16,torch.bfloat16,False,False,asm,5,6,14.0558,_ZN5aiter39bf16gemm_fp32bf16_tn_64x64_splitk_cleanE,0.0184,125.33,735.52
256,328,384,7168,False,torch.bfloat16,torch.bfloat16,False,False,asm,3,5,14.2261,_ZN5aiter39bf16gemm_fp32bf16_tn_48x64_splitk_cleanE,0.0164,126.93,735.21
256,336,384,7168,False,torch.bfloat16,torch.bfloat16,False,False,asm,5,6,14.6004,_ZN5aiter39bf16gemm_fp32bf16_tn_64x64_splitk_cleanE,0.0187,126.69,724.64
256,344,384,7168,False,torch.bfloat16,torch.bfloat16,False,False,hipblaslt,439768,0,14.7288,Cijk_Alik_Bljk_BBS_BH_Bias_HA_S_SAV_UserArgs_MT128x64x64_MI16x16x1_SN_LDSB0_AFC0_AFEM1_AFEM1_ASEM1_CLR0_CADS0_DTLA1_DTLB1_DTVA0_DTVB0_EPS0_FDSI0_GRPM1_GRVWA8_GRVWB2_GSU0_GSUAMB_GLS0_ISA950_IU1_K1_LDSTI0_LBSPPA1024_LBSPPB256_LBSPPM0_LPA16_LPB16_LPM0_LRVW8_LWPMn1_MIAV1_MIWT4_2_MO40_NTn1_NTA3_NTB0_NTC4_NTD3_NTM0_NEPBS14_NLCA1_NLCB1_ONLL1_PGR2_PLR1_PKA1_SIA3_SS1_SPO0_SRVW0_SSO0_SVW4_SK3_SKFTR0_SKXCCM8_TLDS2_ULSGRO0_USL1_UIOFGRO0_USFGRO1_VSn1_VWA4_VWB2_WSGRA0_WSGRB0_WS64_WG32_8_1,0.0,128.57,726.52
256,352,384,7168,False,torch.bfloat16,torch.bfloat16,False,False,asm,5,6,14.3162,_ZN5aiter39bf16gemm_fp32bf16_tn_64x64_splitk_cleanE,0.0188,135.35,755.9
256,360,384,7168,False,torch.bfloat16,torch.bfloat16,False,False,asm,3,5,14.5766,_ZN5aiter39bf16gemm_fp32bf16_tn_48x64_splitk_cleanE,0.0163,135.96,750.69
256,368,384,7168,False,torch.bfloat16,torch.bfloat16,False,False,asm,5,5,14.6534,_ZN5aiter39bf16gemm_fp32bf16_tn_64x64_splitk_cleanE,0.0163,138.25,755.0
256,376,384,7168,False,torch.bfloat16,torch.bfloat16,False,False,asm,3,5,14.5889,_ZN5aiter39bf16gemm_fp32bf16_tn_48x64_splitk_cleanE,0.0162,141.88,766.62
256,384,384,7168,False,torch.bfloat16,torch.bfloat16,False,False,asm,5,6,14.5123,_ZN5aiter39bf16gemm_fp32bf16_tn_64x64_splitk_cleanE,0.0184,145.66,778.99
256,392,384,7168,False,torch.bfloat16,torch.bfloat16,False,False,asm,7,6,14.9855,_ZN5aiter39bf16gemm_fp32bf16_tn_80x64_splitk_cleanE,0.0185,144.0,762.46
256,400,384,7168,False,torch.bfloat16,torch.bfloat16,False,False,asm,5,5,14.6799,_ZN5aiter39bf16gemm_fp32bf16_tn_64x64_splitk_cleanE,0.0163,150.0,786.56
256,408,384,7168,False,torch.bfloat16,torch.bfloat16,False,False,asm,5,5,14.6347,_ZN5aiter39bf16gemm_fp32bf16_tn_64x64_splitk_cleanE,0.0161,153.47,797.25
256,416,384,7168,False,torch.bfloat16,torch.bfloat16,False,False,asm,5,5,14.862,_ZN5aiter39bf16gemm_fp32bf16_tn_64x64_splitk_cleanE,0.0164,154.09,793.18
256,424,384,7168,False,torch.bfloat16,torch.bfloat16,False,False,asm,8,6,15.3921,_ZN5aiter39bf16gemm_fp32bf16_tn_96x64_splitk_cleanE,0.0188,151.64,773.72
256,432,384,7168,False,torch.bfloat16,torch.bfloat16,False,False,asm,5,5,14.9275,_ZN5aiter39bf16gemm_fp32bf16_tn_64x64_splitk_cleanE,0.0162,159.31,805.89
256,440,384,7168,False,torch.bfloat16,torch.bfloat16,False,False,asm,5,5,14.957,_ZN5aiter39bf16gemm_fp32bf16_tn_64x64_splitk_cleanE,0.0161,161.94,812.38
256,448,384,7168,False,torch.bfloat16,torch.bfloat16,False,False,asm,7,5,15.266,_ZN5aiter39bf16gemm_fp32bf16_tn_80x64_splitk_cleanE,0.0163,161.55,803.85
256,456,384,7168,False,torch.bfloat16,torch.bfloat16,False,False,asm,7,5,15.4627,_ZN5aiter39bf16gemm_fp32bf16_tn_80x64_splitk_cleanE,0.0162,162.34,801.44
256,464,384,7168,False,torch.bfloat16,torch.bfloat16,False,False,asm,5,5,15.3917,_ZN5aiter39bf16gemm_fp32bf16_tn_64x64_splitk_cleanE,0.0162,165.96,812.99
256,472,384,7168,False,torch.bfloat16,torch.bfloat16,False,False,asm,7,5,15.3552,_ZN5aiter39bf16gemm_fp32bf16_tn_80x64_splitk_cleanE,0.0163,169.22,822.79
256,480,384,7168,False,torch.bfloat16,torch.bfloat16,False,False,asm,5,5,15.4679,_ZN5aiter39bf16gemm_fp32bf16_tn_64x64_splitk_cleanE,0.0162,170.83,824.61
256,488,384,7168,False,torch.bfloat16,torch.bfloat16,False,False,asm,7,5,15.5389,_ZN5aiter39bf16gemm_fp32bf16_tn_80x64_splitk_cleanE,0.0162,172.89,828.62
256,496,384,7168,False,torch.bfloat16,torch.bfloat16,False,False,asm,5,5,15.6968,_ZN5aiter39bf16gemm_fp32bf16_tn_64x64_splitk_cleanE,0.0162,173.95,827.98
256,504,384,7168,False,torch.bfloat16,torch.bfloat16,False,False,asm,7,5,15.6448,_ZN5aiter39bf16gemm_fp32bf16_tn_80x64_splitk_cleanE,0.0162,177.35,838.45
256,512,384,7168,False,torch.bfloat16,torch.bfloat16,False,False,asm,7,5,15.667,_ZN5aiter39bf16gemm_fp32bf16_tn_80x64_splitk_cleanE,0.0161,179.91,844.98
256,1,1024,7168,False,torch.bfloat16,torch.bfloat16,False,False,flydsl,180,16,8.3967,flydsl_gemm2_abf16_wbf16_bf16_t32x64x64_split_k16_block_m_warp1_block_n_warp4_async_copyTrue_b_to_ldsFalse_b_preshuffleFalse_c_to_ldsFalse_gfx950,0.0283,1.75,1750.26
256,2,1024,7168,False,torch.bfloat16,torch.bfloat16,False,False,flydsl,180,16,8.0166,flydsl_gemm2_abf16_wbf16_bf16_t32x64x64_split_k16_block_m_warp1_block_n_warp4_async_copyTrue_b_to_ldsFalse_b_preshuffleFalse_c_to_ldsFalse_gfx950,0.0298,3.66,1835.3
256,8,1024,7168,False,torch.bfloat16,torch.bfloat16,False,False,flydsl,180,16,8.0761,flydsl_gemm2_abf16_wbf16_bf16_t32x64x64_split_k16_block_m_warp1_block_n_warp4_async_copyTrue_b_to_ldsFalse_b_preshuffleFalse_c_to_ldsFalse_gfx950,0.0295,14.54,1833.95
256,16,1024,7168,False,torch.bfloat16,torch.bfloat16,False,False,flydsl,180,16,8.7294,flydsl_gemm2_abf16_wbf16_bf16_t32x64x64_split_k16_block_m_warp1_block_n_warp4_async_copyTrue_b_to_ldsFalse_b_preshuffleFalse_c_to_ldsFalse_gfx950,0.0303,26.91,1711.71
256,24,1024,7168,False,torch.bfloat16,torch.bfloat16,False,False,flydsl,179,8,9.8754,flydsl_gemm2_abf16_wbf16_bf16_t32x64x128_split_k8_block_m_warp2_block_n_warp2_async_copyTrue_b_to_ldsTrue_b_preshuffleFalse_c_to_ldsFalse_gfx950,0.0217,35.68,1526.35
256,40,1024,7168,False,torch.bfloat16,torch.bfloat16,False,False,flydsl,179,8,10.3428,flydsl_gemm2_abf16_wbf16_bf16_t32x64x128_split_k8_block_m_warp2_block_n_warp2_async_copyTrue_b_to_ldsTrue_b_preshuffleFalse_c_to_ldsFalse_gfx950,0.0209,56.77,1482.71
256,48,1024,7168,False,torch.bfloat16,torch.bfloat16,False,False,flydsl,179,8,11.8915,flydsl_gemm2_abf16_wbf16_bf16_t32x64x128_split_k8_block_m_warp2_block_n_warp2_async_copyTrue_b_to_ldsTrue_b_preshuffleFalse_c_to_ldsFalse_gfx950,0.0205,59.26,1300.63
256,56,1024,7168,False,torch.bfloat16,torch.bfloat16,False,False,flydsl,179,8,10.9143,flydsl_gemm2_abf16_wbf16_bf16_t32x64x128_split_k8_block_m_warp2_block_n_warp2_async_copyTrue_b_to_ldsTrue_b_preshuffleFalse_c_to_ldsFalse_gfx950,0.0217,75.32,1429.09
256,64,1024,7168,False,torch.bfloat16,torch.bfloat16,False,False,hipblaslt,440911,0,12.1182,Cijk_Alik_Bljk_BBS_BH_Bias_HA_S_SAV_UserArgs_MT16x16x1024_MI16x16x1_SN_LDSB1_AFC0_AFEM1_AFEM1_ASEM1_CLR1_CADS0_DTLA0_DTLB0_DTVA0_DTVB0_EPS0_FDSI0_GRPM1_GRVWA8_GRVWB8_GSU0_GSUAMB_GLS0_ISA950_IU1_K1_LDSTI0_LBSPPA2048_LBSPPB2048_LBSPPM0_LPA16_LPB16_LPM0_LRVW8_LWPMn1_MIAV0_MIWT1_1_MO40_NTn1_NTA4_NTB0_NTC0_NTD0_NTM0_NEPBS0_NLCA1_NLCB1_ONLL1_PGR2_PLR1_PKA1_SIA3_SS1_SPO0_SRVW0_SSO0_SVW1_SK3_SKFTR0_SKXCCM8_TLDS1_ULSGRO0_USL1_UIOFGRO0_USFGRO0_VSn1_VWA1_VWB1_WSGRA0_WSGRB0_WS64_WG16_4_4,0.0,77.53,1297.94
256,72,1024,7168,False,torch.bfloat16,torch.bfloat16,False,False,flydsl,289,8,13.2099,flydsl_gemm2_abf16_wbf16_bf16_t64x64x128_split_k8_block_m_warp2_block_n_warp2_async_copyTrue_b_to_ldsTrue_b_preshuffleFalse_c_to_ldsFalse_gfx950,0.0214,80.01,1200.59
256,80,1024,7168,False,torch.bfloat16,torch.bfloat16,False,False,flydsl,289,8,13.2676,flydsl_gemm2_abf16_wbf16_bf16_t64x64x128_split_k8_block_m_warp2_block_n_warp2_async_copyTrue_b_to_ldsTrue_b_preshuffleFalse_c_to_ldsFalse_gfx950,0.0213,88.52,1205.25
256,88,1024,7168,False,torch.bfloat16,torch.bfloat16,False,False,flydsl,289,8,13.6796,flydsl_gemm2_abf16_wbf16_bf16_t64x64x128_split_k8_block_m_warp2_block_n_warp2_async_copyTrue_b_to_ldsTrue_b_preshuffleFalse_c_to_ldsFalse_gfx950,0.0214,94.44,1178.53
256,96,1024,7168,False,torch.bfloat16,torch.bfloat16,False,False,asm,3,6,14.0885,_ZN5aiter39bf16gemm_fp32bf16_tn_48x64_splitk_cleanE,0.018,100.03,1153.63
256,104,1024,7168,False,torch.bfloat16,torch.bfloat16,False,False,asm,5,6,14.1454,_ZN5aiter39bf16gemm_fp32bf16_tn_64x64_splitk_cleanE,0.0177,107.93,1158.26
256,112,1024,7168,False,torch.bfloat16,torch.bfloat16,False,False,asm,3,5,14.3991,_ZN5aiter39bf16gemm_fp32bf16_tn_48x64_splitk_cleanE,0.0161,114.19,1146.95
256,120,1024,7168,False,torch.bfloat16,torch.bfloat16,False,False,asm,3,5,14.5062,_ZN5aiter39bf16gemm_fp32bf16_tn_48x64_splitk_cleanE,0.0159,121.44,1147.52
256,128,1024,7168,False,torch.bfloat16,torch.bfloat16,False,False,asm,3,5,14.5238,_ZN5aiter39bf16gemm_fp32bf16_tn_48x64_splitk_cleanE,0.0163,129.38,1155.15
256,136,1024,7168,False,torch.bfloat16,torch.bfloat16,False,False,asm,3,5,14.6787,_ZN5aiter39bf16gemm_fp32bf16_tn_48x64_splitk_cleanE,0.0163,136.01,1151.89
256,144,1024,7168,False,torch.bfloat16,torch.bfloat16,False,False,asm,3,5,14.633,_ZN5aiter39bf16gemm_fp32bf16_tn_48x64_splitk_cleanE,0.0161,144.46,1164.45
256,152,1024,7168,False,torch.bfloat16,torch.bfloat16,False,False,asm,5,5,14.802,_ZN5aiter39bf16gemm_fp32bf16_tn_64x64_splitk_cleanE,0.0163,150.75,1160.01
256,160,1024,7168,False,torch.bfloat16,torch.bfloat16,False,False,asm,5,5,15.0656,_ZN5aiter39bf16gemm_fp32bf16_tn_64x64_splitk_cleanE,0.0163,155.91,1148.41
256,168,1024,7168,False,torch.bfloat16,torch.bfloat16,False,False,asm,5,5,15.0442,_ZN5aiter39bf16gemm_fp32bf16_tn_64x64_splitk_cleanE,0.0162,163.93,1158.76
256,176,1024,7168,False,torch.bfloat16,torch.bfloat16,False,False,asm,5,5,15.2535,_ZN5aiter39bf16gemm_fp32bf16_tn_64x64_splitk_cleanE,0.0162,169.38,1151.45
256,184,1024,7168,False,torch.bfloat16,torch.bfloat16,False,False,asm,5,5,15.1892,_ZN5aiter39bf16gemm_fp32bf16_tn_64x64_splitk_cleanE,0.0163,177.83,1164.95
256,192,1024,7168,False,torch.bfloat16,torch.bfloat16,False,False,asm,5,5,15.3065,_ZN5aiter39bf16gemm_fp32bf16_tn_64x64_splitk_cleanE,0.0162,184.14,1164.59
256,200,1024,7168,False,torch.bfloat16,torch.bfloat16,False,False,asm,7,5,15.4285,_ZN5aiter39bf16gemm_fp32bf16_tn_80x64_splitk_cleanE,0.0163,190.3,1163.88
256,208,1024,7168,False,torch.bfloat16,torch.bfloat16,False,False,asm,7,5,15.5531,_ZN5aiter39bf16gemm_fp32bf16_tn_80x64_splitk_cleanE,0.0162,196.32,1162.98
256,216,1024,7168,False,torch.bfloat16,torch.bfloat16,False,False,asm,7,5,15.7414,_ZN5aiter39bf16gemm_fp32bf16_tn_80x64_splitk_cleanE,0.0162,201.44,1157.39
256,224,1024,7168,False,torch.bfloat16,torch.bfloat16,False,False,asm,7,5,16.0465,_ZN5aiter39bf16gemm_fp32bf16_tn_80x64_splitk_cleanE,0.0162,204.93,1143.56
256,232,1024,7168,False,torch.bfloat16,torch.bfloat16,False,False,asm,7,5,16.011,_ZN5aiter39bf16gemm_fp32bf16_tn_80x64_splitk_cleanE,0.0161,212.71,1154.28
256,240,1024,7168,False,torch.bfloat16,torch.bfloat16,False,False,asm,7,5,15.9839,_ZN5aiter39bf16gemm_fp32bf16_tn_80x64_splitk_cleanE,0.0163,220.42,1164.44
256,248,1024,7168,False,torch.bfloat16,torch.bfloat16,False,False,asm,8,5,16.2255,_ZN5aiter39bf16gemm_fp32bf16_tn_96x64_splitk_cleanE,0.0165,224.38,1155.18
256,256,1024,7168,False,torch.bfloat16,torch.bfloat16,False,False,asm,8,5,16.5219,_ZN5aiter39bf16gemm_fp32bf16_tn_96x64_splitk_cleanE,0.0163,227.46,1142.38
256,264,1024,7168,False,torch.bfloat16,torch.bfloat16,False,False,asm,8,5,16.3885,_ZN5aiter39bf16gemm_fp32bf16_tn_96x64_splitk_cleanE,0.0161,236.48,1159.68
256,272,1024,7168,False,torch.bfloat16,torch.bfloat16,False,False,asm,8,5,16.5055,_ZN5aiter39bf16gemm_fp32bf16_tn_96x64_splitk_cleanE,0.0162,241.92,1159.4
256,280,1024,7168,False,torch.bfloat16,torch.bfloat16,False,False,asm,8,5,16.8484,_ZN5aiter39bf16gemm_fp32bf16_tn_96x64_splitk_cleanE,0.0162,243.96,1143.59
256,288,1024,7168,False,torch.bfloat16,torch.bfloat16,False,False,asm,8,5,16.6915,_ZN5aiter39bf16gemm_fp32bf16_tn_96x64_splitk_cleanE,0.0165,253.29,1162.19
256,296,1024,7168,False,torch.bfloat16,torch.bfloat16,False,False,asm,7,4,17.5214,_ZN5aiter39bf16gemm_fp32bf16_tn_80x64_splitk_cleanE,0.0137,248.0,1114.62
256,304,1024,7168,False,torch.bfloat16,torch.bfloat16,False,False,asm,7,4,17.5882,_ZN5aiter39bf16gemm_fp32bf16_tn_80x64_splitk_cleanE,0.0139,253.73,1117.84
256,312,1024,7168,False,torch.bfloat16,torch.bfloat16,False,False,hipblaslt,439939,0,17.6727,Cijk_Alik_Bljk_BBS_BH_Bias_HA_S_SAV_UserArgs_MT128x96x64_MI16x16x1_SN_LDSB0_AFC0_AFEM1_AFEM1_ASEM1_CLR0_CADS0_DTLA1_DTLB1_DTVA0_DTVB0_EPS0_FDSI0_GRPM1_GRVWA2_GRVWB8_GSU0_GSUAMB_GLS0_ISA950_IU1_K1_LDSTI0_LBSPPA256_LBSPPB1024_LBSPPM0_LPA16_LPB16_LPM0_LRVW8_LWPMn1_MIAV0_MIWT4_3_MO40_NTn1_NTA5_NTB1_NTC0_NTD7_NTM0_NEPBS0_NLCA1_NLCB1_ONLL1_PGR2_PLR1_PKA1_SIA3_SS1_SPO0_SRVW0_SSO0_SVW4_SK3_SKFTR0_SKXCCM4_TLDS1_ULSGRO0_USL1_UIOFGRO0_USFGRO0_VSn1_VWA4_VWB1_WSGRA0_WSGRB0_WS64_WG32_8_1,0.0,259.17,1119.91
256,320,1024,7168,False,torch.bfloat16,torch.bfloat16,False,False,asm,7,4,17.8718,_ZN5aiter39bf16gemm_fp32bf16_tn_80x64_splitk_cleanE,0.0138,262.85,1114.77
256,328,1024,7168,False,torch.bfloat16,torch.bfloat16,False,False,asm,8,4,18.2496,_ZN5aiter39bf16gemm_fp32bf16_tn_96x64_splitk_cleanE,0.0137,263.84,1098.87
256,336,1024,7168,False,torch.bfloat16,torch.bfloat16,False,False,asm,8,4,18.1987,_ZN5aiter39bf16gemm_fp32bf16_tn_96x64_splitk_cleanE,0.0139,271.04,1109.15
256,344,1024,7168,False,torch.bfloat16,torch.bfloat16,False,False,hipblaslt,439801,0,18.2568,Cijk_Alik_Bljk_BBS_BH_Bias_HA_S_SAV_UserArgs_MT128x96x64_MI16x16x1_SN_LDSB0_AFC0_AFEM1_AFEM1_ASEM1_CLR1_CADS0_DTLA1_DTLB1_DTVA0_DTVB0_EPS0_FDSI0_GRPM1_GRVWA2_GRVWB8_GSU0_GSUAMB_GLS0_ISA950_IU1_K1_LDSTI0_LBSPPA256_LBSPPB1024_LBSPPM0_LPA16_LPB16_LPM0_LRVW8_LWPMn1_MIAV0_MIWT4_3_MO40_NTn1_NTA7_NTB3_NTC2_NTD4_NTM0_NEPBS0_NLCA1_NLCB1_ONLL1_PGR2_PLR1_PKA1_SIA3_SS1_SPO0_SRVW0_SSO1_SVW4_SK3_SKFTR0_SKXCCM0_TLDS1_ULSGRO0_USL1_UIOFGRO0_USFGRO0_VSn1_VWA4_VWB1_WSGRA0_WSGRB0_WS64_WG32_8_1,0.0,276.61,1112.8
256,376,1024,7168,False,torch.bfloat16,torch.bfloat16,False,False,asm,8,4,18.8005,_ZN5aiter39bf16gemm_fp32bf16_tn_96x64_splitk_cleanE,0.0138,293.59,1108.5
256,384,1024,7168,False,torch.bfloat16,torch.bfloat16,False,False,asm,8,4,18.8832,_ZN5aiter39bf16gemm_fp32bf16_tn_96x64_splitk_cleanE,0.0138,298.53,1110.59
256,4,2112,7168,False,torch.bfloat16,torch.bfloat16,False,False,flydsl,182,16,9.3715,flydsl_gemm2_abf16_wbf16_bf16_t32x64x64_split_k16_block_m_warp2_block_n_warp2_async_copyTrue_b_to_ldsTrue_b_preshuffleFalse_c_to_ldsFalse_gfx950,0.0286,12.92,3238.74
256,8,2112,7168,False,torch.bfloat16,torch.bfloat16,False,False,flydsl,182,16,9.7582,flydsl_gemm2_abf16_wbf16_bf16_t32x64x64_split_k16_block_m_warp2_block_n_warp2_async_copyTrue_b_to_ldsTrue_b_preshuffleFalse_c_to_ldsFalse_gfx950,0.0288,24.82,3118.0
256,16,2112,7168,False,torch.bfloat16,torch.bfloat16,False,False,flydsl,179,8,10.7144,flydsl_gemm2_abf16_wbf16_bf16_t32x64x128_split_k8_block_m_warp2_block_n_warp2_async_copyTrue_b_to_ldsTrue_b_preshuffleFalse_c_to_ldsFalse_gfx950,0.0212,45.21,2853.6
256,24,2112,7168,False,torch.bfloat16,torch.bfloat16,False,False,flydsl,289,8,12.8635,flydsl_gemm2_abf16_wbf16_bf16_t64x64x128_split_k8_block_m_warp2_block_n_warp2_async_copyTrue_b_to_ldsTrue_b_preshuffleFalse_c_to_ldsFalse_gfx950,0.0222,56.49,2388.39
256,32,2112,7168,False,torch.bfloat16,torch.bfloat16,False,False,flydsl,179,8,13.0746,flydsl_gemm2_abf16_wbf16_bf16_t32x64x128_split_k8_block_m_warp2_block_n_warp2_async_copyTrue_b_to_ldsTrue_b_preshuffleFalse_c_to_ldsFalse_gfx950,0.0219,74.1,2361.19
256,40,2112,7168,False,torch.bfloat16,torch.bfloat16,False,False,flydsl,289,8,14.5861,flydsl_gemm2_abf16_wbf16_bf16_t64x64x128_split_k8_block_m_warp2_block_n_warp2_async_copyTrue_b_to_ldsTrue_b_preshuffleFalse_c_to_ldsFalse_gfx950,0.0217,83.03,2126.68
256,48,2112,7168,False,torch.bfloat16,torch.bfloat16,False,False,asm,3,6,14.8189,_ZN5aiter39bf16gemm_fp32bf16_tn_48x64_splitk_cleanE,0.0181,98.07,2103.29
256,56,2112,7168,False,torch.bfloat16,torch.bfloat16,False,False,hipblaslt,440034,0,15.2733,Cijk_Alik_Bljk_BBS_BH_Bias_HA_S_SAV_UserArgs_MT64x64x64_MI16x16x1_SN_LDSB0_AFC0_AFEM1_AFEM1_ASEM1_CLR0_CADS0_DTLA1_DTLB1_DTVA0_DTVB0_EPS0_FDSI0_GRPM1_GRVWA8_GRVWB8_GSU0_GSUAMB_GLS0_ISA950_IU1_K1_LDSTI0_LBSPPA1024_LBSPPB1024_LBSPPM0_LPA16_LPB16_LPM0_LRVW8_LWPMn1_MIAV1_MIWT4_1_MO40_NTn1_NTA1_NTB3_NTC3_NTD2_NTM0_NEPBS0_NLCA1_NLCB1_ONLL1_PGR2_PLR1_PKA1_SIA3_SS1_SPO0_SRVW0_SSO0_SVW4_SK3_SKFTR0_SKXCCM8_TLDS1_ULSGRO0_USL1_UIOFGRO0_USFGRO1_VSn1_VWA4_VWB1_WSGRA0_WSGRB0_WS64_WG16_16_1,0.0,111.01,2050.44
256,72,2112,7168,False,torch.bfloat16,torch.bfloat16,False,False,asm,7,7,15.5887,_ZN5aiter39bf16gemm_fp32bf16_tn_80x64_splitk_cleanE,0.0197,139.84,2028.0
256,88,2112,7168,False,torch.bfloat16,torch.bfloat16,False,False,asm,8,6,16.3983,_ZN5aiter39bf16gemm_fp32bf16_tn_96x64_splitk_cleanE,0.0179,162.48,1945.99
256,360,4096,512,False,torch.bfloat16,torch.bfloat16,False,False,hipblaslt,440054,0,7.306,Cijk_Alik_Bljk_BBS_BH_Bias_HA_S_SAV_UserArgs_MT64x128x128_MI16x16x1_SN_LDSB0_AFC0_AFEM1_AFEM1_ASEM1_CLR1_CADS0_DTLA0_DTLB0_DTVA0_DTVB0_EPS0_FDSI0_GRPM1_GRVWA8_GRVWB8_GSUAMB_GLS0_ISA950_IU1_K1_LDSTI0_LBSPPA1024_LBSPPB512_LBSPPM0_LPA16_LPB16_LPM0_LRVW8_LWPMn1_MIAV1_MIWT4_2_MO40_NTn1_NTA2_NTB2_NTC4_NTD5_NTM0_NEPBS12_NLCA1_NLCB1_ONLL1_PGR2_PLR1_PKA1_SIA3_SS1_SPO0_SRVW0_SSO0_SVW4_SK0_SKFTR0_SKXCCM0_TLDS2_ULSGRO0_USL1_UIOFGRO0_USFGROn1_VSn1_VWA4_VWB2_WSGRA0_WSGRB0_WS64_WG16_16_1,0.0,206.67,1028.2
256,1,7168,512,False,torch.bfloat16,torch.bfloat16,False,False,triton,0,0,4.9485,auto,0.0,1.48,1486.39
256,48,7168,512,False,torch.bfloat16,torch.bfloat16,False,False,hipblaslt,439773,0,5.878,Cijk_Alik_Bljk_BBS_BH_Bias_HA_S_SAV_UserArgs_MT32x48x256_MI16x16x1_SN_LDSB0_AFC0_AFEM1_AFEM1_ASEM1_CLR1_CADS0_DTLA1_DTLB1_DTVA0_DTVB0_EPS0_FDSI0_GRPM1_GRVWA8_GRVWB8_GSU0_GSUAMB_GLS0_ISA950_IU1_K1_LDSTI0_LBSPPA1024_LBSPPB1024_LBSPPM0_LPA16_LPB16_LPM0_LRVW8_LWPMn1_MIAV1_MIWT2_3_MO40_NTn1_NTA7_NTB1_NTC3_NTD2_NTM0_NEPBS8_NLCA1_NLCB1_ONLL1_PGR2_PLR1_PKA1_SIA3_SS1_SPO0_SRVW0_SSO0_SVW2_SK3_SKFTR0_SKXCCM0_TLDS1_ULSGRO0_USL1_UIOFGRO0_USFGRO0_VSn1_VWA2_VWB1_WSGRA0_WSGRB0_WS64_WG16_4_2,0.0,59.94,1374.16
256,72,7168,512,False,torch.bfloat16,torch.bfloat16,False,False,asm,4,1,6.5814,_ZN5aiter37bf16gemm_fp32bf16_tn_48x64_pf3_splitkE,0.0,80.3,1283.31
256,80,7168,512,False,torch.bfloat16,torch.bfloat16,False,False,asm,4,1,6.6122,_ZN5aiter37bf16gemm_fp32bf16_tn_48x64_pf3_splitkE,0.0,88.81,1295.91
256,120,7168,512,False,torch.bfloat16,torch.bfloat16,False,False,flydsl,280,1,6.8966,flydsl_gemm2_abf16_wbf16_bf16_t64x64x128_split_k1_block_m_warp2_block_n_warp2_async_copyTrue_b_to_ldsTrue_b_preshuffleFalse_c_to_ldsFalse_gfx950,0.0,127.72,1331.56
256,128,7168,512,False,torch.bfloat16,torch.bfloat16,False,False,triton,0,0,6.8938,auto,0.0,136.29,1349.92
