aiter/configs/model_configs/llama70B_bf16_tuned_gemm.csv
cu_num,M,N,K,bias,dtype,outdtype,scaleAB,bpreshuffle,libtype,solidx,splitK,us,kernelName,err_ratio,tflops,bw
256,64,192,1024,False,torch.bfloat16,torch.bfloat16,False,False,flydsl,179,8,3.7986,flydsl_gemm2_abf16_wbf16_bf16_t32x64x128_split_k8_block_m_warp2_block_n_warp2_async_copyTrue_b_to_ldsTrue_b_preshuffleFalse_c_to_ldsFalse_gfx950,0.0124,6.63,144.49
256,1,1280,8192,False,torch.bfloat16,torch.bfloat16,False,False,flydsl,167,16,7.3327,flydsl_gemm2_abf16_wbf16_bf16_t32x64x128_split_k16_block_m_warp2_block_n_warp2_async_copyTrue_b_to_ldsTrue_b_preshuffleFalse_c_to_ldsFalse_gfx950,0.0305,2.86,2862.58
256,16,1280,8192,False,torch.bfloat16,torch.bfloat16,False,False,flydsl,105,16,8.7513,flydsl_gemm2_abf16_wbf16_bf16_t32x128x128_split_k16_block_m_warp1_block_n_warp4_async_copyTrue_b_to_ldsFalse_b_preshuffleFalse_c_to_ldsFalse_gfx950,0.0287,38.34,2431.02
256,32,1280,8192,False,torch.bfloat16,torch.bfloat16,False,False,flydsl,177,8,12.0725,flydsl_gemm2_abf16_wbf16_bf16_t32x64x128_split_k8_block_m_warp1_block_n_warp4_async_copyTrue_b_to_ldsFalse_b_preshuffleFalse_c_to_ldsFalse_gfx950,0.0214,55.59,1787.35
256,64,1280,8192,False,torch.bfloat16,torch.bfloat16,False,False,flydsl,179,8,13.6099,flydsl_gemm2_abf16_wbf16_bf16_t32x64x128_split_k8_block_m_warp2_block_n_warp2_async_copyTrue_b_to_ldsTrue_b_preshuffleFalse_c_to_ldsFalse_gfx950,0.0216,98.62,1629.99
256,128,1280,8192,False,torch.bfloat16,torch.bfloat16,False,False,asm,5,6,15.0191,_ZN5aiter39bf16gemm_fp32bf16_tn_64x64_splitk_cleanE,0.018,178.73,1557.77
256,256,1280,8192,False,torch.bfloat16,torch.bfloat16,False,False,hipblaslt,439930,0,17.7489,Cijk_Alik_Bljk_BBS_BH_Bias_HA_S_SAV_UserArgs_MT96x128x128_MI16x16x1_SN_LDSB0_AFC0_AFEM1_AFEM1_ASEM1_CLR0_CADS0_DTLA0_DTLB0_DTVA0_DTVB0_EPS0_FDSI0_GRPM1_GRVWA8_GRVWB8_GSU0_GSUAMB_GLS0_ISA950_IU1_K1_LDSTI0_LBSPPA512_LBSPPB512_LBSPPM0_LPA16_LPB16_LPM0_LRVW8_LWPMn1_MIAV0_MIWT6_2_MO40_NTn1_NTA3_NTB1_NTC0_NTD5_NTM0_NEPBS0_NLCA1_NLCB1_ONLL1_PGR2_PLR1_PKA1_SIA3_SS1_SPO0_SRVW0_SSO0_SVW2_SK3_SKFTR0_SKXCCM4_TLDS1_ULSGRO0_USL1_UIOFGRO0_USFGRO0_VSn1_VWA2_VWB2_WSGRA0_WSGRB0_WS64_WG16_16_1,0.0,302.48,1454.8
256,512,1280,8192,False,torch.bfloat16,torch.bfloat16,False,False,hipblaslt,440320,0,23.6725,Cijk_Alik_Bljk_BBS_BH_Bias_HA_S_SAV_UserArgs_MT128x192x64_MI16x16x1_SN_LDSB0_AFC0_AFEM1_AFEM1_ASEM1_CLR0_CADS0_DTLA0_DTLB0_DTVA0_DTVB0_EPS0_FDSI0_GRPM1_GRVWA8_GRVWB8_GSU0_GSUAMB_GLS0_ISA950_IU1_K1_LDSTI0_LBSPPA256_LBSPPB512_LBSPPM0_LPA16_LPB16_LPM0_LRVW8_LWPMn1_MIAV0_MIWT2_12_MO40_NTn1_NTA0_NTB0_NTC1_NTD2_NTM0_NEPBS14_NLCA1_NLCB1_ONLL1_PGR2_PLR1_PKA1_SIA3_SS1_SPO0_SRVW0_SSO0_SVW2_SK3_SKFTR0_SKXCCM0_TLDS1_ULSGRO0_USL1_UIOFGRO0_USFGRO1_VSn1_VWA2_VWB4_WSGRA0_WSGRB0_WS64_WG64_4_1,0.0,453.58,1295.63
256,1024,1280,8192,False,torch.bfloat16,torch.bfloat16,False,False,hipblaslt,440366,0,33.9749,Cijk_Alik_Bljk_BBS_BH_Bias_HA_S_SAV_UserArgs_MT256x128x64_MI16x16x1_SN_LDSB0_AFC1_AFEM1_AFEM1_ASEM1_CLR0_CADS0_DTLA1_DTLB1_DTVA0_DTVB0_EPS0_FDSI0_GRPM1_GRVWA8_GRVWB8_GSU0_GSUAMB_GLS0_ISA950_IU1_K1_LDSTI0_LBSPPA1024_LBSPPB1024_LBSPPM0_LPA16_LPB16_LPM0_LRVW8_LWPMn1_MIAV0_MIWT4_8_MO40_NTn1_NTA3_NTB7_NTC6_NTD6_NTM0_NEPBS12_NLCA1_NLCB1_ONLL1_PGR2_PLR1_PKA1_SIA3_SS1_SPO0_SRVW0_SSO0_SVW4_SK3_SKFTR0_SKXCCM0_TLDS1_ULSGRO0_USL1_UIOFGRO0_USFGRO1_VSn1_VWA4_VWB8_WSGRA0_WSGRB0_WS64_WG64_4_1,0.0,632.08,1188.24
256,2048,1280,8192,False,torch.bfloat16,torch.bfloat16,False,False,hipblaslt,441305,0,52.6186,Cijk_Alik_Bljk_BBS_BH_Bias_HA_S_SAV_UserArgs_MT160x256x64_MI16x16x1_SN_LDSB0_AFC0_AFEM1_AFEM1_ASEM1_CLR1_CADS0_DTLA0_DTLB0_DTVA0_DTVB0_EPS0_FDSI0_GRPM1_GRVWA8_GRVWB8_GSU0_GSUAMB_GLS0_ISA950_IU1_K1_LDSTI0_LBSPPA128_LBSPPB1024_LBSPPM0_LPA16_LPB16_LPM0_LRVW8_LWPMn1_MIAV0_MIWT5_8_MO40_NTn1_NTA0_NTB0_NTC0_NTD0_NTM0_NEPBS0_NLCA1_NLCB1_ONLL1_PGR2_PLR1_PKA1_SIA3_SS1_SPO0_SRVW0_SSO0_SVW1_SK3_SKFTR0_SKXCCM0_TLDS1_ULSGRO0_USL1_UIOFGRO0_USFGRO0_VSn1_VWA1_VWB8_WSGRA0_WSGRB0_WS64_WG32_8_1,0.0,816.25,1135.89
256,4096,1280,8192,False,torch.bfloat16,torch.bfloat16,False,False,hipblaslt,440465,0,89.5077,Cijk_Alik_Bljk_BBS_BH_Bias_HA_S_SAV_UserArgs_MT160x256x64_MI16x16x1_SN_LDSB0_AFC1_AFEM1_AFEM1_ASEM1_CLR1_CADS0_DTLA1_DTLB1_DTVA0_DTVB0_EPS0_FDSI0_GRPM1_GRVWA8_GRVWB8_GSU0_GSUAMB_GLS0_ISA950_IU1_K1_LDSTI0_LBSPPA1024_LBSPPB1024_LBSPPM0_LPA16_LPB16_LPM0_LRVW8_LWPMn1_MIAV0_MIWT5_8_MO40_NTn1_NTA3_NTB0_NTC0_NTD4_NTM0_NEPBS0_NLCA1_NLCB1_ONLL1_PGR2_PLR1_PKA1_SIA3_SS1_SPO1_SRVW0_SSO1_SVW1_SK3_SKFTR0_SKXCCM4_TLDS1_ULSGRO0_USL1_UIOFGRO0_USFGRO0_VSn1_VWA1_VWB8_WSGRA0_WSGRB0_WS64_WG32_8_1,0.0,959.69,1101.2
256,8192,1280,8192,False,torch.bfloat16,torch.bfloat16,False,False,hipblaslt,440465,0,147.843,Cijk_Alik_Bljk_BBS_BH_Bias_HA_S_SAV_UserArgs_MT160x256x64_MI16x16x1_SN_LDSB0_AFC1_AFEM1_AFEM1_ASEM1_CLR1_CADS0_DTLA1_DTLB1_DTVA0_DTVB0_EPS0_FDSI0_GRPM1_GRVWA8_GRVWB8_GSU0_GSUAMB_GLS0_ISA950_IU1_K1_LDSTI0_LBSPPA1024_LBSPPB1024_LBSPPM0_LPA16_LPB16_LPM0_LRVW8_LWPMn1_MIAV0_MIWT5_8_MO40_NTn1_NTA3_NTB0_NTC0_NTD4_NTM0_NEPBS0_NLCA1_NLCB1_ONLL1_PGR2_PLR1_PKA1_SIA3_SS1_SPO1_SRVW0_SSO1_SVW1_SK3_SKFTR0_SKXCCM4_TLDS1_ULSGRO0_USL1_UIOFGRO0_USFGRO0_VSn1_VWA1_VWB8_WSGRA0_WSGRB0_WS64_WG32_8_1,0.0,1162.03,1191.54
256,16384,1280,8192,False,torch.bfloat16,torch.bfloat16,False,False,hipblaslt,440417,0,267.8494,Cijk_Alik_Bljk_BBS_BH_Bias_HA_S_SAV_UserArgs_MT160x256x64_MI16x16x1_SN_LDSB0_AFC1_AFEM1_AFEM1_ASEM1_CLR0_CADS0_DTLA1_DTLB1_DTVA0_DTVB0_EPS0_FDSI0_GRPM1_GRVWA8_GRVWB8_GSU0_GSUAMB_GLS0_ISA950_IU1_K1_LDSTI0_LBSPPA1024_LBSPPB1024_LBSPPM0_LPA16_LPB16_LPM0_LRVW8_LWPMn1_MIAV0_MIWT5_8_MO40_NTn1_NTA1_NTB2_NTC1_NTD0_NTM0_NEPBS0_NLCA1_NLCB1_ONLL1_PGR2_PLR1_PKA1_SIA3_SS1_SPO0_SRVW0_SSO0_SVW1_SK3_SKFTR0_SKXCCM4_TLDS2_ULSGRO0_USL1_UIOFGRO0_USFGRO0_VSn1_VWA1_VWB8_WSGRA0_WSGRB0_WS64_WG32_8_1,0.0,1282.8,1237.08
256,32768,1280,8192,False,torch.bfloat16,torch.bfloat16,False,False,hipblaslt,440527,0,490.6775,Cijk_Alik_Bljk_BBS_BH_Bias_HA_S_SAV_UserArgs_MT256x256x64_MI16x16x1_CMS_SN_LDSB0_AFC1_AFEM1_AFEM1_ASEM1_CLR0_CADS0_DTLA1_DTLB1_DTVA0_DTVB0_EPS0_FDSI0_GRPM1_GRVWA8_GRVWB8_GSU0_GSUAMB_GLS0_ISA950_IU1_K1_LDSTI0_LBSPPA1024_LBSPPB1024_LBSPPM0_LPA16_LPB16_LPM0_LRVW8_LWPMn1_MIAV0_MIWT8_8_MO40_NTn1_NTA3_NTB1_NTC5_NTD2_NTM0_NEPBS0_NLCA1_NLCB1_ONLL1_PGR2_PLR1_PKA1_SIA3_SS1_SPO1_SRVW0_SSO1_SVW8_SK3_SKFTR0_SKXCCM0_TLDS1_ULSGRO0_USL1_UIOFGRO0_USFGRO0_VSn1_VWA8_VWB8_WSGRA0_WSGRB0_WS64_WG32_8_1,0.0,1400.5,1307.84
256,1,2560,8192,False,torch.bfloat16,torch.bfloat16,False,False,flydsl,167,16,10.3178,flydsl_gemm2_abf16_wbf16_bf16_t32x64x128_split_k16_block_m_warp2_block_n_warp2_async_copyTrue_b_to_ldsTrue_b_preshuffleFalse_c_to_ldsFalse_gfx950,0.0312,4.07,4067.2
256,16,2560,8192,False,torch.bfloat16,torch.bfloat16,False,False,flydsl,93,8,12.6898,flydsl_gemm2_abf16_wbf16_bf16_t16x128x128_split_k8_block_m_warp1_block_n_warp4_async_copyTrue_b_to_ldsFalse_b_preshuffleFalse_c_to_ldsFalse_gfx950,0.0214,52.88,3332.37
256,32,2560,8192,False,torch.bfloat16,torch.bfloat16,False,False,flydsl,179,8,13.6964,flydsl_gemm2_abf16_wbf16_bf16_t32x64x128_split_k8_block_m_warp2_block_n_warp2_async_copyTrue_b_to_ldsTrue_b_preshuffleFalse_c_to_ldsFalse_gfx950,0.0221,97.99,3112.58
256,64,2560,8192,False,torch.bfloat16,torch.bfloat16,False,False,hipblaslt,441380,0,15.5877,Cijk_Alik_Bljk_BBS_BH_Bias_HA_S_SAV_UserArgs_MT96x64x128_MI16x16x1_SN_LDSB1_AFC0_AFEM1_AFEM1_ASEM1_CLR1_CADS0_DTLA0_DTLB0_DTVA0_DTVB0_EPS0_FDSI0_GRPM1_GRVWA8_GRVWB8_GSU0_GSUAMB_GLS0_ISA950_IU1_K1_LDSTI0_LBSPPA256_LBSPPB512_LBSPPM0_LPA16_LPB16_LPM0_LRVW8_LWPMn1_MIAV0_MIWT3_2_MO40_NTn1_NTA0_NTB0_NTC0_NTD0_NTM0_NEPBS0_NLCA1_NLCB1_ONLL1_PGR2_PLR1_PKA1_SIA3_SS1_SPO0_SRVW0_SSO0_SVW1_SK3_SKFTR0_SKXCCM0_TLDS1_ULSGRO0_USL1_UIOFGRO0_USFGRO0_VSn1_VWA1_VWB2_WSGRA0_WSGRB0_WS64_WG32_8_1,0.0,172.21,2779.07
256,128,2560,8192,False,torch.bfloat16,torch.bfloat16,False,False,hipblaslt,439851,0,18.0634,Cijk_Alik_Bljk_BBS_BH_Bias_HA_S_SAV_UserArgs_MT96x128x128_MI16x16x1_SN_LDSB0_AFC0_AFEM1_AFEM1_ASEM1_CLR0_CADS0_DTLA0_DTLB0_DTVA0_DTVB0_EPS0_FDSI0_GRPM1_GRVWA8_GRVWB8_GSU0_GSUAMB_GLS0_ISA950_IU1_K1_LDSTI0_LBSPPA512_LBSPPB512_LBSPPM0_LPA16_LPB16_LPM0_LRVW8_LWPMn1_MIAV1_MIWT6_2_MO40_NTn1_NTA3_NTB1_NTC1_NTD3_NTM0_NEPBS0_NLCA1_NLCB1_ONLL1_PGR2_PLR1_PKA1_SIA3_SS1_SPO0_SRVW0_SSO0_SVW2_SK3_SKFTR0_SKXCCM0_TLDS1_ULSGRO0_USL1_UIOFGRO0_USFGRO0_VSn1_VWA2_VWB2_WSGRA0_WSGRB0_WS64_WG16_16_1,0.0,297.21,2474.37
256,256,2560,8192,False,torch.bfloat16,torch.bfloat16,False,False,hipblaslt,441367,0,24.629,Cijk_Alik_Bljk_BBS_BH_Bias_HA_S_SAV_UserArgs_MT160x128x128_MI16x16x1_SN_LDSB1_AFC0_AFEM1_AFEM1_ASEM1_CLR1_CADS0_DTLA0_DTLB0_DTVA0_DTVB0_EPS0_FDSI0_GRPM1_GRVWA8_GRVWB8_GSU0_GSUAMB_GLS0_ISA950_IU1_K1_LDSTI0_LBSPPA256_LBSPPB1024_LBSPPM0_LPA16_LPB16_LPM0_LRVW8_LWPMn1_MIAV0_MIWT5_4_MO40_NTn1_NTA0_NTB0_NTC0_NTD0_NTM0_NEPBS0_NLCA1_NLCB1_ONLL1_PGR2_PLR1_PKA1_SIA3_SS1_SPO0_SRVW0_SSO0_SVW1_SK3_SKFTR0_SKXCCM0_TLDS1_ULSGRO0_USL1_UIOFGRO0_USFGRO0_VSn1_VWA1_VWB4_WSGRA0_WSGRB0_WS64_WG32_8_1,0.0,435.97,1926.51
256,512,2560,8192,False,torch.bfloat16,torch.bfloat16,False,False,hipblaslt,440459,0,34.5297,Cijk_Alik_Bljk_BBS_BH_Bias_HA_S_SAV_UserArgs_MT256x128x64_MI16x16x1_SN_LDSB0_AFC1_AFEM1_AFEM1_ASEM1_CLR1_CADS0_DTLA1_DTLB1_DTVA0_DTVB0_EPS0_FDSI0_GRPM1_GRVWA8_GRVWB8_GSU0_GSUAMB_GLS0_ISA950_IU1_K1_LDSTI0_LBSPPA1024_LBSPPB1024_LBSPPM0_LPA16_LPB16_LPM0_LRVW8_LWPMn1_MIAV0_MIWT4_8_MO40_NTn1_NTA5_NTB3_NTC5_NTD3_NTM0_NEPBS16_NLCA1_NLCB1_ONLL1_PGR2_PLR1_PKA1_SIA3_SS1_SPO0_SRVW0_SSO0_SVW4_SK3_SKFTR0_SKXCCM8_TLDS2_ULSGRO0_USL1_UIOFGRO0_USFGRO0_VSn1_VWA4_VWB8_WSGRA0_WSGRB0_WS64_WG64_4_1,0.0,621.92,1533.55
256,1024,2560,8192,False,torch.bfloat16,torch.bfloat16,False,False,hipblaslt,440417,0,53.207,Cijk_Alik_Bljk_BBS_BH_Bias_HA_S_SAV_UserArgs_MT160x256x64_MI16x16x1_SN_LDSB0_AFC1_AFEM1_AFEM1_ASEM1_CLR0_CADS0_DTLA1_DTLB1_DTVA0_DTVB0_EPS0_FDSI0_GRPM1_GRVWA8_GRVWB8_GSU0_GSUAMB_GLS0_ISA950_IU1_K1_LDSTI0_LBSPPA1024_LBSPPB1024_LBSPPM0_LPA16_LPB16_LPM0_LRVW8_LWPMn1_MIAV0_MIWT5_8_MO40_NTn1_NTA1_NTB2_NTC1_NTD0_NTM0_NEPBS0_NLCA1_NLCB1_ONLL1_PGR2_PLR1_PKA1_SIA3_SS1_SPO0_SRVW0_SSO0_SVW1_SK3_SKFTR0_SKXCCM4_TLDS2_ULSGRO0_USL1_UIOFGRO0_USFGRO0_VSn1_VWA1_VWB8_WSGRA0_WSGRB0_WS64_WG32_8_1,0.0,807.22,1202.16
256,2048,2560,8192,False,torch.bfloat16,torch.bfloat16,False,False,hipblaslt,439562,0,91.6693,Cijk_Alik_Bljk_BBS_BH_Bias_HA_S_SAV_UserArgs_MT160x256x64_MI16x16x1_SN_LDSB0_AFC0_AFEM1_AFEM1_ASEM1_CLR1_CADS0_DTLA0_DTLB0_DTVA0_DTVB0_EPS0_FDSI0_GRPM1_GRVWA8_GRVWB8_GSU0_GSUAMB_GLS0_ISA950_IU1_K1_LDSTI0_LBSPPA256_LBSPPB512_LBSPPM0_LPA16_LPB16_LPM0_LRVW8_LWPMn1_MIAV0_MIWT10_4_MO40_NTn1_NTA0_NTB3_NTC0_NTD4_NTM0_NEPBS0_NLCA1_NLCB1_ONLL1_PGR2_PLR1_PKA1_SIA3_SS1_SPO0_SRVW0_SSO4_SVW2_SK3_SKFTR0_SKXCCM4_TLDS1_ULSGRO0_USL1_UIOFGRO0_USFGROn1_VSn1_VWA2_VWB4_WSGRA0_WSGRB0_WS64_WG16_16_1,0.0,937.06,937.97
256,4096,2560,8192,False,torch.bfloat16,torch.bfloat16,False,False,hipblaslt,441305,0,138.3141,Cijk_Alik_Bljk_BBS_BH_Bias_HA_S_SAV_UserArgs_MT160x256x64_MI16x16x1_SN_LDSB0_AFC0_AFEM1_AFEM1_ASEM1_CLR1_CADS0_DTLA0_DTLB0_DTVA0_DTVB0_EPS0_FDSI0_GRPM1_GRVWA8_GRVWB8_GSU0_GSUAMB_GLS0_ISA950_IU1_K1_LDSTI0_LBSPPA128_LBSPPB1024_LBSPPM0_LPA16_LPB16_LPM0_LRVW8_LWPMn1_MIAV0_MIWT5_8_MO40_NTn1_NTA0_NTB0_NTC0_NTD0_NTM0_NEPBS0_NLCA1_NLCB1_ONLL1_PGR2_PLR1_PKA1_SIA3_SS1_SPO0_SRVW0_SSO0_SVW1_SK3_SKFTR0_SKXCCM0_TLDS1_ULSGRO0_USL1_UIOFGRO0_USFGRO0_VSn1_VWA1_VWB8_WSGRA0_WSGRB0_WS64_WG32_8_1,0.0,1242.09,940.06
256,8192,2560,8192,False,torch.bfloat16,torch.bfloat16,False,False,hipblaslt,440452,0,268.4801,Cijk_Alik_Bljk_BBS_BH_Bias_HA_S_SAV_UserArgs_MT256x256x64_MI16x16x1_CMS_SN_LDSB0_AFC1_AFEM1_AFEM1_ASEM1_CLR0_CADS0_DTLA1_DTLB1_DTVA0_DTVB0_EPS0_FDSI0_GRPM1_GRVWA8_GRVWB8_GSU0_GSUAMB_GLS0_ISA950_IU1_K1_LDSTI0_LBSPPA1024_LBSPPB1024_LBSPPM0_LPA16_LPB16_LPM0_LRVW8_LWPMn1_MIAV0_MIWT8_8_MO40_NTn1_NTA1_NTB2_NTC4_NTD2_NTM0_NEPBS12_NLCA1_NLCB1_ONLL1_PGR2_PLR1_PKA1_SIA3_SS1_SPO1_SRVW0_SSO0_SVW8_SK3_SKFTR0_SKXCCM4_TLDS1_ULSGRO0_USL1_UIOFGRO0_USFGRO0_VSn1_VWA8_VWB8_WSGRA0_WSGRB0_WS64_WG32_8_1,0.0,1279.79,812.36
256,16384,2560,8192,False,torch.bfloat16,torch.bfloat16,False,False,hipblaslt,440606,0,484.6137,Cijk_Alik_Bljk_BBS_BH_Bias_HA_S_SAV_UserArgs_MT256x224x64_MI16x16x1_SN_LDSB0_AFC0_AFEM1_AFEM1_ASEM1_CLR1_CADS0_DTLA1_DTLB1_DTVA0_DTVB0_EPS0_FDSI0_GRPM1_GRVWA8_GRVWB8_GSU0_GSUAMB_GLS0_ISA950_IU1_K1_LDSTI0_LBSPPA1024_LBSPPB1024_LBSPPM0_LPA16_LPB16_LPM0_LRVW8_LWPMn1_MIAV0_MIWT8_7_MO40_NTn1_NTA1_NTB0_NTC7_NTD4_NTM0_NEPBS14_NLCA1_NLCB1_ONLL1_PGR2_PLR1_PKA1_SIA3_SS1_SPO0_SRVW0_SSO1_SVW8_SK3_SKFTR0_SKXCCM4_TLDS1_ULSGRO0_USL1_UIOFGRO0_USFGRO0_VSn1_VWA8_VWB1_WSGRA0_WSGRB0_WS64_WG32_8_1,0.0,1418.03,813.56
256,32768,2560,8192,False,torch.bfloat16,torch.bfloat16,False,False,hipblaslt,440587,0,909.8416,Cijk_Alik_Bljk_BBS_BH_Bias_HA_S_SAV_UserArgs_MT256x256x64_MI16x16x1_CMS_SN_LDSB0_AFC0_AFEM1_AFEM1_ASEM1_CLR0_CADS0_DTLA1_DTLB1_DTVA0_DTVB0_EPS0_FDSI0_GRPM1_GRVWA8_GRVWB8_GSU0_GSUAMB_GLS0_ISA950_IU1_K1_LDSTI0_LBSPPA1024_LBSPPB1024_LBSPPM0_LPA16_LPB16_LPM0_LRVW8_LWPMn1_MIAV0_MIWT8_8_MO40_NTn1_NTA0_NTB1_NTC0_NTD0_NTM0_NEPBS0_NLCA1_NLCB1_ONLL1_PGR2_PLR1_PKA1_SIA3_SS1_SPO1_SRVW0_SSO1_SVW8_SK3_SKFTR0_SKXCCM0_TLDS1_ULSGRO0_USL1_UIOFGRO0_USFGRO0_VSn1_VWA8_VWB8_WSGRA0_WSGRB0_WS64_WG32_8_1,0.0,1510.58,820.57
256,1,8192,1024,False,torch.bfloat16,torch.bfloat16,False,False,flydsl,103,8,6.3379,flydsl_gemm2_abf16_wbf16_bf16_t16x256x128_split_k8_block_m_warp1_block_n_warp4_async_copyTrue_b_to_ldsFalse_b_preshuffleFalse_c_to_ldsFalse_gfx950,0.0112,2.65,2650.03
256,1,8192,2048,False,torch.bfloat16,torch.bfloat16,False,False,hipblaslt,440304,0,8.761,Cijk_Alik_Bljk_BBS_BH_Bias_HA_S_SAV_UserArgs_MT16x16x256_MI16x16x1_SN_LDSB0_AFC0_AFEM1_AFEM1_ASEM1_CLR1_CADS0_DTLA1_DTLB1_DTVA0_DTVB0_EPS0_FDSI0_GRPM1_GRVWA8_GRVWB8_GSU0_GSUAMB_GLS0_ISA950_IU1_K1_LDSTI0_LBSPPA1024_LBSPPB1024_LBSPPM0_LPA16_LPB16_LPM0_LRVW8_LWPMn1_MIAV0_MIWT1_1_MO40_NTn1_NTA5_NTB0_NTC2_NTD0_NTM0_NEPBS10_NLCA1_NLCB1_ONLL1_PGR2_PLR1_PKA1_SIA3_SS1_SPO0_SRVW0_SSO0_SVW1_SK3_SKFTR0_SKXCCM0_TLDS1_ULSGRO0_USL1_UIOFGRO0_USFGRO1_VSn1_VWA1_VWB1_WSGRA0_WSGRB0_WS64_WG16_4_2,0.0,3.83,3832.32
256,1,8192,8192,False,torch.bfloat16,torch.bfloat16,False,False,hipblaslt,440286,0,23.1091,Cijk_Alik_Bljk_BBS_BH_Bias_HA_S_SAV_UserArgs_MT16x16x256_MI16x16x1_SN_LDSB0_AFC0_AFEM1_AFEM1_ASEM1_CLR1_CADS0_DTLA1_DTLB1_DTVA0_DTVB0_EPS0_FDSI0_GRPM1_GRVWA8_GRVWB8_GSU0_GSUAMB_GLS0_ISA950_IU1_K1_LDSTI0_LBSPPA1024_LBSPPB1024_LBSPPM0_LPA16_LPB16_LPM0_LRVW8_LWPMn1_MIAV0_MIWT1_1_MO40_NTn1_NTA5_NTB2_NTC3_NTD1_NTM0_NEPBS12_NLCA1_NLCB1_ONLL1_PGR2_PLR1_PKA1_SIA3_SS1_SPO0_SRVW0_SSO0_SVW1_SK3_SKFTR0_SKXCCM5_TLDS2_ULSGRO0_USL1_UIOFGRO0_USFGROn1_VSn1_VWA1_VWB1_WSGRA0_WSGRB0_WS64_WG16_4_2,0.0,5.81,5809.42
256,16,8192,1024,False,torch.bfloat16,torch.bfloat16,False,False,hipblaslt,439772,0,6.5729,Cijk_Alik_Bljk_BBS_BH_Bias_HA_S_SAV_UserArgs_MT16x16x256_MI16x16x1_SN_LDSB0_AFC0_AFEM1_AFEM1_ASEM1_CLR1_CADS0_DTLA1_DTLB1_DTVA0_DTVB0_EPS0_FDSI0_GRPM1_GRVWA8_GRVWB8_GSU0_GSUAMB_GLS0_ISA950_IU1_K1_LDSTI0_LBSPPA1024_LBSPPB1024_LBSPPM0_LPA16_LPB16_LPM0_LRVW8_LWPMn1_MIAV0_MIWT1_1_MO40_NTn1_NTA7_NTB1_NTC3_NTD0_NTM0_NEPBS14_NLCA1_NLCB1_ONLL1_PGR2_PLR1_PKA1_SIA3_SS1_SPO1_SRVW0_SSO0_SVW1_SK3_SKFTR0_SKXCCM0_TLDS2_ULSGRO0_USL1_UIOFGRO0_USFGRO1_VSn1_VWA1_VWB1_WSGRA0_WSGRB0_WS64_WG16_4_2,0.0,40.84,2597.35
256,16,8192,2048,False,torch.bfloat16,torch.bfloat16,False,False,hipblaslt,439977,0,9.1174,Cijk_Alik_Bljk_BBS_BH_Bias_HA_S_SAV_UserArgs_MT16x16x256_MI16x16x1_SN_LDSB0_AFC0_AFEM1_AFEM1_ASEM1_CLR1_CADS0_DTLA1_DTLB1_DTVA0_DTVB0_EPS0_FDSI0_GRPM1_GRVWA8_GRVWB8_GSU0_GSUAMB_GLS0_ISA950_IU1_K1_LDSTI0_LBSPPA1024_LBSPPB1024_LBSPPM0_LPA16_LPB16_LPM0_LRVW8_LWPMn1_MIAV1_MIWT1_1_MO40_NTn1_NTA4_NTB2_NTC3_NTD0_NTM0_NEPBS14_NLCA1_NLCB1_ONLL1_PGR2_PLR1_PKA1_SIA3_SS1_SPO0_SRVW0_SSO0_SVW1_SK3_SKFTR0_SKXCCM0_TLDS2_ULSGRO0_USL1_UIOFGRO0_USFGROn1_VSn1_VWA1_VWB1_WSGRA0_WSGRB0_WS64_WG16_4_2,0.0,58.88,3716.2
256,16,8192,8192,False,torch.bfloat16,torch.bfloat16,False,False,hipblaslt,440553,0,24.1955,Cijk_Alik_Bljk_BBS_BH_Bias_HA_S_SAV_UserArgs_MT32x16x256_MI16x16x1_SN_LDSB0_AFC0_AFEM1_AFEM1_ASEM1_CLR1_CADS0_DTLA1_DTLB1_DTVA0_DTVB0_EPS0_FDSI0_GRPM1_GRVWA8_GRVWB8_GSU0_GSUAMB_GLS0_ISA950_IU1_K1_LDSTI0_LBSPPA1024_LBSPPB1024_LBSPPM0_LPA16_LPB16_LPM0_LRVW8_LWPMn1_MIAV1_MIWT2_1_MO40_NTn1_NTA7_NTB1_NTC0_NTD0_NTM0_NEPBS12_NLCA1_NLCB1_ONLL1_PGR2_PLR1_PKA1_SIA3_SS1_SPO0_SRVW0_SSO1_SVW2_SK3_SKFTR0_SKXCCM7_TLDS1_ULSGRO0_USL1_UIOFGRO0_USFGRO0_VSn1_VWA2_VWB1_WSGRA0_WSGRB0_WS64_WG16_4_2,0.0,88.76,5568.89
256,32,8192,1024,False,torch.bfloat16,torch.bfloat16,False,False,triton,0,0,7.1053,auto,0.0,75.56,2444.24
256,32,8192,2048,False,torch.bfloat16,torch.bfloat16,False,False,hipblaslt,440174,0,9.8977,Cijk_Alik_Bljk_BBS_BH_Bias_HA_S_SAV_UserArgs_MT32x32x256_MI16x16x1_SN_LDSB0_AFC0_AFEM1_AFEM1_ASEM1_CLR1_CADS0_DTLA0_DTLB0_DTVA0_DTVB0_EPS0_FDSI0_GRPM1_GRVWA8_GRVWB8_GSU0_GSUAMB_GLS0_ISA950_IU1_K1_LDSTI0_LBSPPA512_LBSPPB512_LBSPPM0_LPA16_LPB16_LPM0_LRVW8_LWPMn1_MIAV1_MIWT1_1_MO40_NTn1_NTA1_NTB2_NTC3_NTD1_NTM0_NEPBS14_NLCA1_NLCB1_ONLL1_PGR2_PLR1_PKA1_SIA3_SS1_SPO0_SRVW0_SSO0_SVW1_SK3_SKFTR0_SKXCCM4_TLDS1_ULSGRO0_USL1_UIOFGRO0_USFGRO1_VSn1_VWA1_VWB1_WSGRA0_WSGRB0_WS64_WG32_8_1,0.0,108.48,3456.34
256,32,8192,8192,False,torch.bfloat16,torch.bfloat16,False,False,hipblaslt,439842,0,27.1079,Cijk_Alik_Bljk_BBS_BH_Bias_HA_S_SAV_UserArgs_MT32x32x256_MI16x16x1_SN_LDSB0_AFC0_AFEM1_AFEM1_ASEM1_CLR1_CADS0_DTLA1_DTLB1_DTVA0_DTVB0_EPS0_FDSI0_GRPM1_GRVWA8_GRVWB8_GSU0_GSUAMB_GLS0_ISA950_IU1_K1_LDSTI0_LBSPPA1024_LBSPPB1024_LBSPPM0_LPA16_LPB16_LPM0_LRVW8_LWPMn1_MIAV1_MIWT1_1_MO40_NTn1_NTA7_NTB1_NTC0_NTD3_NTM0_NEPBS14_NLCA1_NLCB1_ONLL1_PGR2_PLR1_PKA1_SIA3_SS0_SPO1_SRVW0_SSO0_SVW4_SK3_SKFTR0_SKXCCM4_TLDS2_ULSGRO0_USL1_UIOFGRO0_USFGROn1_VSn1_VWA1_VWB1_WSGRA0_WSGRB0_WS64_WG32_8_1,0.0,158.44,4989.92
256,64,8192,2048,False,torch.bfloat16,torch.bfloat16,False,False,hipblaslt,441407,0,12.0362,Cijk_Alik_Bljk_BBS_BH_Bias_HA_S_SAV_UserArgs_MT32x64x256_MI16x16x1_SN_LDSB1_AFC0_AFEM1_AFEM1_ASEM1_CLR1_CADS0_DTLA0_DTLB0_DTVA0_DTVB0_EPS0_FDSI0_GRPM1_GRVWA8_GRVWB8_GSU0_GSUAMB_GLS0_ISA950_IU1_K1_LDSTI0_LBSPPA512_LBSPPB1024_LBSPPM0_LPA16_LPB16_LPM0_LRVW8_LWPMn1_MIAV0_MIWT1_2_MO40_NTn1_NTA0_NTB0_NTC0_NTD0_NTM0_NEPBS0_NLCA1_NLCB1_ONLL1_PGR2_PLR1_PKA1_SIA3_SS1_SPO0_SRVW0_SSO0_SVW1_SK3_SKFTR0_SKXCCM0_TLDS1_ULSGRO0_USL1_UIOFGRO0_USFGRO0_VSn1_VWA1_VWB2_WSGRA0_WSGRB0_WS64_WG32_8_1,0.0,178.42,2896.69
256,64,8192,8192,False,torch.bfloat16,torch.bfloat16,False,False,hipblaslt,439986,0,30.9767,Cijk_Alik_Bljk_BBS_BH_Bias_HA_S_SAV_UserArgs_MT64x64x256_MI16x16x1_SN_LDSB0_AFC0_AFEM1_AFEM1_ASEM1_CLR0_CADS0_DTLA0_DTLB0_DTVA0_DTVB0_EPS0_FDSI0_GRPM1_GRVWA8_GRVWB8_GSU0_GSUAMB_GLS0_ISA950_IU1_K1_LDSTI0_LBSPPA2048_LBSPPB512_LBSPPM0_LPA16_LPB16_LPM0_LRVW8_LWPMn1_MIAV0_MIWT4_1_MO40_NTn1_NTA3_NTB3_NTC7_NTD4_NTM0_NEPBS12_NLCA1_NLCB1_ONLL1_PGR2_PLR1_PKA1_SIA3_SS1_SPO0_SRVW0_SSO0_SVW4_SK3_SKFTR0_SKXCCM5_TLDS1_ULSGRO0_USL1_UIOFGRO0_USFGRO0_VSn1_VWA4_VWB1_WSGRA0_WSGRB0_WS64_WG16_16_1,0.0,277.3,4400.56
256,128,8192,1024,False,torch.bfloat16,torch.bfloat16,False,False,hipblaslt,440262,0,9.1681,Cijk_Alik_Bljk_BBS_BH_Bias_HA_S_SAV_UserArgs_MT64x64x128_MI16x16x1_SN_LDSB0_AFC0_AFEM1_AFEM1_ASEM1_CLR0_CADS0_DTLA0_DTLB0_DTVA0_DTVB0_EPS0_FDSI0_GRPM1_GRVWA8_GRVWB8_GSUAMB_GLS0_ISA950_IU1_K1_LDSTI0_LBSPPA512_LBSPPB512_LBSPPM0_LPA16_LPB16_LPM0_LRVW8_LWPMn1_MIAV0_MIWT2_2_MO40_NTn1_NTA1_NTB3_NTC5_NTD7_NTM0_NEPBS16_NLCA1_NLCB1_ONLL1_PGR2_PLR1_PKA1_SIA3_SS1_SPO0_SRVW0_SSO0_SVW2_SK0_SKFTR0_SKXCCM0_TLDS1_ULSGRO0_USL1_UIOFGRO0_USFGROn1_VSn1_VWA2_VWB2_WSGRA0_WSGRB0_WS64_WG32_8_1,0.0,234.23,2087.29
256,128,8192,2048,False,torch.bfloat16,torch.bfloat16,False,False,hipblaslt,441404,0,13.5214,Cijk_Alik_Bljk_BBS_BH_Bias_HA_S_SAV_UserArgs_MT64x64x256_MI16x16x1_SN_LDSB0_AFC0_AFEM1_AFEM1_ASEM1_CLR0_CADS0_DTLA0_DTLB0_DTVA0_DTVB0_EPS0_FDSI0_GRPM1_GRVWA8_GRVWB8_GSU0_GSUAMB_GLS0_ISA950_IU1_K1_LDSTI0_LBSPPA1024_LBSPPB1024_LBSPPM0_LPA16_LPB16_LPM0_LRVW8_LWPMn1_MIAV1_MIWT2_2_MO40_NTn1_NTA0_NTB0_NTC3_NTD3_NTM0_NEPBS16_NLCA1_NLCB1_ONLL1_PGR2_PLR1_PKA1_SIA3_SS1_SPO0_SRVW0_SSO0_SVW2_SK3_SKFTR0_SKXCCM0_TLDS1_ULSGRO0_USL1_UIOFGRO0_USFGRO0_VSn1_VWA2_VWB2_WSGRA0_WSGRB0_WS64_WG32_8_1,0.0,317.64,2675.45
256,128,8192,8192,False,torch.bfloat16,torch.bfloat16,False,False,hipblaslt,439646,0,37.1858,Cijk_Alik_Bljk_BBS_BH_Bias_HA_S_SAV_UserArgs_MT64x128x128_MI16x16x1_SN_LDSB0_AFC0_AFEM1_AFEM1_ASEM1_CLR0_CADS0_DTLA1_DTLB1_DTVA0_DTVB0_EPS0_FDSI0_GRPM1_GRVWA8_GRVWB8_GSU0_GSUAMB_GLS0_ISA950_IU1_K1_LDSTI0_LBSPPA1024_LBSPPB1024_LBSPPM0_LPA16_LPB16_LPM0_LRVW8_LWPMn1_MIAV0_MIWT4_2_MO40_NTn1_NTA0_NTB0_NTC7_NTD5_NTM0_NEPBS12_NLCA1_NLCB1_ONLL1_PGR2_PLR1_PKA1_SIA3_SS1_SPO1_SRVW0_SSO0_SVW4_SK3_SKFTR0_SKXCCM5_TLDS2_ULSGRO0_USL1_UIOFGRO0_USFGRO1_VSn1_VWA4_VWB2_WSGRA0_WSGRB0_WS64_WG16_16_1,0.0,462.0,3722.17
256,256,8192,1024,False,torch.bfloat16,torch.bfloat16,False,False,hipblaslt,440196,0,11.4458,Cijk_Alik_Bljk_BBS_BH_Bias_HA_S_SAV_UserArgs_MT64x128x128_MI16x16x1_SN_LDSB0_AFC0_AFEM1_AFEM1_ASEM1_CLR1_CADS0_DTLA1_DTLB1_DTVA0_DTVB0_EPS0_FDSI0_GRPM1_GRVWA8_GRVWB8_GSU0_GSUAMB_GLS0_ISA950_IU1_K1_LDSTI0_LBSPPA1024_LBSPPB1024_LBSPPM0_LPA16_LPB16_LPM0_LRVW8_LWPMn1_MIAV1_MIWT4_2_MO40_NTn1_NTA4_NTB2_NTC3_NTD3_NTM0_NEPBS10_NLCA1_NLCB1_ONLL1_PGR2_PLR1_PKA1_SIA3_SS1_SPO0_SRVW0_SSO0_SVW4_SK3_SKFTR0_SKXCCM4_TLDS1_ULSGRO0_USL1_UIOFGRO0_USFGROn1_VSn1_VWA4_VWB2_WSGRA0_WSGRB0_WS64_WG16_16_1,0.0,375.24,1878.05
256,256,8192,2048,False,torch.bfloat16,torch.bfloat16,False,False,hipblaslt,440054,0,17.9759,Cijk_Alik_Bljk_BBS_BH_Bias_HA_S_SAV_UserArgs_MT64x128x128_MI16x16x1_SN_LDSB0_AFC0_AFEM1_AFEM1_ASEM1_CLR1_CADS0_DTLA0_DTLB0_DTVA0_DTVB0_EPS0_FDSI0_GRPM1_GRVWA8_GRVWB8_GSUAMB_GLS0_ISA950_IU1_K1_LDSTI0_LBSPPA1024_LBSPPB512_LBSPPM0_LPA16_LPB16_LPM0_LRVW8_LWPMn1_MIAV1_MIWT4_2_MO40_NTn1_NTA2_NTB2_NTC4_NTD5_NTM0_NEPBS12_NLCA1_NLCB1_ONLL1_PGR2_PLR1_PKA1_SIA3_SS1_SPO0_SRVW0_SSO0_SVW4_SK0_SKFTR0_SKXCCM0_TLDS2_ULSGRO0_USL1_UIOFGRO0_USFGROn1_VSn1_VWA4_VWB2_WSGRA0_WSGRB0_WS64_WG16_16_1,0.0,477.86,2158.3
256,256,8192,8192,False,torch.bfloat16,torch.bfloat16,False,False,hipblaslt,440197,0,47.9098,Cijk_Alik_Bljk_BBS_BH_Bias_HA_S_SAV_UserArgs_MT128x128x128_MI32x32x1_SN_LDSB0_AFC0_AFEM1_AFEM1_ASEM1_CLR1_CADS0_DTLA0_DTLB0_DTVA0_DTVB0_EPS0_FDSI0_GRPM1_GRVWA8_GRVWB8_GSU0_GSUAMB_GLS0_ISA950_IU1_K1_LDSTI0_LBSPPA1024_LBSPPB256_LBSPPM0_LPA8_LPB8_LPM0_LRVW8_LWPMn1_MIAV0_MIWT4_1_MO40_NTn1_NTA5_NTB0_NTC6_NTD0_NTM0_NEPBS16_NLCA1_NLCB1_ONLL1_PGR2_PLR1_PKA1_SIA3_SS1_SPO0_SRVW0_SSO0_SVW4_SK3_SKFTR0_SKXCCM8_TLDS2_ULSGRO0_USL1_UIOFGRO0_USFGRO0_VSn1_VWA4_VWB1_WSGRA0_WSGRB0_WS64_WG32_8_1,0.0,717.18,2976.56
256,512,8192,1024,False,torch.bfloat16,torch.bfloat16,False,False,hipblaslt,439871,0,15.129,Cijk_Alik_Bljk_BBS_BH_Bias_HA_S_SAV_UserArgs_MT128x128x64_MI32x32x1_SN_LDSB0_AFC0_AFEM1_AFEM1_ASEM1_CLR1_CADS0_DTLA0_DTLB0_DTVA0_DTVB0_EPS0_FDSI0_GRPM1_GRVWA8_GRVWB8_GSU0_GSUAMB_GLS0_ISA950_IU1_K1_LDSTI0_LBSPPA256_LBSPPB256_LBSPPM0_LPA8_LPB8_LPM0_LRVW8_LWPMn1_MIAV0_MIWT2_2_MO40_NTn1_NTA2_NTB1_NTC3_NTD5_NTM0_NEPBS0_NLCA1_NLCB1_ONLL1_PGR2_PLR1_PKA1_SIA3_SS1_SPO1_SRVW0_SSO1_SVW2_SK3_SKFTR0_SKXCCM0_TLDS1_ULSGRO0_USL1_UIOFGRO0_USFGRO1_VSn1_VWA2_VWB2_WSGRA0_WSGRB0_WS64_WG64_4_1,0.0,567.78,1732.73
256,512,8192,2048,False,torch.bfloat16,torch.bfloat16,False,False,hipblaslt,440209,0,22.6168,Cijk_Alik_Bljk_BBS_BH_Bias_HA_S_SAV_UserArgs_MT128x128x128_MI16x16x1_SN_LDSB0_AFC0_AFEM1_AFEM1_ASEM1_CLR0_CADS0_DTLA0_DTLB0_DTVA0_DTVB0_EPS0_FDSI0_GRPM1_GRVWA8_GRVWB8_GSU0_GSUAMB_GLS0_ISA950_IU1_K1_LDSTI0_LBSPPA1024_LBSPPB1024_LBSPPM0_LPA16_LPB16_LPM0_LRVW8_LWPMn1_MIAV1_MIWT4_4_MO40_NTn1_NTA7_NTB2_NTC2_NTD2_NTM0_NEPBS0_NLCA1_NLCB1_ONLL1_PGR2_PLR1_PKA1_SIA3_SS1_SPO1_SRVW0_SSO0_SVW4_SK3_SKFTR0_SKXCCM8_TLDS1_ULSGRO0_USL1_UIOFGRO0_USFGRO0_VSn1_VWA4_VWB4_WSGRA0_WSGRB0_WS64_WG32_8_1,0.0,759.61,1947.23
256,512,8192,8192,False,torch.bfloat16,torch.bfloat16,False,False,hipblaslt,440298,0,75.6048,Cijk_Alik_Bljk_BBS_BH_Bias_HA_S_SAV_UserArgs_MT128x256x64_MI32x32x1_SN_LDSB0_AFC0_AFEM1_AFEM1_ASEM1_CLR0_CADS0_DTLA0_DTLB0_DTVA0_DTVB0_EPS0_FDSI0_GRPM1_GRVWA8_GRVWB8_GSU0_GSUAMB_GLS0_ISA950_IU1_K1_LDSTI0_LBSPPA256_LBSPPB512_LBSPPM0_LPA8_LPB8_LPM0_LRVW8_LWPMn1_MIAV0_MIWT2_4_MO40_NTn1_NTA4_NTB3_NTC6_NTD3_NTM0_NEPBS8_NLCA1_NLCB1_ONLL1_PGR2_PLR1_PKA1_SIA3_SS1_SPO0_SRVW0_SSO1_SVW2_SK3_SKFTR0_SKXCCM4_TLDS2_ULSGRO0_USL1_UIOFGRO0_USFGRO0_VSn1_VWA2_VWB4_WSGRA0_WSGRB0_WS64_WG64_4_1,0.0,908.93,1997.16
256,1024,8192,1024,False,torch.bfloat16,torch.bfloat16,False,False,hipblaslt,440203,0,20.4515,Cijk_Alik_Bljk_BBS_BH_Bias_HA_S_SAV_UserArgs_MT256x128x64_MI16x16x1_SN_LDSB0_AFC0_AFEM1_AFEM1_ASEM1_CLR1_CADS0_DTLA1_DTLB1_DTVA0_DTVB0_EPS0_FDSI0_GRPM1_GRVWA8_GRVWB8_GSU0_GSUAMB_GLS0_ISA950_IU1_K1_LDSTI0_LBSPPA1024_LBSPPB1024_LBSPPM0_LPA16_LPB16_LPM0_LRVW8_LWPMn1_MIAV0_MIWT8_4_MO40_NTn1_NTA3_NTB3_NTC4_NTD7_NTM0_NEPBS0_NLCA1_NLCB1_ONLL1_PGR2_PLR1_PKA1_SIA3_SS1_SPO0_SRVW0_SSO1_SVW8_SK3_SKFTR0_SKXCCM8_TLDS1_ULSGRO0_USL1_UIOFGRO0_USFGROn1_VSn1_VWA8_VWB4_WSGRA0_WSGRB0_WS64_WG32_8_1,0.0,840.03,1743.23
256,1024,8192,2048,False,torch.bfloat16,torch.bfloat16,False,False,hipblaslt,440412,0,34.7945,Cijk_Alik_Bljk_BBS_BH_Bias_HA_S_SAV_UserArgs_MT256x128x64_MI16x16x1_SN_LDSB0_AFC1_AFEM1_AFEM1_ASEM1_CLR0_CADS0_DTLA1_DTLB1_DTVA0_DTVB0_EPS0_FDSI0_GRPM1_GRVWA8_GRVWB8_GSU0_GSUAMB_GLS0_ISA950_IU1_K1_LDSTI0_LBSPPA1024_LBSPPB1024_LBSPPM0_LPA16_LPB16_LPM0_LRVW8_LWPMn1_MIAV0_MIWT8_4_MO40_NTn1_NTA2_NTB3_NTC5_NTD5_NTM0_NEPBS0_NLCA1_NLCB1_ONLL1_PGR2_PLR1_PKA1_SIA3_SS1_SPO0_SRVW0_SSO0_SVW8_SK3_SKFTR0_SKXCCM0_TLDS1_ULSGRO0_USL1_UIOFGRO0_USFGRO1_VSn1_VWA8_VWB4_WSGRA0_WSGRB0_WS64_WG32_8_1,0.0,987.5,1567.09
256,1024,8192,8192,False,torch.bfloat16,torch.bfloat16,False,False,hipblaslt,440491,0,121.6111,Cijk_Alik_Bljk_BBS_BH_Bias_HA_S_SAV_UserArgs_MT256x256x64_MI16x16x1_CMS_SN_LDSB0_AFC1_AFEM1_AFEM1_ASEM1_CLR1_CADS0_DTLA1_DTLB1_DTVA0_DTVB0_EPS0_FDSI0_GRPM1_GRVWA8_GRVWB8_GSU0_GSUAMB_GLS0_ISA950_IU1_K1_LDSTI0_LBSPPA1024_LBSPPB1024_LBSPPM0_LPA16_LPB16_LPM0_LRVW8_LWPMn1_MIAV0_MIWT8_8_MO40_NTn1_NTA3_NTB3_NTC5_NTD2_NTM0_NEPBS10_NLCA1_NLCB1_ONLL1_PGR2_PLR1_PKA1_SIA3_SS1_SPO0_SRVW0_SSO0_SVW8_SK3_SKFTR0_SKXCCM4_TLDS1_ULSGRO0_USL1_UIOFGRO0_USFGRO0_VSn1_VWA8_VWB8_WSGRA0_WSGRB0_WS64_WG32_8_1,0.0,1130.15,1379.58
256,2048,8192,1024,False,torch.bfloat16,torch.bfloat16,False,False,hipblaslt,440620,0,31.4274,Cijk_Alik_Bljk_BBS_BH_Bias_HA_S_SAV_UserArgs_MT256x256x64_MI16x16x1_CMS_SN_LDSB0_AFC0_AFEM1_AFEM1_ASEM1_CLR1_CADS0_DTLA1_DTLB1_DTVA0_DTVB0_EPS0_FDSI0_GRPM1_GRVWA8_GRVWB8_GSU0_GSUAMB_GLS0_ISA950_IU1_K1_LDSTI0_LBSPPA1024_LBSPPB1024_LBSPPM0_LPA16_LPB16_LPM0_LRVW8_LWPMn1_MIAV0_MIWT8_8_MO40_NTn1_NTA2_NTB1_NTC1_NTD2_NTM0_NEPBS16_NLCA1_NLCB1_ONLL1_PGR2_PLR1_PKA1_SIA3_SS1_SPO1_SRVW0_SSO0_SVW8_SK3_SKFTR0_SKXCCM0_TLDS1_ULSGRO0_USL1_UIOFGRO0_USFGRO0_VSn1_VWA8_VWB8_WSGRA0_WSGRB0_WS64_WG32_8_1,0.0,1093.31,1734.98
256,2048,8192,2048,False,torch.bfloat16,torch.bfloat16,False,False,hipblaslt,440543,0,54.003,Cijk_Alik_Bljk_BBS_BH_Bias_HA_S_SAV_UserArgs_MT256x256x64_MI16x16x1_CMS_SN_LDSB0_AFC1_AFEM1_AFEM1_ASEM1_CLR0_CADS0_DTLA1_DTLB1_DTVA0_DTVB0_EPS0_FDSI0_GRPM1_GRVWA8_GRVWB8_GSU0_GSUAMB_GLS0_ISA950_IU1_K1_LDSTI0_LBSPPA1024_LBSPPB1024_LBSPPM0_LPA16_LPB16_LPM0_LRVW8_LWPMn1_MIAV0_MIWT8_8_MO40_NTn1_NTA2_NTB1_NTC7_NTD4_NTM0_NEPBS0_NLCA1_NLCB1_ONLL1_PGR2_PLR1_PKA1_SIA3_SS1_SPO0_SRVW0_SSO1_SVW8_SK3_SKFTR0_SKXCCM8_TLDS1_ULSGRO0_USL1_UIOFGRO0_USFGRO0_VSn1_VWA8_VWB8_WSGRA0_WSGRB0_WS64_WG32_8_1,0.0,1272.51,1398.02
256,2048,8192,8192,False,torch.bfloat16,torch.bfloat16,False,False,hipblaslt,440503,0,189.4633,Cijk_Alik_Bljk_BBS_BH_Bias_HA_S_SAV_UserArgs_MT256x256x64_MI16x16x1_CMS_SN_LDSB0_AFC1_AFEM1_AFEM1_ASEM1_CLR0_CADS0_DTLA1_DTLB1_DTVA0_DTVB0_EPS0_FDSI0_GRPM1_GRVWA8_GRVWB8_GSU0_GSUAMB_GLS0_ISA950_IU1_K1_LDSTI0_LBSPPA1024_LBSPPB1024_LBSPPM0_LPA16_LPB16_LPM0_LRVW8_LWPMn1_MIAV0_MIWT8_8_MO40_NTn1_NTA0_NTB2_NTC5_NTD7_NTM0_NEPBS12_NLCA1_NLCB1_ONLL1_PGR2_PLR1_PKA1_SIA3_SS1_SPO0_SRVW0_SSO0_SVW8_SK3_SKFTR0_SKXCCM8_TLDS1_ULSGRO0_USL1_UIOFGRO0_USFGRO0_VSn1_VWA8_VWB8_WSGRA0_WSGRB0_WS64_WG32_8_1,0.0,1450.82,1062.62
256,4096,8192,1024,False,torch.bfloat16,torch.bfloat16,False,False,hipblaslt,439452,0,61.2463,Cijk_Alik_Bljk_BBS_BH_Bias_HA_S_SAV_UserArgs_MT256x256x64_MI16x16x1_CMS_SN_LDSB0_AFC0_AFEM1_AFEM1_ASEM1_CLR1_CADS0_DTLA1_DTLB1_DTVA0_DTVB0_EPS0_FDSI0_GRPM1_GRVWA8_GRVWB8_GSU0_GSUAMB_GLS0_ISA950_IU1_K1_LDSTI0_LBSPPA1024_LBSPPB1024_LBSPPM0_LPA16_LPB16_LPM0_LRVW8_LWPMn1_MIAV0_MIWT8_8_MO40_NTn1_NTA0_NTB0_NTC0_NTD4_NTM0_NEPBS0_NLCA1_NLCB1_ONLL1_PGR2_PLR1_PKA1_SIA3_SS1_SPO0_SRVW0_SSO0_SVW8_SK3_SKFTR0_SKXCCM0_TLDS1_ULSGRO0_USL1_UIOFGRO0_USFGRO0_VSn1_VWA8_VWB8_WSGRA0_WSGRB0_WS64_WG32_8_1,0.0,1122.02,1506.62
256,4096,8192,2048,False,torch.bfloat16,torch.bfloat16,False,False,hipblaslt,440335,0,104.9472,Cijk_Alik_Bljk_BBS_BH_Bias_HA_S_SAV_UserArgs_MT256x256x64_MI16x16x1_CMS_SN_LDSB0_AFC0_AFEM1_AFEM1_ASEM1_CLR1_CADS0_DTLA1_DTLB1_DTVA0_DTVB0_EPS0_FDSI0_GRPM1_GRVWA8_GRVWB8_GSU0_GSUAMB_GLS0_ISA950_IU1_K1_LDSTI0_LBSPPA1024_LBSPPB1024_LBSPPM0_LPA16_LPB16_LPM0_LRVW8_LWPMn1_MIAV0_MIWT8_8_MO40_NTn1_NTA1_NTB3_NTC5_NTD4_NTM0_NEPBS16_NLCA1_NLCB1_ONLL1_PGR2_PLR1_PKA1_SIA3_SS1_SPO1_SRVW0_SSO4_SVW8_SK3_SKFTR0_SKXCCM0_TLDS1_ULSGRO0_USL1_UIOFGRO0_USFGRO0_VSn1_VWA8_VWB8_WSGRA0_WSGRB0_WS64_WG32_8_1,0.0,1309.6,1119.04
256,4096,8192,8192,False,torch.bfloat16,torch.bfloat16,False,False,hipblaslt,440333,0,363.0173,Cijk_Alik_Bljk_BBS_BH_Bias_HA_S_SAV_UserArgs_MT256x256x64_MI16x16x1_CMS_SN_LDSB0_AFC0_AFEM1_AFEM1_ASEM1_CLR0_CADS0_DTLA1_DTLB1_DTVA0_DTVB0_EPS0_FDSI0_GRPM1_GRVWA8_GRVWB8_GSU0_GSUAMB_GLS0_ISA950_IU1_K1_LDSTI0_LBSPPA1024_LBSPPB1024_LBSPPM0_LPA16_LPB16_LPM0_LRVW8_LWPMn1_MIAV0_MIWT8_8_MO40_NTn1_NTA2_NTB1_NTC5_NTD0_NTM0_NEPBS8_NLCA1_NLCB1_ONLL1_PGR2_PLR1_PKA1_SIA3_SS1_SPO1_SRVW0_SSO1_SVW8_SK3_SKFTR0_SKXCCM0_TLDS1_ULSGRO0_USL1_UIOFGRO0_USFGRO0_VSn1_VWA8_VWB8_WSGRA0_WSGRB0_WS64_WG32_8_1,0.0,1514.41,739.46
256,8192,8192,1024,False,torch.bfloat16,torch.bfloat16,False,False,asm,10,1,122.5229,_ZN5aiter24bf16gemm_bf16_tn_256x256E,0.0,1121.74,1369.31
256,8192,8192,2048,False,torch.bfloat16,torch.bfloat16,False,False,hipblaslt,440543,0,204.6234,Cijk_Alik_Bljk_BBS_BH_Bias_HA_S_SAV_UserArgs_MT256x256x64_MI16x16x1_CMS_SN_LDSB0_AFC1_AFEM1_AFEM1_ASEM1_CLR0_CADS0_DTLA1_DTLB1_DTVA0_DTVB0_EPS0_FDSI0_GRPM1_GRVWA8_GRVWB8_GSU0_GSUAMB_GLS0_ISA950_IU1_K1_LDSTI0_LBSPPA1024_LBSPPB1024_LBSPPM0_LPA16_LPB16_LPM0_LRVW8_LWPMn1_MIAV0_MIWT8_8_MO40_NTn1_NTA2_NTB1_NTC7_NTD4_NTM0_NEPBS0_NLCA1_NLCB1_ONLL1_PGR2_PLR1_PKA1_SIA3_SS1_SPO0_SRVW0_SSO1_SVW8_SK3_SKFTR0_SKXCCM8_TLDS1_ULSGRO0_USL1_UIOFGRO0_USFGRO0_VSn1_VWA8_VWB8_WSGRA0_WSGRB0_WS64_WG32_8_1,0.0,1343.34,983.89
256,8192,8192,8192,False,torch.bfloat16,torch.bfloat16,False,False,hipblaslt,440588,0,710.6239,Cijk_Alik_Bljk_BBS_BH_Bias_HA_S_SAV_UserArgs_MT256x256x64_MI16x16x1_CMS_SN_LDSB0_AFC0_AFEM1_AFEM1_ASEM1_CLR1_CADS0_DTLA1_DTLB1_DTVA0_DTVB0_EPS0_FDSI0_GRPM1_GRVWA8_GRVWB8_GSU0_GSUAMB_GLS0_ISA950_IU1_K1_LDSTI0_LBSPPA1024_LBSPPB1024_LBSPPM0_LPA16_LPB16_LPM0_LRVW8_LWPMn1_MIAV0_MIWT8_8_MO40_NTn1_NTA1_NTB0_NTC7_NTD5_NTM0_NEPBS16_NLCA1_NLCB1_ONLL1_PGR2_PLR1_PKA1_SIA3_SS1_SPO0_SRVW0_SSO1_SVW8_SK3_SKFTR0_SKXCCM0_TLDS1_ULSGRO0_USL1_UIOFGRO0_USFGRO0_VSn1_VWA8_VWB8_WSGRA0_WSGRB0_WS64_WG32_8_1,0.0,1547.25,566.62
256,16384,8192,1024,False,torch.bfloat16,torch.bfloat16,False,False,hipblaslt,439452,0,232.4281,Cijk_Alik_Bljk_BBS_BH_Bias_HA_S_SAV_UserArgs_MT256x256x64_MI16x16x1_CMS_SN_LDSB0_AFC0_AFEM1_AFEM1_ASEM1_CLR1_CADS0_DTLA1_DTLB1_DTVA0_DTVB0_EPS0_FDSI0_GRPM1_GRVWA8_GRVWB8_GSU0_GSUAMB_GLS0_ISA950_IU1_K1_LDSTI0_LBSPPA1024_LBSPPB1024_LBSPPM0_LPA16_LPB16_LPM0_LRVW8_LWPMn1_MIAV0_MIWT8_8_MO40_NTn1_NTA0_NTB0_NTC0_NTD4_NTM0_NEPBS0_NLCA1_NLCB1_ONLL1_PGR2_PLR1_PKA1_SIA3_SS1_SPO0_SRVW0_SSO0_SVW8_SK3_SKFTR0_SKXCCM0_TLDS1_ULSGRO0_USL1_UIOFGRO0_USFGRO0_VSn1_VWA8_VWB8_WSGRA0_WSGRB0_WS64_WG32_8_1,0.0,1182.64,1371.47
256,16384,8192,2048,False,torch.bfloat16,torch.bfloat16,False,False,hipblaslt,440544,0,395.3056,Cijk_Alik_Bljk_BBS_BH_Bias_HA_S_SAV_UserArgs_MT256x256x64_MI16x16x1_CMS_SN_LDSB0_AFC1_AFEM1_AFEM1_ASEM1_CLR0_CADS0_DTLA1_DTLB1_DTVA0_DTVB0_EPS0_FDSI0_GRPM1_GRVWA8_GRVWB8_GSU0_GSUAMB_GLS0_ISA950_IU1_K1_LDSTI0_LBSPPA1024_LBSPPB1024_LBSPPM0_LPA16_LPB16_LPM0_LRVW8_LWPMn1_MIAV0_MIWT8_8_MO40_NTn1_NTA2_NTB0_NTC7_NTD7_NTM0_NEPBS16_NLCA1_NLCB1_ONLL1_PGR2_PLR1_PKA1_SIA3_SS1_SPO1_SRVW0_SSO1_SVW8_SK3_SKFTR0_SKXCCM0_TLDS1_ULSGRO0_USL1_UIOFGRO0_USFGRO0_VSn1_VWA8_VWB8_WSGRA0_WSGRB0_WS64_WG32_8_1,0.0,1390.71,933.7
256,16384,8192,8192,False,torch.bfloat16,torch.bfloat16,False,False,hipblaslt,440502,0,1407.8259,Cijk_Alik_Bljk_BBS_BH_Bias_HA_S_SAV_UserArgs_MT256x256x64_MI16x16x1_CMS_SN_LDSB0_AFC1_AFEM1_AFEM1_ASEM1_CLR1_CADS0_DTLA1_DTLB1_DTVA0_DTVB0_EPS0_FDSI0_GRPM1_GRVWA8_GRVWB8_GSU0_GSUAMB_GLS0_ISA950_IU1_K1_LDSTI0_LBSPPA1024_LBSPPB1024_LBSPPM0_LPA16_LPB16_LPM0_LRVW8_LWPMn1_MIAV0_MIWT8_8_MO40_NTn1_NTA2_NTB3_NTC0_NTD7_NTM0_NEPBS0_NLCA1_NLCB1_ONLL1_PGR2_PLR1_PKA1_SIA3_SS1_SPO0_SRVW0_SSO1_SVW8_SK3_SKFTR0_SKXCCM4_TLDS1_ULSGRO0_USL1_UIOFGRO0_USFGRO0_VSn1_VWA8_VWB8_WSGRA0_WSGRB0_WS64_WG32_8_1,0.0,1562.0,476.68
256,32768,8192,1024,False,torch.bfloat16,torch.bfloat16,False,False,hipblaslt,440528,0,453.3644,Cijk_Alik_Bljk_BBS_BH_Bias_HA_S_SAV_UserArgs_MT256x256x64_MI16x16x1_CMS_SN_LDSB0_AFC1_AFEM1_AFEM1_ASEM1_CLR0_CADS0_DTLA1_DTLB1_DTVA0_DTVB0_EPS0_FDSI0_GRPM1_GRVWA8_GRVWB8_GSU0_GSUAMB_GLS0_ISA950_IU1_K1_LDSTI0_LBSPPA1024_LBSPPB1024_LBSPPM0_LPA16_LPB16_LPM0_LRVW8_LWPMn1_MIAV0_MIWT8_8_MO40_NTn1_NTA0_NTB3_NTC5_NTD4_NTM0_NEPBS0_NLCA1_NLCB1_ONLL1_PGR2_PLR1_PKA1_SIA3_SS1_SPO0_SRVW0_SSO0_SVW8_SK3_SKFTR0_SKXCCM4_TLDS1_ULSGRO0_USL1_UIOFGRO0_USFGRO0_VSn1_VWA8_VWB8_WSGRA0_WSGRB0_WS64_WG32_8_1,0.0,1212.61,1369.22
256,32768,8192,2048,False,torch.bfloat16,torch.bfloat16,False,False,hipblaslt,440624,0,779.1373,Cijk_Alik_Bljk_BBS_BH_Bias_HA_S_SAV_UserArgs_MT256x256x64_MI16x16x1_CMS_SN_LDSB0_AFC0_AFEM1_AFEM1_ASEM1_CLR1_CADS0_DTLA1_DTLB1_DTVA0_DTVB0_EPS0_FDSI0_GRPM1_GRVWA8_GRVWB8_GSU0_GSUAMB_GLS0_ISA950_IU1_K1_LDSTI0_LBSPPA1024_LBSPPB1024_LBSPPM0_LPA16_LPB16_LPM0_LRVW8_LWPMn1_MIAV0_MIWT8_8_MO40_NTn1_NTA1_NTB3_NTC4_NTD5_NTM0_NEPBS16_NLCA1_NLCB1_ONLL1_PGR2_PLR1_PKA1_SIA3_SS1_SPO1_SRVW0_SSO0_SVW8_SK3_SKFTR0_SKXCCM0_TLDS1_ULSGRO0_USL1_UIOFGRO0_USFGRO0_VSn1_VWA8_VWB8_WSGRA0_WSGRB0_WS64_WG32_8_1,0.0,1411.19,904.39
256,32768,8192,8192,False,torch.bfloat16,torch.bfloat16,False,False,asm,10,1,3026.2195,_ZN5aiter24bf16gemm_bf16_tn_256x256E,0.0,1453.31,399.16
256,1,10240,8192,False,torch.bfloat16,torch.bfloat16,False,False,hipblaslt,440307,0,29.3707,Cijk_Alik_Bljk_BBS_BH_Bias_HA_S_SAV_UserArgs_MT16x16x256_MI16x16x1_SN_LDSB1_AFC0_AFEM1_AFEM1_ASEM1_CLR1_CADS0_DTLA0_DTLB0_DTVA0_DTVB0_EPS0_FDSI0_GRPM1_GRVWA8_GRVWB8_GSU0_GSUAMB_GLS0_ISA950_IU1_K1_LDSTI0_LBSPPA512_LBSPPB512_LBSPPM0_LPA16_LPB16_LPM0_LRVW8_LWPMn1_MIAV0_MIWT1_1_MO40_NTn1_NTA7_NTB0_NTC3_NTD0_NTM0_NEPBS0_NLCA1_NLCB1_ONLL1_PGR2_PLR1_PKA1_SIA3_SS0_SPO0_SRVW0_SSO0_SVW4_SK3_SKFTR0_SKXCCM0_TLDS1_ULSGRO0_USL1_UIOFGRO0_USFGRO0_VSn1_VWA1_VWB1_WSGRA0_WSGRB0_WS64_WG16_4_1,0.0,5.71,5713.48
256,16,10240,8192,False,torch.bfloat16,torch.bfloat16,False,False,hipblaslt,439912,0,30.8036,Cijk_Alik_Bljk_BBS_BH_Bias_HA_S_SAV_UserArgs_MT48x32x256_MI16x16x1_SN_LDSB0_AFC0_AFEM1_AFEM1_ASEM1_CLR1_CADS0_DTLA1_DTLB1_DTVA0_DTVB0_EPS0_FDSI0_GRPM1_GRVWA8_GRVWB8_GSU0_GSUAMB_GLS0_ISA950_IU1_K1_LDSTI0_LBSPPA1024_LBSPPB1024_LBSPPM0_LPA16_LPB16_LPM0_LRVW8_LWPMn1_MIAV0_MIWT3_1_MO40_NTn1_NTA4_NTB3_NTC2_NTD2_NTM0_NEPBS0_NLCA1_NLCB1_ONLL1_PGR2_PLR1_PKA1_SIA3_SS0_SPO1_SRVW0_SSO0_SVW4_SK3_SKFTR0_SKXCCM0_TLDS2_ULSGRO0_USL1_UIOFGRO0_USFGRO0_VSn1_VWA1_VWB1_WSGRA0_WSGRB0_WS64_WG16_8_1,0.0,87.14,5465.66
256,32,10240,8192,False,torch.bfloat16,torch.bfloat16,False,False,hipblaslt,439912,0,31.1015,Cijk_Alik_Bljk_BBS_BH_Bias_HA_S_SAV_UserArgs_MT48x32x256_MI16x16x1_SN_LDSB0_AFC0_AFEM1_AFEM1_ASEM1_CLR1_CADS0_DTLA1_DTLB1_DTVA0_DTVB0_EPS0_FDSI0_GRPM1_GRVWA8_GRVWB8_GSU0_GSUAMB_GLS0_ISA950_IU1_K1_LDSTI0_LBSPPA1024_LBSPPB1024_LBSPPM0_LPA16_LPB16_LPM0_LRVW8_LWPMn1_MIAV0_MIWT3_1_MO40_NTn1_NTA4_NTB3_NTC2_NTD2_NTM0_NEPBS0_NLCA1_NLCB1_ONLL1_PGR2_PLR1_PKA1_SIA3_SS0_SPO1_SRVW0_SSO0_SVW4_SK3_SKFTR0_SKXCCM0_TLDS2_ULSGRO0_USL1_UIOFGRO0_USFGRO0_VSn1_VWA1_VWB1_WSGRA0_WSGRB0_WS64_WG16_8_1,0.0,172.62,5432.27
256,64,10240,8192,False,torch.bfloat16,torch.bfloat16,False,False,hipblaslt,439915,0,34.2047,Cijk_Alik_Bljk_BBS_BH_Bias_HA_S_SAV_UserArgs_MT80x64x256_MI16x16x1_SN_LDSB0_AFC0_AFEM1_AFEM1_ASEM1_CLR0_CADS0_DTLA0_DTLB0_DTVA0_DTVB0_EPS0_FDSI0_GRPM1_GRVWA8_GRVWB8_GSU0_GSUAMB_GLS0_ISA950_IU1_K1_LDSTI0_LBSPPA512_LBSPPB512_LBSPPM0_LPA16_LPB16_LPM0_LRVW8_LWPMn1_MIAV0_MIWT5_1_MO40_NTn1_NTA5_NTB2_NTC1_NTD3_NTM0_NEPBS16_NLCA1_NLCB1_ONLL1_PGR2_PLR1_PKA1_SIA3_SS0_SPO1_SRVW0_SSO0_SVW4_SK3_SKFTR0_SKXCCM0_TLDS2_ULSGRO0_USL1_UIOFGRO0_USFGRO0_VSn1_VWA1_VWB1_WSGRA0_WSGRB0_WS64_WG16_16_1,0.0,313.92,4973.92
256,128,10240,8192,False,torch.bfloat16,torch.bfloat16,False,False,hipblaslt,440299,0,40.4695,Cijk_Alik_Bljk_BBS_BH_Bias_HA_S_SAV_UserArgs_MT80x128x128_MI16x16x1_SN_LDSB0_AFC0_AFEM1_AFEM1_ASEM1_CLR0_CADS0_DTLA0_DTLB0_DTVA0_DTVB0_EPS0_FDSI0_GRPM1_GRVWA8_GRVWB8_GSU0_GSUAMB_GLS0_ISA950_IU1_K1_LDSTI0_LBSPPA256_LBSPPB512_LBSPPM0_LPA16_LPB16_LPM0_LRVW8_LWPMn1_MIAV0_MIWT5_2_MO40_NTn1_NTA5_NTB3_NTC0_NTD1_NTM0_NEPBS0_NLCA1_NLCB1_ONLL1_PGR2_PLR1_PKA1_SIA3_SS1_SPO1_SRVW0_SSO1_SVW1_SK3_SKFTR0_SKXCCM0_TLDS1_ULSGRO0_USL1_UIOFGRO0_USFGRO0_VSn1_VWA1_VWB2_WSGRA0_WSGRB0_WS64_WG16_16_1,0.0,530.64,4262.24
256,256,10240,8192,False,torch.bfloat16,torch.bfloat16,False,False,hipblaslt,440791,0,57.6827,Cijk_Alik_Bljk_BBS_BH_Bias_HA_S_SAV_UserArgs_MT160x256x64_MI16x16x1_SN_LDSB0_AFC0_AFEM1_AFEM1_ASEM1_CLR1_CADS0_DTLA0_DTLB0_DTVA0_DTVB0_EPS0_FDSI0_GRPM1_GRVWA8_GRVWB8_GSU0_GSUAMB_GLS0_ISA950_IU1_K1_LDSTI0_LBSPPA128_LBSPPB1024_LBSPPM0_LPA16_LPB16_LPM0_LRVW8_LWPMn1_MIAV0_MIWT5_8_MO40_NTn1_NTA4_NTB0_NTC0_NTD0_NTM0_NEPBS0_NLCA1_NLCB1_ONLL1_PGR2_PLR1_PKA1_SIA3_SS1_SPO0_SRVW0_SSO0_SVW1_SK3_SKFTR0_SKXCCM8_TLDS1_ULSGRO0_USL1_UIOFGRO0_USFGRO0_VSn1_VWA1_VWB8_WSGRA0_WSGRB0_WS64_WG32_8_1,0.0,744.58,3072.14
256,512,10240,8192,False,torch.bfloat16,torch.bfloat16,False,False,hipblaslt,439562,0,92.2564,Cijk_Alik_Bljk_BBS_BH_Bias_HA_S_SAV_UserArgs_MT160x256x64_MI16x16x1_SN_LDSB0_AFC0_AFEM1_AFEM1_ASEM1_CLR1_CADS0_DTLA0_DTLB0_DTVA0_DTVB0_EPS0_FDSI0_GRPM1_GRVWA8_GRVWB8_GSU0_GSUAMB_GLS0_ISA950_IU1_K1_LDSTI0_LBSPPA256_LBSPPB512_LBSPPM0_LPA16_LPB16_LPM0_LRVW8_LWPMn1_MIAV0_MIWT10_4_MO40_NTn1_NTA0_NTB3_NTC0_NTD4_NTM0_NEPBS0_NLCA1_NLCB1_ONLL1_PGR2_PLR1_PKA1_SIA3_SS1_SPO0_SRVW0_SSO4_SVW2_SK3_SKFTR0_SKXCCM4_TLDS1_ULSGRO0_USL1_UIOFGRO0_USFGROn1_VSn1_VWA2_VWB4_WSGRA0_WSGRB0_WS64_WG16_16_1,0.0,931.09,2023.13
256,1024,10240,8192,False,torch.bfloat16,torch.bfloat16,False,False,hipblaslt,441305,0,149.9052,Cijk_Alik_Bljk_BBS_BH_Bias_HA_S_SAV_UserArgs_MT160x256x64_MI16x16x1_SN_LDSB0_AFC0_AFEM1_AFEM1_ASEM1_CLR1_CADS0_DTLA0_DTLB0_DTVA0_DTVB0_EPS0_FDSI0_GRPM1_GRVWA8_GRVWB8_GSU0_GSUAMB_GLS0_ISA950_IU1_K1_LDSTI0_LBSPPA128_LBSPPB1024_LBSPPM0_LPA16_LPB16_LPM0_LRVW8_LWPMn1_MIAV0_MIWT5_8_MO40_NTn1_NTA0_NTB0_NTC0_NTD0_NTM0_NEPBS0_NLCA1_NLCB1_ONLL1_PGR2_PLR1_PKA1_SIA3_SS1_SPO0_SRVW0_SSO0_SVW1_SK3_SKFTR0_SKXCCM0_TLDS1_ULSGRO0_USL1_UIOFGRO0_USFGRO0_VSn1_VWA1_VWB8_WSGRA0_WSGRB0_WS64_WG32_8_1,0.0,1146.05,1371.01
256,2048,10240,8192,False,torch.bfloat16,torch.bfloat16,False,False,hipblaslt,440465,0,293.505,Cijk_Alik_Bljk_BBS_BH_Bias_HA_S_SAV_UserArgs_MT160x256x64_MI16x16x1_SN_LDSB0_AFC1_AFEM1_AFEM1_ASEM1_CLR1_CADS0_DTLA1_DTLB1_DTVA0_DTVB0_EPS0_FDSI0_GRPM1_GRVWA8_GRVWB8_GSU0_GSUAMB_GLS0_ISA950_IU1_K1_LDSTI0_LBSPPA1024_LBSPPB1024_LBSPPM0_LPA16_LPB16_LPM0_LRVW8_LWPMn1_MIAV0_MIWT5_8_MO40_NTn1_NTA3_NTB0_NTC0_NTD4_NTM0_NEPBS0_NLCA1_NLCB1_ONLL1_PGR2_PLR1_PKA1_SIA3_SS1_SPO1_SRVW0_SSO1_SVW1_SK3_SKFTR0_SKXCCM4_TLDS1_ULSGRO0_USL1_UIOFGRO0_USFGRO0_VSn1_VWA1_VWB8_WSGRA0_WSGRB0_WS64_WG32_8_1,0.0,1170.67,828.84
256,4096,10240,8192,False,torch.bfloat16,torch.bfloat16,False,False,hipblaslt,440588,0,475.9574,Cijk_Alik_Bljk_BBS_BH_Bias_HA_S_SAV_UserArgs_MT256x256x64_MI16x16x1_CMS_SN_LDSB0_AFC0_AFEM1_AFEM1_ASEM1_CLR1_CADS0_DTLA1_DTLB1_DTVA0_DTVB0_EPS0_FDSI0_GRPM1_GRVWA8_GRVWB8_GSU0_GSUAMB_GLS0_ISA950_IU1_K1_LDSTI0_LBSPPA1024_LBSPPB1024_LBSPPM0_LPA16_LPB16_LPM0_LRVW8_LWPMn1_MIAV0_MIWT8_8_MO40_NTn1_NTA1_NTB0_NTC7_NTD5_NTM0_NEPBS16_NLCA1_NLCB1_ONLL1_PGR2_PLR1_PKA1_SIA3_SS1_SPO0_SRVW0_SSO1_SVW8_SK3_SKFTR0_SKXCCM0_TLDS1_ULSGRO0_USL1_UIOFGRO0_USFGRO0_VSn1_VWA8_VWB8_WSGRA0_WSGRB0_WS64_WG32_8_1,0.0,1443.82,669.74
256,8192,10240,8192,False,torch.bfloat16,torch.bfloat16,False,False,hipblaslt,440450,0,899.5932,Cijk_Alik_Bljk_BBS_BH_Bias_HA_S_SAV_UserArgs_MT256x256x64_MI16x16x1_CMS_SN_LDSB0_AFC1_AFEM1_AFEM1_ASEM1_CLR1_CADS0_DTLA1_DTLB1_DTVA0_DTVB0_EPS0_FDSI0_GRPM1_GRVWA8_GRVWB8_GSU0_GSUAMB_GLS0_ISA950_IU1_K1_LDSTI0_LBSPPA1024_LBSPPB1024_LBSPPM0_LPA16_LPB16_LPM0_LRVW8_LWPMn1_MIAV0_MIWT8_8_MO40_NTn1_NTA3_NTB0_NTC4_NTD3_NTM0_NEPBS16_NLCA1_NLCB1_ONLL1_PGR2_PLR1_PKA1_SIA3_SS1_SPO1_SRVW0_SSO1_SVW8_SK3_SKFTR0_SKXCCM4_TLDS1_ULSGRO0_USL1_UIOFGRO0_USFGRO0_VSn1_VWA8_VWB8_WSGRA0_WSGRB0_WS64_WG32_8_1,0.0,1527.79,522.19
256,16384,10240,8192,False,torch.bfloat16,torch.bfloat16,False,False,hipblaslt,440510,0,1791.5084,Cijk_Alik_Bljk_BBS_BH_Bias_HA_S_SAV_UserArgs_MT256x256x64_MI16x16x1_CMS_SN_LDSB0_AFC1_AFEM1_AFEM1_ASEM1_CLR0_CADS0_DTLA1_DTLB1_DTVA0_DTVB0_EPS0_FDSI0_GRPM1_GRVWA8_GRVWB8_GSU0_GSUAMB_GLS0_ISA950_IU1_K1_LDSTI0_LBSPPA1024_LBSPPB1024_LBSPPM0_LPA16_LPB16_LPM0_LRVW8_LWPMn1_MIAV0_MIWT8_8_MO40_NTn1_NTA1_NTB2_NTC0_NTD7_NTM0_NEPBS0_NLCA1_NLCB1_ONLL1_PGR2_PLR1_PKA1_SIA3_SS1_SPO1_SRVW0_SSO0_SVW8_SK3_SKFTR0_SKXCCM0_TLDS1_ULSGRO0_USL1_UIOFGRO0_USFGRO0_VSn1_VWA8_VWB8_WSGRA0_WSGRB0_WS64_WG32_8_1,0.0,1534.34,430.78
256,32768,10240,8192,False,torch.bfloat16,torch.bfloat16,False,False,hipblaslt,440534,0,3495.0812,Cijk_Alik_Bljk_BBS_BH_Bias_HA_S_SAV_UserArgs_MT256x256x64_MI16x16x1_CMS_SN_LDSB0_AFC1_AFEM1_AFEM1_ASEM1_CLR1_CADS0_DTLA1_DTLB1_DTVA0_DTVB0_EPS0_FDSI0_GRPM1_GRVWA8_GRVWB8_GSU0_GSUAMB_GLS0_ISA950_IU1_K1_LDSTI0_LBSPPA1024_LBSPPB1024_LBSPPM0_LPA16_LPB16_LPM0_LRVW8_LWPMn1_MIAV0_MIWT8_8_MO40_NTn1_NTA0_NTB2_NTC5_NTD6_NTM0_NEPBS16_NLCA1_NLCB1_ONLL1_PGR2_PLR1_PKA1_SIA3_SS1_SPO0_SRVW0_SSO1_SVW8_SK3_SKFTR0_SKXCCM0_TLDS1_ULSGRO0_USL1_UIOFGRO0_USFGRO0_VSn1_VWA8_VWB8_WSGRA0_WSGRB0_WS64_WG32_8_1,0.0,1572.94,393.62
256,1,7168,8192,False,torch.bfloat16,torch.bfloat16,False,False,hipblaslt,440303,0,20.5725,Cijk_Alik_Bljk_BBS_BH_Bias_HA_S_SAV_UserArgs_MT16x16x256_MI16x16x1_SN_LDSB0_AFC0_AFEM1_AFEM1_ASEM1_CLR1_CADS0_DTLA1_DTLB1_DTVA0_DTVB0_EPS0_FDSI0_GRPM1_GRVWA8_GRVWB8_GSU0_GSUAMB_GLS0_ISA950_IU1_K1_LDSTI0_LBSPPA1024_LBSPPB1024_LBSPPM0_LPA16_LPB16_LPM0_LRVW8_LWPMn1_MIAV0_MIWT1_1_MO40_NTn1_NTA4_NTB1_NTC3_NTD0_NTM0_NEPBS8_NLCA1_NLCB1_ONLL1_PGR2_PLR1_PKA1_SIA3_SS1_SPO1_SRVW0_SSO1_SVW1_SK3_SKFTR0_SKXCCM0_TLDS2_ULSGRO0_USL1_UIOFGRO0_USFGROn1_VSn1_VWA1_VWB1_WSGRA0_WSGRB0_WS64_WG16_4_2,0.0,5.71,5710.11
256,16,7168,8192,False,torch.bfloat16,torch.bfloat16,False,False,hipblaslt,439704,0,22.3125,Cijk_Alik_Bljk_BBS_BH_Bias_HA_S_SAV_UserArgs_MT32x16x256_MI16x16x1_SN_LDSB0_AFC0_AFEM1_AFEM1_ASEM1_CLR1_CADS0_DTLA1_DTLB1_DTVA0_DTVB0_EPS0_FDSI0_GRPM1_GRVWA8_GRVWB8_GSU0_GSUAMB_GLS0_ISA950_IU1_K1_LDSTI0_LBSPPA1024_LBSPPB1024_LBSPPM0_LPA16_LPB16_LPM0_LRVW8_LWPMn1_MIAV1_MIWT2_1_MO40_NTn1_NTA7_NTB1_NTC0_NTD2_NTM0_NEPBS8_NLCA1_NLCB1_ONLL1_PGR2_PLR1_PKA1_SIA3_SS1_SPO0_SRVW0_SSO0_SVW2_SK3_SKFTR0_SKXCCM4_TLDS2_ULSGRO0_USL1_UIOFGRO0_USFGRO1_VSn1_VWA2_VWB1_WSGRA0_WSGRB0_WS64_WG16_4_2,0.0,84.22,5285.47
256,32,7168,8192,False,torch.bfloat16,torch.bfloat16,False,False,hipblaslt,441408,0,25.9201,Cijk_Alik_Bljk_BBS_BH_Bias_HA_S_SAV_UserArgs_MT32x32x256_MI16x16x1_SN_LDSB1_AFC0_AFEM1_AFEM1_ASEM1_CLR1_CADS0_DTLA0_DTLB0_DTVA0_DTVB0_EPS0_FDSI0_GRPM1_GRVWA8_GRVWB8_GSU0_GSUAMB_GLS0_ISA950_IU1_K1_LDSTI0_LBSPPA512_LBSPPB512_LBSPPM0_LPA16_LPB16_LPM0_LRVW8_LWPMn1_MIAV0_MIWT1_1_MO40_NTn1_NTA0_NTB0_NTC0_NTD0_NTM0_NEPBS0_NLCA1_NLCB1_ONLL1_PGR2_PLR1_PKA1_SIA3_SS1_SPO0_SRVW0_SSO0_SVW1_SK3_SKFTR0_SKXCCM0_TLDS1_ULSGRO0_USL1_UIOFGRO0_USFGRO0_VSn1_VWA1_VWB1_WSGRA0_WSGRB0_WS64_WG32_8_1,0.0,144.99,4568.79
256,64,7168,8192,False,torch.bfloat16,torch.bfloat16,False,False,hipblaslt,439593,0,29.8084,Cijk_Alik_Bljk_BBS_BH_Bias_HA_S_SAV_UserArgs_MT64x64x128_MI16x16x1_SN_LDSB0_AFC0_AFEM1_AFEM1_ASEM1_CLR0_CADS0_DTLA0_DTLB0_DTVA0_DTVB0_EPS0_FDSI0_GRPM1_GRVWA8_GRVWB8_GSU0_GSUAMB_GLS0_ISA950_IU1_K1_LDSTI0_LBSPPA512_LBSPPB512_LBSPPM0_LPA16_LPB16_LPM0_LRVW8_LWPMn1_MIAV0_MIWT2_2_MO40_NTn1_NTA3_NTB3_NTC5_NTD6_NTM0_NEPBS16_NLCA1_NLCB1_ONLL1_PGR2_PLR1_PKA1_SIA3_SS1_SPO1_SRVW0_SSO1_SVW2_SK3_SKFTR0_SKXCCM0_TLDS1_ULSGRO0_USL1_UIOFGRO0_USFGROn1_VSn1_VWA2_VWB2_WSGRA0_WSGRB0_WS64_WG32_8_1,0.0,252.15,4005.8
256,128,7168,8192,False,torch.bfloat16,torch.bfloat16,False,False,hipblaslt,439908,0,35.1308,Cijk_Alik_Bljk_BBS_BH_Bias_HA_S_SAV_UserArgs_MT128x128x64_MI16x16x1_SN_LDSB0_AFC0_AFEM1_AFEM1_ASEM1_CLR1_CADS0_DTLA1_DTLB1_DTVA0_DTVB0_EPS0_FDSI0_GRPM1_GRVWA2_GRVWB8_GSU0_GSUAMB_GLS0_ISA950_IU1_K1_LDSTI0_LBSPPA256_LBSPPB1024_LBSPPM0_LPA16_LPB16_LPM0_LRVW8_LWPMn1_MIAV1_MIWT4_4_MO40_NTn1_NTA2_NTB0_NTC6_NTD0_NTM0_NEPBS16_NLCA1_NLCB1_ONLL1_PGR2_PLR1_PKA1_SIA3_SS1_SPO0_SRVW0_SSO0_SVW4_SK3_SKFTR0_SKXCCM0_TLDS1_ULSGRO0_USL1_UIOFGRO0_USFGRO0_VSn1_VWA4_VWB4_WSGRA0_WSGRB0_WS64_WG32_8_1,0.0,427.9,3454.88
256,256,7168,8192,False,torch.bfloat16,torch.bfloat16,False,False,hipblaslt,440341,0,45.2671,Cijk_Alik_Bljk_BBS_BH_Bias_HA_S_SAV_UserArgs_MT128x128x128_MI16x16x1_SN_LDSB0_AFC1_AFEM1_AFEM1_ASEM1_CLR0_CADS0_DTLA0_DTLB0_DTVA0_DTVB0_EPS0_FDSI0_GRPM1_GRVWA8_GRVWB8_GSU0_GSUAMB_GLS0_ISA950_IU1_K1_LDSTI0_LBSPPA1024_LBSPPB1024_LBSPPM0_LPA16_LPB16_LPM0_LRVW8_LWPMn1_MIAV0_MIWT4_4_MO40_NTn1_NTA3_NTB1_NTC5_NTD3_NTM0_NEPBS16_NLCA1_NLCB1_ONLL1_PGR2_PLR1_PKA1_SIA3_SS1_SPO1_SRVW0_SSO0_SVW4_SK3_SKFTR0_SKXCCM8_TLDS1_ULSGRO0_USL1_UIOFGRO0_USFGRO0_VSn1_VWA4_VWB4_WSGRA0_WSGRB0_WS64_WG32_8_1,0.0,664.16,2768.12
256,512,7168,8192,False,torch.bfloat16,torch.bfloat16,False,False,hipblaslt,440657,0,71.5815,Cijk_Alik_Bljk_BBS_BH_Bias_HA_S_SAV_UserArgs_MT256x256x64_MI16x16x1_CMS_SN_LDSB0_AFC0_AFEM1_AFEM1_ASEM1_CLR0_CADS0_DTLA1_DTLB1_DTVA0_DTVB0_EPS0_FDSI0_GRPM1_GRVWA8_GRVWB8_GSU0_GSUAMB_GLS0_ISA950_IU1_K1_LDSTI0_LBSPPA1024_LBSPPB1024_LBSPPM0_LPA16_LPB16_LPM0_LRVW8_LWPMn1_MIAV0_MIWT8_8_MO40_NTn1_NTA0_NTB0_NTC4_NTD0_NTM0_NEPBS16_NLCA1_NLCB1_ONLL1_PGR2_PLR1_PKA1_SIA3_SS1_SPO0_SRVW0_SSO1_SVW8_SK3_SKFTR0_SKXCCM4_TLDS1_ULSGRO0_USL1_UIOFGRO0_USFGRO0_VSn1_VWA8_VWB8_WSGRA0_WSGRB0_WS64_WG32_8_1,0.0,840.02,1860.39
256,1024,7168,8192,False,torch.bfloat16,torch.bfloat16,False,False,hipblaslt,440203,0,116.622,Cijk_Alik_Bljk_BBS_BH_Bias_HA_S_SAV_UserArgs_MT256x128x64_MI16x16x1_SN_LDSB0_AFC0_AFEM1_AFEM1_ASEM1_CLR1_CADS0_DTLA1_DTLB1_DTVA0_DTVB0_EPS0_FDSI0_GRPM1_GRVWA8_GRVWB8_GSU0_GSUAMB_GLS0_ISA950_IU1_K1_LDSTI0_LBSPPA1024_LBSPPB1024_LBSPPM0_LPA16_LPB16_LPM0_LRVW8_LWPMn1_MIAV0_MIWT8_4_MO40_NTn1_NTA3_NTB3_NTC4_NTD7_NTM0_NEPBS0_NLCA1_NLCB1_ONLL1_PGR2_PLR1_PKA1_SIA3_SS1_SPO0_SRVW0_SSO1_SVW8_SK3_SKFTR0_SKXCCM8_TLDS1_ULSGRO0_USL1_UIOFGRO0_USFGROn1_VSn1_VWA8_VWB4_WSGRA0_WSGRB0_WS64_WG32_8_1,0.0,1031.19,1276.76
256,2048,7168,8192,False,torch.bfloat16,torch.bfloat16,False,False,asm,10,1,180.181,_ZN5aiter24bf16gemm_bf16_tn_256x256E,0.0,1334.87,1000.97
256,4096,7168,8192,False,torch.bfloat16,torch.bfloat16,False,False,asm,10,1,339.9066,_ZN5aiter24bf16gemm_bf16_tn_256x256E,0.0,1415.2,715.7
256,8192,7168,8192,False,torch.bfloat16,torch.bfloat16,False,False,hipblaslt,440518,0,648.7957,Cijk_Alik_Bljk_BBS_BH_Bias_HA_S_SAV_UserArgs_MT256x256x64_MI16x16x1_CMS_SN_LDSB0_AFC1_AFEM1_AFEM1_ASEM1_CLR0_CADS0_DTLA1_DTLB1_DTVA0_DTVB0_EPS0_FDSI0_GRPM1_GRVWA8_GRVWB8_GSU0_GSUAMB_GLS0_ISA950_IU1_K1_LDSTI0_LBSPPA1024_LBSPPB1024_LBSPPM0_LPA16_LPB16_LPM0_LRVW8_LWPMn1_MIAV0_MIWT8_8_MO40_NTn1_NTA3_NTB2_NTC5_NTD6_NTM0_NEPBS12_NLCA1_NLCB1_ONLL1_PGR2_PLR1_PKA1_SIA3_SS1_SPO1_SRVW0_SSO1_SVW8_SK3_SKFTR0_SKXCCM0_TLDS1_ULSGRO0_USL1_UIOFGRO0_USFGRO0_VSn1_VWA8_VWB8_WSGRA0_WSGRB0_WS64_WG32_8_1,0.0,1482.86,568.9
256,16384,7168,8192,False,torch.bfloat16,torch.bfloat16,False,False,hipblaslt,441281,0,1222.0475,Cijk_Alik_Bljk_BBS_BH_Bias_HA_S_SAV_UserArgs_MT256x256x64_MI16x16x1_CMS_SN_LDSB0_AFC0_AFEM1_AFEM1_ASEM1_CLR1_CADS0_DTLA1_DTLB1_DTVA0_DTVB0_EPS0_FDSI0_GRPM1_GRVWA8_GRVWB8_GSU0_GSUAMB_GLS0_ISA950_IU1_K1_LDSTI0_LBSPPA1024_LBSPPB1024_LBSPPM0_LPA16_LPB16_LPM0_LRVW8_LWPMn1_MIAV0_MIWT8_8_MO40_NTn1_NTA0_NTB0_NTC0_NTD4_NTM0_NEPBS0_NLCA1_NLCB1_ONLL1_PGR2_PLR1_PKA1_SIA3_SS1_SPO0_SRVW0_SSO0_SVW8_SK3_SKFTR0_SKXCCM0_TLDS1_ULSGRO0_USL1_UIOFGRO0_USFGRO0_VSn1_VWA8_VWB8_WSGRA0_WSGRB0_WS64_WG32_8_1,0.0,1574.53,507.96
256,32768,7168,8192,False,torch.bfloat16,torch.bfloat16,False,False,hipblaslt,440524,0,2436.0256,Cijk_Alik_Bljk_BBS_BH_Bias_HA_S_SAV_UserArgs_MT256x256x64_MI16x16x1_CMS_SN_LDSB0_AFC1_AFEM1_AFEM1_ASEM1_CLR1_CADS0_DTLA1_DTLB1_DTVA0_DTVB0_EPS0_FDSI0_GRPM1_GRVWA8_GRVWB8_GSU0_GSUAMB_GLS0_ISA950_IU1_K1_LDSTI0_LBSPPA1024_LBSPPB1024_LBSPPM0_LPA16_LPB16_LPM0_LRVW8_LWPMn1_MIAV0_MIWT8_8_MO40_NTn1_NTA3_NTB3_NTC7_NTD5_NTM0_NEPBS16_NLCA1_NLCB1_ONLL1_PGR2_PLR1_PKA1_SIA3_SS1_SPO1_SRVW0_SSO1_SVW8_SK3_SKFTR0_SKXCCM0_TLDS1_ULSGRO0_USL1_UIOFGRO0_USFGRO0_VSn1_VWA8_VWB8_WSGRA0_WSGRB0_WS64_WG32_8_1,0.0,1579.74,461.44
256,1,8192,3584,False,torch.bfloat16,torch.bfloat16,False,False,hipblaslt,439977,0,12.1146,Cijk_Alik_Bljk_BBS_BH_Bias_HA_S_SAV_UserArgs_MT16x16x256_MI16x16x1_SN_LDSB0_AFC0_AFEM1_AFEM1_ASEM1_CLR1_CADS0_DTLA1_DTLB1_DTVA0_DTVB0_EPS0_FDSI0_GRPM1_GRVWA8_GRVWB8_GSU0_GSUAMB_GLS0_ISA950_IU1_K1_LDSTI0_LBSPPA1024_LBSPPB1024_LBSPPM0_LPA16_LPB16_LPM0_LRVW8_LWPMn1_MIAV1_MIWT1_1_MO40_NTn1_NTA4_NTB2_NTC3_NTD0_NTM0_NEPBS14_NLCA1_NLCB1_ONLL1_PGR2_PLR1_PKA1_SIA3_SS1_SPO0_SRVW0_SSO0_SVW1_SK3_SKFTR0_SKXCCM0_TLDS2_ULSGRO0_USL1_UIOFGRO0_USFGROn1_VSn1_VWA1_VWB1_WSGRA0_WSGRB0_WS64_WG16_4_2,0.0,4.85,4849.01
256,1,8192,7168,False,torch.bfloat16,torch.bfloat16,False,False,hipblaslt,440286,0,20.3313,Cijk_Alik_Bljk_BBS_BH_Bias_HA_S_SAV_UserArgs_MT16x16x256_MI16x16x1_SN_LDSB0_AFC0_AFEM1_AFEM1_ASEM1_CLR1_CADS0_DTLA1_DTLB1_DTVA0_DTVB0_EPS0_FDSI0_GRPM1_GRVWA8_GRVWB8_GSU0_GSUAMB_GLS0_ISA950_IU1_K1_LDSTI0_LBSPPA1024_LBSPPB1024_LBSPPM0_LPA16_LPB16_LPM0_LRVW8_LWPMn1_MIAV0_MIWT1_1_MO40_NTn1_NTA5_NTB2_NTC3_NTD1_NTM0_NEPBS12_NLCA1_NLCB1_ONLL1_PGR2_PLR1_PKA1_SIA3_SS1_SPO0_SRVW0_SSO0_SVW1_SK3_SKFTR0_SKXCCM5_TLDS2_ULSGRO0_USL1_UIOFGRO0_USFGROn1_VSn1_VWA1_VWB1_WSGRA0_WSGRB0_WS64_WG16_4_2,0.0,5.78,5777.85
256,1,8192,28672,False,torch.bfloat16,torch.bfloat16,False,False,hipblaslt,440305,0,72.551,Cijk_Alik_Bljk_BBS_BH_Bias_HA_S_SAV_UserArgs_MT16x16x512_MI16x16x1_SN_LDSB0_AFC0_AFEM1_AFEM1_ASEM1_CLR1_CADS0_DTLA1_DTLB1_DTVA0_DTVB0_EPS0_FDSI0_GRPM1_GRVWA8_GRVWB8_GSU0_GSUAMB_GLS0_ISA950_IU1_K1_LDSTI0_LBSPPA1024_LBSPPB1024_LBSPPM0_LPA16_LPB16_LPM0_LRVW8_LWPMn1_MIAV0_MIWT1_1_MO40_NTn1_NTA7_NTB3_NTC3_NTD1_NTM0_NEPBS2_NLCA1_NLCB1_ONLL1_PGR2_PLR1_PKA1_SIA3_SS0_SPO0_SRVW0_SSO0_SVW1_SK3_SKFTR0_SKXCCM0_TLDS2_ULSGRO0_USL1_UIOFGRO0_USFGRO1_VSn1_VWA1_VWB1_WSGRA0_WSGRB0_WS64_WG16_4_4,0.0,6.47,6475.94
256,16,8192,3584,False,torch.bfloat16,torch.bfloat16,False,False,hipblaslt,439704,0,12.6982,Cijk_Alik_Bljk_BBS_BH_Bias_HA_S_SAV_UserArgs_MT32x16x256_MI16x16x1_SN_LDSB0_AFC0_AFEM1_AFEM1_ASEM1_CLR1_CADS0_DTLA1_DTLB1_DTVA0_DTVB0_EPS0_FDSI0_GRPM1_GRVWA8_GRVWB8_GSU0_GSUAMB_GLS0_ISA950_IU1_K1_LDSTI0_LBSPPA1024_LBSPPB1024_LBSPPM0_LPA16_LPB16_LPM0_LRVW8_LWPMn1_MIAV1_MIWT2_1_MO40_NTn1_NTA7_NTB1_NTC0_NTD2_NTM0_NEPBS8_NLCA1_NLCB1_ONLL1_PGR2_PLR1_PKA1_SIA3_SS1_SPO0_SRVW0_SSO0_SVW2_SK3_SKFTR0_SKXCCM4_TLDS2_ULSGRO0_USL1_UIOFGRO0_USFGRO1_VSn1_VWA2_VWB1_WSGRA0_WSGRB0_WS64_WG16_4_2,0.0,73.99,4653.97
256,16,8192,7168,False,torch.bfloat16,torch.bfloat16,False,False,hipblaslt,440553,0,21.2748,Cijk_Alik_Bljk_BBS_BH_Bias_HA_S_SAV_UserArgs_MT32x16x256_MI16x16x1_SN_LDSB0_AFC0_AFEM1_AFEM1_ASEM1_CLR1_CADS0_DTLA1_DTLB1_DTVA0_DTVB0_EPS0_FDSI0_GRPM1_GRVWA8_GRVWB8_GSU0_GSUAMB_GLS0_ISA950_IU1_K1_LDSTI0_LBSPPA1024_LBSPPB1024_LBSPPM0_LPA16_LPB16_LPM0_LRVW8_LWPMn1_MIAV1_MIWT2_1_MO40_NTn1_NTA7_NTB1_NTC0_NTD0_NTM0_NEPBS12_NLCA1_NLCB1_ONLL1_PGR2_PLR1_PKA1_SIA3_SS1_SPO0_SRVW0_SSO1_SVW2_SK3_SKFTR0_SKXCCM7_TLDS1_ULSGRO0_USL1_UIOFGRO0_USFGRO0_VSn1_VWA2_VWB1_WSGRA0_WSGRB0_WS64_WG16_4_2,0.0,88.32,5543.27
256,16,8192,28672,False,torch.bfloat16,torch.bfloat16,False,False,hipblaslt,440306,0,73.9187,Cijk_Alik_Bljk_BBS_BH_Bias_HA_S_SAV_UserArgs_MT32x16x512_MI16x16x1_SN_LDSB0_AFC0_AFEM1_AFEM1_ASEM1_CLR1_CADS0_DTLA1_DTLB1_DTVA0_DTVB0_EPS0_FDSI0_GRPM1_GRVWA8_GRVWB8_GSU0_GSUAMB_GLS0_ISA950_IU1_K1_LDSTI0_LBSPPA1024_LBSPPB1024_LBSPPM0_LPA16_LPB16_LPM0_LRVW8_LWPMn1_MIAV0_MIWT1_1_MO40_NTn1_NTA7_NTB3_NTC1_NTD0_NTM0_NEPBS10_NLCA1_NLCB1_ONLL1_PGR2_PLR1_PKA1_SIA3_SS1_SPO0_SRVW0_SSO0_SVW1_SK3_SKFTR0_SKXCCM8_TLDS1_ULSGRO0_USL1_UIOFGRO0_USFGROn1_VSn1_VWA1_VWB1_WSGRA0_WSGRB0_WS64_WG32_4_2,0.0,101.68,6371.08
256,32,8192,3584,False,torch.bfloat16,torch.bfloat16,False,False,hipblaslt,440111,0,13.6521,Cijk_Alik_Bljk_BBS_BH_Bias_HA_S_SAV_UserArgs_MT32x32x256_MI16x16x1_SN_LDSB0_AFC0_AFEM1_AFEM1_ASEM1_CLR1_CADS0_DTLA1_DTLB1_DTVA0_DTVB0_EPS0_FDSI0_GRPM1_GRVWA8_GRVWB8_GSU0_GSUAMB_GLS0_ISA950_IU1_K1_LDSTI0_LBSPPA1024_LBSPPB1024_LBSPPM0_LPA16_LPB16_LPM0_LRVW8_LWPMn1_MIAV1_MIWT1_1_MO40_NTn1_NTA7_NTB2_NTC2_NTD1_NTM0_NEPBS14_NLCA1_NLCB1_ONLL1_PGR2_PLR1_PKA1_SIA3_SS1_SPO0_SRVW0_SSO0_SVW1_SK3_SKFTR0_SKXCCM4_TLDS1_ULSGRO0_USL1_UIOFGRO0_USFGROn1_VSn1_VWA1_VWB1_WSGRA0_WSGRB0_WS64_WG32_8_1,0.0,137.64,4356.39
256,32,8192,7168,False,torch.bfloat16,torch.bfloat16,False,False,hipblaslt,440174,0,24.2667,Cijk_Alik_Bljk_BBS_BH_Bias_HA_S_SAV_UserArgs_MT32x32x256_MI16x16x1_SN_LDSB0_AFC0_AFEM1_AFEM1_ASEM1_CLR1_CADS0_DTLA0_DTLB0_DTVA0_DTVB0_EPS0_FDSI0_GRPM1_GRVWA8_GRVWB8_GSU0_GSUAMB_GLS0_ISA950_IU1_K1_LDSTI0_LBSPPA512_LBSPPB512_LBSPPM0_LPA16_LPB16_LPM0_LRVW8_LWPMn1_MIAV1_MIWT1_1_MO40_NTn1_NTA1_NTB2_NTC3_NTD1_NTM0_NEPBS14_NLCA1_NLCB1_ONLL1_PGR2_PLR1_PKA1_SIA3_SS1_SPO0_SRVW0_SSO0_SVW1_SK3_SKFTR0_SKXCCM4_TLDS1_ULSGRO0_USL1_UIOFGRO0_USFGRO1_VSn1_VWA1_VWB1_WSGRA0_WSGRB0_WS64_WG32_8_1,0.0,154.87,4880.08
256,32,8192,28672,False,torch.bfloat16,torch.bfloat16,False,False,hipblaslt,440860,0,76.3662,Cijk_Alik_Bljk_BBS_BH_Bias_HA_S_SAV_UserArgs_MT128x64x128_MI16x16x1_SN_LDSB1_AFC0_AFEM1_AFEM1_ASEM1_CLR1_CADS0_DTLA0_DTLB0_DTVA0_DTVB0_EPS0_FDSI0_GRPM1_GRVWA8_GRVWB8_GSU0_GSUAMB_GLS0_ISA950_IU1_K1_LDSTI0_LBSPPA1024_LBSPPB512_LBSPPM0_LPA16_LPB16_LPM0_LRVW8_LWPMn1_MIAV0_MIWT4_2_MO40_NTn1_NTA4_NTB0_NTC0_NTD0_NTM0_NEPBS0_NLCA1_NLCB1_ONLL1_PGR2_PLR1_PKA1_SIA3_SS1_SPO0_SRVW0_SSO0_SVW4_SK3_SKFTR0_SKXCCM8_TLDS1_ULSGRO0_USL1_UIOFGRO0_USFGRO0_VSn1_VWA4_VWB2_WSGRA0_WSGRB0_WS64_WG32_8_1,0.0,196.85,6182.33
256,64,8192,3584,False,torch.bfloat16,torch.bfloat16,False,False,hipblaslt,441407,0,16.7778,Cijk_Alik_Bljk_BBS_BH_Bias_HA_S_SAV_UserArgs_MT32x64x256_MI16x16x1_SN_LDSB1_AFC0_AFEM1_AFEM1_ASEM1_CLR1_CADS0_DTLA0_DTLB0_DTVA0_DTVB0_EPS0_FDSI0_GRPM1_GRVWA8_GRVWB8_GSU0_GSUAMB_GLS0_ISA950_IU1_K1_LDSTI0_LBSPPA512_LBSPPB1024_LBSPPM0_LPA16_LPB16_LPM0_LRVW8_LWPMn1_MIAV0_MIWT1_2_MO40_NTn1_NTA0_NTB0_NTC0_NTD0_NTM0_NEPBS0_NLCA1_NLCB1_ONLL1_PGR2_PLR1_PKA1_SIA3_SS1_SPO0_SRVW0_SSO0_SVW1_SK3_SKFTR0_SKXCCM0_TLDS1_ULSGRO0_USL1_UIOFGRO0_USFGRO0_VSn1_VWA1_VWB2_WSGRA0_WSGRB0_WS64_WG32_8_1,0.0,223.99,3589.72
256,64,8192,7168,False,torch.bfloat16,torch.bfloat16,False,False,hipblaslt,439593,0,27.857,Cijk_Alik_Bljk_BBS_BH_Bias_HA_S_SAV_UserArgs_MT64x64x128_MI16x16x1_SN_LDSB0_AFC0_AFEM1_AFEM1_ASEM1_CLR0_CADS0_DTLA0_DTLB0_DTVA0_DTVB0_EPS0_FDSI0_GRPM1_GRVWA8_GRVWB8_GSU0_GSUAMB_GLS0_ISA950_IU1_K1_LDSTI0_LBSPPA512_LBSPPB512_LBSPPM0_LPA16_LPB16_LPM0_LRVW8_LWPMn1_MIAV0_MIWT2_2_MO40_NTn1_NTA3_NTB3_NTC5_NTD6_NTM0_NEPBS16_NLCA1_NLCB1_ONLL1_PGR2_PLR1_PKA1_SIA3_SS1_SPO1_SRVW0_SSO1_SVW2_SK3_SKFTR0_SKXCCM0_TLDS1_ULSGRO0_USL1_UIOFGRO0_USFGROn1_VSn1_VWA2_VWB2_WSGRA0_WSGRB0_WS64_WG32_8_1,0.0,269.81,4286.41
256,64,8192,28672,False,torch.bfloat16,torch.bfloat16,False,False,hipblaslt,440860,0,82.9978,Cijk_Alik_Bljk_BBS_BH_Bias_HA_S_SAV_UserArgs_MT128x64x128_MI16x16x1_SN_LDSB1_AFC0_AFEM1_AFEM1_ASEM1_CLR1_CADS0_DTLA0_DTLB0_DTVA0_DTVB0_EPS0_FDSI0_GRPM1_GRVWA8_GRVWB8_GSU0_GSUAMB_GLS0_ISA950_IU1_K1_LDSTI0_LBSPPA1024_LBSPPB512_LBSPPM0_LPA16_LPB16_LPM0_LRVW8_LWPMn1_MIAV0_MIWT4_2_MO40_NTn1_NTA4_NTB0_NTC0_NTD0_NTM0_NEPBS0_NLCA1_NLCB1_ONLL1_PGR2_PLR1_PKA1_SIA3_SS1_SPO0_SRVW0_SSO0_SVW4_SK3_SKFTR0_SKXCCM8_TLDS1_ULSGRO0_USL1_UIOFGRO0_USFGRO0_VSn1_VWA4_VWB2_WSGRA0_WSGRB0_WS64_WG32_8_1,0.0,362.24,5716.79
256,128,8192,3584,False,torch.bfloat16,torch.bfloat16,False,False,hipblaslt,439919,0,20.4535,Cijk_Alik_Bljk_BBS_BH_Bias_HA_S_SAV_UserArgs_MT64x64x256_MI32x32x1_SN_LDSB0_AFC0_AFEM1_AFEM1_ASEM1_CLR1_CADS0_DTLA0_DTLB0_DTVA0_DTVB0_EPS0_FDSI0_GRPM1_GRVWA8_GRVWB8_GSU0_GSUAMB_GLS0_ISA950_IU1_K1_LDSTI0_LBSPPA512_LBSPPB512_LBSPPM0_LPA8_LPB8_LPM0_LRVW8_LWPMn1_MIAV0_MIWT1_1_MO40_NTn1_NTA2_NTB3_NTC0_NTD7_NTM0_NEPBS16_NLCA1_NLCB1_ONLL1_PGR2_PLR1_PKA1_SIA3_SS1_SPO1_SRVW0_SSO1_SVW1_SK3_SKFTR0_SKXCCM0_TLDS1_ULSGRO0_USL1_UIOFGRO0_USFGRO0_VSn1_VWA1_VWB1_WSGRA0_WSGRB0_WS64_WG64_4_1,0.0,367.48,3018.31
256,128,8192,7168,False,torch.bfloat16,torch.bfloat16,False,False,hipblaslt,440108,0,33.0489,Cijk_Alik_Bljk_BBS_BH_Bias_HA_S_SAV_UserArgs_MT128x128x64_MI16x16x1_SN_LDSB0_AFC0_AFEM1_AFEM1_ASEM1_CLR0_CADS0_DTLA1_DTLB1_DTVA0_DTVB0_EPS0_FDSI0_GRPM1_GRVWA8_GRVWB8_GSU0_GSUAMB_GLS0_ISA950_IU1_K1_LDSTI0_LBSPPA1024_LBSPPB1024_LBSPPM0_LPA16_LPB16_LPM0_LRVW8_LWPMn1_MIAV1_MIWT4_4_MO40_NTn1_NTA2_NTB1_NTC6_NTD3_NTM0_NEPBS16_NLCA1_NLCB1_ONLL1_PGR2_PLR1_PKA1_SIA3_SS1_SPO0_SRVW0_SSO0_SVW4_SK3_SKFTR0_SKXCCM4_TLDS1_ULSGRO0_USL1_UIOFGRO0_USFGROn1_VSn1_VWA4_VWB4_WSGRA0_WSGRB0_WS64_WG32_8_1,0.0,454.85,3672.52
256,128,8192,28672,False,torch.bfloat16,torch.bfloat16,False,False,hipblaslt,440459,0,93.8224,Cijk_Alik_Bljk_BBS_BH_Bias_HA_S_SAV_UserArgs_MT256x128x64_MI16x16x1_SN_LDSB0_AFC1_AFEM1_AFEM1_ASEM1_CLR1_CADS0_DTLA1_DTLB1_DTVA0_DTVB0_EPS0_FDSI0_GRPM1_GRVWA8_GRVWB8_GSU0_GSUAMB_GLS0_ISA950_IU1_K1_LDSTI0_LBSPPA1024_LBSPPB1024_LBSPPM0_LPA16_LPB16_LPM0_LRVW8_LWPMn1_MIAV0_MIWT4_8_MO40_NTn1_NTA5_NTB3_NTC5_NTD3_NTM0_NEPBS16_NLCA1_NLCB1_ONLL1_PGR2_PLR1_PKA1_SIA3_SS1_SPO0_SRVW0_SSO0_SVW4_SK3_SKFTR0_SKXCCM8_TLDS2_ULSGRO0_USL1_UIOFGRO0_USFGRO0_VSn1_VWA4_VWB8_WSGRA0_WSGRB0_WS64_WG64_4_1,0.0,640.89,5107.51
256,256,8192,3584,False,torch.bfloat16,torch.bfloat16,False,False,hipblaslt,440341,0,26.5094,Cijk_Alik_Bljk_BBS_BH_Bias_HA_S_SAV_UserArgs_MT128x128x128_MI16x16x1_SN_LDSB0_AFC1_AFEM1_AFEM1_ASEM1_CLR0_CADS0_DTLA0_DTLB0_DTVA0_DTVB0_EPS0_FDSI0_GRPM1_GRVWA8_GRVWB8_GSU0_GSUAMB_GLS0_ISA950_IU1_K1_LDSTI0_LBSPPA1024_LBSPPB1024_LBSPPM0_LPA16_LPB16_LPM0_LRVW8_LWPMn1_MIAV0_MIWT4_4_MO40_NTn1_NTA3_NTB1_NTC5_NTD3_NTM0_NEPBS16_NLCA1_NLCB1_ONLL1_PGR2_PLR1_PKA1_SIA3_SS1_SPO1_SRVW0_SSO0_SVW4_SK3_SKFTR0_SKXCCM8_TLDS1_ULSGRO0_USL1_UIOFGRO0_USFGRO0_VSn1_VWA4_VWB4_WSGRA0_WSGRB0_WS64_WG32_8_1,0.0,567.06,2442.51
256,256,8192,7168,False,torch.bfloat16,torch.bfloat16,False,False,hipblaslt,440341,0,43.8206,Cijk_Alik_Bljk_BBS_BH_Bias_HA_S_SAV_UserArgs_MT128x128x128_MI16x16x1_SN_LDSB0_AFC1_AFEM1_AFEM1_ASEM1_CLR0_CADS0_DTLA0_DTLB0_DTVA0_DTVB0_EPS0_FDSI0_GRPM1_GRVWA8_GRVWB8_GSU0_GSUAMB_GLS0_ISA950_IU1_K1_LDSTI0_LBSPPA1024_LBSPPB1024_LBSPPM0_LPA16_LPB16_LPM0_LRVW8_LWPMn1_MIAV0_MIWT4_4_MO40_NTn1_NTA3_NTB1_NTC5_NTD3_NTM0_NEPBS16_NLCA1_NLCB1_ONLL1_PGR2_PLR1_PKA1_SIA3_SS1_SPO1_SRVW0_SSO0_SVW4_SK3_SKFTR0_SKXCCM8_TLDS1_ULSGRO0_USL1_UIOFGRO0_USFGRO0_VSn1_VWA4_VWB4_WSGRA0_WSGRB0_WS64_WG32_8_1,0.0,686.09,2859.5
256,256,8192,28672,False,torch.bfloat16,torch.bfloat16,False,False,hipblaslt,439559,0,128.3281,Cijk_Alik_Bljk_BBS_BH_Bias_HA_S_SAV_UserArgs_MT256x256x64_MI16x16x1_SN_LDSB0_AFC0_AFEM1_AFEM1_ASEM1_CLR1_CADS0_DTLA1_DTLB1_DTVA0_DTVB0_EPS0_FDSI0_GRPM1_GRVWA8_GRVWB8_GSU0_GSUAMB_GLS0_ISA950_IU1_K1_LDSTI0_LBSPPA1024_LBSPPB1024_LBSPPM0_LPA16_LPB16_LPM0_LRVW8_LWPMn1_MIAV0_MIWT16_4_MO40_NTn1_NTA7_NTB1_NTC0_NTD0_NTM0_NEPBS2_NLCA1_NLCB1_ONLL1_PGR2_PLR1_PKA1_SIA3_SS1_SPO0_SRVW0_SSO1_SVW8_SK3_SKFTR0_SKXCCM0_TLDS1_ULSGRO0_USL1_UIOFGRO0_USFGRO0_VSn1_VWA8_VWB4_WSGRA0_WSGRB0_WS64_WG16_16_1,0.0,937.12,3807.71
256,512,8192,3584,False,torch.bfloat16,torch.bfloat16,False,False,hipblaslt,440209,0,35.1572,Cijk_Alik_Bljk_BBS_BH_Bias_HA_S_SAV_UserArgs_MT128x128x128_MI16x16x1_SN_LDSB0_AFC0_AFEM1_AFEM1_ASEM1_CLR0_CADS0_DTLA0_DTLB0_DTVA0_DTVB0_EPS0_FDSI0_GRPM1_GRVWA8_GRVWB8_GSU0_GSUAMB_GLS0_ISA950_IU1_K1_LDSTI0_LBSPPA1024_LBSPPB1024_LBSPPM0_LPA16_LPB16_LPM0_LRVW8_LWPMn1_MIAV1_MIWT4_4_MO40_NTn1_NTA7_NTB2_NTC2_NTD2_NTM0_NEPBS0_NLCA1_NLCB1_ONLL1_PGR2_PLR1_PKA1_SIA3_SS1_SPO1_SRVW0_SSO0_SVW4_SK3_SKFTR0_SKXCCM8_TLDS1_ULSGRO0_USL1_UIOFGRO0_USFGRO0_VSn1_VWA4_VWB4_WSGRA0_WSGRB0_WS64_WG32_8_1,0.0,855.15,2013.21
256,512,8192,7168,False,torch.bfloat16,torch.bfloat16,False,False,hipblaslt,440459,0,66.7104,Cijk_Alik_Bljk_BBS_BH_Bias_HA_S_SAV_UserArgs_MT256x128x64_MI16x16x1_SN_LDSB0_AFC1_AFEM1_AFEM1_ASEM1_CLR1_CADS0_DTLA1_DTLB1_DTVA0_DTVB0_EPS0_FDSI0_GRPM1_GRVWA8_GRVWB8_GSU0_GSUAMB_GLS0_ISA950_IU1_K1_LDSTI0_LBSPPA1024_LBSPPB1024_LBSPPM0_LPA16_LPB16_LPM0_LRVW8_LWPMn1_MIAV0_MIWT4_8_MO40_NTn1_NTA5_NTB3_NTC5_NTD3_NTM0_NEPBS16_NLCA1_NLCB1_ONLL1_PGR2_PLR1_PKA1_SIA3_SS1_SPO0_SRVW0_SSO0_SVW4_SK3_SKFTR0_SKXCCM8_TLDS2_ULSGRO0_USL1_UIOFGRO0_USFGRO0_VSn1_VWA4_VWB8_WSGRA0_WSGRB0_WS64_WG64_4_1,0.0,901.35,1996.23
256,512,8192,28672,False,torch.bfloat16,torch.bfloat16,False,False,hipblaslt,440453,0,208.9587,Cijk_Alik_Bljk_BBS_BH_Bias_HA_S_SAV_UserArgs_MT256x256x64_MI16x16x1_CMS_SN_LDSB0_AFC1_AFEM1_AFEM1_ASEM1_CLR0_CADS0_DTLA1_DTLB1_DTVA0_DTVB0_EPS0_FDSI0_GRPM1_GRVWA8_GRVWB8_GSU0_GSUAMB_GLS0_ISA950_IU1_K1_LDSTI0_LBSPPA1024_LBSPPB1024_LBSPPM0_LPA16_LPB16_LPM0_LRVW8_LWPMn1_MIAV0_MIWT8_8_MO40_NTn1_NTA0_NTB3_NTC6_NTD0_NTM0_NEPBS0_NLCA1_NLCB1_ONLL1_PGR2_PLR1_PKA1_SIA3_SS1_SPO1_SRVW0_SSO1_SVW8_SK3_SKFTR0_SKXCCM0_TLDS1_ULSGRO0_USL1_UIOFGRO0_USFGRO0_VSn1_VWA8_VWB8_WSGRA0_WSGRB0_WS64_WG32_8_1,0.0,1151.03,2428.76
256,1024,8192,3584,False,torch.bfloat16,torch.bfloat16,False,False,hipblaslt,439453,0,56.7205,Cijk_Alik_Bljk_BBS_BH_Bias_HA_S_SAV_UserArgs_MT128x256x64_MI16x16x1_SN_LDSB0_AFC0_AFEM1_AFEM1_ASEM1_CLR0_CADS0_DTLA0_DTLB0_DTVA0_DTVB0_EPS0_FDSI0_GRPM1_GRVWA8_GRVWB8_GSU0_GSUAMB_GLS0_ISA950_IU1_K1_LDSTI0_LBSPPA1024_LBSPPB512_LBSPPM0_LPA16_LPB16_LPM0_LRVW8_LWPMn1_MIAV0_MIWT8_4_MO40_NTn1_NTA3_NTB1_NTC7_NTD4_NTM0_NEPBS0_NLCA1_NLCB1_ONLL1_PGR2_PLR1_PKA1_SIA3_SS1_SPO0_SRVW0_SSO1_SVW8_SK3_SKFTR0_SKXCCM0_TLDS2_ULSGRO0_USL1_UIOFGRO0_USFGROn1_VSn1_VWA8_VWB4_WSGRA0_WSGRB0_WS64_WG16_16_1,0.0,1060.1,1460.45
256,1024,8192,7168,False,torch.bfloat16,torch.bfloat16,False,False,hipblaslt,440483,0,113.4358,Cijk_Alik_Bljk_BBS_BH_Bias_HA_S_SAV_UserArgs_MT256x256x64_MI16x16x1_CMS_SN_LDSB0_AFC1_AFEM1_AFEM1_ASEM1_CLR0_CADS0_DTLA1_DTLB1_DTVA0_DTVB0_EPS0_FDSI0_GRPM1_GRVWA8_GRVWB8_GSU0_GSUAMB_GLS0_ISA950_IU1_K1_LDSTI0_LBSPPA1024_LBSPPB1024_LBSPPM0_LPA16_LPB16_LPM0_LRVW8_LWPMn1_MIAV0_MIWT8_8_MO40_NTn1_NTA0_NTB3_NTC6_NTD3_NTM0_NEPBS0_NLCA1_NLCB1_ONLL1_PGR2_PLR1_PKA1_SIA3_SS1_SPO0_SRVW0_SSO0_SVW8_SK3_SKFTR0_SKXCCM8_TLDS1_ULSGRO0_USL1_UIOFGRO0_USFGRO0_VSn1_VWA8_VWB8_WSGRA0_WSGRB0_WS64_WG32_8_1,0.0,1060.15,1312.62
256,1024,8192,28672,False,torch.bfloat16,torch.bfloat16,False,False,hipblaslt,440440,0,353.5274,Cijk_Alik_Bljk_BBS_BH_Bias_HA_S_SAV_UserArgs_MT256x256x64_MI16x16x1_CMS_SN_LDSB0_AFC1_AFEM1_AFEM1_ASEM1_CLR0_CADS0_DTLA1_DTLB1_DTVA0_DTVB0_EPS0_FDSI0_GRPM1_GRVWA8_GRVWB8_GSU0_GSUAMB_GLS0_ISA950_IU1_K1_LDSTI0_LBSPPA1024_LBSPPB1024_LBSPPM0_LPA16_LPB16_LPM0_LRVW8_LWPMn1_MIAV0_MIWT8_8_MO40_NTn1_NTA3_NTB3_NTC5_NTD2_NTM0_NEPBS0_NLCA1_NLCB1_ONLL1_PGR2_PLR1_PKA1_SIA3_SS1_SPO0_SRVW0_SSO1_SVW8_SK3_SKFTR0_SKXCCM0_TLDS1_ULSGRO0_USL1_UIOFGRO0_USFGRO0_VSn1_VWA8_VWB8_WSGRA0_WSGRB0_WS64_WG32_8_1,0.0,1360.68,1542.34
256,2048,8192,3584,False,torch.bfloat16,torch.bfloat16,False,False,hipblaslt,439467,0,92.7091,Cijk_Alik_Bljk_BBS_BH_Bias_HA_S_SAV_UserArgs_MT256x256x64_MI16x16x1_CMS_SN_LDSB0_AFC0_AFEM1_AFEM1_ASEM1_CLR1_CADS0_DTLA1_DTLB1_DTVA0_DTVB0_EPS0_FDSI0_GRPM1_GRVWA8_GRVWB8_GSU0_GSUAMB_GLS0_ISA950_IU1_K1_LDSTI0_LBSPPA1024_LBSPPB1024_LBSPPM0_LPA16_LPB16_LPM0_LRVW8_LWPMn1_MIAV0_MIWT8_8_MO40_NTn1_NTA2_NTB1_NTC3_NTD5_NTM0_NEPBS16_NLCA1_NLCB1_ONLL1_PGR2_PLR1_PKA1_SIA3_SS1_SPO0_SRVW0_SSO1_SVW8_SK3_SKFTR0_SKXCCM0_TLDS1_ULSGRO0_USL1_UIOFGRO0_USFGRO0_VSn1_VWA8_VWB8_WSGRA0_WSGRB0_WS64_WG32_8_1,0.0,1297.17,1153.66
256,2048,8192,7168,False,torch.bfloat16,torch.bfloat16,False,False,asm,10,1,172.3823,_ZN5aiter24bf16gemm_bf16_tn_256x256E,0.0,1395.26,1046.25
256,2048,8192,28672,False,torch.bfloat16,torch.bfloat16,False,False,hipblaslt,440505,0,618.4741,Cijk_Alik_Bljk_BBS_BH_Bias_HA_S_SAV_UserArgs_MT256x256x64_MI16x16x1_CMS_SN_LDSB0_AFC1_AFEM1_AFEM1_ASEM1_CLR0_CADS0_DTLA1_DTLB1_DTVA0_DTVB0_EPS0_FDSI0_GRPM1_GRVWA8_GRVWB8_GSU0_GSUAMB_GLS0_ISA950_IU1_K1_LDSTI0_LBSPPA1024_LBSPPB1024_LBSPPM0_LPA16_LPB16_LPM0_LRVW8_LWPMn1_MIAV0_MIWT8_8_MO40_NTn1_NTA0_NTB1_NTC4_NTD7_NTM0_NEPBS12_NLCA1_NLCB1_ONLL1_PGR2_PLR1_PKA1_SIA3_SS1_SPO0_SRVW0_SSO1_SVW8_SK3_SKFTR0_SKXCCM8_TLDS1_ULSGRO0_USL1_UIOFGRO0_USFGRO0_VSn1_VWA8_VWB8_WSGRA0_WSGRB0_WS64_WG32_8_1,0.0,1555.56,1003.69
256,4096,8192,3584,False,torch.bfloat16,torch.bfloat16,False,False,asm,10,1,177.0024,_ZN5aiter24bf16gemm_bf16_tn_256x256E,0.0,1358.84,876.76
256,4096,8192,7168,False,torch.bfloat16,torch.bfloat16,False,False,asm,10,1,324.9569,_ZN5aiter24bf16gemm_bf16_tn_256x256E,0.0,1480.31,748.62
256,4096,8192,28672,False,torch.bfloat16,torch.bfloat16,False,False,hipblaslt,439452,0,1216.919,Cijk_Alik_Bljk_BBS_BH_Bias_HA_S_SAV_UserArgs_MT256x256x64_MI16x16x1_CMS_SN_LDSB0_AFC0_AFEM1_AFEM1_ASEM1_CLR1_CADS0_DTLA1_DTLB1_DTVA0_DTVB0_EPS0_FDSI0_GRPM1_GRVWA8_GRVWB8_GSU0_GSUAMB_GLS0_ISA950_IU1_K1_LDSTI0_LBSPPA1024_LBSPPB1024_LBSPPM0_LPA16_LPB16_LPM0_LRVW8_LWPMn1_MIAV0_MIWT8_8_MO40_NTn1_NTA0_NTB0_NTC0_NTD4_NTM0_NEPBS0_NLCA1_NLCB1_ONLL1_PGR2_PLR1_PKA1_SIA3_SS1_SPO0_SRVW0_SSO0_SVW8_SK3_SKFTR0_SKXCCM0_TLDS1_ULSGRO0_USL1_UIOFGRO0_USFGRO0_VSn1_VWA8_VWB8_WSGRA0_WSGRB0_WS64_WG32_8_1,0.0,1581.16,634.19
256,8192,8192,3584,False,torch.bfloat16,torch.bfloat16,False,False,asm,10,1,333.1274,_ZN5aiter24bf16gemm_bf16_tn_256x256E,0.0,1444.0,755.44
256,8192,8192,7168,False,torch.bfloat16,torch.bfloat16,False,False,hipblaslt,441281,0,627.6619,Cijk_Alik_Bljk_BBS_BH_Bias_HA_S_SAV_UserArgs_MT256x256x64_MI16x16x1_CMS_SN_LDSB0_AFC0_AFEM1_AFEM1_ASEM1_CLR1_CADS0_DTLA1_DTLB1_DTVA0_DTVB0_EPS0_FDSI0_GRPM1_GRVWA8_GRVWB8_GSU0_GSUAMB_GLS0_ISA950_IU1_K1_LDSTI0_LBSPPA1024_LBSPPB1024_LBSPPM0_LPA16_LPB16_LPM0_LRVW8_LWPMn1_MIAV0_MIWT8_8_MO40_NTn1_NTA0_NTB0_NTC0_NTD4_NTM0_NEPBS0_NLCA1_NLCB1_ONLL1_PGR2_PLR1_PKA1_SIA3_SS1_SPO0_SRVW0_SSO0_SVW8_SK3_SKFTR0_SKXCCM0_TLDS1_ULSGRO0_USL1_UIOFGRO0_USFGRO0_VSn1_VWA8_VWB8_WSGRA0_WSGRB0_WS64_WG32_8_1,0.0,1532.79,588.05
256,8192,8192,28672,False,torch.bfloat16,torch.bfloat16,False,False,hipblaslt,440510,0,2437.242,Cijk_Alik_Bljk_BBS_BH_Bias_HA_S_SAV_UserArgs_MT256x256x64_MI16x16x1_CMS_SN_LDSB0_AFC1_AFEM1_AFEM1_ASEM1_CLR0_CADS0_DTLA1_DTLB1_DTVA0_DTVB0_EPS0_FDSI0_GRPM1_GRVWA8_GRVWB8_GSU0_GSUAMB_GLS0_ISA950_IU1_K1_LDSTI0_LBSPPA1024_LBSPPB1024_LBSPPM0_LPA16_LPB16_LPM0_LRVW8_LWPMn1_MIAV0_MIWT8_8_MO40_NTn1_NTA1_NTB2_NTC0_NTD7_NTM0_NEPBS0_NLCA1_NLCB1_ONLL1_PGR2_PLR1_PKA1_SIA3_SS1_SPO1_SRVW0_SSO0_SVW8_SK3_SKFTR0_SKXCCM0_TLDS1_ULSGRO0_USL1_UIOFGRO0_USFGRO0_VSn1_VWA8_VWB8_WSGRA0_WSGRB0_WS64_WG32_8_1,0.0,1578.95,440.56
256,16384,8192,3584,False,torch.bfloat16,torch.bfloat16,False,False,hipblaslt,440588,0,648.9517,Cijk_Alik_Bljk_BBS_BH_Bias_HA_S_SAV_UserArgs_MT256x256x64_MI16x16x1_CMS_SN_LDSB0_AFC0_AFEM1_AFEM1_ASEM1_CLR1_CADS0_DTLA1_DTLB1_DTVA0_DTVB0_EPS0_FDSI0_GRPM1_GRVWA8_GRVWB8_GSU0_GSUAMB_GLS0_ISA950_IU1_K1_LDSTI0_LBSPPA1024_LBSPPB1024_LBSPPM0_LPA16_LPB16_LPM0_LRVW8_LWPMn1_MIAV0_MIWT8_8_MO40_NTn1_NTA1_NTB0_NTC7_NTD5_NTM0_NEPBS16_NLCA1_NLCB1_ONLL1_PGR2_PLR1_PKA1_SIA3_SS1_SPO0_SRVW0_SSO1_SVW8_SK3_SKFTR0_SKXCCM0_TLDS1_ULSGRO0_USL1_UIOFGRO0_USFGRO0_VSn1_VWA8_VWB8_WSGRA0_WSGRB0_WS64_WG32_8_1,0.0,1482.5,685.1
256,16384,8192,7168,False,torch.bfloat16,torch.bfloat16,False,False,hipblaslt,440334,0,1222.429,Cijk_Alik_Bljk_BBS_BH_Bias_HA_S_SAV_UserArgs_MT256x256x64_MI16x16x1_CMS_SN_LDSB0_AFC0_AFEM1_AFEM1_ASEM1_CLR1_CADS0_DTLA1_DTLB1_DTVA0_DTVB0_EPS0_FDSI0_GRPM1_GRVWA8_GRVWB8_GSU0_GSUAMB_GLS0_ISA950_IU1_K1_LDSTI0_LBSPPA1024_LBSPPB1024_LBSPPM0_LPA16_LPB16_LPM0_LRVW8_LWPMn1_MIAV0_MIWT8_8_MO40_NTn1_NTA2_NTB1_NTC4_NTD2_NTM0_NEPBS12_NLCA1_NLCB1_ONLL1_PGR2_PLR1_PKA1_SIA3_SS1_SPO0_SRVW0_SSO0_SVW8_SK3_SKFTR0_SKXCCM0_TLDS1_ULSGRO0_USL1_UIOFGRO0_USFGRO0_VSn1_VWA8_VWB8_WSGRA0_WSGRB0_WS64_WG32_8_1,0.0,1574.03,507.81
256,16384,8192,28672,False,torch.bfloat16,torch.bfloat16,False,False,hipblaslt,439464,0,4914.4576,Cijk_Alik_Bljk_BBS_BH_Bias_HA_S_SAV_UserArgs_MT256x256x64_MI16x16x1_CMS_SN_LDSB0_AFC0_AFEM1_AFEM1_ASEM1_CLR1_CADS0_DTLA1_DTLB1_DTVA0_DTVB0_EPS0_FDSI0_GRPM1_GRVWA8_GRVWB8_GSU0_GSUAMB_GLS0_ISA950_IU1_K1_LDSTI0_LBSPPA1024_LBSPPB1024_LBSPPM0_LPA16_LPB16_LPM0_LRVW8_LWPMn1_MIAV0_MIWT8_8_MO40_NTn1_NTA3_NTB2_NTC4_NTD4_NTM0_NEPBS16_NLCA1_NLCB1_ONLL1_PGR2_PLR1_PKA1_SIA3_SS1_SPO0_SRVW0_SSO0_SVW8_SK3_SKFTR0_SKXCCM4_TLDS1_ULSGRO0_USL1_UIOFGRO0_USFGRO0_VSn1_VWA8_VWB8_WSGRA0_WSGRB0_WS64_WG32_8_1,0.0,1566.11,341.38
256,32768,8192,3584,False,torch.bfloat16,torch.bfloat16,False,False,hipblaslt,439467,0,1264.7815,Cijk_Alik_Bljk_BBS_BH_Bias_HA_S_SAV_UserArgs_MT256x256x64_MI16x16x1_CMS_SN_LDSB0_AFC0_AFEM1_AFEM1_ASEM1_CLR1_CADS0_DTLA1_DTLB1_DTVA0_DTVB0_EPS0_FDSI0_GRPM1_GRVWA8_GRVWB8_GSU0_GSUAMB_GLS0_ISA950_IU1_K1_LDSTI0_LBSPPA1024_LBSPPB1024_LBSPPM0_LPA16_LPB16_LPM0_LRVW8_LWPMn1_MIAV0_MIWT8_8_MO40_NTn1_NTA2_NTB1_NTC3_NTD5_NTM0_NEPBS16_NLCA1_NLCB1_ONLL1_PGR2_PLR1_PKA1_SIA3_SS1_SPO0_SRVW0_SSO1_SVW8_SK3_SKFTR0_SKXCCM0_TLDS1_ULSGRO0_USL1_UIOFGRO0_USFGRO0_VSn1_VWA8_VWB8_WSGRA0_WSGRB0_WS64_WG32_8_1,0.0,1521.33,656.61
256,32768,8192,7168,False,torch.bfloat16,torch.bfloat16,False,False,hipblaslt,440588,0,2428.4901,Cijk_Alik_Bljk_BBS_BH_Bias_HA_S_SAV_UserArgs_MT256x256x64_MI16x16x1_CMS_SN_LDSB0_AFC0_AFEM1_AFEM1_ASEM1_CLR1_CADS0_DTLA1_DTLB1_DTVA0_DTVB0_EPS0_FDSI0_GRPM1_GRVWA8_GRVWB8_GSU0_GSUAMB_GLS0_ISA950_IU1_K1_LDSTI0_LBSPPA1024_LBSPPB1024_LBSPPM0_LPA16_LPB16_LPM0_LRVW8_LWPMn1_MIAV0_MIWT8_8_MO40_NTn1_NTA1_NTB0_NTC7_NTD5_NTM0_NEPBS16_NLCA1_NLCB1_ONLL1_PGR2_PLR1_PKA1_SIA3_SS1_SPO0_SRVW0_SSO1_SVW8_SK3_SKFTR0_SKXCCM0_TLDS1_ULSGRO0_USL1_UIOFGRO0_USFGRO0_VSn1_VWA8_VWB8_WSGRA0_WSGRB0_WS64_WG32_8_1,0.0,1584.64,462.87
256,32768,8192,28672,False,torch.bfloat16,torch.bfloat16,False,False,hipblaslt,439464,0,10067.9005,Cijk_Alik_Bljk_BBS_BH_Bias_HA_S_SAV_UserArgs_MT256x256x64_MI16x16x1_CMS_SN_LDSB0_AFC0_AFEM1_AFEM1_ASEM1_CLR1_CADS0_DTLA1_DTLB1_DTVA0_DTVB0_EPS0_FDSI0_GRPM1_GRVWA8_GRVWB8_GSU0_GSUAMB_GLS0_ISA950_IU1_K1_LDSTI0_LBSPPA1024_LBSPPB1024_LBSPPM0_LPA16_LPB16_LPM0_LRVW8_LWPMn1_MIAV0_MIWT8_8_MO40_NTn1_NTA3_NTB2_NTC4_NTD4_NTM0_NEPBS16_NLCA1_NLCB1_ONLL1_PGR2_PLR1_PKA1_SIA3_SS1_SPO0_SRVW0_SSO0_SVW8_SK3_SKFTR0_SKXCCM4_TLDS1_ULSGRO0_USL1_UIOFGRO0_USFGRO0_VSn1_VWA8_VWB8_WSGRA0_WSGRB0_WS64_WG32_8_1,0.0,1528.93,286.62
256,1,14336,8192,False,torch.bfloat16,torch.bfloat16,False,False,hipblaslt,440628,0,38.458,Cijk_Alik_Bljk_BBS_BH_Bias_HA_S_SAV_UserArgs_MT32x16x256_MI16x16x1_SN_LDSB0_AFC0_AFEM1_AFEM1_ASEM1_CLR1_CADS0_DTLA1_DTLB1_DTVA0_DTVB0_EPS1_FDSI0_GRPM1_GRVWA8_GRVWB8_GSU0_GSUAMB_GLS0_ISA950_IU1_K1_LDSTI0_LBSPPA1024_LBSPPB1024_LBSPPM0_LPA16_LPB16_LPM0_LRVW8_LWPMn1_MIAV1_MIWT2_1_MO40_NTn1_NTA5_NTB1_NTC0_NTD0_NTM0_NEPBS8_NLCA1_NLCB1_ONLL1_PGR1_PLR1_PKA1_SIA3_SS1_SPO1_SRVW0_SSO1_SVW2_SK3_SKFTR0_SKXCCM5_TLDS2_ULSGRO0_USL1_UIOFGRO0_USFGROn1_VSn1_VWA2_VWB1_WSGRA0_WSGRB0_WS64_WG16_4_2,0.0,6.11,6108.64
256,16,14336,8192,False,torch.bfloat16,torch.bfloat16,False,False,hipblaslt,440628,0,39.1379,Cijk_Alik_Bljk_BBS_BH_Bias_HA_S_SAV_UserArgs_MT32x16x256_MI16x16x1_SN_LDSB0_AFC0_AFEM1_AFEM1_ASEM1_CLR1_CADS0_DTLA1_DTLB1_DTVA0_DTVB0_EPS1_FDSI0_GRPM1_GRVWA8_GRVWB8_GSU0_GSUAMB_GLS0_ISA950_IU1_K1_LDSTI0_LBSPPA1024_LBSPPB1024_LBSPPM0_LPA16_LPB16_LPM0_LRVW8_LWPMn1_MIAV1_MIWT2_1_MO40_NTn1_NTA5_NTB1_NTC0_NTD0_NTM0_NEPBS8_NLCA1_NLCB1_ONLL1_PGR1_PLR1_PKA1_SIA3_SS1_SPO1_SRVW0_SSO1_SVW2_SK3_SKFTR0_SKXCCM5_TLDS2_ULSGRO0_USL1_UIOFGRO0_USFGROn1_VSn1_VWA2_VWB1_WSGRA0_WSGRB0_WS64_WG16_4_2,0.0,96.02,6019.79
256,32,14336,8192,False,torch.bfloat16,torch.bfloat16,False,False,hipblaslt,440891,0,40.6542,Cijk_Alik_Bljk_BBS_BH_Bias_HA_S_SAV_UserArgs_MT64x32x256_MI16x16x1_SN_LDSB0_AFC0_AFEM1_AFEM1_ASEM1_CLR0_CADS0_DTLA1_DTLB1_DTVA0_DTVB0_EPS0_FDSI0_GRPM1_GRVWA8_GRVWB8_GSU0_GSUAMB_GLS0_ISA950_IU1_K1_LDSTI0_LBSPPA1024_LBSPPB1024_LBSPPM0_LPA16_LPB16_LPM0_LRVW8_LWPMn1_MIAV0_MIWT2_1_MO40_NTn1_NTA4_NTB0_NTC3_NTD1_NTM0_NEPBS10_NLCA1_NLCB1_ONLL1_PGR2_PLR1_PKA1_SIA3_SS1_SPO0_SRVW0_SSO0_SVW2_SK3_SKFTR0_SKXCCM8_TLDS2_ULSGRO0_USL1_UIOFGRO0_USFGROn1_VSn1_VWA2_VWB1_WSGRA0_WSGRB0_WS64_WG32_8_1,0.0,184.88,5813.0
256,64,14336,8192,False,torch.bfloat16,torch.bfloat16,False,False,hipblaslt,440552,0,45.351,Cijk_Alik_Bljk_BBS_BH_Bias_HA_S_SAV_UserArgs_MT64x64x256_MI16x16x1_SN_LDSB0_AFC0_AFEM1_AFEM1_ASEM1_CLR0_CADS0_DTLA0_DTLB0_DTVA0_DTVB0_EPS0_FDSI0_GRPM1_GRVWA8_GRVWB8_GSU0_GSUAMB_GLS0_ISA950_IU1_K1_LDSTI0_LBSPPA2048_LBSPPB512_LBSPPM0_LPA16_LPB16_LPM0_LRVW8_LWPMn1_MIAV0_MIWT4_1_MO40_NTn1_NTA5_NTB3_NTC5_NTD2_NTM0_NEPBS14_NLCA1_NLCB1_ONLL1_PGR2_PLR1_PKA1_SIA3_SS1_SPO1_SRVW0_SSO4_SVW4_SK3_SKFTR0_SKXCCM8_TLDS2_ULSGRO0_USL1_UIOFGRO0_USFGRO0_VSn1_VWA4_VWB1_WSGRA0_WSGRB0_WS64_WG16_16_1,0.0,331.47,5242.76
256,128,14336,8192,False,torch.bfloat16,torch.bfloat16,False,False,hipblaslt,440456,0,52.2152,Cijk_Alik_Bljk_BBS_BH_Bias_HA_S_SAV_UserArgs_MT128x128x128_MI16x16x1_SN_LDSB0_AFC1_AFEM1_AFEM1_ASEM1_CLR1_CADS0_DTLA0_DTLB0_DTVA0_DTVB0_EPS0_FDSI0_GRPM1_GRVWA8_GRVWB8_GSU0_GSUAMB_GLS0_ISA950_IU1_K1_LDSTI0_LBSPPA1024_LBSPPB1024_LBSPPM0_LPA16_LPB16_LPM0_LRVW8_LWPMn1_MIAV0_MIWT4_4_MO40_NTn1_NTA7_NTB1_NTC2_NTD3_NTM0_NEPBS0_NLCA1_NLCB1_ONLL1_PGR2_PLR1_PKA1_SIA3_SS1_SPO0_SRVW0_SSO0_SVW4_SK3_SKFTR0_SKXCCM8_TLDS1_ULSGRO0_USL1_UIOFGRO0_USFGRO0_VSn1_VWA4_VWB4_WSGRA0_WSGRB0_WS64_WG32_8_1,0.0,575.79,4608.78
256,256,14336,8192,False,torch.bfloat16,torch.bfloat16,False,False,hipblaslt,440799,0,75.2632,Cijk_Alik_Bljk_BBS_BH_Bias_HA_S_SAV_UserArgs_MT128x256x64_MI16x16x1_SN_LDSB0_AFC0_AFEM1_AFEM1_ASEM1_CLR1_CADS0_DTLA1_DTLB1_DTVA0_DTVB0_EPS0_FDSI0_GRPM1_GRVWA8_GRVWB8_GSU0_GSUAMB_GLS0_ISA950_IU1_K1_LDSTI0_LBSPPA1024_LBSPPB1024_LBSPPM0_LPA16_LPB16_LPM0_LRVW8_LWPMn1_MIAV0_MIWT4_8_MO40_NTn1_NTA4_NTB0_NTC4_NTD4_NTM0_NEPBS0_NLCA1_NLCB1_ONLL1_PGR2_PLR1_PKA1_SIA3_SS1_SPO0_SRVW0_SSO1_SVW4_SK3_SKFTR0_SKXCCM8_TLDS1_ULSGRO0_USL1_UIOFGRO0_USFGROn1_VSn1_VWA4_VWB8_WSGRA0_WSGRB0_WS64_WG32_8_1,0.0,798.92,3274.05
256,512,14336,8192,False,torch.bfloat16,torch.bfloat16,False,False,hipblaslt,440799,0,119.4186,Cijk_Alik_Bljk_BBS_BH_Bias_HA_S_SAV_UserArgs_MT128x256x64_MI16x16x1_SN_LDSB0_AFC0_AFEM1_AFEM1_ASEM1_CLR1_CADS0_DTLA1_DTLB1_DTVA0_DTVB0_EPS0_FDSI0_GRPM1_GRVWA8_GRVWB8_GSU0_GSUAMB_GLS0_ISA950_IU1_K1_LDSTI0_LBSPPA1024_LBSPPB1024_LBSPPM0_LPA16_LPB16_LPM0_LRVW8_LWPMn1_MIAV0_MIWT4_8_MO40_NTn1_NTA4_NTB0_NTC4_NTD4_NTM0_NEPBS0_NLCA1_NLCB1_ONLL1_PGR2_PLR1_PKA1_SIA3_SS1_SPO0_SRVW0_SSO1_SVW4_SK3_SKFTR0_SKXCCM8_TLDS1_ULSGRO0_USL1_UIOFGRO0_USFGROn1_VSn1_VWA4_VWB8_WSGRA0_WSGRB0_WS64_WG32_8_1,0.0,1007.04,2160.05
256,1024,14336,8192,False,torch.bfloat16,torch.bfloat16,False,False,asm,10,1,181.075,_ZN5aiter24bf16gemm_bf16_tn_256x256E,0.0,1328.28,1551.94
256,2048,14336,8192,False,torch.bfloat16,torch.bfloat16,False,False,hipblaslt,439532,0,345.903,Cijk_Alik_Bljk_BBS_BH_Bias_HA_S_SAV_UserArgs_MT256x256x64_MI16x16x1_CMS_SN_LDSB0_AFC0_AFEM1_AFEM1_ASEM1_CLR1_CADS0_DTLA1_DTLB1_DTVA0_DTVB0_EPS0_FDSI0_GRPM1_GRVWA8_GRVWB8_GSU0_GSUAMB_GLS0_ISA950_IU1_K1_LDSTI0_LBSPPA1024_LBSPPB1024_LBSPPM0_LPA16_LPB16_LPM0_LRVW8_LWPMn1_MIAV0_MIWT8_8_MO40_NTn1_NTA0_NTB1_NTC5_NTD4_NTM0_NEPBS16_NLCA1_NLCB1_ONLL1_PGR2_PLR1_PKA1_SIA3_SS1_SPO0_SRVW0_SSO1_SVW8_SK3_SKFTR0_SKXCCM4_TLDS1_ULSGRO0_USL1_UIOFGRO0_USFGRO0_VSn1_VWA8_VWB8_WSGRA0_WSGRB0_WS64_WG32_8_1,0.0,1390.67,945.8
256,4096,14336,8192,False,torch.bfloat16,torch.bfloat16,False,False,hipblaslt,440483,0,653.8876,Cijk_Alik_Bljk_BBS_BH_Bias_HA_S_SAV_UserArgs_MT256x256x64_MI16x16x1_CMS_SN_LDSB0_AFC1_AFEM1_AFEM1_ASEM1_CLR0_CADS0_DTLA1_DTLB1_DTVA0_DTVB0_EPS0_FDSI0_GRPM1_GRVWA8_GRVWB8_GSU0_GSUAMB_GLS0_ISA950_IU1_K1_LDSTI0_LBSPPA1024_LBSPPB1024_LBSPPM0_LPA16_LPB16_LPM0_LRVW8_LWPMn1_MIAV0_MIWT8_8_MO40_NTn1_NTA0_NTB3_NTC6_NTD3_NTM0_NEPBS0_NLCA1_NLCB1_ONLL1_PGR2_PLR1_PKA1_SIA3_SS1_SPO0_SRVW0_SSO0_SVW8_SK3_SKFTR0_SKXCCM8_TLDS1_ULSGRO0_USL1_UIOFGRO0_USFGRO0_VSn1_VWA8_VWB8_WSGRA0_WSGRB0_WS64_WG32_8_1,0.0,1471.31,641.44
256,8192,14336,8192,False,torch.bfloat16,torch.bfloat16,False,False,hipblaslt,440508,0,1221.8425,Cijk_Alik_Bljk_BBS_BH_Bias_HA_S_SAV_UserArgs_MT256x256x64_MI16x16x1_CMS_SN_LDSB0_AFC1_AFEM1_AFEM1_ASEM1_CLR0_CADS0_DTLA1_DTLB1_DTVA0_DTVB0_EPS0_FDSI0_GRPM1_GRVWA8_GRVWB8_GSU0_GSUAMB_GLS0_ISA950_IU1_K1_LDSTI0_LBSPPA1024_LBSPPB1024_LBSPPM0_LPA16_LPB16_LPM0_LRVW8_LWPMn1_MIAV0_MIWT8_8_MO40_NTn1_NTA1_NTB1_NTC4_NTD7_NTM0_NEPBS0_NLCA1_NLCB1_ONLL1_PGR2_PLR1_PKA1_SIA3_SS1_SPO0_SRVW0_SSO0_SVW8_SK3_SKFTR0_SKXCCM8_TLDS1_ULSGRO0_USL1_UIOFGRO0_USFGRO0_VSn1_VWA8_VWB8_WSGRA0_WSGRB0_WS64_WG32_8_1,0.0,1574.79,494.32
256,16384,14336,8192,False,torch.bfloat16,torch.bfloat16,False,False,hipblaslt,440624,0,2425.2544,Cijk_Alik_Bljk_BBS_BH_Bias_HA_S_SAV_UserArgs_MT256x256x64_MI16x16x1_CMS_SN_LDSB0_AFC0_AFEM1_AFEM1_ASEM1_CLR1_CADS0_DTLA1_DTLB1_DTVA0_DTVB0_EPS0_FDSI0_GRPM1_GRVWA8_GRVWB8_GSU0_GSUAMB_GLS0_ISA950_IU1_K1_LDSTI0_LBSPPA1024_LBSPPB1024_LBSPPM0_LPA16_LPB16_LPM0_LRVW8_LWPMn1_MIAV0_MIWT8_8_MO40_NTn1_NTA1_NTB3_NTC4_NTD5_NTM0_NEPBS16_NLCA1_NLCB1_ONLL1_PGR2_PLR1_PKA1_SIA3_SS1_SPO1_SRVW0_SSO0_SVW8_SK3_SKFTR0_SKXCCM0_TLDS1_ULSGRO0_USL1_UIOFGRO0_USFGRO0_VSn1_VWA8_VWB8_WSGRA0_WSGRB0_WS64_WG32_8_1,0.0,1586.76,401.23
256,32768,14336,8192,False,torch.bfloat16,torch.bfloat16,False,False,hipblaslt,440588,0,4832.0372,Cijk_Alik_Bljk_BBS_BH_Bias_HA_S_SAV_UserArgs_MT256x256x64_MI16x16x1_CMS_SN_LDSB0_AFC0_AFEM1_AFEM1_ASEM1_CLR1_CADS0_DTLA1_DTLB1_DTVA0_DTVB0_EPS0_FDSI0_GRPM1_GRVWA8_GRVWB8_GSU0_GSUAMB_GLS0_ISA950_IU1_K1_LDSTI0_LBSPPA1024_LBSPPB1024_LBSPPM0_LPA16_LPB16_LPM0_LRVW8_LWPMn1_MIAV0_MIWT8_8_MO40_NTn1_NTA1_NTB0_NTC7_NTD5_NTM0_NEPBS16_NLCA1_NLCB1_ONLL1_PGR2_PLR1_PKA1_SIA3_SS1_SPO0_SRVW0_SSO1_SVW8_SK3_SKFTR0_SKXCCM0_TLDS1_ULSGRO0_USL1_UIOFGRO0_USFGRO0_VSn1_VWA8_VWB8_WSGRA0_WSGRB0_WS64_WG32_8_1,0.0,1592.82,354.15
256,1,57344,8192,False,torch.bfloat16,torch.bfloat16,False,False,hipblaslt,440894,0,139.7265,Cijk_Alik_Bljk_BBS_BH_Bias_HA_S_SAV_UserArgs_MT32x32x256_MI16x16x1_SN_LDSB1_AFC0_AFEM1_AFEM1_ASEM1_CLR1_CADS0_DTLA0_DTLB0_DTVA0_DTVB0_EPS0_FDSI0_GRPM1_GRVWA8_GRVWB8_GSU0_GSUAMB_GLS0_ISA950_IU1_K1_LDSTI0_LBSPPA512_LBSPPB512_LBSPPM0_LPA16_LPB16_LPM0_LRVW8_LWPMn1_MIAV0_MIWT1_1_MO40_NTn1_NTA4_NTB0_NTC0_NTD0_NTM0_NEPBS0_NLCA1_NLCB1_ONLL1_PGR2_PLR1_PKA1_SIA3_SS1_SPO0_SRVW0_SSO0_SVW1_SK3_SKFTR0_SKXCCM8_TLDS1_ULSGRO0_USL1_UIOFGRO0_USFGRO0_VSn1_VWA1_VWB1_WSGRA0_WSGRB0_WS64_WG32_8_1,0.0,6.72,6724.96
256,16,57344,8192,False,torch.bfloat16,torch.bfloat16,False,False,hipblaslt,440894,0,138.785,Cijk_Alik_Bljk_BBS_BH_Bias_HA_S_SAV_UserArgs_MT32x32x256_MI16x16x1_SN_LDSB1_AFC0_AFEM1_AFEM1_ASEM1_CLR1_CADS0_DTLA0_DTLB0_DTVA0_DTVB0_EPS0_FDSI0_GRPM1_GRVWA8_GRVWB8_GSU0_GSUAMB_GLS0_ISA950_IU1_K1_LDSTI0_LBSPPA512_LBSPPB512_LBSPPM0_LPA16_LPB16_LPM0_LRVW8_LWPMn1_MIAV0_MIWT1_1_MO40_NTn1_NTA4_NTB0_NTC0_NTD0_NTM0_NEPBS0_NLCA1_NLCB1_ONLL1_PGR2_PLR1_PKA1_SIA3_SS1_SPO0_SRVW0_SSO0_SVW1_SK3_SKFTR0_SKXCCM8_TLDS1_ULSGRO0_USL1_UIOFGRO0_USFGRO0_VSn1_VWA1_VWB1_WSGRA0_WSGRB0_WS64_WG32_8_1,0.0,108.31,6784.75
256,32,57344,8192,False,torch.bfloat16,torch.bfloat16,False,False,hipblaslt,440894,0,150.5846,Cijk_Alik_Bljk_BBS_BH_Bias_HA_S_SAV_UserArgs_MT32x32x256_MI16x16x1_SN_LDSB1_AFC0_AFEM1_AFEM1_ASEM1_CLR1_CADS0_DTLA0_DTLB0_DTVA0_DTVB0_EPS0_FDSI0_GRPM1_GRVWA8_GRVWB8_GSU0_GSUAMB_GLS0_ISA950_IU1_K1_LDSTI0_LBSPPA512_LBSPPB512_LBSPPM0_LPA16_LPB16_LPM0_LRVW8_LWPMn1_MIAV0_MIWT1_1_MO40_NTn1_NTA4_NTB0_NTC0_NTD0_NTM0_NEPBS0_NLCA1_NLCB1_ONLL1_PGR2_PLR1_PKA1_SIA3_SS1_SPO0_SRVW0_SSO0_SVW1_SK3_SKFTR0_SKXCCM8_TLDS1_ULSGRO0_USL1_UIOFGRO0_USFGRO0_VSn1_VWA1_VWB1_WSGRA0_WSGRB0_WS64_WG32_8_1,0.0,199.65,6267.03
256,64,57344,8192,False,torch.bfloat16,torch.bfloat16,False,False,hipblaslt,440848,0,154.0302,Cijk_Alik_Bljk_BBS_BH_Bias_HA_S_SAV_UserArgs_MT224x64x128_MI16x16x1_SN_LDSB1_AFC0_AFEM1_AFEM1_ASEM1_CLR1_CADS0_DTLA0_DTLB0_DTVA0_DTVB0_EPS0_FDSI0_GRPM1_GRVWA8_GRVWB8_GSU0_GSUAMB_GLS0_ISA950_IU1_K1_LDSTI0_LBSPPA256_LBSPPB512_LBSPPM0_LPA16_LPB16_LPM0_LRVW8_LWPMn1_MIAV0_MIWT7_2_MO40_NTn1_NTA4_NTB0_NTC0_NTD0_NTM0_NEPBS0_NLCA1_NLCB1_ONLL1_PGR2_PLR1_PKA1_SIA3_SS1_SPO0_SRVW0_SSO0_SVW1_SK3_SKFTR0_SKXCCM8_TLDS1_ULSGRO0_USL1_UIOFGRO0_USFGRO0_VSn1_VWA1_VWB2_WSGRA0_WSGRB0_WS64_WG32_8_1,0.0,390.38,6154.07
256,128,57344,8192,False,torch.bfloat16,torch.bfloat16,False,False,hipblaslt,440564,0,170.6136,Cijk_Alik_Bljk_BBS_BH_Bias_HA_S_SAV_UserArgs_MT256x128x64_MI16x16x1_SN_LDSB0_AFC0_AFEM1_AFEM1_ASEM1_CLR1_CADS0_DTLA1_DTLB1_DTVA0_DTVB0_EPS0_FDSI0_GRPM1_GRVWA8_GRVWB8_GSU0_GSUAMB_GLS0_ISA950_IU1_K1_LDSTI0_LBSPPA1024_LBSPPB1024_LBSPPM0_LPA16_LPB16_LPM0_LRVW8_LWPMn1_MIAV0_MIWT8_4_MO40_NTn1_NTA6_NTB2_NTC2_NTD0_NTM0_NEPBS10_NLCA1_NLCB1_ONLL1_PGR2_PLR1_PKA1_SIA3_SS1_SPO0_SRVW0_SSO1_SVW8_SK3_SKFTR0_SKXCCM8_TLDS1_ULSGRO0_USL1_UIOFGRO0_USFGRO0_VSn1_VWA8_VWB4_WSGRA0_WSGRB0_WS64_WG32_8_1,0.0,704.86,5605.07
256,256,57344,8192,False,torch.bfloat16,torch.bfloat16,False,False,hipblaslt,439452,0,214.4058,Cijk_Alik_Bljk_BBS_BH_Bias_HA_S_SAV_UserArgs_MT256x256x64_MI16x16x1_CMS_SN_LDSB0_AFC0_AFEM1_AFEM1_ASEM1_CLR1_CADS0_DTLA1_DTLB1_DTVA0_DTVB0_EPS0_FDSI0_GRPM1_GRVWA8_GRVWB8_GSU0_GSUAMB_GLS0_ISA950_IU1_K1_LDSTI0_LBSPPA1024_LBSPPB1024_LBSPPM0_LPA16_LPB16_LPM0_LRVW8_LWPMn1_MIAV0_MIWT8_8_MO40_NTn1_NTA0_NTB0_NTC0_NTD4_NTM0_NEPBS0_NLCA1_NLCB1_ONLL1_PGR2_PLR1_PKA1_SIA3_SS1_SPO0_SRVW0_SSO0_SVW8_SK3_SKFTR0_SKXCCM0_TLDS1_ULSGRO0_USL1_UIOFGRO0_USFGRO0_VSn1_VWA8_VWB8_WSGRA0_WSGRB0_WS64_WG32_8_1,0.0,1121.79,4538.49
256,512,57344,8192,False,torch.bfloat16,torch.bfloat16,False,False,hipblaslt,440226,0,377.8892,Cijk_Alik_Bljk_BBS_BH_Bias_HA_S_SAV_UserArgs_MT256x256x64_MI16x16x1_CMS_SN_LDSB0_AFC0_AFEM1_AFEM1_ASEM1_CLR1_CADS0_DTLA1_DTLB1_DTVA0_DTVB0_EPS0_FDSI0_GRPM1_GRVWA8_GRVWB8_GSU0_GSUAMB_GLS0_ISA950_IU1_K1_LDSTI0_LBSPPA1024_LBSPPB1024_LBSPPM0_LPA16_LPB16_LPM0_LRVW8_LWPMn1_MIAV0_MIWT8_8_MO40_NTn1_NTA4_NTB2_NTC1_NTD5_NTM0_NEPBS16_NLCA1_NLCB1_ONLL1_PGR2_PLR1_PKA1_SIA3_SS1_SPO0_SRVW0_SSO4_SVW8_SK3_SKFTR0_SKXCCM8_TLDS1_ULSGRO0_USL1_UIOFGRO0_USFGRO0_VSn1_VWA8_VWB8_WSGRA0_WSGRB0_WS64_WG32_8_1,0.0,1272.96,2663.83
256,1024,57344,8192,False,torch.bfloat16,torch.bfloat16,False,False,asm,10,1,693.132,_ZN5aiter24bf16gemm_bf16_tn_256x256E,0.0,1388.01,1549.12
256,2048,57344,8192,False,torch.bfloat16,torch.bfloat16,False,False,hipblaslt,439532,0,1246.7409,Cijk_Alik_Bljk_BBS_BH_Bias_HA_S_SAV_UserArgs_MT256x256x64_MI16x16x1_CMS_SN_LDSB0_AFC0_AFEM1_AFEM1_ASEM1_CLR1_CADS0_DTLA1_DTLB1_DTVA0_DTVB0_EPS0_FDSI0_GRPM1_GRVWA8_GRVWB8_GSU0_GSUAMB_GLS0_ISA950_IU1_K1_LDSTI0_LBSPPA1024_LBSPPB1024_LBSPPM0_LPA16_LPB16_LPM0_LRVW8_LWPMn1_MIAV0_MIWT8_8_MO40_NTn1_NTA0_NTB1_NTC5_NTD4_NTM0_NEPBS16_NLCA1_NLCB1_ONLL1_PGR2_PLR1_PKA1_SIA3_SS1_SPO0_SRVW0_SSO1_SVW8_SK3_SKFTR0_SKXCCM4_TLDS1_ULSGRO0_USL1_UIOFGRO0_USFGRO0_VSn1_VWA8_VWB8_WSGRA0_WSGRB0_WS64_WG32_8_1,0.0,1543.34,968.89
256,4096,57344,8192,False,torch.bfloat16,torch.bfloat16,False,False,hipblaslt,439452,0,2455.0899,Cijk_Alik_Bljk_BBS_BH_Bias_HA_S_SAV_UserArgs_MT256x256x64_MI16x16x1_CMS_SN_LDSB0_AFC0_AFEM1_AFEM1_ASEM1_CLR1_CADS0_DTLA1_DTLB1_DTVA0_DTVB0_EPS0_FDSI0_GRPM1_GRVWA8_GRVWB8_GSU0_GSUAMB_GLS0_ISA950_IU1_K1_LDSTI0_LBSPPA1024_LBSPPB1024_LBSPPM0_LPA16_LPB16_LPM0_LRVW8_LWPMn1_MIAV0_MIWT8_8_MO40_NTn1_NTA0_NTB0_NTC0_NTD4_NTM0_NEPBS0_NLCA1_NLCB1_ONLL1_PGR2_PLR1_PKA1_SIA3_SS1_SPO0_SRVW0_SSO0_SVW8_SK3_SKFTR0_SKXCCM0_TLDS1_ULSGRO0_USL1_UIOFGRO0_USFGRO0_VSn1_VWA8_VWB8_WSGRA0_WSGRB0_WS64_WG32_8_1,0.0,1567.47,601.36
256,8192,57344,8192,False,torch.bfloat16,torch.bfloat16,False,False,hipblaslt,439464,0,4823.8046,Cijk_Alik_Bljk_BBS_BH_Bias_HA_S_SAV_UserArgs_MT256x256x64_MI16x16x1_CMS_SN_LDSB0_AFC0_AFEM1_AFEM1_ASEM1_CLR1_CADS0_DTLA1_DTLB1_DTVA0_DTVB0_EPS0_FDSI0_GRPM1_GRVWA8_GRVWB8_GSU0_GSUAMB_GLS0_ISA950_IU1_K1_LDSTI0_LBSPPA1024_LBSPPB1024_LBSPPM0_LPA16_LPB16_LPM0_LRVW8_LWPMn1_MIAV0_MIWT8_8_MO40_NTn1_NTA3_NTB2_NTC4_NTD4_NTM0_NEPBS16_NLCA1_NLCB1_ONLL1_PGR2_PLR1_PKA1_SIA3_SS1_SPO0_SRVW0_SSO0_SVW8_SK3_SKFTR0_SKXCCM4_TLDS1_ULSGRO0_USL1_UIOFGRO0_USFGRO0_VSn1_VWA8_VWB8_WSGRA0_WSGRB0_WS64_WG32_8_1,0.0,1595.54,417.36
256,16384,57344,8192,False,torch.bfloat16,torch.bfloat16,False,False,hipblaslt,440588,0,9740.0474,Cijk_Alik_Bljk_BBS_BH_Bias_HA_S_SAV_UserArgs_MT256x256x64_MI16x16x1_CMS_SN_LDSB0_AFC0_AFEM1_AFEM1_ASEM1_CLR1_CADS0_DTLA1_DTLB1_DTVA0_DTVB0_EPS0_FDSI0_GRPM1_GRVWA8_GRVWB8_GSU0_GSUAMB_GLS0_ISA950_IU1_K1_LDSTI0_LBSPPA1024_LBSPPB1024_LBSPPM0_LPA16_LPB16_LPM0_LRVW8_LWPMn1_MIAV0_MIWT8_8_MO40_NTn1_NTA1_NTB0_NTC7_NTD5_NTM0_NEPBS16_NLCA1_NLCB1_ONLL1_PGR2_PLR1_PKA1_SIA3_SS1_SPO0_SRVW0_SSO1_SVW8_SK3_SKFTR0_SKXCCM0_TLDS1_ULSGRO0_USL1_UIOFGRO0_USFGRO0_VSn1_VWA8_VWB8_WSGRA0_WSGRB0_WS64_WG32_8_1,0.0,1580.4,316.94
256,32768,57344,8192,False,torch.bfloat16,torch.bfloat16,False,False,hipblaslt,440397,0,20959.1243,Cijk_Alik_Bljk_BBS_BH_Bias_HA_S_SAV_UserArgs_MT256x224x64_MI16x16x1_SN_LDSB0_AFC1_AFEM1_AFEM1_ASEM1_CLR1_CADS0_DTLA1_DTLB1_DTVA0_DTVB0_EPS0_FDSI0_GRPM1_GRVWA8_GRVWB8_GSU0_GSUAMB_GLS0_ISA950_IU1_K1_LDSTI0_LBSPPA1024_LBSPPB1024_LBSPPM0_LPA16_LPB16_LPM0_LRVW8_LWPMn1_MIAV0_MIWT8_7_MO40_NTn1_NTA0_NTB1_NTC6_NTD7_NTM0_NEPBS14_NLCA1_NLCB1_ONLL1_PGR2_PLR1_PKA1_SIA3_SS1_SPO1_SRVW0_SSO4_SVW8_SK3_SKFTR0_SKXCCM0_TLDS2_ULSGRO0_USL1_UIOFGRO0_USFGRO0_VSn1_VWA8_VWB1_WSGRA0_WSGRB0_WS64_WG32_8_1,0.0,1468.87,249.75
