aiter/configs/model_configs/llama70B_bf16_tuned_gemm.csv
gfx,cu_num,M,N,K,bias,dtype,outdtype,scaleAB,bpreshuffle,libtype,solidx,splitK,us,kernelName,err_ratio,tflops,bw
gfx950,256,64,192,1024,False,torch.bfloat16,torch.bfloat16,False,False,flydsl,504,4,3.9454,flydsl_hgemm_abf16_wbf16_bf16_t32x64x64x5_ks4_w1x4x1_bias0_ktail0_gm0_pft_gfx950,0.0065,6.38,139.11
gfx950,256,1,1280,8192,False,torch.bfloat16,torch.bfloat16,False,False,flydsl,243,8,7.15,flydsl_hgemm_abf16_wbf16_bf16_t16x64x64x6_ks8_w1x2x1_bias0_ktail0_gm0_pft_gfx950,0.025,2.93,2935.73
gfx950,256,16,1280,8192,False,torch.bfloat16,torch.bfloat16,False,False,flydsl,255,8,7.8699,flydsl_hgemm_abf16_wbf16_bf16_t16x64x64x7_ks8_w1x2x1_bias0_ktail0_gm0_pft_gfx950,0.0208,42.64,2703.29
gfx950,256,32,1280,8192,False,torch.bfloat16,torch.bfloat16,False,False,flydsl,928,8,8.9787,flydsl_hgemm_abf16_wbf16_bf16_t32x64x64x7_ks8_w1x4x1_bias0_ktail0_gm0_pft_gfx950,0.0218,74.74,2403.21
gfx950,256,64,1280,8192,False,torch.bfloat16,torch.bfloat16,False,False,flydsl,1834,8,11.5434,flydsl_hgemm_abf16_wbf16_bf16_t64x64x64x5_ks8_w2x2x1_bias0_ktail0_gm0_pft_gfx950,0.0226,116.27,1921.79
gfx950,256,128,1280,8192,False,torch.bfloat16,torch.bfloat16,False,False,asm,5,6,14.832,_ZN5aiter39bf16gemm_fp32bf16_tn_64x64_splitk_cleanE,0.0179,180.98,1577.42
gfx950,256,256,1280,8192,False,torch.bfloat16,torch.bfloat16,False,False,asm,8,4,18.8133,_ZN5aiter39bf16gemm_fp32bf16_tn_96x64_splitk_cleanE,0.0141,285.37,1372.5
gfx950,256,512,1280,8192,False,torch.bfloat16,torch.bfloat16,False,False,torch,0,0,25.9146,native,0.0,414.34,1183.54
gfx950,256,1024,1280,8192,False,torch.bfloat16,torch.bfloat16,False,False,torch,0,0,36.6048,native,0.0,586.67,1102.87
gfx950,256,2048,1280,8192,False,torch.bfloat16,torch.bfloat16,False,False,torch,0,0,63.5883,native,0.0,675.43,939.93
gfx950,256,4096,1280,8192,False,torch.bfloat16,torch.bfloat16,False,False,torch,0,0,93.0381,native,0.0,923.27,1059.42
gfx950,256,8192,1280,8192,False,torch.bfloat16,torch.bfloat16,False,False,torch,0,0,146.2276,native,0.0,1174.87,1204.7
gfx950,256,16384,1280,8192,False,torch.bfloat16,torch.bfloat16,False,False,torch,0,0,273.6138,native,0.0,1255.78,1211.01
gfx950,256,32768,1280,8192,False,torch.bfloat16,torch.bfloat16,False,False,flydsl,393,1,517.6656,flydsl_hgemm_abf16_wbf16_bf16_t256x256x64x2_ks1_w2x4x1_bias0_ktail0_gm4_pht_gfx950,0.0,1327.49,1239.66
gfx950,256,1,2560,8192,False,torch.bfloat16,torch.bfloat16,False,False,flydsl,59,8,10.2259,flydsl_hgemm_abf16_wbf16_bf16_t16x128x64x4_ks8_w1x2x1_bias0_ktail0_gm0_pft_gfx950,0.0223,4.1,4103.75
gfx950,256,16,2560,8192,False,torch.bfloat16,torch.bfloat16,False,False,flydsl,22,8,11.4085,flydsl_hgemm_abf16_wbf16_bf16_t16x128x128x3_ks8_w1x2x2_bias0_ktail0_gm0_pft_gfx950,0.0272,58.82,3706.63
gfx950,256,32,2560,8192,False,torch.bfloat16,torch.bfloat16,False,False,flydsl,891,4,13.1075,flydsl_hgemm_abf16_wbf16_bf16_t32x64x64x6_ks4_w2x2x1_bias0_ktail0_gm0_pft_gfx950,0.014,102.4,3252.43
gfx950,256,64,2560,8192,False,torch.bfloat16,torch.bfloat16,False,False,flydsl,1494,4,15.6084,flydsl_hgemm_abf16_wbf16_bf16_t64x64x128x4_ks4_w4x2x1_bias0_ktail0_gm0_pft_gfx950,0.0141,171.98,2775.38
gfx950,256,128,2560,8192,False,torch.bfloat16,torch.bfloat16,False,False,asm,5,3,21.6237,_ZN5aiter39bf16gemm_fp32bf16_tn_64x64_splitk_cleanE,0.0107,248.28,2066.97
gfx950,256,256,2560,8192,False,torch.bfloat16,torch.bfloat16,False,False,torch,0,0,32.2041,native,0.0,333.42,1473.35
gfx950,256,512,2560,8192,False,torch.bfloat16,torch.bfloat16,False,False,torch,0,0,37.0672,native,0.0,579.35,1428.57
gfx950,256,1024,2560,8192,False,torch.bfloat16,torch.bfloat16,False,False,torch,0,0,57.8117,native,0.0,742.92,1106.4
gfx950,256,2048,2560,8192,False,torch.bfloat16,torch.bfloat16,False,False,torch,0,0,94.1089,native,0.0,912.77,913.66
gfx950,256,4096,2560,8192,False,torch.bfloat16,torch.bfloat16,False,False,torch,0,0,143.6807,native,0.0,1195.7,904.95
gfx950,256,8192,2560,8192,False,torch.bfloat16,torch.bfloat16,False,False,torch,0,0,276.8675,native,0.0,1241.02,787.76
gfx950,256,16384,2560,8192,False,torch.bfloat16,torch.bfloat16,False,False,flydsl,393,1,504.5019,flydsl_hgemm_abf16_wbf16_bf16_t256x256x64x2_ks1_w2x4x1_bias0_ktail0_gm4_pht_gfx950,0.0,1362.13,781.49
gfx950,256,32768,2560,8192,False,torch.bfloat16,torch.bfloat16,False,False,torch,0,0,899.0055,native,0.0,1528.79,830.46
gfx950,256,1,7168,8192,False,torch.bfloat16,torch.bfloat16,False,False,triton,0,0,20.4287,auto,0.0,5.75,5750.3
gfx950,256,16,7168,8192,False,torch.bfloat16,torch.bfloat16,False,False,triton,0,0,21.1734,auto,0.0,88.75,5569.82
gfx950,256,32,7168,8192,False,torch.bfloat16,torch.bfloat16,False,False,triton,0,0,23.3376,auto,0.0,161.03,5074.37
gfx950,256,64,7168,8192,False,torch.bfloat16,torch.bfloat16,False,False,triton,0,0,28.7998,auto,0.0,260.98,4146.09
gfx950,256,128,7168,8192,False,torch.bfloat16,torch.bfloat16,False,False,torch,0,0,38.2101,native,0.0,393.41,3176.46
gfx950,256,256,7168,8192,False,torch.bfloat16,torch.bfloat16,False,False,torch,0,0,48.9286,native,0.0,614.46,2560.97
gfx950,256,512,7168,8192,False,torch.bfloat16,torch.bfloat16,False,False,flydsl,7,1,76.3268,flydsl_hgemm_abf16_wbf16_bf16_t128x128x128x2_ks1_w2x4x1_bias0_ktail0_gm0_pht_gfx950,0.0,787.79,1744.72
gfx950,256,1024,7168,8192,False,torch.bfloat16,torch.bfloat16,False,False,torch,0,0,119.1762,native,0.0,1009.09,1249.39
gfx950,256,2048,7168,8192,False,torch.bfloat16,torch.bfloat16,False,False,flydsl,393,1,179.2413,flydsl_hgemm_abf16_wbf16_bf16_t256x256x64x2_ks1_w2x4x1_bias0_ktail0_gm4_pht_gfx950,0.0,1341.87,1006.21
gfx950,256,4096,7168,8192,False,torch.bfloat16,torch.bfloat16,False,False,asm,10,1,339.1781,_ZN5aiter24bf16gemm_bf16_tn_256x256E,0.0,1418.24,717.23
gfx950,256,8192,7168,8192,False,torch.bfloat16,torch.bfloat16,False,False,flydsl,19,1,667.5975,flydsl_hgemm_abf16_wbf16_bf16_t256x256x64x2_ks1_w2x4x1_bias0_ktail0_gm4_pht_gfx950,0.0,1441.1,552.88
gfx950,256,16384,7168,8192,False,torch.bfloat16,torch.bfloat16,False,False,torch,0,0,1241.8043,native,0.0,1549.48,499.88
gfx950,256,32768,7168,8192,False,torch.bfloat16,torch.bfloat16,False,False,torch,0,0,2432.1111,native,0.0,1582.28,462.18
gfx950,256,1,8192,1024,False,torch.bfloat16,torch.bfloat16,False,False,flydsl,246,1,5.7943,flydsl_hgemm_abf16_wbf16_bf16_t16x64x64x8_ks1_w1x1x2_bias0_ktail0_gm0_pft_gfx950,0.0024,2.9,2898.65
gfx950,256,1,8192,2048,False,torch.bfloat16,torch.bfloat16,False,False,flydsl,248,2,8.3604,flydsl_hgemm_abf16_wbf16_bf16_t16x64x64x7_ks2_w1x1x2_bias0_ktail0_gm0_pft_gfx950,0.0072,4.01,4015.95
gfx950,256,1,8192,3584,False,torch.bfloat16,torch.bfloat16,False,False,triton,0,0,11.3515,auto,0.0,5.17,5174.98
gfx950,256,1,8192,7168,False,torch.bfloat16,torch.bfloat16,False,False,triton,0,0,19.2655,auto,0.0,6.1,6097.49
gfx950,256,1,8192,8192,False,torch.bfloat16,torch.bfloat16,False,False,triton,0,0,22.6397,auto,0.0,5.93,5929.87
gfx950,256,1,8192,28672,False,torch.bfloat16,torch.bfloat16,False,False,torch,0,0,75.5187,native,0.0,6.22,6221.45
gfx950,256,16,8192,1024,False,torch.bfloat16,torch.bfloat16,False,False,triton,0,0,5.6798,auto,0.0,47.26,3005.76
gfx950,256,16,8192,2048,False,torch.bfloat16,torch.bfloat16,False,False,triton,0,0,8.5129,auto,0.0,63.07,3980.09
gfx950,256,16,8192,3584,False,torch.bfloat16,torch.bfloat16,False,False,triton,0,0,11.9719,auto,0.0,78.48,4936.32
gfx950,256,16,8192,7168,False,torch.bfloat16,torch.bfloat16,False,False,triton,0,0,19.9891,auto,0.0,94.0,5899.82
gfx950,256,16,8192,8192,False,torch.bfloat16,torch.bfloat16,False,False,triton,0,0,23.0763,auto,0.0,93.06,5838.98
gfx950,256,16,8192,28672,False,torch.bfloat16,torch.bfloat16,False,False,triton,0,0,76.4033,auto,0.0,98.38,6163.89
gfx950,256,32,8192,1024,False,torch.bfloat16,torch.bfloat16,False,False,triton,0,0,5.9912,auto,0.0,89.61,2898.76
gfx950,256,32,8192,2048,False,torch.bfloat16,torch.bfloat16,False,False,triton,0,0,8.6955,auto,0.0,123.48,3934.19
gfx950,256,32,8192,3584,False,torch.bfloat16,torch.bfloat16,False,False,triton,0,0,12.5588,auto,0.0,149.62,4735.64
gfx950,256,32,8192,7168,False,torch.bfloat16,torch.bfloat16,False,False,triton,0,0,21.9947,auto,0.0,170.86,5384.19
gfx950,256,32,8192,8192,False,torch.bfloat16,torch.bfloat16,False,False,triton,0,0,24.0001,auto,0.0,178.96,5636.07
gfx950,256,32,8192,28672,False,torch.bfloat16,torch.bfloat16,False,False,torch,0,0,78.8746,native,0.0,190.59,5985.72
gfx950,256,64,8192,2048,False,torch.bfloat16,torch.bfloat16,False,False,triton,0,0,10.4827,auto,0.0,204.86,3325.97
gfx950,256,64,8192,3584,False,torch.bfloat16,torch.bfloat16,False,False,flydsl,539,1,15.7547,flydsl_hgemm_abf16_wbf16_bf16_t32x64x128x5_ks1_w1x4x1_bias0_ktail0_gm0_pft_gfx950,0.0,238.54,3822.83
gfx950,256,64,8192,7168,False,torch.bfloat16,torch.bfloat16,False,False,flydsl,1428,2,29.1457,flydsl_hgemm_abf16_wbf16_bf16_t64x64x128x3_ks2_w2x2x1_bias0_ktail0_gm0_pft_gfx950,0.0061,257.88,4096.89
gfx950,256,64,8192,8192,False,torch.bfloat16,torch.bfloat16,False,False,triton,0,0,29.5157,auto,0.0,291.03,4618.39
gfx950,256,64,8192,28672,False,torch.bfloat16,torch.bfloat16,False,False,torch,0,0,85.6724,native,0.0,350.93,5538.31
gfx950,256,128,8192,1024,False,torch.bfloat16,torch.bfloat16,False,False,flydsl,1767,1,7.9485,flydsl_hgemm_abf16_wbf16_bf16_t64x64x64x6_ks1_w4x2x1_bias0_ktail0_gm0_pft_gfx950,0.0,270.17,2407.56
gfx950,256,128,8192,2048,False,torch.bfloat16,torch.bfloat16,False,False,triton,0,0,12.6498,auto,0.0,339.53,2859.8
gfx950,256,128,8192,3584,False,torch.bfloat16,torch.bfloat16,False,False,torch,0,0,19.9833,native,0.0,376.12,3089.33
gfx950,256,128,8192,7168,False,torch.bfloat16,torch.bfloat16,False,False,triton,0,0,36.833,auto,0.0,408.12,3295.22
gfx950,256,128,8192,8192,False,torch.bfloat16,torch.bfloat16,False,False,triton,0,0,41.1765,auto,0.0,417.23,3361.43
gfx950,256,128,8192,28672,False,torch.bfloat16,torch.bfloat16,False,False,torch,0,0,92.7508,native,0.0,648.29,5166.52
gfx950,256,256,8192,1024,False,torch.bfloat16,torch.bfloat16,False,False,flydsl,355,1,10.4508,flydsl_hgemm_abf16_wbf16_bf16_t128x64x64x5_ks1_w4x2x1_bias0_ktail0_gm0_pft_gfx950,0.0,410.97,2056.86
gfx950,256,256,8192,2048,False,torch.bfloat16,torch.bfloat16,False,False,triton,0,0,16.7874,auto,0.0,511.69,2311.1
gfx950,256,256,8192,3584,False,torch.bfloat16,torch.bfloat16,False,False,flydsl,249,1,27.0445,flydsl_hgemm_abf16_wbf16_bf16_t128x64x128x3_ks1_w4x1x2_bias0_ktail0_gm0_pft_gfx950,0.0047,555.84,2394.19
gfx950,256,256,8192,7168,False,torch.bfloat16,torch.bfloat16,False,False,flydsl,911,1,51.1109,flydsl_hgemm_abf16_wbf16_bf16_t64x128x128x3_ks1_w1x4x2_bias0_ktail0_gm0_pft_gfx950,0.006,588.23,2451.63
gfx950,256,256,8192,8192,False,torch.bfloat16,torch.bfloat16,False,False,triton,0,0,56.2137,auto,0.0,611.23,2536.86
gfx950,256,256,8192,28672,False,torch.bfloat16,torch.bfloat16,False,False,torch,0,0,127.5615,native,0.0,942.75,3830.59
gfx950,256,512,8192,1024,False,torch.bfloat16,torch.bfloat16,False,False,flydsl,148,1,14.2036,flydsl_hgemm_abf16_wbf16_bf16_t128x128x64x3_ks1_w2x4x1_bias0_ktail0_gm0_pft_gfx950,0.0,604.77,1845.62
gfx950,256,512,8192,2048,False,torch.bfloat16,torch.bfloat16,False,False,flydsl,268,1,23.6793,flydsl_hgemm_abf16_wbf16_bf16_t128x128x64x5_ks1_w4x4x1_bias0_ktail0_gm0_pft_gfx950,0.0,725.52,1859.86
gfx950,256,512,8192,3584,False,torch.bfloat16,torch.bfloat16,False,False,flydsl,204,1,39.6751,flydsl_hgemm_abf16_wbf16_bf16_t128x128x64x4_ks1_w2x4x1_bias0_ktail0_gm0_pft_gfx950,0.0,757.77,1783.96
gfx950,256,512,8192,7168,False,torch.bfloat16,torch.bfloat16,False,False,flydsl,9,1,71.6168,flydsl_hgemm_abf16_wbf16_bf16_t128x128x128x2_ks1_w2x4x1_bias0_ktail0_gm4_pht_gfx950,0.0,839.6,1859.47
gfx950,256,512,8192,8192,False,torch.bfloat16,torch.bfloat16,False,False,flydsl,7,1,80.0292,flydsl_hgemm_abf16_wbf16_bf16_t128x128x128x2_ks1_w2x4x1_bias0_ktail0_gm0_pht_gfx950,0.0,858.68,1886.75
gfx950,256,512,8192,28672,False,torch.bfloat16,torch.bfloat16,False,False,flydsl,684,2,252.3539,flydsl_hgemm_abf16_wbf16_bf16_t256x128x64x2_ks2_w2x4x1_bias0_ktail0_gm0_pht_gfx950,0.0084,953.1,2011.11
gfx950,256,1024,8192,1024,False,torch.bfloat16,torch.bfloat16,False,False,flydsl,466,1,22.0021,flydsl_hgemm_abf16_wbf16_bf16_t256x128x64x3_ks1_w4x4x1_bias0_ktail0_gm0_pft_gfx950,0.0,780.83,1620.37
gfx950,256,1024,8192,2048,False,torch.bfloat16,torch.bfloat16,False,False,flydsl,465,1,38.774,flydsl_hgemm_abf16_wbf16_bf16_t256x128x64x3_ks1_w4x2x2_bias0_ktail0_gm4_pft_gfx950,0.0034,886.15,1406.25
gfx950,256,1024,8192,3584,False,torch.bfloat16,torch.bfloat16,False,False,flydsl,464,1,62.3699,flydsl_hgemm_abf16_wbf16_bf16_t256x128x64x3_ks1_w4x2x2_bias0_ktail0_gm0_pft_gfx950,0.0046,964.08,1328.16
gfx950,256,1024,8192,7168,False,torch.bfloat16,torch.bfloat16,False,False,flydsl,465,1,113.3202,flydsl_hgemm_abf16_wbf16_bf16_t256x128x64x3_ks1_w4x2x2_bias0_ktail0_gm4_pft_gfx950,0.006,1061.23,1313.96
gfx950,256,1024,8192,8192,False,torch.bfloat16,torch.bfloat16,False,False,flydsl,464,1,127.6202,flydsl_hgemm_abf16_wbf16_bf16_t256x128x64x3_ks1_w4x2x2_bias0_ktail0_gm0_pft_gfx950,0.0062,1076.94,1314.62
gfx950,256,1024,8192,28672,False,torch.bfloat16,torch.bfloat16,False,False,torch,0,0,363.9713,native,0.0,1321.63,1498.08
gfx950,256,2048,8192,1024,False,torch.bfloat16,torch.bfloat16,False,False,asm,10,1,33.3926,_ZN5aiter24bf16gemm_bf16_tn_256x256E,0.0,1028.96,1632.88
gfx950,256,2048,8192,2048,False,torch.bfloat16,torch.bfloat16,False,False,torch,0,0,57.9885,native,0.0,1185.05,1301.94
gfx950,256,2048,8192,3584,False,torch.bfloat16,torch.bfloat16,False,False,torch,0,0,93.6292,native,0.0,1284.42,1142.32
gfx950,256,2048,8192,7168,False,torch.bfloat16,torch.bfloat16,False,False,torch,0,0,170.229,native,0.0,1412.91,1059.48
gfx950,256,2048,8192,8192,False,torch.bfloat16,torch.bfloat16,False,False,asm,10,1,187.4882,_ZN5aiter24bf16gemm_bf16_tn_256x256E,0.0,1466.11,1073.81
gfx950,256,2048,8192,28672,False,torch.bfloat16,torch.bfloat16,False,False,torch,0,0,624.0063,native,0.0,1541.77,994.79
gfx950,256,4096,8192,1024,False,torch.bfloat16,torch.bfloat16,False,False,asm,10,1,65.2702,_ZN5aiter24bf16gemm_bf16_tn_256x256E,0.0,1052.85,1413.73
gfx950,256,4096,8192,2048,False,torch.bfloat16,torch.bfloat16,False,False,flydsl,393,1,109.7443,flydsl_hgemm_abf16_wbf16_bf16_t256x256x64x2_ks1_w2x4x1_bias0_ktail0_gm4_pht_gfx950,0.0,1252.36,1070.13
gfx950,256,4096,8192,3584,False,torch.bfloat16,torch.bfloat16,False,False,torch,0,0,175.6191,native,0.0,1369.54,883.67
gfx950,256,4096,8192,7168,False,torch.bfloat16,torch.bfloat16,False,False,torch,0,0,320.0086,native,0.0,1503.2,760.2
gfx950,256,4096,8192,8192,False,torch.bfloat16,torch.bfloat16,False,False,torch,0,0,361.5513,native,0.0,1520.55,742.45
gfx950,256,4096,8192,28672,False,torch.bfloat16,torch.bfloat16,False,False,flydsl,18,1,1238.7209,flydsl_hgemm_abf16_wbf16_bf16_t256x256x64x2_ks1_w2x4x1_bias0_ktail0_gm0_pht_gfx950,0.0,1553.33,623.02
gfx950,256,8192,8192,1024,False,torch.bfloat16,torch.bfloat16,False,False,asm,10,1,122.1433,_ZN5aiter24bf16gemm_bf16_tn_256x256E,0.0,1125.23,1373.57
gfx950,256,8192,8192,2048,False,torch.bfloat16,torch.bfloat16,False,False,asm,10,1,206.1989,_ZN5aiter24bf16gemm_bf16_tn_256x256E,0.0,1333.07,976.37
gfx950,256,8192,8192,3584,False,torch.bfloat16,torch.bfloat16,False,False,torch,0,0,333.7705,native,0.0,1441.22,753.99
gfx950,256,8192,8192,7168,False,torch.bfloat16,torch.bfloat16,False,False,torch,0,0,617.1666,native,0.0,1558.85,598.05
gfx950,256,8192,8192,8192,False,torch.bfloat16,torch.bfloat16,False,False,torch,0,0,691.7679,native,0.0,1589.42,582.06
gfx950,256,8192,8192,28672,False,torch.bfloat16,torch.bfloat16,False,False,asm,10,1,2460.5241,_ZN5aiter24bf16gemm_bf16_tn_256x256E,0.0,1564.01,436.39
gfx950,256,16384,8192,1024,False,torch.bfloat16,torch.bfloat16,False,False,torch,0,0,231.2077,native,0.0,1188.88,1378.7
gfx950,256,16384,8192,2048,False,torch.bfloat16,torch.bfloat16,False,False,torch,0,0,397.7406,native,0.0,1382.2,927.99
gfx950,256,16384,8192,3584,False,torch.bfloat16,torch.bfloat16,False,False,torch,0,0,648.8803,native,0.0,1482.67,685.17
gfx950,256,16384,8192,7168,False,torch.bfloat16,torch.bfloat16,False,False,asm,10,1,1232.5026,_ZN5aiter24bf16gemm_bf16_tn_256x256E,0.0,1561.17,503.66
gfx950,256,16384,8192,8192,False,torch.bfloat16,torch.bfloat16,False,False,asm,10,1,1369.7023,_ZN5aiter24bf16gemm_bf16_tn_256x256E,0.0,1605.48,489.95
gfx950,256,16384,8192,28672,False,torch.bfloat16,torch.bfloat16,False,False,asm,10,1,4958.464,_ZN5aiter24bf16gemm_bf16_tn_256x256E,0.0,1552.21,338.36
gfx950,256,32768,8192,1024,False,torch.bfloat16,torch.bfloat16,False,False,torch,0,0,438.8252,native,0.0,1252.79,1414.59
gfx950,256,32768,8192,2048,False,torch.bfloat16,torch.bfloat16,False,False,torch,0,0,770.3625,native,0.0,1427.27,914.69
gfx950,256,32768,8192,3584,False,torch.bfloat16,torch.bfloat16,False,False,torch,0,0,1268.7315,native,0.0,1516.59,654.57
gfx950,256,32768,8192,7168,False,torch.bfloat16,torch.bfloat16,False,False,asm,10,1,2464.8315,_ZN5aiter24bf16gemm_bf16_tn_256x256E,0.0,1561.28,456.04
gfx950,256,32768,8192,8192,False,torch.bfloat16,torch.bfloat16,False,False,asm,10,1,2777.3258,_ZN5aiter24bf16gemm_bf16_tn_256x256E,0.0,1583.55,434.94
gfx950,256,32768,8192,28672,False,torch.bfloat16,torch.bfloat16,False,False,asm,10,1,9965.18,_ZN5aiter24bf16gemm_bf16_tn_256x256E,0.0,1544.69,289.58
gfx950,256,1,10240,8192,False,torch.bfloat16,torch.bfloat16,False,False,flydsl,195,8,31.2386,flydsl_hgemm_abf16_wbf16_bf16_t16x64x64x2_ks8_w1x2x1_bias0_ktail0_gm0_pft_gfx950,0.0227,5.37,5371.85
gfx950,256,16,10240,8192,False,torch.bfloat16,torch.bfloat16,False,False,flydsl,176,1,33.3051,flydsl_hgemm_abf16_wbf16_bf16_t16x64x256x4_ks1_w1x1x2_bias0_ktail0_gm0_pft_gfx950,0.0061,80.6,5055.14
gfx950,256,32,10240,8192,False,torch.bfloat16,torch.bfloat16,False,False,torch,0,0,36.4806,native,0.0,147.17,4631.28
gfx950,256,64,10240,8192,False,torch.bfloat16,torch.bfloat16,False,False,torch,0,0,38.6686,native,0.0,277.68,4399.73
gfx950,256,128,10240,8192,False,torch.bfloat16,torch.bfloat16,False,False,torch,0,0,46.2086,native,0.0,464.74,3732.87
gfx950,256,256,10240,8192,False,torch.bfloat16,torch.bfloat16,False,False,torch,0,0,65.9441,native,0.0,651.3,2687.27
gfx950,256,512,10240,8192,False,torch.bfloat16,torch.bfloat16,False,False,flydsl,25,1,111.2608,flydsl_hgemm_abf16_wbf16_bf16_t128x128x64x2_ks1_w2x4x1_bias0_ktail0_gm0_pht_gfx950,0.0,772.05,1677.56
gfx950,256,1024,10240,8192,False,torch.bfloat16,torch.bfloat16,False,False,torch,0,0,146.821,native,0.0,1170.12,1399.81
gfx950,256,2048,10240,8192,False,torch.bfloat16,torch.bfloat16,False,False,torch,0,0,279.6783,native,0.0,1228.55,869.82
gfx950,256,4096,10240,8192,False,torch.bfloat16,torch.bfloat16,False,False,flydsl,18,1,494.2747,flydsl_hgemm_abf16_wbf16_bf16_t256x256x64x2_ks1_w2x4x1_bias0_ktail0_gm0_pht_gfx950,0.0,1390.31,644.92
gfx950,256,8192,10240,8192,False,torch.bfloat16,torch.bfloat16,False,False,torch,0,0,867.1759,native,0.0,1584.9,541.71
gfx950,256,16384,10240,8192,False,torch.bfloat16,torch.bfloat16,False,False,torch,0,0,1756.1699,native,0.0,1565.21,439.45
gfx950,256,32768,10240,8192,False,torch.bfloat16,torch.bfloat16,False,False,torch,0,0,3491.2242,native,0.0,1574.68,394.05
gfx950,256,1,14336,8192,False,torch.bfloat16,torch.bfloat16,False,False,triton,0,0,38.0295,auto,0.0,6.18,6177.47
gfx950,256,16,14336,8192,False,torch.bfloat16,torch.bfloat16,False,False,triton,0,0,40.3147,auto,0.0,93.22,5844.07
gfx950,256,32,14336,8192,False,torch.bfloat16,torch.bfloat16,False,False,torch,0,0,41.8467,native,0.0,179.61,5647.35
gfx950,256,64,14336,8192,False,torch.bfloat16,torch.bfloat16,False,False,torch,0,0,46.8392,native,0.0,320.94,5076.19
gfx950,256,128,14336,8192,False,torch.bfloat16,torch.bfloat16,False,False,torch,0,0,60.4133,native,0.0,497.65,3983.36
gfx950,256,256,14336,8192,False,torch.bfloat16,torch.bfloat16,False,False,flydsl,61,1,84.346,flydsl_hgemm_abf16_wbf16_bf16_t128x128x64x3_ks1_w4x2x2_bias0_ktail0_gm0_pft_gfx950,0.0063,712.89,2921.48
gfx950,256,512,14336,8192,False,torch.bfloat16,torch.bfloat16,False,False,torch,0,0,115.6257,native,0.0,1040.07,2230.9
gfx950,256,1024,14336,8192,False,torch.bfloat16,torch.bfloat16,False,False,flydsl,393,1,178.7487,flydsl_hgemm_abf16_wbf16_bf16_t256x256x64x2_ks1_w2x4x1_bias0_ktail0_gm4_pht_gfx950,0.0,1345.57,1572.14
gfx950,256,2048,14336,8192,False,torch.bfloat16,torch.bfloat16,False,False,asm,10,1,344.8257,_ZN5aiter24bf16gemm_bf16_tn_256x256E,0.0,1395.01,948.76
gfx950,256,4096,14336,8192,False,torch.bfloat16,torch.bfloat16,False,False,asm,10,1,666.1374,_ZN5aiter24bf16gemm_bf16_tn_256x256E,0.0,1444.26,629.65
gfx950,256,8192,14336,8192,False,torch.bfloat16,torch.bfloat16,False,False,asm,10,1,1229.4203,_ZN5aiter24bf16gemm_bf16_tn_256x256E,0.0,1565.08,491.27
gfx950,256,16384,14336,8192,False,torch.bfloat16,torch.bfloat16,False,False,asm,10,1,2486.0516,_ZN5aiter24bf16gemm_bf16_tn_256x256E,0.0,1547.95,391.42
gfx950,256,32768,14336,8192,False,torch.bfloat16,torch.bfloat16,False,False,asm,10,1,4913.5308,_ZN5aiter24bf16gemm_bf16_tn_256x256E,0.0,1566.41,348.28
gfx950,256,1,57344,8192,False,torch.bfloat16,torch.bfloat16,False,False,triton,0,0,142.2374,auto,0.0,6.61,6606.25
gfx950,256,16,57344,8192,False,torch.bfloat16,torch.bfloat16,False,False,triton,0,0,146.1174,auto,0.0,102.88,6444.28
gfx950,256,32,57344,8192,False,torch.bfloat16,torch.bfloat16,False,False,torch,0,0,150.2313,native,0.0,200.12,6281.77
gfx950,256,64,57344,8192,False,torch.bfloat16,torch.bfloat16,False,False,torch,0,0,160.0695,native,0.0,375.65,5921.88
gfx950,256,128,57344,8192,False,torch.bfloat16,torch.bfloat16,False,False,torch,0,0,166.4385,native,0.0,722.54,5745.67
gfx950,256,256,57344,8192,False,torch.bfloat16,torch.bfloat16,False,False,torch,0,0,211.8234,native,0.0,1135.47,4593.82
gfx950,256,512,57344,8192,False,torch.bfloat16,torch.bfloat16,False,False,flydsl,393,1,373.0208,flydsl_hgemm_abf16_wbf16_bf16_t256x256x64x2_ks1_w2x4x1_bias0_ktail0_gm4_pht_gfx950,0.0,1289.57,2698.6
gfx950,256,1024,57344,8192,False,torch.bfloat16,torch.bfloat16,False,False,asm,10,1,687.0696,_ZN5aiter24bf16gemm_bf16_tn_256x256E,0.0,1400.26,1562.78
gfx950,256,2048,57344,8192,False,torch.bfloat16,torch.bfloat16,False,False,flydsl,393,1,1252.5353,flydsl_hgemm_abf16_wbf16_bf16_t256x256x64x2_ks1_w2x4x1_bias0_ktail0_gm4_pht_gfx950,0.0,1536.2,964.41
gfx950,256,4096,57344,8192,False,torch.bfloat16,torch.bfloat16,False,False,asm,10,1,2494.4877,_ZN5aiter24bf16gemm_bf16_tn_256x256E,0.0,1542.72,591.86
gfx950,256,8192,57344,8192,False,torch.bfloat16,torch.bfloat16,False,False,asm,10,1,4985.061,_ZN5aiter24bf16gemm_bf16_tn_256x256E,0.0,1543.93,403.86
gfx950,256,16384,57344,8192,False,torch.bfloat16,torch.bfloat16,False,False,asm,10,1,10106.1271,_ZN5aiter24bf16gemm_bf16_tn_256x256E,0.0,1523.15,305.46
gfx950,256,32768,57344,8192,False,torch.bfloat16,torch.bfloat16,False,False,flydsl,19,1,20316.6869,flydsl_hgemm_abf16_wbf16_bf16_t256x256x64x2_ks1_w2x4x1_bias0_ktail0_gm4_pht_gfx950,0.0,1515.32,257.64
gfx942,80,64,192,1024,False,torch.bfloat16,torch.bfloat16,False,False,opus,10300,0,4.2782,opus_gemm_gfx942_wkc_512x16x16x64_1x1_16x16x16_0x0x0,0.0,5.88,128.29
gfx942,80,1,1280,8192,False,torch.bfloat16,torch.bfloat16,False,False,opus,10300,0,12.9122,opus_gemm_gfx942_wkc_512x16x16x64_1x1_16x16x16_0x0x0,0.0,1.62,1625.63
