aiter/configs/model_configs/minimax_m3_bf16_tuned_gemm.csv
gfx,cu_num,M,N,K,bias,dtype,outdtype,scaleAB,bpreshuffle,libtype,solidx,splitK,us,kernelName,err_ratio,tflops,bw
gfx1250,256,1,128,6144,False,torch.bfloat16,torch.bfloat16,False,False,triton,0,0,0.0091,auto,0.0,0.17,174.41
gfx1250,256,1,6144,8192,False,torch.bfloat16,torch.bfloat16,False,False,triton,0,0,0.0110,auto,0.0,9.13,9128.92
gfx1250,256,1,6144,12288,False,torch.bfloat16,torch.bfloat16,False,False,triton,0,0,0.0175,auto,0.0,8.64,8645.21
gfx1250,256,1,9216,6144,False,torch.bfloat16,torch.bfloat16,False,False,triton,0,0,0.0111,auto,0.0,10.21,10211.57
gfx1250,256,1,9856,6144,False,torch.bfloat16,torch.bfloat16,False,False,triton,0,0,0.0131,auto,0.0,9.22,9227.09
gfx1250,256,1,24576,6144,False,torch.bfloat16,torch.bfloat16,False,False,triton,0,0,0.0455,auto,0.0,6.64,6637.91
gfx1250,256,1,200064,6144,False,torch.bfloat16,torch.bfloat16,False,False,triton,0,0,0.3169,auto,0.0,7.76,7759.50
gfx1250,256,2,200064,6144,False,torch.bfloat16,torch.bfloat16,False,False,triton,0,0,0.3191,auto,0.0,15.41,7705.89
gfx1250,256,3,128,6144,False,torch.bfloat16,torch.bfloat16,False,False,triton,0,0,0.0093,auto,0.0,0.51,173.69
gfx1250,256,3,6144,8192,False,torch.bfloat16,torch.bfloat16,False,False,triton,0,0,0.0115,auto,0.0,26.18,8734.23
gfx1250,256,3,6144,12288,False,torch.bfloat16,torch.bfloat16,False,False,triton,0,0,0.0187,auto,0.0,24.22,8080.51
gfx1250,256,3,9216,6144,False,torch.bfloat16,torch.bfloat16,False,False,triton,0,0,0.0117,auto,0.0,29.07,9699.48
gfx1250,256,3,9856,6144,False,torch.bfloat16,torch.bfloat16,False,False,triton,0,0,0.0135,auto,0.0,26.88,8965.64
gfx1250,256,3,24576,6144,False,torch.bfloat16,torch.bfloat16,False,False,triton,0,0,0.0462,auto,0.0,19.63,6545.81
gfx1250,256,4,128,6144,False,torch.bfloat16,torch.bfloat16,False,False,triton,0,0,0.0093,auto,0.0,0.68,174.78
gfx1250,256,4,6144,8192,False,torch.bfloat16,torch.bfloat16,False,False,triton,0,0,0.0115,auto,0.0,34.88,8729.15
gfx1250,256,4,6144,12288,False,torch.bfloat16,torch.bfloat16,False,False,triton,0,0,0.0189,auto,0.0,31.95,7994.84
gfx1250,256,4,9216,6144,False,torch.bfloat16,torch.bfloat16,False,False,triton,0,0,0.0118,auto,0.0,38.27,9578.33
gfx1250,256,4,9856,6144,False,torch.bfloat16,torch.bfloat16,False,False,triton,0,0,0.0136,auto,0.0,35.71,8937.60
gfx1250,256,4,24576,6144,False,torch.bfloat16,torch.bfloat16,False,False,triton,0,0,0.0463,auto,0.0,26.08,6524.95
gfx1250,256,4,200064,6144,False,torch.bfloat16,torch.bfloat16,False,False,triton,0,0,0.3195,auto,0.0,30.78,7700.34
gfx1250,256,5,128,6144,False,torch.bfloat16,torch.bfloat16,False,False,triton,0,0,0.0092,auto,0.0,0.85,176.92
gfx1250,256,5,6144,8192,False,torch.bfloat16,torch.bfloat16,False,False,triton,0,0,0.0119,auto,0.0,42.30,8471.15
gfx1250,256,5,6144,12288,False,torch.bfloat16,torch.bfloat16,False,False,triton,0,0,0.0201,auto,0.0,37.49,7506.79
gfx1250,256,5,9216,6144,False,torch.bfloat16,torch.bfloat16,False,False,triton,0,0,0.0120,auto,0.0,47.12,9436.62
gfx1250,256,5,9856,6144,False,torch.bfloat16,torch.bfloat16,False,False,triton,0,0,0.0150,auto,0.0,40.35,8081.47
gfx1250,256,5,24576,6144,False,torch.bfloat16,torch.bfloat16,False,False,triton,0,0,0.0473,auto,0.0,31.95,6396.47
gfx1250,256,5,200064,6144,False,torch.bfloat16,torch.bfloat16,False,False,triton,0,0,0.3876,auto,0.0,31.71,6348.30
gfx1250,256,6,128,6144,False,torch.bfloat16,torch.bfloat16,False,False,triton,0,0,0.0091,auto,0.0,1.03,180.30
gfx1250,256,6,6144,8192,False,torch.bfloat16,torch.bfloat16,False,False,triton,0,0,0.0118,auto,0.0,51.13,8536.69
gfx1250,256,6,6144,12288,False,torch.bfloat16,torch.bfloat16,False,False,triton,0,0,0.0201,auto,0.0,45.04,7517.21
gfx1250,256,6,9216,6144,False,torch.bfloat16,torch.bfloat16,False,False,triton,0,0,0.0120,auto,0.0,56.58,9445.46
gfx1250,256,6,9856,6144,False,torch.bfloat16,torch.bfloat16,False,False,triton,0,0,0.0151,auto,0.0,48.24,8053.55
gfx1250,256,6,24576,6144,False,torch.bfloat16,torch.bfloat16,False,False,triton,0,0,0.0472,auto,0.0,38.36,6401.43
gfx1250,256,6,200064,6144,False,torch.bfloat16,torch.bfloat16,False,False,triton,0,0,0.3885,auto,0.0,37.96,6333.79
gfx1250,256,7,128,6144,False,torch.bfloat16,torch.bfloat16,False,False,triton,0,0,0.0092,auto,0.0,1.19,180.21
gfx1250,256,7,6144,8192,False,torch.bfloat16,torch.bfloat16,False,False,triton,0,0,0.0120,auto,0.0,58.66,8396.24
gfx1250,256,7,6144,12288,False,torch.bfloat16,torch.bfloat16,False,False,triton,0,0,0.0202,auto,0.0,52.39,7497.05
gfx1250,256,7,9216,6144,False,torch.bfloat16,torch.bfloat16,False,False,triton,0,0,0.0121,auto,0.0,65.55,9382.39
gfx1250,256,7,9856,6144,False,torch.bfloat16,torch.bfloat16,False,False,triton,0,0,0.0152,auto,0.0,55.64,7963.15
gfx1250,256,7,24576,6144,False,torch.bfloat16,torch.bfloat16,False,False,triton,0,0,0.0472,auto,0.0,44.75,6402.18
gfx1250,256,7,200064,6144,False,torch.bfloat16,torch.bfloat16,False,False,triton,0,0,0.3886,auto,0.0,44.28,6333.12
gfx1250,256,8,128,6144,False,torch.bfloat16,torch.bfloat16,False,False,triton,0,0,0.0092,auto,0.0,1.37,182.51
gfx1250,256,8,6144,8192,False,torch.bfloat16,torch.bfloat16,False,False,triton,0,0,0.0122,auto,0.0,65.94,8261.09
gfx1250,256,8,6144,12288,False,torch.bfloat16,torch.bfloat16,False,False,triton,0,0,0.0202,auto,0.0,59.84,7494.79
gfx1250,256,8,9216,6144,False,torch.bfloat16,torch.bfloat16,False,False,triton,0,0,0.0121,auto,0.0,74.77,9367.12
gfx1250,256,8,9856,6144,False,torch.bfloat16,torch.bfloat16,False,False,triton,0,0,0.0152,auto,0.0,63.70,7979.39
gfx1250,256,8,24576,6144,False,torch.bfloat16,torch.bfloat16,False,False,triton,0,0,0.0473,auto,0.0,51.04,6390.77
gfx1250,256,8,200064,6144,False,torch.bfloat16,torch.bfloat16,False,False,triton,0,0,0.3892,auto,0.0,50.53,6324.81
gfx1250,256,9,128,6144,False,torch.bfloat16,torch.bfloat16,False,False,triton,0,0,0.0091,auto,0.0,1.55,184.32
gfx1250,256,9,6144,8192,False,torch.bfloat16,torch.bfloat16,False,False,triton,0,0,0.0123,auto,0.0,73.89,8231.09
gfx1250,256,9,6144,12288,False,torch.bfloat16,torch.bfloat16,False,False,triton,0,0,0.0206,auto,0.0,66.10,7360.25
gfx1250,256,9,9216,6144,False,torch.bfloat16,torch.bfloat16,False,False,triton,0,0,0.0121,auto,0.0,84.50,9411.60
gfx1250,256,9,9856,6144,False,torch.bfloat16,torch.bfloat16,False,False,triton,0,0,0.0154,auto,0.0,71.00,7908.18
gfx1250,256,9,24576,6144,False,torch.bfloat16,torch.bfloat16,False,False,triton,0,0,0.0365,auto,0.0,74.44,8286.12
gfx1250,256,9,200064,6144,False,torch.bfloat16,torch.bfloat16,False,False,triton,0,0,0.3241,auto,0.0,68.27,7596.82
gfx1250,256,10,128,6144,False,torch.bfloat16,torch.bfloat16,False,False,triton,0,0,0.0092,auto,0.0,1.71,185.16
gfx1250,256,10,6144,8192,False,torch.bfloat16,torch.bfloat16,False,False,triton,0,0,0.0123,auto,0.0,81.68,8191.34
gfx1250,256,10,6144,12288,False,torch.bfloat16,torch.bfloat16,False,False,triton,0,0,0.0207,auto,0.0,72.80,7298.15
gfx1250,256,10,9216,6144,False,torch.bfloat16,torch.bfloat16,False,False,triton,0,0,0.0122,auto,0.0,92.86,9310.71
gfx1250,256,10,9856,6144,False,torch.bfloat16,torch.bfloat16,False,False,triton,0,0,0.0152,auto,0.0,79.43,7964.22
gfx1250,256,10,24576,6144,False,torch.bfloat16,torch.bfloat16,False,False,triton,0,0,0.0367,auto,0.0,82.27,8243.78
gfx1250,256,10,200064,6144,False,torch.bfloat16,torch.bfloat16,False,False,triton,0,0,0.3256,auto,0.0,75.51,7564.11
gfx1250,256,11,128,6144,False,torch.bfloat16,torch.bfloat16,False,False,triton,0,0,0.0091,auto,0.0,1.90,187.51
gfx1250,256,11,6144,8192,False,torch.bfloat16,torch.bfloat16,False,False,triton,0,0,0.0125,auto,0.0,88.85,8102.28
gfx1250,256,11,6144,12288,False,torch.bfloat16,torch.bfloat16,False,False,triton,0,0,0.0207,auto,0.0,80.27,7316.86
gfx1250,256,11,9216,6144,False,torch.bfloat16,torch.bfloat16,False,False,triton,0,0,0.0123,auto,0.0,101.66,9269.15
gfx1250,256,11,9856,6144,False,torch.bfloat16,torch.bfloat16,False,False,triton,0,0,0.0153,auto,0.0,87.10,7940.80
gfx1250,256,11,24576,6144,False,torch.bfloat16,torch.bfloat16,False,False,triton,0,0,0.0366,auto,0.0,90.70,8264.14
gfx1250,256,11,200064,6144,False,torch.bfloat16,torch.bfloat16,False,False,triton,0,0,0.3277,auto,0.0,82.51,7515.14
gfx1250,256,12,128,6144,False,torch.bfloat16,torch.bfloat16,False,False,triton,0,0,0.0092,auto,0.0,2.06,187.98
gfx1250,256,12,6144,8192,False,torch.bfloat16,torch.bfloat16,False,False,triton,0,0,0.0124,auto,0.0,97.27,8133.29
gfx1250,256,12,6144,12288,False,torch.bfloat16,torch.bfloat16,False,False,triton,0,0,0.0206,auto,0.0,87.81,7338.86
gfx1250,256,12,9216,6144,False,torch.bfloat16,torch.bfloat16,False,False,triton,0,0,0.0123,auto,0.0,110.57,9244.50
gfx1250,256,12,9856,6144,False,torch.bfloat16,torch.bfloat16,False,False,triton,0,0,0.0153,auto,0.0,94.88,7931.49
gfx1250,256,12,24576,6144,False,torch.bfloat16,torch.bfloat16,False,False,triton,0,0,0.0367,auto,0.0,98.62,8238.15
gfx1250,256,12,200064,6144,False,torch.bfloat16,torch.bfloat16,False,False,triton,0,0,0.3285,auto,0.0,89.79,7497.96
gfx1250,256,13,128,6144,False,torch.bfloat16,torch.bfloat16,False,False,triton,0,0,0.0091,auto,0.0,2.24,189.89
gfx1250,256,13,6144,8192,False,torch.bfloat16,torch.bfloat16,False,False,triton,0,0,0.0125,auto,0.0,104.57,8073.84
gfx1250,256,13,6144,12288,False,torch.bfloat16,torch.bfloat16,False,False,triton,0,0,0.0207,auto,0.0,94.68,7306.30
gfx1250,256,13,9216,6144,False,torch.bfloat16,torch.bfloat16,False,False,triton,0,0,0.0124,auto,0.0,118.66,9159.79
gfx1250,256,13,9856,6144,False,torch.bfloat16,torch.bfloat16,False,False,triton,0,0,0.0155,auto,0.0,101.77,7855.63
gfx1250,256,13,24576,6144,False,torch.bfloat16,torch.bfloat16,False,False,triton,0,0,0.0376,auto,0.0,104.35,8047.97
gfx1250,256,13,200064,6144,False,torch.bfloat16,torch.bfloat16,False,False,triton,0,0,0.3296,auto,0.0,96.96,7474.65
gfx1250,256,14,128,6144,False,torch.bfloat16,torch.bfloat16,False,False,triton,0,0,0.0092,auto,0.0,2.39,189.50
gfx1250,256,14,6144,8192,False,torch.bfloat16,torch.bfloat16,False,False,triton,0,0,0.0126,auto,0.0,111.41,7989.94
gfx1250,256,14,6144,12288,False,torch.bfloat16,torch.bfloat16,False,False,triton,0,0,0.0207,auto,0.0,102.07,7315.84
gfx1250,256,14,9216,6144,False,torch.bfloat16,torch.bfloat16,False,False,triton,0,0,0.0124,auto,0.0,127.89,9169.66
gfx1250,256,14,9856,6144,False,torch.bfloat16,torch.bfloat16,False,False,triton,0,0,0.0155,auto,0.0,109.31,7836.42
gfx1250,256,14,24576,6144,False,torch.bfloat16,torch.bfloat16,False,False,triton,0,0,0.0379,auto,0.0,111.50,7986.76
gfx1250,256,14,200064,6144,False,torch.bfloat16,torch.bfloat16,False,False,triton,0,0,0.3296,auto,0.0,104.43,7476.62
gfx1250,256,15,128,6144,False,torch.bfloat16,torch.bfloat16,False,False,triton,0,0,0.0092,auto,0.0,2.55,190.38
gfx1250,256,15,6144,8192,False,torch.bfloat16,torch.bfloat16,False,False,triton,0,0,0.0127,auto,0.0,118.53,7935.74
gfx1250,256,15,6144,12288,False,torch.bfloat16,torch.bfloat16,False,False,triton,0,0,0.0208,auto,0.0,108.73,7275.46
gfx1250,256,15,9216,6144,False,torch.bfloat16,torch.bfloat16,False,False,triton,0,0,0.0125,auto,0.0,136.04,9106.03
gfx1250,256,15,9856,6144,False,torch.bfloat16,torch.bfloat16,False,False,triton,0,0,0.0155,auto,0.0,117.08,7835.96
gfx1250,256,15,24576,6144,False,torch.bfloat16,torch.bfloat16,False,False,triton,0,0,0.0379,auto,0.0,119.46,7988.59
gfx1250,256,15,200064,6144,False,torch.bfloat16,torch.bfloat16,False,False,triton,0,0,0.3302,auto,0.0,111.68,7463.97
gfx1250,256,16,128,6144,False,torch.bfloat16,torch.bfloat16,False,False,triton,0,0,0.0093,auto,0.0,2.70,190.58
gfx1250,256,16,6144,8192,False,torch.bfloat16,torch.bfloat16,False,False,triton,0,0,0.0127,auto,0.0,126.41,7936.74
gfx1250,256,16,6144,12288,False,torch.bfloat16,torch.bfloat16,False,False,triton,0,0,0.0206,auto,0.0,117.28,7358.84
gfx1250,256,16,9216,6144,False,torch.bfloat16,torch.bfloat16,False,False,triton,0,0,0.0123,auto,0.0,146.98,9225.97
gfx1250,256,16,9856,6144,False,torch.bfloat16,torch.bfloat16,False,False,triton,0,0,0.0156,auto,0.0,124.30,7801.32
gfx1250,256,16,24576,6144,False,torch.bfloat16,torch.bfloat16,False,False,triton,0,0,0.0387,auto,0.0,124.84,7827.75
gfx1250,256,16,200064,6144,False,torch.bfloat16,torch.bfloat16,False,False,triton,0,0,0.3303,auto,0.0,119.10,7463.95
gfx1250,256,32,128,6144,False,torch.bfloat16,torch.bfloat16,False,False,triton,0,0,0,auto,0.0,0.0,0.0
gfx1250,256,32,6144,8192,False,torch.bfloat16,torch.bfloat16,False,False,triton,0,0,0,auto,0.0,0.0,0.0
gfx1250,256,32,6144,12288,False,torch.bfloat16,torch.bfloat16,False,False,triton,0,0,0,auto,0.0,0.0,0.0
gfx1250,256,32,9216,6144,False,torch.bfloat16,torch.bfloat16,False,False,triton,0,0,0,auto,0.0,0.0,0.0
gfx1250,256,32,9856,6144,False,torch.bfloat16,torch.bfloat16,False,False,triton,0,0,0,auto,0.0,0.0,0.0
gfx1250,256,32,24576,6144,False,torch.bfloat16,torch.bfloat16,False,False,triton,0,0,0,auto,0.0,0.0,0.0
gfx1250,256,32,200064,6144,False,torch.bfloat16,torch.bfloat16,False,False,triton,0,0,0,auto,0.0,0.0,0.0
gfx1250,256,48,128,6144,False,torch.bfloat16,torch.bfloat16,False,False,triton,0,0,0,auto,0.0,0.0,0.0
gfx1250,256,48,6144,8192,False,torch.bfloat16,torch.bfloat16,False,False,triton,0,0,0,auto,0.0,0.0,0.0
gfx1250,256,48,6144,12288,False,torch.bfloat16,torch.bfloat16,False,False,triton,0,0,0,auto,0.0,0.0,0.0
gfx1250,256,48,9216,6144,False,torch.bfloat16,torch.bfloat16,False,False,triton,0,0,0,auto,0.0,0.0,0.0
gfx1250,256,48,9856,6144,False,torch.bfloat16,torch.bfloat16,False,False,triton,0,0,0,auto,0.0,0.0,0.0
gfx1250,256,48,24576,6144,False,torch.bfloat16,torch.bfloat16,False,False,triton,0,0,0,auto,0.0,0.0,0.0
gfx1250,256,48,200064,6144,False,torch.bfloat16,torch.bfloat16,False,False,triton,0,0,0,auto,0.0,0.0,0.0
gfx1250,256,64,128,6144,False,torch.bfloat16,torch.bfloat16,False,False,triton,0,0,0,auto,0.0,0.0,0.0
gfx1250,256,64,6144,8192,False,torch.bfloat16,torch.bfloat16,False,False,triton,0,0,0,auto,0.0,0.0,0.0
gfx1250,256,64,6144,12288,False,torch.bfloat16,torch.bfloat16,False,False,triton,0,0,0,auto,0.0,0.0,0.0
gfx1250,256,64,9216,6144,False,torch.bfloat16,torch.bfloat16,False,False,triton,0,0,0,auto,0.0,0.0,0.0
gfx1250,256,64,9856,6144,False,torch.bfloat16,torch.bfloat16,False,False,triton,0,0,0,auto,0.0,0.0,0.0
gfx1250,256,64,24576,6144,False,torch.bfloat16,torch.bfloat16,False,False,triton,0,0,0,auto,0.0,0.0,0.0
gfx1250,256,64,200064,6144,False,torch.bfloat16,torch.bfloat16,False,False,triton,0,0,0,auto,0.0,0.0,0.0
gfx1250,256,128,128,6144,False,torch.bfloat16,torch.bfloat16,False,False,triton,0,0,0,auto,0.0,0.0,0.0
gfx1250,256,128,6144,8192,False,torch.bfloat16,torch.bfloat16,False,False,triton,0,0,0,auto,0.0,0.0,0.0
gfx1250,256,128,6144,12288,False,torch.bfloat16,torch.bfloat16,False,False,triton,0,0,0,auto,0.0,0.0,0.0
gfx1250,256,128,9216,6144,False,torch.bfloat16,torch.bfloat16,False,False,triton,0,0,0,auto,0.0,0.0,0.0
gfx1250,256,128,9856,6144,False,torch.bfloat16,torch.bfloat16,False,False,triton,0,0,0,auto,0.0,0.0,0.0
gfx1250,256,128,24576,6144,False,torch.bfloat16,torch.bfloat16,False,False,triton,0,0,0,auto,0.0,0.0,0.0
gfx1250,256,128,200064,6144,False,torch.bfloat16,torch.bfloat16,False,False,triton,0,0,0,auto,0.0,0.0,0.0
gfx1250,256,256,128,6144,False,torch.bfloat16,torch.bfloat16,False,False,triton,0,0,0,auto,0.0,0.0,0.0
gfx1250,256,256,6144,8192,False,torch.bfloat16,torch.bfloat16,False,False,triton,0,0,0,auto,0.0,0.0,0.0
gfx1250,256,256,6144,12288,False,torch.bfloat16,torch.bfloat16,False,False,triton,0,0,0,auto,0.0,0.0,0.0
gfx1250,256,256,9216,6144,False,torch.bfloat16,torch.bfloat16,False,False,triton,0,0,0,auto,0.0,0.0,0.0
gfx1250,256,256,9856,6144,False,torch.bfloat16,torch.bfloat16,False,False,triton,0,0,0,auto,0.0,0.0,0.0
gfx1250,256,256,24576,6144,False,torch.bfloat16,torch.bfloat16,False,False,triton,0,0,0,auto,0.0,0.0,0.0
gfx1250,256,256,200064,6144,False,torch.bfloat16,torch.bfloat16,False,False,triton,0,0,0,auto,0.0,0.0,0.0
gfx1250,256,512,128,6144,False,torch.bfloat16,torch.bfloat16,False,False,triton,0,0,0,auto,0.0,0.0,0.0
gfx1250,256,512,6144,8192,False,torch.bfloat16,torch.bfloat16,False,False,triton,0,0,0,auto,0.0,0.0,0.0
gfx1250,256,512,6144,12288,False,torch.bfloat16,torch.bfloat16,False,False,triton,0,0,0,auto,0.0,0.0,0.0
gfx1250,256,512,9216,6144,False,torch.bfloat16,torch.bfloat16,False,False,triton,0,0,0,auto,0.0,0.0,0.0
gfx1250,256,512,9856,6144,False,torch.bfloat16,torch.bfloat16,False,False,triton,0,0,0,auto,0.0,0.0,0.0
gfx1250,256,512,24576,6144,False,torch.bfloat16,torch.bfloat16,False,False,triton,0,0,0,auto,0.0,0.0,0.0
gfx1250,256,512,200064,6144,False,torch.bfloat16,torch.bfloat16,False,False,triton,0,0,0,auto,0.0,0.0,0.0
gfx1250,256,1024,128,6144,False,torch.bfloat16,torch.bfloat16,False,False,triton,0,0,0,auto,0.0,0.0,0.0
gfx1250,256,1024,6144,8192,False,torch.bfloat16,torch.bfloat16,False,False,triton,0,0,0,auto,0.0,0.0,0.0
gfx1250,256,1024,6144,12288,False,torch.bfloat16,torch.bfloat16,False,False,triton,0,0,0,auto,0.0,0.0,0.0
gfx1250,256,1024,9216,6144,False,torch.bfloat16,torch.bfloat16,False,False,triton,0,0,0,auto,0.0,0.0,0.0
gfx1250,256,1024,9856,6144,False,torch.bfloat16,torch.bfloat16,False,False,triton,0,0,0,auto,0.0,0.0,0.0
gfx1250,256,1024,24576,6144,False,torch.bfloat16,torch.bfloat16,False,False,triton,0,0,0,auto,0.0,0.0,0.0
gfx1250,256,1024,200064,6144,False,torch.bfloat16,torch.bfloat16,False,False,triton,0,0,0,auto,0.0,0.0,0.0
gfx1250,256,2048,128,6144,False,torch.bfloat16,torch.bfloat16,False,False,triton,0,0,0,auto,0.0,0.0,0.0
gfx1250,256,2048,6144,8192,False,torch.bfloat16,torch.bfloat16,False,False,triton,0,0,0,auto,0.0,0.0,0.0
gfx1250,256,2048,6144,12288,False,torch.bfloat16,torch.bfloat16,False,False,triton,0,0,0,auto,0.0,0.0,0.0
gfx1250,256,2048,9216,6144,False,torch.bfloat16,torch.bfloat16,False,False,triton,0,0,0,auto,0.0,0.0,0.0
gfx1250,256,2048,9856,6144,False,torch.bfloat16,torch.bfloat16,False,False,triton,0,0,0,auto,0.0,0.0,0.0
gfx1250,256,2048,24576,6144,False,torch.bfloat16,torch.bfloat16,False,False,triton,0,0,0,auto,0.0,0.0,0.0
gfx1250,256,2048,200064,6144,False,torch.bfloat16,torch.bfloat16,False,False,triton,0,0,0,auto,0.0,0.0,0.0
gfx1250,256,3072,128,6144,False,torch.bfloat16,torch.bfloat16,False,False,triton,0,0,0,auto,0.0,0.0,0.0
gfx1250,256,3072,6144,8192,False,torch.bfloat16,torch.bfloat16,False,False,triton,0,0,0,auto,0.0,0.0,0.0
gfx1250,256,3072,6144,12288,False,torch.bfloat16,torch.bfloat16,False,False,triton,0,0,0,auto,0.0,0.0,0.0
gfx1250,256,3072,9216,6144,False,torch.bfloat16,torch.bfloat16,False,False,triton,0,0,0,auto,0.0,0.0,0.0
gfx1250,256,3072,9856,6144,False,torch.bfloat16,torch.bfloat16,False,False,triton,0,0,0,auto,0.0,0.0,0.0
gfx1250,256,3072,24576,6144,False,torch.bfloat16,torch.bfloat16,False,False,triton,0,0,0,auto,0.0,0.0,0.0
gfx1250,256,3072,200064,6144,False,torch.bfloat16,torch.bfloat16,False,False,triton,0,0,0,auto,0.0,0.0,0.0
gfx1250,256,4096,128,6144,False,torch.bfloat16,torch.bfloat16,False,False,triton,0,0,0,auto,0.0,0.0,0.0
gfx1250,256,4096,6144,8192,False,torch.bfloat16,torch.bfloat16,False,False,triton,0,0,0,auto,0.0,0.0,0.0
gfx1250,256,4096,6144,12288,False,torch.bfloat16,torch.bfloat16,False,False,triton,0,0,0,auto,0.0,0.0,0.0
gfx1250,256,4096,9216,6144,False,torch.bfloat16,torch.bfloat16,False,False,triton,0,0,0,auto,0.0,0.0,0.0
gfx1250,256,4096,9856,6144,False,torch.bfloat16,torch.bfloat16,False,False,triton,0,0,0,auto,0.0,0.0,0.0
gfx1250,256,4096,24576,6144,False,torch.bfloat16,torch.bfloat16,False,False,triton,0,0,0,auto,0.0,0.0,0.0
gfx1250,256,4096,200064,6144,False,torch.bfloat16,torch.bfloat16,False,False,triton,0,0,0,auto,0.0,0.0,0.0
gfx1250,256,5120,128,6144,False,torch.bfloat16,torch.bfloat16,False,False,triton,0,0,0,auto,0.0,0.0,0.0
gfx1250,256,5120,6144,8192,False,torch.bfloat16,torch.bfloat16,False,False,triton,0,0,0,auto,0.0,0.0,0.0
gfx1250,256,5120,6144,12288,False,torch.bfloat16,torch.bfloat16,False,False,triton,0,0,0,auto,0.0,0.0,0.0
gfx1250,256,5120,9216,6144,False,torch.bfloat16,torch.bfloat16,False,False,triton,0,0,0,auto,0.0,0.0,0.0
gfx1250,256,5120,9856,6144,False,torch.bfloat16,torch.bfloat16,False,False,triton,0,0,0,auto,0.0,0.0,0.0
gfx1250,256,5120,24576,6144,False,torch.bfloat16,torch.bfloat16,False,False,triton,0,0,0,auto,0.0,0.0,0.0
gfx1250,256,5120,200064,6144,False,torch.bfloat16,torch.bfloat16,False,False,triton,0,0,0,auto,0.0,0.0,0.0
gfx1250,256,6144,128,6144,False,torch.bfloat16,torch.bfloat16,False,False,triton,0,0,0,auto,0.0,0.0,0.0
gfx1250,256,6144,6144,8192,False,torch.bfloat16,torch.bfloat16,False,False,triton,0,0,0,auto,0.0,0.0,0.0
gfx1250,256,6144,6144,12288,False,torch.bfloat16,torch.bfloat16,False,False,triton,0,0,0,auto,0.0,0.0,0.0
gfx1250,256,6144,9216,6144,False,torch.bfloat16,torch.bfloat16,False,False,triton,0,0,0,auto,0.0,0.0,0.0
gfx1250,256,6144,9856,6144,False,torch.bfloat16,torch.bfloat16,False,False,triton,0,0,0,auto,0.0,0.0,0.0
gfx1250,256,6144,24576,6144,False,torch.bfloat16,torch.bfloat16,False,False,triton,0,0,0,auto,0.0,0.0,0.0
gfx1250,256,6144,200064,6144,False,torch.bfloat16,torch.bfloat16,False,False,triton,0,0,0,auto,0.0,0.0,0.0
gfx1250,256,6564,128,6144,False,torch.bfloat16,torch.bfloat16,False,False,triton,0,0,0.0275,auto,0.0,375.63,3053.00
gfx1250,256,6564,6144,8192,False,torch.bfloat16,torch.bfloat16,False,False,triton,0,0,0.7550,auto,0.0,875.19,382.61
gfx1250,256,6564,6144,12288,False,torch.bfloat16,torch.bfloat16,False,False,triton,0,0,1.1965,auto,0.0,828.37,328.44
gfx1250,256,6564,9216,6144,False,torch.bfloat16,torch.bfloat16,False,False,triton,0,0,0.8595,auto,0.0,864.83,366.35
gfx1250,256,6564,9856,6144,False,torch.bfloat16,torch.bfloat16,False,False,triton,0,0,0.6998,auto,0.0,1135.96,473.20
gfx1250,256,6564,24576,6144,False,torch.bfloat16,torch.bfloat16,False,False,triton,0,0,2.2390,auto,0.0,885.34,315.00
gfx1250,256,6576,128,6144,False,torch.bfloat16,torch.bfloat16,False,False,triton,0,0,0.0274,auto,0.0,377.39,3067.18
gfx1250,256,6576,6144,8192,False,torch.bfloat16,torch.bfloat16,False,False,triton,0,0,0.7559,auto,0.0,875.70,382.59
gfx1250,256,6576,6144,12288,False,torch.bfloat16,torch.bfloat16,False,False,triton,0,0,1.2337,auto,0.0,804.88,318.90
gfx1250,256,6576,9216,6144,False,torch.bfloat16,torch.bfloat16,False,False,triton,0,0,0.8636,auto,0.0,862.31,365.05
gfx1250,256,6576,9856,6144,False,torch.bfloat16,torch.bfloat16,False,False,triton,0,0,0.6997,auto,0.0,1138.27,473.85
gfx1250,256,6576,24576,6144,False,torch.bfloat16,torch.bfloat16,False,False,triton,0,0,2.2020,auto,0.0,901.87,320.63
gfx1250,256,6581,128,6144,False,torch.bfloat16,torch.bfloat16,False,False,triton,0,0,0.0274,auto,0.0,377.60,3068.80
gfx1250,256,6581,6144,8192,False,torch.bfloat16,torch.bfloat16,False,False,triton,0,0,0.7541,auto,0.0,878.46,383.70
gfx1250,256,6581,6144,12288,False,torch.bfloat16,torch.bfloat16,False,False,triton,0,0,1.1808,auto,0.0,841.53,333.32
gfx1250,256,6581,9216,6144,False,torch.bfloat16,torch.bfloat16,False,False,triton,0,0,0.8632,auto,0.0,863.38,365.40
gfx1250,256,6581,9856,6144,False,torch.bfloat16,torch.bfloat16,False,False,triton,0,0,0.6995,auto,0.0,1139.50,474.23
gfx1250,256,6581,24576,6144,False,torch.bfloat16,torch.bfloat16,False,False,triton,0,0,2.2690,auto,0.0,875.89,311.30
gfx1250,256,6585,128,6144,False,torch.bfloat16,torch.bfloat16,False,False,triton,0,0,0.0274,auto,0.0,377.52,3068.16
gfx1250,256,6585,6144,8192,False,torch.bfloat16,torch.bfloat16,False,False,triton,0,0,0.7543,auto,0.0,878.79,383.76
gfx1250,256,6585,6144,12288,False,torch.bfloat16,torch.bfloat16,False,False,triton,0,0,1.2229,auto,0.0,813.08,321.98
gfx1250,256,6585,9216,6144,False,torch.bfloat16,torch.bfloat16,False,False,triton,0,0,0.8617,auto,0.0,865.40,366.18
gfx1250,256,6585,9856,6144,False,torch.bfloat16,torch.bfloat16,False,False,triton,0,0,0.6986,auto,0.0,1141.62,475.01
gfx1250,256,6585,24576,6144,False,torch.bfloat16,torch.bfloat16,False,False,triton,0,0,2.2769,auto,0.0,873.37,310.32
gfx1250,256,6610,128,6144,False,torch.bfloat16,torch.bfloat16,False,False,triton,0,0,0.0276,auto,0.0,377.32,3066.30
gfx1250,256,6610,6144,8192,False,torch.bfloat16,torch.bfloat16,False,False,triton,0,0,0.7551,auto,0.0,881.14,384.28
gfx1250,256,6610,6144,12288,False,torch.bfloat16,torch.bfloat16,False,False,triton,0,0,1.2102,auto,0.0,824.75,326.13
gfx1250,256,6610,9216,6144,False,torch.bfloat16,torch.bfloat16,False,False,triton,0,0,0.8641,auto,0.0,866.32,366.06
gfx1250,256,6610,9856,6144,False,torch.bfloat16,torch.bfloat16,False,False,triton,0,0,0.7089,auto,0.0,1129.28,469.22
gfx1250,256,6610,24576,6144,False,torch.bfloat16,torch.bfloat16,False,False,triton,0,0,2.3381,auto,0.0,853.76,302.86
gfx1250,256,6637,128,6144,False,torch.bfloat16,torch.bfloat16,False,False,triton,0,0,0.0276,auto,0.0,378.37,3074.57
gfx1250,256,6637,6144,8192,False,torch.bfloat16,torch.bfloat16,False,False,triton,0,0,0.7558,auto,0.0,884.00,384.98
gfx1250,256,6637,6144,12288,False,torch.bfloat16,torch.bfloat16,False,False,triton,0,0,1.2109,auto,0.0,827.63,326.76
gfx1250,256,6637,9216,6144,False,torch.bfloat16,torch.bfloat16,False,False,triton,0,0,0.8661,auto,0.0,867.80,366.16
gfx1250,256,6637,9856,6144,False,torch.bfloat16,torch.bfloat16,False,False,triton,0,0,0.7217,auto,0.0,1113.77,462.10
gfx1250,256,6637,24576,6144,False,torch.bfloat16,torch.bfloat16,False,False,triton,0,0,2.2613,auto,0.0,886.36,313.88
gfx1250,256,6639,128,6144,False,torch.bfloat16,torch.bfloat16,False,False,triton,0,0,0.0275,auto,0.0,379.21,3081.40
gfx1250,256,6639,6144,8192,False,torch.bfloat16,torch.bfloat16,False,False,triton,0,0,0.7549,auto,0.0,885.27,385.50
gfx1250,256,6639,6144,12288,False,torch.bfloat16,torch.bfloat16,False,False,triton,0,0,1.2248,auto,0.0,818.48,323.11
gfx1250,256,6639,9216,6144,False,torch.bfloat16,torch.bfloat16,False,False,triton,0,0,0.8643,auto,0.0,869.85,366.98
gfx1250,256,6639,9856,6144,False,torch.bfloat16,torch.bfloat16,False,False,triton,0,0,0.6993,auto,0.0,1149.80,476.99
gfx1250,256,6639,24576,6144,False,torch.bfloat16,torch.bfloat16,False,False,triton,0,0,2.2839,auto,0.0,877.85,310.83
gfx1250,256,6640,128,6144,False,torch.bfloat16,torch.bfloat16,False,False,triton,0,0,0.0275,auto,0.0,379.44,3083.31
gfx1250,256,6640,6144,8192,False,torch.bfloat16,torch.bfloat16,False,False,triton,0,0,0.7546,auto,0.0,885.72,385.67
gfx1250,256,6640,6144,12288,False,torch.bfloat16,torch.bfloat16,False,False,triton,0,0,1.2066,auto,0.0,830.95,328.01
gfx1250,256,6640,9216,6144,False,torch.bfloat16,torch.bfloat16,False,False,triton,0,0,0.8625,auto,0.0,871.80,367.79
gfx1250,256,6640,9856,6144,False,torch.bfloat16,torch.bfloat16,False,False,triton,0,0,0.8887,auto,0.0,904.91,375.38
gfx1250,256,6640,24576,6144,False,torch.bfloat16,torch.bfloat16,False,False,triton,0,0,2.4062,auto,0.0,833.35,295.05
gfx1250,256,6644,128,6144,False,torch.bfloat16,torch.bfloat16,False,False,triton,0,0,0.0274,auto,0.0,381.29,3098.30
gfx1250,256,6644,6144,8192,False,torch.bfloat16,torch.bfloat16,False,False,triton,0,0,0.7549,auto,0.0,885.96,385.70
gfx1250,256,6644,6144,12288,False,torch.bfloat16,torch.bfloat16,False,False,triton,0,0,1.2178,auto,0.0,823.82,325.12
gfx1250,256,6644,9216,6144,False,torch.bfloat16,torch.bfloat16,False,False,triton,0,0,0.8650,auto,0.0,869.84,366.88
gfx1250,256,6644,9856,6144,False,torch.bfloat16,torch.bfloat16,False,False,triton,0,0,0.7723,auto,0.0,1041.93,432.12
gfx1250,256,6644,24576,6144,False,torch.bfloat16,torch.bfloat16,False,False,triton,0,0,2.3234,auto,0.0,863.59,305.68
gfx1250,256,6651,128,6144,False,torch.bfloat16,torch.bfloat16,False,False,triton,0,0,0.0276,auto,0.0,378.79,3077.92
gfx1250,256,6651,6144,8192,False,torch.bfloat16,torch.bfloat16,False,False,triton,0,0,0.7566,auto,0.0,884.90,385.09
gfx1250,256,6651,6144,12288,False,torch.bfloat16,torch.bfloat16,False,False,triton,0,0,1.2171,auto,0.0,825.14,325.51
gfx1250,256,6651,9216,6144,False,torch.bfloat16,torch.bfloat16,False,False,triton,0,0,0.8658,auto,0.0,869.94,366.78
gfx1250,256,6651,9856,6144,False,torch.bfloat16,torch.bfloat16,False,False,triton,0,0,0.7397,auto,0.0,1088.94,451.45
gfx1250,256,6651,24576,6144,False,torch.bfloat16,torch.bfloat16,False,False,triton,0,0,2.2633,auto,0.0,887.43,313.98
gfx1250,256,6652,128,6144,False,torch.bfloat16,torch.bfloat16,False,False,triton,0,0,0.0273,auto,0.0,383.09,3112.87
gfx1250,256,6652,6144,8192,False,torch.bfloat16,torch.bfloat16,False,False,triton,0,0,0.7558,auto,0.0,885.99,385.55
gfx1250,256,6652,6144,12288,False,torch.bfloat16,torch.bfloat16,False,False,triton,0,0,1.2028,auto,0.0,835.05,329.40
gfx1250,256,6652,9216,6144,False,torch.bfloat16,torch.bfloat16,False,False,triton,0,0,0.8638,auto,0.0,872.06,367.66
gfx1250,256,6652,9856,6144,False,torch.bfloat16,torch.bfloat16,False,False,triton,0,0,0.7111,auto,0.0,1132.94,469.66
gfx1250,256,6652,24576,6144,False,torch.bfloat16,torch.bfloat16,False,False,triton,0,0,2.3766,auto,0.0,845.27,299.04
gfx1250,256,6668,128,6144,False,torch.bfloat16,torch.bfloat16,False,False,triton,0,0,0.0271,auto,0.0,387.64,3149.63
gfx1250,256,6668,6144,8192,False,torch.bfloat16,torch.bfloat16,False,False,triton,0,0,0.8299,auto,0.0,808.80,351.67
gfx1250,256,6668,6144,12288,False,torch.bfloat16,torch.bfloat16,False,False,triton,0,0,1.1986,auto,0.0,840.01,331.06
gfx1250,256,6668,9216,6144,False,torch.bfloat16,torch.bfloat16,False,False,triton,0,0,0.8687,auto,0.0,869.29,366.18
gfx1250,256,6668,9856,6144,False,torch.bfloat16,torch.bfloat16,False,False,triton,0,0,0.8581,auto,0.0,941.07,389.78
gfx1250,256,6668,24576,6144,False,torch.bfloat16,torch.bfloat16,False,False,triton,0,0,2.5632,auto,0.0,785.62,277.65
gfx1250,256,6676,128,6144,False,torch.bfloat16,torch.bfloat16,False,False,triton,0,0,0.0267,auto,0.0,393.41,3196.46
gfx1250,256,6676,6144,8192,False,torch.bfloat16,torch.bfloat16,False,False,triton,0,0,0.8371,auto,0.0,802.85,348.94
gfx1250,256,6676,6144,12288,False,torch.bfloat16,torch.bfloat16,False,False,triton,0,0,1.2056,auto,0.0,836.12,329.37
gfx1250,256,6676,9216,6144,False,torch.bfloat16,torch.bfloat16,False,False,triton,0,0,0.8677,auto,0.0,871.35,366.89
gfx1250,256,6676,9856,6144,False,torch.bfloat16,torch.bfloat16,False,False,triton,0,0,0.8265,auto,0.0,978.26,405.01
gfx1250,256,6676,24576,6144,False,torch.bfloat16,torch.bfloat16,False,False,triton,0,0,2.4547,auto,0.0,821.31,290.12
gfx1250,256,6683,128,6144,False,torch.bfloat16,torch.bfloat16,False,False,triton,0,0,0.0267,auto,0.0,393.81,3199.63
gfx1250,256,6683,6144,8192,False,torch.bfloat16,torch.bfloat16,False,False,triton,0,0,0.8346,auto,0.0,806.06,350.20
gfx1250,256,6683,6144,12288,False,torch.bfloat16,torch.bfloat16,False,False,triton,0,0,1.2447,auto,0.0,810.68,319.23
gfx1250,256,6683,9216,6144,False,torch.bfloat16,torch.bfloat16,False,False,triton,0,0,0.8682,auto,0.0,871.77,366.93
gfx1250,256,6683,9856,6144,False,torch.bfloat16,torch.bfloat16,False,False,triton,0,0,0.7875,auto,0.0,1027.81,425.36
gfx1250,256,6683,24576,6144,False,torch.bfloat16,torch.bfloat16,False,False,triton,0,0,2.4417,auto,0.0,826.57,291.85
gfx1250,256,6704,128,6144,False,torch.bfloat16,torch.bfloat16,False,False,triton,0,0,0.0271,auto,0.0,389.41,3163.74
gfx1250,256,6704,6144,8192,False,torch.bfloat16,torch.bfloat16,False,False,triton,0,0,0.8289,auto,0.0,814.17,353.34
gfx1250,256,6704,6144,12288,False,torch.bfloat16,torch.bfloat16,False,False,triton,0,0,1.2322,auto,0.0,821.53,323.11
gfx1250,256,6704,9216,6144,False,torch.bfloat16,torch.bfloat16,False,False,triton,0,0,0.8701,auto,0.0,872.58,366.86
gfx1250,256,6704,9856,6144,False,torch.bfloat16,torch.bfloat16,False,False,triton,0,0,0.8558,auto,0.0,948.78,392.21
gfx1250,256,6704,24576,6144,False,torch.bfloat16,torch.bfloat16,False,False,triton,0,0,2.5436,auto,0.0,795.93,280.66
gfx1250,256,6722,128,6144,False,torch.bfloat16,torch.bfloat16,False,False,triton,0,0,0.0268,auto,0.0,395.16,3210.26
gfx1250,256,6722,6144,8192,False,torch.bfloat16,torch.bfloat16,False,False,triton,0,0,0.8357,auto,0.0,809.71,351.09
gfx1250,256,6722,6144,12288,False,torch.bfloat16,torch.bfloat16,False,False,triton,0,0,1.2271,auto,0.0,827.11,324.98
gfx1250,256,6722,9216,6144,False,torch.bfloat16,torch.bfloat16,False,False,triton,0,0,0.8684,auto,0.0,876.58,368.19
gfx1250,256,6722,9856,6144,False,torch.bfloat16,torch.bfloat16,False,False,triton,0,0,0.8216,auto,0.0,990.91,409.23
gfx1250,256,6722,24576,6144,False,torch.bfloat16,torch.bfloat16,False,False,triton,0,0,2.4444,auto,0.0,830.45,292.50
gfx1250,256,6727,128,6144,False,torch.bfloat16,torch.bfloat16,False,False,triton,0,0,0.0270,auto,0.0,391.66,3181.80
gfx1250,256,6727,6144,8192,False,torch.bfloat16,torch.bfloat16,False,False,triton,0,0,0.8467,auto,0.0,799.76,346.69
gfx1250,256,6727,6144,12288,False,torch.bfloat16,torch.bfloat16,False,False,triton,0,0,1.2072,auto,0.0,841.42,330.51
gfx1250,256,6727,9216,6144,False,torch.bfloat16,torch.bfloat16,False,False,triton,0,0,0.8720,auto,0.0,873.59,366.84
gfx1250,256,6727,9856,6144,False,torch.bfloat16,torch.bfloat16,False,False,triton,0,0,0.9227,auto,0.0,882.92,364.53
gfx1250,256,6727,24576,6144,False,torch.bfloat16,torch.bfloat16,False,False,triton,0,0,2.6755,auto,0.0,759.29,267.35
gfx1250,256,6754,128,6144,False,torch.bfloat16,torch.bfloat16,False,False,triton,0,0,0.0270,auto,0.0,393.81,3199.07
gfx1250,256,6754,6144,8192,False,torch.bfloat16,torch.bfloat16,False,False,triton,0,0,0.8415,auto,0.0,807.95,349.75
gfx1250,256,6754,6144,12288,False,torch.bfloat16,torch.bfloat16,False,False,triton,0,0,1.2231,auto,0.0,833.82,327.03
gfx1250,256,6754,9216,6144,False,torch.bfloat16,torch.bfloat16,False,False,triton,0,0,0.8689,auto,0.0,880.28,369.13
gfx1250,256,6754,9856,6144,False,torch.bfloat16,torch.bfloat16,False,False,triton,0,0,0.8669,auto,0.0,943.59,389.02
gfx1250,256,6754,24576,6144,False,torch.bfloat16,torch.bfloat16,False,False,triton,0,0,2.5397,auto,0.0,803.11,282.30
gfx1250,256,6756,128,6144,False,torch.bfloat16,torch.bfloat16,False,False,triton,0,0,0.0267,auto,0.0,398.66,3238.42
gfx1250,256,6756,6144,8192,False,torch.bfloat16,torch.bfloat16,False,False,triton,0,0,0.8417,auto,0.0,807.98,349.73
gfx1250,256,6756,6144,12288,False,torch.bfloat16,torch.bfloat16,False,False,triton,0,0,1.2050,auto,0.0,846.58,331.99
gfx1250,256,6756,9216,6144,False,torch.bfloat16,torch.bfloat16,False,False,triton,0,0,0.8702,auto,0.0,879.22,368.64
gfx1250,256,6756,9856,6144,False,torch.bfloat16,torch.bfloat16,False,False,triton,0,0,0.8094,auto,0.0,1010.95,416.75
gfx1250,256,6756,24576,6144,False,torch.bfloat16,torch.bfloat16,False,False,triton,0,0,2.5599,auto,0.0,797.01,280.12
gfx1250,256,6762,128,6144,False,torch.bfloat16,torch.bfloat16,False,False,triton,0,0,0.0268,auto,0.0,396.80,3223.23
gfx1250,256,6762,6144,8192,False,torch.bfloat16,torch.bfloat16,False,False,triton,0,0,0.8387,auto,0.0,811.56,351.17
gfx1250,256,6762,6144,12288,False,torch.bfloat16,torch.bfloat16,False,False,triton,0,0,1.2288,auto,0.0,830.89,325.73
gfx1250,256,6762,9216,6144,False,torch.bfloat16,torch.bfloat16,False,False,triton,0,0,0.8690,auto,0.0,881.22,369.37
gfx1250,256,6762,9856,6144,False,torch.bfloat16,torch.bfloat16,False,False,triton,0,0,0.8755,auto,0.0,935.38,385.47
gfx1250,256,6762,24576,6144,False,torch.bfloat16,torch.bfloat16,False,False,triton,0,0,2.5526,auto,0.0,799.99,281.07
gfx1250,256,6797,128,6144,False,torch.bfloat16,torch.bfloat16,False,False,triton,0,0,0.0269,auto,0.0,397.40,3227.81
gfx1250,256,6797,6144,8192,False,torch.bfloat16,torch.bfloat16,False,False,triton,0,0,0.8306,auto,0.0,823.78,355.84
gfx1250,256,6797,6144,12288,False,torch.bfloat16,torch.bfloat16,False,False,triton,0,0,1.2496,auto,0.0,821.32,321.35
gfx1250,256,6797,9216,6144,False,torch.bfloat16,torch.bfloat16,False,False,triton,0,0,0.8802,auto,0.0,874.51,365.89
gfx1250,256,6797,9856,6144,False,torch.bfloat16,torch.bfloat16,False,False,triton,0,0,0.8894,auto,0.0,925.60,380.74
gfx1250,256,6797,24576,6144,False,torch.bfloat16,torch.bfloat16,False,False,triton,0,0,2.5331,auto,0.0,810.34,284.08
gfx1250,256,6809,128,6144,False,torch.bfloat16,torch.bfloat16,False,False,triton,0,0,0.0269,auto,0.0,398.33,3235.33
gfx1250,256,6809,6144,8192,False,torch.bfloat16,torch.bfloat16,False,False,triton,0,0,0.8423,auto,0.0,813.74,351.29
gfx1250,256,6809,6144,12288,False,torch.bfloat16,torch.bfloat16,False,False,triton,0,0,1.1633,auto,0.0,883.77,345.56
gfx1250,256,6809,9216,6144,False,torch.bfloat16,torch.bfloat16,False,False,triton,0,0,0.8816,auto,0.0,874.66,365.72
gfx1250,256,6809,9856,6144,False,torch.bfloat16,torch.bfloat16,False,False,triton,0,0,0.8718,auto,0.0,945.94,388.86
gfx1250,256,6809,24576,6144,False,torch.bfloat16,torch.bfloat16,False,False,triton,0,0,2.4811,auto,0.0,828.75,290.32
gfx1250,256,6810,128,6144,False,torch.bfloat16,torch.bfloat16,False,False,triton,0,0,0.0269,auto,0.0,397.80,3230.99
gfx1250,256,6810,6144,8192,False,torch.bfloat16,torch.bfloat16,False,False,triton,0,0,0.8450,auto,0.0,811.29,350.21
gfx1250,256,6810,6144,12288,False,torch.bfloat16,torch.bfloat16,False,False,triton,0,0,1.2382,auto,0.0,830.43,324.69
gfx1250,256,6810,9216,6144,False,torch.bfloat16,torch.bfloat16,False,False,triton,0,0,0.8798,auto,0.0,876.59,366.51
gfx1250,256,6810,9856,6144,False,torch.bfloat16,torch.bfloat16,False,False,triton,0,0,0.7882,auto,0.0,1046.35,430.12
gfx1250,256,6810,24576,6144,False,torch.bfloat16,torch.bfloat16,False,False,triton,0,0,2.5607,auto,0.0,803.11,281.33
gfx1250,256,6826,128,6144,False,torch.bfloat16,torch.bfloat16,False,False,triton,0,0,0.0269,auto,0.0,398.78,3238.80
gfx1250,256,6826,6144,8192,False,torch.bfloat16,torch.bfloat16,False,False,triton,0,0,0.8415,auto,0.0,816.58,352.21
gfx1250,256,6826,6144,12288,False,torch.bfloat16,torch.bfloat16,False,False,triton,0,0,1.2381,auto,0.0,832.47,325.20
gfx1250,256,6826,9216,6144,False,torch.bfloat16,torch.bfloat16,False,False,triton,0,0,0.8809,auto,0.0,877.56,366.62
gfx1250,256,6826,9856,6144,False,torch.bfloat16,torch.bfloat16,False,False,triton,0,0,0.9014,auto,0.0,917.16,376.70
gfx1250,256,6826,24576,6144,False,torch.bfloat16,torch.bfloat16,False,False,triton,0,0,2.5669,auto,0.0,803.06,281.03
gfx1250,256,6844,128,6144,False,torch.bfloat16,torch.bfloat16,False,False,triton,0,0,0.0268,auto,0.0,402.40,3268.06
gfx1250,256,6844,6144,8192,False,torch.bfloat16,torch.bfloat16,False,False,triton,0,0,0.8417,auto,0.0,818.51,352.73
gfx1250,256,6844,6144,12288,False,torch.bfloat16,torch.bfloat16,False,False,triton,0,0,1.2177,auto,0.0,848.68,331.20
gfx1250,256,6844,9216,6144,False,torch.bfloat16,torch.bfloat16,False,False,triton,0,0,0.8812,auto,0.0,879.53,367.10
gfx1250,256,6844,9856,6144,False,torch.bfloat16,torch.bfloat16,False,False,triton,0,0,0.8906,auto,0.0,930.74,381.91
gfx1250,256,6844,24576,6144,False,torch.bfloat16,torch.bfloat16,False,False,triton,0,0,2.5707,auto,0.0,803.99,281.05
gfx1250,256,6860,128,6144,False,torch.bfloat16,torch.bfloat16,False,False,triton,0,0,0.0268,auto,0.0,403.19,3274.34
gfx1250,256,6860,6144,8192,False,torch.bfloat16,torch.bfloat16,False,False,triton,0,0,0.8462,auto,0.0,816.10,351.42
gfx1250,256,6860,6144,12288,False,torch.bfloat16,torch.bfloat16,False,False,triton,0,0,1.0957,auto,0.0,945.39,368.62
gfx1250,256,6860,9216,6144,False,torch.bfloat16,torch.bfloat16,False,False,triton,0,0,0.8817,auto,0.0,881.15,367.47
gfx1250,256,6860,9856,6144,False,torch.bfloat16,torch.bfloat16,False,False,triton,0,0,0.8554,auto,0.0,971.26,398.21
gfx1250,256,6860,24576,6144,False,torch.bfloat16,torch.bfloat16,False,False,triton,0,0,2.5919,auto,0.0,799.28,279.13
gfx1250,256,6877,128,6144,False,torch.bfloat16,torch.bfloat16,False,False,triton,0,0,0.0267,auto,0.0,405.43,3292.40
gfx1250,256,6877,6144,8192,False,torch.bfloat16,torch.bfloat16,False,False,triton,0,0,0.8459,auto,0.0,818.35,352.09
gfx1250,256,6877,6144,12288,False,torch.bfloat16,torch.bfloat16,False,False,triton,0,0,1.2339,auto,0.0,841.54,327.82
gfx1250,256,6877,9216,6144,False,torch.bfloat16,torch.bfloat16,False,False,triton,0,0,0.8825,auto,0.0,882.51,367.73
gfx1250,256,6877,9856,6144,False,torch.bfloat16,torch.bfloat16,False,False,triton,0,0,0.9265,auto,0.0,898.92,368.23
gfx1250,256,6877,24576,6144,False,torch.bfloat16,torch.bfloat16,False,False,triton,0,0,2.5517,auto,0.0,813.89,283.94
gfx1250,256,6888,128,6144,False,torch.bfloat16,torch.bfloat16,False,False,triton,0,0,0.0268,auto,0.0,403.62,3277.55
gfx1250,256,6888,6144,8192,False,torch.bfloat16,torch.bfloat16,False,False,triton,0,0,0.8445,auto,0.0,821.03,353.05
gfx1250,256,6888,6144,12288,False,torch.bfloat16,torch.bfloat16,False,False,triton,0,0,1.2349,auto,0.0,842.23,327.90
gfx1250,256,6888,9216,6144,False,torch.bfloat16,torch.bfloat16,False,False,triton,0,0,0.8817,auto,0.0,884.65,368.41
gfx1250,256,6888,9856,6144,False,torch.bfloat16,torch.bfloat16,False,False,triton,0,0,0.9694,auto,0.0,860.56,352.31
gfx1250,256,6888,24576,6144,False,torch.bfloat16,torch.bfloat16,False,False,triton,0,0,2.6082,auto,0.0,797.52,278.04
gfx1250,256,6921,128,6144,False,torch.bfloat16,torch.bfloat16,False,False,triton,0,0,0.0264,auto,0.0,412.37,3348.36
gfx1250,256,6921,6144,8192,False,torch.bfloat16,torch.bfloat16,False,False,triton,0,0,0.8754,auto,0.0,795.88,341.69
gfx1250,256,6921,6144,12288,False,torch.bfloat16,torch.bfloat16,False,False,triton,0,0,0.9951,auto,0.0,1050.20,408.14
gfx1250,256,6921,9216,6144,False,torch.bfloat16,torch.bfloat16,False,False,triton,0,0,0.8864,auto,0.0,884.21,367.61
gfx1250,256,6921,9856,6144,False,torch.bfloat16,torch.bfloat16,False,False,triton,0,0,0.7674,auto,0.0,1092.25,446.41
gfx1250,256,6921,24576,6144,False,torch.bfloat16,torch.bfloat16,False,False,triton,0,0,2.5387,auto,0.0,823.29,286.46
gfx1250,256,6923,128,6144,False,torch.bfloat16,torch.bfloat16,False,False,triton,0,0,0.0264,auto,0.0,412.13,3346.39
gfx1250,256,6923,6144,8192,False,torch.bfloat16,torch.bfloat16,False,False,triton,0,0,0.8767,auto,0.0,794.92,341.24
gfx1250,256,6923,6144,12288,False,torch.bfloat16,torch.bfloat16,False,False,triton,0,0,1.2182,auto,0.0,858.10,333.45
gfx1250,256,6923,9216,6144,False,torch.bfloat16,torch.bfloat16,False,False,triton,0,0,0.8874,auto,0.0,883.50,367.28
gfx1250,256,6923,9856,6144,False,torch.bfloat16,torch.bfloat16,False,False,triton,0,0,0.7673,auto,0.0,1092.68,446.54
gfx1250,256,6923,24576,6144,False,torch.bfloat16,torch.bfloat16,False,False,triton,0,0,2.5061,auto,0.0,834.22,290.22
gfx1250,256,6926,128,6144,False,torch.bfloat16,torch.bfloat16,False,False,triton,0,0,0.0266,auto,0.0,409.54,3325.29
gfx1250,256,6926,6144,8192,False,torch.bfloat16,torch.bfloat16,False,False,triton,0,0,0.8765,auto,0.0,795.41,341.40
gfx1250,256,6926,6144,12288,False,torch.bfloat16,torch.bfloat16,False,False,triton,0,0,1.1224,auto,0.0,931.76,362.01
gfx1250,256,6926,9216,6144,False,torch.bfloat16,torch.bfloat16,False,False,triton,0,0,0.8861,auto,0.0,885.14,367.91
gfx1250,256,6926,9856,6144,False,torch.bfloat16,torch.bfloat16,False,False,triton,0,0,0.7681,auto,0.0,1092.11,446.24
gfx1250,256,6926,24576,6144,False,torch.bfloat16,torch.bfloat16,False,False,triton,0,0,2.4970,auto,0.0,837.64,291.36
gfx1250,256,6930,128,6144,False,torch.bfloat16,torch.bfloat16,False,False,triton,0,0,0.0266,auto,0.0,410.20,3330.68
gfx1250,256,6930,6144,8192,False,torch.bfloat16,torch.bfloat16,False,False,triton,0,0,0.8762,auto,0.0,796.17,341.66
gfx1250,256,6930,6144,12288,False,torch.bfloat16,torch.bfloat16,False,False,triton,0,0,1.1314,auto,0.0,924.91,359.27
gfx1250,256,6930,9216,6144,False,torch.bfloat16,torch.bfloat16,False,False,triton,0,0,0.8871,auto,0.0,884.66,367.64
gfx1250,256,6930,9856,6144,False,torch.bfloat16,torch.bfloat16,False,False,triton,0,0,0.7687,auto,0.0,1091.79,446.02
gfx1250,256,6930,24576,6144,False,torch.bfloat16,torch.bfloat16,False,False,triton,0,0,2.4809,auto,0.0,843.55,293.35
gfx1250,256,6936,128,6144,False,torch.bfloat16,torch.bfloat16,False,False,triton,0,0,0.0267,auto,0.0,407.93,3312.20
gfx1250,256,6936,6144,8192,False,torch.bfloat16,torch.bfloat16,False,False,triton,0,0,0.8768,auto,0.0,796.30,341.62
gfx1250,256,6936,6144,12288,False,torch.bfloat16,torch.bfloat16,False,False,triton,0,0,1.0226,auto,0.0,1024.19,397.71
gfx1250,256,6936,9216,6144,False,torch.bfloat16,torch.bfloat16,False,False,triton,0,0,0.8871,auto,0.0,885.48,367.87
gfx1250,256,6936,9856,6144,False,torch.bfloat16,torch.bfloat16,False,False,triton,0,0,0.7671,auto,0.0,1095.13,447.25
gfx1250,256,6936,24576,6144,False,torch.bfloat16,torch.bfloat16,False,False,triton,0,0,2.4888,auto,0.0,841.61,292.56
gfx1250,256,6940,128,6144,False,torch.bfloat16,torch.bfloat16,False,False,triton,0,0,0.0265,auto,0.0,411.57,3341.69
gfx1250,256,6940,6144,8192,False,torch.bfloat16,torch.bfloat16,False,False,triton,0,0,0.8756,auto,0.0,797.81,342.20
gfx1250,256,6940,6144,12288,False,torch.bfloat16,torch.bfloat16,False,False,triton,0,0,1.0412,auto,0.0,1006.45,390.74
gfx1250,256,6940,9216,6144,False,torch.bfloat16,torch.bfloat16,False,False,triton,0,0,0.8870,auto,0.0,886.06,368.04
gfx1250,256,6940,9856,6144,False,torch.bfloat16,torch.bfloat16,False,False,triton,0,0,0.7669,auto,0.0,1095.91,447.48
gfx1250,256,6940,24576,6144,False,torch.bfloat16,torch.bfloat16,False,False,triton,0,0,2.4816,auto,0.0,844.54,293.52
gfx1250,256,6941,128,6144,False,torch.bfloat16,torch.bfloat16,False,False,triton,0,0,0.0266,auto,0.0,410.31,3331.48
gfx1250,256,6941,6144,8192,False,torch.bfloat16,torch.bfloat16,False,False,triton,0,0,0.8768,auto,0.0,796.89,341.79
gfx1250,256,6941,6144,12288,False,torch.bfloat16,torch.bfloat16,False,False,triton,0,0,1.2314,auto,0.0,851.11,330.41
gfx1250,256,6941,9216,6144,False,torch.bfloat16,torch.bfloat16,False,False,triton,0,0,0.8885,auto,0.0,884.67,367.44
gfx1250,256,6941,9856,6144,False,torch.bfloat16,torch.bfloat16,False,False,triton,0,0,0.7696,auto,0.0,1092.23,445.95
gfx1250,256,6941,24576,6144,False,torch.bfloat16,torch.bfloat16,False,False,triton,0,0,2.5778,auto,0.0,813.15,282.59
gfx1250,256,6951,128,6144,False,torch.bfloat16,torch.bfloat16,False,False,triton,0,0,0.0268,auto,0.0,408.11,3313.53
gfx1250,256,6951,6144,8192,False,torch.bfloat16,torch.bfloat16,False,False,triton,0,0,0.8764,auto,0.0,798.40,342.27
gfx1250,256,6951,6144,12288,False,torch.bfloat16,torch.bfloat16,False,False,triton,0,0,1.2307,auto,0.0,852.80,330.89
gfx1250,256,6951,9216,6144,False,torch.bfloat16,torch.bfloat16,False,False,triton,0,0,0.8887,auto,0.0,885.72,367.69
gfx1250,256,6951,9856,6144,False,torch.bfloat16,torch.bfloat16,False,False,triton,0,0,0.7650,auto,0.0,1100.40,449.06
gfx1250,256,6951,24576,6144,False,torch.bfloat16,torch.bfloat16,False,False,triton,0,0,2.5237,auto,0.0,831.77,288.89
gfx1250,256,6976,128,6144,False,torch.bfloat16,torch.bfloat16,False,False,triton,0,0,0.0263,auto,0.0,416.45,3381.02
gfx1250,256,6976,6144,8192,False,torch.bfloat16,torch.bfloat16,False,False,triton,0,0,0.8759,auto,0.0,801.75,343.29
gfx1250,256,6976,6144,12288,False,torch.bfloat16,torch.bfloat16,False,False,triton,0,0,1.2433,auto,0.0,847.20,328.28
gfx1250,256,6976,9216,6144,False,torch.bfloat16,torch.bfloat16,False,False,triton,0,0,0.8922,auto,0.0,885.46,367.12
gfx1250,256,6976,9856,6144,False,torch.bfloat16,torch.bfloat16,False,False,triton,0,0,0.8175,auto,0.0,1033.49,421.22
gfx1250,256,6976,24576,6144,False,torch.bfloat16,torch.bfloat16,False,False,triton,0,0,2.5598,auto,0.0,822.97,285.41
gfx1250,256,6983,128,6144,False,torch.bfloat16,torch.bfloat16,False,False,triton,0,0,0.0265,auto,0.0,414.82,3367.74
gfx1250,256,6983,6144,8192,False,torch.bfloat16,torch.bfloat16,False,False,triton,0,0,0.8761,auto,0.0,802.31,343.42
gfx1250,256,6983,6144,12288,False,torch.bfloat16,torch.bfloat16,False,False,triton,0,0,1.2152,auto,0.0,867.67,336.09
gfx1250,256,6983,9216,6144,False,torch.bfloat16,torch.bfloat16,False,False,triton,0,0,0.8906,auto,0.0,887.92,368.02
gfx1250,256,6983,9856,6144,False,torch.bfloat16,torch.bfloat16,False,False,triton,0,0,0.7897,auto,0.0,1070.94,436.33
gfx1250,256,6983,24576,6144,False,torch.bfloat16,torch.bfloat16,False,False,triton,0,0,2.5817,auto,0.0,816.82,283.15
gfx1250,256,7001,128,6144,False,torch.bfloat16,torch.bfloat16,False,False,triton,0,0,0.0267,auto,0.0,412.48,3348.57
gfx1250,256,7001,6144,8192,False,torch.bfloat16,torch.bfloat16,False,False,triton,0,0,0.8776,auto,0.0,803.08,343.45
gfx1250,256,7001,6144,12288,False,torch.bfloat16,torch.bfloat16,False,False,triton,0,0,1.0678,auto,0.0,990.02,383.11
gfx1250,256,7001,9216,6144,False,torch.bfloat16,torch.bfloat16,False,False,triton,0,0,0.8949,auto,0.0,885.96,366.88
gfx1250,256,7001,9856,6144,False,torch.bfloat16,torch.bfloat16,False,False,triton,0,0,0.7693,auto,0.0,1102.11,448.62
gfx1250,256,7001,24576,6144,False,torch.bfloat16,torch.bfloat16,False,False,triton,0,0,2.5843,auto,0.0,818.11,283.30
gfx1250,256,7063,128,6144,False,torch.bfloat16,torch.bfloat16,False,False,triton,0,0,0.0255,auto,0.0,436.42,3542.37
gfx1250,256,7063,6144,8192,False,torch.bfloat16,torch.bfloat16,False,False,triton,0,0,0.8793,auto,0.0,808.55,344.78
gfx1250,256,7063,6144,12288,False,torch.bfloat16,torch.bfloat16,False,False,triton,0,0,1.2051,auto,0.0,884.95,341.34
gfx1250,256,7063,9216,6144,False,torch.bfloat16,torch.bfloat16,False,False,triton,0,0,0.8673,auto,0.0,922.21,380.73
gfx1250,256,7063,9856,6144,False,torch.bfloat16,torch.bfloat16,False,False,triton,0,0,0.7510,auto,0.0,1139.07,462.24
gfx1250,256,7063,24576,6144,False,torch.bfloat16,torch.bfloat16,False,False,triton,0,0,2.6037,auto,0.0,819.19,282.65
gfx1250,256,7090,128,6144,False,torch.bfloat16,torch.bfloat16,False,False,triton,0,0,0.0253,auto,0.0,440.22,3572.94
gfx1250,256,7090,6144,8192,False,torch.bfloat16,torch.bfloat16,False,False,triton,0,0,0.8844,auto,0.0,807.03,343.69
gfx1250,256,7090,6144,12288,False,torch.bfloat16,torch.bfloat16,False,False,triton,0,0,1.2391,auto,0.0,863.96,332.78
gfx1250,256,7090,9216,6144,False,torch.bfloat16,torch.bfloat16,False,False,triton,0,0,0.8684,auto,0.0,924.56,381.21
gfx1250,256,7090,9856,6144,False,torch.bfloat16,torch.bfloat16,False,False,triton,0,0,0.7490,auto,0.0,1146.38,464.59
gfx1250,256,7090,24576,6144,False,torch.bfloat16,torch.bfloat16,False,False,triton,0,0,2.6596,auto,0.0,805.06,277.34
gfx1250,256,7096,128,6144,False,torch.bfloat16,torch.bfloat16,False,False,triton,0,0,0.0255,auto,0.0,437.29,3549.16
gfx1250,256,7096,6144,8192,False,torch.bfloat16,torch.bfloat16,False,False,triton,0,0,0.8840,auto,0.0,808.06,344.03
gfx1250,256,7096,6144,12288,False,torch.bfloat16,torch.bfloat16,False,False,triton,0,0,1.2541,auto,0.0,854.39,329.00
gfx1250,256,7096,9216,6144,False,torch.bfloat16,torch.bfloat16,False,False,triton,0,0,0.8681,auto,0.0,925.72,381.57
gfx1250,256,7096,9856,6144,False,torch.bfloat16,torch.bfloat16,False,False,triton,0,0,0.7497,auto,0.0,1146.36,464.44
gfx1250,256,7096,24576,6144,False,torch.bfloat16,torch.bfloat16,False,False,triton,0,0,2.6330,auto,0.0,813.86,280.27
gfx1250,256,7097,128,6144,False,torch.bfloat16,torch.bfloat16,False,False,triton,0,0,0.0256,auto,0.0,436.64,3543.82
gfx1250,256,7097,6144,8192,False,torch.bfloat16,torch.bfloat16,False,False,triton,0,0,0.8815,auto,0.0,810.48,345.05
gfx1250,256,7097,6144,12288,False,torch.bfloat16,torch.bfloat16,False,False,triton,0,0,1.2173,auto,0.0,880.28,338.95
gfx1250,256,7097,9216,6144,False,torch.bfloat16,torch.bfloat16,False,False,triton,0,0,0.8682,auto,0.0,925.76,381.57
gfx1250,256,7097,9856,6144,False,torch.bfloat16,torch.bfloat16,False,False,triton,0,0,0.7510,auto,0.0,1144.56,463.69
gfx1250,256,7097,24576,6144,False,torch.bfloat16,torch.bfloat16,False,False,triton,0,0,2.6266,auto,0.0,815.97,280.98
gfx1250,256,7104,128,6144,False,torch.bfloat16,torch.bfloat16,False,False,triton,0,0,0.0252,auto,0.0,443.94,3603.06
gfx1250,256,7104,6144,8192,False,torch.bfloat16,torch.bfloat16,False,False,triton,0,0,0.8857,auto,0.0,807.40,343.63
gfx1250,256,7104,6144,12288,False,torch.bfloat16,torch.bfloat16,False,False,triton,0,0,1.2545,auto,0.0,855.08,329.13
gfx1250,256,7104,9216,6144,False,torch.bfloat16,torch.bfloat16,False,False,triton,0,0,0.8762,auto,0.0,918.17,378.31
gfx1250,256,7104,9856,6144,False,torch.bfloat16,torch.bfloat16,False,False,triton,0,0,0.7429,auto,0.0,1158.06,469.00
gfx1250,256,7104,24576,6144,False,torch.bfloat16,torch.bfloat16,False,False,triton,0,0,2.7383,auto,0.0,783.44,269.67
gfx1250,256,7108,128,6144,False,torch.bfloat16,torch.bfloat16,False,False,triton,0,0,0.0255,auto,0.0,439.27,3565.11
gfx1250,256,7108,6144,8192,False,torch.bfloat16,torch.bfloat16,False,False,triton,0,0,0.8800,auto,0.0,813.13,346.00
gfx1250,256,7108,6144,12288,False,torch.bfloat16,torch.bfloat16,False,False,triton,0,0,1.1039,auto,0.0,972.22,374.14
gfx1250,256,7108,9216,6144,False,torch.bfloat16,torch.bfloat16,False,False,triton,0,0,0.8693,auto,0.0,925.96,381.45
gfx1250,256,7108,9856,6144,False,torch.bfloat16,torch.bfloat16,False,False,triton,0,0,0.7521,auto,0.0,1144.58,463.45
gfx1250,256,7108,24576,6144,False,torch.bfloat16,torch.bfloat16,False,False,triton,0,0,2.6385,auto,0.0,813.55,279.97
gfx1250,256,7113,128,6144,False,torch.bfloat16,torch.bfloat16,False,False,triton,0,0,0.0254,auto,0.0,440.26,3573.05
gfx1250,256,7113,6144,8192,False,torch.bfloat16,torch.bfloat16,False,False,triton,0,0,0.8830,auto,0.0,810.93,344.98
gfx1250,256,7113,6144,12288,False,torch.bfloat16,torch.bfloat16,False,False,triton,0,0,1.2173,auto,0.0,882.33,339.46
gfx1250,256,7113,9216,6144,False,torch.bfloat16,torch.bfloat16,False,False,triton,0,0,0.8691,auto,0.0,926.86,381.73
gfx1250,256,7113,9856,6144,False,torch.bfloat16,torch.bfloat16,False,False,triton,0,0,0.7521,auto,0.0,1145.39,463.66
gfx1250,256,7113,24576,6144,False,torch.bfloat16,torch.bfloat16,False,False,triton,0,0,2.6287,auto,0.0,817.15,281.13
gfx1250,256,7115,128,6144,False,torch.bfloat16,torch.bfloat16,False,False,triton,0,0,0.0255,auto,0.0,438.77,3561.00
gfx1250,256,7115,6144,8192,False,torch.bfloat16,torch.bfloat16,False,False,triton,0,0,0.8806,auto,0.0,813.32,345.97
gfx1250,256,7115,6144,12288,False,torch.bfloat16,torch.bfloat16,False,False,triton,0,0,1.1886,auto,0.0,903.84,347.70
gfx1250,256,7115,9216,6144,False,torch.bfloat16,torch.bfloat16,False,False,triton,0,0,0.8689,auto,0.0,927.28,381.87
gfx1250,256,7115,9856,6144,False,torch.bfloat16,torch.bfloat16,False,False,triton,0,0,0.7525,auto,0.0,1145.19,463.54
gfx1250,256,7115,24576,6144,False,torch.bfloat16,torch.bfloat16,False,False,triton,0,0,2.6276,auto,0.0,817.73,281.30
gfx1250,256,7147,128,6144,False,torch.bfloat16,torch.bfloat16,False,False,triton,0,0,0.0255,auto,0.0,440.28,3572.96
gfx1250,256,7147,6144,8192,False,torch.bfloat16,torch.bfloat16,False,False,triton,0,0,0.8813,auto,0.0,816.37,346.75
gfx1250,256,7147,6144,12288,False,torch.bfloat16,torch.bfloat16,False,False,triton,0,0,1.0498,auto,0.0,1027.96,394.80
gfx1250,256,7147,9216,6144,False,torch.bfloat16,torch.bfloat16,False,False,triton,0,0,0.8696,auto,0.0,930.76,382.71
gfx1250,256,7147,9856,6144,False,torch.bfloat16,torch.bfloat16,False,False,triton,0,0,0.7549,auto,0.0,1146.63,463.40
gfx1250,256,7147,24576,6144,False,torch.bfloat16,torch.bfloat16,False,False,triton,0,0,2.6434,auto,0.0,816.50,280.36
gfx1250,256,7164,128,6144,False,torch.bfloat16,torch.bfloat16,False,False,triton,0,0,0.0255,auto,0.0,442.11,3587.64
gfx1250,256,7164,6144,8192,False,torch.bfloat16,torch.bfloat16,False,False,triton,0,0,0.8841,auto,0.0,815.73,346.21
gfx1250,256,7164,6144,12288,False,torch.bfloat16,torch.bfloat16,False,False,triton,0,0,1.0294,auto,0.0,1050.80,403.22
gfx1250,256,7164,9216,6144,False,torch.bfloat16,torch.bfloat16,False,False,triton,0,0,0.8709,auto,0.0,931.57,382.74
gfx1250,256,7164,9856,6144,False,torch.bfloat16,torch.bfloat16,False,False,triton,0,0,0.7534,auto,0.0,1151.58,465.02
gfx1250,256,7164,24576,6144,False,torch.bfloat16,torch.bfloat16,False,False,triton,0,0,2.6567,auto,0.0,814.33,279.34
gfx1250,256,7186,128,6144,False,torch.bfloat16,torch.bfloat16,False,False,triton,0,0,0.0266,auto,0.0,424.16,3441.82
gfx1250,256,7186,6144,8192,False,torch.bfloat16,torch.bfloat16,False,False,triton,0,0,0.8937,auto,0.0,809.39,343.17
gfx1250,256,7186,6144,12288,False,torch.bfloat16,torch.bfloat16,False,False,triton,0,0,1.2583,auto,0.0,862.33,330.53
gfx1250,256,7186,9216,6144,False,torch.bfloat16,torch.bfloat16,False,False,triton,0,0,0.9692,auto,0.0,839.62,344.60
gfx1250,256,7186,9856,6144,False,torch.bfloat16,torch.bfloat16,False,False,triton,0,0,0.7798,auto,0.0,1116.09,450.21
gfx1250,256,7186,24576,6144,False,torch.bfloat16,torch.bfloat16,False,False,triton,0,0,2.7259,auto,0.0,796.11,272.76
gfx1250,256,7192,128,6144,False,torch.bfloat16,torch.bfloat16,False,False,triton,0,0,0.0263,auto,0.0,429.43,3484.52
gfx1250,256,7192,6144,8192,False,torch.bfloat16,torch.bfloat16,False,False,triton,0,0,0.8923,auto,0.0,811.39,343.93
gfx1250,256,7192,6144,12288,False,torch.bfloat16,torch.bfloat16,False,False,triton,0,0,1.2492,auto,0.0,869.29,333.10
gfx1250,256,7192,9216,6144,False,torch.bfloat16,torch.bfloat16,False,False,triton,0,0,0.9709,auto,0.0,838.84,344.18
gfx1250,256,7192,9856,6144,False,torch.bfloat16,torch.bfloat16,False,False,triton,0,0,0.8123,auto,0.0,1072.36,432.44
gfx1250,256,7192,24576,6144,False,torch.bfloat16,torch.bfloat16,False,False,triton,0,0,2.7074,auto,0.0,802.21,274.75
gfx1250,256,7212,128,6144,False,torch.bfloat16,torch.bfloat16,False,False,triton,0,0,0.0262,auto,0.0,432.64,3510.44
gfx1250,256,7212,6144,8192,False,torch.bfloat16,torch.bfloat16,False,False,triton,0,0,0.8917,auto,0.0,814.12,344.77
gfx1250,256,7212,6144,12288,False,torch.bfloat16,torch.bfloat16,False,False,triton,0,0,1.2453,auto,0.0,874.49,334.76
gfx1250,256,7212,9216,6144,False,torch.bfloat16,torch.bfloat16,False,False,triton,0,0,0.9705,auto,0.0,841.55,344.97
gfx1250,256,7212,9856,6144,False,torch.bfloat16,torch.bfloat16,False,False,triton,0,0,0.8498,auto,0.0,1027.87,414.11
gfx1250,256,7212,24576,6144,False,torch.bfloat16,torch.bfloat16,False,False,triton,0,0,2.7732,auto,0.0,785.35,268.68
gfx1250,256,7228,128,6144,False,torch.bfloat16,torch.bfloat16,False,False,triton,0,0,0.0263,auto,0.0,432.70,3510.73
gfx1250,256,7228,6144,8192,False,torch.bfloat16,torch.bfloat16,False,False,triton,0,0,0.8929,auto,0.0,814.87,344.84
gfx1250,256,7228,6144,12288,False,torch.bfloat16,torch.bfloat16,False,False,triton,0,0,1.2455,auto,0.0,876.25,335.16
gfx1250,256,7228,9216,6144,False,torch.bfloat16,torch.bfloat16,False,False,triton,0,0,0.9763,auto,0.0,838.37,343.41
gfx1250,256,7228,9856,6144,False,torch.bfloat16,torch.bfloat16,False,False,triton,0,0,0.8658,auto,0.0,1011.04,407.02
gfx1250,256,7228,24576,6144,False,torch.bfloat16,torch.bfloat16,False,False,triton,0,0,2.7889,auto,0.0,782.67,267.52
gfx1250,256,7237,128,6144,False,torch.bfloat16,torch.bfloat16,False,False,triton,0,0,0.0260,auto,0.0,437.58,3550.29
gfx1250,256,7237,6144,8192,False,torch.bfloat16,torch.bfloat16,False,False,triton,0,0,0.8921,auto,0.0,816.63,345.44
gfx1250,256,7237,6144,12288,False,torch.bfloat16,torch.bfloat16,False,False,triton,0,0,1.2240,auto,0.0,892.73,341.31
gfx1250,256,7237,9216,6144,False,torch.bfloat16,torch.bfloat16,False,False,triton,0,0,0.9718,auto,0.0,843.37,345.32
gfx1250,256,7237,9856,6144,False,torch.bfloat16,torch.bfloat16,False,False,triton,0,0,0.7719,auto,0.0,1135.46,456.91
gfx1250,256,7237,24576,6144,False,torch.bfloat16,torch.bfloat16,False,False,triton,0,0,2.8676,auto,0.0,762.14,260.37
gfx1250,256,7250,128,6144,False,torch.bfloat16,torch.bfloat16,False,False,triton,0,0,0.0264,auto,0.0,432.25,3506.95
gfx1250,256,7250,6144,8192,False,torch.bfloat16,torch.bfloat16,False,False,triton,0,0,0.8922,auto,0.0,817.97,345.81
gfx1250,256,7250,6144,12288,False,torch.bfloat16,torch.bfloat16,False,False,triton,0,0,1.2624,auto,0.0,867.17,331.32
gfx1250,256,7250,9216,6144,False,torch.bfloat16,torch.bfloat16,False,False,triton,0,0,0.9754,auto,0.0,841.72,344.43
gfx1250,256,7250,9856,6144,False,torch.bfloat16,torch.bfloat16,False,False,triton,0,0,0.8675,auto,0.0,1012.17,407.05
gfx1250,256,7250,24576,6144,False,torch.bfloat16,torch.bfloat16,False,False,triton,0,0,2.7915,auto,0.0,784.32,267.75
gfx1250,256,7258,128,6144,False,torch.bfloat16,torch.bfloat16,False,False,triton,0,0,0.0263,auto,0.0,433.85,3519.83
gfx1250,256,7258,6144,8192,False,torch.bfloat16,torch.bfloat16,False,False,triton,0,0,0.8932,auto,0.0,817.97,345.68
gfx1250,256,7258,6144,12288,False,torch.bfloat16,torch.bfloat16,False,False,triton,0,0,1.2410,auto,0.0,883.07,337.26
gfx1250,256,7258,9216,6144,False,torch.bfloat16,torch.bfloat16,False,False,triton,0,0,0.9717,auto,0.0,845.87,346.00
gfx1250,256,7258,9856,6144,False,torch.bfloat16,torch.bfloat16,False,False,triton,0,0,0.9160,auto,0.0,959.65,385.78
gfx1250,256,7258,24576,6144,False,torch.bfloat16,torch.bfloat16,False,False,triton,0,0,2.7470,auto,0.0,797.90,272.27
gfx1250,256,7267,128,6144,False,torch.bfloat16,torch.bfloat16,False,False,triton,0,0,0.0265,auto,0.0,431.19,3498.19
gfx1250,256,7267,6144,8192,False,torch.bfloat16,torch.bfloat16,False,False,triton,0,0,0.8932,auto,0.0,818.99,345.97
gfx1250,256,7267,6144,12288,False,torch.bfloat16,torch.bfloat16,False,False,triton,0,0,1.2454,auto,0.0,881.05,336.34
gfx1250,256,7267,9216,6144,False,torch.bfloat16,torch.bfloat16,False,False,triton,0,0,0.9777,auto,0.0,841.72,344.16
gfx1250,256,7267,9856,6144,False,torch.bfloat16,torch.bfloat16,False,False,triton,0,0,0.8021,auto,0.0,1097.22,440.90
gfx1250,256,7267,24576,6144,False,torch.bfloat16,torch.bfloat16,False,False,triton,0,0,2.7794,auto,0.0,789.58,269.29
gfx1250,256,7272,128,6144,False,torch.bfloat16,torch.bfloat16,False,False,triton,0,0,0.0265,auto,0.0,431.10,3497.39
gfx1250,256,7272,6144,8192,False,torch.bfloat16,torch.bfloat16,False,False,triton,0,0,0.8936,auto,0.0,819.22,345.99
gfx1250,256,7272,6144,12288,False,torch.bfloat16,torch.bfloat16,False,False,triton,0,0,1.2513,auto,0.0,877.50,334.90
gfx1250,256,7272,9216,6144,False,torch.bfloat16,torch.bfloat16,False,False,triton,0,0,0.9721,auto,0.0,847.18,346.31
gfx1250,256,7272,9856,6144,False,torch.bfloat16,torch.bfloat16,False,False,triton,0,0,0.8186,auto,0.0,1075.90,432.23
gfx1250,256,7272,24576,6144,False,torch.bfloat16,torch.bfloat16,False,False,triton,0,0,2.7377,auto,0.0,802.17,273.51
gfx1250,256,7287,128,6144,False,torch.bfloat16,torch.bfloat16,False,False,triton,0,0,0.0264,auto,0.0,434.71,3526.55
gfx1250,256,7287,6144,8192,False,torch.bfloat16,torch.bfloat16,False,False,triton,0,0,0.8948,auto,0.0,819.75,345.99
gfx1250,256,7287,6144,12288,False,torch.bfloat16,torch.bfloat16,False,False,triton,0,0,1.2468,auto,0.0,882.51,336.57
gfx1250,256,7287,9216,6144,False,torch.bfloat16,torch.bfloat16,False,False,triton,0,0,0.9730,auto,0.0,848.10,346.45
gfx1250,256,7287,9856,6144,False,torch.bfloat16,torch.bfloat16,False,False,triton,0,0,0.9418,auto,0.0,937.09,376.20
gfx1250,256,7287,24576,6144,False,torch.bfloat16,torch.bfloat16,False,False,triton,0,0,2.7920,auto,0.0,788.19,268.52
gfx1250,256,7292,128,6144,False,torch.bfloat16,torch.bfloat16,False,False,triton,0,0,0.0263,auto,0.0,435.68,3534.42
gfx1250,256,7292,6144,8192,False,torch.bfloat16,torch.bfloat16,False,False,triton,0,0,0.8952,auto,0.0,819.93,345.98
gfx1250,256,7292,6144,12288,False,torch.bfloat16,torch.bfloat16,False,False,triton,0,0,1.2569,auto,0.0,876.04,334.01
gfx1250,256,7292,9216,6144,False,torch.bfloat16,torch.bfloat16,False,False,triton,0,0,0.9753,auto,0.0,846.69,345.79
gfx1250,256,7292,9856,6144,False,torch.bfloat16,torch.bfloat16,False,False,triton,0,0,0.9259,auto,0.0,953.79,382.81
gfx1250,256,7292,24576,6144,False,torch.bfloat16,torch.bfloat16,False,False,triton,0,0,2.7795,auto,0.0,792.26,269.83
gfx1250,256,7308,128,6144,False,torch.bfloat16,torch.bfloat16,False,False,triton,0,0,0.0269,auto,0.0,427.00,3463.89
gfx1250,256,7308,6144,8192,False,torch.bfloat16,torch.bfloat16,False,False,triton,0,0,0.8939,auto,0.0,822.97,347.02
gfx1250,256,7308,6144,12288,False,torch.bfloat16,torch.bfloat16,False,False,triton,0,0,1.2681,auto,0.0,870.19,331.52
gfx1250,256,7308,9216,6144,False,torch.bfloat16,torch.bfloat16,False,False,triton,0,0,0.9759,auto,0.0,848.01,346.08
gfx1250,256,7308,9856,6144,False,torch.bfloat16,torch.bfloat16,False,False,triton,0,0,1.1430,auto,0.0,774.35,310.56
gfx1250,256,7308,24576,6144,False,torch.bfloat16,torch.bfloat16,False,False,triton,0,0,2.7918,auto,0.0,790.52,269.00
gfx1250,256,7309,128,6144,False,torch.bfloat16,torch.bfloat16,False,False,triton,0,0,0.0269,auto,0.0,426.74,3461.78
gfx1250,256,7309,6144,8192,False,torch.bfloat16,torch.bfloat16,False,False,triton,0,0,0.8951,auto,0.0,821.96,346.58
gfx1250,256,7309,6144,12288,False,torch.bfloat16,torch.bfloat16,False,False,triton,0,0,1.1107,auto,0.0,993.64,378.53
gfx1250,256,7309,9216,6144,False,torch.bfloat16,torch.bfloat16,False,False,triton,0,0,0.9743,auto,0.0,849.51,346.67
gfx1250,256,7309,9856,6144,False,torch.bfloat16,torch.bfloat16,False,False,triton,0,0,0.9637,auto,0.0,918.52,368.36
gfx1250,256,7309,24576,6144,False,torch.bfloat16,torch.bfloat16,False,False,triton,0,0,2.7057,auto,0.0,815.77,277.58
gfx1250,256,7323,128,6144,False,torch.bfloat16,torch.bfloat16,False,False,triton,0,0,0.0269,auto,0.0,428.15,3473.07
gfx1250,256,7323,6144,8192,False,torch.bfloat16,torch.bfloat16,False,False,triton,0,0,0.8953,auto,0.0,823.33,346.94
gfx1250,256,7323,6144,12288,False,torch.bfloat16,torch.bfloat16,False,False,triton,0,0,1.2712,auto,0.0,869.86,331.15
gfx1250,256,7323,9216,6144,False,torch.bfloat16,torch.bfloat16,False,False,triton,0,0,0.9720,auto,0.0,853.19,347.95
gfx1250,256,7323,9856,6144,False,torch.bfloat16,torch.bfloat16,False,False,triton,0,0,0.9997,auto,0.0,887.18,355.56
gfx1250,256,7323,24576,6144,False,torch.bfloat16,torch.bfloat16,False,False,triton,0,0,2.7477,auto,0.0,804.84,273.65
gfx1250,256,7327,128,6144,False,torch.bfloat16,torch.bfloat16,False,False,triton,0,0,0.0268,auto,0.0,430.35,3490.90
gfx1250,256,7327,6144,8192,False,torch.bfloat16,torch.bfloat16,False,False,triton,0,0,0.8948,auto,0.0,824.24,347.26
gfx1250,256,7327,6144,12288,False,torch.bfloat16,torch.bfloat16,False,False,triton,0,0,1.2629,auto,0.0,876.06,333.45
gfx1250,256,7327,9216,6144,False,torch.bfloat16,torch.bfloat16,False,False,triton,0,0,0.9722,auto,0.0,853.49,348.01
gfx1250,256,7327,9856,6144,False,torch.bfloat16,torch.bfloat16,False,False,triton,0,0,1.0421,auto,0.0,851.55,341.22
gfx1250,256,7327,24576,6144,False,torch.bfloat16,torch.bfloat16,False,False,triton,0,0,2.7722,auto,0.0,798.17,271.32
gfx1250,256,7331,128,6144,False,torch.bfloat16,torch.bfloat16,False,False,triton,0,0,0.0270,auto,0.0,427.71,3469.45
gfx1250,256,7331,6144,8192,False,torch.bfloat16,torch.bfloat16,False,False,triton,0,0,0.8945,auto,0.0,824.96,347.51
gfx1250,256,7331,6144,12288,False,torch.bfloat16,torch.bfloat16,False,False,triton,0,0,1.2403,auto,0.0,892.46,339.62
gfx1250,256,7331,9216,6144,False,torch.bfloat16,torch.bfloat16,False,False,triton,0,0,0.9717,auto,0.0,854.40,348.32
gfx1250,256,7331,9856,6144,False,torch.bfloat16,torch.bfloat16,False,False,triton,0,0,1.0555,auto,0.0,841.15,336.99
gfx1250,256,7331,24576,6144,False,torch.bfloat16,torch.bfloat16,False,False,triton,0,0,2.7945,auto,0.0,792.23,269.24
gfx1250,256,7332,128,6144,False,torch.bfloat16,torch.bfloat16,False,False,triton,0,0,0.0269,auto,0.0,428.69,3477.40
gfx1250,256,7332,6144,8192,False,torch.bfloat16,torch.bfloat16,False,False,triton,0,0,0.8945,auto,0.0,825.10,347.55
gfx1250,256,7332,6144,12288,False,torch.bfloat16,torch.bfloat16,False,False,triton,0,0,1.2615,auto,0.0,877.61,333.96
gfx1250,256,7332,9216,6144,False,torch.bfloat16,torch.bfloat16,False,False,triton,0,0,0.9745,auto,0.0,852.02,347.33
gfx1250,256,7332,9856,6144,False,torch.bfloat16,torch.bfloat16,False,False,triton,0,0,1.0655,auto,0.0,833.39,333.86
gfx1250,256,7332,24576,6144,False,torch.bfloat16,torch.bfloat16,False,False,triton,0,0,2.7751,auto,0.0,797.87,271.15
gfx1250,256,7335,128,6144,False,torch.bfloat16,torch.bfloat16,False,False,triton,0,0,0.0267,auto,0.0,431.89,3503.28
gfx1250,256,7335,6144,8192,False,torch.bfloat16,torch.bfloat16,False,False,triton,0,0,0.8958,auto,0.0,824.23,347.13
gfx1250,256,7335,6144,12288,False,torch.bfloat16,torch.bfloat16,False,False,triton,0,0,1.2802,auto,0.0,865.13,329.16
gfx1250,256,7335,9216,6144,False,torch.bfloat16,torch.bfloat16,False,False,triton,0,0,0.9738,auto,0.0,853.03,347.69
gfx1250,256,7335,9856,6144,False,torch.bfloat16,torch.bfloat16,False,False,triton,0,0,0.9657,auto,0.0,919.94,368.49
gfx1250,256,7335,24576,6144,False,torch.bfloat16,torch.bfloat16,False,False,triton,0,0,2.7849,auto,0.0,795.39,270.26
gfx1250,256,7344,128,6144,False,torch.bfloat16,torch.bfloat16,False,False,triton,0,0,0.0269,auto,0.0,430.19,3489.48
gfx1250,256,7344,6144,8192,False,torch.bfloat16,torch.bfloat16,False,False,triton,0,0,0.8946,auto,0.0,826.36,347.90
gfx1250,256,7344,6144,12288,False,torch.bfloat16,torch.bfloat16,False,False,triton,0,0,1.2707,auto,0.0,872.65,331.87
gfx1250,256,7344,9216,6144,False,torch.bfloat16,torch.bfloat16,False,False,triton,0,0,0.9725,auto,0.0,855.18,348.43
gfx1250,256,7344,9856,6144,False,torch.bfloat16,torch.bfloat16,False,False,triton,0,0,1.0405,auto,0.0,854.82,342.26
gfx1250,256,7344,24576,6144,False,torch.bfloat16,torch.bfloat16,False,False,triton,0,0,2.7975,auto,0.0,792.79,269.25
gfx1250,256,7350,128,6144,False,torch.bfloat16,torch.bfloat16,False,False,triton,0,0,0.0270,auto,0.0,428.47,3475.46
gfx1250,256,7350,6144,8192,False,torch.bfloat16,torch.bfloat16,False,False,triton,0,0,0.8950,auto,0.0,826.71,347.95
gfx1250,256,7350,6144,12288,False,torch.bfloat16,torch.bfloat16,False,False,triton,0,0,1.2587,auto,0.0,881.74,335.23
gfx1250,256,7350,9216,6144,False,torch.bfloat16,torch.bfloat16,False,False,triton,0,0,0.9784,auto,0.0,850.74,346.52
gfx1250,256,7350,9856,6144,False,torch.bfloat16,torch.bfloat16,False,False,triton,0,0,1.1373,auto,0.0,782.70,313.29
gfx1250,256,7350,24576,6144,False,torch.bfloat16,torch.bfloat16,False,False,triton,0,0,2.8033,auto,0.0,791.78,268.81
gfx1250,256,7355,128,6144,False,torch.bfloat16,torch.bfloat16,False,False,triton,0,0,0.0269,auto,0.0,430.45,3491.50
gfx1250,256,7355,6144,8192,False,torch.bfloat16,torch.bfloat16,False,False,triton,0,0,0.8961,auto,0.0,826.24,347.68
gfx1250,256,7355,6144,12288,False,torch.bfloat16,torch.bfloat16,False,False,triton,0,0,1.2313,auto,0.0,901.97,342.84
gfx1250,256,7355,9216,6144,False,torch.bfloat16,torch.bfloat16,False,False,triton,0,0,0.9787,auto,0.0,851.10,346.59
gfx1250,256,7355,9856,6144,False,torch.bfloat16,torch.bfloat16,False,False,triton,0,0,1.1331,auto,0.0,786.13,314.60
gfx1250,256,7355,24576,6144,False,torch.bfloat16,torch.bfloat16,False,False,triton,0,0,2.7818,auto,0.0,798.45,271.00
gfx1250,256,7369,128,6144,False,torch.bfloat16,torch.bfloat16,False,False,triton,0,0,0.0267,auto,0.0,434.26,3522.28
gfx1250,256,7369,6144,8192,False,torch.bfloat16,torch.bfloat16,False,False,triton,0,0,0.8954,auto,0.0,828.43,348.38
gfx1250,256,7369,6144,12288,False,torch.bfloat16,torch.bfloat16,False,False,triton,0,0,1.2698,auto,0.0,876.25,332.84
gfx1250,256,7369,9216,6144,False,torch.bfloat16,torch.bfloat16,False,False,triton,0,0,0.9740,auto,0.0,856.81,348.70
gfx1250,256,7369,9856,6144,False,torch.bfloat16,torch.bfloat16,False,False,triton,0,0,1.0894,auto,0.0,819.22,327.63
gfx1250,256,7369,24576,6144,False,torch.bfloat16,torch.bfloat16,False,False,triton,0,0,2.7683,auto,0.0,803.87,272.64
gfx1250,256,7398,128,6144,False,torch.bfloat16,torch.bfloat16,False,False,triton,0,0,0.0270,auto,0.0,430.87,3494.53
gfx1250,256,7398,6144,8192,False,torch.bfloat16,torch.bfloat16,False,False,triton,0,0,0.9015,auto,0.0,826.11,346.97
gfx1250,256,7398,6144,12288,False,torch.bfloat16,torch.bfloat16,False,False,triton,0,0,1.2470,auto,0.0,895.77,339.78
gfx1250,256,7398,9216,6144,False,torch.bfloat16,torch.bfloat16,False,False,triton,0,0,0.9806,auto,0.0,854.35,347.24
gfx1250,256,7398,9856,6144,False,torch.bfloat16,torch.bfloat16,False,False,triton,0,0,1.2387,auto,0.0,723.35,288.90
gfx1250,256,7398,24576,6144,False,torch.bfloat16,torch.bfloat16,False,False,triton,0,0,2.8214,auto,0.0,791.86,268.14
gfx1250,256,7402,128,6144,False,torch.bfloat16,torch.bfloat16,False,False,triton,0,0,0.0271,auto,0.0,430.29,3489.80
gfx1250,256,7402,6144,8192,False,torch.bfloat16,torch.bfloat16,False,False,triton,0,0,0.9005,auto,0.0,827.48,347.48
gfx1250,256,7402,6144,12288,False,torch.bfloat16,torch.bfloat16,False,False,triton,0,0,1.2348,auto,0.0,905.11,343.25
gfx1250,256,7402,9216,6144,False,torch.bfloat16,torch.bfloat16,False,False,triton,0,0,0.9794,auto,0.0,855.86,347.79
gfx1250,256,7402,9856,6144,False,torch.bfloat16,torch.bfloat16,False,False,triton,0,0,1.2588,auto,0.0,712.14,284.37
gfx1250,256,7402,24576,6144,False,torch.bfloat16,torch.bfloat16,False,False,triton,0,0,2.8411,auto,0.0,786.77,266.36
gfx1250,256,7403,128,6144,False,torch.bfloat16,torch.bfloat16,False,False,triton,0,0,0.0269,auto,0.0,432.63,3508.81
gfx1250,256,7403,6144,8192,False,torch.bfloat16,torch.bfloat16,False,False,triton,0,0,0.9006,auto,0.0,827.46,347.46
gfx1250,256,7403,6144,12288,False,torch.bfloat16,torch.bfloat16,False,False,triton,0,0,1.2426,auto,0.0,899.57,341.14
gfx1250,256,7403,9216,6144,False,torch.bfloat16,torch.bfloat16,False,False,triton,0,0,0.9804,auto,0.0,855.09,347.47
gfx1250,256,7403,9856,6144,False,torch.bfloat16,torch.bfloat16,False,False,triton,0,0,1.2237,auto,0.0,732.68,292.56
gfx1250,256,7403,24576,6144,False,torch.bfloat16,torch.bfloat16,False,False,triton,0,0,2.7897,auto,0.0,801.39,271.30
gfx1250,256,7421,128,6144,False,torch.bfloat16,torch.bfloat16,False,False,triton,0,0,0.0269,auto,0.0,434.02,3519.95
gfx1250,256,7421,6144,8192,False,torch.bfloat16,torch.bfloat16,False,False,triton,0,0,0.8974,auto,0.0,832.41,349.27
gfx1250,256,7421,6144,12288,False,torch.bfloat16,torch.bfloat16,False,False,triton,0,0,1.2848,auto,0.0,872.15,330.45
gfx1250,256,7421,9216,6144,False,torch.bfloat16,torch.bfloat16,False,False,triton,0,0,0.9805,auto,0.0,857.11,348.00
gfx1250,256,7421,9856,6144,False,torch.bfloat16,torch.bfloat16,False,False,triton,0,0,1.2182,auto,0.0,737.75,294.34
gfx1250,256,7421,24576,6144,False,torch.bfloat16,torch.bfloat16,False,False,triton,0,0,2.8048,auto,0.0,799.01,270.23
gfx1250,256,7425,128,6144,False,torch.bfloat16,torch.bfloat16,False,False,triton,0,0,0.0275,auto,0.0,424.69,3444.20
gfx1250,256,7425,6144,8192,False,torch.bfloat16,torch.bfloat16,False,False,triton,0,0,0.9096,auto,0.0,821.73,344.72
gfx1250,256,7425,6144,12288,False,torch.bfloat16,torch.bfloat16,False,False,triton,0,0,1.3491,auto,0.0,831.05,314.82
gfx1250,256,7425,9216,6144,False,torch.bfloat16,torch.bfloat16,False,False,triton,0,0,0.9738,auto,0.0,863.44,350.51
gfx1250,256,7425,9856,6144,False,torch.bfloat16,torch.bfloat16,False,False,triton,0,0,0.9266,auto,0.0,970.53,387.14
gfx1250,256,7425,24576,6144,False,torch.bfloat16,torch.bfloat16,False,False,triton,0,0,2.7454,auto,0.0,816.75,276.17
gfx1250,256,7435,128,6144,False,torch.bfloat16,torch.bfloat16,False,False,triton,0,0,0.0276,auto,0.0,423.75,3436.51
gfx1250,256,7435,6144,8192,False,torch.bfloat16,torch.bfloat16,False,False,triton,0,0,0.9099,auto,0.0,822.55,344.92
gfx1250,256,7435,6144,12288,False,torch.bfloat16,torch.bfloat16,False,False,triton,0,0,1.0912,auto,0.0,1028.86,389.57
gfx1250,256,7435,9216,6144,False,torch.bfloat16,torch.bfloat16,False,False,triton,0,0,0.9780,auto,0.0,860.94,349.34
gfx1250,256,7435,9856,6144,False,torch.bfloat16,torch.bfloat16,False,False,triton,0,0,1.0983,auto,0.0,819.86,326.89
gfx1250,256,7435,24576,6144,False,torch.bfloat16,torch.bfloat16,False,False,triton,0,0,2.7754,auto,0.0,808.99,273.40
gfx1250,256,7441,128,6144,False,torch.bfloat16,torch.bfloat16,False,False,triton,0,0,0.0275,auto,0.0,425.20,3448.24
gfx1250,256,7441,6144,8192,False,torch.bfloat16,torch.bfloat16,False,False,triton,0,0,0.9091,auto,0.0,823.93,345.41
gfx1250,256,7441,6144,12288,False,torch.bfloat16,torch.bfloat16,False,False,triton,0,0,1.3843,auto,0.0,811.62,307.22
gfx1250,256,7441,9216,6144,False,torch.bfloat16,torch.bfloat16,False,False,triton,0,0,0.9779,auto,0.0,861.67,349.54
gfx1250,256,7441,9856,6144,False,torch.bfloat16,torch.bfloat16,False,False,triton,0,0,0.9047,auto,0.0,996.10,397.06
gfx1250,256,7441,24576,6144,False,torch.bfloat16,torch.bfloat16,False,False,triton,0,0,2.8388,auto,0.0,791.56,267.42
gfx1250,256,7461,128,6144,False,torch.bfloat16,torch.bfloat16,False,False,triton,0,0,0.0277,auto,0.0,423.93,3437.74
gfx1250,256,7461,6144,8192,False,torch.bfloat16,torch.bfloat16,False,False,triton,0,0,0.9109,auto,0.0,824.53,345.36
gfx1250,256,7461,6144,12288,False,torch.bfloat16,torch.bfloat16,False,False,triton,0,0,1.0752,auto,0.0,1047.82,396.25
gfx1250,256,7461,9216,6144,False,torch.bfloat16,torch.bfloat16,False,False,triton,0,0,0.9787,auto,0.0,863.28,349.88
gfx1250,256,7461,9856,6144,False,torch.bfloat16,torch.bfloat16,False,False,triton,0,0,1.0354,auto,0.0,872.74,347.57
gfx1250,256,7461,24576,6144,False,torch.bfloat16,torch.bfloat16,False,False,triton,0,0,2.7515,auto,0.0,818.87,276.35
gfx1250,256,7462,128,6144,False,torch.bfloat16,torch.bfloat16,False,False,triton,0,0,0.0276,auto,0.0,425.32,3449.04
gfx1250,256,7462,6144,8192,False,torch.bfloat16,torch.bfloat16,False,False,triton,0,0,0.9092,auto,0.0,826.17,346.04
gfx1250,256,7462,6144,12288,False,torch.bfloat16,torch.bfloat16,False,False,triton,0,0,1.0220,auto,0.0,1102.45,416.90
gfx1250,256,7462,9216,6144,False,torch.bfloat16,torch.bfloat16,False,False,triton,0,0,0.9779,auto,0.0,864.13,350.21
gfx1250,256,7462,9856,6144,False,torch.bfloat16,torch.bfloat16,False,False,triton,0,0,1.1190,auto,0.0,807.64,321.63
gfx1250,256,7462,24576,6144,False,torch.bfloat16,torch.bfloat16,False,False,triton,0,0,2.8238,auto,0.0,798.01,269.30
gfx1250,256,7463,128,6144,False,torch.bfloat16,torch.bfloat16,False,False,triton,0,0,0.0275,auto,0.0,427.20,3464.31
gfx1250,256,7463,6144,8192,False,torch.bfloat16,torch.bfloat16,False,False,triton,0,0,0.9083,auto,0.0,827.08,346.40
gfx1250,256,7463,6144,12288,False,torch.bfloat16,torch.bfloat16,False,False,triton,0,0,1.3797,auto,0.0,816.78,308.85
gfx1250,256,7463,9216,6144,False,torch.bfloat16,torch.bfloat16,False,False,triton,0,0,0.9817,auto,0.0,860.89,348.89
gfx1250,256,7463,9856,6144,False,torch.bfloat16,torch.bfloat16,False,False,triton,0,0,1.1034,auto,0.0,819.13,326.19
gfx1250,256,7463,24576,6144,False,torch.bfloat16,torch.bfloat16,False,False,triton,0,0,2.8471,auto,0.0,791.59,267.12
gfx1250,256,7470,128,6144,False,torch.bfloat16,torch.bfloat16,False,False,triton,0,0,0.0276,auto,0.0,425.90,3453.68
gfx1250,256,7470,6144,8192,False,torch.bfloat16,torch.bfloat16,False,False,triton,0,0,0.9102,auto,0.0,826.16,345.91
gfx1250,256,7470,6144,12288,False,torch.bfloat16,torch.bfloat16,False,False,triton,0,0,1.2600,auto,0.0,895.16,338.38
gfx1250,256,7470,9216,6144,False,torch.bfloat16,torch.bfloat16,False,False,triton,0,0,0.9790,auto,0.0,864.10,350.08
gfx1250,256,7470,9856,6144,False,torch.bfloat16,torch.bfloat16,False,False,triton,0,0,1.0230,auto,0.0,884.36,352.05
gfx1250,256,7470,24576,6144,False,torch.bfloat16,torch.bfloat16,False,False,triton,0,0,2.8136,auto,0.0,801.77,270.45
gfx1250,256,7484,128,6144,False,torch.bfloat16,torch.bfloat16,False,False,triton,0,0,0.0274,auto,0.0,429.27,3480.86
gfx1250,256,7484,6144,8192,False,torch.bfloat16,torch.bfloat16,False,False,triton,0,0,0.9119,auto,0.0,826.14,345.70
gfx1250,256,7484,6144,12288,False,torch.bfloat16,torch.bfloat16,False,False,triton,0,0,1.0455,auto,0.0,1080.85,408.30
gfx1250,256,7484,9216,6144,False,torch.bfloat16,torch.bfloat16,False,False,triton,0,0,0.9788,auto,0.0,865.93,350.60
gfx1250,256,7484,9856,6144,False,torch.bfloat16,torch.bfloat16,False,False,triton,0,0,1.1302,auto,0.0,801.99,319.06
gfx1250,256,7484,24576,6144,False,torch.bfloat16,torch.bfloat16,False,False,triton,0,0,2.7652,auto,0.0,817.35,275.50
gfx1250,256,7507,128,6144,False,torch.bfloat16,torch.bfloat16,False,False,triton,0,0,0.0278,auto,0.0,424.90,3445.27
gfx1250,256,7507,6144,8192,False,torch.bfloat16,torch.bfloat16,False,False,triton,0,0,0.9100,auto,0.0,830.38,347.13
gfx1250,256,7507,6144,12288,False,torch.bfloat16,torch.bfloat16,False,False,triton,0,0,1.3990,auto,0.0,810.24,305.74
gfx1250,256,7507,9216,6144,False,torch.bfloat16,torch.bfloat16,False,False,triton,0,0,0.9804,auto,0.0,867.13,350.73
gfx1250,256,7507,9856,6144,False,torch.bfloat16,torch.bfloat16,False,False,triton,0,0,1.2985,auto,0.0,700.16,278.26
gfx1250,256,7507,24576,6144,False,torch.bfloat16,torch.bfloat16,False,False,triton,0,0,2.8345,auto,0.0,799.79,269.26
gfx1250,256,7517,128,6144,False,torch.bfloat16,torch.bfloat16,False,False,triton,0,0,0.0278,auto,0.0,424.61,3442.85
gfx1250,256,7517,6144,8192,False,torch.bfloat16,torch.bfloat16,False,False,triton,0,0,0.9100,auto,0.0,831.52,347.46
gfx1250,256,7517,6144,12288,False,torch.bfloat16,torch.bfloat16,False,False,triton,0,0,1.0988,auto,0.0,1032.98,389.61
gfx1250,256,7517,9216,6144,False,torch.bfloat16,torch.bfloat16,False,False,triton,0,0,0.9840,auto,0.0,865.13,349.77
gfx1250,256,7517,9856,6144,False,torch.bfloat16,torch.bfloat16,False,False,triton,0,0,0.8001,auto,0.0,1137.81,452.00
gfx1250,256,7517,24576,6144,False,torch.bfloat16,torch.bfloat16,False,False,triton,0,0,2.8746,auto,0.0,789.71,265.72
gfx1250,256,7525,128,6144,False,torch.bfloat16,torch.bfloat16,False,False,triton,0,0,0.0278,auto,0.0,425.55,3450.42
gfx1250,256,7525,6144,8192,False,torch.bfloat16,torch.bfloat16,False,False,triton,0,0,0.9102,auto,0.0,832.27,347.66
gfx1250,256,7525,6144,12288,False,torch.bfloat16,torch.bfloat16,False,False,triton,0,0,1.0672,auto,0.0,1064.64,401.40
gfx1250,256,7525,9216,6144,False,torch.bfloat16,torch.bfloat16,False,False,triton,0,0,0.9834,auto,0.0,866.57,350.23
gfx1250,256,7525,9856,6144,False,torch.bfloat16,torch.bfloat16,False,False,triton,0,0,1.1642,auto,0.0,782.79,310.86
gfx1250,256,7525,24576,6144,False,torch.bfloat16,torch.bfloat16,False,False,triton,0,0,2.8663,auto,0.0,792.83,266.66
gfx1250,256,7526,128,6144,False,torch.bfloat16,torch.bfloat16,False,False,triton,0,0,0.0277,auto,0.0,427.71,3467.95
gfx1250,256,7526,6144,8192,False,torch.bfloat16,torch.bfloat16,False,False,triton,0,0,0.9102,auto,0.0,832.34,347.67
gfx1250,256,7526,6144,12288,False,torch.bfloat16,torch.bfloat16,False,False,triton,0,0,1.3408,auto,0.0,847.55,319.54
gfx1250,256,7526,9216,6144,False,torch.bfloat16,torch.bfloat16,False,False,triton,0,0,0.9845,auto,0.0,865.75,349.89
gfx1250,256,7526,9856,6144,False,torch.bfloat16,torch.bfloat16,False,False,triton,0,0,1.1804,auto,0.0,772.18,306.63
gfx1250,256,7526,24576,6144,False,torch.bfloat16,torch.bfloat16,False,False,triton,0,0,2.8747,auto,0.0,790.61,265.90
gfx1250,256,7529,128,6144,False,torch.bfloat16,torch.bfloat16,False,False,triton,0,0,0.0276,auto,0.0,428.89,3477.48
gfx1250,256,7529,6144,8192,False,torch.bfloat16,torch.bfloat16,False,False,triton,0,0,0.9117,auto,0.0,831.30,347.19
gfx1250,256,7529,6144,12288,False,torch.bfloat16,torch.bfloat16,False,False,triton,0,0,1.4052,auto,0.0,809.04,304.97
gfx1250,256,7529,9216,6144,False,torch.bfloat16,torch.bfloat16,False,False,triton,0,0,0.9837,auto,0.0,866.74,350.24
gfx1250,256,7529,9856,6144,False,torch.bfloat16,torch.bfloat16,False,False,triton,0,0,1.3143,auto,0.0,693.80,275.47
gfx1250,256,7529,24576,6144,False,torch.bfloat16,torch.bfloat16,False,False,triton,0,0,2.9179,auto,0.0,779.22,262.03
gfx1250,256,7613,128,6144,False,torch.bfloat16,torch.bfloat16,False,False,triton,0,0,0.0284,auto,0.0,421.86,3419.90
gfx1250,256,7613,6144,8192,False,torch.bfloat16,torch.bfloat16,False,False,triton,0,0,0.9126,auto,0.0,839.75,349.49
gfx1250,256,7613,6144,12288,False,torch.bfloat16,torch.bfloat16,False,False,triton,0,0,1.2984,auto,0.0,885.32,332.43
gfx1250,256,7613,9216,6144,False,torch.bfloat16,torch.bfloat16,False,False,triton,0,0,0.9879,auto,0.0,872.70,351.37
gfx1250,256,7613,9856,6144,False,torch.bfloat16,torch.bfloat16,False,False,triton,0,0,1.4115,auto,0.0,653.22,258.40
gfx1250,256,7613,24576,6144,False,torch.bfloat16,torch.bfloat16,False,False,triton,0,0,2.9125,auto,0.0,789.38,264.29
gfx1250,256,7618,128,6144,False,torch.bfloat16,torch.bfloat16,False,False,triton,0,0,0.0286,auto,0.0,419.61,3401.61
gfx1250,256,7618,6144,8192,False,torch.bfloat16,torch.bfloat16,False,False,triton,0,0,0.9126,auto,0.0,840.27,349.64
gfx1250,256,7618,6144,12288,False,torch.bfloat16,torch.bfloat16,False,False,triton,0,0,1.3159,auto,0.0,874.12,328.15
gfx1250,256,7618,9216,6144,False,torch.bfloat16,torch.bfloat16,False,False,triton,0,0,0.9883,auto,0.0,872.90,351.37
gfx1250,256,7618,9856,6144,False,torch.bfloat16,torch.bfloat16,False,False,triton,0,0,1.2986,auto,0.0,710.46,280.98
gfx1250,256,7618,24576,6144,False,torch.bfloat16,torch.bfloat16,False,False,triton,0,0,2.8681,auto,0.0,802.12,268.48
gfx1250,256,7619,128,6144,False,torch.bfloat16,torch.bfloat16,False,False,triton,0,0,0.0284,auto,0.0,422.03,3421.22
gfx1250,256,7619,6144,8192,False,torch.bfloat16,torch.bfloat16,False,False,triton,0,0,0.9183,auto,0.0,835.22,347.52
gfx1250,256,7619,6144,12288,False,torch.bfloat16,torch.bfloat16,False,False,triton,0,0,1.3092,auto,0.0,878.75,329.87
gfx1250,256,7619,9216,6144,False,torch.bfloat16,torch.bfloat16,False,False,triton,0,0,0.9879,auto,0.0,873.41,351.56
gfx1250,256,7619,9856,6144,False,torch.bfloat16,torch.bfloat16,False,False,triton,0,0,1.4160,auto,0.0,651.64,257.71
gfx1250,256,7619,24576,6144,False,torch.bfloat16,torch.bfloat16,False,False,triton,0,0,2.8959,auto,0.0,794.53,265.93
gfx1250,256,7620,128,6144,False,torch.bfloat16,torch.bfloat16,False,False,triton,0,0,0.0284,auto,0.0,422.33,3423.59
gfx1250,256,7620,6144,8192,False,torch.bfloat16,torch.bfloat16,False,False,triton,0,0,0.9132,auto,0.0,839.94,349.47
gfx1250,256,7620,6144,12288,False,torch.bfloat16,torch.bfloat16,False,False,triton,0,0,1.0831,auto,0.0,1062.26,398.74
gfx1250,256,7620,9216,6144,False,torch.bfloat16,torch.bfloat16,False,False,triton,0,0,0.9890,auto,0.0,872.52,351.19
gfx1250,256,7620,9856,6144,False,torch.bfloat16,torch.bfloat16,False,False,triton,0,0,1.2370,auto,0.0,746.02,295.02
gfx1250,256,7620,24576,6144,False,torch.bfloat16,torch.bfloat16,False,False,triton,0,0,2.9233,auto,0.0,787.19,263.46
gfx1250,256,7624,128,6144,False,torch.bfloat16,torch.bfloat16,False,False,triton,0,0,0.0285,auto,0.0,420.92,3412.14
gfx1250,256,7624,6144,8192,False,torch.bfloat16,torch.bfloat16,False,False,triton,0,0,0.9176,auto,0.0,836.41,347.94
gfx1250,256,7624,6144,12288,False,torch.bfloat16,torch.bfloat16,False,False,triton,0,0,1.3798,auto,0.0,834.29,313.12
gfx1250,256,7624,9216,6144,False,torch.bfloat16,torch.bfloat16,False,False,triton,0,0,0.9896,auto,0.0,872.49,351.12
gfx1250,256,7624,9856,6144,False,torch.bfloat16,torch.bfloat16,False,False,triton,0,0,1.3835,auto,0.0,667.39,263.87
gfx1250,256,7624,24576,6144,False,torch.bfloat16,torch.bfloat16,False,False,triton,0,0,2.9215,auto,0.0,788.08,263.70
gfx1250,256,7630,128,6144,False,torch.bfloat16,torch.bfloat16,False,False,triton,0,0,0.0285,auto,0.0,421.75,3418.86
gfx1250,256,7630,6144,8192,False,torch.bfloat16,torch.bfloat16,False,False,triton,0,0,0.9161,auto,0.0,838.36,348.67
gfx1250,256,7630,6144,12288,False,torch.bfloat16,torch.bfloat16,False,False,triton,0,0,1.3912,auto,0.0,828.12,310.71
gfx1250,256,7630,9216,6144,False,torch.bfloat16,torch.bfloat16,False,False,triton,0,0,0.9876,auto,0.0,874.90,352.00
gfx1250,256,7630,9856,6144,False,torch.bfloat16,torch.bfloat16,False,False,triton,0,0,1.4196,auto,0.0,650.92,257.30
gfx1250,256,7630,24576,6144,False,torch.bfloat16,torch.bfloat16,False,False,triton,0,0,2.9612,auto,0.0,778.11,260.29
gfx1250,256,7635,128,6144,False,torch.bfloat16,torch.bfloat16,False,False,triton,0,0,0.0285,auto,0.0,421.51,3416.86
gfx1250,256,7635,6144,8192,False,torch.bfloat16,torch.bfloat16,False,False,triton,0,0,0.9119,auto,0.0,842.84,350.46
gfx1250,256,7635,6144,12288,False,torch.bfloat16,torch.bfloat16,False,False,triton,0,0,1.4150,auto,0.0,814.75,305.63
gfx1250,256,7635,9216,6144,False,torch.bfloat16,torch.bfloat16,False,False,triton,0,0,0.9878,auto,0.0,875.32,352.09
gfx1250,256,7635,9856,6144,False,torch.bfloat16,torch.bfloat16,False,False,triton,0,0,1.4017,auto,0.0,659.69,260.71
gfx1250,256,7635,24576,6144,False,torch.bfloat16,torch.bfloat16,False,False,triton,0,0,2.8965,auto,0.0,796.03,266.21
gfx1250,256,7657,128,6144,False,torch.bfloat16,torch.bfloat16,False,False,triton,0,0,0.0284,auto,0.0,423.53,3433.05
gfx1250,256,7657,6144,8192,False,torch.bfloat16,torch.bfloat16,False,False,triton,0,0,0.9137,auto,0.0,843.54,350.43
gfx1250,256,7657,6144,12288,False,torch.bfloat16,torch.bfloat16,False,False,triton,0,0,1.4206,auto,0.0,813.87,304.99
gfx1250,256,7657,9216,6144,False,torch.bfloat16,torch.bfloat16,False,False,triton,0,0,0.9896,auto,0.0,876.21,352.12
gfx1250,256,7657,9856,6144,False,torch.bfloat16,torch.bfloat16,False,False,triton,0,0,1.4298,auto,0.0,648.58,256.07
gfx1250,256,7657,24576,6144,False,torch.bfloat16,torch.bfloat16,False,False,triton,0,0,2.9293,auto,0.0,789.37,263.69
gfx1250,256,7659,128,6144,False,torch.bfloat16,torch.bfloat16,False,False,triton,0,0,0.0285,auto,0.0,423.31,3431.28
gfx1250,256,7659,6144,8192,False,torch.bfloat16,torch.bfloat16,False,False,triton,0,0,0.9189,auto,0.0,839.07,348.54
gfx1250,256,7659,6144,12288,False,torch.bfloat16,torch.bfloat16,False,False,triton,0,0,1.0270,auto,0.0,1126.08,421.95
gfx1250,256,7659,9216,6144,False,torch.bfloat16,torch.bfloat16,False,False,triton,0,0,0.9891,auto,0.0,876.88,352.36
gfx1250,256,7659,9856,6144,False,torch.bfloat16,torch.bfloat16,False,False,triton,0,0,1.4071,auto,0.0,659.22,260.25
gfx1250,256,7659,24576,6144,False,torch.bfloat16,torch.bfloat16,False,False,triton,0,0,2.9412,auto,0.0,786.41,262.67
gfx1250,256,7672,128,6144,False,torch.bfloat16,torch.bfloat16,False,False,triton,0,0,0.0285,auto,0.0,423.46,3432.43
gfx1250,256,7672,6144,8192,False,torch.bfloat16,torch.bfloat16,False,False,triton,0,0,0.9181,auto,0.0,841.21,349.25
gfx1250,256,7672,6144,12288,False,torch.bfloat16,torch.bfloat16,False,False,triton,0,0,1.0401,auto,0.0,1113.72,417.07
gfx1250,256,7672,9216,6144,False,torch.bfloat16,torch.bfloat16,False,False,triton,0,0,0.9911,auto,0.0,876.63,352.06
gfx1250,256,7672,9856,6144,False,torch.bfloat16,torch.bfloat16,False,False,triton,0,0,1.3541,auto,0.0,686.19,270.75
gfx1250,256,7672,24576,6144,False,torch.bfloat16,torch.bfloat16,False,False,triton,0,0,2.8854,auto,0.0,802.95,268.02
gfx1250,256,7696,128,6144,False,torch.bfloat16,torch.bfloat16,False,False,triton,0,0,0.0278,auto,0.0,435.08,3526.40
gfx1250,256,7696,6144,8192,False,torch.bfloat16,torch.bfloat16,False,False,triton,0,0,0.9257,auto,0.0,836.88,347.11
gfx1250,256,7696,6144,12288,False,torch.bfloat16,torch.bfloat16,False,False,triton,0,0,1.2628,auto,0.0,920.20,344.23
gfx1250,256,7696,9216,6144,False,torch.bfloat16,torch.bfloat16,False,False,triton,0,0,0.9902,auto,0.0,880.16,353.12
gfx1250,256,7696,9856,6144,False,torch.bfloat16,torch.bfloat16,False,False,triton,0,0,1.2988,auto,0.0,717.66,282.87
gfx1250,256,7696,24576,6144,False,torch.bfloat16,torch.bfloat16,False,False,triton,0,0,2.9039,auto,0.0,800.35,266.83
gfx1250,256,7705,128,6144,False,torch.bfloat16,torch.bfloat16,False,False,triton,0,0,0.0277,auto,0.0,437.71,3547.67
gfx1250,256,7705,6144,8192,False,torch.bfloat16,torch.bfloat16,False,False,triton,0,0,0.9254,auto,0.0,838.15,347.51
gfx1250,256,7705,6144,12288,False,torch.bfloat16,torch.bfloat16,False,False,triton,0,0,1.3175,auto,0.0,883.07,330.20
gfx1250,256,7705,9216,6144,False,torch.bfloat16,torch.bfloat16,False,False,triton,0,0,0.9908,auto,0.0,880.68,353.20
gfx1250,256,7705,9856,6144,False,torch.bfloat16,torch.bfloat16,False,False,triton,0,0,1.3565,auto,0.0,687.90,271.04
gfx1250,256,7705,24576,6144,False,torch.bfloat16,torch.bfloat16,False,False,triton,0,0,2.8800,auto,0.0,807.93,269.23
gfx1250,256,7708,128,6144,False,torch.bfloat16,torch.bfloat16,False,False,triton,0,0,0.0276,auto,0.0,438.56,3554.55
gfx1250,256,7708,6144,8192,False,torch.bfloat16,torch.bfloat16,False,False,triton,0,0,0.9263,auto,0.0,837.65,347.26
gfx1250,256,7708,6144,12288,False,torch.bfloat16,torch.bfloat16,False,False,triton,0,0,1.3798,auto,0.0,843.53,315.37
gfx1250,256,7708,9216,6144,False,torch.bfloat16,torch.bfloat16,False,False,triton,0,0,0.9903,auto,0.0,881.46,353.47
gfx1250,256,7708,9856,6144,False,torch.bfloat16,torch.bfloat16,False,False,triton,0,0,1.3133,auto,0.0,710.80,280.02
gfx1250,256,7708,24576,6144,False,torch.bfloat16,torch.bfloat16,False,False,triton,0,0,2.9044,auto,0.0,801.45,267.03
gfx1250,256,7720,128,6144,False,torch.bfloat16,torch.bfloat16,False,False,triton,0,0,0.0278,auto,0.0,436.51,3537.86
gfx1250,256,7720,6144,8192,False,torch.bfloat16,torch.bfloat16,False,False,triton,0,0,0.9260,auto,0.0,839.22,347.74
gfx1250,256,7720,6144,12288,False,torch.bfloat16,torch.bfloat16,False,False,triton,0,0,1.1592,auto,0.0,1005.63,375.78
gfx1250,256,7720,9216,6144,False,torch.bfloat16,torch.bfloat16,False,False,triton,0,0,0.9905,auto,0.0,882.64,353.76
gfx1250,256,7720,9856,6144,False,torch.bfloat16,torch.bfloat16,False,False,triton,0,0,0.8618,auto,0.0,1084.85,427.17
gfx1250,256,7720,24576,6144,False,torch.bfloat16,torch.bfloat16,False,False,triton,0,0,2.9552,auto,0.0,788.91,262.69
gfx1250,256,7724,128,6144,False,torch.bfloat16,torch.bfloat16,False,False,triton,0,0,0.0275,auto,0.0,441.05,3574.61
gfx1250,256,7724,6144,8192,False,torch.bfloat16,torch.bfloat16,False,False,triton,0,0,0.9251,auto,0.0,840.45,348.20
gfx1250,256,7724,6144,12288,False,torch.bfloat16,torch.bfloat16,False,False,triton,0,0,1.0309,auto,0.0,1131.32,422.67
gfx1250,256,7724,9216,6144,False,torch.bfloat16,torch.bfloat16,False,False,triton,0,0,0.9900,auto,0.0,883.55,354.07
gfx1250,256,7724,9856,6144,False,torch.bfloat16,torch.bfloat16,False,False,triton,0,0,1.3797,auto,0.0,678.00,266.92
gfx1250,256,7724,24576,6144,False,torch.bfloat16,torch.bfloat16,False,False,triton,0,0,2.9438,auto,0.0,792.37,263.79
gfx1250,256,7725,128,6144,False,torch.bfloat16,torch.bfloat16,False,False,triton,0,0,0.0277,auto,0.0,439.29,3560.33
gfx1250,256,7725,6144,8192,False,torch.bfloat16,torch.bfloat16,False,False,triton,0,0,0.9270,auto,0.0,838.83,347.51
gfx1250,256,7725,6144,12288,False,torch.bfloat16,torch.bfloat16,False,False,triton,0,0,1.4722,auto,0.0,792.30,296.00
gfx1250,256,7725,9216,6144,False,torch.bfloat16,torch.bfloat16,False,False,triton,0,0,0.9907,auto,0.0,883.03,353.85
gfx1250,256,7725,9856,6144,False,torch.bfloat16,torch.bfloat16,False,False,triton,0,0,1.3948,auto,0.0,670.78,264.07
gfx1250,256,7725,24576,6144,False,torch.bfloat16,torch.bfloat16,False,False,triton,0,0,2.9477,auto,0.0,791.41,263.46
gfx1250,256,7751,128,6144,False,torch.bfloat16,torch.bfloat16,False,False,triton,0,0,0.0276,auto,0.0,440.96,3573.68
gfx1250,256,7751,6144,8192,False,torch.bfloat16,torch.bfloat16,False,False,triton,0,0,0.9267,auto,0.0,841.96,348.44
gfx1250,256,7751,6144,12288,False,torch.bfloat16,torch.bfloat16,False,False,triton,0,0,1.4448,auto,0.0,810.07,302.28
gfx1250,256,7751,9216,6144,False,torch.bfloat16,torch.bfloat16,False,False,triton,0,0,0.9912,auto,0.0,885.56,354.48
gfx1250,256,7751,9856,6144,False,torch.bfloat16,torch.bfloat16,False,False,triton,0,0,1.4057,auto,0.0,667.79,262.60
gfx1250,256,7751,24576,6144,False,torch.bfloat16,torch.bfloat16,False,False,triton,0,0,2.9694,auto,0.0,788.27,262.07
gfx1250,256,7754,128,6144,False,torch.bfloat16,torch.bfloat16,False,False,triton,0,0,0.0277,auto,0.0,440.86,3572.84
gfx1250,256,7754,6144,8192,False,torch.bfloat16,torch.bfloat16,False,False,triton,0,0,0.9256,auto,0.0,843.28,348.95
gfx1250,256,7754,6144,12288,False,torch.bfloat16,torch.bfloat16,False,False,triton,0,0,1.4240,auto,0.0,822.20,306.77
gfx1250,256,7754,9216,6144,False,torch.bfloat16,torch.bfloat16,False,False,triton,0,0,0.9900,auto,0.0,886.96,354.99
gfx1250,256,7754,9856,6144,False,torch.bfloat16,torch.bfloat16,False,False,triton,0,0,1.4244,auto,0.0,659.28,259.22
gfx1250,256,7754,24576,6144,False,torch.bfloat16,torch.bfloat16,False,False,triton,0,0,2.9539,auto,0.0,792.72,263.51
gfx1250,256,7757,128,6144,False,torch.bfloat16,torch.bfloat16,False,False,triton,0,0,0.0277,auto,0.0,440.16,3567.11
gfx1250,256,7757,6144,8192,False,torch.bfloat16,torch.bfloat16,False,False,triton,0,0,0.9264,auto,0.0,842.87,348.73
gfx1250,256,7757,6144,12288,False,torch.bfloat16,torch.bfloat16,False,False,triton,0,0,1.5094,auto,0.0,776.00,289.49
gfx1250,256,7757,9216,6144,False,torch.bfloat16,torch.bfloat16,False,False,triton,0,0,0.9916,auto,0.0,885.93,354.53
gfx1250,256,7757,9856,6144,False,torch.bfloat16,torch.bfloat16,False,False,triton,0,0,1.4143,auto,0.0,664.27,261.15
gfx1250,256,7757,24576,6144,False,torch.bfloat16,torch.bfloat16,False,False,triton,0,0,2.9660,auto,0.0,789.78,262.50
gfx1250,256,7759,128,6144,False,torch.bfloat16,torch.bfloat16,False,False,triton,0,0,0.0277,auto,0.0,440.87,3572.91
gfx1250,256,7759,6144,8192,False,torch.bfloat16,torch.bfloat16,False,False,triton,0,0,0.9281,auto,0.0,841.53,348.15
gfx1250,256,7759,6144,12288,False,torch.bfloat16,torch.bfloat16,False,False,triton,0,0,1.4715,auto,0.0,796.20,297.00
gfx1250,256,7759,9216,6144,False,torch.bfloat16,torch.bfloat16,False,False,triton,0,0,0.9917,auto,0.0,886.06,354.56
gfx1250,256,7759,9856,6144,False,torch.bfloat16,torch.bfloat16,False,False,triton,0,0,1.4201,auto,0.0,661.73,260.13
gfx1250,256,7759,24576,6144,False,torch.bfloat16,torch.bfloat16,False,False,triton,0,0,2.8933,auto,0.0,809.85,269.14
gfx1250,256,7760,128,6144,False,torch.bfloat16,torch.bfloat16,False,False,triton,0,0,0.0277,auto,0.0,440.69,3571.43
gfx1250,256,7760,6144,8192,False,torch.bfloat16,torch.bfloat16,False,False,triton,0,0,0.9266,auto,0.0,843.01,348.75
gfx1250,256,7760,6144,12288,False,torch.bfloat16,torch.bfloat16,False,False,triton,0,0,1.4457,auto,0.0,810.51,302.33
gfx1250,256,7760,9216,6144,False,torch.bfloat16,torch.bfloat16,False,False,triton,0,0,0.9905,auto,0.0,887.20,355.00
gfx1250,256,7760,9856,6144,False,torch.bfloat16,torch.bfloat16,False,False,triton,0,0,1.4290,auto,0.0,657.68,258.53
gfx1250,256,7760,24576,6144,False,torch.bfloat16,torch.bfloat16,False,False,triton,0,0,2.9655,auto,0.0,790.23,262.61
gfx1250,256,7761,128,6144,False,torch.bfloat16,torch.bfloat16,False,False,triton,0,0,0.0277,auto,0.0,440.84,3572.66
gfx1250,256,7761,6144,8192,False,torch.bfloat16,torch.bfloat16,False,False,triton,0,0,0.9284,auto,0.0,841.54,348.13
gfx1250,256,7761,6144,12288,False,torch.bfloat16,torch.bfloat16,False,False,triton,0,0,1.4415,auto,0.0,812.94,303.22
gfx1250,256,7761,9216,6144,False,torch.bfloat16,torch.bfloat16,False,False,triton,0,0,0.9923,auto,0.0,885.73,354.39
gfx1250,256,7761,9856,6144,False,torch.bfloat16,torch.bfloat16,False,False,triton,0,0,1.4155,auto,0.0,664.04,261.01
gfx1250,256,7761,24576,6144,False,torch.bfloat16,torch.bfloat16,False,False,triton,0,0,2.8987,auto,0.0,808.54,268.68
gfx1250,256,7774,128,6144,False,torch.bfloat16,torch.bfloat16,False,False,triton,0,0,0.0277,auto,0.0,441.36,3576.74
gfx1250,256,7774,6144,8192,False,torch.bfloat16,torch.bfloat16,False,False,triton,0,0,0.9275,auto,0.0,843.75,348.86
gfx1250,256,7774,6144,12288,False,torch.bfloat16,torch.bfloat16,False,False,triton,0,0,1.4967,auto,0.0,784.29,292.36
gfx1250,256,7774,9216,6144,False,torch.bfloat16,torch.bfloat16,False,False,triton,0,0,0.9924,auto,0.0,887.13,354.76
gfx1250,256,7774,9856,6144,False,torch.bfloat16,torch.bfloat16,False,False,triton,0,0,1.4314,auto,0.0,657.76,258.40
gfx1250,256,7774,24576,6144,False,torch.bfloat16,torch.bfloat16,False,False,triton,0,0,2.8940,auto,0.0,811.22,269.39
gfx1250,256,7804,128,6144,False,torch.bfloat16,torch.bfloat16,False,False,triton,0,0,0.0278,auto,0.0,441.25,3575.61
gfx1250,256,7804,6144,8192,False,torch.bfloat16,torch.bfloat16,False,False,triton,0,0,0.9284,auto,0.0,846.15,349.43
gfx1250,256,7804,6144,12288,False,torch.bfloat16,torch.bfloat16,False,False,triton,0,0,1.5029,auto,0.0,784.05,291.88
gfx1250,256,7804,9216,6144,False,torch.bfloat16,torch.bfloat16,False,False,triton,0,0,0.9922,auto,0.0,890.71,355.75
gfx1250,256,7804,9856,6144,False,torch.bfloat16,torch.bfloat16,False,False,triton,0,0,1.4276,auto,0.0,662.05,259.76
gfx1250,256,7804,24576,6144,False,torch.bfloat16,torch.bfloat16,False,False,triton,0,0,2.9826,auto,0.0,790.16,262.01
gfx1250,256,7842,128,6144,False,torch.bfloat16,torch.bfloat16,False,False,triton,0,0,0.0272,auto,0.0,454.07,3679.24
gfx1250,256,7842,6144,8192,False,torch.bfloat16,torch.bfloat16,False,False,triton,0,0,0.9272,auto,0.0,851.38,351.07
gfx1250,256,7842,6144,12288,False,torch.bfloat16,torch.bfloat16,False,False,triton,0,0,1.4189,auto,0.0,834.51,310.15
gfx1250,256,7842,9216,6144,False,torch.bfloat16,torch.bfloat16,False,False,triton,0,0,0.9963,auto,0.0,891.35,355.46
gfx1250,256,7842,9856,6144,False,torch.bfloat16,torch.bfloat16,False,False,triton,0,0,1.4350,auto,0.0,661.85,259.27
gfx1250,256,7842,24576,6144,False,torch.bfloat16,torch.bfloat16,False,False,triton,0,0,2.9593,auto,0.0,800.27,264.87
gfx1250,256,7865,128,6144,False,torch.bfloat16,torch.bfloat16,False,False,triton,0,0,0.0272,auto,0.0,454.42,3681.87
gfx1250,256,7865,6144,8192,False,torch.bfloat16,torch.bfloat16,False,False,triton,0,0,0.9276,auto,0.0,853.51,351.63
gfx1250,256,7865,6144,12288,False,torch.bfloat16,torch.bfloat16,False,False,triton,0,0,1.1274,auto,0.0,1053.42,391.12
gfx1250,256,7865,9216,6144,False,torch.bfloat16,torch.bfloat16,False,False,triton,0,0,0.9982,auto,0.0,892.32,355.51
gfx1250,256,7865,9856,6144,False,torch.bfloat16,torch.bfloat16,False,False,triton,0,0,1.4269,auto,0.0,667.55,261.26
gfx1250,256,7865,24576,6144,False,torch.bfloat16,torch.bfloat16,False,False,triton,0,0,2.9770,auto,0.0,797.84,263.76
gfx1250,256,7869,128,6144,False,torch.bfloat16,torch.bfloat16,False,False,triton,0,0,0.0275,auto,0.0,449.61,3642.89
gfx1250,256,7869,6144,8192,False,torch.bfloat16,torch.bfloat16,False,False,triton,0,0,0.9289,auto,0.0,852.71,351.24
gfx1250,256,7869,6144,12288,False,torch.bfloat16,torch.bfloat16,False,False,triton,0,0,1.0395,auto,0.0,1143.08,424.34
gfx1250,256,7869,9216,6144,False,torch.bfloat16,torch.bfloat16,False,False,triton,0,0,0.9999,auto,0.0,891.21,355.01
gfx1250,256,7869,9856,6144,False,torch.bfloat16,torch.bfloat16,False,False,triton,0,0,1.4437,auto,0.0,660.12,258.31
gfx1250,256,7869,24576,6144,False,torch.bfloat16,torch.bfloat16,False,False,triton,0,0,2.9453,auto,0.0,806.84,266.69
gfx1250,256,7882,128,6144,False,torch.bfloat16,torch.bfloat16,False,False,triton,0,0,0.0275,auto,0.0,451.60,3658.92
gfx1250,256,7882,6144,8192,False,torch.bfloat16,torch.bfloat16,False,False,triton,0,0,0.9286,auto,0.0,854.46,351.78
gfx1250,256,7882,6144,12288,False,torch.bfloat16,torch.bfloat16,False,False,triton,0,0,1.4259,auto,0.0,834.66,309.67
gfx1250,256,7882,9216,6144,False,torch.bfloat16,torch.bfloat16,False,False,triton,0,0,1.0007,auto,0.0,891.95,355.12
gfx1250,256,7882,9856,6144,False,torch.bfloat16,torch.bfloat16,False,False,triton,0,0,1.4575,auto,0.0,654.95,256.15
gfx1250,256,7882,24576,6144,False,torch.bfloat16,torch.bfloat16,False,False,triton,0,0,2.9517,auto,0.0,806.41,266.37
gfx1250,256,7898,128,6144,False,torch.bfloat16,torch.bfloat16,False,False,triton,0,0,0.0274,auto,0.0,453.34,3672.92
gfx1250,256,7898,6144,8192,False,torch.bfloat16,torch.bfloat16,False,False,triton,0,0,0.9283,auto,0.0,856.42,352.37
gfx1250,256,7898,6144,12288,False,torch.bfloat16,torch.bfloat16,False,False,triton,0,0,1.4345,auto,0.0,831.31,308.21
gfx1250,256,7898,9216,6144,False,torch.bfloat16,torch.bfloat16,False,False,triton,0,0,1.0006,auto,0.0,893.89,355.66
gfx1250,256,7898,9856,6144,False,torch.bfloat16,torch.bfloat16,False,False,triton,0,0,1.4300,auto,0.0,668.90,261.43
gfx1250,256,7898,24576,6144,False,torch.bfloat16,torch.bfloat16,False,False,triton,0,0,2.9919,auto,0.0,797.19,263.13
gfx1250,256,7948,128,6144,False,torch.bfloat16,torch.bfloat16,False,False,triton,0,0,0.0267,auto,0.0,468.22,3793.12
gfx1250,256,7948,6144,8192,False,torch.bfloat16,torch.bfloat16,False,False,triton,0,0,0.9068,auto,0.0,882.25,362.30
gfx1250,256,7948,6144,12288,False,torch.bfloat16,torch.bfloat16,False,False,triton,0,0,1.0371,auto,0.0,1157.12,428.09
gfx1250,256,7948,9216,6144,False,torch.bfloat16,torch.bfloat16,False,False,triton,0,0,1.0428,auto,0.0,863.12,342.73
gfx1250,256,7948,9856,6144,False,torch.bfloat16,torch.bfloat16,False,False,triton,0,0,0.9783,auto,0.0,983.89,383.76
gfx1250,256,7948,24576,6144,False,torch.bfloat16,torch.bfloat16,False,False,triton,0,0,1.7674,auto,0.0,1358.07,447.17
gfx1250,256,7960,128,6144,False,torch.bfloat16,torch.bfloat16,False,False,triton,0,0,0.0267,auto,0.0,469.46,3803.03
gfx1250,256,7960,6144,8192,False,torch.bfloat16,torch.bfloat16,False,False,triton,0,0,0.9069,auto,0.0,883.53,362.65
gfx1250,256,7960,6144,12288,False,torch.bfloat16,torch.bfloat16,False,False,triton,0,0,1.0374,auto,0.0,1158.54,428.39
gfx1250,256,7960,9216,6144,False,torch.bfloat16,torch.bfloat16,False,False,triton,0,0,1.0423,auto,0.0,864.85,343.25
gfx1250,256,7960,9856,6144,False,torch.bfloat16,torch.bfloat16,False,False,triton,0,0,0.8739,auto,0.0,1103.12,430.05
gfx1250,256,7960,24576,6144,False,torch.bfloat16,torch.bfloat16,False,False,triton,0,0,1.7660,auto,0.0,1361.21,447.94
gfx1250,256,7988,128,6144,False,torch.bfloat16,torch.bfloat16,False,False,triton,0,0,0.0270,auto,0.0,464.73,3764.54
gfx1250,256,7988,6144,8192,False,torch.bfloat16,torch.bfloat16,False,False,triton,0,0,0.9076,auto,0.0,885.99,363.27
gfx1250,256,7988,6144,12288,False,torch.bfloat16,torch.bfloat16,False,False,triton,0,0,1.0386,auto,0.0,1161.31,428.90
gfx1250,256,7988,9216,6144,False,torch.bfloat16,torch.bfloat16,False,False,triton,0,0,1.0454,auto,0.0,865.32,343.06
gfx1250,256,7988,9856,6144,False,torch.bfloat16,torch.bfloat16,False,False,triton,0,0,0.8732,auto,0.0,1107.90,431.43
gfx1250,256,7988,24576,6144,False,torch.bfloat16,torch.bfloat16,False,False,triton,0,0,1.7687,auto,0.0,1363.86,448.22
gfx1250,256,8008,128,6144,False,torch.bfloat16,torch.bfloat16,False,False,triton,0,0,0.0270,auto,0.0,466.26,3776.75
gfx1250,256,8008,6144,8192,False,torch.bfloat16,torch.bfloat16,False,False,triton,0,0,0.9077,auto,0.0,888.08,363.85
gfx1250,256,8008,6144,12288,False,torch.bfloat16,torch.bfloat16,False,False,triton,0,0,1.0357,auto,0.0,1167.44,430.80
gfx1250,256,8008,9216,6144,False,torch.bfloat16,torch.bfloat16,False,False,triton,0,0,1.0502,auto,0.0,863.53,342.08
gfx1250,256,8008,9856,6144,False,torch.bfloat16,torch.bfloat16,False,False,triton,0,0,0.9828,auto,0.0,986.83,383.97
gfx1250,256,8008,24576,6144,False,torch.bfloat16,torch.bfloat16,False,False,triton,0,0,1.7665,auto,0.0,1368.96,449.47
gfx1250,256,8019,128,6144,False,torch.bfloat16,torch.bfloat16,False,False,triton,0,0,0.0271,auto,0.0,465.38,3769.58
gfx1250,256,8019,6144,8192,False,torch.bfloat16,torch.bfloat16,False,False,triton,0,0,0.9074,auto,0.0,889.63,364.34
gfx1250,256,8019,6144,12288,False,torch.bfloat16,torch.bfloat16,False,False,triton,0,0,1.0390,auto,0.0,1165.36,429.84
gfx1250,256,8019,9216,6144,False,torch.bfloat16,torch.bfloat16,False,False,triton,0,0,1.0450,auto,0.0,869.04,344.11
gfx1250,256,8019,9856,6144,False,torch.bfloat16,torch.bfloat16,False,False,triton,0,0,1.0804,auto,0.0,898.89,349.60
gfx1250,256,8019,24576,6144,False,torch.bfloat16,torch.bfloat16,False,False,triton,0,0,1.7648,auto,0.0,1372.22,450.30
gfx1250,256,8025,128,6144,False,torch.bfloat16,torch.bfloat16,False,False,triton,0,0,0.0272,auto,0.0,464.16,3759.60
gfx1250,256,8025,6144,8192,False,torch.bfloat16,torch.bfloat16,False,False,triton,0,0,0.9082,auto,0.0,889.49,364.19
gfx1250,256,8025,6144,12288,False,torch.bfloat16,torch.bfloat16,False,False,triton,0,0,1.0381,auto,0.0,1167.21,430.41
gfx1250,256,8025,9216,6144,False,torch.bfloat16,torch.bfloat16,False,False,triton,0,0,1.0436,auto,0.0,870.80,344.73
gfx1250,256,8025,9856,6144,False,torch.bfloat16,torch.bfloat16,False,False,triton,0,0,0.8755,auto,0.0,1110.17,431.67
gfx1250,256,8025,24576,6144,False,torch.bfloat16,torch.bfloat16,False,False,triton,0,0,1.7697,auto,0.0,1369.39,449.24
gfx1250,256,8036,128,6144,False,torch.bfloat16,torch.bfloat16,False,False,triton,0,0,0.0269,auto,0.0,470.50,3810.92
gfx1250,256,8036,6144,8192,False,torch.bfloat16,torch.bfloat16,False,False,triton,0,0,0.9075,auto,0.0,891.34,364.80
gfx1250,256,8036,6144,12288,False,torch.bfloat16,torch.bfloat16,False,False,triton,0,0,1.0398,auto,0.0,1166.95,430.11
gfx1250,256,8036,9216,6144,False,torch.bfloat16,torch.bfloat16,False,False,triton,0,0,1.0467,auto,0.0,869.45,344.05
gfx1250,256,8036,9856,6144,False,torch.bfloat16,torch.bfloat16,False,False,triton,0,0,0.8793,auto,0.0,1106.84,430.19
gfx1250,256,8036,24576,6144,False,torch.bfloat16,torch.bfloat16,False,False,triton,0,0,1.7688,auto,0.0,1372.00,449.86
gfx1250,256,8065,128,6144,False,torch.bfloat16,torch.bfloat16,False,False,triton,0,0,0.0259,auto,0.0,490.27,3970.79
gfx1250,256,8065,6144,8192,False,torch.bfloat16,torch.bfloat16,False,False,triton,0,0,0.9084,auto,0.0,893.71,365.37
gfx1250,256,8065,6144,12288,False,torch.bfloat16,torch.bfloat16,False,False,triton,0,0,1.0478,auto,0.0,1162.18,427.84
gfx1250,256,8065,9216,6144,False,torch.bfloat16,torch.bfloat16,False,False,triton,0,0,1.0129,auto,0.0,901.69,356.40
gfx1250,256,8065,9856,6144,False,torch.bfloat16,torch.bfloat16,False,False,triton,0,0,0.8495,auto,0.0,1149.85,446.39
gfx1250,256,8065,24576,6144,False,torch.bfloat16,torch.bfloat16,False,False,triton,0,0,1.7720,auto,0.0,1374.48,450.07
gfx1250,256,8089,128,6144,False,torch.bfloat16,torch.bfloat16,False,False,triton,0,0,0.0260,auto,0.0,489.34,3963.13
gfx1250,256,8089,6144,8192,False,torch.bfloat16,torch.bfloat16,False,False,triton,0,0,0.9092,auto,0.0,895.56,365.79
gfx1250,256,8089,6144,12288,False,torch.bfloat16,torch.bfloat16,False,False,triton,0,0,1.0429,auto,0.0,1171.17,430.71
gfx1250,256,8089,9216,6144,False,torch.bfloat16,torch.bfloat16,False,False,triton,0,0,1.0123,auto,0.0,904.90,357.34
gfx1250,256,8089,9856,6144,False,torch.bfloat16,torch.bfloat16,False,False,triton,0,0,0.8496,auto,0.0,1153.12,447.23
gfx1250,256,8089,24576,6144,False,torch.bfloat16,torch.bfloat16,False,False,triton,0,0,1.7728,auto,0.0,1377.91,450.68
gfx1250,256,8127,128,6144,False,torch.bfloat16,torch.bfloat16,False,False,triton,0,0,0.0259,auto,0.0,493.75,3998.53
gfx1250,256,8127,6144,8192,False,torch.bfloat16,torch.bfloat16,False,False,triton,0,0,0.9087,auto,0.0,900.33,367.22
gfx1250,256,8127,6144,12288,False,torch.bfloat16,torch.bfloat16,False,False,triton,0,0,1.0393,auto,0.0,1180.72,433.55
gfx1250,256,8127,9216,6144,False,torch.bfloat16,torch.bfloat16,False,False,triton,0,0,1.0093,auto,0.0,911.86,359.56
gfx1250,256,8127,9856,6144,False,torch.bfloat16,torch.bfloat16,False,False,triton,0,0,0.8500,auto,0.0,1157.96,448.44
gfx1250,256,8127,24576,6144,False,torch.bfloat16,torch.bfloat16,False,False,triton,0,0,1.7717,auto,0.0,1385.27,452.29
gfx1250,256,8131,128,6144,False,torch.bfloat16,torch.bfloat16,False,False,triton,0,0,0.0259,auto,0.0,493.12,3993.37
gfx1250,256,8131,6144,8192,False,torch.bfloat16,torch.bfloat16,False,False,triton,0,0,0.9097,auto,0.0,899.72,366.92
gfx1250,256,8131,6144,12288,False,torch.bfloat16,torch.bfloat16,False,False,triton,0,0,1.0388,auto,0.0,1181.86,433.89
gfx1250,256,8131,9216,6144,False,torch.bfloat16,torch.bfloat16,False,False,triton,0,0,1.0116,auto,0.0,910.27,358.88
gfx1250,256,8131,9856,6144,False,torch.bfloat16,torch.bfloat16,False,False,triton,0,0,0.8488,auto,0.0,1160.16,449.22
gfx1250,256,8131,24576,6144,False,torch.bfloat16,torch.bfloat16,False,False,triton,0,0,1.7726,auto,0.0,1385.24,452.19
gfx1250,256,8142,128,6144,False,torch.bfloat16,torch.bfloat16,False,False,triton,0,0,0.0259,auto,0.0,494.70,4006.11
gfx1250,256,8142,6144,8192,False,torch.bfloat16,torch.bfloat16,False,False,triton,0,0,0.9094,auto,0.0,901.26,367.40
gfx1250,256,8142,6144,12288,False,torch.bfloat16,torch.bfloat16,False,False,triton,0,0,1.0414,auto,0.0,1180.51,433.20
gfx1250,256,8142,9216,6144,False,torch.bfloat16,torch.bfloat16,False,False,triton,0,0,1.0145,auto,0.0,908.87,358.17
gfx1250,256,8142,9856,6144,False,torch.bfloat16,torch.bfloat16,False,False,triton,0,0,0.8511,auto,0.0,1158.64,448.44
gfx1250,256,8142,24576,6144,False,torch.bfloat16,torch.bfloat16,False,False,triton,0,0,1.7735,auto,0.0,1386.39,452.34
gfx1250,256,8151,128,6144,False,torch.bfloat16,torch.bfloat16,False,False,triton,0,0,0.0259,auto,0.0,494.63,4005.52
gfx1250,256,8151,6144,8192,False,torch.bfloat16,torch.bfloat16,False,False,triton,0,0,0.9101,auto,0.0,901.53,367.39
gfx1250,256,8151,6144,12288,False,torch.bfloat16,torch.bfloat16,False,False,triton,0,0,1.0418,auto,0.0,1181.37,433.36
gfx1250,256,8151,9216,6144,False,torch.bfloat16,torch.bfloat16,False,False,triton,0,0,1.0159,auto,0.0,908.58,357.94
gfx1250,256,8151,9856,6144,False,torch.bfloat16,torch.bfloat16,False,False,triton,0,0,0.8505,auto,0.0,1160.69,449.08
gfx1250,256,8151,24576,6144,False,torch.bfloat16,torch.bfloat16,False,False,triton,0,0,1.7733,auto,0.0,1388.08,452.70
gfx1250,256,8158,128,6144,False,torch.bfloat16,torch.bfloat16,False,False,triton,0,0,0.0260,auto,0.0,493.74,3998.26
gfx1250,256,8158,6144,8192,False,torch.bfloat16,torch.bfloat16,False,False,triton,0,0,0.9096,auto,0.0,902.82,367.82
gfx1250,256,8158,6144,12288,False,torch.bfloat16,torch.bfloat16,False,False,triton,0,0,1.0398,auto,0.0,1184.71,434.46
gfx1250,256,8158,9216,6144,False,torch.bfloat16,torch.bfloat16,False,False,triton,0,0,1.0123,auto,0.0,912.67,359.45
gfx1250,256,8158,9856,6144,False,torch.bfloat16,torch.bfloat16,False,False,triton,0,0,0.8495,auto,0.0,1163.10,449.89
gfx1250,256,8158,24576,6144,False,torch.bfloat16,torch.bfloat16,False,False,triton,0,0,1.7752,auto,0.0,1387.83,452.47
gfx1250,256,8177,128,6144,False,torch.bfloat16,torch.bfloat16,False,False,triton,0,0,0.0258,auto,0.0,499.33,4043.37
gfx1250,256,8177,6144,8192,False,torch.bfloat16,torch.bfloat16,False,False,triton,0,0,0.9156,auto,0.0,899.02,366.01
gfx1250,256,8177,6144,12288,False,torch.bfloat16,torch.bfloat16,False,False,triton,0,0,1.4984,auto,0.0,823.98,301.93
gfx1250,256,8177,9216,6144,False,torch.bfloat16,torch.bfloat16,False,False,triton,0,0,1.0178,auto,0.0,909.86,358.09
gfx1250,256,8177,9856,6144,False,torch.bfloat16,torch.bfloat16,False,False,triton,0,0,0.8453,auto,0.0,1171.50,452.80
gfx1250,256,8177,24576,6144,False,torch.bfloat16,torch.bfloat16,False,False,triton,0,0,2.6334,auto,0.0,937.70,305.45
gfx1250,256,8183,128,6144,False,torch.bfloat16,torch.bfloat16,False,False,triton,0,0,0.0259,auto,0.0,496.52,4020.54
gfx1250,256,8183,6144,8192,False,torch.bfloat16,torch.bfloat16,False,False,triton,0,0,0.9103,auto,0.0,904.89,368.32
gfx1250,256,8183,6144,12288,False,torch.bfloat16,torch.bfloat16,False,False,triton,0,0,1.0411,auto,0.0,1186.82,434.79
gfx1250,256,8183,9216,6144,False,torch.bfloat16,torch.bfloat16,False,False,triton,0,0,1.0150,auto,0.0,912.98,359.23
gfx1250,256,8183,9856,6144,False,torch.bfloat16,torch.bfloat16,False,False,triton,0,0,0.8507,auto,0.0,1164.92,450.16
gfx1250,256,8183,24576,6144,False,torch.bfloat16,torch.bfloat16,False,False,triton,0,0,1.7750,auto,0.0,1392.21,453.38
gfx1250,256,13362,128,6144,False,torch.bfloat16,torch.bfloat16,False,False,triton,0,0,0.0646,auto,0.0,325.26,2618.37
gfx1250,256,13362,6144,8192,False,torch.bfloat16,torch.bfloat16,False,False,triton,0,0,1.6067,auto,0.0,837.17,301.10
gfx1250,256,13362,6144,12288,False,torch.bfloat16,torch.bfloat16,False,False,triton,0,0,2.2900,auto,0.0,881.05,281.04
gfx1250,256,13362,9216,6144,False,torch.bfloat16,torch.bfloat16,False,False,triton,0,0,1.8557,auto,0.0,815.43,282.23
gfx1250,256,13362,9856,6144,False,torch.bfloat16,torch.bfloat16,False,False,triton,0,0,1.8781,auto,0.0,861.67,292.16
gfx1250,256,13362,24576,6144,False,torch.bfloat16,torch.bfloat16,False,False,triton,0,0,4.6378,auto,0.0,870.07,242.13
gfx1250,256,13795,128,6144,False,torch.bfloat16,torch.bfloat16,False,False,triton,0,0,0.0643,auto,0.0,337.50,2716.13
gfx1250,256,13795,6144,8192,False,torch.bfloat16,torch.bfloat16,False,False,triton,0,0,1.7237,auto,0.0,805.63,287.87
gfx1250,256,13795,6144,12288,False,torch.bfloat16,torch.bfloat16,False,False,triton,0,0,2.4508,auto,0.0,849.91,269.11
gfx1250,256,13795,9216,6144,False,torch.bfloat16,torch.bfloat16,False,False,triton,0,0,1.9090,auto,0.0,818.34,281.31
gfx1250,256,13795,9856,6144,False,torch.bfloat16,torch.bfloat16,False,False,triton,0,0,1.9662,auto,0.0,849.71,286.11
gfx1250,256,13795,24576,6144,False,torch.bfloat16,torch.bfloat16,False,False,triton,0,0,4.8126,auto,0.0,865.64,238.86
gfx1250,256,13955,128,6144,False,torch.bfloat16,torch.bfloat16,False,False,triton,0,0,0.0651,auto,0.0,336.97,2711.58
gfx1250,256,13955,6144,8192,False,torch.bfloat16,torch.bfloat16,False,False,triton,0,0,1.7252,auto,0.0,814.23,290.27
gfx1250,256,13955,6144,12288,False,torch.bfloat16,torch.bfloat16,False,False,triton,0,0,2.4544,auto,0.0,858.51,271.12
gfx1250,256,13955,9216,6144,False,torch.bfloat16,torch.bfloat16,False,False,triton,0,0,1.9166,auto,0.0,824.57,282.77
gfx1250,256,13955,9856,6144,False,torch.bfloat16,torch.bfloat16,False,False,triton,0,0,1.9852,auto,0.0,851.33,285.95
gfx1250,256,13955,24576,6144,False,torch.bfloat16,torch.bfloat16,False,False,triton,0,0,4.8933,auto,0.0,861.23,236.93
gfx1250,256,14187,128,6144,False,torch.bfloat16,torch.bfloat16,False,False,triton,0,0,0.0653,auto,0.0,341.92,2751.02
gfx1250,256,14187,6144,8192,False,torch.bfloat16,torch.bfloat16,False,False,triton,0,0,1.6711,auto,0.0,854.57,303.64
gfx1250,256,14187,6144,12288,False,torch.bfloat16,torch.bfloat16,False,False,triton,0,0,2.4532,auto,0.0,873.22,274.74
gfx1250,256,14187,9216,6144,False,torch.bfloat16,torch.bfloat16,False,False,triton,0,0,1.8336,auto,0.0,876.22,299.45
gfx1250,256,14187,9856,6144,False,torch.bfloat16,torch.bfloat16,False,False,triton,0,0,2.0242,auto,0.0,848.83,284.11
gfx1250,256,14187,24576,6144,False,torch.bfloat16,torch.bfloat16,False,False,triton,0,0,4.9035,auto,0.0,873.73,239.35
gfx1250,256,16318,128,6144,False,torch.bfloat16,torch.bfloat16,False,False,triton,0,0,0.0663,auto,0.0,387.11,3111.05
gfx1250,256,16318,6144,8192,False,torch.bfloat16,torch.bfloat16,False,False,triton,0,0,1.8838,auto,0.0,871.97,301.80
gfx1250,256,16318,6144,12288,False,torch.bfloat16,torch.bfloat16,False,False,triton,0,0,2.6919,auto,0.0,915.31,279.56
gfx1250,256,16318,9216,6144,False,torch.bfloat16,torch.bfloat16,False,False,triton,0,0,2.1075,auto,0.0,876.85,291.59
gfx1250,256,16318,9856,6144,False,torch.bfloat16,torch.bfloat16,False,False,triton,0,0,2.2221,auto,0.0,889.38,289.49
gfx1250,256,16318,24576,6144,False,torch.bfloat16,torch.bfloat16,False,False,triton,0,0,5.4179,auto,0.0,909.55,240.79
gfx1250,256,31744,128,6144,False,torch.bfloat16,torch.bfloat16,False,False,triton,0,0,0,auto,0.0,0.0,0.0
gfx1250,256,31744,6144,8192,False,torch.bfloat16,torch.bfloat16,False,False,triton,0,0,0,auto,0.0,0.0,0.0
gfx1250,256,31744,6144,12288,False,torch.bfloat16,torch.bfloat16,False,False,triton,0,0,0,auto,0.0,0.0,0.0
gfx1250,256,31744,9216,6144,False,torch.bfloat16,torch.bfloat16,False,False,triton,0,0,0,auto,0.0,0.0,0.0
gfx1250,256,31744,9856,6144,False,torch.bfloat16,torch.bfloat16,False,False,triton,0,0,0,auto,0.0,0.0,0.0
gfx1250,256,31744,24576,6144,False,torch.bfloat16,torch.bfloat16,False,False,triton,0,0,0,auto,0.0,0.0,0.0
gfx1250,256,31744,200064,6144,False,torch.bfloat16,torch.bfloat16,False,False,triton,0,0,0,auto,0.0,0.0,0.0
gfx1250,256,32768,128,6144,False,torch.bfloat16,torch.bfloat16,False,False,triton,0,0,0.1285,auto,0.0,401.13,3211.36
gfx1250,256,32768,6144,8192,False,torch.bfloat16,torch.bfloat16,False,False,triton,0,0,3.9256,auto,0.0,840.27,264.98
gfx1250,256,32768,6144,12288,False,torch.bfloat16,torch.bfloat16,False,False,triton,0,0,5.6059,auto,0.0,882.60,242.41
gfx1250,256,32768,9216,6144,False,torch.bfloat16,torch.bfloat16,False,False,triton,0,0,4.4487,auto,0.0,834.14,251.73
gfx1250,256,32768,9856,6144,False,torch.bfloat16,torch.bfloat16,False,False,triton,0,0,4.7015,auto,0.0,844.10,248.79
gfx1250,256,32768,24576,6144,False,torch.bfloat16,torch.bfloat16,False,False,triton,0,0,11.4493,auto,0.0,864.30,202.22
