aiter/configs/model_configs/minimax_m3_eagle_bf16_tuned_gemm.csv
gfx,cu_num,M,N,K,bias,dtype,outdtype,scaleAB,bpreshuffle,libtype,solidx,splitK,us,kernelName,err_ratio,tflops,bw
gfx950,256,1,128,6144,False,torch.bfloat16,torch.bfloat16,False,False,skinny,2,0,4.1699,sol2,0.0,0.38,380.2
gfx950,256,2,128,6144,False,torch.bfloat16,torch.bfloat16,False,False,skinny,2,0,4.4999,sol2,0.0,0.7,355.11
gfx950,256,4,128,6144,False,torch.bfloat16,torch.bfloat16,False,False,flydsl,166,8,5.0874,flydsl_hgemm_abf16_wbf16_bf16_t16x64x128x4_ks8_w1x1x2_bias0_ktail0_gm0_pft_gfx950,0.0195,1.24,319.03
gfx950,256,8,128,6144,False,torch.bfloat16,torch.bfloat16,False,False,flydsl,196,8,5.0839,flydsl_hgemm_abf16_wbf16_bf16_t16x64x128x6_ks8_w1x1x2_bias0_ktail0_gm0_pft_gfx950,0.0244,2.48,329.12
gfx950,256,16,128,6144,False,torch.bfloat16,torch.bfloat16,False,False,flydsl,166,8,5.1966,flydsl_hgemm_abf16_wbf16_bf16_t16x64x128x4_ks8_w1x1x2_bias0_ktail0_gm0_pft_gfx950,0.0293,4.84,341.29
gfx950,256,32,128,6144,False,torch.bfloat16,torch.bfloat16,False,False,flydsl,196,8,5.1958,flydsl_hgemm_abf16_wbf16_bf16_t16x64x128x6_ks8_w1x1x2_bias0_ktail0_gm0_pft_gfx950,0.0271,9.69,379.97
gfx950,256,64,128,6144,False,torch.bfloat16,torch.bfloat16,False,False,flydsl,884,8,5.6492,flydsl_hgemm_abf16_wbf16_bf16_t32x64x128x4_ks8_w1x4x1_bias0_ktail0_gm0_pft_gfx950,0.0204,17.82,420.53
gfx950,256,128,128,6144,False,torch.bfloat16,torch.bfloat16,False,False,flydsl,1508,8,6.4732,flydsl_hgemm_abf16_wbf16_bf16_t32x64x128x5_ks8_w1x4x1_bias0_ktail0_gm0_pft_gfx950,0.0209,31.1,491.02
gfx950,256,196,128,6144,False,torch.bfloat16,torch.bfloat16,False,False,flydsl,167,8,7.0227,flydsl_hgemm_abf16_wbf16_bf16_t16x64x128x4_ks8_w1x2x1_bias0_ktail0_gm0_pft_gfx950,0.0218,43.9,574.07
gfx950,256,256,128,6144,False,torch.bfloat16,torch.bfloat16,False,False,flydsl,776,6,7.3844,flydsl_hgemm_abf16_wbf16_bf16_t16x64x128x6_ks6_w1x1x2_bias0_ktail0_gm0_pft_gfx950,0.0267,54.53,647.87
gfx950,256,320,128,6144,False,torch.bfloat16,torch.bfloat16,False,False,flydsl,362,6,8.0862,flydsl_hgemm_abf16_wbf16_bf16_t16x64x128x5_ks6_w1x1x2_bias0_ktail0_gm0_pft_gfx950,0.0253,62.24,690.92
gfx950,256,512,128,6144,False,torch.bfloat16,torch.bfloat16,False,False,flydsl,4026,6,9.2363,flydsl_hgemm_abf16_wbf16_bf16_t32x64x64x5_ks6_w2x2x1_bias0_ktail0_gm0_pft_gfx950,0.017,87.19,865.65
gfx950,256,1024,128,6144,False,torch.bfloat16,torch.bfloat16,False,False,flydsl,6545,6,11.1767,flydsl_hgemm_abf16_wbf16_bf16_t64x64x256x2_ks6_w2x2x1_bias0_ktail0_gm0_pht_gfx950,0.0173,144.1,1290.0
gfx950,256,2048,128,6144,False,torch.bfloat16,torch.bfloat16,False,False,flydsl,6417,4,15.1346,flydsl_hgemm_abf16_wbf16_bf16_t64x64x256x2_ks4_w2x2x1_bias0_ktail0_gm0_pht_gfx950,0.013,212.84,1801.37
gfx950,256,4096,128,6144,False,torch.bfloat16,torch.bfloat16,False,False,flydsl,5625,2,22.198,flydsl_hgemm_abf16_wbf16_bf16_t64x64x256x2_ks2_w2x2x1_bias0_ktail0_gm0_pht_gfx950,0.0055,290.23,2385.49
gfx950,256,8192,128,6144,False,torch.bfloat16,torch.bfloat16,False,False,flydsl,2683,2,33.0337,flydsl_hgemm_abf16_wbf16_bf16_t64x128x128x2_ks2_w2x4x1_bias0_ktail0_gm0_pht_gfx950,0.0057,390.05,3158.39
gfx950,256,16384,128,6144,False,torch.bfloat16,torch.bfloat16,False,False,flydsl,25,2,51.6762,flydsl_hgemm_abf16_wbf16_bf16_t128x128x128x2_ks2_w2x4x1_bias0_ktail0_gm0_pht_gfx950,0.0058,498.68,4007.53
gfx950,256,32768,128,6144,False,torch.bfloat16,torch.bfloat16,False,False,torch,0,0,85.1047,native,0.0,605.6,4848.32
gfx950,256,1,2304,6144,False,torch.bfloat16,torch.bfloat16,False,False,flydsl,152,6,8.0475,flydsl_hgemm_abf16_wbf16_bf16_t16x64x128x3_ks6_w1x2x1_bias0_ktail0_gm0_pft_gfx950,0.0143,3.52,3520.16
gfx950,256,2,2304,6144,False,torch.bfloat16,torch.bfloat16,False,False,flydsl,362,6,7.9748,flydsl_hgemm_abf16_wbf16_bf16_t16x64x64x6_ks6_w1x2x1_bias0_ktail0_gm0_pft_gfx950,0.0141,7.1,3554.36
gfx950,256,4,2304,6144,False,torch.bfloat16,torch.bfloat16,False,False,flydsl,411,6,8.1767,flydsl_hgemm_abf16_wbf16_bf16_t16x64x64x9_ks6_w1x2x1_bias0_ktail0_gm0_pft_gfx950,0.0163,13.85,3470.73
gfx950,256,8,2304,6144,False,torch.bfloat16,torch.bfloat16,False,False,flydsl,188,6,8.3221,flydsl_hgemm_abf16_wbf16_bf16_t16x64x128x5_ks6_w1x2x1_bias0_ktail0_gm0_pft_gfx950,0.0182,27.22,3418.21
gfx950,256,16,2304,6144,False,torch.bfloat16,torch.bfloat16,False,False,flydsl,411,6,8.8897,flydsl_hgemm_abf16_wbf16_bf16_t16x64x64x9_ks6_w1x2x1_bias0_ktail0_gm0_pft_gfx950,0.0187,50.96,3215.17
gfx950,256,32,2304,6144,False,torch.bfloat16,torch.bfloat16,False,False,flydsl,1341,6,10.35,flydsl_hgemm_abf16_wbf16_bf16_t32x64x64x6_ks6_w2x2x1_bias0_ktail0_gm0_pft_gfx950,0.017,87.53,2787.65
gfx950,256,64,2304,6144,False,torch.bfloat16,torch.bfloat16,False,False,flydsl,2150,4,13.9461,flydsl_hgemm_abf16_wbf16_bf16_t64x64x128x3_ks4_w2x2x1_bias0_ktail0_gm0_pft_gfx950,0.0128,129.92,2107.61
gfx950,256,128,2304,6144,False,torch.bfloat16,torch.bfloat16,False,False,asm,5,3,17.4915,_ZN5aiter39bf16gemm_fp32bf16_tn_64x64_splitk_cleanE,0.0101,207.18,1742.23
gfx950,256,196,2304,6144,False,torch.bfloat16,torch.bfloat16,False,False,asm,7,2,23.7165,_ZN5aiter39bf16gemm_fp32bf16_tn_80x64_splitk_cleanE,0.0058,233.97,1333.38
gfx950,256,256,2304,6144,False,torch.bfloat16,torch.bfloat16,False,False,torch,0,0,24.4861,native,0.0,295.99,1332.88
gfx950,256,320,2304,6144,False,torch.bfloat16,torch.bfloat16,False,False,flydsl,3073,1,27.5557,flydsl_hgemm_abf16_wbf16_bf16_t64x64x128x5_ks1_w4x1x2_bias0_ktail0_gm4_pft_gfx950,0.0055,328.78,1223.64
gfx950,256,512,2304,6144,False,torch.bfloat16,torch.bfloat16,False,False,flydsl,3929,1,34.5977,flydsl_hgemm_abf16_wbf16_bf16_t64x96x128x4_ks1_w2x2x1_bias0_ktail0_gm4_pft_gfx950,0.0,418.97,1068.35
gfx950,256,1024,2304,6144,False,torch.bfloat16,torch.bfloat16,False,False,torch,0,0,49.499,native,0.0,585.69,921.49
gfx950,256,2048,2304,6144,False,torch.bfloat16,torch.bfloat16,False,False,torch,0,0,73.5403,native,0.0,788.44,855.51
gfx950,256,4096,2304,6144,False,torch.bfloat16,torch.bfloat16,False,False,torch,0,0,110.3504,native,0.0,1050.87,883.71
gfx950,256,8192,2304,6144,False,torch.bfloat16,torch.bfloat16,False,False,torch,0,0,213.0175,native,0.0,1088.78,782.68
gfx950,256,16384,2304,6144,False,torch.bfloat16,torch.bfloat16,False,False,torch,0,0,358.4204,native,0.0,1294.17,851.33
gfx950,256,32768,2304,6144,False,torch.bfloat16,torch.bfloat16,False,False,flydsl,393,1,666.3208,flydsl_hgemm_abf16_wbf16_bf16_t256x256x64x2_ks1_w2x4x1_bias0_ktail0_gm4_pht_gfx950,0.0,1392.29,873.39
gfx950,256,1,2560,6144,False,torch.bfloat16,torch.bfloat16,False,False,flydsl,362,6,8.5463,flydsl_hgemm_abf16_wbf16_bf16_t16x64x64x6_ks6_w1x2x1_bias0_ktail0_gm0_pft_gfx950,0.0184,3.68,3682.84
gfx950,256,2,2560,6144,False,torch.bfloat16,torch.bfloat16,False,False,flydsl,380,6,8.5217,flydsl_hgemm_abf16_wbf16_bf16_t16x64x64x7_ks6_w1x2x1_bias0_ktail0_gm0_pft_gfx950,0.0137,7.38,3695.52
gfx950,256,4,2560,6144,False,torch.bfloat16,torch.bfloat16,False,False,flydsl,398,6,8.6247,flydsl_hgemm_abf16_wbf16_bf16_t16x64x64x8_ks6_w1x2x1_bias0_ktail0_gm0_pft_gfx950,0.0162,14.59,3655.42
gfx950,256,8,2560,6144,False,torch.bfloat16,torch.bfloat16,False,False,flydsl,380,6,8.8734,flydsl_hgemm_abf16_wbf16_bf16_t16x64x64x7_ks6_w1x2x1_bias0_ktail0_gm0_pft_gfx950,0.0172,28.36,3560.82
gfx950,256,16,2560,6144,False,torch.bfloat16,torch.bfloat16,False,False,flydsl,411,6,9.4426,flydsl_hgemm_abf16_wbf16_bf16_t16x64x64x9_ks6_w1x2x1_bias0_ktail0_gm0_pft_gfx950,0.0182,53.3,3360.92
gfx950,256,32,2560,6144,False,torch.bfloat16,torch.bfloat16,False,False,flydsl,1386,6,11.0334,flydsl_hgemm_abf16_wbf16_bf16_t32x64x64x7_ks6_w1x4x1_bias0_ktail0_gm0_pft_gfx950,0.0177,91.24,2901.58
gfx950,256,64,2560,6144,False,torch.bfloat16,torch.bfloat16,False,False,flydsl,902,3,13.597,flydsl_hgemm_abf16_wbf16_bf16_t32x64x128x4_ks3_w1x4x1_bias0_ktail0_gm0_pft_gfx950,0.0103,148.07,2395.48
gfx950,256,128,2560,6144,False,torch.bfloat16,torch.bfloat16,False,False,flydsl,2839,3,18.1704,flydsl_hgemm_abf16_wbf16_bf16_t64x64x128x3_ks3_w2x2x1_bias0_ktail0_gm0_pft_gfx950,0.0101,221.6,1853.87
gfx950,256,196,2560,6144,False,torch.bfloat16,torch.bfloat16,False,False,asm,7,2,23.8883,_ZN5aiter39bf16gemm_fp32bf16_tn_80x64_splitk_cleanE,0.0058,258.1,1459.68
gfx950,256,256,2560,6144,False,torch.bfloat16,torch.bfloat16,False,False,asm,8,2,25.1542,_ZN5aiter39bf16gemm_fp32bf16_tn_96x64_splitk_cleanE,0.0057,320.15,1427.74
gfx950,256,320,2560,6144,False,torch.bfloat16,torch.bfloat16,False,False,flydsl,2689,1,27.7398,flydsl_hgemm_abf16_wbf16_bf16_t64x64x128x5_ks1_w4x1x2_bias0_ktail0_gm4_pft_gfx950,0.0055,362.88,1334.83
gfx950,256,512,2560,6144,False,torch.bfloat16,torch.bfloat16,False,False,flydsl,45,3,34.5343,flydsl_hgemm_abf16_wbf16_bf16_t128x128x128x2_ks3_w2x4x1_bias0_ktail0_gm4_pht_gfx950,0.01,466.38,1168.99
gfx950,256,1024,2560,6144,False,torch.bfloat16,torch.bfloat16,False,False,torch,0,0,49.63,native,0.0,649.05,993.01
gfx950,256,2048,2560,6144,False,torch.bfloat16,torch.bfloat16,False,False,torch,0,0,76.5887,native,0.0,841.18,876.22
gfx950,256,4096,2560,6144,False,torch.bfloat16,torch.bfloat16,False,False,torch,0,0,112.5464,native,0.0,1144.85,913.05
gfx950,256,8192,2560,6144,False,torch.bfloat16,torch.bfloat16,False,False,torch,0,0,216.9554,native,0.0,1187.79,802.3
gfx950,256,16384,2560,6144,False,torch.bfloat16,torch.bfloat16,False,False,flydsl,393,1,380.2341,flydsl_hgemm_abf16_wbf16_bf16_t256x256x64x2_ks1_w2x4x1_bias0_ktail0_gm4_pht_gfx950,0.0,1355.47,832.83
gfx950,256,32768,2560,6144,False,torch.bfloat16,torch.bfloat16,False,False,torch,0,0,673.1052,native,0.0,1531.4,894.19
gfx950,256,1,6144,2048,False,torch.bfloat16,torch.bfloat16,False,False,flydsl,121,2,7.2567,flydsl_hgemm_abf16_wbf16_bf16_t16x64x128x5_ks2_w1x2x1_bias0_ktail0_gm0_pft_gfx950,0.0028,3.47,3470.2
gfx950,256,1,6144,3072,False,torch.bfloat16,torch.bfloat16,False,False,flydsl,405,2,9.3491,flydsl_hgemm_abf16_wbf16_bf16_t16x64x64x9_ks2_w1x2x1_bias0_ktail0_gm0_pft_gfx950,0.0042,4.04,4039.66
gfx950,256,1,6144,4608,False,torch.bfloat16,torch.bfloat16,False,False,flydsl,208,2,12.2661,flydsl_hgemm_abf16_wbf16_bf16_t16x64x128x5_ks2_w1x2x1_bias0_ktail0_gm0_pft_gfx950,0.005,4.62,4617.98
gfx950,256,1,6144,6144,False,torch.bfloat16,torch.bfloat16,False,False,flydsl,194,2,14.8826,flydsl_hgemm_abf16_wbf16_bf16_t16x64x128x6_ks2_w1x1x2_bias0_ktail0_gm0_pft_gfx950,0.015,5.07,5074.52
gfx950,256,1,6144,12288,False,torch.bfloat16,torch.bfloat16,False,False,flydsl,46,4,27.8963,flydsl_hgemm_abf16_wbf16_bf16_t16x128x128x4_ks4_w1x2x2_bias0_ktail0_gm0_pft_gfx950,0.0236,5.41,5414.04
gfx950,256,1,6144,18432,False,torch.bfloat16,torch.bfloat16,False,False,flydsl,187,2,38.7406,flydsl_hgemm_abf16_wbf16_bf16_t16x64x128x4_ks2_w1x2x1_bias0_ktail0_gm0_pft_gfx950,0.0076,5.85,5847.65
gfx950,256,2,6144,2048,False,torch.bfloat16,torch.bfloat16,False,False,triton,0,0,7.2552,auto,0.0,6.94,3473.18
gfx950,256,2,6144,3072,False,torch.bfloat16,torch.bfloat16,False,False,flydsl,161,2,9.3926,flydsl_hgemm_abf16_wbf16_bf16_t16x64x128x4_ks2_w1x2x1_bias0_ktail0_gm0_pft_gfx950,0.0042,8.04,4022.91
gfx950,256,2,6144,4608,False,torch.bfloat16,torch.bfloat16,False,False,flydsl,208,2,12.3018,flydsl_hgemm_abf16_wbf16_bf16_t16x64x128x5_ks2_w1x2x1_bias0_ktail0_gm0_pft_gfx950,0.005,9.21,4606.33
gfx950,256,2,6144,6144,False,torch.bfloat16,torch.bfloat16,False,False,flydsl,161,2,15.0418,flydsl_hgemm_abf16_wbf16_bf16_t16x64x128x4_ks2_w1x2x1_bias0_ktail0_gm0_pft_gfx950,0.0051,10.04,5022.45
gfx950,256,2,6144,12288,False,torch.bfloat16,torch.bfloat16,False,False,flydsl,29,4,27.921,flydsl_hgemm_abf16_wbf16_bf16_t16x128x128x3_ks4_w1x4x1_bias0_ktail0_gm0_pft_gfx950,0.0151,10.82,5410.58
gfx950,256,2,6144,18432,False,torch.bfloat16,torch.bfloat16,False,False,flydsl,207,2,39.003,flydsl_hgemm_abf16_wbf16_bf16_t16x64x128x5_ks2_w1x1x2_bias0_ktail0_gm0_pft_gfx950,0.0155,11.61,5809.57
gfx950,256,4,6144,2048,False,torch.bfloat16,torch.bfloat16,False,False,flydsl,108,2,7.3196,flydsl_hgemm_abf16_wbf16_bf16_t16x64x128x4_ks2_w1x1x2_bias0_ktail0_gm0_pft_gfx950,0.0085,13.75,3447.1
gfx950,256,4,6144,3072,False,torch.bfloat16,torch.bfloat16,False,False,flydsl,405,2,9.488,flydsl_hgemm_abf16_wbf16_bf16_t16x64x64x9_ks2_w1x2x1_bias0_ktail0_gm0_pft_gfx950,0.0042,15.91,3986.35
gfx950,256,4,6144,4608,False,torch.bfloat16,torch.bfloat16,False,False,flydsl,453,2,12.3278,flydsl_hgemm_abf16_wbf16_bf16_t16x64x64x8_ks2_w1x2x1_bias0_ktail0_gm0_pft_gfx950,0.0052,18.37,4600.1
gfx950,256,4,6144,6144,False,torch.bfloat16,torch.bfloat16,False,False,flydsl,370,2,14.9456,flydsl_hgemm_abf16_wbf16_bf16_t16x64x64x7_ks2_w1x1x2_bias0_ktail0_gm0_pft_gfx950,0.0139,20.21,5058.06
gfx950,256,4,6144,12288,False,torch.bfloat16,torch.bfloat16,False,False,flydsl,29,4,28.0439,flydsl_hgemm_abf16_wbf16_bf16_t16x128x128x3_ks4_w1x4x1_bias0_ktail0_gm0_pft_gfx950,0.0159,21.54,5389.49
gfx950,256,4,6144,18432,False,torch.bfloat16,torch.bfloat16,False,False,flydsl,226,2,39.0719,flydsl_hgemm_abf16_wbf16_bf16_t16x64x128x6_ks2_w1x1x2_bias0_ktail0_gm0_pft_gfx950,0.0165,23.19,5801.84
gfx950,256,8,6144,2048,False,torch.bfloat16,torch.bfloat16,False,False,flydsl,121,2,7.4259,flydsl_hgemm_abf16_wbf16_bf16_t16x64x128x5_ks2_w1x2x1_bias0_ktail0_gm0_pft_gfx950,0.0036,27.11,3406.58
gfx950,256,8,6144,3072,False,torch.bfloat16,torch.bfloat16,False,False,triton,0,0,9.3482,auto,0.0,32.3,4053.85
gfx950,256,8,6144,4608,False,torch.bfloat16,torch.bfloat16,False,False,flydsl,207,2,12.4734,flydsl_hgemm_abf16_wbf16_bf16_t16x64x128x5_ks2_w1x1x2_bias0_ktail0_gm0_pft_gfx950,0.0126,36.32,4553.3
gfx950,256,8,6144,6144,False,torch.bfloat16,torch.bfloat16,False,False,flydsl,334,2,15.434,flydsl_hgemm_abf16_wbf16_bf16_t16x64x64x5_ks2_w1x1x2_bias0_ktail0_gm0_pft_gfx950,0.0138,39.13,4904.37
gfx950,256,8,6144,12288,False,torch.bfloat16,torch.bfloat16,False,False,triton,0,0,28.1993,auto,0.0,42.84,5365.02
gfx950,256,8,6144,18432,False,torch.bfloat16,torch.bfloat16,False,False,flydsl,187,2,39.3893,flydsl_hgemm_abf16_wbf16_bf16_t16x64x128x4_ks2_w1x2x1_bias0_ktail0_gm0_pft_gfx950,0.0076,46.0,5760.08
gfx950,256,16,6144,2048,False,torch.bfloat16,torch.bfloat16,False,False,triton,0,0,7.5469,auto,0.0,53.35,3369.33
gfx950,256,16,6144,3072,False,torch.bfloat16,torch.bfloat16,False,False,triton,0,0,10.0159,auto,0.0,60.3,3798.33
gfx950,256,16,6144,4608,False,torch.bfloat16,torch.bfloat16,False,False,flydsl,226,2,13.0277,flydsl_hgemm_abf16_wbf16_bf16_t16x64x128x6_ks2_w1x1x2_bias0_ktail0_gm0_pft_gfx950,0.0125,69.54,4372.77
gfx950,256,16,6144,6144,False,torch.bfloat16,torch.bfloat16,False,False,flydsl,389,2,15.7279,flydsl_hgemm_abf16_wbf16_bf16_t16x64x64x8_ks2_w1x2x1_bias0_ktail0_gm0_pft_gfx950,0.0054,76.8,4825.23
gfx950,256,16,6144,12288,False,torch.bfloat16,torch.bfloat16,False,False,flydsl,47,4,29.3697,flydsl_hgemm_abf16_wbf16_bf16_t16x128x128x4_ks4_w1x4x1_bias0_ktail0_gm0_pft_gfx950,0.015,82.26,5161.26
gfx950,256,16,6144,18432,False,torch.bfloat16,torch.bfloat16,False,False,flydsl,310,2,40.114,flydsl_hgemm_abf16_wbf16_bf16_t16x64x256x4_ks2_w1x1x2_bias0_ktail0_gm0_pft_gfx950,0.0167,90.34,5665.82
gfx950,256,32,6144,2048,False,torch.bfloat16,torch.bfloat16,False,False,triton,0,0,7.7425,auto,0.0,104.01,3318.06
gfx950,256,32,6144,3072,False,torch.bfloat16,torch.bfloat16,False,False,triton,0,0,10.6712,auto,0.0,113.2,3592.71
gfx950,256,32,6144,4608,False,torch.bfloat16,torch.bfloat16,False,False,triton,0,0,14.0262,auto,0.0,129.18,4086.01
gfx950,256,32,6144,6144,False,torch.bfloat16,torch.bfloat16,False,False,flydsl,847,2,17.5734,flydsl_hgemm_abf16_wbf16_bf16_t32x64x128x4_ks2_w2x1x2_bias0_ktail0_gm0_pft_gfx950,0.0134,137.48,4340.87
gfx950,256,32,6144,12288,False,torch.bfloat16,torch.bfloat16,False,False,flydsl,1448,4,31.3353,flydsl_hgemm_abf16_wbf16_bf16_t32x96x128x4_ks4_w1x2x1_bias0_ktail0_gm0_pft_gfx950,0.0151,154.2,4856.33
gfx950,256,32,6144,18432,False,torch.bfloat16,torch.bfloat16,False,False,flydsl,1697,4,43.0,flydsl_hgemm_abf16_wbf16_bf16_t32x96x64x6_ks4_w1x2x1_bias0_ktail0_gm0_pft_gfx950,0.0166,168.55,5303.84
gfx950,256,64,6144,2048,False,torch.bfloat16,torch.bfloat16,False,False,triton,0,0,9.8378,auto,0.0,163.72,2664.66
gfx950,256,64,6144,3072,False,torch.bfloat16,torch.bfloat16,False,False,triton,0,0,13.2625,auto,0.0,182.16,2935.22
gfx950,256,64,6144,4608,False,torch.bfloat16,torch.bfloat16,False,False,triton,0,0,18.3861,auto,0.0,197.1,3154.52
gfx950,256,64,6144,6144,False,torch.bfloat16,torch.bfloat16,False,False,flydsl,1742,2,23.0668,flydsl_hgemm_abf16_wbf16_bf16_t64x64x128x3_ks2_w2x2x1_bias0_ktail0_gm0_pft_gfx950,0.0056,209.47,3341.18
gfx950,256,64,6144,12288,False,torch.bfloat16,torch.bfloat16,False,False,torch,0,0,36.6416,native,0.0,263.74,4185.25
gfx950,256,64,6144,18432,False,torch.bfloat16,torch.bfloat16,False,False,opus,1214,4,47.6719,opus_gemm_flatmm_splitk_256x64x96x64_2x1_16x16x32_0x0x0_wgpcu1_nooob,0.0,304.07,4817.05
gfx950,256,128,6144,2048,False,torch.bfloat16,torch.bfloat16,False,False,flydsl,1491,1,12.1126,flydsl_hgemm_abf16_wbf16_bf16_t64x64x128x5_ks1_w2x2x2_bias0_ktail0_gm0_pft_gfx950,0.0034,265.94,2250.79
gfx950,256,128,6144,3072,False,torch.bfloat16,torch.bfloat16,False,False,flydsl,1946,1,16.4521,flydsl_hgemm_abf16_wbf16_bf16_t64x64x128x4_ks1_w2x2x1_bias0_ktail0_gm0_pft_gfx950,0.0,293.69,2437.87
gfx950,256,128,6144,4608,False,torch.bfloat16,torch.bfloat16,False,False,flydsl,2198,1,23.1155,flydsl_hgemm_abf16_wbf16_bf16_t64x64x128x5_ks1_w2x2x2_bias0_ktail0_gm0_pft_gfx950,0.0052,313.55,2568.65
gfx950,256,128,6144,6144,False,torch.bfloat16,torch.bfloat16,False,False,flydsl,1330,1,30.756,flydsl_hgemm_abf16_wbf16_bf16_t48x64x64x4_ks1_w1x2x1_bias0_ktail0_gm0_pft_gfx950,0.0,314.2,2557.0
gfx950,256,128,6144,12288,False,torch.bfloat16,torch.bfloat16,False,False,torch,0,0,41.486,native,0.0,465.88,3753.4
gfx950,256,128,6144,18432,False,torch.bfloat16,torch.bfloat16,False,False,torch,0,0,55.7303,native,0.0,520.2,4176.97
gfx950,256,196,6144,2048,False,torch.bfloat16,torch.bfloat16,False,False,torch,0,0,15.9147,native,0.0,309.93,1783.07
gfx950,256,196,6144,3072,False,torch.bfloat16,torch.bfloat16,False,False,torch,0,0,21.1235,native,0.0,350.26,1958.08
gfx950,256,196,6144,4608,False,torch.bfloat16,torch.bfloat16,False,False,triton,0,0,34.5303,auto,0.0,321.4,1761.87
gfx950,256,196,6144,6144,False,torch.bfloat16,torch.bfloat16,False,False,torch,0,0,35.9811,native,0.0,411.26,2232.13
gfx950,256,196,6144,12288,False,torch.bfloat16,torch.bfloat16,False,False,torch,0,0,60.706,native,0.0,487.51,2606.34
gfx950,256,196,6144,18432,False,torch.bfloat16,torch.bfloat16,False,False,torch,0,0,77.2822,native,0.0,574.42,3055.38
gfx950,256,256,6144,2048,False,torch.bfloat16,torch.bfloat16,False,False,flydsl,1295,1,14.801,flydsl_hgemm_abf16_wbf16_bf16_t64x96x128x3_ks1_w1x2x2_bias0_ktail0_gm0_pft_gfx950,0.0034,435.27,1983.66
gfx950,256,256,6144,3072,False,torch.bfloat16,torch.bfloat16,False,False,flydsl,1595,1,20.1742,flydsl_hgemm_abf16_wbf16_bf16_t64x96x128x3_ks1_w2x2x1_bias0_ktail0_gm0_pft_gfx950,0.0,479.01,2105.03
gfx950,256,256,6144,4608,False,torch.bfloat16,torch.bfloat16,False,False,flydsl,1673,1,28.7678,flydsl_hgemm_abf16_wbf16_bf16_t64x96x128x4_ks1_w2x2x1_bias0_ktail0_gm0_pft_gfx950,0.0,503.88,2159.64
gfx950,256,256,6144,6144,False,torch.bfloat16,torch.bfloat16,False,False,flydsl,1594,1,38.3946,flydsl_hgemm_abf16_wbf16_bf16_t64x96x128x3_ks1_w1x2x2_bias0_ktail0_gm0_pft_gfx950,0.0057,503.39,2130.22
gfx950,256,256,6144,12288,False,torch.bfloat16,torch.bfloat16,False,False,torch,0,0,55.8027,native,0.0,692.7,2874.99
gfx950,256,256,6144,18432,False,torch.bfloat16,torch.bfloat16,False,False,torch,0,0,88.3199,native,0.0,656.5,2706.92
gfx950,256,320,6144,2048,False,torch.bfloat16,torch.bfloat16,False,False,flydsl,768,1,16.001,flydsl_hgemm_abf16_wbf16_bf16_t64x128x128x3_ks1_w1x4x2_bias0_ktail0_gm0_pft_gfx950,0.0034,503.29,1900.43
gfx950,256,320,6144,3072,False,torch.bfloat16,torch.bfloat16,False,False,flydsl,810,1,22.2976,flydsl_hgemm_abf16_wbf16_bf16_t64x128x128x3_ks1_w1x4x2_bias0_ktail0_gm0_pft_gfx950,0.0042,541.74,1957.47
gfx950,256,320,6144,4608,False,torch.bfloat16,torch.bfloat16,False,False,flydsl,809,1,32.0305,flydsl_hgemm_abf16_wbf16_bf16_t64x128x128x3_ks1_w1x4x2_bias0_ktail0_gm4_pft_gfx950,0.0052,565.69,1982.62
gfx950,256,320,6144,6144,False,torch.bfloat16,torch.bfloat16,False,False,flydsl,811,1,42.5281,flydsl_hgemm_abf16_wbf16_bf16_t64x128x128x3_ks1_w1x4x2_bias0_ktail0_gm4_pft_gfx950,0.0057,568.08,1960.16
gfx950,256,320,6144,12288,False,torch.bfloat16,torch.bfloat16,False,False,torch,0,0,77.5921,native,0.0,622.72,2098.04
gfx950,256,320,6144,18432,False,torch.bfloat16,torch.bfloat16,False,False,torch,0,0,101.2936,native,0.0,715.52,2391.28
gfx950,256,512,6144,2048,False,torch.bfloat16,torch.bfloat16,False,False,flydsl,536,1,20.8402,flydsl_hgemm_abf16_wbf16_bf16_t128x96x64x3_ks1_w2x2x1_bias0_ktail0_gm0_pft_gfx950,0.0,618.27,1610.08
gfx950,256,512,6144,3072,False,torch.bfloat16,torch.bfloat16,False,False,flydsl,665,1,30.5676,flydsl_hgemm_abf16_wbf16_bf16_t128x96x64x4_ks1_w2x2x1_bias0_ktail0_gm4_pft_gfx950,0.0,632.28,1543.66
gfx950,256,512,6144,4608,False,torch.bfloat16,torch.bfloat16,False,False,flydsl,670,1,44.3151,flydsl_hgemm_abf16_wbf16_bf16_t128x96x64x3_ks1_w2x2x1_bias0_ktail0_gm0_pft_gfx950,0.0,654.2,1526.19
gfx950,256,512,6144,6144,False,torch.bfloat16,torch.bfloat16,False,False,flydsl,7,1,58.5226,flydsl_hgemm_abf16_wbf16_bf16_t128x128x128x2_ks1_w2x4x1_bias0_ktail0_gm0_pht_gfx950,0.0,660.51,1505.07
gfx950,256,512,6144,12288,False,torch.bfloat16,torch.bfloat16,False,False,torch,0,0,102.1074,native,0.0,757.14,1663.63
gfx950,256,512,6144,18432,False,torch.bfloat16,torch.bfloat16,False,False,torch,0,0,141.9047,native,0.0,817.2,1773.43
gfx950,256,1024,6144,2048,False,torch.bfloat16,torch.bfloat16,False,False,flydsl,466,1,34.3818,flydsl_hgemm_abf16_wbf16_bf16_t256x128x64x3_ks1_w4x4x1_bias0_ktail0_gm0_pft_gfx950,0.0,749.52,1219.92
gfx950,256,1024,6144,3072,False,torch.bfloat16,torch.bfloat16,False,False,torch,0,0,48.0348,native,0.0,804.72,1178.79
gfx950,256,1024,6144,4608,False,torch.bfloat16,torch.bfloat16,False,False,torch,0,0,68.6174,native,0.0,845.01,1146.11
gfx950,256,1024,6144,6144,False,torch.bfloat16,torch.bfloat16,False,False,torch,0,0,82.0328,native,0.0,942.42,1227.11
gfx950,256,1024,6144,12288,False,torch.bfloat16,torch.bfloat16,False,False,torch,0,0,142.7907,native,0.0,1082.84,1321.82
gfx950,256,1024,6144,18432,False,torch.bfloat16,torch.bfloat16,False,False,torch,0,0,199.9505,native,0.0,1159.93,1384.46
gfx950,256,2048,6144,2048,False,torch.bfloat16,torch.bfloat16,False,False,torch,0,0,52.06,native,0.0,990.0,1127.93
gfx950,256,2048,6144,3072,False,torch.bfloat16,torch.bfloat16,False,False,flydsl,392,1,71.9463,flydsl_hgemm_abf16_wbf16_bf16_t256x256x64x2_ks1_w2x4x1_bias0_ktail0_gm0_pht_gfx950,0.0,1074.54,1049.36
gfx950,256,2048,6144,4608,False,torch.bfloat16,torch.bfloat16,False,False,flydsl,392,1,100.4271,flydsl_hgemm_abf16_wbf16_bf16_t256x256x64x2_ks1_w2x4x1_bias0_ktail0_gm0_pht_gfx950,0.0,1154.71,1002.35
gfx950,256,2048,6144,6144,False,torch.bfloat16,torch.bfloat16,False,False,torch,0,0,125.722,native,0.0,1229.85,1000.85
gfx950,256,2048,6144,12288,False,torch.bfloat16,torch.bfloat16,False,False,torch,0,0,236.0978,native,0.0,1309.79,959.32
gfx950,256,2048,6144,18432,False,torch.bfloat16,torch.bfloat16,False,False,torch,0,0,349.4244,native,0.0,1327.49,936.27
gfx950,256,4096,6144,2048,False,torch.bfloat16,torch.bfloat16,False,False,asm,10,1,98.0359,_ZN5aiter24bf16gemm_bf16_tn_256x256E,0.0,1051.44,941.23
gfx950,256,4096,6144,3072,False,torch.bfloat16,torch.bfloat16,False,False,flydsl,392,1,136.1625,flydsl_hgemm_abf16_wbf16_bf16_t256x256x64x2_ks1_w2x4x1_bias0_ktail0_gm0_pht_gfx950,0.0,1135.55,831.7
gfx950,256,4096,6144,4608,False,torch.bfloat16,torch.bfloat16,False,False,torch,0,0,188.0734,native,0.0,1233.18,769.4
gfx950,256,4096,6144,6144,False,torch.bfloat16,torch.bfloat16,False,False,asm,10,1,243.7625,_ZN5aiter24bf16gemm_bf16_tn_256x256E,0.0,1268.6,722.67
gfx950,256,4096,6144,12288,False,torch.bfloat16,torch.bfloat16,False,False,asm,10,1,463.9274,_ZN5aiter24bf16gemm_bf16_tn_256x256E,0.0,1333.13,650.94
gfx950,256,4096,6144,18432,False,torch.bfloat16,torch.bfloat16,False,False,asm,10,1,692.4977,_ZN5aiter24bf16gemm_bf16_tn_256x256E,0.0,1339.66,617.79
gfx950,256,8192,6144,2048,False,torch.bfloat16,torch.bfloat16,False,False,flydsl,393,1,160.1346,flydsl_hgemm_abf16_wbf16_bf16_t256x256x64x2_ks1_w2x4x1_bias0_ktail0_gm4_pht_gfx950,0.0,1287.41,995.31
gfx950,256,8192,6144,3072,False,torch.bfloat16,torch.bfloat16,False,False,asm,10,1,223.5748,_ZN5aiter24bf16gemm_bf16_tn_256x256E,0.0,1383.15,844.21
gfx950,256,8192,6144,4608,False,torch.bfloat16,torch.bfloat16,False,False,flydsl,19,1,314.8239,flydsl_hgemm_abf16_wbf16_bf16_t256x256x64x2_ks1_w2x4x1_bias0_ktail0_gm4_pht_gfx950,0.0,1473.38,739.41
gfx950,256,8192,6144,6144,False,torch.bfloat16,torch.bfloat16,False,False,torch,0,0,404.8948,native,0.0,1527.5,683.69
gfx950,256,8192,6144,12288,False,torch.bfloat16,torch.bfloat16,False,False,torch,0,0,793.21,native,0.0,1559.42,571.08
gfx950,256,8192,6144,18432,False,torch.bfloat16,torch.bfloat16,False,False,torch,0,0,1202.0369,native,0.0,1543.57,523.4
gfx950,256,16384,6144,2048,False,torch.bfloat16,torch.bfloat16,False,False,torch,0,0,301.2649,native,0.0,1368.62,974.56
gfx950,256,16384,6144,3072,False,torch.bfloat16,torch.bfloat16,False,False,torch,0,0,429.7362,native,0.0,1439.2,790.57
gfx950,256,16384,6144,4608,False,torch.bfloat16,torch.bfloat16,False,False,torch,0,0,616.9047,native,0.0,1503.82,662.9
gfx950,256,16384,6144,6144,False,torch.bfloat16,torch.bfloat16,False,False,torch,0,0,805.8769,native,0.0,1534.91,593.33
gfx950,256,16384,6144,12288,False,torch.bfloat16,torch.bfloat16,False,False,torch,0,0,1580.942,native,0.0,1564.83,477.55
gfx950,256,16384,6144,18432,False,torch.bfloat16,torch.bfloat16,False,False,flydsl,18,1,2403.4034,flydsl_hgemm_abf16_wbf16_bf16_t256x256x64x2_ks1_w2x4x1_bias0_ktail0_gm0_pht_gfx950,0.0,1544.0,429.31
gfx950,256,32768,6144,2048,False,torch.bfloat16,torch.bfloat16,False,False,torch,0,0,580.8572,native,0.0,1419.68,967.6
gfx950,256,32768,6144,3072,False,torch.bfloat16,torch.bfloat16,False,False,torch,0,0,832.6361,native,0.0,1485.58,770.72
gfx950,256,32768,6144,4608,False,torch.bfloat16,torch.bfloat16,False,False,torch,0,0,1219.5748,native,0.0,1521.37,624.21
gfx950,256,32768,6144,6144,False,torch.bfloat16,torch.bfloat16,False,False,torch,0,0,1596.7807,native,0.0,1549.31,551.61
gfx950,256,32768,6144,12288,False,torch.bfloat16,torch.bfloat16,False,False,torch,0,0,3205.049,native,0.0,1543.75,424.0
gfx950,256,32768,6144,18432,False,torch.bfloat16,torch.bfloat16,False,False,torch,0,0,4749.7415,native,0.0,1562.55,386.78
gfx950,256,1,9216,6144,False,torch.bfloat16,torch.bfloat16,False,False,flydsl,290,6,21.6722,flydsl_hgemm_abf16_wbf16_bf16_t16x64x64x2_ks6_w1x2x1_bias0_ktail0_gm0_pft_gfx950,0.017,5.23,5226.83
gfx950,256,2,9216,6144,False,torch.bfloat16,torch.bfloat16,False,False,flydsl,13,6,21.6612,flydsl_hgemm_abf16_wbf16_bf16_t16x128x128x2_ks6_w1x2x2_bias0_ktail0_gm0_pft_gfx950,0.0224,10.46,5230.9
gfx950,256,4,9216,6144,False,torch.bfloat16,torch.bfloat16,False,False,flydsl,288,6,22.1202,flydsl_hgemm_abf16_wbf16_bf16_t16x64x64x2_ks6_w1x1x1_bias0_ktail0_gm0_pft_gfx950,0.0169,20.48,5125.14
gfx950,256,8,9216,6144,False,torch.bfloat16,torch.bfloat16,False,False,flydsl,288,6,22.9664,flydsl_hgemm_abf16_wbf16_bf16_t16x64x64x2_ks6_w1x1x1_bias0_ktail0_gm0_pft_gfx950,0.0183,39.45,4941.65
gfx950,256,16,9216,6144,False,torch.bfloat16,torch.bfloat16,False,False,flydsl,307,6,24.5268,flydsl_hgemm_abf16_wbf16_bf16_t16x64x64x3_ks6_w1x1x2_bias0_ktail0_gm0_pft_gfx950,0.0247,73.88,4637.28
gfx950,256,32,9216,6144,False,torch.bfloat16,torch.bfloat16,False,False,flydsl,1250,2,25.1404,flydsl_hgemm_abf16_wbf16_bf16_t32x96x128x4_ks2_w1x2x1_bias0_ktail0_gm0_pft_gfx950,0.0056,144.15,4543.65
gfx950,256,64,9216,6144,False,torch.bfloat16,torch.bfloat16,False,False,flydsl,526,1,30.3659,flydsl_hgemm_abf16_wbf16_bf16_t32x64x64x5_ks1_w1x2x1_bias0_ktail0_gm0_pft_gfx950,0.0,238.68,3794.13
gfx950,256,128,9216,6144,False,torch.bfloat16,torch.bfloat16,False,False,flydsl,1604,1,38.1831,flydsl_hgemm_abf16_wbf16_bf16_t64x64x64x4_ks1_w1x1x2_bias0_ktail0_gm0_pft_gfx950,0.0057,379.63,3068.85
gfx950,256,196,9216,6144,False,torch.bfloat16,torch.bfloat16,False,False,torch,0,0,46.4573,native,0.0,477.78,2567.25
gfx950,256,256,9216,6144,False,torch.bfloat16,torch.bfloat16,False,False,torch,0,0,52.9458,native,0.0,547.56,2287.44
gfx950,256,320,9216,6144,False,torch.bfloat16,torch.bfloat16,False,False,flydsl,1286,1,60.1843,flydsl_hgemm_abf16_wbf16_bf16_t64x96x128x2_ks1_w2x2x1_bias0_ktail0_gm0_pft_gfx950,0.0,602.13,2045.0
gfx950,256,512,9216,6144,False,torch.bfloat16,torch.bfloat16,False,False,flydsl,25,1,86.236,flydsl_hgemm_abf16_wbf16_bf16_t128x128x64x2_ks1_w2x4x1_bias0_ktail0_gm0_pht_gfx950,0.0,672.36,1495.6
gfx950,256,1024,9216,6144,False,torch.bfloat16,torch.bfloat16,False,False,torch,0,0,111.5056,native,0.0,1039.98,1297.72
gfx950,256,2048,9216,6144,False,torch.bfloat16,torch.bfloat16,False,False,torch,0,0,215.1277,native,0.0,1078.1,818.87
gfx950,256,4096,9216,6144,False,torch.bfloat16,torch.bfloat16,False,False,torch,0,0,356.7905,native,0.0,1300.08,670.07
gfx950,256,8192,9216,6144,False,torch.bfloat16,torch.bfloat16,False,False,asm,10,1,637.7453,_ZN5aiter24bf16gemm_bf16_tn_256x256E,0.0,1454.68,572.18
gfx950,256,16384,9216,6144,False,torch.bfloat16,torch.bfloat16,False,False,torch,0,0,1196.3855,native,0.0,1550.86,515.35
gfx950,256,32768,9216,6144,False,torch.bfloat16,torch.bfloat16,False,False,torch,0,0,2339.1139,native,0.0,1586.43,478.76
gfx950,256,1,50016,6144,False,torch.bfloat16,torch.bfloat16,False,False,triton,0,0,102.691,auto,0.0,5.98,5986.01
gfx950,256,2,50016,6144,False,torch.bfloat16,torch.bfloat16,False,False,triton,0,0,104.8695,auto,0.0,11.72,5862.73
gfx950,256,4,50016,6144,False,torch.bfloat16,torch.bfloat16,False,False,triton,0,0,104.4662,auto,0.0,23.53,5887.51
gfx950,256,8,50016,6144,False,torch.bfloat16,torch.bfloat16,False,False,triton,0,0,107.2679,auto,0.0,45.84,5737.93
gfx950,256,16,50016,6144,False,torch.bfloat16,torch.bfloat16,False,False,triton,0,0,110.2904,auto,0.0,89.16,5588.82
gfx950,256,32,50016,6144,False,torch.bfloat16,torch.bfloat16,False,False,triton,0,0,119.4316,auto,0.0,164.67,5176.11
gfx950,256,64,50016,6144,False,torch.bfloat16,torch.bfloat16,False,False,torch,0,0,128.4729,native,0.0,306.17,4839.82
gfx950,256,128,50016,6144,False,torch.bfloat16,torch.bfloat16,False,False,torch,0,0,143.3782,native,0.0,548.68,4386.81
gfx950,256,196,50016,6144,False,torch.bfloat16,torch.bfloat16,False,False,opus,9,0,167.7505,opus_gemm_512x256x256x64_2x4_16x16x32_0x0x0,0.0,718.1,3794.99
gfx950,256,256,50016,6144,False,torch.bfloat16,torch.bfloat16,False,False,torch,0,0,168.0051,native,0.0,936.5,3829.35
gfx950,256,320,50016,6144,False,torch.bfloat16,torch.bfloat16,False,False,torch,0,0,211.5436,native,0.0,929.69,3075.2
gfx950,256,512,50016,6144,False,torch.bfloat16,torch.bfloat16,False,False,torch,0,0,288.2029,native,0.0,1091.85,2332.05
gfx950,256,1024,50016,6144,False,torch.bfloat16,torch.bfloat16,False,False,flydsl,393,1,525.2503,flydsl_hgemm_abf16_wbf16_bf16_t256x256x64x2_ks1_w2x4x1_bias0_ktail0_gm4_pht_gfx950,0.0,1198.18,1389.08
gfx950,256,2048,50016,6144,False,torch.bfloat16,torch.bfloat16,False,False,flydsl,393,1,930.7924,flydsl_hgemm_abf16_wbf16_bf16_t256x256x64x2_ks1_w2x4x1_bias0_ktail0_gm4_pht_gfx950,0.0,1352.28,907.43
gfx950,256,4096,50016,6144,False,torch.bfloat16,torch.bfloat16,False,False,flydsl,19,1,1747.2412,flydsl_hgemm_abf16_wbf16_bf16_t256x256x64x2_ks1_w2x4x1_bias0_ktail0_gm4_pht_gfx950,0.0,1440.78,615.06
gfx950,256,8192,50016,6144,False,torch.bfloat16,torch.bfloat16,False,False,flydsl,19,1,3354.7845,flydsl_hgemm_abf16_wbf16_bf16_t256x256x64x2_ks1_w2x4x1_bias0_ktail0_gm4_pht_gfx950,0.0,1500.77,457.47
gfx950,256,16384,50016,6144,False,torch.bfloat16,torch.bfloat16,False,False,flydsl,19,1,6557.2474,flydsl_hgemm_abf16_wbf16_bf16_t256x256x64x2_ks1_w2x4x1_bias0_ktail0_gm4_pht_gfx950,0.0,1535.64,374.37
gfx950,256,32768,50016,6144,False,torch.bfloat16,torch.bfloat16,False,False,flydsl,19,1,13423.3385,flydsl_hgemm_abf16_wbf16_bf16_t256x256x64x2_ks1_w2x4x1_bias0_ktail0_gm4_pht_gfx950,0.0,1500.3,319.97
