aiter/configs/model_configs/minimax_m25_fp4_tuned_fmoe.csv
gfx,cu_num,token,model_dim,inter_dim,expert,topk,act_type,dtype,q_dtype_a,q_dtype_w,q_type,use_g1u1,doweight_stage1,gate_mode,block_m,ksplit,us1,kernelName1,err1,us2,kernelName2,err2,us,run_1stage,xbf16,flat,tflops,bw,_tag
gfx950,256,1,3072,256,256,8,ActivationType.Silu,torch.bfloat16,torch.float4_e2m1fn_x2,torch.float4_e2m1fn_x2,QuantType.per_1x32,1,0,separated,32,0,12.6929,flydsl_moe1_afp4_wfp4_bf16_t32x32x256_w4_fp4,0.4%,6.4582,moe_ck2stages_gemm2_64x32x32x128_1x1_MulABScaleExpertWeightShuffled_v1_Nswizzle0_Quant3_MulRoutedWeight1_FP4X2_FP4X2_B16,0.0%,19.1511,0,0,0,1.97,31538.08,
gfx950,256,2,3072,256,256,8,ActivationType.Silu,torch.bfloat16,torch.float4_e2m1fn_x2,torch.float4_e2m1fn_x2,QuantType.per_1x32,1,0,separated,64,0,14.1385,flydsl_moe1_afp4_wfp4_bf16_t64x64x256_w3_fp4,0.6%,8.5424,moe_ck2stages_gemm2_256x64x128x128_1x4_MulABScaleExpertWeightShuffled_v3_Nswizzle0_Quant3_MulRoutedWeight1_FP4X2_FP4X2_B16,0.0%,22.6809,0,0,0,3.33,26630.26,
gfx950,256,4,3072,256,256,8,ActivationType.Silu,torch.bfloat16,torch.float4_e2m1fn_x2,torch.float4_e2m1fn_x2,QuantType.per_1x32,1,0,separated,64,0,14.6549,flydsl_moe1_afp4_wfp4_bf16_t64x64x256_w2_fp4,0.5%,9.8355,moe_ck2stages_gemm2_256x64x128x128_1x4_MulABScaleExpertWeightShuffled_v3_Nswizzle0_Quant3_MulRoutedWeight1_FP4X2_FP4X2_B16,0.0%,24.4904,0,0,0,6.17,24663.4,
gfx950,256,8,3072,256,256,8,ActivationType.Silu,torch.bfloat16,torch.float4_e2m1fn_x2,torch.float4_e2m1fn_x2,QuantType.per_1x32,1,0,separated,32,0,15.0112,flydsl_moe1_afp4_wfp4_bf16_t32x64x256_w3_bnt0_fp4,0.5%,11.0332,moe_ck2stages_gemm2_64x32x32x128_1x1_MulABScaleExpertWeightShuffled_v1_Nswizzle0_Quant3_MulRoutedWeight1_FP4X2_FP4X2_B16,0.0%,26.0444,0,0,0,11.6,23193.22,
gfx950,256,16,3072,256,256,8,ActivationType.Silu,torch.bfloat16,torch.float4_e2m1fn_x2,torch.float4_e2m1fn_x2,QuantType.per_1x32,1,0,separated,32,0,19.2822,flydsl_moe1_afp4_wfp4_bf16_t32x128x256_w2_bnt0_fp4,0.5%,15.3136,flydsl_moe2_afp4_wfp4_bf16_t32x256x256_atomic,0.0%,34.5958,0,0,0,17.46,17462.44,
gfx950,256,32,3072,256,256,8,ActivationType.Silu,torch.bfloat16,torch.float4_e2m1fn_x2,torch.float4_e2m1fn_x2,QuantType.per_1x32,1,0,separated,32,0,30.2323,flydsl_moe1_afp4_wfp4_bf16_t32x64x256_w4,0.0%,19.2482,flydsl_moe2_afp4_wfp4_bf16_t32x256x256_atomic,0.0%,49.4805,0,0,0,24.41,12212.38,
gfx950,256,64,3072,256,256,8,ActivationType.Silu,torch.bfloat16,torch.float4_e2m1fn_x2,torch.float4_e2m1fn_x2,QuantType.per_1x32,1,0,separated,32,0,37.1453,flydsl_moe1_afp4_wfp4_bf16_t32x128x256_w3,0.0%,24.4456,flydsl_moe2_afp4_wfp4_bf16_t16x256x256_atomic_persist_sbm32,0.0%,61.5909,0,0,0,39.23,9815.89,
gfx950,256,128,3072,256,256,8,ActivationType.Silu,torch.bfloat16,torch.float4_e2m1fn_x2,torch.float4_e2m1fn_x2,QuantType.per_1x32,1,0,separated,32,0,41.3453,flydsl_moe1_afp4_wfp4_bf16_t32x64x256_w4,0.0%,26.5566,flydsl_moe2_afp4_wfp4_bf16_t16x256x256_atomic_bnt2_sbm32,0.0%,67.9019,0,0,0,71.16,8912.26,
gfx950,256,256,3072,256,256,8,ActivationType.Silu,torch.bfloat16,torch.float4_e2m1fn_x2,torch.float4_e2m1fn_x2,QuantType.per_1x32,1,0,separated,32,0,37.6798,flydsl_moe1_afp4_wfp4_bf16_t32x128x256_w3_fp4,0.8%,28.4171,flydsl_moe2_afp4_wfp4_bf16_t16x256x256_atomic_sbm32,0.0%,66.0969,0,0,0,146.2,9173.49,
gfx950,256,512,3072,256,256,8,ActivationType.Silu,torch.bfloat16,torch.float4_e2m1fn_x2,torch.float4_e2m1fn_x2,QuantType.per_1x32,1,0,separated,32,0,42.3428,flydsl_moe1_afp4_wfp4_bf16_t32x128x256_w2,0.0%,33.4443,flydsl_moe2_afp4_wfp4_bf16_t32x128x256_atomic_bnt2_persist,0.0%,75.7871,0,0,0,255.02,8031.69,
gfx950,256,1024,3072,256,256,8,ActivationType.Silu,torch.bfloat16,torch.float4_e2m1fn_x2,torch.float4_e2m1fn_x2,QuantType.per_1x32,1,0,separated,64,0,45.8141,flydsl_moe1_afp4_wfp4_bf16_t64x128x256_w3,0.0%,47.6451,flydsl_moe2_afp4_wfp4_bf16_t64x256x256_reduce_bnt2,0.0%,93.4592,0,0,0,413.6,6563.47,
gfx950,256,2048,3072,256,256,8,ActivationType.Silu,torch.bfloat16,torch.float4_e2m1fn_x2,torch.float4_e2m1fn_x2,QuantType.per_1x32,1,0,separated,128,0,57.2497,flydsl_moe1_afp4_wfp4_bf16_t128x128x256,0.0%,72.0936,flydsl_moe2_afp4_wfp4_bf16_t64x256x256_reduce_persist_sbm128,0.0%,129.3433,0,0,0,597.71,4815.51,
gfx950,256,4096,3072,256,256,8,ActivationType.Silu,torch.bfloat16,torch.float4_e2m1fn_x2,torch.float4_e2m1fn_x2,QuantType.per_1x32,1,0,separated,64,0,82.41290000000001,flydsl_moe1_afp4_wfp4_bf16_t64x128x256_w2_bnt0_xcd4,0.0%,126.4326,flydsl_moe2_afp4_wfp4_bf16_t64x256x256_reduce_persist,0.0%,208.8455,0,0,0,740.35,3072.74,
gfx950,256,8192,3072,256,256,8,ActivationType.Silu,torch.bfloat16,torch.float4_e2m1fn_x2,torch.float4_e2m1fn_x2,QuantType.per_1x32,1,0,separated,64,0,127.5673,flydsl_moe1_afp4_wfp4_bf16_t64x128x256_w2_bnt0_xcd4,0.0%,221.4306,flydsl_moe2_afp4_wfp4_bf16_t64x256x256_reduce,0.0%,348.9979,0,0,0,886.07,1946.94,
gfx950,256,16384,3072,256,256,8,ActivationType.Silu,torch.bfloat16,torch.float4_e2m1fn_x2,torch.float4_e2m1fn_x2,QuantType.per_1x32,1,0,separated,64,0,213.5913,flydsl_moe1_afp4_wfp4_bf16_t64x128x256_w2_bnt0_xcd4,0.0%,418.5491,flydsl_moe2_afp4_wfp4_bf16_t64x256x256_reduce,0.0%,632.1404,0,0,0,978.38,1194.31,
gfx950,256,32768,3072,256,256,8,ActivationType.Silu,torch.bfloat16,torch.float4_e2m1fn_x2,torch.float4_e2m1fn_x2,QuantType.per_1x32,1,0,separated,64,0,383.483,flydsl_moe1_afp4_wfp4_bf16_t64x128x256_w4_bnt0_xcd4,0.0%,816.482,flydsl_moe2_afp4_wfp4_bf16_t64x256x256_reduce,0.0%,1199.965,0,0,0,1030.82,755.0,
gfx950,256,1,3072,384,256,8,ActivationType.Silu,torch.bfloat16,torch.float4_e2m1fn_x2,torch.float4_e2m1fn_x2,QuantType.per_1x32,1,0,separated,64,0,14.2566,flydsl_moe1_afp4_wfp4_bf16_t64x64x256_w4_fp4,0.8%,11.5331,flydsl_moe2_afp4_wfp4_bf16_t64x128x128_atomic_bnt2_xcd4,0.1%,25.7897,0,0,0,2.2,35129.49,
gfx950,256,2,3072,384,256,8,ActivationType.Silu,torch.bfloat16,torch.float4_e2m1fn_x2,torch.float4_e2m1fn_x2,QuantType.per_1x32,1,0,separated,64,0,14.6814,flydsl_moe1_afp4_wfp4_bf16_t64x64x256_w4_bnt0_fp4,0.6%,11.8477,flydsl_moe2_afp4_wfp4_bf16_t32x256x128_atomic_bnt2_persist_sbm64,0.1%,26.5291,0,0,0,4.27,34150.73,
gfx950,256,4,3072,384,256,8,ActivationType.Silu,torch.bfloat16,torch.float4_e2m1fn_x2,torch.float4_e2m1fn_x2,QuantType.per_1x32,1,0,separated,32,0,14.578,flydsl_moe1_afp4_wfp4_bf16_t32x128x256_w4_bnt0_fp4,0.6%,12.3339,flydsl_moe2_afp4_wfp4_bf16_t32x128x128_atomic_bnt2,0.1%,26.9119,0,0,0,8.42,33665.65,
gfx950,256,8,3072,384,256,8,ActivationType.Silu,torch.bfloat16,torch.float4_e2m1fn_x2,torch.float4_e2m1fn_x2,QuantType.per_1x32,1,0,separated,32,0,17.2628,flydsl_moe1_afp4_wfp4_bf16_t32x128x256_w3_bnt0_fp4,0.6%,14.5125,flydsl_moe2_afp4_wfp4_bf16_t32x256x128_atomic,0.1%,31.7753,0,0,0,14.26,28514.08,
gfx950,256,16,3072,384,256,8,ActivationType.Silu,torch.bfloat16,torch.float4_e2m1fn_x2,torch.float4_e2m1fn_x2,QuantType.per_1x32,1,0,separated,32,0,30.1417,flydsl_moe1_afp4_wfp4_bf16_t32x64x256_w3,0.0%,19.3946,flydsl_moe2_afp4_wfp4_bf16_t32x256x128_atomic,0.1%,49.5363,0,0,0,18.29,18291.98,
gfx950,256,32,3072,384,256,8,ActivationType.Silu,torch.bfloat16,torch.float4_e2m1fn_x2,torch.float4_e2m1fn_x2,QuantType.per_1x32,1,0,separated,32,0,39.5342,flydsl_moe1_afp4_wfp4_bf16_t32x128x256_w3,0.0%,26.271,flydsl_moe2_afp4_wfp4_bf16_t32x256x128_atomic_bnt2,0.1%,65.8052,0,0,0,27.53,13771.93,
gfx950,256,64,3072,384,256,8,ActivationType.Silu,torch.bfloat16,torch.float4_e2m1fn_x2,torch.float4_e2m1fn_x2,QuantType.per_1x32,1,0,separated,32,0,51.2411,flydsl_moe1_afp4_wfp4_bf16_t32x128x256_w3,0.0%,33.6009,flydsl_moe2_afp4_wfp4_bf16_t32x128x128_atomic_persist,0.1%,84.842,0,0,0,42.71,10685.27,
gfx950,256,128,3072,384,256,8,ActivationType.Silu,torch.bfloat16,torch.float4_e2m1fn_x2,torch.float4_e2m1fn_x2,QuantType.per_1x32,1,0,separated,64,0,53.5896,flydsl_moe1_afp4_wfp4_bf16_t64x128x256_w2_fp4,0.8%,38.2497,flydsl_moe2_afp4_wfp4_bf16_t32x256x128_atomic_bnt2_sbm64,0.1%,91.8393,0,0,0,78.92,9877.57,
gfx950,256,256,3072,384,256,8,ActivationType.Silu,torch.bfloat16,torch.float4_e2m1fn_x2,torch.float4_e2m1fn_x2,QuantType.per_1x32,1,0,separated,64,0,55.2609,flydsl_moe1_afp4_wfp4_bf16_t64x128x256_w3_fp4,0.8%,40.0961,flydsl_moe2_afp4_wfp4_bf16_t32x256x128_atomic_bnt2_sbm64,0.1%,95.357,0,0,0,152.01,9525.56,
gfx950,256,512,3072,384,256,8,ActivationType.Silu,torch.bfloat16,torch.float4_e2m1fn_x2,torch.float4_e2m1fn_x2,QuantType.per_1x32,1,0,separated,32,0,60.1925,flydsl_moe1_afp4_wfp4_bf16_t32x128x256_w2,0.0%,42.975,flydsl_moe2_afp4_wfp4_bf16_t32x128x128_atomic_bnt2,0.1%,103.1675,0,0,0,281.01,8827.28,
gfx950,256,1024,3072,384,256,8,ActivationType.Silu,torch.bfloat16,torch.float4_e2m1fn_x2,torch.float4_e2m1fn_x2,QuantType.per_1x32,1,0,separated,64,0,64.6613,flydsl_moe1_afp4_wfp4_bf16_t64x128x256_w3,0.0%,61.6333,flydsl_moe2_afp4_wfp4_bf16_t32x128x128_atomic_sbm64,0.1%,126.2946,0,0,0,459.1,7248.19,
gfx950,256,2048,3072,384,256,8,ActivationType.Silu,torch.bfloat16,torch.float4_e2m1fn_x2,torch.float4_e2m1fn_x2,QuantType.per_1x32,1,0,separated,128,0,80.4055,flydsl_moe1_afp4_wfp4_bf16_t128x128x256_w2,0.0%,91.7581,flydsl_moe2_afp4_wfp4_bf16_t64x256x128_reduce_persist_sbm128,0.0%,172.1636,0,0,0,673.57,5371.89,
gfx950,256,4096,3072,384,256,8,ActivationType.Silu,torch.bfloat16,torch.float4_e2m1fn_x2,torch.float4_e2m1fn_x2,QuantType.per_1x32,1,0,separated,64,0,120.3309,flydsl_moe1_afp4_wfp4_bf16_t64x128x256_w3_bnt0_xcd4,0.0%,155.6247,flydsl_moe2_afp4_wfp4_bf16_t64x256x128_reduce_persist,0.0%,275.9556,0,0,0,840.45,3419.82,
gfx950,256,8192,3072,384,256,8,ActivationType.Silu,torch.bfloat16,torch.float4_e2m1fn_x2,torch.float4_e2m1fn_x2,QuantType.per_1x32,1,0,separated,64,0,187.9358,flydsl_moe1_afp4_wfp4_bf16_t64x128x256_w4_bnt0_xcd4,0.0%,276.7236,flydsl_moe2_afp4_wfp4_bf16_t64x256x128_reduce,0.0%,464.6594,0,0,0,998.27,2112.23,
gfx950,256,16384,3072,384,256,8,ActivationType.Silu,torch.bfloat16,torch.float4_e2m1fn_x2,torch.float4_e2m1fn_x2,QuantType.per_1x32,1,0,separated,64,0,312.4787,flydsl_moe1_afp4_wfp4_bf16_t64x128x256_w3_bnt0_xcd4,0.0%,526.4592,flydsl_moe2_afp4_wfp4_bf16_t64x256x128_reduce_persist,0.0%,838.9379,0,0,0,1105.82,1259.88,
gfx950,256,32768,3072,384,256,8,ActivationType.Silu,torch.bfloat16,torch.float4_e2m1fn_x2,torch.float4_e2m1fn_x2,QuantType.per_1x32,1,0,separated,64,0,551.7283,flydsl_moe1_afp4_wfp4_bf16_t64x128x256_w2_bnt0_xcd4,0.0%,1025.3113,flydsl_moe2_afp4_wfp4_bf16_t64x256x128_reduce_persist,0.0%,1577.0396,0,0,0,1176.52,765.97,
gfx950,256,1,3072,768,256,8,ActivationType.Silu,torch.bfloat16,torch.float4_e2m1fn_x2,torch.float4_e2m1fn_x2,QuantType.per_1x32,1,0,separated,32,0,14.8353,flydsl_moe1_afp4_wfp4_bf16_t32x32x256_w4,0.0%,7.6223,moe_ck2stages_gemm2_256x32x128x128_1x4_MulABScaleExpertWeightShuffled_v3_Nswizzle0_Quant3_MulRoutedWeight1_FP4X2_FP4X2_B16,0.5%,22.4576,0,0,0,5.04,80683.09,
gfx950,256,2,3072,768,256,8,ActivationType.Silu,torch.bfloat16,torch.float4_e2m1fn_x2,torch.float4_e2m1fn_x2,QuantType.per_1x32,1,0,separated,32,0,15.9369,flydsl_moe1_afp4_wfp4_bf16_t32x64x256_w4_bnt0,0.0%,9.6064,moe_ck2stages_gemm2_256x32x128x128_1x4_MulABScaleExpertWeightShuffled_v3_Nswizzle0_Quant3_MulRoutedWeight1_FP4X2_FP4X2_B16,0.4%,25.5433,0,0,0,8.87,70936.71,
gfx950,256,4,3072,768,256,8,ActivationType.Silu,torch.bfloat16,torch.float4_e2m1fn_x2,torch.float4_e2m1fn_x2,QuantType.per_1x32,1,0,separated,32,0,20.1916,flydsl_moe1_afp4_wfp4_bf16_t32x64x256_w2_bnt0,0.0%,14.3392,flydsl_moe2_afp4_wfp4_bf16_t32x128x256_atomic,0.4%,34.5308,0,0,0,13.12,52474.2,
gfx950,256,8,3072,768,256,8,ActivationType.Silu,torch.bfloat16,torch.float4_e2m1fn_x2,torch.float4_e2m1fn_x2,QuantType.per_1x32,1,0,separated,32,0,31.6611,flydsl_moe1_afp4_wfp4_bf16_t32x64x256_w4,0.0%,20.1124,flydsl_moe2_afp4_wfp4_bf16_t32x256x256_atomic,0.4%,51.7735,0,0,0,17.5,34998.85,
gfx950,256,16,3072,768,256,8,ActivationType.Silu,torch.bfloat16,torch.float4_e2m1fn_x2,torch.float4_e2m1fn_x2,QuantType.per_1x32,1,0,separated,32,0,50.8717,flydsl_moe1_afp4_wfp4_bf16_t32x128x256_w3,0.0%,29.5543,flydsl_moe2_afp4_wfp4_bf16_t32x128x256_atomic,0.3%,80.426,0,0,0,22.53,22531.11,
gfx950,256,32,3072,768,256,8,ActivationType.Silu,torch.bfloat16,torch.float4_e2m1fn_x2,torch.float4_e2m1fn_x2,QuantType.per_1x32,1,0,separated,32,0,70.4671,flydsl_moe1_afp4_wfp4_bf16_t32x64x256_w4,0.0%,41.4032,flydsl_moe2_afp4_wfp4_bf16_t32x128x256_atomic,0.4%,111.8703,0,0,0,32.39,16199.42,
gfx950,256,64,3072,768,256,8,ActivationType.Silu,torch.bfloat16,torch.float4_e2m1fn_x2,torch.float4_e2m1fn_x2,QuantType.per_1x32,1,0,separated,32,0,92.4827,flydsl_moe1_afp4_wfp4_bf16_t32x128x256_w4_fp4,17.4%,54.461,flydsl_moe2_afp4_wfp4_bf16_t16x128x256_atomic_persist_sbm32,0.4%,146.9437,0,0,0,49.32,12334.85,
gfx950,256,128,3072,768,256,8,ActivationType.Silu,torch.bfloat16,torch.float4_e2m1fn_x2,torch.float4_e2m1fn_x2,QuantType.per_1x32,1,0,separated,32,0,99.1837,flydsl_moe1_afp4_wfp4_bf16_t32x128x256_w4_fp4,17.8%,61.3148,flydsl_moe2_afp4_wfp4_bf16_t16x128x256_atomic_sbm32,0.4%,160.4985,0,0,0,90.32,11296.8,
gfx950,256,256,3072,768,256,8,ActivationType.Silu,torch.bfloat16,torch.float4_e2m1fn_x2,torch.float4_e2m1fn_x2,QuantType.per_1x32,1,0,separated,32,0,101.8754,flydsl_moe1_afp4_wfp4_bf16_t32x128x256_w3_fp4,18.0%,62.3209,flydsl_moe2_afp4_wfp4_bf16_t16x128x256_atomic_persist_sbm32,0.4%,164.1963,0,0,0,176.56,11049.57,
gfx950,256,512,3072,768,256,8,ActivationType.Silu,torch.bfloat16,torch.float4_e2m1fn_x2,torch.float4_e2m1fn_x2,QuantType.per_1x32,1,0,separated,32,0,103.3035,flydsl_moe1_afp4_wfp4_bf16_t32x128x256_w3_fp4,17.9%,67.4932,flydsl_moe2_afp4_wfp4_bf16_t32x256x256_atomic,0.4%,170.7967,0,0,0,339.48,10636.38,
gfx950,256,1024,3072,768,256,8,ActivationType.Silu,torch.bfloat16,torch.float4_e2m1fn_x2,torch.float4_e2m1fn_x2,QuantType.per_1x32,1,0,separated,64,0,117.2095,flydsl_moe1_afp4_wfp4_bf16_t64x128x256_w4,0.0%,83.6869,flydsl_moe2_afp4_wfp4_bf16_t64x128x256_atomic_persist,0.4%,200.8964,0,0,0,577.23,9066.25,
gfx950,256,2048,3072,768,256,8,ActivationType.Silu,torch.bfloat16,torch.float4_e2m1fn_x2,torch.float4_e2m1fn_x2,QuantType.per_1x32,1,0,separated,128,0,154.01600000000002,flydsl_moe1_afp4_wfp4_bf16_t128x128x256_w4,0.0%,118.6657,flydsl_moe2_afp4_wfp4_bf16_t64x128x256_atomic_sbm128,0.4%,272.6817,0,0,0,850.55,6714.11,
gfx950,256,4096,3072,768,256,8,ActivationType.Silu,torch.bfloat16,torch.float4_e2m1fn_x2,torch.float4_e2m1fn_x2,QuantType.per_1x32,1,0,separated,128,0,225.759,moe_ck2stages_gemm1_256x128x128x128_1x4_MulABScaleShuffled_v3_Nswizzle0_Quant3_MulRoutedWeight0_silu_FP4X2_FP4X2_B16,0.0%,197.3883,flydsl_moe2_afp4_wfp4_bf16_t64x128x256_reduce_sbm128,0.0%,423.1473,0,0,0,1096.21,4371.26,
gfx950,256,8192,3072,768,256,8,ActivationType.Silu,torch.bfloat16,torch.float4_e2m1fn_x2,torch.float4_e2m1fn_x2,QuantType.per_1x32,1,0,separated,64,0,372.9222,flydsl_moe1_afp4_wfp4_bf16_t64x64x256_w4_bnt0,0.0%,365.3342,flydsl_moe2_afp4_wfp4_bf16_t64x128x256_reduce,0.0%,738.2564,0,0,0,1256.63,2556.61,
gfx950,256,16384,3072,768,256,8,ActivationType.Silu,torch.bfloat16,torch.float4_e2m1fn_x2,torch.float4_e2m1fn_x2,QuantType.per_1x32,1,0,separated,64,0,619.2387000000001,flydsl_moe1_afp4_wfp4_bf16_t64x64x256_w4_bnt0,0.0%,682.629,flydsl_moe2_afp4_wfp4_bf16_t64x128x256_reduce,0.0%,1301.8677,0,0,0,1425.2,1507.78,
gfx950,256,32768,3072,768,256,8,ActivationType.Silu,torch.bfloat16,torch.float4_e2m1fn_x2,torch.float4_e2m1fn_x2,QuantType.per_1x32,1,0,separated,128,0,1079.7018,moe_ck2stages_gemm1_256x128x128x128_1x4_MulABScaleShuffled_v3_Nswizzle0_Quant3_MulRoutedWeight0_silu_FP4X2_FP4X2_B16,0.0%,1306.6176,flydsl_moe2_afp4_wfp4_bf16_t128x128x256_reduce_persist,0.0%,2386.3194,0,0,0,1555.05,885.85,
gfx950,256,1,3072,1536,256,8,ActivationType.Silu,torch.bfloat16,torch.float4_e2m1fn_x2,torch.float4_e2m1fn_x2,QuantType.per_1x32,1,0,separated,32,0,16.3186,flydsl_moe1_afp4_wfp4_bf16_t32x64x256_w4,0.0%,9.2725,moe_ck2stages_gemm2_256x32x128x128_1x4_MulABScaleExpertWeightShuffled_v3_Nswizzle0_Quant3_MulRoutedWeight1_FP4X2_FP4X2_B16,1.2%,25.5911,0,0,0,8.85,141607.35,
gfx950,256,2,3072,1536,256,8,ActivationType.Silu,torch.bfloat16,torch.float4_e2m1fn_x2,torch.float4_e2m1fn_x2,QuantType.per_1x32,1,0,separated,32,0,20.0622,flydsl_moe1_afp4_wfp4_bf16_t32x64x256_w4,0.0%,14.9386,moe_ck2stages_gemm2_256x32x128x128_1x4_MulABScaleExpertWeightShuffled_v3_Nswizzle0_Quant3_MulRoutedWeight1_FP4X2_FP4X2_B16,1.3%,35.0008,0,0,0,12.94,103537.55,
gfx950,256,4,3072,1536,256,8,ActivationType.Silu,torch.bfloat16,torch.float4_e2m1fn_x2,torch.float4_e2m1fn_x2,QuantType.per_1x32,1,0,separated,32,0,27.3858,flydsl_moe1_afp4_wfp4_bf16_t32x64x256_w4_fp4,19.4%,20.3684,flydsl_moe2_afp4_wfp4_bf16_t32x128x256_atomic,1.2%,47.7542,0,0,0,18.97,75886.84,
gfx950,256,8,3072,1536,256,8,ActivationType.Silu,torch.bfloat16,torch.float4_e2m1fn_x2,torch.float4_e2m1fn_x2,QuantType.per_1x32,1,0,separated,32,0,48.5723,flydsl_moe1_afp4_wfp4_bf16_t32x128x256_w4_fp4,19.4%,33.1983,flydsl_moe2_afp4_wfp4_bf16_t32x256x256_atomic,1.1%,81.7706,0,0,0,22.16,44318.53,
gfx950,256,16,3072,1536,256,8,ActivationType.Silu,torch.bfloat16,torch.float4_e2m1fn_x2,torch.float4_e2m1fn_x2,QuantType.per_1x32,1,0,separated,32,0,88.1776,flydsl_moe1_afp4_wfp4_bf16_t32x128x256_w3,0.0%,51.9006,flydsl_moe2_afp4_wfp4_bf16_t32x256x256_atomic,1.2%,140.0782,0,0,0,25.87,25871.45,
gfx950,256,32,3072,1536,256,8,ActivationType.Silu,torch.bfloat16,torch.float4_e2m1fn_x2,torch.float4_e2m1fn_x2,QuantType.per_1x32,1,0,separated,32,0,131.8303,flydsl_moe1_afp4_wfp4_bf16_t32x128x256_w4,0.0%,75.0333,flydsl_moe2_afp4_wfp4_bf16_t16x256x256_atomic_sbm32,1.1%,206.8636,0,0,0,35.04,17519.63,
gfx950,256,64,3072,1536,256,8,ActivationType.Silu,torch.bfloat16,torch.float4_e2m1fn_x2,torch.float4_e2m1fn_x2,QuantType.per_1x32,1,0,separated,32,0,179.33669999999998,flydsl_moe1_afp4_wfp4_bf16_t32x128x256_w4,0.0%,101.3682,flydsl_moe2_afp4_wfp4_bf16_t16x128x256_atomic_persist_sbm32,1.2%,280.7049,0,0,0,51.64,12912.02,
gfx950,256,128,3072,1536,256,8,ActivationType.Silu,torch.bfloat16,torch.float4_e2m1fn_x2,torch.float4_e2m1fn_x2,QuantType.per_1x32,1,0,separated,32,0,194.1204,flydsl_moe1_afp4_wfp4_bf16_t32x128x256_w3_fp4,18.2%,114.4731,flydsl_moe2_afp4_wfp4_bf16_t16x128x256_atomic_sbm32,1.2%,308.5935,0,0,0,93.95,11747.03,
gfx950,256,256,3072,1536,256,8,ActivationType.Silu,torch.bfloat16,torch.float4_e2m1fn_x2,torch.float4_e2m1fn_x2,QuantType.per_1x32,1,0,separated,32,0,198.7877,flydsl_moe1_afp4_wfp4_bf16_t32x128x256_w4_fp4,18.1%,118.0959,flydsl_moe2_afp4_wfp4_bf16_t32x256x256_atomic,1.2%,316.8836,0,0,0,182.98,11443.44,
gfx950,256,512,3072,1536,256,8,ActivationType.Silu,torch.bfloat16,torch.float4_e2m1fn_x2,torch.float4_e2m1fn_x2,QuantType.per_1x32,1,0,separated,32,0,202.3344,flydsl_moe1_afp4_wfp4_bf16_t32x128x256_w2_fp4,18.1%,120.9485,flydsl_moe2_afp4_wfp4_bf16_t32x128x256_atomic,1.2%,323.2829,0,0,0,358.71,11224.22,
gfx950,256,1024,3072,1536,256,8,ActivationType.Silu,torch.bfloat16,torch.float4_e2m1fn_x2,torch.float4_e2m1fn_x2,QuantType.per_1x32,1,0,separated,64,0,213.101,flydsl_moe1_afp4_wfp4_bf16_t64x128x256_w4_fp4,18.0%,135.3613,flydsl_moe2_afp4_wfp4_bf16_t64x128x256_atomic_persist,1.2%,348.4623,0,0,0,665.58,10426.71,
gfx950,256,2048,3072,1536,256,8,ActivationType.Silu,torch.bfloat16,torch.float4_e2m1fn_x2,torch.float4_e2m1fn_x2,QuantType.per_1x32,1,0,separated,128,0,292.03860000000003,flydsl_moe1_afp4_wfp4_bf16_t128x128x256,0.0%,183.7217,flydsl_moe2_afp4_wfp4_bf16_t64x128x256_atomic_sbm128,1.2%,475.7603,0,0,0,974.98,7656.7,
gfx950,256,4096,3072,1536,256,8,ActivationType.Silu,torch.bfloat16,torch.float4_e2m1fn_x2,torch.float4_e2m1fn_x2,QuantType.per_1x32,1,0,separated,128,0,416.9723,moe_ck2stages_gemm1_256x128x128x128_1x4_MulABScaleShuffled_v3_Nswizzle0_Quant3_MulRoutedWeight0_silu_FP4X2_FP4X2_B16,0.0%,283.5614,flydsl_moe2_afp4_wfp4_bf16_t64x128x256_atomic_sbm128,1.2%,700.5337,0,0,0,1324.29,5226.91,
gfx950,256,8192,3072,1536,256,8,ActivationType.Silu,torch.bfloat16,torch.float4_e2m1fn_x2,torch.float4_e2m1fn_x2,QuantType.per_1x32,1,0,separated,128,0,652.3389,moe_ck2stages_gemm1_256x128x128x128_1x4_MulABScaleShuffled_v3_Nswizzle0_Quant3_MulRoutedWeight0_silu_FP4X2_FP4X2_B16,0.0%,516.9253,flydsl_moe2_afp4_wfp4_bf16_t64x128x256_atomic_sbm128,1.2%,1169.2642,0,0,0,1586.83,3163.85,
gfx950,256,16384,3072,1536,256,8,ActivationType.Silu,torch.bfloat16,torch.float4_e2m1fn_x2,torch.float4_e2m1fn_x2,QuantType.per_1x32,1,0,separated,128,0,1101.1593,moe_ck2stages_gemm1_256x128x128x128_1x4_MulABScaleShuffled_v3_Nswizzle0_Quant3_MulRoutedWeight0_silu_FP4X2_FP4X2_B16,0.0%,1001.7505,flydsl_moe2_afp4_wfp4_bf16_t64x128x256_atomic_persist_sbm128,1.2%,2102.9098,0,0,0,1764.63,1795.07,
gfx950,256,32768,3072,1536,256,8,ActivationType.Silu,torch.bfloat16,torch.float4_e2m1fn_x2,torch.float4_e2m1fn_x2,QuantType.per_1x32,1,0,separated,128,0,2010.7428,moe_ck2stages_gemm1_256x128x128x128_1x4_MulABScaleShuffled_v3_Nswizzle0_Quant3_MulRoutedWeight0_silu_FP4X2_FP4X2_B16,0.0%,2008.0011,flydsl_moe2_afp4_wfp4_bf16_t64x128x256_atomic_persist_sbm128,1.2%,4018.7439,0,0,0,1846.77,976.89,
gfx950,256,1,3072,256,256,8,ActivationType.Silu,torch.bfloat16,torch.float4_e2m1fn_x2,torch.float4_e2m1fn_x2,QuantType.per_1x32,1,0,separated,32,0,15.822399999999998,moe_ck2stages_gemm1_64x32x32x128_1x1_MulABScaleShuffled_v3_Nswizzle0_Quant3_MulRoutedWeight0_silu_FP4X2_FP4X2_B16,0.0,6.4582,moe_ck2stages_gemm2_64x32x32x128_1x1_MulABScaleExpertWeightShuffled_v1_Nswizzle0_Quant3_MulRoutedWeight1_FP4X2_FP4X2_B16,0.0003,22.2806,0,0,0,0.0,0.0,flydsl_fallback
gfx950,256,2,3072,256,256,8,ActivationType.Silu,torch.bfloat16,torch.float4_e2m1fn_x2,torch.float4_e2m1fn_x2,QuantType.per_1x32,1,0,separated,32,0,15.7738,moe_ck2stages_gemm1_64x32x32x128_1x1_MulABScaleShuffled_v3_Nswizzle0_Quant3_MulRoutedWeight0_silu_FP4X2_FP4X2_B16,0.0,7.7726,moe_ck2stages_gemm2_64x32x32x128_1x1_MulABScaleExpertWeightShuffled_v1_Nswizzle0_Quant3_MulRoutedWeight1_FP4X2_FP4X2_B16,0.0002,23.5464,0,0,0,0.0,0.0,flydsl_fallback
gfx950,256,4,3072,256,256,8,ActivationType.Silu,torch.bfloat16,torch.float4_e2m1fn_x2,torch.float4_e2m1fn_x2,QuantType.per_1x32,1,0,separated,32,0,16.4456,moe_ck2stages_gemm1_64x32x32x128_1x1_MulABScaleShuffled_v3_Nswizzle0_Quant3_MulRoutedWeight0_silu_FP4X2_FP4X2_B16,0.0,8.4397,moe_ck2stages_gemm2_256x32x128x128_1x4_MulABScaleExpertWeightShuffled_v3_Nswizzle0_Quant3_MulRoutedWeight1_FP4X2_FP4X2_B16,0.0007,24.8853,0,0,0,0.0,0.0,flydsl_fallback
gfx950,256,8,3072,256,256,8,ActivationType.Silu,torch.bfloat16,torch.float4_e2m1fn_x2,torch.float4_e2m1fn_x2,QuantType.per_1x32,1,0,separated,32,0,19.4496,moe_ck2stages_gemm1_64x32x32x128_1x1_MulABScaleShuffled_v3_Nswizzle0_Quant3_MulRoutedWeight0_silu_FP4X2_FP4X2_B16,0.0,11.0332,moe_ck2stages_gemm2_64x32x32x128_1x1_MulABScaleExpertWeightShuffled_v1_Nswizzle0_Quant3_MulRoutedWeight1_FP4X2_FP4X2_B16,0.0002,30.4828,0,0,0,0.0,0.0,flydsl_fallback
gfx950,256,16,3072,256,256,8,ActivationType.Silu,torch.bfloat16,torch.float4_e2m1fn_x2,torch.float4_e2m1fn_x2,QuantType.per_1x32,1,0,separated,32,0,24.657,moe_ck2stages_gemm1_64x32x32x128_1x1_MulABScaleShuffled_v3_Nswizzle0_Quant3_MulRoutedWeight0_silu_FP4X2_FP4X2_B16,0.0,17.2158,moe_ck2stages_gemm2_64x32x32x128_1x1_MulABScaleExpertWeightShuffled_v1_Nswizzle0_Quant3_MulRoutedWeight1_FP4X2_FP4X2_B16,0.0002,41.8728,0,0,0,0.0,0.0,flydsl_fallback
gfx950,256,32,3072,256,256,8,ActivationType.Silu,torch.bfloat16,torch.float4_e2m1fn_x2,torch.float4_e2m1fn_x2,QuantType.per_1x32,1,0,separated,32,0,31.5703,moe_ck2stages_gemm1_64x32x32x128_1x1_MulABScaleShuffled_v3_Nswizzle0_Quant3_MulRoutedWeight0_silu_FP4X2_FP4X2_B16,0.0,20.7888,moe_ck2stages_gemm2_64x32x32x128_1x1_MulABScaleExpertWeightShuffled_v1_Nswizzle0_Quant3_MulRoutedWeight1_FP4X2_FP4X2_B16,0.0003,52.3591,0,0,0,0.0,0.0,flydsl_fallback
gfx950,256,64,3072,256,256,8,ActivationType.Silu,torch.bfloat16,torch.float4_e2m1fn_x2,torch.float4_e2m1fn_x2,QuantType.per_1x32,1,0,separated,32,0,41.2001,moe_ck2stages_gemm1_256x32x128x128_1x4_MulABScaleShuffled_v3_Nswizzle0_Quant3_MulRoutedWeight0_silu_FP4X2_FP4X2_B16,0.0,26.2499,moe_ck2stages_gemm2_64x32x32x128_1x1_MulABScaleExpertWeightShuffled_v1_Nswizzle0_Quant3_MulRoutedWeight1_FP4X2_FP4X2_B16,0.0004,67.45,0,0,0,0.0,0.0,flydsl_fallback
gfx950,256,128,3072,256,256,8,ActivationType.Silu,torch.bfloat16,torch.float4_e2m1fn_x2,torch.float4_e2m1fn_x2,QuantType.per_1x32,1,0,separated,32,0,44.9364,moe_ck2stages_gemm1_256x32x128x128_1x4_MulABScaleShuffled_v3_Nswizzle0_Quant3_MulRoutedWeight0_silu_FP4X2_FP4X2_B16,0.0,28.9309,moe_ck2stages_gemm2_64x32x32x128_1x1_MulABScaleExpertWeightShuffled_v1_Nswizzle0_Quant3_MulRoutedWeight1_FP4X2_FP4X2_B16,0.0003,73.8673,0,0,0,0.0,0.0,flydsl_fallback
gfx950,256,256,3072,256,256,8,ActivationType.Silu,torch.bfloat16,torch.float4_e2m1fn_x2,torch.float4_e2m1fn_x2,QuantType.per_1x32,1,0,separated,32,0,45.4038,moe_ck2stages_gemm1_256x32x128x128_1x4_MulABScaleShuffled_v3_Nswizzle0_Quant3_MulRoutedWeight0_silu_FP4X2_FP4X2_B16,0.0,30.907,moe_ck2stages_gemm2_64x32x32x128_1x1_MulABScaleExpertWeightShuffled_v1_Nswizzle0_Quant3_MulRoutedWeight1_FP4X2_FP4X2_B16,0.0003,76.3108,0,0,0,0.0,0.0,flydsl_fallback
gfx950,256,512,3072,256,256,8,ActivationType.Silu,torch.bfloat16,torch.float4_e2m1fn_x2,torch.float4_e2m1fn_x2,QuantType.per_1x32,1,0,separated,32,0,47.478,moe_ck2stages_gemm1_256x32x128x128_1x4_MulABScaleShuffled_v3_Nswizzle0_Quant3_MulRoutedWeight0_silu_FP4X2_FP4X2_B16,0.0,33.9407,moe_ck2stages_gemm2_64x32x32x128_1x1_MulABScaleExpertWeightShuffled_v1_Nswizzle0_Quant3_MulRoutedWeight1_FP4X2_FP4X2_B16,0.0003,81.4187,0,0,0,0.0,0.0,flydsl_fallback
gfx950,256,1024,3072,256,256,8,ActivationType.Silu,torch.bfloat16,torch.float4_e2m1fn_x2,torch.float4_e2m1fn_x2,QuantType.per_1x32,1,0,separated,32,0,53.3662,moe_ck2stages_gemm1_64x32x32x128_1x1_MulABScaleShuffled_v3_Nswizzle0_Quant3_MulRoutedWeight0_silu_FP4X2_FP4X2_B16,0.0,52.4881,moe_ck2stages_gemm2_64x32x32x128_1x1_MulABScaleExpertWeightShuffled_v1_Nswizzle0_Quant3_MulRoutedWeight1_FP4X2_FP4X2_B16,0.0003,105.8543,0,0,0,0.0,0.0,flydsl_fallback
gfx950,256,2048,3072,256,256,8,ActivationType.Silu,torch.bfloat16,torch.float4_e2m1fn_x2,torch.float4_e2m1fn_x2,QuantType.per_1x32,1,0,separated,32,0,72.463,moe_ck2stages_gemm1_64x32x32x128_1x1_MulABScaleShuffled_v3_Nswizzle0_Quant3_MulRoutedWeight0_silu_FP4X2_FP4X2_B16,0.0,94.7681,moe_ck2stages_gemm2_64x32x32x128_1x1_MulABScaleExpertWeightShuffled_v1_Nswizzle0_Quant3_MulRoutedWeight1_FP4X2_FP4X2_B16,0.0003,167.2311,0,0,0,0.0,0.0,flydsl_fallback
gfx950,256,4096,3072,256,256,8,ActivationType.Silu,torch.bfloat16,torch.float4_e2m1fn_x2,torch.float4_e2m1fn_x2,QuantType.per_1x32,1,0,separated,128,0,94.5862,moe_ck2stages_gemm1_256x128x128x128_1x4_MulABScaleShuffled_v3_Nswizzle0_Quant3_MulRoutedWeight0_silu_FP4X2_FP4X2_B16,0.0,177.1616,moe_ck2stages_gemm2_64x128x128x128_1x1_MulABScaleExpertWeightShuffled_v3_Nswizzle0_Quant3_MulRoutedWeight1_FP4X2_FP4X2_B16,0.0003,271.7478,0,0,0,0.0,0.0,flydsl_fallback
gfx950,256,8192,3072,256,256,8,ActivationType.Silu,torch.bfloat16,torch.float4_e2m1fn_x2,torch.float4_e2m1fn_x2,QuantType.per_1x32,1,0,separated,128,0,148.3411,moe_ck2stages_gemm1_256x128x128x128_1x4_MulABScaleShuffled_v3_Nswizzle0_Quant3_MulRoutedWeight0_silu_FP4X2_FP4X2_B16,0.0,331.0268,moe_ck2stages_gemm2_64x128x128x128_1x1_MulABScaleExpertWeightShuffled_v3_Nswizzle0_Quant3_MulRoutedWeight1_FP4X2_FP4X2_B16,0.0003,479.3679,0,0,0,0.0,0.0,flydsl_fallback
gfx950,256,16384,3072,256,256,8,ActivationType.Silu,torch.bfloat16,torch.float4_e2m1fn_x2,torch.float4_e2m1fn_x2,QuantType.per_1x32,1,0,separated,128,0,250.5205,moe_ck2stages_gemm1_256x128x128x128_1x4_MulABScaleShuffled_v3_Nswizzle0_Quant3_MulRoutedWeight0_silu_FP4X2_FP4X2_B16,0.0,645.2009,moe_ck2stages_gemm2_64x128x128x128_1x1_MulABScaleExpertWeightShuffled_v3_Nswizzle0_Quant3_MulRoutedWeight1_FP4X2_FP4X2_B16,0.0003,895.7214,0,0,0,0.0,0.0,flydsl_fallback
gfx950,256,32768,3072,256,256,8,ActivationType.Silu,torch.bfloat16,torch.float4_e2m1fn_x2,torch.float4_e2m1fn_x2,QuantType.per_1x32,1,0,separated,128,0,406.5933,moe_ck2stages_gemm1_256x128x128x128_1x4_MulABScaleShuffled_v3_Nswizzle0_Quant3_MulRoutedWeight0_silu_FP4X2_FP4X2_B16,0.0,1277.0267,moe_ck2stages_gemm2_64x128x128x128_1x1_MulABScaleExpertWeightShuffled_v3_Nswizzle0_Quant3_MulRoutedWeight1_FP4X2_FP4X2_B16,0.0003,1683.62,0,0,0,0.0,0.0,flydsl_fallback
gfx950,256,1,3072,768,256,8,ActivationType.Silu,torch.bfloat16,torch.float4_e2m1fn_x2,torch.float4_e2m1fn_x2,QuantType.per_1x32,1,0,separated,32,0,15.162,moe_ck2stages_gemm1_64x32x32x128_1x1_MulABScaleShuffled_v3_Nswizzle0_Quant3_MulRoutedWeight0_silu_FP4X2_FP4X2_B16,0.0,7.6223,moe_ck2stages_gemm2_256x32x128x128_1x4_MulABScaleExpertWeightShuffled_v3_Nswizzle0_Quant3_MulRoutedWeight1_FP4X2_FP4X2_B16,0.0055,22.7843,0,0,0,0.0,0.0,flydsl_fallback
gfx950,256,2,3072,768,256,8,ActivationType.Silu,torch.bfloat16,torch.float4_e2m1fn_x2,torch.float4_e2m1fn_x2,QuantType.per_1x32,1,0,separated,32,0,16.2291,moe_ck2stages_gemm1_64x32x32x128_1x1_MulABScaleShuffled_v3_Nswizzle0_Quant3_MulRoutedWeight0_silu_FP4X2_FP4X2_B16,0.0,9.6064,moe_ck2stages_gemm2_256x32x128x128_1x4_MulABScaleExpertWeightShuffled_v3_Nswizzle0_Quant3_MulRoutedWeight1_FP4X2_FP4X2_B16,0.0036,25.8355,0,0,0,0.0,0.0,flydsl_fallback
gfx950,256,4,3072,768,256,8,ActivationType.Silu,torch.bfloat16,torch.float4_e2m1fn_x2,torch.float4_e2m1fn_x2,QuantType.per_1x32,1,0,separated,32,0,20.4781,moe_ck2stages_gemm1_64x32x32x128_1x1_MulABScaleShuffled_v3_Nswizzle0_Quant3_MulRoutedWeight0_silu_FP4X2_FP4X2_B16,0.0,14.8831,moe_ck2stages_gemm2_256x32x128x128_1x4_MulABScaleExpertWeightShuffled_v3_Nswizzle0_Quant3_MulRoutedWeight1_FP4X2_FP4X2_B16,0.0029,35.3612,0,0,0,0.0,0.0,flydsl_fallback
gfx950,256,8,3072,768,256,8,ActivationType.Silu,torch.bfloat16,torch.float4_e2m1fn_x2,torch.float4_e2m1fn_x2,QuantType.per_1x32,1,0,separated,32,0,33.9922,moe_ck2stages_gemm1_64x32x32x128_1x1_MulABScaleShuffled_v3_Nswizzle0_Quant3_MulRoutedWeight0_silu_FP4X2_FP4X2_B16,0.0,21.3895,moe_ck2stages_gemm2_256x32x128x128_1x4_MulABScaleExpertWeightShuffled_v3_Nswizzle0_Quant3_MulRoutedWeight1_FP4X2_FP4X2_B16,0.0035,55.3817,0,0,0,0.0,0.0,flydsl_fallback
gfx950,256,16,3072,768,256,8,ActivationType.Silu,torch.bfloat16,torch.float4_e2m1fn_x2,torch.float4_e2m1fn_x2,QuantType.per_1x32,1,0,separated,32,0,54.139700000000005,moe_ck2stages_gemm1_64x32x32x128_1x1_MulABScaleShuffled_v3_Nswizzle0_Quant3_MulRoutedWeight0_silu_FP4X2_FP4X2_B16,0.0,29.8316,moe_ck2stages_gemm2_256x32x128x128_1x4_MulABScaleExpertWeightShuffled_v3_Nswizzle0_Quant3_MulRoutedWeight1_FP4X2_FP4X2_B16,0.003,83.9713,0,0,0,0.0,0.0,flydsl_fallback
gfx950,256,32,3072,768,256,8,ActivationType.Silu,torch.bfloat16,torch.float4_e2m1fn_x2,torch.float4_e2m1fn_x2,QuantType.per_1x32,1,0,separated,32,0,78.5714,moe_ck2stages_gemm1_64x32x32x128_1x1_MulABScaleShuffled_v3_Nswizzle0_Quant3_MulRoutedWeight0_silu_FP4X2_FP4X2_B16,0.0,41.4478,moe_ck2stages_gemm2_256x32x128x128_1x4_MulABScaleExpertWeightShuffled_v3_Nswizzle0_Quant3_MulRoutedWeight1_FP4X2_FP4X2_B16,0.0036,120.0192,0,0,0,0.0,0.0,flydsl_fallback
gfx950,256,64,3072,768,256,8,ActivationType.Silu,torch.bfloat16,torch.float4_e2m1fn_x2,torch.float4_e2m1fn_x2,QuantType.per_1x32,1,0,separated,32,0,107.5981,moe_ck2stages_gemm1_64x32x32x128_1x1_MulABScaleShuffled_v3_Nswizzle0_Quant3_MulRoutedWeight0_silu_FP4X2_FP4X2_B16,0.0,55.2186,moe_ck2stages_gemm2_256x32x128x128_1x4_MulABScaleExpertWeightShuffled_v3_Nswizzle0_Quant3_MulRoutedWeight1_FP4X2_FP4X2_B16,0.0038,162.8167,0,0,0,0.0,0.0,flydsl_fallback
gfx950,256,128,3072,768,256,8,ActivationType.Silu,torch.bfloat16,torch.float4_e2m1fn_x2,torch.float4_e2m1fn_x2,QuantType.per_1x32,1,0,separated,32,0,116.2064,moe_ck2stages_gemm1_64x32x32x128_1x1_MulABScaleShuffled_v3_Nswizzle0_Quant3_MulRoutedWeight0_silu_FP4X2_FP4X2_B16,0.0,61.8298,moe_ck2stages_gemm2_256x32x128x128_1x4_MulABScaleExpertWeightShuffled_v3_Nswizzle0_Quant3_MulRoutedWeight1_FP4X2_FP4X2_B16,0.0039,178.0362,0,0,0,0.0,0.0,flydsl_fallback
gfx950,256,256,3072,768,256,8,ActivationType.Silu,torch.bfloat16,torch.float4_e2m1fn_x2,torch.float4_e2m1fn_x2,QuantType.per_1x32,1,0,separated,32,0,120.852,moe_ck2stages_gemm1_256x32x128x128_1x4_MulABScaleShuffled_v3_Nswizzle0_Quant3_MulRoutedWeight0_silu_FP4X2_FP4X2_B16,0.0,65.2198,moe_ck2stages_gemm2_256x32x128x128_1x4_MulABScaleExpertWeightShuffled_v3_Nswizzle0_Quant3_MulRoutedWeight1_FP4X2_FP4X2_B16,0.004,186.0718,0,0,0,0.0,0.0,flydsl_fallback
gfx950,256,512,3072,768,256,8,ActivationType.Silu,torch.bfloat16,torch.float4_e2m1fn_x2,torch.float4_e2m1fn_x2,QuantType.per_1x32,1,0,separated,32,0,121.1938,moe_ck2stages_gemm1_64x32x32x128_1x1_MulABScaleShuffled_v3_Nswizzle0_Quant3_MulRoutedWeight0_silu_FP4X2_FP4X2_B16,0.0,72.3051,moe_ck2stages_gemm2_256x32x128x128_1x4_MulABScaleExpertWeightShuffled_v3_Nswizzle0_Quant3_MulRoutedWeight1_FP4X2_FP4X2_B16,0.0041,193.4989,0,0,0,0.0,0.0,flydsl_fallback
gfx950,256,1024,3072,768,256,8,ActivationType.Silu,torch.bfloat16,torch.float4_e2m1fn_x2,torch.float4_e2m1fn_x2,QuantType.per_1x32,1,0,separated,64,0,134.0291,moe_ck2stages_gemm1_256x64x128x128_1x4_MulABScaleShuffled_v3_Nswizzle0_Quant3_MulRoutedWeight0_silu_FP4X2_FP4X2_B16,0.0,99.4503,moe_ck2stages_gemm2_256x64x128x128_1x4_MulABScaleExpertWeightShuffled_v3_Nswizzle0_Quant3_MulRoutedWeight1_FP4X2_FP4X2_B16,0.0041,233.4794,0,0,0,0.0,0.0,flydsl_fallback
gfx950,256,2048,3072,768,256,8,ActivationType.Silu,torch.bfloat16,torch.float4_e2m1fn_x2,torch.float4_e2m1fn_x2,QuantType.per_1x32,1,0,separated,128,0,166.1331,moe_ck2stages_gemm1_256x128x128x128_1x4_MulABScaleShuffled_v3_Nswizzle0_Quant3_MulRoutedWeight0_silu_FP4X2_FP4X2_B16,0.0,185.3013,moe_ck2stages_gemm2_256x128x128x128_1x4_MulABScaleExpertWeightShuffled_v3_Nswizzle0_Quant3_MulRoutedWeight1_FP4X2_FP4X2_B16,0.0041,351.4344,0,0,0,0.0,0.0,flydsl_fallback
gfx950,256,4096,3072,768,256,8,ActivationType.Silu,torch.bfloat16,torch.float4_e2m1fn_x2,torch.float4_e2m1fn_x2,QuantType.per_1x32,1,0,separated,128,0,225.759,moe_ck2stages_gemm1_256x128x128x128_1x4_MulABScaleShuffled_v3_Nswizzle0_Quant3_MulRoutedWeight0_silu_FP4X2_FP4X2_B16,0.0,342.7159,moe_ck2stages_gemm2_256x128x128x128_1x4_MulABScaleExpertWeightShuffled_v3_Nswizzle0_Quant3_MulRoutedWeight1_FP4X2_FP4X2_B16,0.004,568.4749,0,0,0,0.0,0.0,flydsl_fallback
gfx950,256,8192,3072,768,256,8,ActivationType.Silu,torch.bfloat16,torch.float4_e2m1fn_x2,torch.float4_e2m1fn_x2,QuantType.per_1x32,1,0,separated,128,0,388.9514,moe_ck2stages_gemm1_256x128x128x128_1x4_MulABScaleShuffled_v3_Nswizzle0_Quant3_MulRoutedWeight0_silu_FP4X2_FP4X2_B16,0.0,660.6771,moe_ck2stages_gemm2_256x128x128x128_1x4_MulABScaleExpertWeightShuffled_v3_Nswizzle0_Quant3_MulRoutedWeight1_FP4X2_FP4X2_B16,0.004,1049.6285,0,0,0,0.0,0.0,flydsl_fallback
gfx950,256,16384,3072,768,256,8,ActivationType.Silu,torch.bfloat16,torch.float4_e2m1fn_x2,torch.float4_e2m1fn_x2,QuantType.per_1x32,1,0,separated,64,0,662.8634999999999,moe_ck2stages_gemm1_256x64x128x128_1x4_MulABScaleShuffled_v3_Nswizzle0_Quant3_MulRoutedWeight0_silu_FP4X2_FP4X2_B16,0.0,1300.5837,moe_ck2stages_gemm2_256x64x128x128_1x4_MulABScaleExpertWeightShuffled_v3_Nswizzle0_Quant3_MulRoutedWeight1_FP4X2_FP4X2_B16,0.004,1963.4472,0,0,0,0.0,0.0,flydsl_fallback
gfx950,256,32768,3072,768,256,8,ActivationType.Silu,torch.bfloat16,torch.float4_e2m1fn_x2,torch.float4_e2m1fn_x2,QuantType.per_1x32,1,0,separated,128,0,1079.7018,moe_ck2stages_gemm1_256x128x128x128_1x4_MulABScaleShuffled_v3_Nswizzle0_Quant3_MulRoutedWeight0_silu_FP4X2_FP4X2_B16,0.0,2601.0423,moe_ck2stages_gemm2_256x128x128x128_1x4_MulABScaleExpertWeightShuffled_v3_Nswizzle0_Quant3_MulRoutedWeight1_FP4X2_FP4X2_B16,0.004,3680.7441,0,0,0,0.0,0.0,flydsl_fallback
gfx950,256,1,3072,1536,256,8,ActivationType.Silu,torch.bfloat16,torch.float4_e2m1fn_x2,torch.float4_e2m1fn_x2,QuantType.per_1x32,1,0,separated,32,0,16.6162,moe_ck2stages_gemm1_64x32x32x128_1x1_MulABScaleShuffled_v3_Nswizzle0_Quant3_MulRoutedWeight0_silu_FP4X2_FP4X2_B16,0.0,9.2725,moe_ck2stages_gemm2_256x32x128x128_1x4_MulABScaleExpertWeightShuffled_v3_Nswizzle0_Quant3_MulRoutedWeight1_FP4X2_FP4X2_B16,0.0117,25.8887,0,0,0,0.0,0.0,flydsl_fallback
gfx950,256,2,3072,1536,256,8,ActivationType.Silu,torch.bfloat16,torch.float4_e2m1fn_x2,torch.float4_e2m1fn_x2,QuantType.per_1x32,1,0,separated,32,0,20.6758,moe_ck2stages_gemm1_64x32x32x128_1x1_MulABScaleShuffled_v3_Nswizzle0_Quant3_MulRoutedWeight0_silu_FP4X2_FP4X2_B16,0.0,14.9386,moe_ck2stages_gemm2_256x32x128x128_1x4_MulABScaleExpertWeightShuffled_v3_Nswizzle0_Quant3_MulRoutedWeight1_FP4X2_FP4X2_B16,0.013,35.6144,0,0,0,0.0,0.0,flydsl_fallback
gfx950,256,4,3072,1536,256,8,ActivationType.Silu,torch.bfloat16,torch.float4_e2m1fn_x2,torch.float4_e2m1fn_x2,QuantType.per_1x32,1,0,separated,32,0,33.519400000000005,moe_ck2stages_gemm1_64x32x32x128_1x1_MulABScaleShuffled_v3_Nswizzle0_Quant3_MulRoutedWeight0_silu_FP4X2_FP4X2_B16,0.0,21.3341,moe_ck2stages_gemm2_256x32x128x128_1x4_MulABScaleExpertWeightShuffled_v3_Nswizzle0_Quant3_MulRoutedWeight1_FP4X2_FP4X2_B16,0.0125,54.8535,0,0,0,0.0,0.0,flydsl_fallback
gfx950,256,8,3072,1536,256,8,ActivationType.Silu,torch.bfloat16,torch.float4_e2m1fn_x2,torch.float4_e2m1fn_x2,QuantType.per_1x32,1,0,separated,32,0,57.3263,moe_ck2stages_gemm1_256x32x128x128_1x4_MulABScaleShuffled_v3_Nswizzle0_Quant3_MulRoutedWeight0_silu_FP4X2_FP4X2_B16,0.0,33.3764,moe_ck2stages_gemm2_256x32x128x128_1x4_MulABScaleExpertWeightShuffled_v3_Nswizzle0_Quant3_MulRoutedWeight1_FP4X2_FP4X2_B16,0.0109,90.7027,0,0,0,0.0,0.0,flydsl_fallback
gfx950,256,16,3072,1536,256,8,ActivationType.Silu,torch.bfloat16,torch.float4_e2m1fn_x2,torch.float4_e2m1fn_x2,QuantType.per_1x32,1,0,separated,32,0,97.6696,moe_ck2stages_gemm1_64x32x32x128_1x1_MulABScaleShuffled_v3_Nswizzle0_Quant3_MulRoutedWeight0_silu_FP4X2_FP4X2_B16,0.0,53.2868,moe_ck2stages_gemm2_256x32x128x128_1x4_MulABScaleExpertWeightShuffled_v3_Nswizzle0_Quant3_MulRoutedWeight1_FP4X2_FP4X2_B16,0.0112,150.9564,0,0,0,0.0,0.0,flydsl_fallback
gfx950,256,32,3072,1536,256,8,ActivationType.Silu,torch.bfloat16,torch.float4_e2m1fn_x2,torch.float4_e2m1fn_x2,QuantType.per_1x32,1,0,separated,32,0,147.1631,moe_ck2stages_gemm1_256x32x128x128_1x4_MulABScaleShuffled_v3_Nswizzle0_Quant3_MulRoutedWeight0_silu_FP4X2_FP4X2_B16,0.0,77.0028,moe_ck2stages_gemm2_256x32x128x128_1x4_MulABScaleExpertWeightShuffled_v3_Nswizzle0_Quant3_MulRoutedWeight1_FP4X2_FP4X2_B16,0.0115,224.1659,0,0,0,0.0,0.0,flydsl_fallback
gfx950,256,64,3072,1536,256,8,ActivationType.Silu,torch.bfloat16,torch.float4_e2m1fn_x2,torch.float4_e2m1fn_x2,QuantType.per_1x32,1,0,separated,32,0,199.9338,moe_ck2stages_gemm1_256x32x128x128_1x4_MulABScaleShuffled_v3_Nswizzle0_Quant3_MulRoutedWeight0_silu_FP4X2_FP4X2_B16,0.0,105.279,moe_ck2stages_gemm2_256x32x128x128_1x4_MulABScaleExpertWeightShuffled_v3_Nswizzle0_Quant3_MulRoutedWeight1_FP4X2_FP4X2_B16,0.0118,305.2128,0,0,0,0.0,0.0,flydsl_fallback
gfx950,256,128,3072,1536,256,8,ActivationType.Silu,torch.bfloat16,torch.float4_e2m1fn_x2,torch.float4_e2m1fn_x2,QuantType.per_1x32,1,0,separated,32,0,222.3086,moe_ck2stages_gemm1_256x32x128x128_1x4_MulABScaleShuffled_v3_Nswizzle0_Quant3_MulRoutedWeight0_silu_FP4X2_FP4X2_B16,0.0,117.3299,moe_ck2stages_gemm2_256x32x128x128_1x4_MulABScaleExpertWeightShuffled_v3_Nswizzle0_Quant3_MulRoutedWeight1_FP4X2_FP4X2_B16,0.0118,339.6385,0,0,0,0.0,0.0,flydsl_fallback
gfx950,256,256,3072,1536,256,8,ActivationType.Silu,torch.bfloat16,torch.float4_e2m1fn_x2,torch.float4_e2m1fn_x2,QuantType.per_1x32,1,0,separated,32,0,230.3872,moe_ck2stages_gemm1_64x32x32x128_1x1_MulABScaleShuffled_v3_Nswizzle0_Quant3_MulRoutedWeight0_silu_FP4X2_FP4X2_B16,0.0,121.6271,moe_ck2stages_gemm2_256x32x128x128_1x4_MulABScaleExpertWeightShuffled_v3_Nswizzle0_Quant3_MulRoutedWeight1_FP4X2_FP4X2_B16,0.0118,352.0143,0,0,0,0.0,0.0,flydsl_fallback
gfx950,256,512,3072,1536,256,8,ActivationType.Silu,torch.bfloat16,torch.float4_e2m1fn_x2,torch.float4_e2m1fn_x2,QuantType.per_1x32,1,0,separated,32,0,239.4028,moe_ck2stages_gemm1_256x32x128x128_1x4_MulABScaleShuffled_v3_Nswizzle0_Quant3_MulRoutedWeight0_silu_FP4X2_FP4X2_B16,0.0,127.7928,moe_ck2stages_gemm2_256x32x128x128_1x4_MulABScaleExpertWeightShuffled_v3_Nswizzle0_Quant3_MulRoutedWeight1_FP4X2_FP4X2_B16,0.0121,367.1956,0,0,0,0.0,0.0,flydsl_fallback
gfx950,256,1024,3072,1536,256,8,ActivationType.Silu,torch.bfloat16,torch.float4_e2m1fn_x2,torch.float4_e2m1fn_x2,QuantType.per_1x32,1,0,separated,64,0,253.7732,moe_ck2stages_gemm1_256x64x128x128_1x4_MulABScaleShuffled_v3_Nswizzle0_Quant3_MulRoutedWeight0_silu_FP4X2_FP4X2_B16,0.0,145.3242,moe_ck2stages_gemm2_256x64x128x128_1x4_MulABScaleExpertWeightShuffled_v3_Nswizzle0_Quant3_MulRoutedWeight1_FP4X2_FP4X2_B16,0.0124,399.0974,0,0,0,0.0,0.0,flydsl_fallback
gfx950,256,2048,3072,1536,256,8,ActivationType.Silu,torch.bfloat16,torch.float4_e2m1fn_x2,torch.float4_e2m1fn_x2,QuantType.per_1x32,1,0,separated,128,0,310.3729,moe_ck2stages_gemm1_256x128x128x128_1x4_MulABScaleShuffled_v3_Nswizzle0_Quant3_MulRoutedWeight0_silu_FP4X2_FP4X2_B16,0.0,211.6262,moe_ck2stages_gemm2_256x128x128x128_1x4_MulABScaleExpertWeightShuffled_v3_Nswizzle0_Quant3_MulRoutedWeight1_FP4X2_FP4X2_B16,0.0121,521.9991,0,0,0,0.0,0.0,flydsl_fallback
gfx950,256,4096,3072,1536,256,8,ActivationType.Silu,torch.bfloat16,torch.float4_e2m1fn_x2,torch.float4_e2m1fn_x2,QuantType.per_1x32,1,0,separated,128,0,416.9723,moe_ck2stages_gemm1_256x128x128x128_1x4_MulABScaleShuffled_v3_Nswizzle0_Quant3_MulRoutedWeight0_silu_FP4X2_FP4X2_B16,0.0,355.4646,moe_ck2stages_gemm2_256x128x128x128_1x4_MulABScaleExpertWeightShuffled_v3_Nswizzle0_Quant3_MulRoutedWeight1_FP4X2_FP4X2_B16,0.0122,772.4369,0,0,0,0.0,0.0,flydsl_fallback
gfx950,256,8192,3072,1536,256,8,ActivationType.Silu,torch.bfloat16,torch.float4_e2m1fn_x2,torch.float4_e2m1fn_x2,QuantType.per_1x32,1,0,separated,128,0,652.3389,moe_ck2stages_gemm1_256x128x128x128_1x4_MulABScaleShuffled_v3_Nswizzle0_Quant3_MulRoutedWeight0_silu_FP4X2_FP4X2_B16,0.0,679.4715,moe_ck2stages_gemm2_256x128x128x128_1x4_MulABScaleExpertWeightShuffled_v3_Nswizzle0_Quant3_MulRoutedWeight1_FP4X2_FP4X2_B16,0.0122,1331.8104,0,0,0,0.0,0.0,flydsl_fallback
gfx950,256,16384,3072,1536,256,8,ActivationType.Silu,torch.bfloat16,torch.float4_e2m1fn_x2,torch.float4_e2m1fn_x2,QuantType.per_1x32,1,0,separated,128,0,1101.1593,moe_ck2stages_gemm1_256x128x128x128_1x4_MulABScaleShuffled_v3_Nswizzle0_Quant3_MulRoutedWeight0_silu_FP4X2_FP4X2_B16,0.0,1331.8468,moe_ck2stages_gemm2_256x128x128x128_1x4_MulABScaleExpertWeightShuffled_v3_Nswizzle0_Quant3_MulRoutedWeight1_FP4X2_FP4X2_B16,0.0122,2433.0061,0,0,0,0.0,0.0,flydsl_fallback
gfx950,256,32768,3072,1536,256,8,ActivationType.Silu,torch.bfloat16,torch.float4_e2m1fn_x2,torch.float4_e2m1fn_x2,QuantType.per_1x32,1,0,separated,128,0,2010.7428,moe_ck2stages_gemm1_256x128x128x128_1x4_MulABScaleShuffled_v3_Nswizzle0_Quant3_MulRoutedWeight0_silu_FP4X2_FP4X2_B16,0.0,2645.6154,moe_ck2stages_gemm2_256x128x128x128_1x4_MulABScaleExpertWeightShuffled_v3_Nswizzle0_Quant3_MulRoutedWeight1_FP4X2_FP4X2_B16,0.0122,4656.3582,0,0,0,0.0,0.0,flydsl_fallback
gfx950,256,1,3072,1536,256,8,ActivationType.Silu,torch.bfloat16,torch.float4_e2m1fn_x2,torch.float4_e2m1fn_x2,QuantType.per_1x32,1,0,interleave,16,0,1908.3727,flydsl_mxfp4_g1_a4w4_16x256x256_inlinequant,0.0%,2523.2298,flydsl_mxfp4_g2_a4w4_16x256x256_topk8_atomic_nt,0.0%,4431.6025,0,0,0,0.05,817.74,
gfx950,256,2,3072,1536,256,8,ActivationType.Silu,torch.bfloat16,torch.float4_e2m1fn_x2,torch.float4_e2m1fn_x2,QuantType.per_1x32,1,0,interleave,16,0,1910.7285,flydsl_mxfp4_g1_a4w4_16x256x256_inlinequant,0.0%,2532.1584,flydsl_mxfp4_g2_a4w4_16x256x256_topk8_atomic_nt,0.0%,4442.8869,0,0,0,0.1,815.66,
gfx950,256,4,3072,1536,256,8,ActivationType.Silu,torch.bfloat16,torch.float4_e2m1fn_x2,torch.float4_e2m1fn_x2,QuantType.per_1x32,1,0,interleave,16,0,1922.5476,flydsl_mxfp4_g1_a4w4_16x256x256_inlinequant,0.0%,2550.9143,flydsl_mxfp4_g2_a4w4_16x256x256_topk8_atomic_nt,0.0%,4473.4619,0,0,0,0.2,810.09,
gfx950,256,8,3072,1536,256,8,ActivationType.Silu,torch.bfloat16,torch.float4_e2m1fn_x2,torch.float4_e2m1fn_x2,QuantType.per_1x32,1,0,interleave,16,0,1949.4868,flydsl_mxfp4_g1_a4w4_16x256x256_inlinequant,0.0%,2580.6345,flydsl_mxfp4_g2_a4w4_16x256x256_topk8_atomic_nt,0.0%,4530.1213,0,0,0,0.4,799.97,
gfx950,256,16,3072,1536,256,8,ActivationType.Silu,torch.bfloat16,torch.float4_e2m1fn_x2,torch.float4_e2m1fn_x2,QuantType.per_1x32,1,0,interleave,16,0,1981.5923,flydsl_mxfp4_g1_a4w4_16x256x256_inlinequant,0.0%,2627.3339,flydsl_mxfp4_g2_a4w4_16x256x256_topk8_atomic_nt,0.0%,4608.9262,0,0,0,0.79,786.31,
gfx950,256,32,3072,1536,256,8,ActivationType.Silu,torch.bfloat16,torch.float4_e2m1fn_x2,torch.float4_e2m1fn_x2,QuantType.per_1x32,1,0,interleave,16,0,2024.6643,flydsl_mxfp4_g1_a4w4_16x256x256_inlinequant,0.0%,2699.8019,flydsl_mxfp4_g2_a4w4_16x256x256_topk8_atomic_nt,0.0%,4724.4662,0,0,0,1.53,767.11,
gfx950,256,64,3072,1536,256,8,ActivationType.Silu,torch.bfloat16,torch.float4_e2m1fn_x2,torch.float4_e2m1fn_x2,QuantType.per_1x32,1,0,interleave,16,0,2078.4395,flydsl_mxfp4_g1_a4w4_16x256x256_inlinequant,0.0%,2771.5499,flydsl_mxfp4_g2_a4w4_16x256x256_topk8_atomic_nt,0.0%,4849.9894,0,0,0,2.99,747.31,
gfx950,256,128,3072,1536,256,8,ActivationType.Silu,torch.bfloat16,torch.float4_e2m1fn_x2,torch.float4_e2m1fn_x2,QuantType.per_1x32,1,0,interleave,16,0,2090.0122,flydsl_mxfp4_g1_a4w4_16x256x256_inlinequant,0.0%,2797.8006,flydsl_mxfp4_g2_a4w4_16x256x256_topk8_atomic_nt,0.0%,4887.8128,0,0,0,5.93,741.65,
gfx950,256,256,3072,1536,256,8,ActivationType.Silu,torch.bfloat16,torch.float4_e2m1fn_x2,torch.float4_e2m1fn_x2,QuantType.per_1x32,1,0,interleave,32,0,2112.1074,flydsl_mxfp4_g1_a4w4_32x256x256_nt,0.0%,2863.1783,flydsl_mxfp4_g2_a4w4_32x256x256_topk8_atomic_nt,0.0%,4975.2857,0,0,0,11.65,728.85,
gfx950,256,512,3072,1536,256,8,ActivationType.Silu,torch.bfloat16,torch.float4_e2m1fn_x2,torch.float4_e2m1fn_x2,QuantType.per_1x32,1,0,interleave,32,0,2115.4547,flydsl_mxfp4_g1_a4w4_32x256x256_nt,0.0%,2862.0709,flydsl_mxfp4_g2_a4w4_32x256x256_topk8_atomic_nt,0.0%,4977.5256,0,0,0,23.3,729.0,
gfx950,256,1024,3072,1536,256,8,ActivationType.Silu,torch.bfloat16,torch.float4_e2m1fn_x2,torch.float4_e2m1fn_x2,QuantType.per_1x32,1,0,interleave,32,0,2195.4091,flydsl_mxfp4_g1_a4w4_32x256x256_cached,0.0%,2953.1623,flydsl_mxfp4_g2_a4w4_32x256x256_topk8_atomic,0.0%,5148.5714,0,0,0,45.05,705.69,
gfx950,256,2048,3072,1536,256,8,ActivationType.Silu,torch.bfloat16,torch.float4_e2m1fn_x2,torch.float4_e2m1fn_x2,QuantType.per_1x32,1,0,interleave,32,0,2314.9533,flydsl_mxfp4_g1_a4w4_32x256x256_cached,0.0%,3137.8691,flydsl_mxfp4_g2_a4w4_32x256x256_topk8_atomic,0.0%,5452.8224,0,0,0,85.07,668.05,
gfx950,256,4096,3072,1536,256,8,ActivationType.Silu,torch.bfloat16,torch.float4_e2m1fn_x2,torch.float4_e2m1fn_x2,QuantType.per_1x32,1,0,interleave,128,0,2264.1403,flydsl_mxfp4_g1_a4w4_128x256x256,0.0%,3164.3895,flydsl_mxfp4_g2_a4w4_128x256x256_nonatomic,0.0%,5428.5298,0,0,0,170.9,674.52,
gfx950,256,8192,3072,1536,256,8,ActivationType.Silu,torch.bfloat16,torch.float4_e2m1fn_x2,torch.float4_e2m1fn_x2,QuantType.per_1x32,1,0,interleave,128,0,2460.2093,flydsl_mxfp4_g1_a4w4_128x256x256,0.0%,3524.6326,flydsl_mxfp4_g2_a4w4_128x256x256_nonatomic,0.0%,5984.8419,0,0,0,310.02,618.12,
gfx950,256,16384,3072,1536,256,8,ActivationType.Silu,torch.bfloat16,torch.float4_e2m1fn_x2,torch.float4_e2m1fn_x2,QuantType.per_1x32,1,0,interleave,128,0,2823.9052,flydsl_mxfp4_g1_a4w4_128x256x256,0.0%,4341.0525,flydsl_mxfp4_g2_a4w4_128x256x256_nonatomic,0.0%,7164.9577,0,0,0,517.92,526.85,
gfx950,256,32768,3072,1536,256,8,ActivationType.Silu,torch.bfloat16,torch.float4_e2m1fn_x2,torch.float4_e2m1fn_x2,QuantType.per_1x32,1,0,interleave,128,0,3631.5923,flydsl_mxfp4_g1_a4w4_128x256x256,0.0%,5830.4255,flydsl_mxfp4_g2_a4w4_128x256x256_nonatomic,0.0%,9462.0178,0,0,0,784.37,414.91,
gfx950,256,1,3072,768,256,8,ActivationType.Silu,torch.bfloat16,torch.float4_e2m1fn_x2,torch.float4_e2m1fn_x2,QuantType.per_1x32,1,0,interleave,16,0,975.1877,flydsl_mxfp4_g1_a4w4_16x256x256_inlinequant,0.0%,1293.638,flydsl_mxfp4_g2_a4w4_16x256x256_topk8_atomic_nt,0.0%,2268.8257,0,0,0,0.05,798.63,
gfx950,256,2,3072,768,256,8,ActivationType.Silu,torch.bfloat16,torch.float4_e2m1fn_x2,torch.float4_e2m1fn_x2,QuantType.per_1x32,1,0,interleave,16,0,970.8887,flydsl_mxfp4_g1_a4w4_16x256x256_inlinequant,0.0%,1282.1769,flydsl_mxfp4_g2_a4w4_16x256x256_topk8_atomic_nt,0.0%,2253.0656,0,0,0,0.1,804.22,
gfx950,256,4,3072,768,256,8,ActivationType.Silu,torch.bfloat16,torch.float4_e2m1fn_x2,torch.float4_e2m1fn_x2,QuantType.per_1x32,1,0,interleave,16,0,978.8804,flydsl_mxfp4_g1_a4w4_16x256x256_inlinequant,0.0%,1289.5012,flydsl_mxfp4_g2_a4w4_16x256x256_topk8_atomic_nt,0.0%,2268.3816,0,0,0,0.2,798.8,
gfx950,256,8,3072,768,256,8,ActivationType.Silu,torch.bfloat16,torch.float4_e2m1fn_x2,torch.float4_e2m1fn_x2,QuantType.per_1x32,1,0,interleave,16,0,986.0973,flydsl_mxfp4_g1_a4w4_16x256x256_inlinequant,0.0%,1311.8382,flydsl_mxfp4_g2_a4w4_16x256x256_topk8_atomic_nt,0.0%,2297.9355,0,0,0,0.39,788.54,
gfx950,256,16,3072,768,256,8,ActivationType.Silu,torch.bfloat16,torch.float4_e2m1fn_x2,torch.float4_e2m1fn_x2,QuantType.per_1x32,1,0,interleave,16,0,1005.4427,flydsl_mxfp4_g1_a4w4_16x256x256_inlinequant,0.0%,1338.2026,flydsl_mxfp4_g2_a4w4_16x256x256_topk8_atomic_nt,0.0%,2343.6453,0,0,0,0.77,773.19,
gfx950,256,32,3072,768,256,8,ActivationType.Silu,torch.bfloat16,torch.float4_e2m1fn_x2,torch.float4_e2m1fn_x2,QuantType.per_1x32,1,0,interleave,16,0,1026.5545,flydsl_mxfp4_g1_a4w4_16x256x256_inlinequant,0.0%,1365.1018,flydsl_mxfp4_g2_a4w4_16x256x256_topk8_atomic_nt,0.0%,2391.6563,0,0,0,1.52,757.73,
gfx950,256,64,3072,768,256,8,ActivationType.Silu,torch.bfloat16,torch.float4_e2m1fn_x2,torch.float4_e2m1fn_x2,QuantType.per_1x32,1,0,interleave,16,0,1047.0768,flydsl_mxfp4_g1_a4w4_16x256x256_inlinequant,0.0%,1404.6201,flydsl_mxfp4_g2_a4w4_16x256x256_topk8_atomic_nt,0.0%,2451.6969,0,0,0,2.96,739.3,
gfx950,256,128,3072,768,256,8,ActivationType.Silu,torch.bfloat16,torch.float4_e2m1fn_x2,torch.float4_e2m1fn_x2,QuantType.per_1x32,1,0,interleave,16,0,1059.4242,flydsl_mxfp4_g1_a4w4_16x256x256_inlinequant,0.0%,1423.8097,flydsl_mxfp4_g2_a4w4_16x256x256_topk8_atomic_nt,0.0%,2483.2339,0,0,0,5.84,730.14,
gfx950,256,256,3072,768,256,8,ActivationType.Silu,torch.bfloat16,torch.float4_e2m1fn_x2,torch.float4_e2m1fn_x2,QuantType.per_1x32,1,0,interleave,32,0,1086.4584,flydsl_mxfp4_g1_a4w4_32x256x256_nt,0.0%,1470.0587,flydsl_mxfp4_g2_a4w4_32x256x256_topk8_atomic_nt,0.0%,2556.5171,0,0,0,11.34,709.68,
gfx950,256,512,3072,768,256,8,ActivationType.Silu,torch.bfloat16,torch.float4_e2m1fn_x2,torch.float4_e2m1fn_x2,QuantType.per_1x32,1,0,interleave,32,0,1082.1215,flydsl_mxfp4_g1_a4w4_32x256x256_nt,0.0%,1469.9114,flydsl_mxfp4_g2_a4w4_32x256x256_topk8_atomic_nt,0.0%,2552.0329,0,0,0,22.72,711.85,
gfx950,256,1024,3072,768,256,8,ActivationType.Silu,torch.bfloat16,torch.float4_e2m1fn_x2,torch.float4_e2m1fn_x2,QuantType.per_1x32,1,0,interleave,32,0,1124.7934,flydsl_mxfp4_g1_a4w4_32x256x256_cached,0.0%,1519.7897,flydsl_mxfp4_g2_a4w4_32x256x256_topk8_atomic,0.0%,2644.5831,0,0,0,43.85,688.72,
gfx950,256,2048,3072,768,256,8,ActivationType.Silu,torch.bfloat16,torch.float4_e2m1fn_x2,torch.float4_e2m1fn_x2,QuantType.per_1x32,1,0,interleave,32,0,1231.4596,flydsl_mxfp4_g1_a4w4_32x256x256_cached,0.0%,1654.5762,flydsl_mxfp4_g2_a4w4_32x256x256_topk8_atomic,0.0%,2886.0358,0,0,0,80.36,634.37,
gfx950,256,4096,3072,768,256,8,ActivationType.Silu,torch.bfloat16,torch.float4_e2m1fn_x2,torch.float4_e2m1fn_x2,QuantType.per_1x32,1,0,interleave,128,0,1183.4193,flydsl_mxfp4_g1_a4w4_128x256x256,0.0%,1663.669,flydsl_mxfp4_g2_a4w4_128x256x256_nonatomic,0.0%,2847.0883,0,0,0,162.92,649.68,
gfx950,256,8192,3072,768,256,8,ActivationType.Silu,torch.bfloat16,torch.float4_e2m1fn_x2,torch.float4_e2m1fn_x2,QuantType.per_1x32,1,0,interleave,128,0,1315.6772,flydsl_mxfp4_g1_a4w4_128x256x256,0.0%,1919.9975,flydsl_mxfp4_g2_a4w4_128x256x256_nonatomic,0.0%,3235.6747,0,0,0,286.71,583.32,
gfx950,256,16384,3072,768,256,8,ActivationType.Silu,torch.bfloat16,torch.float4_e2m1fn_x2,torch.float4_e2m1fn_x2,QuantType.per_1x32,1,0,interleave,128,0,1558.4541,flydsl_mxfp4_g1_a4w4_128x256x256,0.0%,2406.6671,flydsl_mxfp4_g2_a4w4_128x256x256_nonatomic,0.0%,3965.1212,0,0,0,467.94,495.05,
gfx950,256,32768,3072,768,256,8,ActivationType.Silu,torch.bfloat16,torch.float4_e2m1fn_x2,torch.float4_e2m1fn_x2,QuantType.per_1x32,1,0,interleave,128,0,1952.6744,flydsl_mxfp4_g1_a4w4_128x256x256,0.0%,3320.3403,flydsl_mxfp4_g2_a4w4_128x256x256_nonatomic,0.0%,5273.0147,0,0,0,703.74,400.9,
