aiter/configs/model_configs/mxfp4_tuned_fmoe_glm5_2.csv
gfx,cu_num,token,model_dim,inter_dim,expert,topk,act_type,dtype,q_dtype_a,q_dtype_w,q_type,use_g1u1,doweight_stage1,block_m,ksplit,us1,kernelName1,err1,us2,kernelName2,err2,us,run_1stage,xbf16,flat,tflops,bw,_tag
gfx950,256,1,6144,256,257,9,ActivationType.Silu,torch.bfloat16,torch.float4_e2m1fn_x2,torch.float4_e2m1fn_x2,QuantType.per_1x32,1,0,32,0,10.4658,flydsl_moe1_afp4_wfp4_bf16_t32x32x256_w3_kw4_fp4,0.4%,6.7805,moe_ck2stages_gemm2_256x32x128x128_1x4_MulABScaleExpertWeightShuffled_v3_Nswizzle0_Quant3_MulRoutedWeight1_FP4X2_FP4X2_B16,1.0%,17.2463,0,0,0,4.92,70316.33,
gfx950,256,2,6144,256,257,9,ActivationType.Silu,torch.bfloat16,torch.float4_e2m1fn_x2,torch.float4_e2m1fn_x2,QuantType.per_1x32,1,0,32,0,14.527,flydsl_moe1_afp4_wfp4_bf16_t32x32x256_w3_bnt0_kw4,0.0%,8.9725,moe_ck2stages_gemm2_256x32x128x128_1x4_MulABScaleExpertWeightShuffled_v3_Nswizzle0_Quant3_MulRoutedWeight1_FP4X2_FP4X2_B16,1.1%,23.4995,0,0,0,7.23,51605.99,
gfx950,256,4,6144,256,257,9,ActivationType.Silu,torch.bfloat16,torch.float4_e2m1fn_x2,torch.float4_e2m1fn_x2,QuantType.per_1x32,1,0,32,0,19.7407,flydsl_moe1_afp4_wfp4_bf16_t32x32x256_w2_bnt0_kw2,0.0%,12.11,flydsl_moe2_afp4_wfp4_bf16_t32x128x256_reduce_bnt2,0.0%,31.8507,0,0,0,10.67,38076.15,
gfx950,256,8,6144,256,257,9,ActivationType.Silu,torch.bfloat16,torch.float4_e2m1fn_x2,torch.float4_e2m1fn_x2,QuantType.per_1x32,1,0,32,0,28.377,flydsl_moe1_afp4_wfp4_bf16_t32x64x256_w2_bnt0,0.0%,16.3053,flydsl_moe2_afp4_wfp4_bf16_t32x128x256_reduce,0.0%,44.6823,0,0,0,15.21,27143.31,
gfx950,256,16,6144,256,257,9,ActivationType.Silu,torch.bfloat16,torch.float4_e2m1fn_x2,torch.float4_e2m1fn_x2,QuantType.per_1x32,1,0,32,0,35.2725,flydsl_moe1_afp4_wfp4_bf16_t32x64x256_w2,0.0%,21.6687,flydsl_moe2_afp4_wfp4_bf16_t32x128x256_reduce_bnt2,0.0%,56.9412,0,0,0,23.87,21302.2,
gfx950,256,32,6144,256,257,9,ActivationType.Silu,torch.bfloat16,torch.float4_e2m1fn_x2,torch.float4_e2m1fn_x2,QuantType.per_1x32,1,0,32,0,50.8472,flydsl_moe1_afp4_wfp4_bf16_t32x64x256_w4_kw2,0.0%,31.4634,flydsl_moe2_afp4_wfp4_bf16_t32x256x256_reduce_bnt2,0.0%,82.3106,0,0,0,33.02,14740.12,
gfx950,256,64,6144,256,257,9,ActivationType.Silu,torch.bfloat16,torch.float4_e2m1fn_x2,torch.float4_e2m1fn_x2,QuantType.per_1x32,1,0,32,0,66.1881,flydsl_moe1_afp4_wfp4_bf16_t32x128x256_w3,0.0%,40.668,flydsl_moe2_afp4_wfp4_bf16_t16x256x256_atomic_persist_sbm32,0.8%,106.8561,0,0,0,50.87,11359.74,
gfx950,256,128,6144,256,257,9,ActivationType.Silu,torch.bfloat16,torch.float4_e2m1fn_x2,torch.float4_e2m1fn_x2,QuantType.per_1x32,1,0,64,0,69.123,flydsl_moe1_afp4_wfp4_bf16_t64x128x256_w4_fp4,0.8%,46.5062,flydsl_moe2_afp4_wfp4_bf16_t32x256x128_reduce_bnt2_persist_sbm64,0.0%,115.6292,0,0,0,94.02,10508.05,
gfx950,256,256,6144,256,257,9,ActivationType.Silu,torch.bfloat16,torch.float4_e2m1fn_x2,torch.float4_e2m1fn_x2,QuantType.per_1x32,1,0,32,0,77.29990000000001,flydsl_moe1_afp4_wfp4_bf16_t32x32x256_w3_kw2,0.0%,48.1299,flydsl_moe2_afp4_wfp4_bf16_t16x128x256_atomic_bnt2_sbm32,0.8%,125.4298,0,0,0,173.35,9705.8,
gfx950,256,512,6144,256,257,9,ActivationType.Silu,torch.bfloat16,torch.float4_e2m1fn_x2,torch.float4_e2m1fn_x2,QuantType.per_1x32,1,0,32,0,76.7743,flydsl_moe1_afp4_wfp4_bf16_t32x64x256_w4_kw2_fp4,0.8%,58.686,flydsl_moe2_afp4_wfp4_bf16_t32x128x128_atomic,0.8%,135.4603,0,0,0,321.03,9021.94,
gfx950,256,1024,6144,256,257,9,ActivationType.Silu,torch.bfloat16,torch.float4_e2m1fn_x2,torch.float4_e2m1fn_x2,QuantType.per_1x32,1,0,64,0,91.9857,flydsl_moe1_afp4_wfp4_bf16_t64x64x256_w4,0.0%,86.1777,flydsl_moe2_afp4_wfp4_bf16_t64x256x256_reduce_bnt2_persist,0.0%,178.1634,0,0,0,488.16,6912.49,
gfx950,256,2048,6144,256,257,9,ActivationType.Silu,torch.bfloat16,torch.float4_e2m1fn_x2,torch.float4_e2m1fn_x2,QuantType.per_1x32,1,0,64,0,108.2764,flydsl_moe1_afp4_wfp4_bf16_t64x128x256_w4_bnt0_xcd4_fp4,0.8%,138.5647,flydsl_moe2_afp4_wfp4_bf16_t64x256x256_reduce_bnt2_persist,0.0%,246.8411,0,0,0,704.69,5065.72,
gfx950,256,4096,6144,256,257,9,ActivationType.Silu,torch.bfloat16,torch.float4_e2m1fn_x2,torch.float4_e2m1fn_x2,QuantType.per_1x32,1,0,64,0,149.0838,flydsl_moe1_afp4_wfp4_bf16_t64x128x256_w2_bnt0_xcd4,0.0%,239.422,flydsl_moe2_afp4_wfp4_bf16_t64x256x256_reduce_bnt2,0.0%,388.5058,0,0,0,895.46,3315.72,
gfx950,256,8192,6144,256,257,9,ActivationType.Silu,torch.bfloat16,torch.float4_e2m1fn_x2,torch.float4_e2m1fn_x2,QuantType.per_1x32,1,0,64,0,220.6194,flydsl_moe1_afp4_wfp4_bf16_t64x128x256_w4_bnt0_xcd4,0.0%,455.168,flydsl_moe2_afp4_wfp4_bf16_t64x256x256_reduce_persist,0.0%,675.7874,0,0,0,1029.59,2017.9,
gfx950,256,16384,6144,256,257,9,ActivationType.Silu,torch.bfloat16,torch.float4_e2m1fn_x2,torch.float4_e2m1fn_x2,QuantType.per_1x32,1,0,128,0,367.4062,flydsl_moe1_afp4_wfp4_bf16_t128x128x256_w2_bnt0_xcd4,0.0%,894.9074,flydsl_moe2_afp4_wfp4_bf16_t64x256x256_reduce_bnt2_sbm128,0.0%,1262.3136,0,0,0,1102.4,1199.91,
gfx950,256,32768,6144,256,257,9,ActivationType.Silu,torch.bfloat16,torch.float4_e2m1fn_x2,torch.float4_e2m1fn_x2,QuantType.per_1x32,1,0,128,0,643.8482,flydsl_moe1_afp4_wfp4_bf16_t128x128x256_bnt0_xcd4,0.0%,1757.8258,flydsl_moe2_afp4_wfp4_bf16_t64x256x256_reduce_bnt2_xcd4_sbm128,0.0%,2401.674,0,0,0,1158.83,756.41,
gfx950,256,1,6144,512,257,9,ActivationType.Silu,torch.bfloat16,torch.float4_e2m1fn_x2,torch.float4_e2m1fn_x2,QuantType.per_1x32,1,0,32,0,14.637,flydsl_moe1_afp4_wfp4_bf16_t32x32x256_w3_kw4,0.0%,9.5195,flydsl_moe2_afp4_wfp4_bf16_t32x128x256_reduce,0.2%,24.1565,0,0,0,7.03,100402.57,
gfx950,256,2,6144,512,257,9,ActivationType.Silu,torch.bfloat16,torch.float4_e2m1fn_x2,torch.float4_e2m1fn_x2,QuantType.per_1x32,1,0,32,0,16.3611,flydsl_moe1_afp4_wfp4_bf16_t32x32x256_w3_bnt0_kw2_fp4,1.1%,12.3604,flydsl_moe2_afp4_wfp4_bf16_t32x256x256_reduce_bnt2,0.1%,28.7215,0,0,0,11.83,84445.21,
gfx950,256,4,6144,512,257,9,ActivationType.Silu,torch.bfloat16,torch.float4_e2m1fn_x2,torch.float4_e2m1fn_x2,QuantType.per_1x32,1,0,32,0,28.2911,moe_ck2stages_gemm1_64x32x32x128_1x1_MulABScaleShuffled_v3_Nswizzle0_Quant3_MulRoutedWeight0_silu_FP4X2_FP4X2_B16,0.0%,16.8336,flydsl_moe2_afp4_wfp4_bf16_t32x128x256_reduce_bnt2,0.1%,45.1247,0,0,0,15.06,53749.5,
gfx950,256,8,6144,512,257,9,ActivationType.Silu,torch.bfloat16,torch.float4_e2m1fn_x2,torch.float4_e2m1fn_x2,QuantType.per_1x32,1,0,32,0,42.8909,flydsl_moe1_afp4_wfp4_bf16_t32x32x256_w3_xcd4_kw4_fp4,0.9%,25.2564,flydsl_moe2_afp4_wfp4_bf16_t32x128x256_reduce_bnt2,0.1%,68.1473,0,0,0,19.94,35592.07,
gfx950,256,16,6144,512,257,9,ActivationType.Silu,torch.bfloat16,torch.float4_e2m1fn_x2,torch.float4_e2m1fn_x2,QuantType.per_1x32,1,0,32,0,61.2577,flydsl_moe1_afp4_wfp4_bf16_t32x128x256_w2_fp4,0.8%,39.6528,flydsl_moe2_afp4_wfp4_bf16_t32x128x256_atomic_bnt2,1.9%,100.9105,0,0,0,26.93,24037.65,
gfx950,256,32,6144,512,257,9,ActivationType.Silu,torch.bfloat16,torch.float4_e2m1fn_x2,torch.float4_e2m1fn_x2,QuantType.per_1x32,1,0,64,0,90.6363,flydsl_moe1_afp4_wfp4_bf16_t64x128x256_w3_fp4,0.7%,57.7884,flydsl_moe2_afp4_wfp4_bf16_t32x256x256_reduce_sbm64,0.1%,148.4247,0,0,0,36.62,16344.63,
gfx950,256,64,6144,512,257,9,ActivationType.Silu,torch.bfloat16,torch.float4_e2m1fn_x2,torch.float4_e2m1fn_x2,QuantType.per_1x32,1,0,64,0,122.8115,flydsl_moe1_afp4_wfp4_bf16_t64x128x256_w4_fp4,0.7%,74.6806,flydsl_moe2_afp4_wfp4_bf16_t32x256x256_reduce_xcd4_sbm64,0.1%,197.4921,0,0,0,55.05,12286.75,
gfx950,256,128,6144,512,257,9,ActivationType.Silu,torch.bfloat16,torch.float4_e2m1fn_x2,torch.float4_e2m1fn_x2,QuantType.per_1x32,1,0,32,0,131.6441,flydsl_moe1_afp4_wfp4_bf16_t32x128x256_w3_fp4,0.8%,79.4716,flydsl_moe2_afp4_wfp4_bf16_t16x128x256_reduce_bnt2_sbm32,0.1%,211.1157,0,0,0,102.99,11499.46,
gfx950,256,256,6144,512,257,9,ActivationType.Silu,torch.bfloat16,torch.float4_e2m1fn_x2,torch.float4_e2m1fn_x2,QuantType.per_1x32,1,0,32,0,137.2473,flydsl_moe1_afp4_wfp4_bf16_t32x32x256_w4_kw2_fp4,0.8%,89.8912,flydsl_moe2_afp4_wfp4_bf16_t16x128x256_reduce_bnt2_sbm32,0.1%,227.1385,0,0,0,191.45,10698.65,
gfx950,256,512,6144,512,257,9,ActivationType.Silu,torch.bfloat16,torch.float4_e2m1fn_x2,torch.float4_e2m1fn_x2,QuantType.per_1x32,1,0,32,0,148.5775,flydsl_moe1_afp4_wfp4_bf16_t32x32x256_w4_kw2,0.0%,99.5133,flydsl_moe2_afp4_wfp4_bf16_t32x128x128_reduce,0.1%,248.0908,0,0,0,350.57,9814.12,
gfx950,256,1024,6144,512,257,9,ActivationType.Silu,torch.bfloat16,torch.float4_e2m1fn_x2,torch.float4_e2m1fn_x2,QuantType.per_1x32,1,0,64,0,161.0825,flydsl_moe1_afp4_wfp4_bf16_t64x64x256_w3,0.0%,126.0821,flydsl_moe2_afp4_wfp4_bf16_t64x256x128_reduce,0.1%,287.1646,0,0,0,605.74,8511.6,
gfx950,256,2048,6144,512,257,9,ActivationType.Silu,torch.bfloat16,torch.float4_e2m1fn_x2,torch.float4_e2m1fn_x2,QuantType.per_1x32,1,0,128,0,199.8006,flydsl_moe1_afp4_wfp4_bf16_t128x128x256_w4,0.0%,197.9682,flydsl_moe2_afp4_wfp4_bf16_t64x256x256_reduce_bnt2_sbm128,0.1%,397.7688,0,0,0,874.61,6192.3,
gfx950,256,4096,6144,512,257,9,ActivationType.Silu,torch.bfloat16,torch.float4_e2m1fn_x2,torch.float4_e2m1fn_x2,QuantType.per_1x32,1,0,64,0,280.272,flydsl_moe1_afp4_wfp4_bf16_t64x128x256_w2_bnt0_xcd4,0.0%,333.8801,flydsl_moe2_afp4_wfp4_bf16_t64x256x256_reduce_xcd4,0.1%,614.1521,0,0,0,1132.92,4072.04,
gfx950,256,8192,6144,512,257,9,ActivationType.Silu,torch.bfloat16,torch.float4_e2m1fn_x2,torch.float4_e2m1fn_x2,QuantType.per_1x32,1,0,64,0,419.9263,flydsl_moe1_afp4_wfp4_bf16_t64x128x256_w2_bnt0_xcd4,0.0%,593.7695,flydsl_moe2_afp4_wfp4_bf16_t64x256x256_reduce_bnt2_xcd4_persist,0.1%,1013.6958,0,0,0,1372.77,2541.54,
gfx950,256,16384,6144,512,257,9,ActivationType.Silu,torch.bfloat16,torch.float4_e2m1fn_x2,torch.float4_e2m1fn_x2,QuantType.per_1x32,1,0,128,0,677.1169,moe_ck2stages_gemm1_256x128x128x128_1x4_MulABScaleShuffled_v3_Nswizzle0_Quant3_MulRoutedWeight0_silu_FP4X2_FP4X2_B16,0.0%,1116.5329,flydsl_moe2_afp4_wfp4_bf16_t64x256x256_reduce_xcd4_persist_sbm128,0.1%,1793.6498,0,0,0,1551.66,1520.56,
gfx950,256,32768,6144,512,257,9,ActivationType.Silu,torch.bfloat16,torch.float4_e2m1fn_x2,torch.float4_e2m1fn_x2,QuantType.per_1x32,1,0,128,0,1221.4842,moe_ck2stages_gemm1_256x128x128x128_1x4_MulABScaleShuffled_v3_Nswizzle0_Quant3_MulRoutedWeight0_silu_FP4X2_FP4X2_B16,0.0%,2148.3747,flydsl_moe2_afp4_wfp4_bf16_t64x256x256_reduce_xcd4_persist_sbm128,0.1%,3369.8589,0,0,0,1651.78,898.95,
