aiter/configs/model_configs/qwen3_5_397b_tp4_nvfp4_tuned_fmoe.csv
gfx,cu_num,token,model_dim,inter_dim,expert,topk,act_type,dtype,q_dtype_a,q_dtype_w,q_type,use_g1u1,doweight_stage1,block_m,ksplit,us1,kernelName1,err1,us2,kernelName2,err2,us,run_1stage,xbf16,flat,tflops,bw,_tag
gfx950,256,1,4096,256,512,10,ActivationType.Silu,torch.bfloat16,torch.bfloat16,nvfp4_bf16,QuantType.No,1,0,16,0,16.4502,flydsl_moe1_abf16_wnvfp4_bf16_t16x64x256_kb4,0.0%,11.1927,flydsl_moe2_abf16_wnvfp4_bf16_t16x128x128_atomic,0.0%,27.6429,0,0,0,2.28,29133.08,
gfx950,256,2,4096,256,512,10,ActivationType.Silu,torch.bfloat16,torch.bfloat16,nvfp4_bf16,QuantType.No,1,0,16,0,19.1671,flydsl_moe1_abf16_wnvfp4_bf16_t16x64x256_kb4,0.0%,12.4153,flydsl_moe2_abf16_wnvfp4_bf16_t16x128x128_atomic,0.0%,31.5824,0,0,0,3.98,25499.62,
gfx950,256,4,4096,256,512,10,ActivationType.Silu,torch.bfloat16,torch.bfloat16,nvfp4_bf16,QuantType.No,1,0,16,0,23.9302,flydsl_moe1_abf16_wnvfp4_bf16_t16x64x128_kb4,0.0%,14.7878,flydsl_moe2_abf16_wnvfp4_bf16_t16x128x256_atomic,0.0%,38.718,0,0,0,6.5,20800.97,
gfx950,256,8,4096,256,512,10,ActivationType.Silu,torch.bfloat16,torch.bfloat16,nvfp4_bf16,QuantType.No,1,0,16,0,35.5072,flydsl_moe1_abf16_wnvfp4_bf16_t16x64x256_kb4,0.0%,20.1332,flydsl_moe2_abf16_wnvfp4_bf16_t16x128x256_atomic,0.0%,55.6404,0,0,0,9.05,14475.77,
gfx950,256,16,4096,256,512,10,ActivationType.Silu,torch.bfloat16,torch.bfloat16,nvfp4_bf16,QuantType.No,1,0,16,0,57.0067,flydsl_moe1_abf16_wnvfp4_bf16_t16x64x256_kb4,0.0%,29.5447,flydsl_moe2_abf16_wnvfp4_bf16_t16x128x128_atomic,0.0%,86.5514,0,0,0,11.63,9307.4,
gfx950,256,32,4096,256,512,10,ActivationType.Silu,torch.bfloat16,torch.bfloat16,nvfp4_bf16,QuantType.No,1,0,16,0,81.3051,flydsl_moe1_abf16_wnvfp4_bf16_t16x64x128,0.0%,44.0791,flydsl_moe2_abf16_wnvfp4_bf16_t16x128x128_atomic,0.0%,125.3842,0,0,0,16.06,6426.89,
gfx950,256,64,4096,256,512,10,ActivationType.Silu,torch.bfloat16,torch.bfloat16,nvfp4_bf16,QuantType.No,1,0,16,0,116.4404,flydsl_moe1_abf16_wnvfp4_bf16_t16x64x128,0.0%,65.2956,flydsl_moe2_abf16_wnvfp4_bf16_t16x128x256_atomic,0.0%,181.736,0,0,0,22.16,4436.96,
gfx950,256,128,4096,256,512,10,ActivationType.Silu,torch.bfloat16,torch.bfloat16,nvfp4_bf16,QuantType.No,1,0,16,0,147.6642,flydsl_moe1_abf16_wnvfp4_bf16_t16x64x128,0.0%,81.8384,flydsl_moe2_abf16_wnvfp4_bf16_t16x128x256_atomic,0.0%,229.5026,0,0,0,35.09,3518.06,
gfx950,256,256,4096,256,512,10,ActivationType.Silu,torch.bfloat16,torch.bfloat16,nvfp4_bf16,QuantType.No,1,0,16,0,157.1081,flydsl_moe1_abf16_wnvfp4_bf16_t16x64x128,0.0%,90.9001,flydsl_moe2_abf16_wnvfp4_bf16_t16x128x256_atomic,0.0%,248.0082,0,0,0,64.94,3264.01,
gfx950,256,512,4096,256,512,10,ActivationType.Silu,torch.bfloat16,torch.bfloat16,nvfp4_bf16,QuantType.No,1,0,16,0,169.1675,flydsl_moe1_abf16_wnvfp4_bf16_t16x64x128,0.0%,95.7661,flydsl_moe2_abf16_wnvfp4_bf16_t16x128x128_atomic,0.0%,264.9336,0,0,0,121.59,3071.32,
gfx950,256,1024,4096,256,512,10,ActivationType.Silu,torch.bfloat16,torch.bfloat16,nvfp4_bf16,QuantType.No,1,0,32,0,195.7773,flydsl_moe1_abf16_wnvfp4_bf16_t32x64x128,0.0%,122.8334,flydsl_moe2_abf16_wnvfp4_bf16_t32x128x128_atomic,0.0%,318.6107,0,0,0,202.2,2580.21,
gfx950,256,2048,4096,256,512,10,ActivationType.Silu,torch.bfloat16,torch.bfloat16,nvfp4_bf16,QuantType.No,1,0,64,0,235.8277,flydsl_moe1_abf16_wnvfp4_bf16_t64x64x64,0.0%,183.3734,flydsl_moe2_abf16_wnvfp4_bf16_t64x128x128_atomic,0.0%,419.2011,0,0,0,307.37,2001.09,
gfx950,256,4096,4096,256,512,10,ActivationType.Silu,torch.bfloat16,torch.bfloat16,nvfp4_bf16,QuantType.No,1,0,128,0,385.2402,flydsl_moe1_abf16_wnvfp4_bf16_t128x64x64,0.0%,329.9813,flydsl_moe2_abf16_wnvfp4_bf16_t128x128x64_atomic,0.0%,715.2215,0,0,0,360.31,1219.78,
gfx950,256,8192,4096,256,512,10,ActivationType.Silu,torch.bfloat16,torch.bfloat16,nvfp4_bf16,QuantType.No,1,0,64,0,636.9648,flydsl_moe1_abf16_wnvfp4_bf16_t64x64x64,0.0%,560.0654,flydsl_moe2_abf16_wnvfp4_bf16_t64x128x128_atomic,0.0%,1197.0302,0,0,0,430.56,784.88,
gfx950,256,16384,4096,256,512,10,ActivationType.Silu,torch.bfloat16,torch.bfloat16,nvfp4_bf16,QuantType.No,1,0,64,0,1096.4825,flydsl_moe1_abf16_wnvfp4_bf16_t64x128x64,0.0%,1077.7644,flydsl_moe2_abf16_wnvfp4_bf16_t64x128x128_atomic,0.0%,2174.2469,0,0,0,474.09,493.85,
gfx950,256,32768,4096,256,512,10,ActivationType.Silu,torch.bfloat16,torch.bfloat16,nvfp4_bf16,QuantType.No,1,0,128,0,2052.4846,flydsl_moe1_abf16_wnvfp4_bf16_t128x64x64,0.0%,2176.9801,flydsl_moe2_abf16_wnvfp4_bf16_t128x128x64_atomic,0.0%,4229.4647,0,0,0,487.43,317.34,
