aiter/configs/model_configs/qwen397B_fp4_tuned_fmoe.csv
cu_num,token,model_dim,inter_dim,expert,topk,act_type,dtype,q_dtype_a,q_dtype_w,q_type,use_g1u1,doweight_stage1,block_m,ksplit,us1,kernelName1,err1,us2,kernelName2,err2,us,run_1stage,tflops,bw,_tag
256,256,4096,512,512,10,ActivationType.Silu,torch.bfloat16,torch.float4_e2m1fn_x2,torch.float4_e2m1fn_x2,QuantType.per_1x32,1,0,32,0,176.0879,flydsl_moe1_afp4_wfp4_bf16_t32x64x256_w4_fq,18.0%,104.8173,flydsl_moe2_afp4_wfp4_bf16_t16x128x256_atomic_persist_sbm32,0.6%,280.9052,0,114.67,11478.5,
256,128,4096,512,512,10,ActivationType.Silu,torch.bfloat16,torch.float4_e2m1fn_x2,torch.float4_e2m1fn_x2,QuantType.per_1x32,1,0,128,0,0.0,flydsl_moe1_afp4_wfp4_bf16_t128x64x256_w4_bnt0_fq,17.8%,112.459,flydsl_moe2_afp4_wfp4_bf16_t64x256x256_atomic_sbm128,0.5%,112.459,0,143.22,28657.54,
256,64,4096,512,512,10,ActivationType.Silu,torch.bfloat16,torch.float4_e2m1fn_x2,torch.float4_e2m1fn_x2,QuantType.per_1x32,1,0,32,0,180.1752,flydsl_moe1_afp4_wfp4_bf16_t32x32x256_w4,0.0%,98.4946,moe_ck2stages_gemm2_256x32x128x128_1x4_MulABScaleExpertWeightShuffled_v3_Nswizzle0_Quant3_MulRoutedWeight1_FP4X2_FP4X2_B16,0.6%,278.6698,0,28.9,11562.11,
256,32,4096,512,512,10,ActivationType.Silu,torch.bfloat16,torch.float4_e2m1fn_x2,torch.float4_e2m1fn_x2,QuantType.per_1x32,1,0,32,0,117.8295,flydsl_moe1_afp4_wfp4_bf16_t32x32x256_w4,0.0%,65.7542,moe_ck2stages_gemm2_256x32x128x128_1x4_MulABScaleExpertWeightShuffled_v3_Nswizzle0_Quant3_MulRoutedWeight1_FP4X2_FP4X2_B16,0.6%,183.5837,0,21.93,17548.5,
256,16,4096,512,512,10,ActivationType.Silu,torch.bfloat16,torch.float4_e2m1fn_x2,torch.float4_e2m1fn_x2,QuantType.per_1x32,1,0,32,0,64.2929,flydsl_moe1_afp4_wfp4_bf16_t32x64x256_w3,0.0%,36.0959,flydsl_moe2_afp4_wfp4_bf16_t32x128x256_atomic,0.6%,100.3888,0,20.05,32089.46,
256,8,4096,512,512,10,ActivationType.Silu,torch.bfloat16,torch.float4_e2m1fn_x2,torch.float4_e2m1fn_x2,QuantType.per_1x32,1,0,32,0,32.9395,flydsl_moe1_afp4_wfp4_bf16_t32x64x256_w3_fq,18.0%,22.4412,flydsl_moe2_afp4_wfp4_bf16_t32x128x256_atomic,0.5%,55.3807,0,18.18,58166.9,
256,4,4096,512,512,10,ActivationType.Silu,torch.bfloat16,torch.float4_e2m1fn_x2,torch.float4_e2m1fn_x2,QuantType.per_1x32,1,0,32,0,22.4478,flydsl_moe1_afp4_wfp4_bf16_t32x32x256_w4,0.0%,14.9035,flydsl_moe2_afp4_wfp4_bf16_t32x128x256_atomic,0.6%,37.3513,0,13.48,86242.64,
256,2,4096,512,512,10,ActivationType.Silu,torch.bfloat16,torch.float4_e2m1fn_x2,torch.float4_e2m1fn_x2,QuantType.per_1x32,1,0,32,0,17.7161,flydsl_moe1_afp4_wfp4_bf16_t32x64x256_w4,0.0%,9.1158,moe_ck2stages_gemm2_256x32x128x128_1x4_MulABScaleExpertWeightShuffled_v3_Nswizzle0_Quant3_MulRoutedWeight1_FP4X2_FP4X2_B16,0.7%,26.8319,0,9.38,120053.0,
256,1,4096,512,512,10,ActivationType.Silu,torch.bfloat16,torch.float4_e2m1fn_x2,torch.float4_e2m1fn_x2,QuantType.per_1x32,1,0,32,0,16.8111,flydsl_moe1_afp4_wfp4_bf16_t32x32x256_w3,0.0%,6.7171,moe_ck2stages_gemm2_256x32x128x128_1x4_MulABScaleExpertWeightShuffled_v3_Nswizzle0_Quant3_MulRoutedWeight1_FP4X2_FP4X2_B16,0.4%,23.5282,0,5.35,136909.66,
256,8192,4096,512,512,10,ActivationType.Silu,torch.bfloat16,torch.float4_e2m1fn_x2,torch.float4_e2m1fn_x2,QuantType.per_1x32,1,0,64,0,386.0105,flydsl_moe1_afp4_wfp4_bf16_t64x64x256_w4_bnt0,0.0%,489.1431,flydsl_moe2_afp4_wfp4_bf16_t64x128x256_reduce,0.0%,875.1536,0,1177.84,3795.78,
256,16384,4096,512,512,10,ActivationType.Silu,torch.bfloat16,torch.float4_e2m1fn_x2,torch.float4_e2m1fn_x2,QuantType.per_1x32,1,0,64,0,594.8514,flydsl_moe1_afp4_wfp4_bf16_t64x128x256_w2_bnt0,0.0%,913.2311,flydsl_moe2_afp4_wfp4_bf16_t64x128x256_reduce,0.0%,1508.0825,0,1367.02,2269.47,
256,1024,4096,512,512,10,ActivationType.Silu,torch.bfloat16,torch.float4_e2m1fn_x2,torch.float4_e2m1fn_x2,QuantType.per_1x32,1,0,64,0,190.2225,flydsl_moe1_afp4_wfp4_bf16_t64x64x256_w4_fq,18.1%,123.3687,flydsl_moe2_afp4_wfp4_bf16_t32x128x256_atomic_persist_sbm64,0.6%,313.5912,0,410.88,10312.18,
256,2048,4096,512,512,10,ActivationType.Silu,torch.bfloat16,torch.float4_e2m1fn_x2,torch.float4_e2m1fn_x2,QuantType.per_1x32,1,0,64,0,211.4909,flydsl_moe1_afp4_wfp4_bf16_t64x64x256_w4,0.0%,161.5173,flydsl_moe2_afp4_wfp4_bf16_t64x128x256_atomic,0.6%,373.0082,0,690.86,8703.27,
256,4096,4096,512,512,10,ActivationType.Silu,torch.bfloat16,torch.float4_e2m1fn_x2,torch.float4_e2m1fn_x2,QuantType.per_1x32,1,0,128,0,260.9435,flydsl_moe1_afp4_wfp4_bf16_t128x64x256_w2,0.0%,307.6871,flydsl_moe2_afp4_wfp4_bf16_t64x256x256_reduce_sbm128,0.0%,568.6306,0,906.38,5753.4,
256,512,4096,256,512,10,ActivationType.Silu,torch.bfloat16,torch.float4_e2m1fn_x2,torch.float4_e2m1fn_x2,QuantType.per_1x32,1,0,32,0,102.8365,flydsl_moe1_afp4_wfp4_bf16_t32x32x256_w4,0.0%,64.4242,flydsl_moe2_afp4_wfp4_bf16_t16x128x256_atomic_persist_sbm32,0.1%,167.2607,0,192.59,9666.97,
256,256,4096,256,512,10,ActivationType.Silu,torch.bfloat16,torch.float4_e2m1fn_x2,torch.float4_e2m1fn_x2,QuantType.per_1x32,1,0,32,0,98.6503,flydsl_moe1_afp4_wfp4_bf16_t32x32x256_w4,0.0%,59.1816,flydsl_moe2_afp4_wfp4_bf16_t16x128x256_atomic_sbm32,0.1%,157.8319,0,102.05,10224.54,
256,128,4096,256,512,10,ActivationType.Silu,torch.bfloat16,torch.float4_e2m1fn_x2,torch.float4_e2m1fn_x2,QuantType.per_1x32,1,0,32,0,97.5424,flydsl_moe1_afp4_wfp4_bf16_t32x32x256_w4,0.0%,57.2207,flydsl_moe2_afp4_wfp4_bf16_t16x128x256_atomic_sbm32,0.1%,154.7631,0,52.03,10417.12,
256,64,4096,256,512,10,ActivationType.Silu,torch.bfloat16,torch.float4_e2m1fn_x2,torch.float4_e2m1fn_x2,QuantType.per_1x32,1,0,32,0,93.319,flydsl_moe1_afp4_wfp4_bf16_t32x32x256_w4_fq,18.5%,55.3501,flydsl_moe2_afp4_wfp4_bf16_t16x128x256_atomic_persist_sbm32,0.1%,148.6691,0,27.08,10838.83,
256,32,4096,256,512,10,ActivationType.Silu,torch.bfloat16,torch.float4_e2m1fn_x2,torch.float4_e2m1fn_x2,QuantType.per_1x32,1,0,32,0,62.8959,flydsl_moe1_afp4_wfp4_bf16_t32x32x256_w4_fq,18.4%,37.6446,flydsl_moe2_afp4_wfp4_bf16_t32x256x256_atomic_persist,0.1%,100.5405,0,20.02,16023.45,
256,16,4096,256,512,10,ActivationType.Silu,torch.bfloat16,torch.float4_e2m1fn_x2,torch.float4_e2m1fn_x2,QuantType.per_1x32,1,0,32,0,38.4004,moe_ck2stages_gemm1_64x32x32x128_1x1_MulABScaleShuffled_v3_Nswizzle0_Quant3_MulRoutedWeight0_silu_FP4X2_FP4X2_B16,0.0%,22.2825,flydsl_moe2_afp4_wfp4_bf16_t16x256x256_atomic_persist_sbm32,0.1%,60.6829,0,16.59,26544.7,
256,8,4096,256,512,10,ActivationType.Silu,torch.bfloat16,torch.float4_e2m1fn_x2,torch.float4_e2m1fn_x2,QuantType.per_1x32,1,0,32,0,22.8608,flydsl_moe1_afp4_wfp4_bf16_t32x32x256_w4_bnt0,0.0%,14.9235,flydsl_moe2_afp4_wfp4_bf16_t32x256x256_atomic,0.1%,37.7843,0,13.32,42629.11,
256,4,4096,256,512,10,ActivationType.Silu,torch.bfloat16,torch.float4_e2m1fn_x2,torch.float4_e2m1fn_x2,QuantType.per_1x32,1,0,32,0,18.7875,flydsl_moe1_afp4_wfp4_bf16_t32x32x256_w3,0.0%,9.7933,moe_ck2stages_gemm2_64x32x32x128_1x1_MulABScaleExpertWeightShuffled_v1_Nswizzle0_Quant3_MulRoutedWeight1_FP4X2_FP4X2_B16,0.1%,28.5808,0,8.81,56354.68,
256,2,4096,256,512,10,ActivationType.Silu,torch.bfloat16,torch.float4_e2m1fn_x2,torch.float4_e2m1fn_x2,QuantType.per_1x32,1,0,32,0,17.107300000000002,flydsl_moe1_afp4_wfp4_bf16_t32x32x256_w2,0.0%,7.4039,moe_ck2stages_gemm2_256x32x128x128_1x4_MulABScaleExpertWeightShuffled_v3_Nswizzle0_Quant3_MulRoutedWeight1_FP4X2_FP4X2_B16,0.2%,24.5112,0,5.13,65710.26,
256,1,4096,256,512,10,ActivationType.Silu,torch.bfloat16,torch.float4_e2m1fn_x2,torch.float4_e2m1fn_x2,QuantType.per_1x32,1,0,32,0,16.5597,flydsl_moe1_afp4_wfp4_bf16_t32x32x256,0.0%,6.3384,moe_ck2stages_gemm2_64x32x32x128_1x1_MulABScaleExpertWeightShuffled_v1_Nswizzle0_Quant3_MulRoutedWeight1_FP4X2_FP4X2_B16,0.1%,22.8981,0,2.75,70338.81,
256,8192,4096,256,512,10,ActivationType.Silu,torch.bfloat16,torch.float4_e2m1fn_x2,torch.float4_e2m1fn_x2,QuantType.per_1x32,1,0,64,0,235.8542,flydsl_moe1_afp4_wfp4_bf16_t64x64x256_w4_bnt0,0.0%,356.4032,flydsl_moe2_afp4_wfp4_bf16_t64x256x256_reduce_persist,0.0%,592.2574,0,870.22,2889.41,
256,16384,4096,256,512,10,ActivationType.Silu,torch.bfloat16,torch.float4_e2m1fn_x2,torch.float4_e2m1fn_x2,QuantType.per_1x32,1,0,64,0,336.8208,flydsl_moe1_afp4_wfp4_bf16_t64x64x256_w4_bnt0,0.0%,652.595,flydsl_moe2_afp4_wfp4_bf16_t64x256x256_reduce,0.0%,989.4158,0,1041.82,1831.32,
256,2048,4096,256,512,10,ActivationType.Silu,torch.bfloat16,torch.float4_e2m1fn_x2,torch.float4_e2m1fn_x2,QuantType.per_1x32,1,0,64,0,118.3179,flydsl_moe1_afp4_wfp4_bf16_t64x64x256_w4,0.0%,133.2421,flydsl_moe2_afp4_wfp4_bf16_t64x256x256_reduce,0.0%,251.56,0,512.2,6502.54,
256,4096,4096,256,512,10,ActivationType.Silu,torch.bfloat16,torch.float4_e2m1fn_x2,torch.float4_e2m1fn_x2,QuantType.per_1x32,1,0,128,0,150.4998,flydsl_moe1_afp4_wfp4_bf16_t128x64x256_w4,0.0%,210.9397,flydsl_moe2_afp4_wfp4_bf16_t64x256x256_reduce_persist_sbm128,0.0%,361.4395,0,712.98,4595.36,
256,1024,4096,256,512,10,ActivationType.Silu,torch.bfloat16,torch.float4_e2m1fn_x2,torch.float4_e2m1fn_x2,QuantType.per_1x32,1,0,32,0,105.2787,flydsl_moe1_afp4_wfp4_bf16_t32x32x256_w4,0.0%,80.4636,flydsl_moe2_afp4_wfp4_bf16_t32x128x256_atomic_persist,0.1%,185.7423,0,346.85,8738.97,
256,256,4096,512,512,10,ActivationType.Silu,torch.bfloat16,torch.float4_e2m1fn_x2,torch.float4_e2m1fn_x2,QuantType.per_1x32,1,0,32,0,198.7692,moe_ck2stages_gemm1_64x32x32x128_1x1_MulABScaleShuffled_v3_Nswizzle0_Quant3_MulRoutedWeight0_silu_FP4X2_FP4X2_B16,0.0,107.0109,moe_ck2stages_gemm2_256x32x128x128_1x4_MulABScaleExpertWeightShuffled_v3_Nswizzle0_Quant3_MulRoutedWeight1_FP4X2_FP4X2_B16,0.0055,305.7801,0,0.0,0.0,flydsl_fallback
256,128,4096,512,512,10,ActivationType.Silu,torch.bfloat16,torch.float4_e2m1fn_x2,torch.float4_e2m1fn_x2,QuantType.per_1x32,1,0,32,0,201.2315,moe_ck2stages_gemm1_64x32x32x128_1x1_MulABScaleShuffled_v3_Nswizzle0_Quant3_MulRoutedWeight0_silu_FP4X2_FP4X2_B16,0.0,101.0059,moe_ck2stages_gemm2_256x32x128x128_1x4_MulABScaleExpertWeightShuffled_v3_Nswizzle0_Quant3_MulRoutedWeight1_FP4X2_FP4X2_B16,0.0055,302.2374,0,0.0,0.0,flydsl_fallback
256,64,4096,512,512,10,ActivationType.Silu,torch.bfloat16,torch.float4_e2m1fn_x2,torch.float4_e2m1fn_x2,QuantType.per_1x32,1,0,32,0,200.3774,moe_ck2stages_gemm1_64x32x32x128_1x1_MulABScaleShuffled_v3_Nswizzle0_Quant3_MulRoutedWeight0_silu_FP4X2_FP4X2_B16,0.0,98.4946,moe_ck2stages_gemm2_256x32x128x128_1x4_MulABScaleExpertWeightShuffled_v3_Nswizzle0_Quant3_MulRoutedWeight1_FP4X2_FP4X2_B16,0.006,298.872,0,0.0,0.0,flydsl_fallback
256,32,4096,512,512,10,ActivationType.Silu,torch.bfloat16,torch.float4_e2m1fn_x2,torch.float4_e2m1fn_x2,QuantType.per_1x32,1,0,32,0,128.06449999999998,moe_ck2stages_gemm1_64x32x32x128_1x1_MulABScaleShuffled_v3_Nswizzle0_Quant3_MulRoutedWeight0_silu_FP4X2_FP4X2_B16,0.0,65.7542,moe_ck2stages_gemm2_256x32x128x128_1x4_MulABScaleExpertWeightShuffled_v3_Nswizzle0_Quant3_MulRoutedWeight1_FP4X2_FP4X2_B16,0.0056,193.8187,0,0.0,0.0,flydsl_fallback
256,16,4096,512,512,10,ActivationType.Silu,torch.bfloat16,torch.float4_e2m1fn_x2,torch.float4_e2m1fn_x2,QuantType.per_1x32,1,0,32,0,68.9766,moe_ck2stages_gemm1_64x32x32x128_1x1_MulABScaleShuffled_v3_Nswizzle0_Quant3_MulRoutedWeight0_silu_FP4X2_FP4X2_B16,0.0,38.3693,moe_ck2stages_gemm2_256x32x128x128_1x4_MulABScaleExpertWeightShuffled_v3_Nswizzle0_Quant3_MulRoutedWeight1_FP4X2_FP4X2_B16,0.0059,107.3459,0,0.0,0.0,flydsl_fallback
256,8,4096,512,512,10,ActivationType.Silu,torch.bfloat16,torch.float4_e2m1fn_x2,torch.float4_e2m1fn_x2,QuantType.per_1x32,1,0,32,0,38.5058,moe_ck2stages_gemm1_64x32x32x128_1x1_MulABScaleShuffled_v3_Nswizzle0_Quant3_MulRoutedWeight0_silu_FP4X2_FP4X2_B16,0.0,24.2041,moe_ck2stages_gemm2_256x32x128x128_1x4_MulABScaleExpertWeightShuffled_v3_Nswizzle0_Quant3_MulRoutedWeight1_FP4X2_FP4X2_B16,0.0051,62.7099,0,0.0,0.0,flydsl_fallback
256,4,4096,512,512,10,ActivationType.Silu,torch.bfloat16,torch.float4_e2m1fn_x2,torch.float4_e2m1fn_x2,QuantType.per_1x32,1,0,32,0,23.9419,moe_ck2stages_gemm1_64x32x32x128_1x1_MulABScaleShuffled_v3_Nswizzle0_Quant3_MulRoutedWeight0_silu_FP4X2_FP4X2_B16,0.0,17.2151,moe_ck2stages_gemm2_256x32x128x128_1x4_MulABScaleExpertWeightShuffled_v3_Nswizzle0_Quant3_MulRoutedWeight1_FP4X2_FP4X2_B16,0.005,41.157,0,0.0,0.0,flydsl_fallback
256,2,4096,512,512,10,ActivationType.Silu,torch.bfloat16,torch.float4_e2m1fn_x2,torch.float4_e2m1fn_x2,QuantType.per_1x32,1,0,32,0,18.8132,moe_ck2stages_gemm1_64x32x32x128_1x1_MulABScaleShuffled_v3_Nswizzle0_Quant3_MulRoutedWeight0_silu_FP4X2_FP4X2_B16,0.0,9.1158,moe_ck2stages_gemm2_256x32x128x128_1x4_MulABScaleExpertWeightShuffled_v3_Nswizzle0_Quant3_MulRoutedWeight1_FP4X2_FP4X2_B16,0.0067,27.929,0,0.0,0.0,flydsl_fallback
256,1,4096,512,512,10,ActivationType.Silu,torch.bfloat16,torch.float4_e2m1fn_x2,torch.float4_e2m1fn_x2,QuantType.per_1x32,1,0,32,0,17.2114,moe_ck2stages_gemm1_64x32x32x128_1x1_MulABScaleShuffled_v3_Nswizzle0_Quant3_MulRoutedWeight0_silu_FP4X2_FP4X2_B16,0.0,6.7171,moe_ck2stages_gemm2_256x32x128x128_1x4_MulABScaleExpertWeightShuffled_v3_Nswizzle0_Quant3_MulRoutedWeight1_FP4X2_FP4X2_B16,0.0039,23.9285,0,0.0,0.0,flydsl_fallback
256,8192,4096,512,512,10,ActivationType.Silu,torch.bfloat16,torch.float4_e2m1fn_x2,torch.float4_e2m1fn_x2,QuantType.per_1x32,1,0,64,0,421.5241,moe_ck2stages_gemm1_256x64x128x128_1x4_MulABScaleShuffled_v3_Nswizzle0_Quant3_MulRoutedWeight0_silu_FP4X2_FP4X2_B16,0.0,722.7448,moe_ck2stages_gemm2_64x64x128x128_1x1_MulABScaleExpertWeightShuffled_v3_Nswizzle0_Quant3_MulRoutedWeight1_FP4X2_FP4X2_B16,0.0056,1144.2689,0,0.0,0.0,flydsl_fallback
256,16384,4096,512,512,10,ActivationType.Silu,torch.bfloat16,torch.float4_e2m1fn_x2,torch.float4_e2m1fn_x2,QuantType.per_1x32,1,0,64,0,622.3014000000001,moe_ck2stages_gemm1_256x64x128x128_1x4_MulABScaleShuffled_v3_Nswizzle0_Quant3_MulRoutedWeight0_silu_FP4X2_FP4X2_B16,0.0,1263.7466,moe_ck2stages_gemm2_64x64x128x128_1x1_MulABScaleExpertWeightShuffled_v3_Nswizzle0_Quant3_MulRoutedWeight1_FP4X2_FP4X2_B16,0.0056,1886.048,0,0.0,0.0,flydsl_fallback
256,1024,4096,512,512,10,ActivationType.Silu,torch.bfloat16,torch.float4_e2m1fn_x2,torch.float4_e2m1fn_x2,QuantType.per_1x32,1,0,32,0,223.0844,moe_ck2stages_gemm1_64x32x32x128_1x1_MulABScaleShuffled_v3_Nswizzle0_Quant3_MulRoutedWeight0_silu_FP4X2_FP4X2_B16,0.0,160.5126,moe_ck2stages_gemm2_256x32x128x128_1x4_MulABScaleExpertWeightShuffled_v3_Nswizzle0_Quant3_MulRoutedWeight1_FP4X2_FP4X2_B16,0.0056,383.597,0,0.0,0.0,flydsl_fallback
256,2048,4096,512,512,10,ActivationType.Silu,torch.bfloat16,torch.float4_e2m1fn_x2,torch.float4_e2m1fn_x2,QuantType.per_1x32,1,0,64,0,247.5141,moe_ck2stages_gemm1_256x64x128x128_1x4_MulABScaleShuffled_v3_Nswizzle0_Quant3_MulRoutedWeight0_silu_FP4X2_FP4X2_B16,0.0,279.1335,moe_ck2stages_gemm2_64x64x128x128_1x1_MulABScaleExpertWeightShuffled_v3_Nswizzle0_Quant3_MulRoutedWeight1_FP4X2_FP4X2_B16,0.0056,526.6476,0,0.0,0.0,flydsl_fallback
256,4096,4096,512,512,10,ActivationType.Silu,torch.bfloat16,torch.float4_e2m1fn_x2,torch.float4_e2m1fn_x2,QuantType.per_1x32,1,0,64,0,389.5938,moe_ck2stages_gemm1_256x64x128x128_1x4_MulABScaleShuffled_v3_Nswizzle0_Quant3_MulRoutedWeight0_silu_FP4X2_FP4X2_B16,0.0,428.4926,moe_ck2stages_gemm2_64x64x128x128_1x1_MulABScaleExpertWeightShuffled_v3_Nswizzle0_Quant3_MulRoutedWeight1_FP4X2_FP4X2_B16,0.0056,818.0864,0,0.0,0.0,flydsl_fallback
256,512,4096,256,512,10,ActivationType.Silu,torch.bfloat16,torch.float4_e2m1fn_x2,torch.float4_e2m1fn_x2,QuantType.per_1x32,1,0,32,0,108.1083,moe_ck2stages_gemm1_64x32x32x128_1x1_MulABScaleShuffled_v3_Nswizzle0_Quant3_MulRoutedWeight0_silu_FP4X2_FP4X2_B16,0.0,68.7537,moe_ck2stages_gemm2_64x32x32x128_1x1_MulABScaleExpertWeightShuffled_v1_Nswizzle0_Quant3_MulRoutedWeight1_FP4X2_FP4X2_B16,0.0012,176.862,0,0.0,0.0,flydsl_fallback
256,256,4096,256,512,10,ActivationType.Silu,torch.bfloat16,torch.float4_e2m1fn_x2,torch.float4_e2m1fn_x2,QuantType.per_1x32,1,0,32,0,104.2884,moe_ck2stages_gemm1_64x32x32x128_1x1_MulABScaleShuffled_v3_Nswizzle0_Quant3_MulRoutedWeight0_silu_FP4X2_FP4X2_B16,0.0,63.1118,moe_ck2stages_gemm2_64x32x32x128_1x1_MulABScaleExpertWeightShuffled_v1_Nswizzle0_Quant3_MulRoutedWeight1_FP4X2_FP4X2_B16,0.0012,167.4002,0,0.0,0.0,flydsl_fallback
256,128,4096,256,512,10,ActivationType.Silu,torch.bfloat16,torch.float4_e2m1fn_x2,torch.float4_e2m1fn_x2,QuantType.per_1x32,1,0,32,0,103.5357,moe_ck2stages_gemm1_64x32x32x128_1x1_MulABScaleShuffled_v3_Nswizzle0_Quant3_MulRoutedWeight0_silu_FP4X2_FP4X2_B16,0.0,58.1165,moe_ck2stages_gemm2_64x32x32x128_1x1_MulABScaleExpertWeightShuffled_v1_Nswizzle0_Quant3_MulRoutedWeight1_FP4X2_FP4X2_B16,0.0013,161.6522,0,0.0,0.0,flydsl_fallback
256,64,4096,256,512,10,ActivationType.Silu,torch.bfloat16,torch.float4_e2m1fn_x2,torch.float4_e2m1fn_x2,QuantType.per_1x32,1,0,32,0,103.4869,moe_ck2stages_gemm1_64x32x32x128_1x1_MulABScaleShuffled_v3_Nswizzle0_Quant3_MulRoutedWeight0_silu_FP4X2_FP4X2_B16,0.0,55.9237,moe_ck2stages_gemm2_64x32x32x128_1x1_MulABScaleExpertWeightShuffled_v1_Nswizzle0_Quant3_MulRoutedWeight1_FP4X2_FP4X2_B16,0.0013,159.4106,0,0.0,0.0,flydsl_fallback
256,32,4096,256,512,10,ActivationType.Silu,torch.bfloat16,torch.float4_e2m1fn_x2,torch.float4_e2m1fn_x2,QuantType.per_1x32,1,0,32,0,67.6511,moe_ck2stages_gemm1_64x32x32x128_1x1_MulABScaleShuffled_v3_Nswizzle0_Quant3_MulRoutedWeight0_silu_FP4X2_FP4X2_B16,0.0,38.3069,moe_ck2stages_gemm2_64x32x32x128_1x1_MulABScaleExpertWeightShuffled_v1_Nswizzle0_Quant3_MulRoutedWeight1_FP4X2_FP4X2_B16,0.0014,105.958,0,0.0,0.0,flydsl_fallback
256,16,4096,256,512,10,ActivationType.Silu,torch.bfloat16,torch.float4_e2m1fn_x2,torch.float4_e2m1fn_x2,QuantType.per_1x32,1,0,32,0,38.4004,moe_ck2stages_gemm1_64x32x32x128_1x1_MulABScaleShuffled_v3_Nswizzle0_Quant3_MulRoutedWeight0_silu_FP4X2_FP4X2_B16,0.0,24.3815,moe_ck2stages_gemm2_64x32x32x128_1x1_MulABScaleExpertWeightShuffled_v1_Nswizzle0_Quant3_MulRoutedWeight1_FP4X2_FP4X2_B16,0.0012,62.7819,0,0.0,0.0,flydsl_fallback
256,8,4096,256,512,10,ActivationType.Silu,torch.bfloat16,torch.float4_e2m1fn_x2,torch.float4_e2m1fn_x2,QuantType.per_1x32,1,0,32,0,23.4614,moe_ck2stages_gemm1_64x32x32x128_1x1_MulABScaleShuffled_v3_Nswizzle0_Quant3_MulRoutedWeight0_silu_FP4X2_FP4X2_B16,0.0,15.9224,moe_ck2stages_gemm2_64x32x32x128_1x1_MulABScaleExpertWeightShuffled_v1_Nswizzle0_Quant3_MulRoutedWeight1_FP4X2_FP4X2_B16,0.001,39.3838,0,0.0,0.0,flydsl_fallback
256,4,4096,256,512,10,ActivationType.Silu,torch.bfloat16,torch.float4_e2m1fn_x2,torch.float4_e2m1fn_x2,QuantType.per_1x32,1,0,32,0,19.2167,moe_ck2stages_gemm1_64x32x32x128_1x1_MulABScaleShuffled_v3_Nswizzle0_Quant3_MulRoutedWeight0_silu_FP4X2_FP4X2_B16,0.0,9.7933,moe_ck2stages_gemm2_64x32x32x128_1x1_MulABScaleExpertWeightShuffled_v1_Nswizzle0_Quant3_MulRoutedWeight1_FP4X2_FP4X2_B16,0.001,29.01,0,0.0,0.0,flydsl_fallback
256,2,4096,256,512,10,ActivationType.Silu,torch.bfloat16,torch.float4_e2m1fn_x2,torch.float4_e2m1fn_x2,QuantType.per_1x32,1,0,32,0,17.3238,moe_ck2stages_gemm1_64x32x32x128_1x1_MulABScaleShuffled_v3_Nswizzle0_Quant3_MulRoutedWeight0_silu_FP4X2_FP4X2_B16,0.0,7.4039,moe_ck2stages_gemm2_256x32x128x128_1x4_MulABScaleExpertWeightShuffled_v3_Nswizzle0_Quant3_MulRoutedWeight1_FP4X2_FP4X2_B16,0.0016,24.7277,0,0.0,0.0,flydsl_fallback
256,1,4096,256,512,10,ActivationType.Silu,torch.bfloat16,torch.float4_e2m1fn_x2,torch.float4_e2m1fn_x2,QuantType.per_1x32,1,0,32,0,17.4738,moe_ck2stages_gemm1_64x32x32x128_1x1_MulABScaleShuffled_v3_Nswizzle0_Quant3_MulRoutedWeight0_silu_FP4X2_FP4X2_B16,0.0,6.3384,moe_ck2stages_gemm2_64x32x32x128_1x1_MulABScaleExpertWeightShuffled_v1_Nswizzle0_Quant3_MulRoutedWeight1_FP4X2_FP4X2_B16,0.0015,23.8122,0,0.0,0.0,flydsl_fallback
256,8192,4096,256,512,10,ActivationType.Silu,torch.bfloat16,torch.float4_e2m1fn_x2,torch.float4_e2m1fn_x2,QuantType.per_1x32,1,0,32,0,277.884,moe_ck2stages_gemm1_64x32x32x128_1x1_MulABScaleShuffled_v3_Nswizzle0_Quant3_MulRoutedWeight0_silu_FP4X2_FP4X2_B16,0.0,555.969,moe_ck2stages_gemm2_64x32x32x128_1x1_MulABScaleExpertWeightShuffled_v1_Nswizzle0_Quant3_MulRoutedWeight1_FP4X2_FP4X2_B16,0.0013,833.853,0,0.0,0.0,flydsl_fallback
256,16384,4096,256,512,10,ActivationType.Silu,torch.bfloat16,torch.float4_e2m1fn_x2,torch.float4_e2m1fn_x2,QuantType.per_1x32,1,0,128,0,389.9102,moe_ck2stages_gemm1_256x128x128x128_1x4_MulABScaleShuffled_v3_Nswizzle0_Quant3_MulRoutedWeight0_silu_FP4X2_FP4X2_B16,0.0,1029.5149,moe_ck2stages_gemm2_64x128x128x128_1x1_MulABScaleExpertWeightShuffled_v3_Nswizzle0_Quant3_MulRoutedWeight1_FP4X2_FP4X2_B16,0.0013,1419.4251,0,0.0,0.0,flydsl_fallback
256,2048,4096,256,512,10,ActivationType.Silu,torch.bfloat16,torch.float4_e2m1fn_x2,torch.float4_e2m1fn_x2,QuantType.per_1x32,1,0,32,0,133.022,moe_ck2stages_gemm1_64x32x32x128_1x1_MulABScaleShuffled_v3_Nswizzle0_Quant3_MulRoutedWeight0_silu_FP4X2_FP4X2_B16,0.0,156.3546,moe_ck2stages_gemm2_64x32x32x128_1x1_MulABScaleExpertWeightShuffled_v1_Nswizzle0_Quant3_MulRoutedWeight1_FP4X2_FP4X2_B16,0.0013,289.3766,0,0.0,0.0,flydsl_fallback
256,4096,4096,256,512,10,ActivationType.Silu,torch.bfloat16,torch.float4_e2m1fn_x2,torch.float4_e2m1fn_x2,QuantType.per_1x32,1,0,128,0,155.1636,moe_ck2stages_gemm1_256x128x128x128_1x4_MulABScaleShuffled_v3_Nswizzle0_Quant3_MulRoutedWeight0_silu_FP4X2_FP4X2_B16,0.0,315.2138,moe_ck2stages_gemm2_64x128x128x128_1x1_MulABScaleExpertWeightShuffled_v3_Nswizzle0_Quant3_MulRoutedWeight1_FP4X2_FP4X2_B16,0.0013,470.3774,0,0.0,0.0,flydsl_fallback
256,1024,4096,256,512,10,ActivationType.Silu,torch.bfloat16,torch.float4_e2m1fn_x2,torch.float4_e2m1fn_x2,QuantType.per_1x32,1,0,32,0,110.2153,moe_ck2stages_gemm1_64x32x32x128_1x1_MulABScaleShuffled_v3_Nswizzle0_Quant3_MulRoutedWeight0_silu_FP4X2_FP4X2_B16,0.0,86.7293,moe_ck2stages_gemm2_64x32x32x128_1x1_MulABScaleExpertWeightShuffled_v1_Nswizzle0_Quant3_MulRoutedWeight1_FP4X2_FP4X2_B16,0.0013,196.9446,0,0.0,0.0,flydsl_fallback
