aiter/configs/model_configs/qwen35_bf16_tuned_gemm.csv
cu_num,M,N,K,bias,dtype,outdtype,scaleAB,bpreshuffle,libtype,solidx,splitK,us,kernelName,err_ratio,tflops,bw
80,1,5120,3072,False,torch.bfloat16,torch.bfloat16,False,False,hipblaslt,204196,0,12.3688,Cijk_Alik_Bljk_BBS_BH_UserArgs_MT32x16x256_MI16x16x1_SN_LDSB1_AFC0_AFEM1_AFEM1_ASEM1_CLR1_CADS0_DTLA0_DTLB0_DTVA0_DTVB0_EPS0_FDSI0_GRPM1_GRVWA8_GRVWB8_GSUAMB_GLS0_ISA942_IU1_K1_LDSTI0_LBSPPA1024_LBSPPB512_LBSPPM0_LPA16_LPB16_LPM0_LRVW8_LWPMn1_MIAV1_MIWT2_1_MO40_NTn1_NTA0_NTB0_NTC0_NTD0_NTM0_NEPBS0_NLCA1_NLCB1_ONLL1_PGR2_PLR1_PKA1_SIA3_SS1_SPO0_SRVW0_SSO0_SVW2_SK0_SKFTR0_SKXCCM0_TLDS1_ULSGRO0_USL1_UIOFGRO0_USFGROn1_VSn1_VWA2_VWB1_WSGRA0_WSGRB0_WS64_WG16_4_4,0.0,2.54,2544.6
80,1,5120,8704,False,torch.bfloat16,torch.bfloat16,False,False,hipblaslt,204195,0,26.6632,Cijk_Alik_Bljk_BBS_BH_UserArgs_MT32x16x256_MI16x16x1_SN_LDSB1_AFC0_AFEM1_AFEM1_ASEM1_CLR1_CADS0_DTLA0_DTLB0_DTVA0_DTVB0_EPS0_FDSI0_GRPM1_GRVWA8_GRVWB8_GSUAMB_GLS0_ISA942_IU1_K1_LDSTI0_LBSPPA1024_LBSPPB512_LBSPPM0_LPA16_LPB16_LPM0_LRVW8_LWPMn1_MIAV1_MIWT2_1_MO40_NTn1_NTA0_NTB0_NTC0_NTD0_NTM0_NEPBS0_NLCA1_NLCB1_ONLL1_PGR2_PLR1_PKA1_SIA3_SS1_SPO1_SRVW0_SSO0_SVW2_SK0_SKFTR0_SKXCCM0_TLDS1_ULSGRO0_USL1_UIOFGRO0_USFGROn1_VSn1_VWA2_VWB1_WSGRA0_WSGRB0_WS64_WG16_4_4,0.0,3.34,3343.81
80,2,5120,3072,False,torch.bfloat16,torch.bfloat16,False,False,hipblaslt,204196,0,12.2914,Cijk_Alik_Bljk_BBS_BH_UserArgs_MT32x16x256_MI16x16x1_SN_LDSB1_AFC0_AFEM1_AFEM1_ASEM1_CLR1_CADS0_DTLA0_DTLB0_DTVA0_DTVB0_EPS0_FDSI0_GRPM1_GRVWA8_GRVWB8_GSUAMB_GLS0_ISA942_IU1_K1_LDSTI0_LBSPPA1024_LBSPPB512_LBSPPM0_LPA16_LPB16_LPM0_LRVW8_LWPMn1_MIAV1_MIWT2_1_MO40_NTn1_NTA0_NTB0_NTC0_NTD0_NTM0_NEPBS0_NLCA1_NLCB1_ONLL1_PGR2_PLR1_PKA1_SIA3_SS1_SPO0_SRVW0_SSO0_SVW2_SK0_SKFTR0_SKXCCM0_TLDS1_ULSGRO0_USL1_UIOFGRO0_USFGROn1_VSn1_VWA2_VWB1_WSGRA0_WSGRB0_WS64_WG16_4_4,0.0,5.12,2561.96
80,2,5120,8704,False,torch.bfloat16,torch.bfloat16,False,False,hipblaslt,195794,0,27.1374,Cijk_Alik_Bljk_BBS_BH_Bias_HA_S_SAV_UserArgs_MT32x16x256_MI16x16x1_SN_LDSB1_AFC1_AFEM1_AFEM1_ASEM1_CLR1_CADS0_DTLA0_DTLB0_DTVA0_DTVB0_EPS0_FDSI0_GRPM1_GRVWA8_GRVWB8_GSUAMBSK_GLS0_ISA942_IU1_K1_LDSTI0_LBSPPA512_LBSPPB512_LBSPPM0_LPA16_LPB16_LPM0_LRVW8_LWPMn1_MIAV0_MIWT1_1_MO40_NTn1_NTA0_NTB0_NTC0_NTD4_NTM0_NEPBS8_NLCA1_NLCB1_ONLL1_PGR2_PLR1_PKA1_SIA3_SS1_SPO0_SRVW0_SSO0_SVW1_SK0_SKFTR0_SKXCCM0_TLDS1_ULSGRO0_USL1_UIOFGRO0_USFGROn1_VSn1_VWA1_VWB1_WSGRA0_WSGRB0_WS64_WG32_4_1,0.0,6.57,3286.4
80,4,5120,3072,False,torch.bfloat16,torch.bfloat16,False,False,hipblaslt,204195,0,12.181,Cijk_Alik_Bljk_BBS_BH_UserArgs_MT32x16x256_MI16x16x1_SN_LDSB1_AFC0_AFEM1_AFEM1_ASEM1_CLR1_CADS0_DTLA0_DTLB0_DTVA0_DTVB0_EPS0_FDSI0_GRPM1_GRVWA8_GRVWB8_GSUAMB_GLS0_ISA942_IU1_K1_LDSTI0_LBSPPA1024_LBSPPB512_LBSPPM0_LPA16_LPB16_LPM0_LRVW8_LWPMn1_MIAV1_MIWT2_1_MO40_NTn1_NTA0_NTB0_NTC0_NTD0_NTM0_NEPBS0_NLCA1_NLCB1_ONLL1_PGR2_PLR1_PKA1_SIA3_SS1_SPO1_SRVW0_SSO0_SVW2_SK0_SKFTR0_SKXCCM0_TLDS1_ULSGRO0_USL1_UIOFGRO0_USFGROn1_VSn1_VWA2_VWB1_WSGRA0_WSGRB0_WS64_WG16_4_4,0.0,10.33,2587.87
80,4,5120,8704,False,torch.bfloat16,torch.bfloat16,False,False,hipblaslt,204195,0,27.468,Cijk_Alik_Bljk_BBS_BH_UserArgs_MT32x16x256_MI16x16x1_SN_LDSB1_AFC0_AFEM1_AFEM1_ASEM1_CLR1_CADS0_DTLA0_DTLB0_DTVA0_DTVB0_EPS0_FDSI0_GRPM1_GRVWA8_GRVWB8_GSUAMB_GLS0_ISA942_IU1_K1_LDSTI0_LBSPPA1024_LBSPPB512_LBSPPM0_LPA16_LPB16_LPM0_LRVW8_LWPMn1_MIAV1_MIWT2_1_MO40_NTn1_NTA0_NTB0_NTC0_NTD0_NTM0_NEPBS0_NLCA1_NLCB1_ONLL1_PGR2_PLR1_PKA1_SIA3_SS1_SPO1_SRVW0_SSO0_SVW2_SK0_SKFTR0_SKXCCM0_TLDS1_ULSGRO0_USL1_UIOFGRO0_USFGROn1_VSn1_VWA2_VWB1_WSGRA0_WSGRB0_WS64_WG16_4_4,0.0,12.98,3248.86
80,8,5120,3072,False,torch.bfloat16,torch.bfloat16,False,False,hipblaslt,196958,0,13.1713,Cijk_Alik_Bljk_BBS_BH_Bias_HA_S_SAV_UserArgs_MT32x16x256_MI16x16x1_SN_LDSB1_AFC1_AFEM1_AFEM1_ASEM1_CLR1_CADS0_DTLA0_DTLB0_DTVA0_DTVB0_EPS0_FDSI0_GRPM1_GRVWA8_GRVWB8_GSUAMBSK_GLS0_ISA942_IU1_K1_LDSTI0_LBSPPA1024_LBSPPB512_LBSPPM0_LPA16_LPB16_LPM0_LRVW8_LWPMn1_MIAV0_MIWT2_1_MO40_NTn1_NTA0_NTB0_NTC0_NTD4_NTM0_NEPBS16_NLCA1_NLCB1_ONLL1_PGR2_PLR1_PKA1_SIA3_SS1_SPO0_SRVW0_SSO0_SVW2_SK0_SKFTR0_SKXCCM0_TLDS1_ULSGRO1_USL1_UIOFGRO0_USFGROn1_VSn1_VWA2_VWB1_WSGRA0_WSGRB0_WS64_WG16_4_4,0.0,19.11,2398.27
80,8,5120,8704,False,torch.bfloat16,torch.bfloat16,False,False,hipblaslt,204312,0,27.9965,Cijk_Alik_Bljk_BBS_BH_UserArgs_MT64x16x256_MI16x16x1_SN_LDSB1_AFC0_AFEM8_AFEM1_ASEM32_CLR1_CADS0_DTLA0_DTLB0_DTVA0_DTVB0_EPS0_FDSI0_GRPM1_GRVWA8_GRVWB8_GSUAMB_GLS0_ISA942_IU1_K1_LDSTI0_LBSPPA512_LBSPPB512_LBSPPM0_LPA16_LPB16_LPMn1_LRVW8_LWPMn1_MIAV0_MIWT1_1_MO40_NTn1_NTA0_NTB0_NTC0_NTD0_NTM0_NEPBS0_NLCA1_NLCB1_ONLL1_PGR2_PLR1_PKA1_SIA3_SS0_SPO0_SRVW0_SSO0_SVW4_SK0_SKFTR0_SKXCCM0_TLDS1_ULSGRO0_USL1_UIOFGRO0_USFGROn1_VSn1_VWA1_VWB1_WSGRA0_WSGRB0_WS64_WG64_4_1,0.0,25.47,3191.48
80,12,5120,3072,False,torch.bfloat16,torch.bfloat16,False,False,hipblaslt,197004,0,13.4469,Cijk_Alik_Bljk_BBS_BH_Bias_HA_S_SAV_UserArgs_MT32x16x256_MI16x16x1_SN_LDSB1_AFC1_AFEM1_AFEM1_ASEM1_CLR1_CADS0_DTLA0_DTLB0_DTVA0_DTVB0_EPS0_FDSI0_GRPM1_GRVWA8_GRVWB8_GSUAMBSK_GLS0_ISA942_IU1_K1_LDSTI0_LBSPPA1024_LBSPPB512_LBSPPM0_LPA16_LPB16_LPM0_LRVW8_LWPMn1_MIAV0_MIWT2_1_MO40_NTn1_NTA0_NTB0_NTC0_NTD4_NTM0_NEPBS16_NLCA1_NLCB1_ONLL1_PGR2_PLR1_PKA1_SIA3_SS1_SPO0_SRVW0_SSO0_SVW2_SK0_SKFTR0_SKXCCM0_TLDS1_ULSGRO0_USL1_UIOFGRO0_USFGROn1_VSn1_VWA2_VWB1_WSGRA0_WSGRB0_WS64_WG16_4_4,0.0,28.07,2353.99
80,12,5120,8704,False,torch.bfloat16,torch.bfloat16,False,False,hipblaslt,196957,0,28.7431,Cijk_Alik_Bljk_BBS_BH_Bias_HA_S_SAV_UserArgs_MT64x16x256_MI16x16x1_SN_LDSB1_AFC1_AFEM1_AFEM1_ASEM1_CLR1_CADS0_DTLA0_DTLB0_DTVA0_DTVB0_EPS0_FDSI0_GRPM1_GRVWA8_GRVWB8_GSUAMBSK_GLS0_ISA942_IU1_K1_LDSTI0_LBSPPA512_LBSPPB512_LBSPPM0_LPA16_LPB16_LPM0_LRVW8_LWPMn1_MIAV0_MIWT1_1_MO40_NTn1_NTA0_NTB0_NTC0_NTD4_NTM0_NEPBS16_NLCA1_NLCB1_ONLL1_PGR2_PLR1_PKA1_SIA3_SS1_SPO0_SRVW0_SSO0_SVW1_SK0_SKFTR0_SKXCCM0_TLDS1_ULSGRO0_USL1_UIOFGRO0_USFGROn1_VSn1_VWA1_VWB1_WSGRA0_WSGRB0_WS64_WG64_4_1,0.0,37.21,3112.42
80,16,5120,3072,False,torch.bfloat16,torch.bfloat16,False,False,hipblaslt,195794,0,13.2966,Cijk_Alik_Bljk_BBS_BH_Bias_HA_S_SAV_UserArgs_MT32x16x256_MI16x16x1_SN_LDSB1_AFC1_AFEM1_AFEM1_ASEM1_CLR1_CADS0_DTLA0_DTLB0_DTVA0_DTVB0_EPS0_FDSI0_GRPM1_GRVWA8_GRVWB8_GSUAMBSK_GLS0_ISA942_IU1_K1_LDSTI0_LBSPPA512_LBSPPB512_LBSPPM0_LPA16_LPB16_LPM0_LRVW8_LWPMn1_MIAV0_MIWT1_1_MO40_NTn1_NTA0_NTB0_NTC0_NTD4_NTM0_NEPBS8_NLCA1_NLCB1_ONLL1_PGR2_PLR1_PKA1_SIA3_SS1_SPO0_SRVW0_SSO0_SVW1_SK0_SKFTR0_SKXCCM0_TLDS1_ULSGRO0_USL1_UIOFGRO0_USFGROn1_VSn1_VWA1_VWB1_WSGRA0_WSGRB0_WS64_WG32_4_1,0.0,37.85,2385.53
80,16,5120,8704,False,torch.bfloat16,torch.bfloat16,False,False,hipblaslt,204312,0,28.0714,Cijk_Alik_Bljk_BBS_BH_UserArgs_MT64x16x256_MI16x16x1_SN_LDSB1_AFC0_AFEM8_AFEM1_ASEM32_CLR1_CADS0_DTLA0_DTLB0_DTVA0_DTVB0_EPS0_FDSI0_GRPM1_GRVWA8_GRVWB8_GSUAMB_GLS0_ISA942_IU1_K1_LDSTI0_LBSPPA512_LBSPPB512_LBSPPM0_LPA16_LPB16_LPMn1_LRVW8_LWPMn1_MIAV0_MIWT1_1_MO40_NTn1_NTA0_NTB0_NTC0_NTD0_NTM0_NEPBS0_NLCA1_NLCB1_ONLL1_PGR2_PLR1_PKA1_SIA3_SS0_SPO0_SRVW0_SSO0_SVW4_SK0_SKFTR0_SKXCCM0_TLDS1_ULSGRO0_USL1_UIOFGRO0_USFGROn1_VSn1_VWA1_VWB1_WSGRA0_WSGRB0_WS64_WG64_4_1,0.0,50.8,3190.84
80,24,5120,3072,False,torch.bfloat16,torch.bfloat16,False,False,hipblaslt,197075,0,14.6619,Cijk_Alik_Bljk_BBS_BH_Bias_HA_S_SAV_UserArgs_MT64x32x256_MI16x16x1_SN_LDSB1_AFC1_AFEM1_AFEM1_ASEM1_CLR1_CADS0_DTLA0_DTLB0_DTVA0_DTVB0_EPS0_FDSI0_GRPM1_GRVWA8_GRVWB8_GSUAMBSK_GLS0_ISA942_IU1_K1_LDSTI0_LBSPPA2048_LBSPPB1024_LBSPPM0_LPA16_LPB16_LPM0_LRVW8_LWPMn1_MIAV0_MIWT4_2_MO40_NTn1_NTA0_NTB0_NTC0_NTD4_NTM0_NEPBS16_NLCA1_NLCB1_ONLL1_PGR2_PLR1_PKA1_SIA3_SS1_SPO0_SRVW0_SSO0_SVW4_SK0_SKFTR0_SKXCCM0_TLDS1_ULSGRO0_USL1_UIOFGRO0_USFGROn1_VSn1_VWA4_VWB2_WSGRA0_WSGRB0_WS64_WG16_4_4,0.0,51.49,2172.33
80,24,5120,8704,False,torch.bfloat16,torch.bfloat16,False,False,hipblaslt,197075,0,30.5896,Cijk_Alik_Bljk_BBS_BH_Bias_HA_S_SAV_UserArgs_MT64x32x256_MI16x16x1_SN_LDSB1_AFC1_AFEM1_AFEM1_ASEM1_CLR1_CADS0_DTLA0_DTLB0_DTVA0_DTVB0_EPS0_FDSI0_GRPM1_GRVWA8_GRVWB8_GSUAMBSK_GLS0_ISA942_IU1_K1_LDSTI0_LBSPPA2048_LBSPPB1024_LBSPPM0_LPA16_LPB16_LPM0_LRVW8_LWPMn1_MIAV0_MIWT4_2_MO40_NTn1_NTA0_NTB0_NTC0_NTD4_NTM0_NEPBS16_NLCA1_NLCB1_ONLL1_PGR2_PLR1_PKA1_SIA3_SS1_SPO0_SRVW0_SSO0_SVW4_SK0_SKFTR0_SKXCCM0_TLDS1_ULSGRO0_USL1_UIOFGRO0_USFGROn1_VSn1_VWA4_VWB2_WSGRA0_WSGRB0_WS64_WG16_4_4,0.0,69.93,2935.39
80,32,5120,3072,False,torch.bfloat16,torch.bfloat16,False,False,hipblaslt,204208,0,14.0209,Cijk_Alik_Bljk_BBS_BH_UserArgs_MT64x32x256_MI16x16x1_SN_LDSB1_AFC0_AFEM1_AFEM1_ASEM1_CLR1_CADS0_DTLA0_DTLB0_DTVA0_DTVB0_EPS0_FDSI0_GRPM1_GRVWA8_GRVWB8_GSUAMB_GLS0_ISA942_IU1_K1_LDSTI0_LBSPPA2048_LBSPPB512_LBSPPM0_LPA16_LPB16_LPM0_LRVW8_LWPMn1_MIAV1_MIWT4_2_MO40_NTn1_NTA0_NTB0_NTC3_NTD3_NTM0_NEPBS0_NLCA1_NLCB1_ONLL1_PGR2_PLR1_PKA1_SIA3_SS1_SPO0_SRVW0_SSO0_SVW4_SK0_SKFTR0_SKXCCM0_TLDS1_ULSGRO0_USL1_UIOFGRO0_USFGROn1_VSn1_VWA4_VWB1_WSGRA0_WSGRB0_WS64_WG16_4_4,0.0,71.8,2280.99
80,32,5120,8704,False,torch.bfloat16,torch.bfloat16,False,False,hipblaslt,197077,0,30.6227,Cijk_Alik_Bljk_BBS_BH_Bias_HA_S_SAV_UserArgs_MT64x32x256_MI16x16x1_SN_LDSB1_AFC1_AFEM1_AFEM1_ASEM1_CLR1_CADS0_DTLA0_DTLB0_DTVA0_DTVB0_EPS0_FDSI0_GRPM1_GRVWA8_GRVWB8_GSUAMBSK_GLS0_ISA942_IU1_K1_LDSTI0_LBSPPA2048_LBSPPB1024_LBSPPM0_LPA16_LPB16_LPM0_LRVW8_LWPMn1_MIAV0_MIWT4_2_MO40_NTn1_NTA0_NTB0_NTC0_NTD4_NTM0_NEPBS16_NLCA1_NLCB1_ONLL1_PGR2_PLR1_PKA1_SIA3_SS1_SPO0_SRVW0_SSO0_SVW4_SK0_SKFTR0_SKXCCM0_TLDS1_ULSGRO0_USL1_UIOFGRO0_USFGROn1_VSn1_VWA4_VWB2_WSGRA0_WSGRB0_WS64_WG16_4_4,0.0,93.14,2939.44
80,40,5120,3072,False,torch.bfloat16,torch.bfloat16,False,False,hipblaslt,196654,0,17.0924,Cijk_Alik_Bljk_BBS_BH_Bias_HA_S_SAV_UserArgs_MT64x48x256_MI16x16x1_SN_LDSB1_AFC1_AFEM1_AFEM1_ASEM1_CLR1_CADS0_DTLA0_DTLB0_DTVA0_DTVB0_EPS0_FDSI0_GRPM1_GRVWA8_GRVWB8_GSUAMBSK_GLS0_ISA942_IU1_K1_LDSTI0_LBSPPA2048_LBSPPB512_LBSPPM0_LPA16_LPB16_LPM0_LRVW8_LWPMn1_MIAV0_MIWT4_3_MO40_NTn1_NTA0_NTB0_NTC0_NTD4_NTM0_NEPBS8_NLCA1_NLCB1_ONLL1_PGR2_PLR1_PKA1_SIA3_SS1_SPO0_SRVW0_SSO0_SVW4_SK0_SKFTR0_SKXCCM0_TLDS1_ULSGRO0_USL1_UIOFGRO0_USFGROn1_VSn1_VWA4_VWB1_WSGRA0_WSGRB0_WS64_WG16_4_4,0.0,73.62,1878.77
80,40,5120,8704,False,torch.bfloat16,torch.bfloat16,False,False,hipblaslt,197095,0,36.2525,Cijk_Alik_Bljk_BBS_BH_Bias_HA_S_SAV_UserArgs_MT64x48x256_MI16x16x1_SN_LDSB1_AFC1_AFEM1_AFEM1_ASEM1_CLR1_CADS0_DTLA0_DTLB0_DTVA0_DTVB0_EPS0_FDSI0_GRPM1_GRVWA8_GRVWB8_GSUAMBSK_GLS0_ISA942_IU1_K1_LDSTI0_LBSPPA2048_LBSPPB512_LBSPPM0_LPA16_LPB16_LPM0_LRVW8_LWPMn1_MIAV0_MIWT4_3_MO40_NTn1_NTA0_NTB0_NTC0_NTD4_NTM0_NEPBS16_NLCA1_NLCB1_ONLL1_PGR2_PLR1_PKA1_SIA3_SS1_SPO0_SRVW0_SSO0_SVW4_SK0_SKFTR0_SKXCCM0_TLDS1_ULSGRO1_USL1_UIOFGRO0_USFGROn1_VSn1_VWA4_VWB1_WSGRA0_WSGRB0_WS64_WG16_4_4,0.0,98.34,2489.07
80,48,5120,3072,False,torch.bfloat16,torch.bfloat16,False,False,hipblaslt,197095,0,16.6469,Cijk_Alik_Bljk_BBS_BH_Bias_HA_S_SAV_UserArgs_MT64x48x256_MI16x16x1_SN_LDSB1_AFC1_AFEM1_AFEM1_ASEM1_CLR1_CADS0_DTLA0_DTLB0_DTVA0_DTVB0_EPS0_FDSI0_GRPM1_GRVWA8_GRVWB8_GSUAMBSK_GLS0_ISA942_IU1_K1_LDSTI0_LBSPPA2048_LBSPPB512_LBSPPM0_LPA16_LPB16_LPM0_LRVW8_LWPMn1_MIAV0_MIWT4_3_MO40_NTn1_NTA0_NTB0_NTC0_NTD4_NTM0_NEPBS16_NLCA1_NLCB1_ONLL1_PGR2_PLR1_PKA1_SIA3_SS1_SPO0_SRVW0_SSO0_SVW4_SK0_SKFTR0_SKXCCM0_TLDS1_ULSGRO1_USL1_UIOFGRO0_USFGROn1_VSn1_VWA4_VWB1_WSGRA0_WSGRB0_WS64_WG16_4_4,0.0,90.7,1936.92
80,48,5120,8704,False,torch.bfloat16,torch.bfloat16,False,False,hipblaslt,196951,0,35.3805,Cijk_Alik_Bljk_BBS_BH_Bias_HA_S_SAV_UserArgs_MT64x48x256_MI16x16x1_SN_LDSB1_AFC1_AFEM1_AFEM1_ASEM1_CLR1_CADS0_DTLA0_DTLB0_DTVA0_DTVB0_EPS0_FDSI0_GRPM1_GRVWA8_GRVWB8_GSUAMBSK_GLS0_ISA942_IU1_K1_LDSTI0_LBSPPA2048_LBSPPB512_LBSPPM0_LPA16_LPB16_LPM0_LRVW8_LWPMn1_MIAV0_MIWT4_3_MO40_NTn1_NTA0_NTB0_NTC0_NTD4_NTM0_NEPBS16_NLCA1_NLCB1_ONLL1_PGR2_PLR1_PKA1_SIA3_SS1_SPO0_SRVW0_SSO0_SVW4_SK0_SKFTR0_SKXCCM0_TLDS1_ULSGRO1_USL1_UIOFGRO0_USFGROn1_VSn1_VWA4_VWB1_WSGRA0_WSGRB0_WS64_WG16_4_4,0.0,120.92,2556.66
80,56,5120,3072,False,torch.bfloat16,torch.bfloat16,False,False,hipblaslt,204261,0,21.0286,Cijk_Alik_Bljk_BBS_BH_UserArgs_MT64x64x128_MI16x16x1_SN_LDSB1_AFC0_AFEM8_AFEM8_ASEM32_CLR1_CADS0_DTLA0_DTLB0_DTVA0_DTVB0_EPS0_FDSI0_GRPM1_GRVWA8_GRVWB8_GSUAMB_GLS0_ISA942_IU1_K1_LDSTI0_LBSPPA512_LBSPPB256_LBSPPM0_LPA16_LPB16_LPMn1_LRVW8_LWPMn1_MIAV0_MIWT2_2_MO40_NTn1_NTA0_NTB0_NTC0_NTD0_NTM0_NEPBS0_NLCA1_NLCB1_ONLL1_PGR2_PLR1_PKA1_SIA3_SS1_SPO0_SRVW0_SSO0_SVW2_SK0_SKFTR0_SKXCCM0_TLDS1_ULSGRO0_USL1_UIOFGRO0_USFGROn1_VSn1_VWA2_VWB1_WSGRA0_WSGRB0_WS64_WG32_8_1,0.0,83.77,1539.56
80,56,5120,8704,False,torch.bfloat16,torch.bfloat16,False,False,hipblaslt,197270,0,46.8181,Cijk_Alik_Bljk_BBS_BH_Bias_HA_S_SAV_UserArgs_MT128x64x128_MI16x16x1_SN_LDSB1_AFC1_AFEM1_AFEM1_ASEM1_CLR1_CADS0_DTLA0_DTLB0_DTVA0_DTVB0_EPS0_FDSI0_GRPM1_GRVWA8_GRVWB8_GSUAMBSK_GLS0_ISA942_IU1_K1_LDSTI0_LBSPPA1024_LBSPPB512_LBSPPM0_LPA16_LPB16_LPM0_LRVW8_LWPMn1_MIAV0_MIWT4_2_MO40_NTn1_NTA0_NTB0_NTC0_NTD4_NTM0_NEPBS16_NLCA1_NLCB1_ONLL1_PGR2_PLR1_PKA1_SIA3_SS1_SPO0_SRVW0_SSO0_SVW4_SK0_SKFTR0_SKXCCM0_TLDS1_ULSGRO1_USL1_UIOFGRO0_USFGROn1_VSn1_VWA4_VWB2_WSGRA0_WSGRB0_WS64_WG32_8_1,0.0,106.61,1936.8
80,64,5120,3072,False,torch.bfloat16,torch.bfloat16,False,False,hipblaslt,197863,0,21.3825,Cijk_Alik_Bljk_BBS_BH_Bias_HA_S_SAV_UserArgs_MT64x64x128_MI16x16x1_SN_LDSB1_AFC1_AFEM1_AFEM1_ASEM1_CLR1_CADS0_DTLA0_DTLB0_DTVA0_DTVB0_EPS0_FDSI0_GRPM1_GRVWA8_GRVWB8_GSUAMB_GLS0_ISA942_IU1_K1_LDSTI0_LBSPPA1024_LBSPPB512_LBSPPM0_LPA16_LPB16_LPM0_LRVW8_LWPMn1_MIAV0_MIWT4_2_MO40_NTn1_NTA0_NTB0_NTC0_NTD7_NTM0_NEPBS8_NLCA1_NLCB1_ONLL1_PGR2_PLR1_PKA1_SIA3_SS1_SPO0_SRVW0_SSO0_SVW4_SK0_SKFTR0_SKXCCM0_TLDS1_ULSGRO1_USL1_UIOFGRO0_USFGROn1_VSn1_VWA4_VWB2_WSGRA0_WSGRB0_WS64_WG16_8_2,0.0,94.15,1520.21
80,64,5120,8704,False,torch.bfloat16,torch.bfloat16,False,False,hipblaslt,195988,0,38.4591,Cijk_Alik_Bljk_BBS_BH_Bias_HA_S_SAV_UserArgs_MT128x64x128_MI16x16x1_SN_LDSB1_AFC1_AFEM1_AFEM1_ASEM1_CLR1_CADS0_DTLA0_DTLB0_DTVA0_DTVB0_EPS0_FDSI0_GRPM1_GRVWA8_GRVWB8_GSUAMBSK_GLS0_ISA942_IU1_K1_LDSTI0_LBSPPA1024_LBSPPB256_LBSPPM0_LPA16_LPB16_LPM0_LRVW8_LWPMn1_MIAV0_MIWT4_4_MO40_NTn1_NTA0_NTB0_NTC0_NTD4_NTM0_NEPBS8_NLCA1_NLCB1_ONLL1_PGR2_PLR1_PKA1_SIA3_SS1_SPO0_SRVW0_SSO0_SVW4_SK0_SKFTR0_SKXCCM0_TLDS1_ULSGRO0_USL1_UIOFGRO0_USFGROn1_VSn1_VWA4_VWB1_WSGRA0_WSGRB0_WS64_WG32_4_2,0.0,148.32,2363.51
80,72,5120,3072,False,torch.bfloat16,torch.bfloat16,False,False,hipblaslt,204360,0,25.5876,Cijk_Alik_Bljk_BBS_BH_UserArgs_MT128x96x128_MI16x16x1_SN_LDSB1_AFC0_AFEM4_AFEM1_ASEM8_CLR1_CADS0_DTLA0_DTLB0_DTVA0_DTVB0_EPS0_FDSI0_GRPM0p40_GRVWA8_GRVWB8_GSUAMBSK_GLS0_ISA942_IU1_K1_LDSTI0_LBSPPA1024_LBSPPB256_LBSPPM0_LPA16_LPB16_LPM0_LRVW8_LWPM0p30_MIAV0_MIWT4_3_MO40_NTn1_NTA2_NTB0_NTC1_NTD3_NTM0_NEPBS0_NLCA1_NLCB1_ONLL0_PGR2_PLR1_PKA1_SIA3_SS1_SPO1_SRVW0_SSO0_SVW4_SK0_SKFTR0_SKXCCM0_TLDS2_ULSGRO1_USL1_UIOFGRO0_USFGROn1_VSn1_VWA4_VWB1_WSGRA0_WSGRB1_WS64_WG32_8_1,0.0,88.52,1275.5
80,72,5120,8704,False,torch.bfloat16,torch.bfloat16,False,False,hipblaslt,197296,0,54.3516,Cijk_Alik_Bljk_BBS_BH_Bias_HA_S_SAV_UserArgs_MT128x80x128_MI16x16x1_SN_LDSB1_AFC1_AFEM1_AFEM1_ASEM1_CLR1_CADS0_DTLA0_DTLB0_DTVA0_DTVB0_EPS0_FDSI0_GRPM1_GRVWA8_GRVWB8_GSUAMBSK_GLS0_ISA942_IU1_K1_LDSTI0_LBSPPA1024_LBSPPB256_LBSPPM0_LPA16_LPB16_LPM0_LRVW8_LWPMn1_MIAV0_MIWT4_5_MO40_NTn1_NTA0_NTB0_NTC0_NTD4_NTM0_NEPBS16_NLCA1_NLCB1_ONLL1_PGR2_PLR1_PKA1_SIA3_SS1_SPO0_SRVW0_SSO0_SVW4_SK0_SKFTR0_SKXCCM0_TLDS1_ULSGRO1_USL1_UIOFGRO0_USFGROn1_VSn1_VWA4_VWB1_WSGRA0_WSGRB0_WS64_WG32_4_2,0.0,118.07,1676.48
80,80,5120,3072,False,torch.bfloat16,torch.bfloat16,False,False,hipblaslt,197135,0,26.4124,Cijk_Alik_Bljk_BBS_BH_Bias_HA_S_SAV_UserArgs_MT64x80x128_MI16x16x1_SN_LDSB1_AFC1_AFEM1_AFEM1_ASEM1_CLR1_CADS0_DTLA0_DTLB0_DTVA0_DTVB0_EPS0_FDSI0_GRPM1_GRVWA8_GRVWB8_GSUAMBSK_GLS0_ISA942_IU1_K1_LDSTI0_LBSPPA512_LBSPPB256_LBSPPM0_LPA16_LPB16_LPM0_LRVW8_LWPMn1_MIAV0_MIWT2_5_MO40_NTn1_NTA0_NTB0_NTC0_NTD4_NTM0_NEPBS16_NLCA1_NLCB1_ONLL1_PGR2_PLR1_PKA1_SIA3_SS1_SPO0_SRVW0_SSO0_SVW2_SK0_SKFTR0_SKXCCM0_TLDS1_ULSGRO0_USL1_UIOFGRO0_USFGROn1_VSn1_VWA2_VWB1_WSGRA0_WSGRB0_WS64_WG32_4_2,0.0,95.28,1240.63
80,80,5120,8704,False,torch.bfloat16,torch.bfloat16,False,False,hipblaslt,197296,0,55.4383,Cijk_Alik_Bljk_BBS_BH_Bias_HA_S_SAV_UserArgs_MT128x80x128_MI16x16x1_SN_LDSB1_AFC1_AFEM1_AFEM1_ASEM1_CLR1_CADS0_DTLA0_DTLB0_DTVA0_DTVB0_EPS0_FDSI0_GRPM1_GRVWA8_GRVWB8_GSUAMBSK_GLS0_ISA942_IU1_K1_LDSTI0_LBSPPA1024_LBSPPB256_LBSPPM0_LPA16_LPB16_LPM0_LRVW8_LWPMn1_MIAV0_MIWT4_5_MO40_NTn1_NTA0_NTB0_NTC0_NTD4_NTM0_NEPBS16_NLCA1_NLCB1_ONLL1_PGR2_PLR1_PKA1_SIA3_SS1_SPO0_SRVW0_SSO0_SVW4_SK0_SKFTR0_SKXCCM0_TLDS1_ULSGRO1_USL1_UIOFGRO0_USFGROn1_VSn1_VWA4_VWB1_WSGRA0_WSGRB0_WS64_WG32_4_2,0.0,128.62,1647.61
80,88,5120,3072,False,torch.bfloat16,torch.bfloat16,False,False,hipblaslt,204360,0,26.1334,Cijk_Alik_Bljk_BBS_BH_UserArgs_MT128x96x128_MI16x16x1_SN_LDSB1_AFC0_AFEM4_AFEM1_ASEM8_CLR1_CADS0_DTLA0_DTLB0_DTVA0_DTVB0_EPS0_FDSI0_GRPM0p40_GRVWA8_GRVWB8_GSUAMBSK_GLS0_ISA942_IU1_K1_LDSTI0_LBSPPA1024_LBSPPB256_LBSPPM0_LPA16_LPB16_LPM0_LRVW8_LWPM0p30_MIAV0_MIWT4_3_MO40_NTn1_NTA2_NTB0_NTC1_NTD3_NTM0_NEPBS0_NLCA1_NLCB1_ONLL0_PGR2_PLR1_PKA1_SIA3_SS1_SPO1_SRVW0_SSO0_SVW4_SK0_SKFTR0_SKXCCM0_TLDS2_ULSGRO1_USL1_UIOFGRO0_USFGROn1_VSn1_VWA4_VWB1_WSGRA0_WSGRB1_WS64_WG32_8_1,0.0,105.93,1258.89
80,88,5120,8704,False,torch.bfloat16,torch.bfloat16,False,False,hipblaslt,197324,0,58.6934,Cijk_Alik_Bljk_BBS_BH_Bias_HA_S_SAV_UserArgs_MT128x96x128_MI16x16x1_SN_LDSB1_AFC1_AFEM1_AFEM1_ASEM1_CLR1_CADS0_DTLA0_DTLB0_DTVA0_DTVB0_EPS0_FDSI0_GRPM1_GRVWA8_GRVWB8_GSUAMBSK_GLS0_ISA942_IU1_K1_LDSTI0_LBSPPA2048_LBSPPB256_LBSPPM0_LPA16_LPB16_LPM0_LRVW8_LWPMn1_MIAV0_MIWT8_3_MO40_NTn1_NTA0_NTB0_NTC0_NTD4_NTM0_NEPBS16_NLCA1_NLCB1_ONLL1_PGR2_PLR1_PKA1_SIA3_SS1_SPO0_SRVW0_SSO0_SVW8_SK0_SKFTR0_SKXCCM0_TLDS1_ULSGRO1_USL1_UIOFGRO0_USFGROn1_VSn1_VWA8_VWB1_WSGRA0_WSGRB0_WS64_WG16_8_2,0.0,133.63,1560.0
80,96,5120,3072,False,torch.bfloat16,torch.bfloat16,False,False,hipblaslt,204360,0,26.002,Cijk_Alik_Bljk_BBS_BH_UserArgs_MT128x96x128_MI16x16x1_SN_LDSB1_AFC0_AFEM4_AFEM1_ASEM8_CLR1_CADS0_DTLA0_DTLB0_DTVA0_DTVB0_EPS0_FDSI0_GRPM0p40_GRVWA8_GRVWB8_GSUAMBSK_GLS0_ISA942_IU1_K1_LDSTI0_LBSPPA1024_LBSPPB256_LBSPPM0_LPA16_LPB16_LPM0_LRVW8_LWPM0p30_MIAV0_MIWT4_3_MO40_NTn1_NTA2_NTB0_NTC1_NTD3_NTM0_NEPBS0_NLCA1_NLCB1_ONLL0_PGR2_PLR1_PKA1_SIA3_SS1_SPO1_SRVW0_SSO0_SVW4_SK0_SKFTR0_SKXCCM0_TLDS2_ULSGRO1_USL1_UIOFGRO0_USFGROn1_VSn1_VWA4_VWB1_WSGRA0_WSGRB1_WS64_WG32_8_1,0.0,116.14,1270.29
80,96,5120,8704,False,torch.bfloat16,torch.bfloat16,False,False,hipblaslt,196931,0,58.8528,Cijk_Alik_Bljk_BBS_BH_Bias_HA_S_SAV_UserArgs_MT128x96x128_MI16x16x1_SN_LDSB1_AFC1_AFEM1_AFEM1_ASEM1_CLR1_CADS0_DTLA0_DTLB0_DTVA0_DTVB0_EPS0_FDSI0_GRPM1_GRVWA8_GRVWB8_GSUAMBSK_GLS0_ISA942_IU1_K1_LDSTI0_LBSPPA1024_LBSPPB512_LBSPPM0_LPA16_LPB16_LPM0_LRVW8_LWPMn1_MIAV0_MIWT4_6_MO40_NTn1_NTA0_NTB0_NTC0_NTD4_NTM0_NEPBS16_NLCA1_NLCB1_ONLL1_PGR2_PLR1_PKA1_SIA3_SS1_SPO0_SRVW0_SSO0_SVW4_SK0_SKFTR0_SKXCCM0_TLDS1_ULSGRO1_USL1_UIOFGRO0_USFGROn1_VSn1_VWA4_VWB2_WSGRA0_WSGRB0_WS64_WG32_4_2,0.0,145.39,1559.54
80,104,5120,3072,False,torch.bfloat16,torch.bfloat16,False,False,hipblaslt,204350,0,29.3258,Cijk_Alik_Bljk_BBS_BH_UserArgs_MT128x64x128_MI16x16x1_SN_LDSB1_AFC0_AFEM1_AFEM1_ASEM1_CLR1_CADS0_DTLA0_DTLB0_DTVA0_DTVB0_EPS0_FDSI0_GRPM1_GRVWA8_GRVWB8_GSUAMB_GLS0_ISA942_IU1_K1_LDSTI0_LBSPPA1024_LBSPPB1024_LBSPPM0_LPA16_LPB16_LPM0_LRVW8_LWPMn1_MIAV0_MIWT4_4_MO40_NTn1_NTA0_NTB0_NTC0_NTD7_NTM0_NEPBS8_NLCA1_NLCB1_ONLL1_PGR2_PLR1_PKA1_SIA3_SS1_SPO0_SRVW0_SSO0_SVW4_SK0_SKFTR0_SKXCCM0_TLDS1_ULSGRO1_USL1_UIOFGRO0_USFGROn1_VSn1_VWA4_VWB4_WSGRA0_WSGRB0_WS64_WG32_4_2,0.0,111.56,1130.79
80,104,5120,8704,False,torch.bfloat16,torch.bfloat16,False,False,hipblaslt,197348,0,67.3358,Cijk_Alik_Bljk_BBS_BH_Bias_HA_S_SAV_UserArgs_MT128x112x128_MI16x16x1_SN_LDSB1_AFC1_AFEM1_AFEM1_ASEM1_CLR1_CADS0_DTLA0_DTLB0_DTVA0_DTVB0_EPS0_FDSI0_GRPM1_GRVWA8_GRVWB8_GSUAMBSK_GLS0_ISA942_IU1_K1_LDSTI0_LBSPPA2048_LBSPPB256_LBSPPM0_LPA16_LPB16_LPM0_LRVW8_LWPMn1_MIAV0_MIWT8_7_MO40_NTn1_NTA0_NTB0_NTC0_NTD4_NTM0_NEPBS16_NLCA1_NLCB1_ONLL1_PGR2_PLR1_PKA1_SIA3_SS1_SPO0_SRVW0_SSO0_SVW8_SK0_SKFTR0_SKXCCM0_TLDS1_ULSGRO1_USL1_UIOFGRO0_USFGROn1_VSn1_VWA8_VWB1_WSGRA0_WSGRB0_WS64_WG16_4_4,0.0,137.66,1366.35
80,112,5120,3072,False,torch.bfloat16,torch.bfloat16,False,False,hipblaslt,204316,0,30.1877,Cijk_Alik_Bljk_BBS_BH_UserArgs_MT64x128x128_MI16x16x1_SN_LDSB1_AFC0_AFEM8_AFEM8_ASEM32_CLR1_CADS0_DTLA0_DTLB0_DTVA0_DTVB0_EPS0_FDSI0_GRPM1_GRVWA8_GRVWB8_GSUAMB_GLS0_ISA942_IU1_K1_LDSTI0_LBSPPA1024_LBSPPB256_LBSPPM0_LPA16_LPB16_LPMn1_LRVW8_LWPMn1_MIAV0_MIWT4_4_MO40_NTn1_NTA0_NTB0_NTC0_NTD0_NTM0_NEPBS0_NLCA1_NLCB1_ONLL1_PGR2_PLR1_PKA1_SIA3_SS1_SPO0_SRVW0_SSO0_SVW4_SK0_SKFTR0_SKXCCM0_TLDS1_ULSGRO0_USL1_UIOFGRO0_USFGROn1_VSn1_VWA4_VWB1_WSGRA0_WSGRB0_WS64_WG16_8_2,0.0,116.71,1102.84
80,112,5120,8704,False,torch.bfloat16,torch.bfloat16,False,False,hipblaslt,197348,0,66.2774,Cijk_Alik_Bljk_BBS_BH_Bias_HA_S_SAV_UserArgs_MT128x112x128_MI16x16x1_SN_LDSB1_AFC1_AFEM1_AFEM1_ASEM1_CLR1_CADS0_DTLA0_DTLB0_DTVA0_DTVB0_EPS0_FDSI0_GRPM1_GRVWA8_GRVWB8_GSUAMBSK_GLS0_ISA942_IU1_K1_LDSTI0_LBSPPA2048_LBSPPB256_LBSPPM0_LPA16_LPB16_LPM0_LRVW8_LWPMn1_MIAV0_MIWT8_7_MO40_NTn1_NTA0_NTB0_NTC0_NTD4_NTM0_NEPBS16_NLCA1_NLCB1_ONLL1_PGR2_PLR1_PKA1_SIA3_SS1_SPO0_SRVW0_SSO0_SVW8_SK0_SKFTR0_SKXCCM0_TLDS1_ULSGRO1_USL1_UIOFGRO0_USFGROn1_VSn1_VWA8_VWB1_WSGRA0_WSGRB0_WS64_WG16_4_4,0.0,150.62,1391.51
80,120,5120,3072,False,torch.bfloat16,torch.bfloat16,False,False,hipblaslt,197274,0,30.638,Cijk_Alik_Bljk_BBS_BH_Bias_HA_S_SAV_UserArgs_MT128x64x128_MI16x16x1_SN_LDSB1_AFC1_AFEM1_AFEM1_ASEM1_CLR1_CADS0_DTLA0_DTLB0_DTVA0_DTVB0_EPS0_FDSI0_GRPM1_GRVWA8_GRVWB8_GSUAMBSK_GLS0_ISA942_IU1_K1_LDSTI0_LBSPPA1024_LBSPPB1024_LBSPPM0_LPA16_LPB16_LPM0_LRVW8_LWPMn1_MIAV0_MIWT4_4_MO40_NTn1_NTA0_NTB0_NTC0_NTD4_NTM0_NEPBS16_NLCA1_NLCB1_ONLL1_PGR2_PLR1_PKA1_SIA3_SS1_SPO0_SRVW0_SSO0_SVW4_SK0_SKFTR0_SKXCCM0_TLDS1_ULSGRO1_USL1_UIOFGRO0_USFGROn1_VSn1_VWA4_VWB4_WSGRA0_WSGRB0_WS64_WG32_4_2,0.0,123.21,1090.91
80,120,5120,8704,False,torch.bfloat16,torch.bfloat16,False,False,hipblaslt,196673,0,73.5417,Cijk_Alik_Bljk_BBS_BH_Bias_HA_S_SAV_UserArgs_MT128x64x128_MI16x16x1_SN_LDSB1_AFC1_AFEM1_AFEM1_ASEM1_CLR1_CADS0_DTLA0_DTLB0_DTVA0_DTVB0_EPS0_FDSI0_GRPM1_GRVWA8_GRVWB8_GSUAMBSK_GLS0_ISA942_IU1_K1_LDSTI0_LBSPPA1024_LBSPPB1024_LBSPPM0_LPA16_LPB16_LPM0_LRVW8_LWPMn1_MIAV0_MIWT4_4_MO40_NTn1_NTA0_NTB0_NTC0_NTD4_NTM0_NEPBS8_NLCA1_NLCB1_ONLL1_PGR2_PLR1_PKA1_SIA3_SS1_SPO0_SRVW0_SSO0_SVW4_SK0_SKFTR0_SKXCCM0_TLDS1_ULSGRO1_USL1_UIOFGRO0_USFGROn1_VSn1_VWA4_VWB4_WSGRA0_WSGRB0_WS64_WG32_4_2,0.0,145.43,1257.07
80,128,5120,3072,False,torch.bfloat16,torch.bfloat16,False,False,hipblaslt,204350,0,30.479,Cijk_Alik_Bljk_BBS_BH_UserArgs_MT128x64x128_MI16x16x1_SN_LDSB1_AFC0_AFEM1_AFEM1_ASEM1_CLR1_CADS0_DTLA0_DTLB0_DTVA0_DTVB0_EPS0_FDSI0_GRPM1_GRVWA8_GRVWB8_GSUAMB_GLS0_ISA942_IU1_K1_LDSTI0_LBSPPA1024_LBSPPB1024_LBSPPM0_LPA16_LPB16_LPM0_LRVW8_LWPMn1_MIAV0_MIWT4_4_MO40_NTn1_NTA0_NTB0_NTC0_NTD7_NTM0_NEPBS8_NLCA1_NLCB1_ONLL1_PGR2_PLR1_PKA1_SIA3_SS1_SPO0_SRVW0_SSO0_SVW4_SK0_SKFTR0_SKXCCM0_TLDS1_ULSGRO1_USL1_UIOFGRO0_USFGROn1_VSn1_VWA4_VWB4_WSGRA0_WSGRB0_WS64_WG32_4_2,0.0,132.11,1100.9
80,128,5120,8704,False,torch.bfloat16,torch.bfloat16,False,False,hipblaslt,204345,0,75.7462,Cijk_Alik_Bljk_BBS_BH_UserArgs_MT64x128x128_MI16x16x1_SN_LDSB1_AFC0_AFEM1_AFEM1_ASEM1_CLR1_CADS0_DTLA0_DTLB0_DTVA0_DTVB0_EPS0_FDSI0_GRPM1_GRVWA8_GRVWB8_GSUAMB_GLS0_ISA942_IU1_K1_LDSTI0_LBSPPA1024_LBSPPB1024_LBSPPM0_LPA16_LPB16_LPM0_LRVW8_LWPMn1_MIAV0_MIWT4_4_MO40_NTn1_NTA0_NTB0_NTC0_NTD4_NTM0_NEPBS16_NLCA1_NLCB1_ONLL1_PGR2_PLR1_PKA1_SIA3_SS1_SPO0_SRVW0_SSO0_SVW4_SK0_SKFTR0_SKXCCM0_TLDS1_ULSGRO0_USL1_UIOFGRO0_USFGROn1_VSn1_VWA4_VWB4_WSGRA1_WSGRB1_WS64_WG16_8_2,0.0,150.61,1223.4
80,512,5120,3072,False,torch.bfloat16,torch.bfloat16,False,False,hipblaslt,204297,0,92.8109,Cijk_Alik_Bljk_BBS_BH_UserArgs_MT128x256x64_MI16x16x1_SN_LDSB1_AFC0_AFEM8_AFEM8_ASEM32_CLR1_CADS0_DTLA0_DTLB0_DTVA0_DTVB0_EPS0_FDSI0_GRPM1_GRVWA8_GRVWB8_GSUAMB_GLS0_ISA942_IU1_K1_LDSTI0_LBSPPA1024_LBSPPB128_LBSPPM0_LPA16_LPB16_LPMn1_LRVW8_LWPMn1_MIAV0_MIWT8_4_MO40_NTn1_NTA0_NTB0_NTC0_NTD0_NTM0_NEPBS0_NLCA1_NLCB1_ONLL1_PGR2_PLR1_PKA1_SIA3_SS1_SPO0_SRVW0_SSO0_SVW8_SK0_SKFTR0_SKXCCM0_TLDS1_ULSGRO0_USL1_UIOFGRO0_USFGROn1_VSn1_VWA8_VWB1_WSGRA0_WSGRB0_WS64_WG16_16_1,0.0,173.54,429.32
80,512,5120,8704,False,torch.bfloat16,torch.bfloat16,False,False,hipblaslt,196920,0,256.4287,Cijk_Alik_Bljk_BBS_BH_Bias_HA_S_SAV_UserArgs_MT256x128x64_MI16x16x1_SN_LDSB1_AFC1_AFEM1_AFEM1_ASEM1_CLR1_CADS0_DTLA0_DTLB0_DTVA0_DTVB0_EPS0_FDSI0_GRPM1_GRVWA8_GRVWB8_GSUAMBSK_GLS0_ISA942_IU1_K1_LDSTI0_LBSPPA1024_LBSPPB512_LBSPPM0_LPA16_LPB16_LPM0_LRVW8_LWPMn1_MIAV0_MIWT8_4_MO40_NTn1_NTA0_NTB0_NTC0_NTD4_NTM0_NEPBS16_NLCA1_NLCB1_ONLL1_PGR2_PLR1_PKA1_SIA3_SS1_SPO0_SRVW0_SSO0_SVW8_SK0_SKFTR0_SKXCCM0_TLDS1_ULSGRO1_USL1_UIOFGRO0_USFGROn1_VSn1_VWA8_VWB4_WSGRA0_WSGRB0_WS64_WG32_8_1,0.0,177.96,402.78
80,6074,5120,3072,False,torch.bfloat16,torch.bfloat16,False,False,hipblaslt,204329,0,811.2615,Cijk_Alik_Bljk_BBS_BH_UserArgs_MT256x192x64_MI16x16x1_SN_LDSB1_AFC0_AFEM1_AFEM1_ASEM1_CLR1_CADS0_DTLA0_DTLB0_DTVA0_DTVB0_EPS0_FDSI0_GRPM1_GRVWA8_GRVWB8_GSUAMB_GLS0_ISA942_IU1_K1_LDSTI0_LBSPPA256_LBSPPB256_LBSPPM0_LPA16_LPB16_LPM0_LRVW8_LWPMn1_MIAV0_MIWT8_6_MO40_NTn1_NTA3_NTB1_NTC4_NTD4_NTM0_NEPBS0_NLCA1_NLCB1_ONLL1_PGR2_PLR1_PKA1_SIA3_SS1_SPO0_SRVW0_SSO0_SVW2_SK0_SKFTR0_SKXCCM0_TLDS1_ULSGRO0_USL1_UIOFGRO0_USFGROn1_VSn1_VWA2_VWB2_WSGRA1_WSGRB1_WS64_WG32_8_1,0.0,235.52,161.44
80,6074,5120,8704,False,torch.bfloat16,torch.bfloat16,False,False,hipblaslt,196692,0,2194.612,Cijk_Alik_Bljk_BBS_BH_Bias_HA_S_SAV_UserArgs_MT256x192x64_MI16x16x1_SN_LDSB1_AFC1_AFEM1_AFEM1_ASEM1_CLR1_CADS0_DTLA0_DTLB0_DTVA0_DTVB0_EPS0_FDSI0_GRPM1_GRVWA8_GRVWB8_GSUAMBSK_GLS0_ISA942_IU1_K1_LDSTI0_LBSPPA1024_LBSPPB256_LBSPPM0_LPA16_LPB16_LPM0_LRVW8_LWPMn1_MIAV0_MIWT8_6_MO40_NTn1_NTA0_NTB0_NTC0_NTD4_NTM0_NEPBS16_NLCA1_NLCB1_ONLL1_PGR2_PLR1_PKA1_SIA3_SS1_SPO0_SRVW0_SSO0_SVW8_SK0_SKFTR0_SKXCCM0_TLDS1_ULSGRO1_USL1_UIOFGRO0_USFGROn1_VSn1_VWA8_VWB2_WSGRA0_WSGRB0_WS64_WG32_8_1,0.0,246.68,117.13
80,16384,5120,3072,False,torch.bfloat16,torch.bfloat16,False,False,hipblaslt,196459,0,2164.8818,Cijk_Alik_Bljk_BBS_BH_Bias_HA_S_SAV_UserArgs_MT256x192x64_MI32x32x1_SN_LDSB1_AFC1_AFEM1_AFEM1_ASEM1_CLR1_CADS0_DTLA0_DTLB0_DTVA0_DTVB0_EPS0_FDSI0_GRPM1_GRVWA8_GRVWB8_GSUAMBSK_GLS0_ISA942_IU1_K1_LDSTI0_LBSPPA512_LBSPPB128_LBSPPM0_LPA8_LPB8_LPM0_LRVW8_LWPMn1_MIAV0_MIWT4_3_MO40_NTn1_NTA0_NTB0_NTC0_NTD4_NTM0_NEPBS8_NLCA1_NLCB1_ONLL1_PGR2_PLR1_PKA1_SIA3_SS1_SPO0_SRVW0_SSO0_SVW4_SK0_SKFTR0_SKXCCM0_TLDS1_ULSGRO0_USL1_UIOFGRO0_USFGROn1_VSn1_VWA4_VWB1_WSGRA0_WSGRB0_WS64_WG64_4_1,0.0,238.07,138.53
80,16384,5120,8704,False,torch.bfloat16,torch.bfloat16,False,False,hipblaslt,196277,0,5929.4267,Cijk_Alik_Bljk_BBS_BH_Bias_HA_S_SAV_UserArgs_MT256x192x64_MI32x32x1_SN_LDSB1_AFC1_AFEM1_AFEM1_ASEM1_CLR1_CADS0_DTLA0_DTLB0_DTVA0_DTVB0_EPS0_FDSI0_GRPM1_GRVWA8_GRVWB8_GSUAMBSK_GLS0_ISA942_IU1_K1_LDSTI0_LBSPPA512_LBSPPB128_LBSPPM0_LPA8_LPB8_LPM0_LRVW8_LWPMn1_MIAV0_MIWT4_3_MO40_NTn1_NTA0_NTB0_NTC0_NTD4_NTM0_NEPBS8_NLCA1_NLCB1_ONLL1_PGR2_PLR1_PKA1_SIA3_SS1_SPO0_SRVW0_SSO4_SVW4_SK0_SKFTR0_SKXCCM0_TLDS1_ULSGRO0_USL1_UIOFGRO0_USFGROn1_VSn1_VWA4_VWB1_WSGRA0_WSGRB0_WS64_WG64_4_1,0.0,246.28,91.43
80,27613,5120,3072,False,torch.bfloat16,torch.bfloat16,False,False,hipblaslt,204223,0,3548.556,Cijk_Alik_Bljk_BBS_BH_UserArgs_MT256x192x64_MI32x32x1_SN_LDSB1_AFC0_AFEM1_AFEM1_ASEM1_CLR1_CADS0_DTLA0_DTLB0_DTVA0_DTVB0_EPS0_FDSI0_GRPM1_GRVWA8_GRVWB8_GSUAMB_GLS0_ISA942_IU1_K1_LDSTI0_LBSPPA512_LBSPPB128_LBSPPM0_LPA8_LPB8_LPM0_LRVW8_LWPMn1_MIAV0_MIWT4_3_MO40_NTn1_NTA0_NTB0_NTC4_NTD4_NTM0_NEPBS16_NLCA1_NLCB1_ONLL1_PGR2_PLR1_PKA1_SIA3_SS1_SPO1_SRVW0_SSO4_SVW4_SK0_SKFTR0_SKXCCM0_TLDS1_ULSGRO0_USL1_UIOFGRO0_USFGROn1_VSn1_VWA4_VWB1_WSGRA0_WSGRB0_WS64_WG64_4_1,0.0,244.78,136.36
80,27613,5120,8704,False,torch.bfloat16,torch.bfloat16,False,False,hipblaslt,196277,0,12775.7706,Cijk_Alik_Bljk_BBS_BH_Bias_HA_S_SAV_UserArgs_MT256x192x64_MI32x32x1_SN_LDSB1_AFC1_AFEM1_AFEM1_ASEM1_CLR1_CADS0_DTLA0_DTLB0_DTVA0_DTVB0_EPS0_FDSI0_GRPM1_GRVWA8_GRVWB8_GSUAMBSK_GLS0_ISA942_IU1_K1_LDSTI0_LBSPPA512_LBSPPB128_LBSPPM0_LPA8_LPB8_LPM0_LRVW8_LWPMn1_MIAV0_MIWT4_3_MO40_NTn1_NTA0_NTB0_NTC0_NTD4_NTM0_NEPBS8_NLCA1_NLCB1_ONLL1_PGR2_PLR1_PKA1_SIA3_SS1_SPO0_SRVW0_SSO4_SVW4_SK0_SKFTR0_SKXCCM0_TLDS1_ULSGRO0_USL1_UIOFGRO0_USFGROn1_VSn1_VWA4_VWB1_WSGRA0_WSGRB0_WS64_WG64_4_1,0.0,192.64,66.73
80,1,7168,5120,False,torch.bfloat16,torch.bfloat16,False,False,hipblaslt,196565,0,29.5895,Cijk_Alik_Bljk_BBS_BH_Bias_HA_S_SAV_UserArgs_MT32x16x128_MI16x16x1_SN_LDSB1_AFC1_AFEM1_AFEM1_ASEM1_CLR1_CADS0_DTLA0_DTLB0_DTVA0_DTVB0_EPS0_FDSI0_GRPM1_GRVWA8_GRVWB8_GSUAMBSK_GLS0_ISA942_IU1_K1_LDSTI0_LBSPPA256_LBSPPB256_LBSPPM0_LPA16_LPB16_LPM0_LRVW8_LWPMn1_MIAV0_MIWT1_1_MO40_NTn1_NTA0_NTB0_NTC0_NTD4_NTM0_NEPBS8_NLCA1_NLCB1_ONLL1_PGR2_PLR1_PKA1_SIA3_SS0_SPO0_SRVW0_SSO0_SVW1_SK0_SKFTR0_SKXCCM0_TLDS1_ULSGRO0_USL1_UIOFGRO0_USFGROn1_VSn1_VWA1_VWB1_WSGRA0_WSGRB0_WS64_WG32_4_1,0.0,2.48,2481.45
80,2,7168,5120,False,torch.bfloat16,torch.bfloat16,False,False,hipblaslt,196562,0,29.713,Cijk_Alik_Bljk_BBS_BH_Bias_HA_S_SAV_UserArgs_MT32x16x128_MI16x16x1_SN_LDSB1_AFC1_AFEM1_AFEM1_ASEM1_CLR1_CADS0_DTLA0_DTLB0_DTVA0_DTVB0_EPS0_FDSI0_GRPM1_GRVWA8_GRVWB8_GSUAMBSK_GLS0_ISA942_IU1_K1_LDSTI0_LBSPPA256_LBSPPB256_LBSPPM0_LPA16_LPB16_LPM0_LRVW8_LWPMn1_MIAV0_MIWT1_1_MO40_NTn1_NTA0_NTB0_NTC0_NTD4_NTM0_NEPBS8_NLCA1_NLCB1_ONLL1_PGR2_PLR1_PKA1_SIA3_SS1_SPO0_SRVW0_SSO0_SVW1_SK0_SKFTR0_SKXCCM0_TLDS1_ULSGRO0_USL1_UIOFGRO0_USFGROn1_VSn1_VWA1_VWB1_WSGRA0_WSGRB0_WS64_WG32_4_1,0.0,4.94,2471.96
80,4,7168,5120,False,torch.bfloat16,torch.bfloat16,False,False,hipblaslt,196562,0,30.5787,Cijk_Alik_Bljk_BBS_BH_Bias_HA_S_SAV_UserArgs_MT32x16x128_MI16x16x1_SN_LDSB1_AFC1_AFEM1_AFEM1_ASEM1_CLR1_CADS0_DTLA0_DTLB0_DTVA0_DTVB0_EPS0_FDSI0_GRPM1_GRVWA8_GRVWB8_GSUAMBSK_GLS0_ISA942_IU1_K1_LDSTI0_LBSPPA256_LBSPPB256_LBSPPM0_LPA16_LPB16_LPM0_LRVW8_LWPMn1_MIAV0_MIWT1_1_MO40_NTn1_NTA0_NTB0_NTC0_NTD4_NTM0_NEPBS8_NLCA1_NLCB1_ONLL1_PGR2_PLR1_PKA1_SIA3_SS1_SPO0_SRVW0_SSO0_SVW1_SK0_SKFTR0_SKXCCM0_TLDS1_ULSGRO0_USL1_UIOFGRO0_USFGROn1_VSn1_VWA1_VWB1_WSGRA0_WSGRB0_WS64_WG32_4_1,0.0,9.6,2403.59
80,8,7168,5120,False,torch.bfloat16,torch.bfloat16,False,False,hipblaslt,196565,0,31.2736,Cijk_Alik_Bljk_BBS_BH_Bias_HA_S_SAV_UserArgs_MT32x16x128_MI16x16x1_SN_LDSB1_AFC1_AFEM1_AFEM1_ASEM1_CLR1_CADS0_DTLA0_DTLB0_DTVA0_DTVB0_EPS0_FDSI0_GRPM1_GRVWA8_GRVWB8_GSUAMBSK_GLS0_ISA942_IU1_K1_LDSTI0_LBSPPA256_LBSPPB256_LBSPPM0_LPA16_LPB16_LPM0_LRVW8_LWPMn1_MIAV0_MIWT1_1_MO40_NTn1_NTA0_NTB0_NTC0_NTD4_NTM0_NEPBS8_NLCA1_NLCB1_ONLL1_PGR2_PLR1_PKA1_SIA3_SS0_SPO0_SRVW0_SSO0_SVW1_SK0_SKFTR0_SKXCCM0_TLDS1_ULSGRO0_USL1_UIOFGRO0_USFGROn1_VSn1_VWA1_VWB1_WSGRA0_WSGRB0_WS64_WG32_4_1,0.0,18.78,2353.32
80,12,7168,5120,False,torch.bfloat16,torch.bfloat16,False,False,hipblaslt,204200,0,31.3846,Cijk_Alik_Bljk_BBS_BH_UserArgs_MT32x16x512_MI16x16x1_SN_LDSB1_AFC0_AFEM1_AFEM1_ASEM1_CLR1_CADS0_DTLA0_DTLB0_DTVA0_DTVB0_EPS0_FDSI0_GRPM1_GRVWA8_GRVWB8_GSUAMB_GLS0_ISA942_IU1_K1_LDSTI0_LBSPPA2048_LBSPPB1024_LBSPPM0_LPA16_LPB16_LPM0_LRVW8_LWPMn1_MIAV1_MIWT2_1_MO40_NTn1_NTA0_NTB0_NTC3_NTD3_NTM0_NEPBS0_NLCA1_NLCB1_ONLL1_PGR2_PLR1_PKA1_SIA3_SS1_SPO0_SRVW0_SSO0_SVW2_SK0_SKFTR0_SKXCCM0_TLDS1_ULSGRO0_USL1_UIOFGRO0_USFGROn1_VSn1_VWA2_VWB1_WSGRA0_WSGRB0_WS64_WG16_4_4,0.0,28.06,2348.13
80,16,7168,5120,False,torch.bfloat16,torch.bfloat16,False,False,hipblaslt,196481,0,32.6828,Cijk_Alik_Bljk_BBS_BH_Bias_HA_S_SAV_UserArgs_MT32x16x256_MI16x16x1_SN_LDSB1_AFC1_AFEM1_AFEM1_ASEM1_CLR1_CADS0_DTLA0_DTLB0_DTVA0_DTVB0_EPS0_FDSI0_GRPM1_GRVWA8_GRVWB8_GSUAMBSK_GLS0_ISA942_IU1_K1_LDSTI0_LBSPPA512_LBSPPB512_LBSPPM0_LPA16_LPB16_LPM0_LRVW8_LWPMn1_MIAV0_MIWT2_1_MO40_NTn1_NTA0_NTB0_NTC0_NTD4_NTM0_NEPBS8_NLCA1_NLCB1_ONLL1_PGR2_PLR1_PKA1_SIA3_SS1_SPO0_SRVW0_SSO0_SVW2_SK0_SKFTR0_SKXCCM0_TLDS1_ULSGRO0_USL1_UIOFGRO0_USFGROn1_VSn1_VWA2_VWB1_WSGRA0_WSGRB0_WS64_WG16_4_4,0.0,35.93,2257.87
80,24,7168,5120,False,torch.bfloat16,torch.bfloat16,False,False,hipblaslt,204208,0,36.7038,Cijk_Alik_Bljk_BBS_BH_UserArgs_MT64x32x256_MI16x16x1_SN_LDSB1_AFC0_AFEM1_AFEM1_ASEM1_CLR1_CADS0_DTLA0_DTLB0_DTVA0_DTVB0_EPS0_FDSI0_GRPM1_GRVWA8_GRVWB8_GSUAMB_GLS0_ISA942_IU1_K1_LDSTI0_LBSPPA2048_LBSPPB512_LBSPPM0_LPA16_LPB16_LPM0_LRVW8_LWPMn1_MIAV1_MIWT4_2_MO40_NTn1_NTA0_NTB0_NTC3_NTD3_NTM0_NEPBS0_NLCA1_NLCB1_ONLL1_PGR2_PLR1_PKA1_SIA3_SS1_SPO0_SRVW0_SSO0_SVW4_SK0_SKFTR0_SKXCCM0_TLDS1_ULSGRO0_USL1_UIOFGRO0_USFGROn1_VSn1_VWA4_VWB1_WSGRA0_WSGRB0_WS64_WG16_4_4,0.0,48.0,2015.87
80,32,7168,5120,False,torch.bfloat16,torch.bfloat16,False,False,hipblaslt,204208,0,36.8579,Cijk_Alik_Bljk_BBS_BH_UserArgs_MT64x32x256_MI16x16x1_SN_LDSB1_AFC0_AFEM1_AFEM1_ASEM1_CLR1_CADS0_DTLA0_DTLB0_DTVA0_DTVB0_EPS0_FDSI0_GRPM1_GRVWA8_GRVWB8_GSUAMB_GLS0_ISA942_IU1_K1_LDSTI0_LBSPPA2048_LBSPPB512_LBSPPM0_LPA16_LPB16_LPM0_LRVW8_LWPMn1_MIAV1_MIWT4_2_MO40_NTn1_NTA0_NTB0_NTC3_NTD3_NTM0_NEPBS0_NLCA1_NLCB1_ONLL1_PGR2_PLR1_PKA1_SIA3_SS1_SPO0_SRVW0_SSO0_SVW4_SK0_SKFTR0_SKXCCM0_TLDS1_ULSGRO0_USL1_UIOFGRO0_USFGROn1_VSn1_VWA4_VWB1_WSGRA0_WSGRB0_WS64_WG16_4_4,0.0,63.73,2012.78
80,40,7168,5120,False,torch.bfloat16,torch.bfloat16,False,False,hipblaslt,197097,0,43.0192,Cijk_Alik_Bljk_BBS_BH_Bias_HA_S_SAV_UserArgs_MT64x48x256_MI16x16x1_SN_LDSB1_AFC1_AFEM1_AFEM1_ASEM1_CLR1_CADS0_DTLA0_DTLB0_DTVA0_DTVB0_EPS0_FDSI0_GRPM1_GRVWA8_GRVWB8_GSUAMBSK_GLS0_ISA942_IU1_K1_LDSTI0_LBSPPA2048_LBSPPB512_LBSPPM0_LPA16_LPB16_LPM0_LRVW8_LWPMn1_MIAV0_MIWT4_3_MO40_NTn1_NTA0_NTB0_NTC0_NTD4_NTM0_NEPBS16_NLCA1_NLCB1_ONLL1_PGR2_PLR1_PKA1_SIA3_SS1_SPO0_SRVW0_SSO0_SVW4_SK0_SKFTR0_SKXCCM0_TLDS1_ULSGRO1_USL1_UIOFGRO0_USFGROn1_VSn1_VWA4_VWB1_WSGRA0_WSGRB0_WS64_WG16_4_4,0.0,68.25,1729.07
80,48,7168,5120,False,torch.bfloat16,torch.bfloat16,False,False,hipblaslt,197091,0,43.303,Cijk_Alik_Bljk_BBS_BH_Bias_HA_S_SAV_UserArgs_MT64x48x256_MI16x16x1_SN_LDSB1_AFC1_AFEM1_AFEM1_ASEM1_CLR1_CADS0_DTLA0_DTLB0_DTVA0_DTVB0_EPS0_FDSI0_GRPM1_GRVWA8_GRVWB8_GSUAMBSK_GLS0_ISA942_IU1_K1_LDSTI0_LBSPPA2048_LBSPPB512_LBSPPM0_LPA16_LPB16_LPM0_LRVW8_LWPMn1_MIAV0_MIWT4_3_MO40_NTn1_NTA0_NTB0_NTC0_NTD4_NTM0_NEPBS16_NLCA1_NLCB1_ONLL1_PGR2_PLR1_PKA1_SIA3_SS1_SPO0_SRVW0_SSO0_SVW4_SK0_SKFTR0_SKXCCM0_TLDS1_ULSGRO1_USL1_UIOFGRO0_USFGROn1_VSn1_VWA4_VWB1_WSGRA0_WSGRB0_WS64_WG16_4_4,0.0,81.36,1722.28
80,56,7168,5120,False,torch.bfloat16,torch.bfloat16,False,False,hipblaslt,204350,0,47.8008,Cijk_Alik_Bljk_BBS_BH_UserArgs_MT128x64x128_MI16x16x1_SN_LDSB1_AFC0_AFEM1_AFEM1_ASEM1_CLR1_CADS0_DTLA0_DTLB0_DTVA0_DTVB0_EPS0_FDSI0_GRPM1_GRVWA8_GRVWB8_GSUAMB_GLS0_ISA942_IU1_K1_LDSTI0_LBSPPA1024_LBSPPB1024_LBSPPM0_LPA16_LPB16_LPM0_LRVW8_LWPMn1_MIAV0_MIWT4_4_MO40_NTn1_NTA0_NTB0_NTC0_NTD7_NTM0_NEPBS8_NLCA1_NLCB1_ONLL1_PGR2_PLR1_PKA1_SIA3_SS1_SPO0_SRVW0_SSO0_SVW4_SK0_SKFTR0_SKXCCM0_TLDS1_ULSGRO1_USL1_UIOFGRO0_USFGROn1_VSn1_VWA4_VWB4_WSGRA0_WSGRB0_WS64_WG32_4_2,0.0,85.99,1564.34
80,64,7168,5120,False,torch.bfloat16,torch.bfloat16,False,False,hipblaslt,204205,0,45.5413,Cijk_Alik_Bljk_BBS_BH_UserArgs_MT96x64x128_MI16x16x1_SN_LDSB1_AFC0_AFEM1_AFEM1_ASEM1_CLR1_CADS0_DTLA0_DTLB0_DTVA0_DTVB0_EPS0_FDSI0_GRPM1_GRVWA8_GRVWB8_GSUAMB_GLS0_ISA942_IU1_K1_LDSTI0_LBSPPA256_LBSPPB256_LBSPPM0_LPA16_LPB16_LPM0_LRVW8_LWPMn1_MIAV1_MIWT3_2_MO40_NTn1_NTA0_NTB0_NTC0_NTD0_NTM0_NEPBS0_NLCA1_NLCB1_ONLL1_PGR2_PLR1_PKA1_SIA3_SS1_SPO0_SRVW0_SSO0_SVW1_SK0_SKFTR0_SKXCCM0_TLDS1_ULSGRO0_USL1_UIOFGRO0_USFGROn1_VSn1_VWA1_VWB1_WSGRA0_WSGRB0_WS64_WG32_8_1,0.0,103.15,1646.27
80,72,7168,5120,False,torch.bfloat16,torch.bfloat16,False,False,hipblaslt,197218,0,51.3583,Cijk_Alik_Bljk_BBS_BH_Bias_HA_S_SAV_UserArgs_MT96x96x128_MI16x16x1_SN_LDSB1_AFC1_AFEM1_AFEM1_ASEM1_CLR1_CADS0_DTLA0_DTLB0_DTVA0_DTVB0_EPS0_FDSI0_GRPM1_GRVWA8_GRVWB8_GSUAMBSK_GLS0_ISA942_IU1_K1_LDSTI0_LBSPPA256_LBSPPB256_LBSPPM0_LPA16_LPB16_LPM0_LRVW8_LWPMn1_MIAV0_MIWT3_3_MO40_NTn1_NTA0_NTB0_NTC0_NTD4_NTM0_NEPBS16_NLCA1_NLCB1_ONLL1_PGR2_PLR1_PKA1_SIA3_SS1_SPO0_SRVW0_SSO0_SVW1_SK0_SKFTR0_SKXCCM0_TLDS1_ULSGRO1_USL1_UIOFGRO0_USFGROn1_VSn1_VWA1_VWB1_WSGRA0_WSGRB0_WS64_WG32_8_1,0.0,102.9,1463.63
80,80,7168,5120,False,torch.bfloat16,torch.bfloat16,False,False,hipblaslt,197222,0,52.3004,Cijk_Alik_Bljk_BBS_BH_Bias_HA_S_SAV_UserArgs_MT96x96x128_MI16x16x1_SN_LDSB1_AFC1_AFEM1_AFEM1_ASEM1_CLR1_CADS0_DTLA0_DTLB0_DTVA0_DTVB0_EPS0_FDSI0_GRPM1_GRVWA8_GRVWB8_GSUAMBSK_GLS0_ISA942_IU1_K1_LDSTI0_LBSPPA256_LBSPPB256_LBSPPM0_LPA16_LPB16_LPM0_LRVW8_LWPMn1_MIAV0_MIWT3_3_MO40_NTn1_NTA0_NTB0_NTC0_NTD4_NTM0_NEPBS16_NLCA1_NLCB1_ONLL1_PGR2_PLR1_PKA1_SIA3_SS1_SPO0_SRVW0_SSO0_SVW1_SK0_SKFTR0_SKXCCM0_TLDS1_ULSGRO1_USL1_UIOFGRO0_USFGROn1_VSn1_VWA1_VWB1_WSGRA0_WSGRB0_WS64_WG32_8_1,0.0,112.27,1441.03
80,88,7168,5120,False,torch.bfloat16,torch.bfloat16,False,False,hipblaslt,197222,0,52.3175,Cijk_Alik_Bljk_BBS_BH_Bias_HA_S_SAV_UserArgs_MT96x96x128_MI16x16x1_SN_LDSB1_AFC1_AFEM1_AFEM1_ASEM1_CLR1_CADS0_DTLA0_DTLB0_DTVA0_DTVB0_EPS0_FDSI0_GRPM1_GRVWA8_GRVWB8_GSUAMBSK_GLS0_ISA942_IU1_K1_LDSTI0_LBSPPA256_LBSPPB256_LBSPPM0_LPA16_LPB16_LPM0_LRVW8_LWPMn1_MIAV0_MIWT3_3_MO40_NTn1_NTA0_NTB0_NTC0_NTD4_NTM0_NEPBS16_NLCA1_NLCB1_ONLL1_PGR2_PLR1_PKA1_SIA3_SS1_SPO0_SRVW0_SSO0_SVW1_SK0_SKFTR0_SKXCCM0_TLDS1_ULSGRO1_USL1_UIOFGRO0_USFGROn1_VSn1_VWA1_VWB1_WSGRA0_WSGRB0_WS64_WG32_8_1,0.0,123.46,1444.32
80,96,7168,5120,False,torch.bfloat16,torch.bfloat16,False,False,hipblaslt,196760,0,52.0434,Cijk_Alik_Bljk_BBS_BH_Bias_HA_S_SAV_UserArgs_MT96x96x128_MI16x16x1_SN_LDSB1_AFC1_AFEM1_AFEM1_ASEM1_CLR1_CADS0_DTLA0_DTLB0_DTVA0_DTVB0_EPS0_FDSI0_GRPM1_GRVWA8_GRVWB8_GSUAMBSK_GLS0_ISA942_IU1_K1_LDSTI0_LBSPPA256_LBSPPB256_LBSPPM0_LPA16_LPB16_LPM0_LRVW8_LWPMn1_MIAV0_MIWT3_3_MO40_NTn1_NTA0_NTB0_NTC0_NTD4_NTM0_NEPBS15_NLCA1_NLCB1_ONLL1_PGR2_PLR1_PKA1_SIA3_SS1_SPO0_SRVW0_SSO0_SVW1_SK0_SKFTR0_SKXCCM0_TLDS1_ULSGRO1_USL1_UIOFGRO0_USFGROn1_VSn1_VWA1_VWB1_WSGRA0_WSGRB0_WS64_WG32_8_1,0.0,135.4,1455.7
80,104,7168,5120,False,torch.bfloat16,torch.bfloat16,False,False,hipblaslt,197242,0,62.8043,Cijk_Alik_Bljk_BBS_BH_Bias_HA_S_SAV_UserArgs_MT96x128x128_MI16x16x1_SN_LDSB1_AFC1_AFEM1_AFEM1_ASEM1_CLR1_CADS0_DTLA0_DTLB0_DTVA0_DTVB0_EPS0_FDSI0_GRPM1_GRVWA8_GRVWB8_GSUAMBSK_GLS0_ISA942_IU1_K1_LDSTI0_LBSPPA256_LBSPPB1024_LBSPPM0_LPA16_LPB16_LPM0_LRVW8_LWPMn1_MIAV0_MIWT3_4_MO40_NTn1_NTA0_NTB0_NTC0_NTD4_NTM0_NEPBS16_NLCA1_NLCB1_ONLL1_PGR2_PLR1_PKA1_SIA3_SS1_SPO0_SRVW0_SSO0_SVW1_SK0_SKFTR0_SKXCCM0_TLDS1_ULSGRO1_USL1_UIOFGRO0_USFGROn1_VSn1_VWA1_VWB4_WSGRA0_WSGRB0_WS64_WG32_8_1,0.0,121.55,1209.41
80,112,7168,5120,False,torch.bfloat16,torch.bfloat16,False,False,hipblaslt,197242,0,63.1055,Cijk_Alik_Bljk_BBS_BH_Bias_HA_S_SAV_UserArgs_MT96x128x128_MI16x16x1_SN_LDSB1_AFC1_AFEM1_AFEM1_ASEM1_CLR1_CADS0_DTLA0_DTLB0_DTVA0_DTVB0_EPS0_FDSI0_GRPM1_GRVWA8_GRVWB8_GSUAMBSK_GLS0_ISA942_IU1_K1_LDSTI0_LBSPPA256_LBSPPB1024_LBSPPM0_LPA16_LPB16_LPM0_LRVW8_LWPMn1_MIAV0_MIWT3_4_MO40_NTn1_NTA0_NTB0_NTC0_NTD4_NTM0_NEPBS16_NLCA1_NLCB1_ONLL1_PGR2_PLR1_PKA1_SIA3_SS1_SPO0_SRVW0_SSO0_SVW1_SK0_SKFTR0_SKXCCM0_TLDS1_ULSGRO1_USL1_UIOFGRO0_USFGROn1_VSn1_VWA1_VWB4_WSGRA0_WSGRB0_WS64_WG32_8_1,0.0,130.27,1206.75
80,120,7168,5120,False,torch.bfloat16,torch.bfloat16,False,False,hipblaslt,197239,0,63.6382,Cijk_Alik_Bljk_BBS_BH_Bias_HA_S_SAV_UserArgs_MT96x128x128_MI16x16x1_SN_LDSB1_AFC1_AFEM1_AFEM1_ASEM1_CLR1_CADS0_DTLA0_DTLB0_DTVA0_DTVB0_EPS0_FDSI0_GRPM1_GRVWA8_GRVWB8_GSUAMBSK_GLS0_ISA942_IU1_K1_LDSTI0_LBSPPA256_LBSPPB1024_LBSPPM0_LPA16_LPB16_LPM0_LRVW8_LWPMn1_MIAV0_MIWT3_4_MO40_NTn1_NTA0_NTB0_NTC0_NTD4_NTM0_NEPBS16_NLCA1_NLCB1_ONLL1_PGR2_PLR1_PKA1_SIA3_SS1_SPO0_SRVW0_SSO0_SVW1_SK0_SKFTR0_SKXCCM0_TLDS1_ULSGRO1_USL1_UIOFGRO0_USFGROn1_VSn1_VWA1_VWB4_WSGRA0_WSGRB0_WS64_WG32_8_1,0.0,138.41,1199.74
80,128,7168,5120,False,torch.bfloat16,torch.bfloat16,False,False,hipblaslt,197242,0,64.5379,Cijk_Alik_Bljk_BBS_BH_Bias_HA_S_SAV_UserArgs_MT96x128x128_MI16x16x1_SN_LDSB1_AFC1_AFEM1_AFEM1_ASEM1_CLR1_CADS0_DTLA0_DTLB0_DTVA0_DTVB0_EPS0_FDSI0_GRPM1_GRVWA8_GRVWB8_GSUAMBSK_GLS0_ISA942_IU1_K1_LDSTI0_LBSPPA256_LBSPPB1024_LBSPPM0_LPA16_LPB16_LPM0_LRVW8_LWPMn1_MIAV0_MIWT3_4_MO40_NTn1_NTA0_NTB0_NTC0_NTD4_NTM0_NEPBS16_NLCA1_NLCB1_ONLL1_PGR2_PLR1_PKA1_SIA3_SS1_SPO0_SRVW0_SSO0_SVW1_SK0_SKFTR0_SKXCCM0_TLDS1_ULSGRO1_USL1_UIOFGRO0_USFGROn1_VSn1_VWA1_VWB4_WSGRA0_WSGRB0_WS64_WG32_8_1,0.0,145.58,1186.06
80,512,7168,5120,False,torch.bfloat16,torch.bfloat16,False,False,hipblaslt,204232,0,186.6541,Cijk_Alik_Bljk_BBS_BH_UserArgs_MT192x256x64_MI16x16x1_SN_LDSB1_AFC0_AFEM1_AFEM1_ASEM1_CLR1_CADS0_DTLA0_DTLB0_DTVA0_DTVB0_EPS0_FDSI0_GRPM1_GRVWA8_GRVWB8_GSUAMB_GLS0_ISA942_IU1_K1_LDSTI0_LBSPPA512_LBSPPB512_LBSPPM0_LPA16_LPB16_LPMn1_LRVW8_LWPMn1_MIAV0_MIWT12_4_MO40_NTn1_NTA0_NTB0_NTC0_NTD0_NTM0_NEPBS0_NLCA1_NLCB1_ONLL1_PGR2_PLR1_PKA1_SIA3_SS1_SPO0_SRVW0_SSO0_SVW4_SK0_SKFTR0_SKXCCM0_TLDS1_ULSGRO0_USL1_UIOFGRO0_USFGRO0_VSn1_VWA4_VWB4_WSGRA0_WSGRB0_WS64_WG16_16_1,0.0,201.34,460.66
80,6074,7168,5120,False,torch.bfloat16,torch.bfloat16,False,False,hipblaslt,204387,0,1888.1948,Cijk_Alik_Bljk_BBS_BH_UserArgs_MT256x224x64_MI16x16x1_SN_LDSB1_AFC0_AFEM1_AFEM1_ASEM1_CLR1_CADS0_DTLA0_DTLB0_DTVA0_DTVB0_EPS0_FDSI0_GRPM1_GRVWA2_GRVWB2_GSUAMB_GLS0_ISA942_IU1_K1_LDSTI0_LBSPPA1024_LBSPPB128_LBSPPM0_LPA4_LPB4_LPM0_LRVW4_LWPMn1_MIAV0_MIWT8_7_MO40_NTn1_NTA0_NTB0_NTC0_NTD4_NTM0_NEPBS0_NLCA1_NLCB1_ONLL1_PGR2_PLR1_PKA1_SIA3_SS1_SPO0_SRVW0_SSO0_SVW8_SK0_SKFTR0_SKXCCM0_TLDS2_ULSGRO0_USL1_UIOFGRO0_USFGROn1_VSn1_VWA8_VWB1_WSGRA0_WSGRB0_WS64_WG32_8_1,0.0,236.12,117.93
80,16384,7168,5120,False,torch.bfloat16,torch.bfloat16,False,False,hipblaslt,196512,0,4911.2715,Cijk_Alik_Bljk_BBS_BH_Bias_HA_S_SAV_UserArgs_MT256x192x64_MI32x32x1_SN_LDSB1_AFC1_AFEM1_AFEM1_ASEM1_CLR1_CADS0_DTLA0_DTLB0_DTVA0_DTVB0_EPS0_FDSI0_GRPM1_GRVWA8_GRVWB8_GSUAMBSK_GLS0_ISA942_IU1_K1_LDSTI0_LBSPPA512_LBSPPB128_LBSPPM0_LPA8_LPB8_LPM0_LRVW8_LWPMn1_MIAV0_MIWT4_3_MO40_NTn1_NTA0_NTB0_NTC0_NTD4_NTM0_NEPBS8_NLCA1_NLCB1_ONLL1_PGR2_PLR1_PKA1_SIA3_SS1_SPO0_SRVW0_SSO0_SVW4_SK0_SKFTR0_SKXCCM0_TLDS1_ULSGRO0_USL1_UIOFGRO0_USFGROn1_VSn1_VWA4_VWB1_WSGRA0_WSGRB0_WS64_WG64_4_1,0.0,244.86,96.93
80,27613,7168,5120,False,torch.bfloat16,torch.bfloat16,False,False,hipblaslt,196572,0,10172.2236,Cijk_Alik_Bljk_BBS_BH_Bias_HA_S_SAV_UserArgs_MT256x192x64_MI32x32x1_SN_LDSB1_AFC1_AFEM1_AFEM1_ASEM1_CLR1_CADS0_DTLA0_DTLB0_DTVA0_DTVB0_EPS0_FDSI0_GRPM1_GRVWA8_GRVWB8_GSUAMBSK_GLS0_ISA942_IU1_K1_LDSTI0_LBSPPA512_LBSPPB128_LBSPPM0_LPA8_LPB8_LPM0_LRVW8_LWPMn1_MIAV0_MIWT4_3_MO40_NTn1_NTA0_NTB0_NTC0_NTD4_NTM0_NEPBS8_NLCA1_NLCB1_ONLL1_PGR2_PLR1_PKA1_SIA3_SS1_SPO0_SRVW0_SSO4_SVW4_SK0_SKFTR0_SKXCCM0_TLDS1_ULSGRO0_USL1_UIOFGRO0_USFGROn1_VSn1_VWA4_VWB1_WSGRA0_WSGRB0_WS64_WG64_4_1,0.0,199.25,73.93
80,1,8240,5120,False,torch.bfloat16,torch.bfloat16,False,False,hipblaslt,204195,0,31.6261,Cijk_Alik_Bljk_BBS_BH_UserArgs_MT32x16x256_MI16x16x1_SN_LDSB1_AFC0_AFEM1_AFEM1_ASEM1_CLR1_CADS0_DTLA0_DTLB0_DTVA0_DTVB0_EPS0_FDSI0_GRPM1_GRVWA8_GRVWB8_GSUAMB_GLS0_ISA942_IU1_K1_LDSTI0_LBSPPA1024_LBSPPB512_LBSPPM0_LPA16_LPB16_LPM0_LRVW8_LWPMn1_MIAV1_MIWT2_1_MO40_NTn1_NTA0_NTB0_NTC0_NTD0_NTM0_NEPBS0_NLCA1_NLCB1_ONLL1_PGR2_PLR1_PKA1_SIA3_SS1_SPO1_SRVW0_SSO0_SVW2_SK0_SKFTR0_SKXCCM0_TLDS1_ULSGRO0_USL1_UIOFGRO0_USFGROn1_VSn1_VWA2_VWB1_WSGRA0_WSGRB0_WS64_WG16_4_4,0.0,2.67,2668.82
80,2,8240,5120,False,torch.bfloat16,torch.bfloat16,False,False,hipblaslt,204196,0,31.8834,Cijk_Alik_Bljk_BBS_BH_UserArgs_MT32x16x256_MI16x16x1_SN_LDSB1_AFC0_AFEM1_AFEM1_ASEM1_CLR1_CADS0_DTLA0_DTLB0_DTVA0_DTVB0_EPS0_FDSI0_GRPM1_GRVWA8_GRVWB8_GSUAMB_GLS0_ISA942_IU1_K1_LDSTI0_LBSPPA1024_LBSPPB512_LBSPPM0_LPA16_LPB16_LPM0_LRVW8_LWPMn1_MIAV1_MIWT2_1_MO40_NTn1_NTA0_NTB0_NTC0_NTD0_NTM0_NEPBS0_NLCA1_NLCB1_ONLL1_PGR2_PLR1_PKA1_SIA3_SS1_SPO0_SRVW0_SSO0_SVW2_SK0_SKFTR0_SKXCCM0_TLDS1_ULSGRO0_USL1_UIOFGRO0_USFGROn1_VSn1_VWA2_VWB1_WSGRA0_WSGRB0_WS64_WG16_4_4,0.0,5.29,2648.12
80,4,8240,5120,False,torch.bfloat16,torch.bfloat16,False,False,hipblaslt,204196,0,32.3691,Cijk_Alik_Bljk_BBS_BH_UserArgs_MT32x16x256_MI16x16x1_SN_LDSB1_AFC0_AFEM1_AFEM1_ASEM1_CLR1_CADS0_DTLA0_DTLB0_DTVA0_DTVB0_EPS0_FDSI0_GRPM1_GRVWA8_GRVWB8_GSUAMB_GLS0_ISA942_IU1_K1_LDSTI0_LBSPPA1024_LBSPPB512_LBSPPM0_LPA16_LPB16_LPM0_LRVW8_LWPMn1_MIAV1_MIWT2_1_MO40_NTn1_NTA0_NTB0_NTC0_NTD0_NTM0_NEPBS0_NLCA1_NLCB1_ONLL1_PGR2_PLR1_PKA1_SIA3_SS1_SPO0_SRVW0_SSO0_SVW2_SK0_SKFTR0_SKXCCM0_TLDS1_ULSGRO0_USL1_UIOFGRO0_USFGROn1_VSn1_VWA2_VWB1_WSGRA0_WSGRB0_WS64_WG16_4_4,0.0,10.43,2610.03
80,8,8240,5120,False,torch.bfloat16,torch.bfloat16,False,False,hipblaslt,204312,0,33.9479,Cijk_Alik_Bljk_BBS_BH_UserArgs_MT64x16x256_MI16x16x1_SN_LDSB1_AFC0_AFEM8_AFEM1_ASEM32_CLR1_CADS0_DTLA0_DTLB0_DTVA0_DTVB0_EPS0_FDSI0_GRPM1_GRVWA8_GRVWB8_GSUAMB_GLS0_ISA942_IU1_K1_LDSTI0_LBSPPA512_LBSPPB512_LBSPPM0_LPA16_LPB16_LPMn1_LRVW8_LWPMn1_MIAV0_MIWT1_1_MO40_NTn1_NTA0_NTB0_NTC0_NTD0_NTM0_NEPBS0_NLCA1_NLCB1_ONLL1_PGR2_PLR1_PKA1_SIA3_SS0_SPO0_SRVW0_SSO0_SVW4_SK0_SKFTR0_SKXCCM0_TLDS1_ULSGRO0_USL1_UIOFGRO0_USFGROn1_VSn1_VWA1_VWB1_WSGRA0_WSGRB0_WS64_WG64_4_1,0.0,19.88,2491.8
80,12,8240,5120,False,torch.bfloat16,torch.bfloat16,False,False,hipblaslt,197066,0,34.6587,Cijk_Alik_Bljk_BBS_BH_Bias_HA_S_SAV_UserArgs_MT64x16x256_MI16x16x1_SN_LDSB1_AFC1_AFEM1_AFEM1_ASEM1_CLR1_CADS0_DTLA0_DTLB0_DTVA0_DTVB0_EPS0_FDSI0_GRPM1_GRVWA8_GRVWB8_GSUAMBSK_GLS0_ISA942_IU1_K1_LDSTI0_LBSPPA2048_LBSPPB512_LBSPPM0_LPA16_LPB16_LPM0_LRVW8_LWPMn1_MIAV0_MIWT4_1_MO40_NTn1_NTA0_NTB0_NTC0_NTD4_NTM0_NEPBS16_NLCA1_NLCB1_ONLL1_PGR2_PLR1_PKA1_SIA3_SS1_SPO0_SRVW0_SSO0_SVW4_SK0_SKFTR0_SKXCCM0_TLDS1_ULSGRO1_USL1_UIOFGRO0_USFGROn1_VSn1_VWA4_VWB1_WSGRA0_WSGRB0_WS64_WG16_4_4,0.0,29.21,2443.78
80,16,8240,5120,False,torch.bfloat16,torch.bfloat16,False,False,hipblaslt,204196,0,34.0801,Cijk_Alik_Bljk_BBS_BH_UserArgs_MT32x16x256_MI16x16x1_SN_LDSB1_AFC0_AFEM1_AFEM1_ASEM1_CLR1_CADS0_DTLA0_DTLB0_DTVA0_DTVB0_EPS0_FDSI0_GRPM1_GRVWA8_GRVWB8_GSUAMB_GLS0_ISA942_IU1_K1_LDSTI0_LBSPPA1024_LBSPPB512_LBSPPM0_LPA16_LPB16_LPM0_LRVW8_LWPMn1_MIAV1_MIWT2_1_MO40_NTn1_NTA0_NTB0_NTC0_NTD0_NTM0_NEPBS0_NLCA1_NLCB1_ONLL1_PGR2_PLR1_PKA1_SIA3_SS1_SPO0_SRVW0_SSO0_SVW2_SK0_SKFTR0_SKXCCM0_TLDS1_ULSGRO0_USL1_UIOFGRO0_USFGROn1_VSn1_VWA2_VWB1_WSGRA0_WSGRB0_WS64_WG16_4_4,0.0,39.61,2488.41
80,24,8240,5120,False,torch.bfloat16,torch.bfloat16,False,False,hipblaslt,204208,0,36.9115,Cijk_Alik_Bljk_BBS_BH_UserArgs_MT64x32x256_MI16x16x1_SN_LDSB1_AFC0_AFEM1_AFEM1_ASEM1_CLR1_CADS0_DTLA0_DTLB0_DTVA0_DTVB0_EPS0_FDSI0_GRPM1_GRVWA8_GRVWB8_GSUAMB_GLS0_ISA942_IU1_K1_LDSTI0_LBSPPA2048_LBSPPB512_LBSPPM0_LPA16_LPB16_LPM0_LRVW8_LWPMn1_MIAV1_MIWT4_2_MO40_NTn1_NTA0_NTB0_NTC3_NTD3_NTM0_NEPBS0_NLCA1_NLCB1_ONLL1_PGR2_PLR1_PKA1_SIA3_SS1_SPO0_SRVW0_SSO0_SVW4_SK0_SKFTR0_SKXCCM0_TLDS1_ULSGRO0_USL1_UIOFGRO0_USFGROn1_VSn1_VWA4_VWB1_WSGRA0_WSGRB0_WS64_WG16_4_4,0.0,54.86,2303.32
80,32,8240,5120,False,torch.bfloat16,torch.bfloat16,False,False,hipblaslt,197075,0,38.6546,Cijk_Alik_Bljk_BBS_BH_Bias_HA_S_SAV_UserArgs_MT64x32x256_MI16x16x1_SN_LDSB1_AFC1_AFEM1_AFEM1_ASEM1_CLR1_CADS0_DTLA0_DTLB0_DTVA0_DTVB0_EPS0_FDSI0_GRPM1_GRVWA8_GRVWB8_GSUAMBSK_GLS0_ISA942_IU1_K1_LDSTI0_LBSPPA2048_LBSPPB1024_LBSPPM0_LPA16_LPB16_LPM0_LRVW8_LWPMn1_MIAV0_MIWT4_2_MO40_NTn1_NTA0_NTB0_NTC0_NTD4_NTM0_NEPBS16_NLCA1_NLCB1_ONLL1_PGR2_PLR1_PKA1_SIA3_SS1_SPO0_SRVW0_SSO0_SVW4_SK0_SKFTR0_SKXCCM0_TLDS1_ULSGRO0_USL1_UIOFGRO0_USFGROn1_VSn1_VWA4_VWB2_WSGRA0_WSGRB0_WS64_WG16_4_4,0.0,69.85,2204.98
80,40,8240,5120,False,torch.bfloat16,torch.bfloat16,False,False,hipblaslt,197095,0,43.7634,Cijk_Alik_Bljk_BBS_BH_Bias_HA_S_SAV_UserArgs_MT64x48x256_MI16x16x1_SN_LDSB1_AFC1_AFEM1_AFEM1_ASEM1_CLR1_CADS0_DTLA0_DTLB0_DTVA0_DTVB0_EPS0_FDSI0_GRPM1_GRVWA8_GRVWB8_GSUAMBSK_GLS0_ISA942_IU1_K1_LDSTI0_LBSPPA2048_LBSPPB512_LBSPPM0_LPA16_LPB16_LPM0_LRVW8_LWPMn1_MIAV0_MIWT4_3_MO40_NTn1_NTA0_NTB0_NTC0_NTD4_NTM0_NEPBS16_NLCA1_NLCB1_ONLL1_PGR2_PLR1_PKA1_SIA3_SS1_SPO0_SRVW0_SSO0_SVW4_SK0_SKFTR0_SKXCCM0_TLDS1_ULSGRO1_USL1_UIOFGRO0_USFGROn1_VSn1_VWA4_VWB1_WSGRA0_WSGRB0_WS64_WG16_4_4,0.0,77.12,1952.46
80,48,8240,5120,False,torch.bfloat16,torch.bfloat16,False,False,hipblaslt,196951,0,44.4213,Cijk_Alik_Bljk_BBS_BH_Bias_HA_S_SAV_UserArgs_MT64x48x256_MI16x16x1_SN_LDSB1_AFC1_AFEM1_AFEM1_ASEM1_CLR1_CADS0_DTLA0_DTLB0_DTVA0_DTVB0_EPS0_FDSI0_GRPM1_GRVWA8_GRVWB8_GSUAMBSK_GLS0_ISA942_IU1_K1_LDSTI0_LBSPPA2048_LBSPPB512_LBSPPM0_LPA16_LPB16_LPM0_LRVW8_LWPMn1_MIAV0_MIWT4_3_MO40_NTn1_NTA0_NTB0_NTC0_NTD4_NTM0_NEPBS16_NLCA1_NLCB1_ONLL1_PGR2_PLR1_PKA1_SIA3_SS1_SPO0_SRVW0_SSO0_SVW4_SK0_SKFTR0_SKXCCM0_TLDS1_ULSGRO1_USL1_UIOFGRO0_USFGROn1_VSn1_VWA4_VWB1_WSGRA0_WSGRB0_WS64_WG16_4_4,0.0,91.18,1928.36
80,56,8240,5120,False,torch.bfloat16,torch.bfloat16,False,False,hipblaslt,204350,0,48.1259,Cijk_Alik_Bljk_BBS_BH_UserArgs_MT128x64x128_MI16x16x1_SN_LDSB1_AFC0_AFEM1_AFEM1_ASEM1_CLR1_CADS0_DTLA0_DTLB0_DTVA0_DTVB0_EPS0_FDSI0_GRPM1_GRVWA8_GRVWB8_GSUAMB_GLS0_ISA942_IU1_K1_LDSTI0_LBSPPA1024_LBSPPB1024_LBSPPM0_LPA16_LPB16_LPM0_LRVW8_LWPMn1_MIAV0_MIWT4_4_MO40_NTn1_NTA0_NTB0_NTC0_NTD7_NTM0_NEPBS8_NLCA1_NLCB1_ONLL1_PGR2_PLR1_PKA1_SIA3_SS1_SPO0_SRVW0_SSO0_SVW4_SK0_SKFTR0_SKXCCM0_TLDS1_ULSGRO1_USL1_UIOFGRO0_USFGROn1_VSn1_VWA4_VWB4_WSGRA0_WSGRB0_WS64_WG32_4_2,0.0,98.18,1784.36
80,64,8240,5120,False,torch.bfloat16,torch.bfloat16,False,False,hipblaslt,204350,0,50.1965,Cijk_Alik_Bljk_BBS_BH_UserArgs_MT128x64x128_MI16x16x1_SN_LDSB1_AFC0_AFEM1_AFEM1_ASEM1_CLR1_CADS0_DTLA0_DTLB0_DTVA0_DTVB0_EPS0_FDSI0_GRPM1_GRVWA8_GRVWB8_GSUAMB_GLS0_ISA942_IU1_K1_LDSTI0_LBSPPA1024_LBSPPB1024_LBSPPM0_LPA16_LPB16_LPM0_LRVW8_LWPMn1_MIAV0_MIWT4_4_MO40_NTn1_NTA0_NTB0_NTC0_NTD7_NTM0_NEPBS8_NLCA1_NLCB1_ONLL1_PGR2_PLR1_PKA1_SIA3_SS1_SPO0_SRVW0_SSO0_SVW4_SK0_SKFTR0_SKXCCM0_TLDS1_ULSGRO1_USL1_UIOFGRO0_USFGROn1_VSn1_VWA4_VWB4_WSGRA0_WSGRB0_WS64_WG32_4_2,0.0,107.58,1715.01
80,72,8240,5120,False,torch.bfloat16,torch.bfloat16,False,False,hipblaslt,197296,0,55.3227,Cijk_Alik_Bljk_BBS_BH_Bias_HA_S_SAV_UserArgs_MT128x80x128_MI16x16x1_SN_LDSB1_AFC1_AFEM1_AFEM1_ASEM1_CLR1_CADS0_DTLA0_DTLB0_DTVA0_DTVB0_EPS0_FDSI0_GRPM1_GRVWA8_GRVWB8_GSUAMBSK_GLS0_ISA942_IU1_K1_LDSTI0_LBSPPA1024_LBSPPB256_LBSPPM0_LPA16_LPB16_LPM0_LRVW8_LWPMn1_MIAV0_MIWT4_5_MO40_NTn1_NTA0_NTB0_NTC0_NTD4_NTM0_NEPBS16_NLCA1_NLCB1_ONLL1_PGR2_PLR1_PKA1_SIA3_SS1_SPO0_SRVW0_SSO0_SVW4_SK0_SKFTR0_SKXCCM0_TLDS1_ULSGRO1_USL1_UIOFGRO0_USFGROn1_VSn1_VWA4_VWB1_WSGRA0_WSGRB0_WS64_WG32_4_2,0.0,109.81,1559.96
80,80,8240,5120,False,torch.bfloat16,torch.bfloat16,False,False,hipblaslt,197296,0,54.9557,Cijk_Alik_Bljk_BBS_BH_Bias_HA_S_SAV_UserArgs_MT128x80x128_MI16x16x1_SN_LDSB1_AFC1_AFEM1_AFEM1_ASEM1_CLR1_CADS0_DTLA0_DTLB0_DTVA0_DTVB0_EPS0_FDSI0_GRPM1_GRVWA8_GRVWB8_GSUAMBSK_GLS0_ISA942_IU1_K1_LDSTI0_LBSPPA1024_LBSPPB256_LBSPPM0_LPA16_LPB16_LPM0_LRVW8_LWPMn1_MIAV0_MIWT4_5_MO40_NTn1_NTA0_NTB0_NTC0_NTD4_NTM0_NEPBS16_NLCA1_NLCB1_ONLL1_PGR2_PLR1_PKA1_SIA3_SS1_SPO0_SRVW0_SSO0_SVW4_SK0_SKFTR0_SKXCCM0_TLDS1_ULSGRO1_USL1_UIOFGRO0_USFGROn1_VSn1_VWA4_VWB1_WSGRA0_WSGRB0_WS64_WG32_4_2,0.0,122.83,1574.27
80,88,8240,5120,False,torch.bfloat16,torch.bfloat16,False,False,hipblaslt,197324,0,59.1792,Cijk_Alik_Bljk_BBS_BH_Bias_HA_S_SAV_UserArgs_MT128x96x128_MI16x16x1_SN_LDSB1_AFC1_AFEM1_AFEM1_ASEM1_CLR1_CADS0_DTLA0_DTLB0_DTVA0_DTVB0_EPS0_FDSI0_GRPM1_GRVWA8_GRVWB8_GSUAMBSK_GLS0_ISA942_IU1_K1_LDSTI0_LBSPPA2048_LBSPPB256_LBSPPM0_LPA16_LPB16_LPM0_LRVW8_LWPMn1_MIAV0_MIWT8_3_MO40_NTn1_NTA0_NTB0_NTC0_NTD4_NTM0_NEPBS16_NLCA1_NLCB1_ONLL1_PGR2_PLR1_PKA1_SIA3_SS1_SPO0_SRVW0_SSO0_SVW8_SK0_SKFTR0_SKXCCM0_TLDS1_ULSGRO1_USL1_UIOFGRO0_USFGROn1_VSn1_VWA8_VWB1_WSGRA0_WSGRB0_WS64_WG16_8_2,0.0,125.47,1465.53
80,96,8240,5120,False,torch.bfloat16,torch.bfloat16,False,False,hipblaslt,197332,0,59.2162,Cijk_Alik_Bljk_BBS_BH_Bias_HA_S_SAV_UserArgs_MT128x96x128_MI16x16x1_SN_LDSB1_AFC1_AFEM1_AFEM1_ASEM1_CLR1_CADS0_DTLA0_DTLB0_DTVA0_DTVB0_EPS0_FDSI0_GRPM1_GRVWA8_GRVWB8_GSUAMBSK_GLS0_ISA942_IU1_K1_LDSTI0_LBSPPA1024_LBSPPB512_LBSPPM0_LPA16_LPB16_LPM0_LRVW8_LWPMn1_MIAV0_MIWT4_6_MO40_NTn1_NTA0_NTB0_NTC0_NTD4_NTM0_NEPBS16_NLCA1_NLCB1_ONLL1_PGR2_PLR1_PKA1_SIA3_SS1_SPO0_SRVW0_SSO0_SVW4_SK0_SKFTR0_SKXCCM0_TLDS1_ULSGRO1_USL1_UIOFGRO0_USFGROn1_VSn1_VWA4_VWB2_WSGRA0_WSGRB0_WS64_WG32_4_2,0.0,136.79,1468.23
80,104,8240,5120,False,torch.bfloat16,torch.bfloat16,False,False,hipblaslt,197350,0,69.85,Cijk_Alik_Bljk_BBS_BH_Bias_HA_S_SAV_UserArgs_MT128x112x128_MI16x16x1_SN_LDSB1_AFC1_AFEM1_AFEM1_ASEM1_CLR1_CADS0_DTLA0_DTLB0_DTVA0_DTVB0_EPS0_FDSI0_GRPM1_GRVWA8_GRVWB8_GSUAMBSK_GLS0_ISA942_IU1_K1_LDSTI0_LBSPPA2048_LBSPPB256_LBSPPM0_LPA16_LPB16_LPM0_LRVW8_LWPMn1_MIAV0_MIWT8_7_MO40_NTn1_NTA0_NTB0_NTC0_NTD4_NTM0_NEPBS16_NLCA1_NLCB1_ONLL1_PGR2_PLR1_PKA1_SIA3_SS1_SPO0_SRVW0_SSO0_SVW8_SK0_SKFTR0_SKXCCM0_TLDS1_ULSGRO1_USL1_UIOFGRO0_USFGROn1_VSn1_VWA8_VWB1_WSGRA0_WSGRB0_WS64_WG16_4_4,0.0,125.63,1247.77
80,112,8240,5120,False,torch.bfloat16,torch.bfloat16,False,False,hipblaslt,197348,0,70.3167,Cijk_Alik_Bljk_BBS_BH_Bias_HA_S_SAV_UserArgs_MT128x112x128_MI16x16x1_SN_LDSB1_AFC1_AFEM1_AFEM1_ASEM1_CLR1_CADS0_DTLA0_DTLB0_DTVA0_DTVB0_EPS0_FDSI0_GRPM1_GRVWA8_GRVWB8_GSUAMBSK_GLS0_ISA942_IU1_K1_LDSTI0_LBSPPA2048_LBSPPB256_LBSPPM0_LPA16_LPB16_LPM0_LRVW8_LWPMn1_MIAV0_MIWT8_7_MO40_NTn1_NTA0_NTB0_NTC0_NTD4_NTM0_NEPBS16_NLCA1_NLCB1_ONLL1_PGR2_PLR1_PKA1_SIA3_SS1_SPO0_SRVW0_SSO0_SVW8_SK0_SKFTR0_SKXCCM0_TLDS1_ULSGRO1_USL1_UIOFGRO0_USFGROn1_VSn1_VWA8_VWB1_WSGRA0_WSGRB0_WS64_WG16_4_4,0.0,134.4,1242.52
80,120,8240,5120,False,torch.bfloat16,torch.bfloat16,False,False,hipblaslt,197360,0,91.8925,Cijk_Alik_Bljk_BBS_BH_Bias_HA_S_SAV_UserArgs_MT128x128x64_MI16x16x1_SN_LDSB1_AFC1_AFEM1_AFEM1_ASEM1_CLR1_CADS0_DTLA0_DTLB0_DTVA0_DTVB0_EPS0_FDSI0_GRPM1_GRVWA8_GRVWB8_GSUAMBSK_GLS0_ISA942_IU1_K1_LDSTI0_LBSPPA1024_LBSPPB256_LBSPPM0_LPA16_LPB16_LPM0_LRVW8_LWPMn1_MIAV0_MIWT8_2_MO40_NTn1_NTA0_NTB0_NTC0_NTD4_NTM0_NEPBS16_NLCA1_NLCB1_ONLL1_PGR2_PLR1_PKA1_SIA3_SS1_SPO0_SRVW0_SSO0_SVW8_SK0_SKFTR0_SKXCCM0_TLDS1_ULSGRO1_USL1_UIOFGRO0_USFGROn1_VSn1_VWA8_VWB2_WSGRA0_WSGRB0_WS64_WG16_16_1,0.0,110.19,953.11
80,128,8240,5120,False,torch.bfloat16,torch.bfloat16,False,False,hipblaslt,197274,0,86.5048,Cijk_Alik_Bljk_BBS_BH_Bias_HA_S_SAV_UserArgs_MT128x64x128_MI16x16x1_SN_LDSB1_AFC1_AFEM1_AFEM1_ASEM1_CLR1_CADS0_DTLA0_DTLB0_DTVA0_DTVB0_EPS0_FDSI0_GRPM1_GRVWA8_GRVWB8_GSUAMBSK_GLS0_ISA942_IU1_K1_LDSTI0_LBSPPA1024_LBSPPB1024_LBSPPM0_LPA16_LPB16_LPM0_LRVW8_LWPMn1_MIAV0_MIWT4_4_MO40_NTn1_NTA0_NTB0_NTC0_NTD4_NTM0_NEPBS16_NLCA1_NLCB1_ONLL1_PGR2_PLR1_PKA1_SIA3_SS1_SPO0_SRVW0_SSO0_SVW4_SK0_SKFTR0_SKXCCM0_TLDS1_ULSGRO1_USL1_UIOFGRO0_USFGROn1_VSn1_VWA4_VWB4_WSGRA0_WSGRB0_WS64_WG32_4_2,0.0,124.85,1014.95
80,512,8240,5120,False,torch.bfloat16,torch.bfloat16,False,False,hipblaslt,204330,0,237.531,Cijk_Alik_Bljk_BBS_BH_UserArgs_MT224x256x64_MI16x16x1_SN_LDSB1_AFC0_AFEM1_AFEM1_ASEM1_CLR1_CADS0_DTLA0_DTLB0_DTVA0_DTVB0_EPS0_FDSI0_GRPM1_GRVWA2_GRVWB2_GSUAMB_GLS0_ISA942_IU1_K1_LDSTI0_LBSPPA128_LBSPPB256_LBSPPM0_LPA4_LPB4_LPM0_LRVW4_LWPMn1_MIAV0_MIWT7_8_MO40_NTn1_NTA1_NTB1_NTC4_NTD4_NTM0_NEPBS0_NLCA1_NLCB1_ONLL1_PGR2_PLR1_PKA1_SIA3_SS1_SPO0_SRVW0_SSO0_SVW1_SK0_SKFTR0_SKXCCM0_TLDS1_ULSGRO0_USL1_UIOFGRO0_USFGROn1_VSn1_VWA1_VWB2_WSGRA2_WSGRB2_WS64_WG32_8_1,0.0,181.88,412.82
80,6074,8240,5120,False,torch.bfloat16,torch.bfloat16,False,False,hipblaslt,196867,0,2205.6049,Cijk_Alik_Bljk_BBS_BH_Bias_HA_S_SAV_UserArgs_MT192x256x64_MI16x16x1_SN_LDSB1_AFC1_AFEM1_AFEM1_ASEM1_CLR1_CADS0_DTLA0_DTLB0_DTVA0_DTVB0_EPS0_FDSI0_GRPM1_GRVWA8_GRVWB8_GSUAMBSK_GLS0_ISA942_IU1_K1_LDSTI0_LBSPPA256_LBSPPB1024_LBSPPM0_LPA16_LPB16_LPM0_LRVW8_LWPMn1_MIAV0_MIWT6_8_MO40_NTn1_NTA0_NTB0_NTC0_NTD4_NTM0_NEPBS12_NLCA1_NLCB1_ONLL1_PGR2_PLR1_PKA1_SIA3_SS1_SPO0_SRVW0_SSO0_SVW2_SK0_SKFTR0_SKXCCM0_TLDS1_ULSGRO1_USL1_UIOFGRO0_USFGROn1_VSn1_VWA2_VWB8_WSGRA0_WSGRB0_WS64_WG32_8_1,0.0,232.37,111.84
80,16384,8240,5120,False,torch.bfloat16,torch.bfloat16,False,False,hipblaslt,196512,0,5683.6398,Cijk_Alik_Bljk_BBS_BH_Bias_HA_S_SAV_UserArgs_MT256x192x64_MI32x32x1_SN_LDSB1_AFC1_AFEM1_AFEM1_ASEM1_CLR1_CADS0_DTLA0_DTLB0_DTVA0_DTVB0_EPS0_FDSI0_GRPM1_GRVWA8_GRVWB8_GSUAMBSK_GLS0_ISA942_IU1_K1_LDSTI0_LBSPPA512_LBSPPB128_LBSPPM0_LPA8_LPB8_LPM0_LRVW8_LWPMn1_MIAV0_MIWT4_3_MO40_NTn1_NTA0_NTB0_NTC0_NTD4_NTM0_NEPBS8_NLCA1_NLCB1_ONLL1_PGR2_PLR1_PKA1_SIA3_SS1_SPO0_SRVW0_SSO0_SVW4_SK0_SKFTR0_SKXCCM0_TLDS1_ULSGRO0_USL1_UIOFGRO0_USFGROn1_VSn1_VWA4_VWB1_WSGRA0_WSGRB0_WS64_WG64_4_1,0.0,243.23,91.87
80,27613,8240,5120,False,torch.bfloat16,torch.bfloat16,False,False,hipblaslt,196572,0,12436.1354,Cijk_Alik_Bljk_BBS_BH_Bias_HA_S_SAV_UserArgs_MT256x192x64_MI32x32x1_SN_LDSB1_AFC1_AFEM1_AFEM1_ASEM1_CLR1_CADS0_DTLA0_DTLB0_DTVA0_DTVB0_EPS0_FDSI0_GRPM1_GRVWA8_GRVWB8_GSUAMBSK_GLS0_ISA942_IU1_K1_LDSTI0_LBSPPA512_LBSPPB128_LBSPPM0_LPA8_LPB8_LPM0_LRVW8_LWPMn1_MIAV0_MIWT4_3_MO40_NTn1_NTA0_NTB0_NTC0_NTD4_NTM0_NEPBS8_NLCA1_NLCB1_ONLL1_PGR2_PLR1_PKA1_SIA3_SS1_SPO0_SRVW0_SSO4_SVW4_SK0_SKFTR0_SKXCCM0_TLDS1_ULSGRO0_USL1_UIOFGRO0_USFGROn1_VSn1_VWA4_VWB1_WSGRA0_WSGRB0_WS64_WG64_4_1,0.0,187.35,66.11
80,1,17408,5120,False,torch.bfloat16,torch.bfloat16,False,False,hipblaslt,196481,0,66.1176,Cijk_Alik_Bljk_BBS_BH_Bias_HA_S_SAV_UserArgs_MT32x16x256_MI16x16x1_SN_LDSB1_AFC1_AFEM1_AFEM1_ASEM1_CLR1_CADS0_DTLA0_DTLB0_DTVA0_DTVB0_EPS0_FDSI0_GRPM1_GRVWA8_GRVWB8_GSUAMBSK_GLS0_ISA942_IU1_K1_LDSTI0_LBSPPA512_LBSPPB512_LBSPPM0_LPA16_LPB16_LPM0_LRVW8_LWPMn1_MIAV0_MIWT2_1_MO40_NTn1_NTA0_NTB0_NTC0_NTD4_NTM0_NEPBS8_NLCA1_NLCB1_ONLL1_PGR2_PLR1_PKA1_SIA3_SS1_SPO0_SRVW0_SSO0_SVW2_SK0_SKFTR0_SKXCCM0_TLDS1_ULSGRO0_USL1_UIOFGRO0_USFGROn1_VSn1_VWA2_VWB1_WSGRA0_WSGRB0_WS64_WG16_4_4,0.0,2.7,2696.76
80,2,17408,5120,False,torch.bfloat16,torch.bfloat16,False,False,hipblaslt,196595,0,65.6825,Cijk_Alik_Bljk_BBS_BH_Bias_HA_S_SAV_UserArgs_MT32x16x256_MI16x16x1_SN_LDSB1_AFC1_AFEM1_AFEM1_ASEM1_CLR1_CADS0_DTLA0_DTLB0_DTVA0_DTVB0_EPS0_FDSI0_GRPM1_GRVWA8_GRVWB8_GSUAMBSK_GLS0_ISA942_IU1_K1_LDSTI0_LBSPPA512_LBSPPB512_LBSPPM0_LPA16_LPB16_LPM0_LRVW8_LWPMn1_MIAV0_MIWT1_1_MO40_NTn1_NTA0_NTB0_NTC0_NTD4_NTM0_NEPBS8_NLCA1_NLCB1_ONLL1_PGR2_PLR1_PKA1_SIA3_SS1_SPO0_SRVW0_SSO0_SVW1_SK0_SKFTR0_SKXCCM0_TLDS1_ULSGRO0_USL1_UIOFGRO0_USFGROn1_VSn1_VWA1_VWB1_WSGRA0_WSGRB0_WS64_WG32_4_2,0.0,5.43,2715.31
80,4,17408,5120,False,torch.bfloat16,torch.bfloat16,False,False,hipblaslt,196595,0,66.9691,Cijk_Alik_Bljk_BBS_BH_Bias_HA_S_SAV_UserArgs_MT32x16x256_MI16x16x1_SN_LDSB1_AFC1_AFEM1_AFEM1_ASEM1_CLR1_CADS0_DTLA0_DTLB0_DTVA0_DTVB0_EPS0_FDSI0_GRPM1_GRVWA8_GRVWB8_GSUAMBSK_GLS0_ISA942_IU1_K1_LDSTI0_LBSPPA512_LBSPPB512_LBSPPM0_LPA16_LPB16_LPM0_LRVW8_LWPMn1_MIAV0_MIWT1_1_MO40_NTn1_NTA0_NTB0_NTC0_NTD4_NTM0_NEPBS8_NLCA1_NLCB1_ONLL1_PGR2_PLR1_PKA1_SIA3_SS1_SPO0_SRVW0_SSO0_SVW1_SK0_SKFTR0_SKXCCM0_TLDS1_ULSGRO0_USL1_UIOFGRO0_USFGROn1_VSn1_VWA1_VWB1_WSGRA0_WSGRB0_WS64_WG32_4_2,0.0,10.65,2664.48
80,8,17408,5120,False,torch.bfloat16,torch.bfloat16,False,False,hipblaslt,204195,0,65.3388,Cijk_Alik_Bljk_BBS_BH_UserArgs_MT32x16x256_MI16x16x1_SN_LDSB1_AFC0_AFEM1_AFEM1_ASEM1_CLR1_CADS0_DTLA0_DTLB0_DTVA0_DTVB0_EPS0_FDSI0_GRPM1_GRVWA8_GRVWB8_GSUAMB_GLS0_ISA942_IU1_K1_LDSTI0_LBSPPA1024_LBSPPB512_LBSPPM0_LPA16_LPB16_LPM0_LRVW8_LWPMn1_MIAV1_MIWT2_1_MO40_NTn1_NTA0_NTB0_NTC0_NTD0_NTM0_NEPBS0_NLCA1_NLCB1_ONLL1_PGR2_PLR1_PKA1_SIA3_SS1_SPO1_SRVW0_SSO0_SVW2_SK0_SKFTR0_SKXCCM0_TLDS1_ULSGRO0_USL1_UIOFGRO0_USFGROn1_VSn1_VWA2_VWB1_WSGRA0_WSGRB0_WS64_WG16_4_4,0.0,21.83,2733.73
80,12,17408,5120,False,torch.bfloat16,torch.bfloat16,False,False,hipblaslt,196481,0,68.9243,Cijk_Alik_Bljk_BBS_BH_Bias_HA_S_SAV_UserArgs_MT32x16x256_MI16x16x1_SN_LDSB1_AFC1_AFEM1_AFEM1_ASEM1_CLR1_CADS0_DTLA0_DTLB0_DTVA0_DTVB0_EPS0_FDSI0_GRPM1_GRVWA8_GRVWB8_GSUAMBSK_GLS0_ISA942_IU1_K1_LDSTI0_LBSPPA512_LBSPPB512_LBSPPM0_LPA16_LPB16_LPM0_LRVW8_LWPMn1_MIAV0_MIWT2_1_MO40_NTn1_NTA0_NTB0_NTC0_NTD4_NTM0_NEPBS8_NLCA1_NLCB1_ONLL1_PGR2_PLR1_PKA1_SIA3_SS1_SPO0_SRVW0_SSO0_SVW2_SK0_SKFTR0_SKXCCM0_TLDS1_ULSGRO0_USL1_UIOFGRO0_USFGROn1_VSn1_VWA2_VWB1_WSGRA0_WSGRB0_WS64_WG16_4_4,0.0,31.04,2594.13
80,16,17408,5120,False,torch.bfloat16,torch.bfloat16,False,False,hipblaslt,204298,0,68.2019,Cijk_Alik_Bljk_BBS_BH_UserArgs_MT64x16x256_MI16x16x1_SN_LDSB1_AFC0_AFEM8_AFEM8_ASEM32_CLR1_CADS0_DTLA0_DTLB0_DTVA0_DTVB0_EPS0_FDSI0_GRPM1_GRVWA8_GRVWB8_GSUAMB_GLS0_ISA942_IU1_K1_LDSTI0_LBSPPA512_LBSPPB512_LBSPPM0_LPA16_LPB16_LPMn1_LRVW8_LWPMn1_MIAV0_MIWT1_1_MO40_NTn1_NTA0_NTB0_NTC0_NTD0_NTM0_NEPBS0_NLCA1_NLCB1_ONLL1_PGR2_PLR1_PKA1_SIA3_SS0_SPO0_SRVW0_SSO0_SVW4_SK0_SKFTR0_SKXCCM0_TLDS1_ULSGRO0_USL1_UIOFGRO0_USFGROn1_VSn1_VWA1_VWB1_WSGRA0_WSGRB0_WS64_WG64_4_1,0.0,41.82,2624.25
80,24,17408,5120,False,torch.bfloat16,torch.bfloat16,False,False,hipblaslt,204208,0,74.4656,Cijk_Alik_Bljk_BBS_BH_UserArgs_MT64x32x256_MI16x16x1_SN_LDSB1_AFC0_AFEM1_AFEM1_ASEM1_CLR1_CADS0_DTLA0_DTLB0_DTVA0_DTVB0_EPS0_FDSI0_GRPM1_GRVWA8_GRVWB8_GSUAMB_GLS0_ISA942_IU1_K1_LDSTI0_LBSPPA2048_LBSPPB512_LBSPPM0_LPA16_LPB16_LPM0_LRVW8_LWPMn1_MIAV1_MIWT4_2_MO40_NTn1_NTA0_NTB0_NTC3_NTD3_NTM0_NEPBS0_NLCA1_NLCB1_ONLL1_PGR2_PLR1_PKA1_SIA3_SS1_SPO0_SRVW0_SSO0_SVW4_SK0_SKFTR0_SKXCCM0_TLDS1_ULSGRO0_USL1_UIOFGRO0_USFGROn1_VSn1_VWA4_VWB1_WSGRA0_WSGRB0_WS64_WG16_4_4,0.0,57.45,2408.35
80,32,17408,5120,False,torch.bfloat16,torch.bfloat16,False,False,hipblaslt,197079,0,77.1805,Cijk_Alik_Bljk_BBS_BH_Bias_HA_S_SAV_UserArgs_MT64x32x256_MI16x16x1_SN_LDSB1_AFC1_AFEM1_AFEM1_ASEM1_CLR1_CADS0_DTLA0_DTLB0_DTVA0_DTVB0_EPS0_FDSI0_GRPM1_GRVWA8_GRVWB8_GSUAMBSK_GLS0_ISA942_IU1_K1_LDSTI0_LBSPPA2048_LBSPPB1024_LBSPPM0_LPA16_LPB16_LPM0_LRVW8_LWPMn1_MIAV0_MIWT4_2_MO40_NTn1_NTA0_NTB0_NTC0_NTD4_NTM0_NEPBS16_NLCA1_NLCB1_ONLL1_PGR2_PLR1_PKA1_SIA3_SS1_SPO0_SRVW0_SSO0_SVW4_SK0_SKFTR0_SKXCCM0_TLDS1_ULSGRO0_USL1_UIOFGRO0_USFGROn1_VSn1_VWA4_VWB2_WSGRA0_WSGRB0_WS64_WG16_4_4,0.0,73.91,2328.3
80,40,17408,5120,False,torch.bfloat16,torch.bfloat16,False,False,hipblaslt,196951,0,89.5332,Cijk_Alik_Bljk_BBS_BH_Bias_HA_S_SAV_UserArgs_MT64x48x256_MI16x16x1_SN_LDSB1_AFC1_AFEM1_AFEM1_ASEM1_CLR1_CADS0_DTLA0_DTLB0_DTVA0_DTVB0_EPS0_FDSI0_GRPM1_GRVWA8_GRVWB8_GSUAMBSK_GLS0_ISA942_IU1_K1_LDSTI0_LBSPPA2048_LBSPPB512_LBSPPM0_LPA16_LPB16_LPM0_LRVW8_LWPMn1_MIAV0_MIWT4_3_MO40_NTn1_NTA0_NTB0_NTC0_NTD4_NTM0_NEPBS16_NLCA1_NLCB1_ONLL1_PGR2_PLR1_PKA1_SIA3_SS1_SPO0_SRVW0_SSO0_SVW4_SK0_SKFTR0_SKXCCM0_TLDS1_ULSGRO1_USL1_UIOFGRO0_USFGROn1_VSn1_VWA4_VWB1_WSGRA0_WSGRB0_WS64_WG16_4_4,0.0,79.64,2011.1
80,48,17408,5120,False,torch.bfloat16,torch.bfloat16,False,False,hipblaslt,197091,0,89.4393,Cijk_Alik_Bljk_BBS_BH_Bias_HA_S_SAV_UserArgs_MT64x48x256_MI16x16x1_SN_LDSB1_AFC1_AFEM1_AFEM1_ASEM1_CLR1_CADS0_DTLA0_DTLB0_DTVA0_DTVB0_EPS0_FDSI0_GRPM1_GRVWA8_GRVWB8_GSUAMBSK_GLS0_ISA942_IU1_K1_LDSTI0_LBSPPA2048_LBSPPB512_LBSPPM0_LPA16_LPB16_LPM0_LRVW8_LWPMn1_MIAV0_MIWT4_3_MO40_NTn1_NTA0_NTB0_NTC0_NTD4_NTM0_NEPBS16_NLCA1_NLCB1_ONLL1_PGR2_PLR1_PKA1_SIA3_SS1_SPO0_SRVW0_SSO0_SVW4_SK0_SKFTR0_SKXCCM0_TLDS1_ULSGRO1_USL1_UIOFGRO0_USFGROn1_VSn1_VWA4_VWB1_WSGRA0_WSGRB0_WS64_WG16_4_4,0.0,95.67,2017.24
80,56,17408,5120,False,torch.bfloat16,torch.bfloat16,False,False,hipblaslt,204350,0,98.3443,Cijk_Alik_Bljk_BBS_BH_UserArgs_MT128x64x128_MI16x16x1_SN_LDSB1_AFC0_AFEM1_AFEM1_ASEM1_CLR1_CADS0_DTLA0_DTLB0_DTVA0_DTVB0_EPS0_FDSI0_GRPM1_GRVWA8_GRVWB8_GSUAMB_GLS0_ISA942_IU1_K1_LDSTI0_LBSPPA1024_LBSPPB1024_LBSPPM0_LPA16_LPB16_LPM0_LRVW8_LWPMn1_MIAV0_MIWT4_4_MO40_NTn1_NTA0_NTB0_NTC0_NTD7_NTM0_NEPBS8_NLCA1_NLCB1_ONLL1_PGR2_PLR1_PKA1_SIA3_SS1_SPO0_SRVW0_SSO0_SVW4_SK0_SKFTR0_SKXCCM0_TLDS1_ULSGRO1_USL1_UIOFGRO0_USFGROn1_VSn1_VWA4_VWB4_WSGRA0_WSGRB0_WS64_WG32_4_2,0.0,101.51,1838.25
80,64,17408,5120,False,torch.bfloat16,torch.bfloat16,False,False,hipblaslt,197267,0,101.6534,Cijk_Alik_Bljk_BBS_BH_Bias_HA_S_SAV_UserArgs_MT128x64x128_MI16x16x1_SN_LDSB1_AFC1_AFEM1_AFEM1_ASEM1_CLR1_CADS0_DTLA0_DTLB0_DTVA0_DTVB0_EPS0_FDSI0_GRPM1_GRVWA8_GRVWB8_GSUAMBSK_GLS0_ISA942_IU1_K1_LDSTI0_LBSPPA1024_LBSPPB512_LBSPPM0_LPA16_LPB16_LPM0_LRVW8_LWPMn1_MIAV0_MIWT4_2_MO40_NTn1_NTA0_NTB0_NTC0_NTD4_NTM0_NEPBS16_NLCA1_NLCB1_ONLL1_PGR2_PLR1_PKA1_SIA3_SS1_SPO0_SRVW0_SSO0_SVW4_SK0_SKFTR0_SKXCCM0_TLDS1_ULSGRO1_USL1_UIOFGRO0_USFGROn1_VSn1_VWA4_VWB2_WSGRA0_WSGRB0_WS64_WG32_8_1,0.0,112.23,1781.95
80,72,17408,5120,False,torch.bfloat16,torch.bfloat16,False,False,hipblaslt,196933,0,112.0359,Cijk_Alik_Bljk_BBS_BH_Bias_HA_S_SAV_UserArgs_MT128x80x128_MI16x16x1_SN_LDSB1_AFC1_AFEM1_AFEM1_ASEM1_CLR1_CADS0_DTLA0_DTLB0_DTVA0_DTVB0_EPS0_FDSI0_GRPM1_GRVWA8_GRVWB8_GSUAMBSK_GLS0_ISA942_IU1_K1_LDSTI0_LBSPPA1024_LBSPPB256_LBSPPM0_LPA16_LPB16_LPM0_LRVW8_LWPMn1_MIAV0_MIWT4_5_MO40_NTn1_NTA0_NTB0_NTC0_NTD4_NTM0_NEPBS16_NLCA1_NLCB1_ONLL1_PGR2_PLR1_PKA1_SIA3_SS1_SPO0_SRVW0_SSO0_SVW4_SK0_SKFTR0_SKXCCM0_TLDS1_ULSGRO1_USL1_UIOFGRO0_USFGROn1_VSn1_VWA4_VWB1_WSGRA0_WSGRB0_WS64_WG32_4_2,0.0,114.56,1620.03
80,80,17408,5120,False,torch.bfloat16,torch.bfloat16,False,False,hipblaslt,197292,0,113.1895,Cijk_Alik_Bljk_BBS_BH_Bias_HA_S_SAV_UserArgs_MT128x80x128_MI16x16x1_SN_LDSB1_AFC1_AFEM1_AFEM1_ASEM1_CLR1_CADS0_DTLA0_DTLB0_DTVA0_DTVB0_EPS0_FDSI0_GRPM1_GRVWA8_GRVWB8_GSUAMBSK_GLS0_ISA942_IU1_K1_LDSTI0_LBSPPA1024_LBSPPB256_LBSPPM0_LPA16_LPB16_LPM0_LRVW8_LWPMn1_MIAV0_MIWT4_5_MO40_NTn1_NTA0_NTB0_NTC0_NTD4_NTM0_NEPBS16_NLCA1_NLCB1_ONLL1_PGR2_PLR1_PKA1_SIA3_SS1_SPO0_SRVW0_SSO0_SVW4_SK0_SKFTR0_SKXCCM0_TLDS1_ULSGRO1_USL1_UIOFGRO0_USFGROn1_VSn1_VWA4_VWB1_WSGRA0_WSGRB0_WS64_WG32_4_2,0.0,125.99,1606.71
80,88,17408,5120,False,torch.bfloat16,torch.bfloat16,False,False,hipblaslt,197336,0,121.2901,Cijk_Alik_Bljk_BBS_BH_Bias_HA_S_SAV_UserArgs_MT128x96x128_MI16x16x1_SN_LDSB1_AFC1_AFEM1_AFEM1_ASEM1_CLR1_CADS0_DTLA0_DTLB0_DTVA0_DTVB0_EPS0_FDSI0_GRPM1_GRVWA8_GRVWB8_GSUAMBSK_GLS0_ISA942_IU1_K1_LDSTI0_LBSPPA1024_LBSPPB512_LBSPPM0_LPA16_LPB16_LPM0_LRVW8_LWPMn1_MIAV0_MIWT4_6_MO40_NTn1_NTA0_NTB0_NTC0_NTD4_NTM0_NEPBS16_NLCA1_NLCB1_ONLL1_PGR2_PLR1_PKA1_SIA3_SS1_SPO0_SRVW0_SSO0_SVW4_SK0_SKFTR0_SKXCCM0_TLDS1_ULSGRO1_USL1_UIOFGRO0_USFGROn1_VSn1_VWA4_VWB2_WSGRA0_WSGRB0_WS64_WG32_4_2,0.0,129.33,1502.37
80,96,17408,5120,False,torch.bfloat16,torch.bfloat16,False,False,hipblaslt,197326,0,121.8582,Cijk_Alik_Bljk_BBS_BH_Bias_HA_S_SAV_UserArgs_MT128x96x128_MI16x16x1_SN_LDSB1_AFC1_AFEM1_AFEM1_ASEM1_CLR1_CADS0_DTLA0_DTLB0_DTVA0_DTVB0_EPS0_FDSI0_GRPM1_GRVWA8_GRVWB8_GSUAMBSK_GLS0_ISA942_IU1_K1_LDSTI0_LBSPPA2048_LBSPPB256_LBSPPM0_LPA16_LPB16_LPM0_LRVW8_LWPMn1_MIAV0_MIWT8_3_MO40_NTn1_NTA0_NTB0_NTC0_NTD4_NTM0_NEPBS16_NLCA1_NLCB1_ONLL1_PGR2_PLR1_PKA1_SIA3_SS1_SPO0_SRVW0_SSO0_SVW8_SK0_SKFTR0_SKXCCM0_TLDS1_ULSGRO1_USL1_UIOFGRO0_USFGROn1_VSn1_VWA8_VWB1_WSGRA0_WSGRB0_WS64_WG16_8_2,0.0,140.43,1498.33
80,104,17408,5120,False,torch.bfloat16,torch.bfloat16,False,False,hipblaslt,197350,0,137.4184,Cijk_Alik_Bljk_BBS_BH_Bias_HA_S_SAV_UserArgs_MT128x112x128_MI16x16x1_SN_LDSB1_AFC1_AFEM1_AFEM1_ASEM1_CLR1_CADS0_DTLA0_DTLB0_DTVA0_DTVB0_EPS0_FDSI0_GRPM1_GRVWA8_GRVWB8_GSUAMBSK_GLS0_ISA942_IU1_K1_LDSTI0_LBSPPA2048_LBSPPB256_LBSPPM0_LPA16_LPB16_LPM0_LRVW8_LWPMn1_MIAV0_MIWT8_7_MO40_NTn1_NTA0_NTB0_NTC0_NTD4_NTM0_NEPBS16_NLCA1_NLCB1_ONLL1_PGR2_PLR1_PKA1_SIA3_SS1_SPO0_SRVW0_SSO0_SVW8_SK0_SKFTR0_SKXCCM0_TLDS1_ULSGRO1_USL1_UIOFGRO0_USFGROn1_VSn1_VWA8_VWB1_WSGRA0_WSGRB0_WS64_WG16_4_4,0.0,134.91,1331.29
80,112,17408,5120,False,torch.bfloat16,torch.bfloat16,False,False,hipblaslt,197350,0,140.4602,Cijk_Alik_Bljk_BBS_BH_Bias_HA_S_SAV_UserArgs_MT128x112x128_MI16x16x1_SN_LDSB1_AFC1_AFEM1_AFEM1_ASEM1_CLR1_CADS0_DTLA0_DTLB0_DTVA0_DTVB0_EPS0_FDSI0_GRPM1_GRVWA8_GRVWB8_GSUAMBSK_GLS0_ISA942_IU1_K1_LDSTI0_LBSPPA2048_LBSPPB256_LBSPPM0_LPA16_LPB16_LPM0_LRVW8_LWPMn1_MIAV0_MIWT8_7_MO40_NTn1_NTA0_NTB0_NTC0_NTD4_NTM0_NEPBS16_NLCA1_NLCB1_ONLL1_PGR2_PLR1_PKA1_SIA3_SS1_SPO0_SRVW0_SSO0_SVW8_SK0_SKFTR0_SKXCCM0_TLDS1_ULSGRO1_USL1_UIOFGRO0_USFGROn1_VSn1_VWA8_VWB1_WSGRA0_WSGRB0_WS64_WG16_4_4,0.0,142.14,1305.03
80,120,17408,5120,False,torch.bfloat16,torch.bfloat16,False,False,hipblaslt,204331,0,153.1968,Cijk_Alik_Bljk_BBS_BH_UserArgs_MT224x128x64_MI16x16x1_SN_LDSB1_AFC0_AFEM1_AFEM1_ASEM1_CLR1_CADS0_DTLA0_DTLB0_DTVA0_DTVB0_EPS0_FDSI0_GRPM1_GRVWA8_GRVWB8_GSUAMB_GLS0_ISA942_IU1_K1_LDSTI0_LBSPPA128_LBSPPB256_LBSPPM0_LPA16_LPB16_LPM0_LRVW8_LWPMn1_MIAV1_MIWT7_4_MO40_NTn1_NTA1_NTB1_NTC0_NTD0_NTM0_NEPBS0_NLCA1_NLCB1_ONLL1_PGR2_PLR1_PKA1_SIA3_SS0_SPO0_SRVW0_SSO0_SVW4_SK0_SKFTR0_SKXCCM0_TLDS1_ULSGRO0_USL1_UIOFGRO0_USFGROn1_VSn1_VWA1_VWB2_WSGRA2_WSGRB2_WS64_WG32_8_1,0.0,139.63,1198.88
80,128,17408,5120,False,torch.bfloat16,torch.bfloat16,False,False,hipblaslt,204331,0,153.8851,Cijk_Alik_Bljk_BBS_BH_UserArgs_MT224x128x64_MI16x16x1_SN_LDSB1_AFC0_AFEM1_AFEM1_ASEM1_CLR1_CADS0_DTLA0_DTLB0_DTVA0_DTVB0_EPS0_FDSI0_GRPM1_GRVWA8_GRVWB8_GSUAMB_GLS0_ISA942_IU1_K1_LDSTI0_LBSPPA128_LBSPPB256_LBSPPM0_LPA16_LPB16_LPM0_LRVW8_LWPMn1_MIAV1_MIWT7_4_MO40_NTn1_NTA1_NTB1_NTC0_NTD0_NTM0_NEPBS0_NLCA1_NLCB1_ONLL1_PGR2_PLR1_PKA1_SIA3_SS0_SPO0_SRVW0_SSO0_SVW4_SK0_SKFTR0_SKXCCM0_TLDS1_ULSGRO0_USL1_UIOFGRO0_USFGROn1_VSn1_VWA1_VWB2_WSGRA2_WSGRB2_WS64_WG32_8_1,0.0,148.27,1195.86
80,512,17408,5120,False,torch.bfloat16,torch.bfloat16,False,False,hipblaslt,204330,0,450.4442,Cijk_Alik_Bljk_BBS_BH_UserArgs_MT224x256x64_MI16x16x1_SN_LDSB1_AFC0_AFEM1_AFEM1_ASEM1_CLR1_CADS0_DTLA0_DTLB0_DTVA0_DTVB0_EPS0_FDSI0_GRPM1_GRVWA2_GRVWB2_GSUAMB_GLS0_ISA942_IU1_K1_LDSTI0_LBSPPA128_LBSPPB256_LBSPPM0_LPA4_LPB4_LPM0_LRVW4_LWPMn1_MIAV0_MIWT7_8_MO40_NTn1_NTA1_NTB1_NTC4_NTD4_NTM0_NEPBS0_NLCA1_NLCB1_ONLL1_PGR2_PLR1_PKA1_SIA3_SS1_SPO0_SRVW0_SSO0_SVW1_SK0_SKFTR0_SKXCCM0_TLDS1_ULSGRO0_USL1_UIOFGRO0_USFGROn1_VSn1_VWA1_VWB2_WSGRA2_WSGRB2_WS64_WG32_8_1,0.0,202.62,446.95
80,6074,17408,5120,False,torch.bfloat16,torch.bfloat16,False,False,hipblaslt,204347,0,4460.8779,Cijk_Alik_Bljk_BBS_BH_UserArgs_MT256x224x64_MI16x16x1_SN_LDSB1_AFC0_AFEM1_AFEM1_ASEM1_CLR1_CADS0_DTLA0_DTLB0_DTVA0_DTVB0_EPS0_FDSI0_GRPM1_GRVWA2_GRVWB2_GSUAMB_GLS0_ISA942_IU1_K1_LDSTI0_LBSPPA1024_LBSPPB128_LBSPPM0_LPA4_LPB4_LPM0_LRVW4_LWPMn1_MIAV0_MIWT8_7_MO40_NTn1_NTA0_NTB0_NTC0_NTD4_NTM0_NEPBS16_NLCA1_NLCB1_ONLL1_PGR2_PLR1_PKA1_SIA3_SS1_SPO0_SRVW0_SSO0_SVW8_SK0_SKFTR0_SKXCCM0_TLDS1_ULSGRO0_USL1_UIOFGRO0_USFGROn1_VSn1_VWA8_VWB1_WSGRA1_WSGRB1_WS64_WG32_8_1,0.0,242.72,101.31
80,16384,17408,5120,False,torch.bfloat16,torch.bfloat16,False,False,triton,0,0,15864.0261,auto,0.0,184.1,57.77
80,27613,17408,5120,False,torch.bfloat16,torch.bfloat16,False,False,hipblaslt,196459,0,25973.467,Cijk_Alik_Bljk_BBS_BH_Bias_HA_S_SAV_UserArgs_MT256x192x64_MI32x32x1_SN_LDSB1_AFC1_AFEM1_AFEM1_ASEM1_CLR1_CADS0_DTLA0_DTLB0_DTVA0_DTVB0_EPS0_FDSI0_GRPM1_GRVWA8_GRVWB8_GSUAMBSK_GLS0_ISA942_IU1_K1_LDSTI0_LBSPPA512_LBSPPB128_LBSPPM0_LPA8_LPB8_LPM0_LRVW8_LWPMn1_MIAV0_MIWT4_3_MO40_NTn1_NTA0_NTB0_NTC0_NTD4_NTM0_NEPBS8_NLCA1_NLCB1_ONLL1_PGR2_PLR1_PKA1_SIA3_SS1_SPO0_SRVW0_SSO0_SVW4_SK0_SKFTR0_SKXCCM0_TLDS1_ULSGRO0_USL1_UIOFGRO0_USFGROn1_VSn1_VWA4_VWB1_WSGRA0_WSGRB0_WS64_WG64_4_1,0.0,189.51,54.76
80,32768,5120,3072,False,torch.bfloat16,torch.bfloat16,False,False,hipblaslt,204219,0,4253.1156,Cijk_Alik_Bljk_BBS_BH_UserArgs_MT256x192x64_MI32x32x1_SN_LDSB1_AFC0_AFEM1_AFEM1_ASEM1_CLR1_CADS0_DTLA0_DTLB0_DTVA0_DTVB0_EPS0_FDSI0_GRPM1_GRVWA8_GRVWB8_GSUAMB_GLS0_ISA942_IU1_K1_LDSTI0_LBSPPA512_LBSPPB128_LBSPPM0_LPA8_LPB8_LPM0_LRVW8_LWPMn1_MIAV0_MIWT4_3_MO40_NTn1_NTA0_NTB0_NTC4_NTD4_NTM0_NEPBS16_NLCA1_NLCB1_ONLL1_PGR2_PLR1_PKA1_SIA3_SS1_SPO1_SRVW0_SSO4_SVW4_SK0_SKFTR0_SKXCCM0_TLDS1_ULSGRO0_USL1_UIOFGRO0_USFGROn1_VSn1_VWA4_VWB1_WSGRA0_WSGRB0_WS64_WG64_4_1,0.0,242.36,133.63
80,32768,5120,8704,False,torch.bfloat16,torch.bfloat16,False,False,hipblaslt,195781,0,15903.6023,Cijk_Alik_Bljk_BBS_BH_Bias_HA_S_SAV_UserArgs_MT256x192x64_MI16x16x1_SN_LDSB1_AFC1_AFEM8_AFEM8_ASEM32_CLR1_CADS0_DTLA0_DTLB0_DTVA0_DTVB0_EPS0_FDSI0_GRPM1_GRVWA8_GRVWB8_GSUAMB_GLS0_ISA942_IU1_K1_LDSTI0_LBSPPA1024_LBSPPB256_LBSPPM0_LPA16_LPB16_LPMn1_LRVW8_LWPMn1_MIAV0_MIWT8_6_MO40_NTn1_NTA0_NTB0_NTC0_NTD0_NTM0_NEPBS0_NLCA1_NLCB1_ONLL1_PGR2_PLR1_PKA1_SIA3_SS1_SPO0_SRVW0_SSO0_SVW8_SK0_SKFTR0_SKXCCM0_TLDS1_ULSGRO0_USL1_UIOFGRO0_USFGRO0_VSn1_VWA8_VWB2_WSGRA1_WSGRB0_WS64_WG32_8_1,0.0,183.64,62.57
80,32768,7168,5120,False,torch.bfloat16,torch.bfloat16,False,False,hipblaslt,204329,0,12643.6824,Cijk_Alik_Bljk_BBS_BH_UserArgs_MT256x192x64_MI16x16x1_SN_LDSB1_AFC0_AFEM1_AFEM1_ASEM1_CLR1_CADS0_DTLA0_DTLB0_DTVA0_DTVB0_EPS0_FDSI0_GRPM1_GRVWA8_GRVWB8_GSUAMB_GLS0_ISA942_IU1_K1_LDSTI0_LBSPPA256_LBSPPB256_LBSPPM0_LPA16_LPB16_LPM0_LRVW8_LWPMn1_MIAV0_MIWT8_6_MO40_NTn1_NTA3_NTB1_NTC4_NTD4_NTM0_NEPBS0_NLCA1_NLCB1_ONLL1_PGR2_PLR1_PKA1_SIA3_SS1_SPO0_SRVW0_SSO0_SVW2_SK0_SKFTR0_SKXCCM0_TLDS1_ULSGRO0_USL1_UIOFGRO0_USFGROn1_VSn1_VWA2_VWB2_WSGRA1_WSGRB1_WS64_WG32_8_1,0.0,190.23,69.5
80,32768,8240,5120,False,torch.bfloat16,torch.bfloat16,False,False,hipblaslt,196512,0,15299.2745,Cijk_Alik_Bljk_BBS_BH_Bias_HA_S_SAV_UserArgs_MT256x192x64_MI32x32x1_SN_LDSB1_AFC1_AFEM1_AFEM1_ASEM1_CLR1_CADS0_DTLA0_DTLB0_DTVA0_DTVB0_EPS0_FDSI0_GRPM1_GRVWA8_GRVWB8_GSUAMBSK_GLS0_ISA942_IU1_K1_LDSTI0_LBSPPA512_LBSPPB128_LBSPPM0_LPA8_LPB8_LPM0_LRVW8_LWPMn1_MIAV0_MIWT4_3_MO40_NTn1_NTA0_NTB0_NTC0_NTD4_NTM0_NEPBS8_NLCA1_NLCB1_ONLL1_PGR2_PLR1_PKA1_SIA3_SS1_SPO0_SRVW0_SSO0_SVW4_SK0_SKFTR0_SKXCCM0_TLDS1_ULSGRO0_USL1_UIOFGRO0_USFGROn1_VSn1_VWA4_VWB1_WSGRA0_WSGRB0_WS64_WG64_4_1,0.0,180.72,62.74
80,32768,17408,5120,False,torch.bfloat16,torch.bfloat16,False,False,triton,0,0,31931.7295,auto,0.0,182.93,51.82
