aiter/configs/model_configs/qwen3_5_122b_tp4_bf16_tuned_fmoe.csv
gfx,cu_num,token,model_dim,inter_dim,expert,topk,act_type,dtype,q_dtype_a,q_dtype_w,q_type,use_g1u1,doweight_stage1,block_m,ksplit,us1,kernelName1,err1,us2,kernelName2,err2,us,run_1stage,xbf16,flat,tflops,bw,_tag
gfx950,256,1,3072,256,256,8,ActivationType.Silu,torch.bfloat16,torch.bfloat16,torch.bfloat16,QuantType.No,1,0,32,0,20.7777,moe_ck2stages_gemm1_256x32x64x128_1x4_TypeCast_v1_Nswizzle0_Quant0_MulRoutedWeight0_silu_B16_B16_B16,0.0%,7.5717,moe_ck2stages_gemm2_256x32x128x128_1x4_TypeCast_v1_Nswizzle0_Quant0_MulRoutedWeight1_B16_B16_B16,0.0%,28.3494,0,0,0,1.33,42610.14,
gfx950,256,2,3072,256,256,8,ActivationType.Silu,torch.bfloat16,torch.bfloat16,torch.bfloat16,QuantType.No,1,0,32,0,21.1876,moe_ck2stages_gemm1_256x32x64x128_1x4_TypeCast_v1_Nswizzle0_Quant0_MulRoutedWeight0_silu_B16_B16_B16,0.0%,9.8556,moe_ck2stages_gemm2_256x32x64x64_1x4_TypeCast_v1_Nswizzle0_Quant0_MulRoutedWeight1_B16_B16_B16,0.1%,31.0432,0,0,0,2.43,38913.0,
gfx950,256,4,3072,256,256,8,ActivationType.Silu,torch.bfloat16,torch.bfloat16,torch.bfloat16,QuantType.No,1,0,32,0,23.2045,moe_ck2stages_gemm1_256x32x64x128_1x4_TypeCast_v1_Nswizzle0_Quant0_MulRoutedWeight0_silu_B16_B16_B16,0.0%,16.4508,moe_ck2stages_gemm2_256x32x64x64_1x4_TypeCast_v1_Nswizzle0_Quant0_MulRoutedWeight1_B16_B16_B16,0.0%,39.6553,0,0,0,3.81,30462.73,
gfx950,256,8,3072,256,256,8,ActivationType.Silu,torch.bfloat16,torch.bfloat16,torch.bfloat16,QuantType.No,1,0,32,0,32.6546,moe_ck2stages_gemm1_256x32x64x128_1x4_TypeCast_v1_Nswizzle0_Quant0_MulRoutedWeight0_silu_B16_B16_B16,0.0%,23.3766,moe_ck2stages_gemm2_256x32x64x64_1x4_TypeCast_v1_Nswizzle0_Quant0_MulRoutedWeight1_B16_B16_B16,0.0%,56.0312,0,0,0,5.39,21560.45,
gfx950,256,16,3072,256,256,8,ActivationType.Silu,torch.bfloat16,torch.bfloat16,torch.bfloat16,QuantType.No,1,0,32,0,56.2601,moe_ck2stages_gemm1_256x32x64x128_1x4_TypeCast_v1_Nswizzle0_Quant0_MulRoutedWeight0_silu_B16_B16_B16,0.0%,33.8445,moe_ck2stages_gemm2_256x32x64x64_1x4_TypeCast_v1_Nswizzle0_Quant0_MulRoutedWeight1_B16_B16_B16,0.0%,90.1046,0,0,0,6.7,13408.37,
gfx950,256,32,3072,256,256,8,ActivationType.Silu,torch.bfloat16,torch.bfloat16,torch.bfloat16,QuantType.No,1,0,32,0,87.9109,moe_ck2stages_gemm1_256x32x64x128_1x4_TypeCast_v1_Nswizzle0_Quant0_MulRoutedWeight0_silu_B16_B16_B16,0.0%,47.1799,moe_ck2stages_gemm2_256x32x64x64_1x4_TypeCast_v1_Nswizzle0_Quant0_MulRoutedWeight1_B16_B16_B16,0.0%,135.0908,0,0,0,8.94,8944.75,
gfx950,256,64,3072,256,256,8,ActivationType.Silu,torch.bfloat16,torch.bfloat16,torch.bfloat16,QuantType.No,1,0,32,0,121.5503,moe_ck2stages_gemm1_256x32x64x128_1x4_TypeCast_v1_Nswizzle0_Quant0_MulRoutedWeight0_silu_B16_B16_B16,0.0%,64.4607,moe_ck2stages_gemm2_256x32x64x64_1x4_TypeCast_v1_Nswizzle0_Quant0_MulRoutedWeight1_B16_B16_B16,0.0%,186.011,0,0,0,12.99,6498.25,
gfx950,256,128,3072,256,256,8,ActivationType.Silu,torch.bfloat16,torch.bfloat16,torch.bfloat16,QuantType.No,1,0,32,0,133.9174,moe_ck2stages_gemm1_256x32x64x128_1x4_TypeCast_v1_Nswizzle0_Quant0_MulRoutedWeight0_silu_B16_B16_B16,0.0%,72.8305,moe_ck2stages_gemm2_256x32x64x64_1x4_TypeCast_v1_Nswizzle0_Quant0_MulRoutedWeight1_B16_B16_B16,0.0%,206.7479,0,0,0,23.37,5850.28,
gfx950,256,256,3072,256,256,8,ActivationType.Silu,torch.bfloat16,torch.bfloat16,torch.bfloat16,QuantType.No,1,0,32,0,135.4524,moe_ck2stages_gemm1_256x32x64x128_1x4_TypeCast_v1_Nswizzle0_Quant0_MulRoutedWeight0_silu_B16_B16_B16,0.0%,74.6857,moe_ck2stages_gemm2_256x32x64x64_1x4_TypeCast_v1_Nswizzle0_Quant0_MulRoutedWeight1_B16_B16_B16,0.0%,210.1381,0,0,0,45.99,5763.38,
gfx950,256,512,3072,256,256,8,ActivationType.Silu,torch.bfloat16,torch.bfloat16,torch.bfloat16,QuantType.No,1,0,32,0,137.5051,moe_ck2stages_gemm1_256x32x64x128_1x4_TypeCast_v1_Nswizzle0_Quant0_MulRoutedWeight0_silu_B16_B16_B16,0.0%,78.3645,moe_ck2stages_gemm2_256x32x64x64_1x4_TypeCast_v1_Nswizzle0_Quant0_MulRoutedWeight1_B16_B16_B16,0.0%,215.8696,0,0,0,89.53,5624.93,
gfx950,256,1024,3072,256,256,8,ActivationType.Silu,torch.bfloat16,torch.bfloat16,torch.bfloat16,QuantType.No,1,0,64,0,144.9041,moe_ck2stages_gemm1_256x64x64x128_1x4_TypeCast_v1_Nswizzle0_Quant0_MulRoutedWeight0_silu_B16_B16_B16,0.0%,98.0022,moe_ck2stages_gemm2_256x64x64x64_1x4_TypeCast_v1_Nswizzle0_Quant0_MulRoutedWeight1_B16_B16_B16,0.0%,242.9063,0,0,0,159.13,5024.75,
gfx950,256,2048,3072,256,256,8,ActivationType.Silu,torch.bfloat16,torch.bfloat16,torch.bfloat16,QuantType.No,1,0,128,0,160.8547,moe_ck2stages_gemm1_256x128x64x64_1x4_TypeCast_v1_Nswizzle0_Quant0_MulRoutedWeight0_silu_B16_B16_B16,0.0%,138.4773,moe_ck2stages_gemm2_256x128x64x64_1x4_TypeCast_v3_Nswizzle0_Quant0_MulRoutedWeight1_B16_B16_B16,0.0%,299.332,0,0,0,258.27,4119.59,
gfx950,256,4096,3072,256,256,8,ActivationType.Silu,torch.bfloat16,torch.bfloat16,torch.bfloat16,QuantType.No,1,0,128,0,232.6312,moe_ck2stages_gemm1_256x128x128x64_1x4_TypeCast_v3_Nswizzle0_Quant0_MulRoutedWeight0_silu_B16_B16_B16,0.0%,210.1533,moe_ck2stages_gemm2_256x128x64x64_1x4_TypeCast_v3_Nswizzle0_Quant0_MulRoutedWeight1_B16_B16_B16,0.0%,442.7845,0,0,0,349.2,2841.77,
gfx950,256,8192,3072,256,256,8,ActivationType.Silu,torch.bfloat16,torch.bfloat16,torch.bfloat16,QuantType.No,1,0,128,0,390.991,moe_ck2stages_gemm1_256x128x128x64_1x4_TypeCast_v3_Nswizzle0_Quant0_MulRoutedWeight0_silu_B16_B16_B16,0.0%,359.8827,moe_ck2stages_gemm2_256x128x64x64_1x4_TypeCast_v3_Nswizzle0_Quant0_MulRoutedWeight1_B16_B16_B16,0.0%,750.8737,0,0,0,411.84,1742.8,
gfx950,256,16384,3072,256,256,8,ActivationType.Silu,torch.bfloat16,torch.bfloat16,torch.bfloat16,QuantType.No,1,0,128,0,690.32,moe_ck2stages_gemm1_256x128x128x64_1x4_TypeCast_v3_Nswizzle0_Quant0_MulRoutedWeight0_silu_B16_B16_B16,0.0%,677.135,moe_ck2stages_gemm2_256x128x64x64_1x4_TypeCast_v3_Nswizzle0_Quant0_MulRoutedWeight1_B16_B16_B16,0.0%,1367.455,0,0,0,452.28,1030.59,
gfx950,256,32768,3072,256,256,8,ActivationType.Silu,torch.bfloat16,torch.bfloat16,torch.bfloat16,QuantType.No,1,0,128,0,1080.1525,moe_ck2stages_gemm1_256x128x128x64_1x4_TypeCast_v3_Nswizzle0_Quant0_MulRoutedWeight0_silu_B16_B16_B16,0.0%,1322.2427,moe_ck2stages_gemm2_256x128x64x64_1x4_TypeCast_v3_Nswizzle0_Quant0_MulRoutedWeight1_B16_B16_B16,0.0%,2402.3952,0,0,0,514.88,670.42,
