aiter/configs/model_configs/qwen3_5_397b_bf16_tuned_gemm.csv
gfx,cu_num,M,N,K,bias,dtype,outdtype,scaleAB,bpreshuffle,libtype,solidx,splitK,us,kernelName,err_ratio,tflops,bw
gfx950,256,1,64,4096,False,torch.bfloat16,torch.bfloat16,False,False,skinny,2,0,2.949,sol2,0.0,0.18,180.61
gfx950,256,2,64,4096,False,torch.bfloat16,torch.bfloat16,False,False,skinny,2,0,4.0107,sol2,0.0,0.26,134.87
gfx950,256,4,64,4096,False,torch.bfloat16,torch.bfloat16,False,False,skinny,2,0,4.2997,sol2,0.0,0.49,129.68
gfx950,256,8,64,4096,False,torch.bfloat16,torch.bfloat16,False,False,asm,1,16,4.3978,_ZN5aiter39bf16gemm_fp32bf16_tn_32x64_splitk_cleanE,0.0469,0.95,134.35
gfx950,256,16,64,4096,False,torch.bfloat16,torch.bfloat16,False,False,asm,1,16,4.4487,_ZN5aiter39bf16gemm_fp32bf16_tn_32x64_splitk_cleanE,0.0322,1.89,147.78
gfx950,256,32,64,4096,False,torch.bfloat16,torch.bfloat16,False,False,asm,1,16,4.3421,_ZN5aiter39bf16gemm_fp32bf16_tn_32x64_splitk_cleanE,0.0337,3.86,182.06
gfx950,256,48,64,4096,False,torch.bfloat16,torch.bfloat16,False,False,flydsl,194,8,4.5994,flydsl_hgemm_abf16_wbf16_bf16_t16x64x64x9_ks8_w1x1x2_bias0_ktail0_gm0_pft_gfx950,0.0293,5.47,200.82
gfx950,256,64,64,4096,False,torch.bfloat16,torch.bfloat16,False,False,flydsl,47,8,4.7014,flydsl_hgemm_abf16_wbf16_bf16_t16x64x128x5_ks8_w1x2x1_bias0_ktail0_gm0_pft_gfx950,0.0195,7.14,224.78
gfx950,256,96,64,4096,False,torch.bfloat16,torch.bfloat16,False,False,flydsl,46,8,4.6425,flydsl_hgemm_abf16_wbf16_bf16_t16x64x128x5_ks8_w1x1x2_bias0_ktail0_gm0_pft_gfx950,0.0265,10.84,284.98
gfx950,256,128,64,4096,False,torch.bfloat16,torch.bfloat16,False,False,flydsl,535,8,4.9521,flydsl_hgemm_abf16_wbf16_bf16_t32x64x128x4_ks8_w1x2x2_bias0_ktail0_gm0_pft_gfx950,0.0275,13.55,320.92
gfx950,256,192,64,4096,False,torch.bfloat16,torch.bfloat16,False,False,flydsl,627,8,4.976,flydsl_hgemm_abf16_wbf16_bf16_t32x64x64x8_ks8_w1x2x2_bias0_ktail0_gm0_pft_gfx950,0.0271,20.23,426.39
gfx950,256,256,64,4096,False,torch.bfloat16,torch.bfloat16,False,False,flydsl,931,8,5.408,flydsl_hgemm_abf16_wbf16_bf16_t32x64x64x8_ks8_w1x2x2_bias0_ktail0_gm0_pft_gfx950,0.026,24.82,490.79
gfx950,256,384,64,4096,False,torch.bfloat16,torch.bfloat16,False,False,flydsl,1584,8,6.3395,flydsl_hgemm_abf16_wbf16_bf16_t32x64x64x5_ks8_w1x4x1_bias0_ktail0_gm0_pft_gfx950,0.0193,31.76,586.67
gfx950,256,512,64,4096,False,torch.bfloat16,torch.bfloat16,False,False,flydsl,836,8,6.8498,flydsl_hgemm_abf16_wbf16_bf16_t16x64x64x6_ks8_w1x1x2_bias0_ktail0_gm0_pft_gfx950,0.0261,39.19,698.43
gfx950,256,768,64,4096,False,torch.bfloat16,torch.bfloat16,False,False,flydsl,832,4,7.4589,flydsl_hgemm_abf16_wbf16_bf16_t16x64x64x6_ks4_w1x2x1_bias0_ktail0_gm0_pft_gfx950,0.0115,53.98,926.95
gfx950,256,1024,64,4096,False,torch.bfloat16,torch.bfloat16,False,False,flydsl,1760,4,8.2675,flydsl_hgemm_abf16_wbf16_bf16_t32x64x64x6_ks4_w1x4x1_bias0_ktail0_gm0_pft_gfx950,0.0114,64.94,1093.92
gfx950,256,2048,64,4096,False,torch.bfloat16,torch.bfloat16,False,False,flydsl,2787,8,10.2646,flydsl_hgemm_abf16_wbf16_bf16_t64x64x256x2_ks8_w2x2x1_bias0_ktail0_gm0_pht_gfx950,0.0195,104.61,1711.09
gfx950,256,4096,64,4096,False,torch.bfloat16,torch.bfloat16,False,False,flydsl,2757,4,12.769,flydsl_hgemm_abf16_wbf16_bf16_t64x64x256x2_ks4_w2x2x1_bias0_ktail0_gm0_pht_gfx950,0.0116,168.18,2709.92
gfx950,256,8192,64,4096,False,torch.bfloat16,torch.bfloat16,False,False,flydsl,881,1,17.9025,flydsl_hgemm_abf16_wbf16_bf16_t32x64x128x4_ks1_w2x2x1_bias0_ktail0_gm4_pft_gfx950,0.0,239.91,3836.43
gfx950,256,1,256,4096,False,torch.bfloat16,torch.bfloat16,False,False,skinny,2,0,3.1066,sol2,0.0,0.68,677.87
gfx950,256,2,256,4096,False,torch.bfloat16,torch.bfloat16,False,False,skinny,2,0,4.2173,sol2,0.0,0.99,501.4
gfx950,256,4,256,4096,False,torch.bfloat16,torch.bfloat16,False,False,skinny,2,0,4.4556,sol2,0.0,1.88,478.49
gfx950,256,8,256,4096,False,torch.bfloat16,torch.bfloat16,False,False,flydsl,274,8,4.4578,flydsl_hgemm_abf16_wbf16_bf16_t16x64x64x9_ks8_w1x1x2_bias0_ktail0_gm0_pft_gfx950,0.022,3.76,486.07
gfx950,256,16,256,4096,False,torch.bfloat16,torch.bfloat16,False,False,flydsl,242,8,4.6366,flydsl_hgemm_abf16_wbf16_bf16_t16x64x64x6_ks8_w1x1x2_bias0_ktail0_gm0_pft_gfx950,0.0264,7.24,482.34
gfx950,256,32,256,4096,False,torch.bfloat16,torch.bfloat16,False,False,flydsl,896,8,4.7442,flydsl_hgemm_abf16_wbf16_bf16_t32x64x64x6_ks8_w1x4x1_bias0_ktail0_gm0_pft_gfx950,0.021,14.15,500.75
gfx950,256,48,256,4096,False,torch.bfloat16,torch.bfloat16,False,False,flydsl,242,8,5.2059,flydsl_hgemm_abf16_wbf16_bf16_t16x64x64x6_ks8_w1x1x2_bias0_ktail0_gm0_pft_gfx950,0.0269,19.34,483.09
gfx950,256,64,256,4096,False,torch.bfloat16,torch.bfloat16,False,False,flydsl,928,8,5.4819,flydsl_hgemm_abf16_wbf16_bf16_t32x64x64x7_ks8_w1x4x1_bias0_ktail0_gm0_pft_gfx950,0.0194,24.48,484.18
gfx950,256,96,256,4096,False,torch.bfloat16,torch.bfloat16,False,False,flydsl,736,8,6.019,flydsl_hgemm_abf16_wbf16_bf16_t32x64x256x3_ks8_w1x4x1_bias0_ktail0_gm0_pft_gfx950,0.0185,33.45,487.25
gfx950,256,128,256,4096,False,torch.bfloat16,torch.bfloat16,False,False,flydsl,551,4,6.5722,flydsl_hgemm_abf16_wbf16_bf16_t16x64x128x4_ks4_w1x1x2_bias0_ktail0_gm0_pft_gfx950,0.0194,40.84,488.61
gfx950,256,192,256,4096,False,torch.bfloat16,torch.bfloat16,False,False,flydsl,111,4,7.1247,flydsl_hgemm_abf16_wbf16_bf16_t16x64x128x4_ks4_w1x1x2_bias0_ktail0_gm0_pft_gfx950,0.0189,56.52,528.91
gfx950,256,256,256,4096,False,torch.bfloat16,torch.bfloat16,False,False,flydsl,535,4,7.7603,flydsl_hgemm_abf16_wbf16_bf16_t16x64x128x5_ks4_w1x1x2_bias0_ktail0_gm0_pft_gfx950,0.0186,69.18,557.37
gfx950,256,384,256,4096,False,torch.bfloat16,torch.bfloat16,False,False,flydsl,2104,4,8.8031,flydsl_hgemm_abf16_wbf16_bf16_t32x64x128x4_ks4_w1x4x1_bias0_ktail0_gm0_pft_gfx950,0.0116,91.48,617.91
gfx950,256,512,256,4096,False,torch.bfloat16,torch.bfloat16,False,False,torch,0,0,9.3509,native,0.0,114.83,700.85
gfx950,256,768,256,4096,False,torch.bfloat16,torch.bfloat16,False,False,flydsl,4637,4,11.2447,flydsl_hgemm_abf16_wbf16_bf16_t64x64x256x2_ks4_w2x2x1_bias0_ktail0_gm0_pht_gfx950,0.0116,143.23,780.97
gfx950,256,1024,256,4096,False,torch.bfloat16,torch.bfloat16,False,False,asm,7,4,12.5229,_ZN5aiter39bf16gemm_fp32bf16_tn_80x64_splitk_cleanE,0.0117,171.48,879.19
gfx950,256,2048,256,4096,False,torch.bfloat16,torch.bfloat16,False,False,flydsl,1995,1,14.5828,flydsl_hgemm_abf16_wbf16_bf16_t32x64x128x4_ks1_w1x4x1_bias0_ktail0_gm4_pft_gfx950,0.0,294.52,1366.19
gfx950,256,4096,256,4096,False,torch.bfloat16,torch.bfloat16,False,False,flydsl,3165,1,19.5508,flydsl_hgemm_abf16_wbf16_bf16_t64x64x128x5_ks1_w4x1x2_bias0_ktail0_gm4_pft_gfx950,0.0048,439.36,1930.8
gfx950,256,8192,256,4096,False,torch.bfloat16,torch.bfloat16,False,False,flydsl,1851,1,29.7589,flydsl_hgemm_abf16_wbf16_bf16_t64x128x128x3_ks1_w2x2x2_bias0_ktail0_gm4_pft_gfx950,0.0049,577.3,2466.5
gfx950,256,1,512,4096,False,torch.bfloat16,torch.bfloat16,False,False,skinny,2,0,4.9178,sol2,0.0,0.85,854.76
gfx950,256,2,512,4096,False,torch.bfloat16,torch.bfloat16,False,False,flydsl,267,8,5.2548,flydsl_hgemm_abf16_wbf16_bf16_t16x64x64x8_ks8_w1x2x1_bias0_ktail0_gm0_pft_gfx950,0.0205,1.6,801.69
gfx950,256,4,512,4096,False,torch.bfloat16,torch.bfloat16,False,False,flydsl,115,8,5.7098,flydsl_hgemm_abf16_wbf16_bf16_t16x64x128x4_ks8_w1x2x1_bias0_ktail0_gm0_pft_gfx950,0.021,2.94,741.04
gfx950,256,8,512,4096,False,torch.bfloat16,torch.bfloat16,False,False,flydsl,243,8,5.6274,flydsl_hgemm_abf16_wbf16_bf16_t16x64x64x6_ks8_w1x2x1_bias0_ktail0_gm0_pft_gfx950,0.021,5.96,758.44
gfx950,256,16,512,4096,False,torch.bfloat16,torch.bfloat16,False,False,flydsl,275,8,5.5365,flydsl_hgemm_abf16_wbf16_bf16_t16x64x64x9_ks8_w1x2x1_bias0_ktail0_gm0_pft_gfx950,0.0184,12.12,784.21
gfx950,256,32,512,4096,False,torch.bfloat16,torch.bfloat16,False,False,flydsl,864,8,5.8815,flydsl_hgemm_abf16_wbf16_bf16_t32x64x64x5_ks8_w1x4x1_bias0_ktail0_gm0_pft_gfx950,0.0201,22.82,763.28
gfx950,256,48,512,4096,False,torch.bfloat16,torch.bfloat16,False,False,flydsl,127,8,6.4291,flydsl_hgemm_abf16_wbf16_bf16_t16x64x128x5_ks8_w1x2x1_bias0_ktail0_gm0_pft_gfx950,0.0195,31.31,721.2
gfx950,256,64,512,4096,False,torch.bfloat16,torch.bfloat16,False,False,flydsl,899,8,6.8484,flydsl_hgemm_abf16_wbf16_bf16_t32x64x64x6_ks8_w2x2x1_bias0_ktail0_gm0_pft_gfx950,0.0194,39.2,698.58
gfx950,256,96,512,4096,False,torch.bfloat16,torch.bfloat16,False,False,flydsl,171,4,7.3435,flydsl_hgemm_abf16_wbf16_bf16_t16x64x256x3_ks4_w1x1x2_bias0_ktail0_gm0_pft_gfx950,0.0196,54.83,691.64
gfx950,256,128,512,4096,False,torch.bfloat16,torch.bfloat16,False,False,flydsl,1048,4,7.9655,flydsl_hgemm_abf16_wbf16_bf16_t32x64x128x4_ks4_w1x4x1_bias0_ktail0_gm0_pft_gfx950,0.0118,67.4,674.65
gfx950,256,192,512,4096,False,torch.bfloat16,torch.bfloat16,False,False,flydsl,607,4,8.9289,flydsl_hgemm_abf16_wbf16_bf16_t32x64x128x4_ks4_w1x2x2_bias0_ktail0_gm0_pft_gfx950,0.0196,90.19,667.92
gfx950,256,256,512,4096,False,torch.bfloat16,torch.bfloat16,False,False,torch,0,0,9.7479,native,0.0,110.15,672.31
gfx950,256,384,512,4096,False,torch.bfloat16,torch.bfloat16,False,False,flydsl,4421,4,11.2415,flydsl_hgemm_abf16_wbf16_bf16_t64x64x256x2_ks4_w2x2x1_bias0_ktail0_gm0_pht_gfx950,0.0116,143.27,687.92
gfx950,256,512,512,4096,False,torch.bfloat16,torch.bfloat16,False,False,asm,8,5,12.4969,_ZN5aiter39bf16gemm_fp32bf16_tn_96x64_splitk_cleanE,0.0142,171.84,713.21
gfx950,256,768,512,4096,False,torch.bfloat16,torch.bfloat16,False,False,asm,7,3,14.222,_ZN5aiter39bf16gemm_fp32bf16_tn_80x64_splitk_cleanE,0.0088,226.5,792.59
gfx950,256,1024,512,4096,False,torch.bfloat16,torch.bfloat16,False,False,flydsl,1995,1,14.61,flydsl_hgemm_abf16_wbf16_bf16_t32x64x128x4_ks1_w1x4x1_bias0_ktail0_gm4_pft_gfx950,0.0,293.97,933.02
gfx950,256,2048,512,4096,False,torch.bfloat16,torch.bfloat16,False,False,flydsl,3051,1,19.3667,flydsl_hgemm_abf16_wbf16_bf16_t64x64x128x4_ks1_w2x1x2_bias0_ktail0_gm4_pft_gfx950,0.0049,443.54,1191.15
gfx950,256,4096,512,4096,False,torch.bfloat16,torch.bfloat16,False,False,flydsl,1851,1,28.1173,flydsl_hgemm_abf16_wbf16_bf16_t64x128x128x3_ks1_w2x2x2_bias0_ktail0_gm4_pft_gfx950,0.0048,611.01,1491.72
gfx950,256,8192,512,4096,False,torch.bfloat16,torch.bfloat16,False,False,flydsl,203,1,44.0159,flydsl_hgemm_abf16_wbf16_bf16_t128x128x64x4_ks1_w2x2x2_bias0_ktail0_gm4_pft_gfx950,0.0048,780.62,1810.52
gfx950,256,1,1024,4096,False,torch.bfloat16,torch.bfloat16,False,False,flydsl,267,8,6.0359,flydsl_hgemm_abf16_wbf16_bf16_t16x64x64x8_ks8_w1x2x1_bias0_ktail0_gm0_pft_gfx950,0.0225,1.39,1391.48
gfx950,256,2,1024,4096,False,torch.bfloat16,torch.bfloat16,False,False,flydsl,255,8,6.1135,flydsl_hgemm_abf16_wbf16_bf16_t16x64x64x7_ks8_w1x2x1_bias0_ktail0_gm0_pft_gfx950,0.019,2.74,1375.49
gfx950,256,4,1024,4096,False,torch.bfloat16,torch.bfloat16,False,False,flydsl,115,8,6.1415,flydsl_hgemm_abf16_wbf16_bf16_t16x64x128x4_ks8_w1x2x1_bias0_ktail0_gm0_pft_gfx950,0.0198,5.46,1372.56
gfx950,256,8,1024,4096,False,torch.bfloat16,torch.bfloat16,False,False,flydsl,267,8,6.1887,flydsl_hgemm_abf16_wbf16_bf16_t16x64x64x8_ks8_w1x2x1_bias0_ktail0_gm0_pft_gfx950,0.0173,10.84,1368.71
gfx950,256,16,1024,4096,False,torch.bfloat16,torch.bfloat16,False,False,flydsl,267,8,6.4919,flydsl_hgemm_abf16_wbf16_bf16_t16x64x64x8_ks8_w1x2x1_bias0_ktail0_gm0_pft_gfx950,0.0192,20.67,1317.4
gfx950,256,32,1024,4096,False,torch.bfloat16,torch.bfloat16,False,False,flydsl,896,8,7.0019,flydsl_hgemm_abf16_wbf16_bf16_t32x64x64x6_ks8_w1x4x1_bias0_ktail0_gm0_pft_gfx950,0.0194,38.34,1244.85
gfx950,256,48,1024,4096,False,torch.bfloat16,torch.bfloat16,False,False,flydsl,252,4,7.3831,flydsl_hgemm_abf16_wbf16_bf16_t16x64x64x7_ks4_w1x2x1_bias0_ktail0_gm0_pft_gfx950,0.0116,54.54,1202.76
gfx950,256,64,1024,4096,False,torch.bfloat16,torch.bfloat16,False,False,flydsl,132,4,7.9811,flydsl_hgemm_abf16_wbf16_bf16_t16x64x128x6_ks4_w1x1x2_bias0_ktail0_gm0_pft_gfx950,0.0198,67.27,1133.17
gfx950,256,96,1024,4096,False,torch.bfloat16,torch.bfloat16,False,False,flydsl,608,4,8.9711,flydsl_hgemm_abf16_wbf16_bf16_t32x64x128x4_ks4_w1x4x1_bias0_ktail0_gm0_pft_gfx950,0.012,89.77,1044.65
gfx950,256,128,1024,4096,False,torch.bfloat16,torch.bfloat16,False,False,flydsl,1048,4,10.0871,flydsl_hgemm_abf16_wbf16_bf16_t32x64x128x4_ks4_w1x4x1_bias0_ktail0_gm0_pft_gfx950,0.0117,106.45,961.56
gfx950,256,192,1024,4096,False,torch.bfloat16,torch.bfloat16,False,False,flydsl,632,2,11.529,flydsl_hgemm_abf16_wbf16_bf16_t32x64x128x5_ks2_w2x1x2_bias0_ktail0_gm0_pft_gfx950,0.0122,139.7,898.14
gfx950,256,256,1024,4096,False,torch.bfloat16,torch.bfloat16,False,False,asm,5,4,12.355,_ZN5aiter39bf16gemm_fp32bf16_tn_64x64_splitk_cleanE,0.0116,173.81,891.14
gfx950,256,384,1024,4096,False,torch.bfloat16,torch.bfloat16,False,False,asm,8,4,13.9296,_ZN5aiter39bf16gemm_fp32bf16_tn_96x64_splitk_cleanE,0.0117,231.25,884.5
gfx950,256,512,1024,4096,False,torch.bfloat16,torch.bfloat16,False,False,flydsl,2167,1,14.571,flydsl_hgemm_abf16_wbf16_bf16_t32x64x128x6_ks1_w1x2x2_bias0_ktail0_gm4_pft_gfx950,0.0051,294.76,935.52
gfx950,256,768,1024,4096,False,torch.bfloat16,torch.bfloat16,False,False,torch,0,0,17.8811,native,0.0,360.29,908.94
gfx950,256,1024,1024,4096,False,torch.bfloat16,torch.bfloat16,False,False,flydsl,3241,1,19.0742,flydsl_hgemm_abf16_wbf16_bf16_t64x64x128x5_ks1_w2x2x2_bias0_ktail0_gm4_pft_gfx950,0.005,450.34,989.52
gfx950,256,2048,1024,4096,False,torch.bfloat16,torch.bfloat16,False,False,flydsl,1929,1,28.1381,flydsl_hgemm_abf16_wbf16_bf16_t64x128x128x3_ks1_w1x4x2_bias0_ktail0_gm4_pft_gfx950,0.0049,610.56,1043.43
gfx950,256,4096,1024,4096,False,torch.bfloat16,torch.bfloat16,False,False,flydsl,9,1,42.5835,flydsl_hgemm_abf16_wbf16_bf16_t128x128x128x2_ks1_w2x4x1_bias0_ktail0_gm4_pht_gfx950,0.0,806.88,1181.95
gfx950,256,8192,1024,4096,False,torch.bfloat16,torch.bfloat16,False,False,triton,0,0,67.2542,auto,0.0,1021.79,1372.03
gfx950,256,1,4096,512,False,torch.bfloat16,torch.bfloat16,False,False,flydsl,196,1,4.1823,flydsl_hgemm_abf16_wbf16_bf16_t16x64x64x7_ks1_w1x2x1_bias0_ktail0_gm0_pft_gfx950,0.0,1.0,1005.07
gfx950,256,1,4096,4096,False,torch.bfloat16,torch.bfloat16,False,False,flydsl,273,4,8.5939,flydsl_hgemm_abf16_wbf16_bf16_t16x64x64x9_ks4_w1x2x1_bias0_ktail0_gm0_pft_gfx950,0.0132,3.9,3906.35
gfx950,256,1,4096,8192,False,torch.bfloat16,torch.bfloat16,False,False,flydsl,21,8,14.3387,flydsl_hgemm_abf16_wbf16_bf16_t16x128x128x3_ks8_w1x2x1_bias0_ktail0_gm0_pft_gfx950,0.0178,4.68,4681.98
gfx950,256,2,4096,512,False,torch.bfloat16,torch.bfloat16,False,False,triton,0,0,3.999,auto,0.0,2.1,1053.45
gfx950,256,2,4096,4096,False,torch.bfloat16,torch.bfloat16,False,False,flydsl,112,4,8.6926,flydsl_hgemm_abf16_wbf16_bf16_t16x64x128x4_ks4_w1x2x1_bias0_ktail0_gm0_pft_gfx950,0.0116,7.72,3863.88
gfx950,256,2,4096,8192,False,torch.bfloat16,torch.bfloat16,False,False,flydsl,23,8,14.0678,flydsl_hgemm_abf16_wbf16_bf16_t16x128x128x3_ks8_w1x4x1_bias0_ktail0_gm0_pft_gfx950,0.0192,9.54,4773.88
gfx950,256,4,4096,512,False,torch.bfloat16,torch.bfloat16,False,False,flydsl,208,1,4.1901,flydsl_hgemm_abf16_wbf16_bf16_t16x64x64x8_ks1_w1x2x1_bias0_ktail0_gm0_pft_gfx950,0.0,4.0,1009.8
gfx950,256,4,4096,4096,False,torch.bfloat16,torch.bfloat16,False,False,flydsl,123,4,8.8137,flydsl_hgemm_abf16_wbf16_bf16_t16x64x128x5_ks4_w1x1x2_bias0_ktail0_gm0_pft_gfx950,0.0218,15.23,3814.51
gfx950,256,4,4096,8192,False,torch.bfloat16,torch.bfloat16,False,False,flydsl,35,8,14.5252,flydsl_hgemm_abf16_wbf16_bf16_t16x128x128x4_ks8_w1x4x1_bias0_ktail0_gm0_pft_gfx950,0.0208,18.48,4626.94
gfx950,256,8,4096,512,False,torch.bfloat16,torch.bfloat16,False,False,flydsl,208,1,4.2599,flydsl_hgemm_abf16_wbf16_bf16_t16x64x64x8_ks1_w1x2x1_bias0_ktail0_gm0_pft_gfx950,0.0,7.88,1001.91
gfx950,256,8,4096,4096,False,torch.bfloat16,torch.bfloat16,False,False,flydsl,124,4,9.0318,flydsl_hgemm_abf16_wbf16_bf16_t16x64x128x5_ks4_w1x2x1_bias0_ktail0_gm0_pft_gfx950,0.0118,29.72,3729.66
gfx950,256,8,4096,8192,False,torch.bfloat16,torch.bfloat16,False,False,flydsl,34,8,14.8167,flydsl_hgemm_abf16_wbf16_bf16_t16x128x128x4_ks8_w1x2x2_bias0_ktail0_gm0_pft_gfx950,0.0273,36.23,4542.54
gfx950,256,16,4096,512,False,torch.bfloat16,torch.bfloat16,False,False,triton,0,0,4.2574,auto,0.0,15.76,1019.81
gfx950,256,16,4096,4096,False,torch.bfloat16,torch.bfloat16,False,False,flydsl,264,4,9.6152,flydsl_hgemm_abf16_wbf16_bf16_t16x64x64x8_ks4_w1x2x1_bias0_ktail0_gm0_pft_gfx950,0.0123,55.84,3516.99
gfx950,256,16,4096,8192,False,torch.bfloat16,torch.bfloat16,False,False,flydsl,59,8,15.3346,flydsl_hgemm_abf16_wbf16_bf16_t16x128x64x4_ks8_w1x2x1_bias0_ktail0_gm0_pft_gfx950,0.0216,70.02,4401.95
gfx950,256,32,4096,512,False,torch.bfloat16,torch.bfloat16,False,False,triton,0,0,3.4598,auto,0.0,38.79,1297.54
gfx950,256,32,4096,4096,False,torch.bfloat16,torch.bfloat16,False,False,flydsl,271,2,11.3325,flydsl_hgemm_abf16_wbf16_bf16_t16x64x64x9_ks2_w1x2x1_bias0_ktail0_gm0_pft_gfx950,0.0049,94.75,3007.17
gfx950,256,32,4096,8192,False,torch.bfloat16,torch.bfloat16,False,False,flydsl,725,4,18.0555,flydsl_hgemm_abf16_wbf16_bf16_t32x64x256x3_ks4_w1x1x2_bias0_ktail0_gm0_pft_gfx950,0.022,118.94,3760.37
gfx950,256,48,4096,512,False,torch.bfloat16,torch.bfloat16,False,False,flydsl,184,1,4.4023,flydsl_hgemm_abf16_wbf16_bf16_t16x64x64x6_ks1_w1x2x1_bias0_ktail0_gm0_pft_gfx950,0.0,45.73,1053.24
gfx950,256,48,4096,4096,False,torch.bfloat16,torch.bfloat16,False,False,asm,3,4,13.2155,_ZN5aiter39bf16gemm_fp32bf16_tn_48x64_splitk_cleanE,0.0118,121.87,2598.53
gfx950,256,48,4096,8192,False,torch.bfloat16,torch.bfloat16,False,False,asm,3,4,20.8265,_ZN5aiter39bf16gemm_fp32bf16_tn_48x64_splitk_cleanE,0.0138,154.67,3278.92
gfx950,256,64,4096,512,False,torch.bfloat16,torch.bfloat16,False,False,flydsl,196,1,4.3949,flydsl_hgemm_abf16_wbf16_bf16_t16x64x64x7_ks1_w1x2x1_bias0_ktail0_gm0_pft_gfx950,0.0,61.08,1088.56
gfx950,256,64,4096,4096,False,torch.bfloat16,torch.bfloat16,False,False,asm,5,4,13.4918,_ZN5aiter39bf16gemm_fp32bf16_tn_64x64_splitk_cleanE,0.0118,159.17,2564.74
gfx950,256,64,4096,8192,False,torch.bfloat16,torch.bfloat16,False,False,flydsl,720,2,20.0663,flydsl_hgemm_abf16_wbf16_bf16_t32x64x256x3_ks2_w1x4x1_bias0_ktail0_gm0_pft_gfx950,0.0061,214.04,3422.74
gfx950,256,96,4096,512,False,torch.bfloat16,torch.bfloat16,False,False,flydsl,633,1,4.6932,flydsl_hgemm_abf16_wbf16_bf16_t32x64x64x7_ks1_w1x4x1_bias0_ktail0_gm0_pft_gfx950,0.0,85.8,1082.21
gfx950,256,96,4096,4096,False,torch.bfloat16,torch.bfloat16,False,False,asm,8,4,14.9277,_ZN5aiter39bf16gemm_fp32bf16_tn_96x64_splitk_cleanE,0.0116,215.79,2353.16
gfx950,256,96,4096,8192,False,torch.bfloat16,torch.bfloat16,False,False,torch,0,0,23.0252,native,0.0,279.8,3017.05
gfx950,256,128,4096,512,False,torch.bfloat16,torch.bfloat16,False,False,flydsl,980,1,4.6766,flydsl_hgemm_abf16_wbf16_bf16_t32x64x64x5_ks1_w2x2x1_bias0_ktail0_gm0_pft_gfx950,0.0,114.8,1149.12
gfx950,256,128,4096,4096,False,torch.bfloat16,torch.bfloat16,False,False,flydsl,887,1,15.5855,flydsl_hgemm_abf16_wbf16_bf16_t32x64x128x4_ks1_w2x1x2_bias0_ktail0_gm0_pft_gfx950,0.0049,275.57,2287.48
gfx950,256,128,4096,8192,False,torch.bfloat16,torch.bfloat16,False,False,flydsl,1962,2,26.376,flydsl_hgemm_abf16_wbf16_bf16_t64x64x128x4_ks2_w2x2x2_bias0_ktail0_gm0_pft_gfx950,0.0145,325.67,2663.58
gfx950,256,192,4096,512,False,torch.bfloat16,torch.bfloat16,False,False,flydsl,1221,1,5.5187,flydsl_hgemm_abf16_wbf16_bf16_t64x64x64x5_ks1_w2x2x1_bias0_ktail0_gm0_pft_gfx950,0.0,145.92,1080.65
gfx950,256,192,4096,4096,False,torch.bfloat16,torch.bfloat16,False,False,torch,0,0,19.0695,native,0.0,337.84,1924.55
gfx950,256,192,4096,8192,False,torch.bfloat16,torch.bfloat16,False,False,torch,0,0,32.1422,native,0.0,400.87,2234.68
gfx950,256,256,4096,512,False,torch.bfloat16,torch.bfloat16,False,False,flydsl,1597,1,5.5715,flydsl_hgemm_abf16_wbf16_bf16_t64x64x64x6_ks1_w2x4x1_bias0_ktail0_gm0_pft_gfx950,0.0,192.72,1176.27
gfx950,256,256,4096,4096,False,torch.bfloat16,torch.bfloat16,False,False,flydsl,1449,1,19.9386,flydsl_hgemm_abf16_wbf16_bf16_t64x64x128x5_ks1_w2x2x2_bias0_ktail0_gm0_pft_gfx950,0.0049,430.82,1893.25
gfx950,256,256,4096,8192,False,torch.bfloat16,torch.bfloat16,False,False,torch,0,0,35.3487,native,0.0,486.01,2076.46
gfx950,256,384,4096,512,False,torch.bfloat16,torch.bfloat16,False,False,flydsl,2674,1,6.4579,flydsl_hgemm_abf16_wbf16_bf16_t96x64x128x3_ks1_w2x2x1_bias0_ktail0_gm0_pft_gfx950,0.0,249.4,1197.49
gfx950,256,384,4096,4096,False,torch.bfloat16,torch.bfloat16,False,False,flydsl,2836,1,24.0907,flydsl_hgemm_abf16_wbf16_bf16_t96x64x128x3_ks1_w2x1x2_bias0_ktail0_gm0_pft_gfx950,0.0049,534.85,1653.99
gfx950,256,384,4096,8192,False,torch.bfloat16,torch.bfloat16,False,False,flydsl,2837,1,45.5572,flydsl_hgemm_abf16_wbf16_bf16_t96x64x128x3_ks1_w2x1x2_bias0_ktail0_gm4_pft_gfx950,0.0062,565.66,1680.22
gfx950,256,512,4096,512,False,torch.bfloat16,torch.bfloat16,False,False,flydsl,640,1,7.2247,flydsl_hgemm_abf16_wbf16_bf16_t128x64x64x4_ks1_w2x4x1_bias0_ktail0_gm0_pft_gfx950,0.0,297.24,1233.67
gfx950,256,512,4096,4096,False,torch.bfloat16,torch.bfloat16,False,False,flydsl,1932,1,27.6581,flydsl_hgemm_abf16_wbf16_bf16_t64x128x128x3_ks1_w2x2x2_bias0_ktail0_gm0_pft_gfx950,0.0049,621.15,1516.48
gfx950,256,512,4096,8192,False,torch.bfloat16,torch.bfloat16,False,False,flydsl,25,2,50.3867,flydsl_hgemm_abf16_wbf16_bf16_t128x128x128x2_ks2_w2x4x1_bias0_ktail0_gm0_pht_gfx950,0.0062,681.92,1581.6
gfx950,256,768,4096,512,False,torch.bfloat16,torch.bfloat16,False,False,flydsl,2054,1,8.614,flydsl_hgemm_abf16_wbf16_bf16_t96x64x128x2_ks1_w2x2x1_bias0_ktail0_gm0_pft_gfx950,0.0,373.95,1308.59
gfx950,256,768,4096,4096,False,torch.bfloat16,torch.bfloat16,False,False,flydsl,2095,1,40.0507,flydsl_hgemm_abf16_wbf16_bf16_t96x128x64x5_ks1_w2x2x1_bias0_ktail0_gm4_pft_gfx950,0.0,643.43,1151.97
gfx950,256,768,4096,8192,False,torch.bfloat16,torch.bfloat16,False,False,flydsl,7,1,71.0366,flydsl_hgemm_abf16_wbf16_bf16_t128x128x128x2_ks1_w2x4x1_bias0_ktail0_gm0_pht_gfx950,0.0,725.54,1210.41
gfx950,256,1024,4096,4096,False,torch.bfloat16,torch.bfloat16,False,False,flydsl,9,1,42.9139,flydsl_hgemm_abf16_wbf16_bf16_t128x128x128x2_ks1_w2x4x1_bias0_ktail0_gm4_pht_gfx950,0.0,800.67,1172.85
gfx950,256,1024,4096,8192,False,torch.bfloat16,torch.bfloat16,False,False,flydsl,7,1,78.1004,flydsl_hgemm_abf16_wbf16_bf16_t128x128x128x2_ks1_w2x4x1_bias0_ktail0_gm0_pht_gfx950,0.0,879.89,1181.49
gfx950,256,2048,4096,512,False,torch.bfloat16,torch.bfloat16,False,False,torch,0,0,14.6374,native,0.0,586.85,1576.01
gfx950,256,2048,4096,4096,False,torch.bfloat16,torch.bfloat16,False,False,flydsl,464,1,70.5382,flydsl_hgemm_abf16_wbf16_bf16_t256x128x64x3_ks1_w4x2x2_bias0_ktail0_gm0_pft_gfx950,0.0049,974.22,951.38
gfx950,256,2048,4096,8192,False,torch.bfloat16,torch.bfloat16,False,False,flydsl,120,1,127.5001,flydsl_hgemm_abf16_wbf16_bf16_t128x256x64x3_ks1_w2x4x2_bias0_ktail0_gm0_pft_gfx950,0.0063,1077.95,921.1
gfx950,256,4096,4096,4096,False,torch.bfloat16,torch.bfloat16,False,False,flydsl,19,1,105.1134,flydsl_hgemm_abf16_wbf16_bf16_t256x256x64x2_ks1_w2x4x1_bias0_ktail0_gm4_pht_gfx950,0.0,1307.53,957.66
gfx950,256,4096,4096,8192,False,torch.bfloat16,torch.bfloat16,False,False,flydsl,19,1,190.7761,flydsl_hgemm_abf16_wbf16_bf16_t256x256x64x2_ks1_w2x4x1_bias0_ktail0_gm4_pht_gfx950,0.0,1440.84,879.42
gfx950,256,8192,4096,512,False,torch.bfloat16,torch.bfloat16,False,False,torch,0,0,40.4275,native,0.0,849.91,1971.23
gfx950,256,8192,4096,4096,False,torch.bfloat16,torch.bfloat16,False,False,torch,0,0,191.3663,native,0.0,1436.4,876.71
gfx950,256,8192,4096,8192,False,torch.bfloat16,torch.bfloat16,False,False,torch,0,0,363.8461,native,0.0,1510.96,737.77
gfx950,256,1,8192,4096,False,torch.bfloat16,torch.bfloat16,False,False,triton,0,0,13.2183,auto,0.0,5.08,5078.83
gfx950,256,2,8192,4096,False,torch.bfloat16,torch.bfloat16,False,False,triton,0,0,13.3011,auto,0.0,10.09,5049.06
gfx950,256,4,8192,4096,False,torch.bfloat16,torch.bfloat16,False,False,triton,0,0,13.2622,auto,0.0,20.24,5067.57
gfx950,256,8,8192,4096,False,torch.bfloat16,torch.bfloat16,False,False,triton,0,0,13.2758,auto,0.0,40.44,5069.79
gfx950,256,16,8192,4096,False,torch.bfloat16,torch.bfloat16,False,False,triton,0,0,12.9909,auto,0.0,82.65,5196.1
gfx950,256,32,8192,4096,False,torch.bfloat16,torch.bfloat16,False,False,triton,0,0,13.4043,auto,0.0,160.21,5065.19
gfx950,256,48,8192,4096,False,torch.bfloat16,torch.bfloat16,False,False,triton,0,0,17.3234,auto,0.0,185.95,3941.98
gfx950,256,64,8192,4096,False,torch.bfloat16,torch.bfloat16,False,False,triton,0,0,17.8841,auto,0.0,240.16,3840.38
gfx950,256,96,8192,4096,False,torch.bfloat16,torch.bfloat16,False,False,flydsl,537,1,21.4311,flydsl_hgemm_abf16_wbf16_bf16_t48x64x128x5_ks1_w1x1x2_bias0_ktail0_gm0_pft_gfx950,0.0049,300.61,3241.46
gfx950,256,128,8192,4096,False,torch.bfloat16,torch.bfloat16,False,False,torch,0,0,22.0818,native,0.0,389.01,3181.56
gfx950,256,192,8192,4096,False,torch.bfloat16,torch.bfloat16,False,False,flydsl,919,1,26.2503,flydsl_hgemm_abf16_wbf16_bf16_t96x64x128x3_ks1_w2x1x2_bias0_ktail0_gm0_pft_gfx950,0.0049,490.85,2736.25
gfx950,256,256,8192,4096,False,torch.bfloat16,torch.bfloat16,False,False,flydsl,849,1,29.6504,flydsl_hgemm_abf16_wbf16_bf16_t64x128x128x3_ks1_w1x4x2_bias0_ktail0_gm0_pft_gfx950,0.0049,579.41,2475.53
gfx950,256,384,8192,4096,False,torch.bfloat16,torch.bfloat16,False,False,flydsl,1878,1,39.6067,flydsl_hgemm_abf16_wbf16_bf16_t96x128x64x5_ks1_w2x2x1_bias0_ktail0_gm0_pft_gfx950,0.0,650.64,1932.65
gfx950,256,512,8192,4096,False,torch.bfloat16,torch.bfloat16,False,False,flydsl,9,1,43.6031,flydsl_hgemm_abf16_wbf16_bf16_t128x128x128x2_ks1_w2x4x1_bias0_ktail0_gm4_pht_gfx950,0.0,788.01,1827.66
gfx950,256,768,8192,4096,False,torch.bfloat16,torch.bfloat16,False,False,torch,0,0,62.3146,native,0.0,827.09,1379.82
gfx950,256,1024,8192,4096,False,torch.bfloat16,torch.bfloat16,False,False,flydsl,83,1,70.2923,flydsl_hgemm_abf16_wbf16_bf16_t128x256x64x2_ks1_w2x4x1_bias0_ktail0_gm4_pht_gfx950,0.0,977.62,1312.73
gfx950,256,2048,8192,4096,False,torch.bfloat16,torch.bfloat16,False,False,flydsl,393,1,104.4691,flydsl_hgemm_abf16_wbf16_bf16_t256x256x64x2_ks1_w2x4x1_bias0_ktail0_gm4_pht_gfx950,0.0,1315.59,1124.17
gfx950,256,4096,8192,4096,False,torch.bfloat16,torch.bfloat16,False,False,flydsl,19,1,193.5439,flydsl_hgemm_abf16_wbf16_bf16_t256x256x64x2_ks1_w2x4x1_bias0_ktail0_gm4_pht_gfx950,0.0,1420.24,866.84
gfx950,256,8192,8192,4096,False,torch.bfloat16,torch.bfloat16,False,False,torch,0,0,375.1878,native,0.0,1465.28,715.47
gfx950,256,1,8704,4096,False,torch.bfloat16,torch.bfloat16,False,False,flydsl,87,4,15.0894,flydsl_hgemm_abf16_wbf16_bf16_t16x64x128x2_ks4_w1x1x2_bias0_ktail0_gm0_pft_gfx950,0.0223,4.73,4727.08
gfx950,256,2,8704,4096,False,torch.bfloat16,torch.bfloat16,False,False,flydsl,193,8,15.0211,flydsl_hgemm_abf16_wbf16_bf16_t16x64x64x2_ks8_w1x1x1_bias0_ktail0_gm0_pft_gfx950,0.0194,9.49,4750.28
gfx950,256,4,8704,4096,False,torch.bfloat16,torch.bfloat16,False,False,flydsl,165,1,15.5462,flydsl_hgemm_abf16_wbf16_bf16_t16x64x256x3_ks1_w1x1x2_bias0_ktail0_gm0_pft_gfx950,0.0051,18.35,4593.12
gfx950,256,8,8704,4096,False,torch.bfloat16,torch.bfloat16,False,False,flydsl,176,1,15.4833,flydsl_hgemm_abf16_wbf16_bf16_t16x64x256x4_ks1_w1x1x2_bias0_ktail0_gm0_pft_gfx950,0.0048,36.84,4618.39
gfx950,256,16,8704,4096,False,torch.bfloat16,torch.bfloat16,False,False,flydsl,176,1,16.2256,flydsl_hgemm_abf16_wbf16_bf16_t16x64x256x4_ks1_w1x1x2_bias0_ktail0_gm0_pft_gfx950,0.0048,70.31,4419.73
gfx950,256,32,8704,4096,False,torch.bfloat16,torch.bfloat16,False,False,flydsl,122,1,17.7241,flydsl_hgemm_abf16_wbf16_bf16_t16x64x64x7_ks1_w1x1x2_bias0_ktail0_gm0_pft_gfx950,0.0049,128.73,4069.17
gfx950,256,48,8704,4096,False,torch.bfloat16,torch.bfloat16,False,False,torch,0,0,20.6683,native,0.0,165.59,3509.33
gfx950,256,64,8704,4096,False,torch.bfloat16,torch.bfloat16,False,False,flydsl,408,1,19.9291,flydsl_hgemm_abf16_wbf16_bf16_t32x64x64x6_ks1_w1x2x1_bias0_ktail0_gm0_pft_gfx950,0.0,228.98,3660.05
gfx950,256,96,8704,4096,False,torch.bfloat16,torch.bfloat16,False,False,flydsl,526,1,22.6643,flydsl_hgemm_abf16_wbf16_bf16_t48x64x64x5_ks1_w1x2x1_bias0_ktail0_gm0_pft_gfx950,0.0,302.02,3254.49
gfx950,256,128,8704,4096,False,torch.bfloat16,torch.bfloat16,False,False,flydsl,1220,1,25.0264,flydsl_hgemm_abf16_wbf16_bf16_t64x64x64x5_ks1_w1x1x2_bias0_ktail0_gm0_pft_gfx950,0.0048,364.69,2980.05
gfx950,256,192,8704,4096,False,torch.bfloat16,torch.bfloat16,False,False,torch,0,0,31.0161,native,0.0,441.39,2457.38
gfx950,256,256,8704,4096,False,torch.bfloat16,torch.bfloat16,False,False,flydsl,199,1,36.9006,flydsl_hgemm_abf16_wbf16_bf16_t128x64x64x3_ks1_w4x1x1_bias0_ktail0_gm0_pft_gfx950,0.0,494.67,2109.91
gfx950,256,384,8704,4096,False,torch.bfloat16,torch.bfloat16,False,False,flydsl,205,1,43.8848,flydsl_hgemm_abf16_wbf16_bf16_t128x128x64x4_ks1_w2x4x1_bias0_ktail0_gm4_pft_gfx950,0.0,623.92,1848.79
gfx950,256,512,8704,4096,False,torch.bfloat16,torch.bfloat16,False,False,torch,0,0,50.3176,native,0.0,725.54,1677.55
gfx950,256,768,8704,4096,False,torch.bfloat16,torch.bfloat16,False,False,flydsl,467,1,65.3654,flydsl_hgemm_abf16_wbf16_bf16_t256x128x64x3_ks1_w4x4x1_bias0_ktail0_gm4_pft_gfx950,0.0,837.76,1391.62
gfx950,256,1024,8704,4096,False,torch.bfloat16,torch.bfloat16,False,False,torch,0,0,76.7175,native,0.0,951.73,1271.13
gfx950,256,2048,8704,4096,False,torch.bfloat16,torch.bfloat16,False,False,torch,0,0,137.1702,native,0.0,1064.58,902.03
gfx950,256,4096,8704,4096,False,torch.bfloat16,torch.bfloat16,False,False,torch,0,0,242.1831,native,0.0,1205.94,727.39
gfx950,256,8192,8704,4096,False,torch.bfloat16,torch.bfloat16,False,False,torch,0,0,431.6164,native,0.0,1353.32,651.08
gfx950,256,1,10240,4096,False,torch.bfloat16,torch.bfloat16,False,False,flydsl,165,1,16.1457,flydsl_hgemm_abf16_wbf16_bf16_t16x64x256x3_ks1_w1x1x2_bias0_ktail0_gm0_pft_gfx950,0.0054,5.2,5197.34
gfx950,256,2,10240,4096,False,torch.bfloat16,torch.bfloat16,False,False,flydsl,165,1,16.1327,flydsl_hgemm_abf16_wbf16_bf16_t16x64x256x3_ks1_w1x1x2_bias0_ktail0_gm0_pft_gfx950,0.0048,10.4,5203.31
gfx950,256,4,10240,4096,False,torch.bfloat16,torch.bfloat16,False,False,flydsl,87,4,16.7958,flydsl_hgemm_abf16_wbf16_bf16_t16x64x128x2_ks4_w1x1x2_bias0_ktail0_gm0_pft_gfx950,0.0205,19.98,5001.3
gfx950,256,8,10240,4096,False,torch.bfloat16,torch.bfloat16,False,False,flydsl,176,1,16.3031,flydsl_hgemm_abf16_wbf16_bf16_t16x64x256x4_ks1_w1x1x2_bias0_ktail0_gm0_pft_gfx950,0.0049,41.16,5159.48
gfx950,256,16,10240,4096,False,torch.bfloat16,torch.bfloat16,False,False,flydsl,165,1,17.4768,flydsl_hgemm_abf16_wbf16_bf16_t16x64x256x3_ks1_w1x1x2_bias0_ktail0_gm0_pft_gfx950,0.0049,76.8,4826.1
gfx950,256,32,10240,4096,False,torch.bfloat16,torch.bfloat16,False,False,flydsl,84,1,19.0213,flydsl_hgemm_abf16_wbf16_bf16_t16x64x128x3_ks1_w1x1x2_bias0_ktail0_gm0_pft_gfx950,0.0049,141.12,4458.35
gfx950,256,48,10240,4096,False,torch.bfloat16,torch.bfloat16,False,False,torch,0,0,21.1575,native,0.0,190.31,4029.89
gfx950,256,64,10240,4096,False,torch.bfloat16,torch.bfloat16,False,False,flydsl,329,1,21.2217,flydsl_hgemm_abf16_wbf16_bf16_t32x64x128x3_ks1_w1x1x2_bias0_ktail0_gm0_pft_gfx950,0.0048,252.98,4039.31
gfx950,256,96,10240,4096,False,torch.bfloat16,torch.bfloat16,False,False,flydsl,526,1,24.7414,flydsl_hgemm_abf16_wbf16_bf16_t48x64x64x5_ks1_w1x2x1_bias0_ktail0_gm0_pft_gfx950,0.0,325.49,3501.77
gfx950,256,128,10240,4096,False,torch.bfloat16,torch.bfloat16,False,False,flydsl,1207,1,27.7146,flydsl_hgemm_abf16_wbf16_bf16_t64x64x64x4_ks1_w1x2x1_bias0_ktail0_gm0_pft_gfx950,0.0,387.43,3159.2
gfx950,256,192,10240,4096,False,torch.bfloat16,torch.bfloat16,False,False,flydsl,376,1,30.5121,flydsl_hgemm_abf16_wbf16_bf16_t64x128x128x3_ks1_w1x4x2_bias0_ktail0_gm0_pft_gfx950,0.0048,527.86,2929.69
gfx950,256,256,10240,4096,False,torch.bfloat16,torch.bfloat16,False,False,torch,0,0,34.6859,native,0.0,619.12,2630.06
gfx950,256,384,10240,4096,False,torch.bfloat16,torch.bfloat16,False,False,flydsl,262,1,43.0431,flydsl_hgemm_abf16_wbf16_bf16_t128x128x64x5_ks1_w2x4x2_bias0_ktail0_gm0_pft_gfx950,0.0049,748.37,2204.68
gfx950,256,512,10240,4096,False,torch.bfloat16,torch.bfloat16,False,False,torch,0,0,51.3192,native,0.0,836.91,1920.65
gfx950,256,768,10240,4096,False,torch.bfloat16,torch.bfloat16,False,False,flydsl,81,1,68.0998,flydsl_hgemm_abf16_wbf16_bf16_t128x256x64x2_ks1_w2x4x1_bias0_ktail0_gm0_pht_gfx950,0.0,946.03,1555.16
gfx950,256,1024,10240,4096,False,torch.bfloat16,torch.bfloat16,False,False,torch,0,0,79.3771,native,0.0,1082.17,1426.69
gfx950,256,2048,10240,4096,False,torch.bfloat16,torch.bfloat16,False,False,torch,0,0,153.2836,native,0.0,1120.79,930.34
gfx950,256,4096,10240,4096,False,torch.bfloat16,torch.bfloat16,False,False,flydsl,18,1,264.306,flydsl_hgemm_abf16_wbf16_bf16_t256x256x64x2_ks1_w2x4x1_bias0_ktail0_gm0_pht_gfx950,0.0,1300.0,761.72
gfx950,256,8192,10240,4096,False,torch.bfloat16,torch.bfloat16,False,False,torch,0,0,450.2714,native,0.0,1526.18,707.94
