aiter/configs/model_configs/qwen3_5_397b_fp8_ptpc_tuned_fmoe.csv
gfx,cu_num,token,model_dim,inter_dim,expert,topk,act_type,dtype,q_dtype_a,q_dtype_w,q_type,use_g1u1,doweight_stage1,block_m,ksplit,us1,kernelName1,err1,us2,kernelName2,err2,us,run_1stage,xbf16,flat,tflops,bw,_tag
gfx942,80,1,4096,128,512,10,ActivationType.Silu,torch.bfloat16,torch.float8_e4m3fnuz,torch.float8_e4m3fnuz,QuantType.per_Token,1,0,16,0,14.778674157303518,fused_moe_gfx942__16_16_16_False,0.27%,0.0,,0%,14.778674157303518,1,0,0,0,0,
gfx942,80,2,4096,128,512,10,ActivationType.Silu,torch.bfloat16,torch.float8_e4m3fnuz,torch.float8_e4m3fnuz,QuantType.per_Token,1,0,16,0,35.57803125000005,fused_moe_gfx942__16_16_16_False,0.38%,0.0,,0%,35.57803125000005,1,0,0,0,0,
gfx942,80,4,4096,128,512,10,ActivationType.Silu,torch.bfloat16,torch.float8_e4m3fnuz,torch.float8_e4m3fnuz,QuantType.per_Token,1,0,16,0,45.04978313252989,fused_moe_gfx942__16_16_16_False,0.52%,0.0,,0%,45.04978313252989,1,0,0,0,0,
gfx942,80,8,4096,128,512,10,ActivationType.Silu,torch.bfloat16,torch.float8_e4m3fnuz,torch.float8_e4m3fnuz,QuantType.per_Token,1,0,16,0,64.09065656565653,fused_moe_gfx942__16_16_16_False,0.65%,0.0,,0%,64.09065656565653,1,0,0,0,0,
gfx942,80,16,4096,128,512,10,ActivationType.Silu,torch.bfloat16,torch.float8_e4m3fnuz,torch.float8_e4m3fnuz,QuantType.per_Token,1,0,16,0,98.19035353535327,fused_moe_gfx942__16_16_16_False,0.57%,0.0,,0%,98.19035353535327,1,0,0,0,0,
gfx942,80,32,4096,128,512,10,ActivationType.Silu,torch.bfloat16,torch.float8_e4m3fnuz,torch.float8_e4m3fnuz,QuantType.per_Token,1,0,16,0,145.43463999999983,fused_moe_gfx942__16_16_16_False,0.58%,0.0,,0%,145.43463999999983,1,0,0,0,0,
