aiter/configs/model_configs/qwen3_5_35b_fp8_ptpc_tuned_fmoe.csv
gfx,cu_num,token,model_dim,inter_dim,expert,topk,act_type,dtype,q_dtype_a,q_dtype_w,q_type,use_g1u1,doweight_stage1,block_m,ksplit,us1,kernelName1,err1,us2,kernelName2,err2,us,run_1stage,xbf16,flat,tflops,bw,_tag
gfx942,80,1,2048,128,257,9,ActivationType.Silu,torch.bfloat16,torch.float8_e4m3fnuz,torch.float8_e4m3fnuz,QuantType.per_Token,1,0,16,0,12.125919191919154,fused_moe_gfx942__16_16_16_False,46.78%,0.0,,0%,12.125919191919154,1,0,0,0.0,0.0,
gfx942,80,1,2048,512,257,9,ActivationType.Silu,torch.bfloat16,torch.float8_e4m3fnuz,torch.float8_e4m3fnuz,QuantType.per_Token,1,0,16,0,20.226535353535276,fused_moe_gfx942__16_16_16_False,66.65%,0.0,,0%,20.226535353535276,1,0,0,0.0,0.0,
gfx942,80,2,2048,128,257,9,ActivationType.Silu,torch.bfloat16,torch.float8_e4m3fnuz,torch.float8_e4m3fnuz,QuantType.per_Token,1,0,16,0,24.923576086956913,fused_moe_gfx942__16_16_16_False,47.66%,0.0,,0%,24.923576086956913,1,0,0,0.0,0.0,
gfx942,80,2,2048,512,257,9,ActivationType.Silu,torch.bfloat16,torch.float8_e4m3fnuz,torch.float8_e4m3fnuz,QuantType.per_Token,1,0,16,0,38.14115999999973,fused_moe_gfx942__16_16_16_False,69.24%,0.0,,0%,38.14115999999973,1,0,0,0.0,0.0,
gfx942,80,4,2048,128,257,9,ActivationType.Silu,torch.bfloat16,torch.float8_e4m3fnuz,torch.float8_e4m3fnuz,QuantType.per_Token,1,0,16,0,29.92627999999979,fused_moe_gfx942__16_16_16_False,51.25%,0.0,,0%,29.92627999999979,1,0,0,0.0,0.0,
gfx942,80,4,2048,512,257,9,ActivationType.Silu,torch.bfloat16,torch.float8_e4m3fnuz,torch.float8_e4m3fnuz,QuantType.per_Token,1,0,16,0,53.37598999999998,fused_moe_gfx942__16_16_16_False,68.92%,0.0,,0%,53.37598999999998,1,0,0,0.0,0.0,
gfx942,80,8,2048,128,257,9,ActivationType.Silu,torch.bfloat16,torch.float8_e4m3fnuz,torch.float8_e4m3fnuz,QuantType.per_Token,1,0,16,0,39.269010638297864,fused_moe_gfx942__16_16_16_False,51.11%,0.0,,0%,39.269010638297864,1,0,0,0.0,0.0,
gfx942,80,8,2048,512,257,9,ActivationType.Silu,torch.bfloat16,torch.float8_e4m3fnuz,torch.float8_e4m3fnuz,QuantType.per_Token,1,0,16,0,40.2569,_ZN5aiter47fmoe_stage1_bf16_pertokenFp8_g1u1_16x64_5tg_pf3E,0.0%,26.6967,moe_ck2stages_gemm2_256x16x128x256_1x4_MulABScaleExpertWeight_v1_Nswizzle0_Quant2_MulRoutedWeight1_F8_F8_B16,0.1%,66.9536,0,0,0,6.77,12075.55,
gfx942,80,16,2048,128,257,9,ActivationType.Silu,torch.bfloat16,torch.float8_e4m3fnuz,torch.float8_e4m3fnuz,QuantType.per_Token,1,0,16,0,55.054350000000156,fused_moe_gfx942__16_16_16_False,49.73%,0.0,,0%,55.054350000000156,1,0,0,0.0,0.0,
gfx942,80,16,2048,512,257,9,ActivationType.Silu,torch.bfloat16,torch.float8_e4m3fnuz,torch.float8_e4m3fnuz,QuantType.per_Token,1,0,16,0,62.6192,_ZN5aiter47fmoe_stage1_bf16_pertokenFp8_g1u1_16x64_5tg_pf3E,0.0%,39.4123,moe_ck2stages_gemm2_256x16x128x256_1x4_MulABScaleExpertWeight_v1_Nswizzle0_Quant2_MulRoutedWeight1_F8_F8_B16,0.0%,102.0315,0,0,0,8.88,7924.52,
gfx942,80,32,2048,128,257,9,ActivationType.Silu,torch.bfloat16,torch.float8_e4m3fnuz,torch.float8_e4m3fnuz,QuantType.per_Token,1,0,16,0,67.78166666666677,fused_moe_gfx942__16_16_16_False,49.68%,0.0,,0%,67.78166666666677,1,0,0,0.0,0.0,
gfx942,80,32,2048,512,257,9,ActivationType.Silu,torch.bfloat16,torch.float8_e4m3fnuz,torch.float8_e4m3fnuz,QuantType.per_Token,1,0,16,0,104.965,moe_ck2stages_gemm1_256x16x64x256_1x4_MulABScale_v1_Nswizzle0_Quant2_MulRoutedWeight0_silu_F8_F8_B16,0.0%,60.9566,moe_ck2stages_gemm2_256x16x128x256_1x4_MulABScaleExpertWeight_v1_Nswizzle0_Quant2_MulRoutedWeight1_F8_F8_B16,0.0%,165.9216,0,0,0,10.92,4873.68,
gfx942,80,64,2048,128,257,9,ActivationType.Silu,torch.bfloat16,torch.float8_e4m3fnuz,torch.float8_e4m3fnuz,QuantType.per_Token,1,0,16,0,85.60116326530614,fused_moe_gfx942__16_16_16_False,49.56%,0.0,,0%,85.60116326530614,1,0,0,0.0,0.0,
gfx942,80,64,2048,512,257,9,ActivationType.Silu,torch.bfloat16,torch.float8_e4m3fnuz,torch.float8_e4m3fnuz,QuantType.per_Token,1,0,16,0,134.4378,moe_ck2stages_gemm1_256x16x64x256_1x4_MulABScale_v1_Nswizzle0_Quant2_MulRoutedWeight0_silu_F8_F8_B16,0.0%,79.3759,moe_ck2stages_gemm2_256x16x128x256_1x4_MulABScaleExpertWeight_v1_Nswizzle0_Quant2_MulRoutedWeight1_F8_F8_B16,0.0%,213.8137,0,0,0,16.95,3782.94,
gfx942,80,128,2048,128,257,9,ActivationType.Silu,torch.bfloat16,torch.float8_e4m3fnuz,torch.float8_e4m3fnuz,QuantType.per_Token,1,0,16,0,102.16037499999995,fused_moe_gfx942__16_16_16_False,49.40%,0.0,,0%,102.16037499999995,1,0,0,0.0,0.0,
gfx942,80,128,2048,512,257,9,ActivationType.Silu,torch.bfloat16,torch.float8_e4m3fnuz,torch.float8_e4m3fnuz,QuantType.per_Token,1,0,16,0,156.5502,moe_ck2stages_gemm1_256x16x64x256_1x4_MulABScale_v1_Nswizzle0_Quant2_MulRoutedWeight0_silu_F8_F8_B16,0.0%,92.0139,moe_ck2stages_gemm2_256x16x128x256_1x4_MulABScaleExpertWeight_v1_Nswizzle0_Quant2_MulRoutedWeight1_F8_F8_B16,0.0%,248.5641,0,0,0,29.16,3255.65,
gfx942,80,256,2048,128,257,9,ActivationType.Silu,torch.bfloat16,torch.float8_e4m3fnuz,torch.float8_e4m3fnuz,QuantType.per_Token,1,0,16,0,41.0303,moe_ck2stages_gemm1_256x16x64x256_1x4_MulABScale_v1_Nswizzle0_Quant2_MulRoutedWeight0_silu_F8_F8_B16,0.0%,67.0925,moe_ck2stages_gemm2_128x16x128x128_1x2_MulABScaleExpertWeight_v1_Nswizzle0_Quant2_MulRoutedWeight1_F8_F8_B16,0.0%,108.1228,0,0,0,33.52,1883.84,
gfx942,80,256,2048,512,257,9,ActivationType.Silu,torch.bfloat16,torch.float8_e4m3fnuz,torch.float8_e4m3fnuz,QuantType.per_Token,1,0,16,0,162.9386,_ZN5aiter47fmoe_stage1_bf16_pertokenFp8_g1u1_16x64_5tg_pf3E,0.0%,101.9899,moe_ck2stages_gemm2_256x16x128x256_1x4_MulABScaleExpertWeight_v1_Nswizzle0_Quant2_MulRoutedWeight1_F8_F8_B16,0.0%,264.9285,0,0,0,54.71,3057.52,
gfx942,80,512,2048,128,257,9,ActivationType.Silu,torch.bfloat16,torch.float8_e4m3fnuz,torch.float8_e4m3fnuz,QuantType.per_Token,1,0,32,0,123.4505,_ZN5aiter45fmoe_bf16_pertokenFp8_g1u1_vs_silu_1tg_32x128E,0.0%,0.0,,0.0%,123.4505,1,0,0,58.71,1662.68,
gfx942,80,512,2048,512,257,9,ActivationType.Silu,torch.bfloat16,torch.float8_e4m3fnuz,torch.float8_e4m3fnuz,QuantType.per_Token,1,0,32,0,179.6785,_ZN5aiter48fmoe_stage1_bf16_pertokenFp8_g1u1_32x128_3tg_pf3E,0.0%,136.9475,moe_ck2stages_gemm2_256x32x64x128_1x4_MulABScaleExpertWeight_v1_Nswizzle0_Quant2_MulRoutedWeight1_F8_F8_B16,0.0%,316.626,0,0,0,91.56,2563.27,
gfx942,80,1024,2048,128,257,9,ActivationType.Silu,torch.bfloat16,torch.float8_e4m3fnuz,torch.float8_e4m3fnuz,QuantType.per_Token,1,0,16,0,183.2022708333328,fused_moe_gfx942__64_128_128_True,0.65%,0.0,,0%,183.2022708333328,1,0,0,0.0,0.0,
gfx942,80,1024,2048,512,257,9,ActivationType.Silu,torch.bfloat16,torch.float8_e4m3fnuz,torch.float8_e4m3fnuz,QuantType.per_Token,1,0,16,0,392.0294183673472,fused_moe_gfx942__64_128_256_True,1.51%,0.0,,0%,392.0294183673472,1,0,0,0.0,0.0,
gfx942,80,2048,2048,128,257,9,ActivationType.Silu,torch.bfloat16,torch.float8_e4m3fnuz,torch.float8_e4m3fnuz,QuantType.per_Token,1,0,16,0,277.9349999999998,fused_moe_gfx942__64_128_256_True,0.68%,0.0,,0%,277.9349999999998,1,0,0,0.0,0.0,
gfx942,80,2048,2048,512,257,9,ActivationType.Silu,torch.bfloat16,torch.float8_e4m3fnuz,torch.float8_e4m3fnuz,QuantType.per_Token,1,0,16,0,679.1771739130439,fused_moe_gfx942__64_128_256_True,1.48%,0.0,,0%,679.1771739130439,1,0,0,0.0,0.0,
gfx942,80,4096,2048,128,257,9,ActivationType.Silu,torch.bfloat16,torch.float8_e4m3fnuz,torch.float8_e4m3fnuz,QuantType.per_Token,1,0,16,0,401.4770600000006,fused_moe_gfx942__64_128_256_True,0.60%,0.0,,0%,401.4770600000006,1,0,0,0.0,0.0,
gfx942,80,4096,2048,512,257,9,ActivationType.Silu,torch.bfloat16,torch.float8_e4m3fnuz,torch.float8_e4m3fnuz,QuantType.per_Token,1,0,16,0,1045.7073684210545,fused_moe_gfx942__64_128_256_True,1.37%,0.0,,0%,1045.7073684210545,1,0,0,0.0,0.0,
gfx942,80,8192,2048,128,257,9,ActivationType.Silu,torch.bfloat16,torch.float8_e4m3fnuz,torch.float8_e4m3fnuz,QuantType.per_Token,1,0,16,0,705.1765306122452,fused_moe_gfx942__64_128_256_True,0.67%,0.0,,0%,705.1765306122452,1,0,0,0.0,0.0,
gfx942,80,8192,2048,512,257,9,ActivationType.Silu,torch.bfloat16,torch.float8_e4m3fnuz,torch.float8_e4m3fnuz,QuantType.per_Token,1,0,16,0,1757.7259795918385,fused_moe_gfx942__64_128_256_True,1.49%,0.0,,0%,1757.7259795918385,1,0,0,0.0,0.0,
gfx942,80,16384,2048,128,257,9,ActivationType.Silu,torch.bfloat16,torch.float8_e4m3fnuz,torch.float8_e4m3fnuz,QuantType.per_Token,1,0,16,0,1280.5565102040828,fused_moe_gfx942__64_128_256_True,0.69%,0.0,,0%,1280.5565102040828,1,0,0,0.0,0.0,
gfx942,80,16384,2048,512,257,9,ActivationType.Silu,torch.bfloat16,torch.float8_e4m3fnuz,torch.float8_e4m3fnuz,QuantType.per_Token,1,0,16,0,3200.5802727272744,fused_moe_gfx942__64_128_256_True,1.51%,0.0,,0%,3200.5802727272744,1,0,0,0.0,0.0,
gfx942,80,32768,2048,128,257,9,ActivationType.Silu,torch.bfloat16,torch.float8_e4m3fnuz,torch.float8_e4m3fnuz,QuantType.per_Token,1,0,16,0,2446.90416161616,fused_moe_gfx942__64_128_128_True,0.67%,0.0,,0%,2446.90416161616,1,0,0,0.0,0.0,
gfx942,80,32768,2048,512,257,9,ActivationType.Silu,torch.bfloat16,torch.float8_e4m3fnuz,torch.float8_e4m3fnuz,QuantType.per_Token,1,0,16,0,6105.622530612246,fused_moe_gfx942__64_128_128_True,1.46%,0.0,,0%,6105.622530612246,1,0,0,0.0,0.0,
gfx942,80,65536,2048,128,257,9,ActivationType.Silu,torch.bfloat16,torch.float8_e4m3fnuz,torch.float8_e4m3fnuz,QuantType.per_Token,1,0,16,0,4773.1459696969805,fused_moe_gfx942__64_128_128_True,0.66%,0.0,,0%,4773.1459696969805,1,0,0,0.0,0.0,
gfx942,80,131072,2048,128,257,9,ActivationType.Silu,torch.bfloat16,torch.float8_e4m3fnuz,torch.float8_e4m3fnuz,QuantType.per_Token,1,0,16,0,9629.651363636362,fused_moe_gfx942__64_128_128_True,0.67%,0.0,,0%,9629.651363636362,1,0,0,0.0,0.0,
