aiter/configs/model_configs/qwen3_5_397b_fp4_tuned_fmoe.csv
cu_num,token,model_dim,inter_dim,expert,topk,act_type,dtype,q_dtype_a,q_dtype_w,q_type,use_g1u1,doweight_stage1,block_m,ksplit,us1,kernelName1,err1,us2,kernelName2,err2,us,run_1stage,xbf16,tflops,bw,_tag
256,256,4096,512,512,10,ActivationType.Silu,torch.bfloat16,torch.float4_e2m1fn_x2,torch.float4_e2m1fn_x2,QuantType.per_1x32,1,0,32,0,176.4949,flydsl_moe1_afp4_wfp4_bf16_t32x64x256_w4_fp4,0.8%,104.0769,flydsl_moe2_afp4_wfp4_bf16_t16x128x256_atomic_bnt2_persist_sbm32,0.6%,280.5718,0,0,114.81,11492.14,
256,128,4096,512,512,10,ActivationType.Silu,torch.bfloat16,torch.float4_e2m1fn_x2,torch.float4_e2m1fn_x2,QuantType.per_1x32,1,0,32,0,167.3166,flydsl_moe1_afp4_wfp4_bf16_t32x64x256_w3,0.0%,94.9163,flydsl_moe2_afp4_wfp4_bf16_t16x256x256_atomic_bnt2_persist_sbm32,0.6%,262.2329,0,0,61.42,12289.83,
256,64,4096,512,512,10,ActivationType.Silu,torch.bfloat16,torch.float4_e2m1fn_x2,torch.float4_e2m1fn_x2,QuantType.per_1x32,1,0,32,0,133.6922,flydsl_moe1_afp4_wfp4_bf16_t32x64x256_w3,0.0%,76.0021,flydsl_moe2_afp4_wfp4_bf16_t32x256x256_reduce_bnt2,0.0%,209.6943,0,0,38.4,15365.28,
256,32,4096,512,512,10,ActivationType.Silu,torch.bfloat16,torch.float4_e2m1fn_x2,torch.float4_e2m1fn_x2,QuantType.per_1x32,1,0,32,0,92.0389,flydsl_moe1_afp4_wfp4_bf16_t32x64x256_w4,0.0%,53.0738,flydsl_moe2_afp4_wfp4_bf16_t16x256x256_reduce_bnt2_persist_sbm32,0.0%,145.1127,0,0,27.75,22200.8,
256,16,4096,512,512,10,ActivationType.Silu,torch.bfloat16,torch.float4_e2m1fn_x2,torch.float4_e2m1fn_x2,QuantType.per_1x32,1,0,64,0,57.9792,flydsl_moe1_afp4_wfp4_bf16_t64x128x256_w3_xcd4_fp4,1.0%,35.492,flydsl_moe2_afp4_wfp4_bf16_t32x256x256_reduce_bnt2_sbm64,0.0%,93.4712,0,0,21.54,34464.33,
256,8,4096,512,512,10,ActivationType.Silu,torch.bfloat16,torch.float4_e2m1fn_x2,torch.float4_e2m1fn_x2,QuantType.per_1x32,1,0,32,0,32.5473,flydsl_moe1_afp4_wfp4_bf16_t32x64x256_w4_fp4,1.2%,23.3846,flydsl_moe2_afp4_wfp4_bf16_t32x128x256_reduce_bnt2,0.0%,55.9319,0,0,18.0,57593.68,
256,4,4096,512,512,10,ActivationType.Silu,torch.bfloat16,torch.float4_e2m1fn_x2,torch.float4_e2m1fn_x2,QuantType.per_1x32,1,0,32,0,23.4803,flydsl_moe1_afp4_wfp4_bf16_t32x128x256_w3,0.0%,16.4406,flydsl_moe2_afp4_wfp4_bf16_t32x128x256_atomic_bnt2,0.6%,39.9209,0,0,12.61,80691.43,
256,2,4096,512,512,10,ActivationType.Silu,torch.bfloat16,torch.float4_e2m1fn_x2,torch.float4_e2m1fn_x2,QuantType.per_1x32,1,0,32,0,18.1456,flydsl_moe1_afp4_wfp4_bf16_t32x64x256_w4,0.0%,10.2862,moe_ck2stages_gemm2_256x32x128x128_1x4_MulABScaleExpertWeightShuffled_v3_Nswizzle0_Quant3_MulRoutedWeight1_FP4X2_FP4X2_B16,0.9%,28.4318,0,0,8.85,113297.44,
256,1,4096,512,512,10,ActivationType.Silu,torch.bfloat16,torch.float4_e2m1fn_x2,torch.float4_e2m1fn_x2,QuantType.per_1x32,1,0,32,0,17.1661,flydsl_moe1_afp4_wfp4_bf16_t32x64x256_w4,0.0%,6.8697,moe_ck2stages_gemm2_256x32x128x128_1x4_MulABScaleExpertWeightShuffled_v3_Nswizzle0_Quant3_MulRoutedWeight1_FP4X2_FP4X2_B16,0.8%,24.0358,0,0,5.24,134018.33,
256,8192,4096,512,512,10,ActivationType.Silu,torch.bfloat16,torch.float4_e2m1fn_x2,torch.float4_e2m1fn_x2,QuantType.per_1x32,1,0,64,0,393.9444,flydsl_moe1_afp4_wfp4_bf16_t64x128x256_w4_bnt0_xcd4,0.0%,473.7579,flydsl_moe2_afp4_wfp4_bf16_t64x128x256_reduce_persist,0.0%,867.7023,0,0,1187.96,3828.37,
256,16384,4096,512,512,10,ActivationType.Silu,torch.bfloat16,torch.float4_e2m1fn_x2,torch.float4_e2m1fn_x2,QuantType.per_1x32,1,0,64,0,622.2001,flydsl_moe1_afp4_wfp4_bf16_t64x128x256_w3_bnt0_xcd4,0.0%,884.9408,flydsl_moe2_afp4_wfp4_bf16_t64x128x256_reduce_persist,0.0%,1507.1409,0,0,1367.88,2270.89,
256,1024,4096,512,512,10,ActivationType.Silu,torch.bfloat16,torch.float4_e2m1fn_x2,torch.float4_e2m1fn_x2,QuantType.per_1x32,1,0,64,0,190.2166,flydsl_moe1_afp4_wfp4_bf16_t64x64x256_w4_fp4,0.8%,121.1913,flydsl_moe2_afp4_wfp4_bf16_t32x256x256_atomic_bnt2_xcd4_persist_sbm64,0.7%,311.4079,0,0,413.76,10384.48,
256,2048,4096,512,512,10,ActivationType.Silu,torch.bfloat16,torch.float4_e2m1fn_x2,torch.float4_e2m1fn_x2,QuantType.per_1x32,1,0,64,0,218.3225,flydsl_moe1_afp4_wfp4_bf16_t64x64x256_w4,0.0%,172.2584,flydsl_moe2_afp4_wfp4_bf16_t64x128x256_atomic_bnt2_persist,0.6%,390.5809,0,0,659.78,8311.7,
256,4096,4096,512,512,10,ActivationType.Silu,torch.bfloat16,torch.float4_e2m1fn_x2,torch.float4_e2m1fn_x2,QuantType.per_1x32,1,0,64,0,254.6509,flydsl_moe1_afp4_wfp4_bf16_t64x128x256_w2_bnt0_xcd4_fp4,0.8%,285.2882,flydsl_moe2_afp4_wfp4_bf16_t64x128x256_reduce,0.0%,539.9391,0,0,954.54,6059.12,
256,256,4096,512,512,10,ActivationType.Silu,torch.bfloat16,torch.float4_e2m1fn_x2,torch.float4_e2m1fn_x2,QuantType.per_1x32,1,0,32,0,201.1649,moe_ck2stages_gemm1_64x32x32x128_1x1_MulABScaleShuffled_v3_Nswizzle0_Quant3_MulRoutedWeight0_silu_FP4X2_FP4X2_B16,0.0,106.8039,moe_ck2stages_gemm2_256x32x128x128_1x4_MulABScaleExpertWeightShuffled_v3_Nswizzle0_Quant3_MulRoutedWeight1_FP4X2_FP4X2_B16,0.0064,307.9688,0,0,0.0,0.0,flydsl_fallback
256,128,4096,512,512,10,ActivationType.Silu,torch.bfloat16,torch.float4_e2m1fn_x2,torch.float4_e2m1fn_x2,QuantType.per_1x32,1,0,32,0,190.5984,moe_ck2stages_gemm1_64x32x32x128_1x1_MulABScaleShuffled_v3_Nswizzle0_Quant3_MulRoutedWeight0_silu_FP4X2_FP4X2_B16,0.0,96.567,moe_ck2stages_gemm2_256x32x128x128_1x4_MulABScaleExpertWeightShuffled_v3_Nswizzle0_Quant3_MulRoutedWeight1_FP4X2_FP4X2_B16,0.0063,287.1654,0,0,0.0,0.0,flydsl_fallback
256,64,4096,512,512,10,ActivationType.Silu,torch.bfloat16,torch.float4_e2m1fn_x2,torch.float4_e2m1fn_x2,QuantType.per_1x32,1,0,32,0,150.0412,moe_ck2stages_gemm1_64x32x32x128_1x1_MulABScaleShuffled_v3_Nswizzle0_Quant3_MulRoutedWeight0_silu_FP4X2_FP4X2_B16,0.0,77.3609,moe_ck2stages_gemm2_256x32x128x128_1x4_MulABScaleExpertWeightShuffled_v3_Nswizzle0_Quant3_MulRoutedWeight1_FP4X2_FP4X2_B16,0.0061,227.4021,0,0,0.0,0.0,flydsl_fallback
256,32,4096,512,512,10,ActivationType.Silu,torch.bfloat16,torch.float4_e2m1fn_x2,torch.float4_e2m1fn_x2,QuantType.per_1x32,1,0,32,0,102.2452,moe_ck2stages_gemm1_64x32x32x128_1x1_MulABScaleShuffled_v3_Nswizzle0_Quant3_MulRoutedWeight0_silu_FP4X2_FP4X2_B16,0.0,54.7656,moe_ck2stages_gemm2_256x32x128x128_1x4_MulABScaleExpertWeightShuffled_v3_Nswizzle0_Quant3_MulRoutedWeight1_FP4X2_FP4X2_B16,0.0061,157.0108,0,0,0.0,0.0,flydsl_fallback
256,16,4096,512,512,10,ActivationType.Silu,torch.bfloat16,torch.float4_e2m1fn_x2,torch.float4_e2m1fn_x2,QuantType.per_1x32,1,0,32,0,64.2252,moe_ck2stages_gemm1_64x32x32x128_1x1_MulABScaleShuffled_v3_Nswizzle0_Quant3_MulRoutedWeight0_silu_FP4X2_FP4X2_B16,0.0,36.0226,moe_ck2stages_gemm2_256x32x128x128_1x4_MulABScaleExpertWeightShuffled_v3_Nswizzle0_Quant3_MulRoutedWeight1_FP4X2_FP4X2_B16,0.0064,100.2478,0,0,0.0,0.0,flydsl_fallback
256,8,4096,512,512,10,ActivationType.Silu,torch.bfloat16,torch.float4_e2m1fn_x2,torch.float4_e2m1fn_x2,QuantType.per_1x32,1,0,32,0,36.528,moe_ck2stages_gemm1_64x32x32x128_1x1_MulABScaleShuffled_v3_Nswizzle0_Quant3_MulRoutedWeight0_silu_FP4X2_FP4X2_B16,0.0,23.8148,moe_ck2stages_gemm2_256x32x128x128_1x4_MulABScaleExpertWeightShuffled_v3_Nswizzle0_Quant3_MulRoutedWeight1_FP4X2_FP4X2_B16,0.0062,60.3428,0,0,0.0,0.0,flydsl_fallback
256,4,4096,512,512,10,ActivationType.Silu,torch.bfloat16,torch.float4_e2m1fn_x2,torch.float4_e2m1fn_x2,QuantType.per_1x32,1,0,32,0,23.6677,moe_ck2stages_gemm1_64x32x32x128_1x1_MulABScaleShuffled_v3_Nswizzle0_Quant3_MulRoutedWeight0_silu_FP4X2_FP4X2_B16,0.0,17.3189,moe_ck2stages_gemm2_256x32x128x128_1x4_MulABScaleExpertWeightShuffled_v3_Nswizzle0_Quant3_MulRoutedWeight1_FP4X2_FP4X2_B16,0.007,40.9866,0,0,0.0,0.0,flydsl_fallback
256,2,4096,512,512,10,ActivationType.Silu,torch.bfloat16,torch.float4_e2m1fn_x2,torch.float4_e2m1fn_x2,QuantType.per_1x32,1,0,32,0,19.0213,moe_ck2stages_gemm1_64x32x32x128_1x1_MulABScaleShuffled_v3_Nswizzle0_Quant3_MulRoutedWeight0_silu_FP4X2_FP4X2_B16,0.0,10.2862,moe_ck2stages_gemm2_256x32x128x128_1x4_MulABScaleExpertWeightShuffled_v3_Nswizzle0_Quant3_MulRoutedWeight1_FP4X2_FP4X2_B16,0.0089,29.3075,0,0,0.0,0.0,flydsl_fallback
256,1,4096,512,512,10,ActivationType.Silu,torch.bfloat16,torch.float4_e2m1fn_x2,torch.float4_e2m1fn_x2,QuantType.per_1x32,1,0,32,0,17.6719,moe_ck2stages_gemm1_64x32x32x128_1x1_MulABScaleShuffled_v3_Nswizzle0_Quant3_MulRoutedWeight0_silu_FP4X2_FP4X2_B16,0.0,6.8697,moe_ck2stages_gemm2_256x32x128x128_1x4_MulABScaleExpertWeightShuffled_v3_Nswizzle0_Quant3_MulRoutedWeight1_FP4X2_FP4X2_B16,0.0083,24.5416,0,0,0.0,0.0,flydsl_fallback
256,8192,4096,512,512,10,ActivationType.Silu,torch.bfloat16,torch.float4_e2m1fn_x2,torch.float4_e2m1fn_x2,QuantType.per_1x32,1,0,64,0,483.5272,moe_ck2stages_gemm1_256x64x128x128_1x4_MulABScaleShuffled_v3_Nswizzle0_Quant3_MulRoutedWeight0_silu_FP4X2_FP4X2_B16,0.0,712.0708,moe_ck2stages_gemm2_64x64x128x128_1x1_MulABScaleExpertWeightShuffled_v3_Nswizzle0_Quant3_MulRoutedWeight1_FP4X2_FP4X2_B16,0.0064,1195.598,0,0,0.0,0.0,flydsl_fallback
256,16384,4096,512,512,10,ActivationType.Silu,torch.bfloat16,torch.float4_e2m1fn_x2,torch.float4_e2m1fn_x2,QuantType.per_1x32,1,0,64,0,690.7785,moe_ck2stages_gemm1_256x64x128x128_1x4_MulABScaleShuffled_v3_Nswizzle0_Quant3_MulRoutedWeight0_silu_FP4X2_FP4X2_B16,0.0,1340.1387,moe_ck2stages_gemm2_64x64x128x128_1x1_MulABScaleExpertWeightShuffled_v3_Nswizzle0_Quant3_MulRoutedWeight1_FP4X2_FP4X2_B16,0.0065,2030.9172,0,0,0.0,0.0,flydsl_fallback
256,1024,4096,512,512,10,ActivationType.Silu,torch.bfloat16,torch.float4_e2m1fn_x2,torch.float4_e2m1fn_x2,QuantType.per_1x32,1,0,32,0,219.6921,moe_ck2stages_gemm1_64x32x32x128_1x1_MulABScaleShuffled_v3_Nswizzle0_Quant3_MulRoutedWeight0_silu_FP4X2_FP4X2_B16,0.0,155.3446,moe_ck2stages_gemm2_256x32x128x128_1x4_MulABScaleExpertWeightShuffled_v3_Nswizzle0_Quant3_MulRoutedWeight1_FP4X2_FP4X2_B16,0.0065,375.0367,0,0,0.0,0.0,flydsl_fallback
256,2048,4096,512,512,10,ActivationType.Silu,torch.bfloat16,torch.float4_e2m1fn_x2,torch.float4_e2m1fn_x2,QuantType.per_1x32,1,0,64,0,252.803,moe_ck2stages_gemm1_256x64x128x128_1x4_MulABScaleShuffled_v3_Nswizzle0_Quant3_MulRoutedWeight0_silu_FP4X2_FP4X2_B16,0.0,262.341,moe_ck2stages_gemm2_64x64x128x128_1x1_MulABScaleExpertWeightShuffled_v3_Nswizzle0_Quant3_MulRoutedWeight1_FP4X2_FP4X2_B16,0.0064,515.144,0,0,0.0,0.0,flydsl_fallback
256,4096,4096,512,512,10,ActivationType.Silu,torch.bfloat16,torch.float4_e2m1fn_x2,torch.float4_e2m1fn_x2,QuantType.per_1x32,1,0,64,0,407.0887,moe_ck2stages_gemm1_256x64x128x128_1x4_MulABScaleShuffled_v3_Nswizzle0_Quant3_MulRoutedWeight0_silu_FP4X2_FP4X2_B16,0.0,421.3564,moe_ck2stages_gemm2_64x64x128x128_1x1_MulABScaleExpertWeightShuffled_v3_Nswizzle0_Quant3_MulRoutedWeight1_FP4X2_FP4X2_B16,0.0065,828.4451,0,0,0.0,0.0,flydsl_fallback
256,2,4096,256,512,10,ActivationType.Silu,torch.bfloat16,torch.float4_e2m1fn_x2,torch.float4_e2m1fn_x2,QuantType.per_1x32,1,0,32,0,16.384,flydsl_moe1_afp4_wfp4_bf16_t32x64x256_w4,0.0%,8.4925,flydsl_moe2_afp4_wfp4_bf16_t32x128x256_atomic,0.1%,24.8765,0,0,5.06,64745.33,
256,8,4096,256,512,10,ActivationType.Silu,torch.bfloat16,torch.float4_e2m1fn_x2,torch.float4_e2m1fn_x2,QuantType.per_1x32,1,0,32,0,21.8503,flydsl_moe1_afp4_wfp4_bf16_t32x32x256_w3,0.0%,15.5857,flydsl_moe2_afp4_wfp4_bf16_t32x256x256_atomic,0.1%,37.436,0,0,13.44,43025.72,
256,16,4096,256,512,10,ActivationType.Silu,torch.bfloat16,torch.float4_e2m1fn_x2,torch.float4_e2m1fn_x2,QuantType.per_1x32,1,0,32,0,34.7981,flydsl_moe1_afp4_wfp4_bf16_t32x64x256_w2,0.0%,21.5978,flydsl_moe2_afp4_wfp4_bf16_t32x256x256_atomic,0.2%,56.3959,0,0,17.85,28562.53,
256,32,4096,256,512,10,ActivationType.Silu,torch.bfloat16,torch.float4_e2m1fn_x2,torch.float4_e2m1fn_x2,QuantType.per_1x32,1,0,32,0,50.2597,flydsl_moe1_afp4_wfp4_bf16_t32x64x256_w2,0.0%,31.5129,flydsl_moe2_afp4_wfp4_bf16_t16x128x256_atomic_persist_sbm32,0.1%,81.7726,0,0,24.62,19701.05,
256,64,4096,256,512,10,ActivationType.Silu,torch.bfloat16,torch.float4_e2m1fn_x2,torch.float4_e2m1fn_x2,QuantType.per_1x32,1,0,32,0,70.71889999999999,flydsl_moe1_afp4_wfp4_bf16_t32x64x256_w3,0.0%,43.8912,flydsl_moe2_afp4_wfp4_bf16_t32x128x256_atomic_bnt2,0.2%,114.6101,0,0,35.13,14059.84,
256,128,4096,256,512,10,ActivationType.Silu,torch.bfloat16,torch.float4_e2m1fn_x2,torch.float4_e2m1fn_x2,QuantType.per_1x32,1,0,32,0,87.4931,flydsl_moe1_afp4_wfp4_bf16_t32x32x256_w4,0.0%,53.1125,flydsl_moe2_afp4_wfp4_bf16_t16x256x256_atomic_bnt2_persist_sbm32,0.2%,140.6056,0,0,57.27,11466.01,
256,256,4096,256,512,10,ActivationType.Silu,torch.bfloat16,torch.float4_e2m1fn_x2,torch.float4_e2m1fn_x2,QuantType.per_1x32,1,0,32,0,95.837,flydsl_moe1_afp4_wfp4_bf16_t32x32x256_w4,0.0%,57.6025,flydsl_moe2_afp4_wfp4_bf16_t16x128x256_atomic_bnt2_sbm32,0.2%,153.4395,0,0,104.97,10517.23,
256,512,4096,256,512,10,ActivationType.Silu,torch.bfloat16,torch.float4_e2m1fn_x2,torch.float4_e2m1fn_x2,QuantType.per_1x32,1,0,32,0,99.6753,flydsl_moe1_afp4_wfp4_bf16_t32x32x256_w4,0.0%,60.7698,flydsl_moe2_afp4_wfp4_bf16_t16x128x256_atomic_bnt2_persist_sbm32,0.2%,160.4451,0,0,200.77,10077.62,
256,1024,4096,256,512,10,ActivationType.Silu,torch.bfloat16,torch.float4_e2m1fn_x2,torch.float4_e2m1fn_x2,QuantType.per_1x32,1,0,32,0,110.6725,flydsl_moe1_afp4_wfp4_bf16_t32x64x256_w3,0.0%,81.2088,flydsl_moe2_afp4_wfp4_bf16_t32x128x256_atomic_bnt2,0.2%,191.8813,0,0,335.75,8459.37,
256,2048,4096,256,512,10,ActivationType.Silu,torch.bfloat16,torch.float4_e2m1fn_x2,torch.float4_e2m1fn_x2,QuantType.per_1x32,1,0,64,0,119.997,flydsl_moe1_afp4_wfp4_bf16_t64x64x256_w4,0.0%,121.9695,flydsl_moe2_afp4_wfp4_bf16_t64x256x256_reduce_bnt2,0.0%,241.9665,0,0,532.51,6760.35,
256,4096,4096,256,512,10,ActivationType.Silu,torch.bfloat16,torch.float4_e2m1fn_x2,torch.float4_e2m1fn_x2,QuantType.per_1x32,1,0,64,0,149.0609,flydsl_moe1_afp4_wfp4_bf16_t64x128x256_w3_bnt0_xcd4,0.0%,201.2182,flydsl_moe2_afp4_wfp4_bf16_t64x256x256_reduce_persist,0.0%,350.2791,0,0,735.69,4741.77,
256,8192,4096,256,512,10,ActivationType.Silu,torch.bfloat16,torch.float4_e2m1fn_x2,torch.float4_e2m1fn_x2,QuantType.per_1x32,1,0,64,0,201.6767,flydsl_moe1_afp4_wfp4_bf16_t64x128x256_w2_bnt0_xcd4,0.0%,342.1527,flydsl_moe2_afp4_wfp4_bf16_t64x256x256_reduce_persist,0.0%,543.8294,0,0,947.72,3146.71,
256,16384,4096,256,512,10,ActivationType.Silu,torch.bfloat16,torch.float4_e2m1fn_x2,torch.float4_e2m1fn_x2,QuantType.per_1x32,1,0,64,0,321.84610000000004,flydsl_moe1_afp4_wfp4_bf16_t64x128x256_w2_bnt0_xcd4,0.0%,664.9736,flydsl_moe2_afp4_wfp4_bf16_t64x256x256_reduce_persist,0.0%,986.8197,0,0,1044.56,1836.14,
256,32768,4096,256,512,10,ActivationType.Silu,torch.bfloat16,torch.float4_e2m1fn_x2,torch.float4_e2m1fn_x2,QuantType.per_1x32,1,0,128,0,568.1335,flydsl_moe1_afp4_wfp4_bf16_t128x128x256_w2_bnt0_xcd4,0.0%,1325.2201,flydsl_moe2_afp4_wfp4_bf16_t64x256x256_reduce_sbm128,0.0%,1893.3536,0,0,1088.85,1063.33,
256,1,4096,256,512,10,ActivationType.Silu,torch.bfloat16,torch.float4_e2m1fn_x2,torch.float4_e2m1fn_x2,QuantType.per_1x32,1,0,32,0,16.5743,moe_ck2stages_gemm1_64x32x32x128_1x1_MulABScaleShuffled_v3_Nswizzle0_Quant3_MulRoutedWeight0_silu_FP4X2_FP4X2_B16,0.0,6.4429,moe_ck2stages_gemm2_256x32x128x128_1x4_MulABScaleExpertWeightShuffled_v3_Nswizzle0_Quant3_MulRoutedWeight1_FP4X2_FP4X2_B16,0.0012,23.0172,0,0,0.0,0.0,flydsl_fallback
256,16,4096,256,512,10,ActivationType.Silu,torch.bfloat16,torch.float4_e2m1fn_x2,torch.float4_e2m1fn_x2,QuantType.per_1x32,1,0,32,0,34.7981,moe_ck2stages_gemm1_64x32x32x128_1x1_MulABScaleShuffled_v3_Nswizzle0_Quant3_MulRoutedWeight0_silu_FP4X2_FP4X2_B16,0.0,22.7451,moe_ck2stages_gemm2_64x32x32x128_1x1_MulABScaleExpertWeightShuffled_v1_Nswizzle0_Quant3_MulRoutedWeight1_FP4X2_FP4X2_B16,0.0015,57.5432,0,0,0.0,0.0,flydsl_fallback
256,64,4096,256,512,10,ActivationType.Silu,torch.bfloat16,torch.float4_e2m1fn_x2,torch.float4_e2m1fn_x2,QuantType.per_1x32,1,0,32,0,77.97529999999999,moe_ck2stages_gemm1_64x32x32x128_1x1_MulABScaleShuffled_v3_Nswizzle0_Quant3_MulRoutedWeight0_silu_FP4X2_FP4X2_B16,0.0,43.8912,moe_ck2stages_gemm2_64x32x32x128_1x1_MulABScaleExpertWeightShuffled_v1_Nswizzle0_Quant3_MulRoutedWeight1_FP4X2_FP4X2_B16,0.0017,121.8665,0,0,0.0,0.0,flydsl_fallback
256,512,4096,256,512,10,ActivationType.Silu,torch.bfloat16,torch.float4_e2m1fn_x2,torch.float4_e2m1fn_x2,QuantType.per_1x32,1,0,32,0,109.7165,moe_ck2stages_gemm1_64x32x32x128_1x1_MulABScaleShuffled_v3_Nswizzle0_Quant3_MulRoutedWeight0_silu_FP4X2_FP4X2_B16,0.0,67.0832,moe_ck2stages_gemm2_64x32x32x128_1x1_MulABScaleExpertWeightShuffled_v1_Nswizzle0_Quant3_MulRoutedWeight1_FP4X2_FP4X2_B16,0.0017,176.7997,0,0,0.0,0.0,flydsl_fallback
256,1024,4096,256,512,10,ActivationType.Silu,torch.bfloat16,torch.float4_e2m1fn_x2,torch.float4_e2m1fn_x2,QuantType.per_1x32,1,0,32,0,116.02,moe_ck2stages_gemm1_64x32x32x128_1x1_MulABScaleShuffled_v3_Nswizzle0_Quant3_MulRoutedWeight0_silu_FP4X2_FP4X2_B16,0.0,84.338,moe_ck2stages_gemm2_64x32x32x128_1x1_MulABScaleExpertWeightShuffled_v1_Nswizzle0_Quant3_MulRoutedWeight1_FP4X2_FP4X2_B16,0.0016,200.358,0,0,0.0,0.0,flydsl_fallback
256,2048,4096,256,512,10,ActivationType.Silu,torch.bfloat16,torch.float4_e2m1fn_x2,torch.float4_e2m1fn_x2,QuantType.per_1x32,1,0,32,0,141.96210000000002,moe_ck2stages_gemm1_64x32x32x128_1x1_MulABScaleShuffled_v3_Nswizzle0_Quant3_MulRoutedWeight0_silu_FP4X2_FP4X2_B16,0.0,148.9518,moe_ck2stages_gemm2_64x32x32x128_1x1_MulABScaleExpertWeightShuffled_v1_Nswizzle0_Quant3_MulRoutedWeight1_FP4X2_FP4X2_B16,0.0017,290.9139,0,0,0.0,0.0,flydsl_fallback
256,4096,4096,256,512,10,ActivationType.Silu,torch.bfloat16,torch.float4_e2m1fn_x2,torch.float4_e2m1fn_x2,QuantType.per_1x32,1,0,128,0,157.3485,moe_ck2stages_gemm1_256x128x128x128_1x4_MulABScaleShuffled_v3_Nswizzle0_Quant3_MulRoutedWeight0_silu_FP4X2_FP4X2_B16,0.0,295.767,moe_ck2stages_gemm2_64x128x128x128_1x1_MulABScaleExpertWeightShuffled_v3_Nswizzle0_Quant3_MulRoutedWeight1_FP4X2_FP4X2_B16,0.0017,453.1155,0,0,0.0,0.0,flydsl_fallback
256,8192,4096,256,512,10,ActivationType.Silu,torch.bfloat16,torch.float4_e2m1fn_x2,torch.float4_e2m1fn_x2,QuantType.per_1x32,1,0,128,0,271.8116,moe_ck2stages_gemm1_256x128x128x128_1x4_MulABScaleShuffled_v3_Nswizzle0_Quant3_MulRoutedWeight0_silu_FP4X2_FP4X2_B16,0.0,548.1027,moe_ck2stages_gemm2_64x128x128x128_1x1_MulABScaleExpertWeightShuffled_v3_Nswizzle0_Quant3_MulRoutedWeight1_FP4X2_FP4X2_B16,0.0016,819.9143,0,0,0.0,0.0,flydsl_fallback
256,16384,4096,256,512,10,ActivationType.Silu,torch.bfloat16,torch.float4_e2m1fn_x2,torch.float4_e2m1fn_x2,QuantType.per_1x32,1,0,128,0,424.6578,moe_ck2stages_gemm1_256x128x128x128_1x4_MulABScaleShuffled_v3_Nswizzle0_Quant3_MulRoutedWeight0_silu_FP4X2_FP4X2_B16,0.0,1053.187,moe_ck2stages_gemm2_64x128x128x128_1x1_MulABScaleExpertWeightShuffled_v3_Nswizzle0_Quant3_MulRoutedWeight1_FP4X2_FP4X2_B16,0.0017,1477.8448,0,0,0.0,0.0,flydsl_fallback
256,32768,4096,256,512,10,ActivationType.Silu,torch.bfloat16,torch.float4_e2m1fn_x2,torch.float4_e2m1fn_x2,QuantType.per_1x32,1,0,128,0,667.0119,moe_ck2stages_gemm1_256x128x128x128_1x4_MulABScaleShuffled_v3_Nswizzle0_Quant3_MulRoutedWeight0_silu_FP4X2_FP4X2_B16,0.0,2099.58,moe_ck2stages_gemm2_64x128x128x128_1x1_MulABScaleExpertWeightShuffled_v3_Nswizzle0_Quant3_MulRoutedWeight1_FP4X2_FP4X2_B16,0.0017,2766.5919,0,0,0.0,0.0,flydsl_fallback
