aiter/configs/model_configs/qwen_image_edit_fp8_a8w8_bpreshuffle_tuned_gemm.csv
gfx,cu_num,M,N,K,q_dtype_w,libtype,kernelId,splitK,us,kernelName,tflops,bw,errRatio
gfx942,80,8192,12288,3072,torch.float8_e4m3fnuz,cktile,48,0,1307.1145,a8w8_bpreshuffle_cktile_0x0x8x4x1x0x0x0x0x2_64x256x128_1x4x1_16x16x64_default,473.16,202.16,0.0
gfx942,80,594,12288,3072,torch.float8_e4m3fnuz,ck,68,0,121.311,a8w8_bpreshuffle_256x128x192x128_16x16_16x16_8x32x1_8x32x1_1x32x1x8_8x8x1_2x1_intrawave_v3,369.67,446.55,0.0
gfx942,80,8192,3072,12288,torch.float8_e4m3fnuz,ck,68,0,1238.5819,a8w8_bpreshuffle_256x128x192x128_16x16_16x16_8x32x1_8x32x1_1x32x1x8_8x8x1_2x1_intrawave_v3,499.34,152.39,0.0
gfx942,80,594,3072,12288,torch.float8_e4m3fnuz,cktile,58,0,109.9673,a8w8_bpreshuffle_cktile_0x0x8x4x1x0x0x0x0x1_64x192x256_1x4x1_16x16x64_default,407.81,442.83,0.0
gfx942,80,8192,9216,3072,torch.float8_e4m3fnuz,cktile,54,0,1003.0568,a8w8_bpreshuffle_cktile_0x0x8x4x1x0x0x0x0x2_64x192x128_1x4x1_16x16x64_default,462.44,203.85,0.0
gfx942,80,594,9216,3072,torch.float8_e4m3fnuz,ck,68,0,91.124,a8w8_bpreshuffle_256x128x192x128_16x16_16x16_8x32x1_8x32x1_1x32x1x8_8x8x1_2x1_intrawave_v3,369.1,450.87,0.0
