aiter/ops/triton/configs/attn/MI300X-ATTN-QK-INT8-PER-BLOCK.json
{
  "small": {
    "BLOCK_SIZE_M": 32,
    "BLOCK_SIZE_N": 16,
    "num_warps": 2,
    "num_stages": 2,
    "waves_per_eu": 2
  },
  "medium_M32": {
    "BLOCK_SIZE_M": 32,
    "BLOCK_SIZE_N": 16,
    "num_warps": 2,
    "num_stages": 2,
    "waves_per_eu": 2
  },
  "medium_M64": {
    "BLOCK_SIZE_M": 64,
    "BLOCK_SIZE_N": 16,
    "num_warps": 2,
    "num_stages": 3,
    "waves_per_eu": 2
  },
  "medium_M128": {
    "BLOCK_SIZE_M": 128,
    "BLOCK_SIZE_N": 16,
    "num_warps": 2,
    "num_stages": 3,
    "waves_per_eu": 2
  },
  "any": {
    "BLOCK_SIZE_M": 64,
    "BLOCK_SIZE_N": 16,
    "num_warps": 2,
    "num_stages": 3,
    "waves_per_eu": 2
  }
}
