aiter/configs/aakif/aakif_backup/glm_tuned_main.csv
cu_num,token,model_dim,inter_dim,expert,topk,act_type,dtype,q_dtype_a,q_dtype_w,q_type,use_g1u1,doweight_stage1,block_m,ksplit,us1,kernelName1,err1,us2,kernelName2,err2,us,run_1stage,tflops,bw,_tag
256,1,5120,1536,40,8,ActivationType.Silu,torch.bfloat16,torch.float8_e4m3fn,torch.float8_e4m3fn,QuantType.per_Token,1,0,32,0,25.1805,moe_ck2stages_gemm1_256x32x64x256_1x4_TypeCast_v1_Nswizzle0_Quant2_MulRoutedWeight0_silu_F8_F8_B16,0.0%,19.351,moe_ck2stages_gemm2_256x32x128x256_1x4_TypeCast_v1_Nswizzle0_Quant2_MulRoutedWeight1_F8_F8_B16,3.9%,44.5315,0,8.48,21192.5,
256,2,5120,1536,40,8,ActivationType.Silu,torch.bfloat16,torch.float8_e4m3fn,torch.float8_e4m3fn,QuantType.per_Token,1,0,32,0,40.588,_ZN5aiter47fmoe_stage1_bf16_pertokenFp8_g1u1_32x64_4tg_pf3E,0.0%,28.2485,moe_ck2stages_gemm2_256x32x128x256_1x4_TypeCast_v1_Nswizzle0_Quant2_MulRoutedWeight1_F8_F8_B16,4.0%,68.8365,0,10.97,13710.01,
256,4,5120,1536,40,8,ActivationType.Silu,torch.bfloat16,torch.float8_e4m3fn,torch.float8_e4m3fn,QuantType.per_Token,1,0,32,0,101.1397,_ZN5aiter45fmoe_bf16_pertokenFp8_g1u1_vs_silu_1tg_32x192E,0.0%,0.0,,0.0%,101.1397,1,14.93,9331.45,
256,8,5120,1536,40,8,ActivationType.Silu,torch.bfloat16,torch.float8_e4m3fn,torch.float8_e4m3fn,QuantType.per_Token,1,0,32,0,137.4972,_ZN5aiter45fmoe_bf16_pertokenFp8_g1u1_vs_silu_1tg_32x256E,0.0%,0.0,,0.0%,137.4972,1,21.96,6864.44,
256,16,5120,1536,40,8,ActivationType.Silu,torch.bfloat16,torch.float8_e4m3fn,torch.float8_e4m3fn,QuantType.per_Token,1,0,32,0,158.9053,_ZN5aiter45fmoe_bf16_pertokenFp8_g1u1_vs_silu_1tg_32x256E,0.0%,0.0,,0.0%,158.9053,1,38.01,5940.42,
256,32,5120,1536,40,8,ActivationType.Silu,torch.bfloat16,torch.float8_e4m3fn,torch.float8_e4m3fn,QuantType.per_Token,1,0,32,0,168.1834,_ZN5aiter45fmoe_bf16_pertokenFp8_g1u1_vs_silu_1tg_32x256E,0.0%,0.0,,0.0%,168.1834,1,71.82,5614.17,
256,64,5120,1536,40,8,ActivationType.Silu,torch.bfloat16,torch.float8_e4m3fn,torch.float8_e4m3fn,QuantType.per_Token,1,0,32,0,170.094,_ZN5aiter48fmoe_bf16_pertokenFp8_g1u1_vs_silu_1tg_ps_32x256E,0.0%,0.0,,0.0%,170.094,1,142.03,5554.0,
256,128,5120,1536,40,8,ActivationType.Silu,torch.bfloat16,torch.float8_e4m3fn,torch.float8_e4m3fn,QuantType.per_Token,1,0,32,0,180.6616,_ZN5aiter48fmoe_bf16_pertokenFp8_g1u1_vs_silu_1tg_ps_32x384E,0.0%,0.0,,0.0%,180.6616,1,267.45,5234.56,
256,256,5120,1536,40,8,ActivationType.Silu,torch.bfloat16,torch.float8_e4m3fn,torch.float8_e4m3fn,QuantType.per_Token,1,0,64,0,114.9849,_ZN5aiter48fmoe_stage1_bf16_pertokenFp8_g1u1_64x128_2tg_pf3E,0.0%,95.4099,moe_ck2stages_gemm2_256x64x128x256_1x4_TypeCast_v1_Nswizzle0_Quant2_MulRoutedWeight1_F8_F8_B16,3.8%,210.3948,0,459.31,4504.15,
256,512,5120,1536,40,8,ActivationType.Silu,torch.bfloat16,torch.float8_e4m3fn,torch.float8_e4m3fn,QuantType.per_Token,1,0,128,0,128.6645,_ZN5aiter45fmoe_stage1_bf16_pertokenFp8_g1u1_128x128_pf3E,0.0%,139.9741,moe_ck2stages_gemm2_256x128x128x128_1x4_TypeCast_v3_Nswizzle0_Quant2_MulRoutedWeight1_F8_F8_B16,3.8%,268.6386,0,719.46,3542.24,
256,1024,5120,1536,40,8,ActivationType.Silu,torch.bfloat16,torch.float8_e4m3fn,torch.float8_e4m3fn,QuantType.per_Token,1,0,128,0,208.4949,moe_ck2stages_gemm1_256x128x64x128_1x4_TypeCast_v1_Nswizzle0_Quant2_MulRoutedWeight0_silu_F8_F8_B16,0.0%,216.8684,moe_ck2stages_gemm2_256x128x128x128_1x4_TypeCast_v1_Nswizzle0_Quant2_MulRoutedWeight1_F8_F8_B16,3.8%,425.3633,0,908.75,2255.59,
256,2048,5120,1536,40,8,ActivationType.Silu,torch.bfloat16,torch.float8_e4m3fn,torch.float8_e4m3fn,QuantType.per_Token,1,0,128,0,351.7191,moe_ck2stages_gemm1_256x128x64x128_1x4_TypeCast_v1_Nswizzle0_Quant2_MulRoutedWeight0_silu_F8_F8_B16,0.0%,350.557,moe_ck2stages_gemm2_256x128x128x128_1x4_TypeCast_v1_Nswizzle0_Quant2_MulRoutedWeight1_F8_F8_B16,3.7%,702.2761,0,1100.84,1388.59,
