aiter/configs/aakif/aakif_backup/minimax_gemm_tuned_p0.csv
cu_num,M,N,K,libtype,kernelId,splitK,us,kernelName,tflops,bw,errRatio
256,1,2048,3072,ck,8,0,10.5122,a8w8_blockscale_1x128x128_256x16x64x256_16x16_16x16_1x1_16x16x1_16x16x1_1x16x1x16_4_1x1_intrawave_v1,1.2,599.17,0.0
256,2,2048,3072,ck,8,0,10.4335,a8w8_blockscale_1x128x128_256x16x64x256_16x16_16x16_1x1_16x16x1_16x16x1_1x16x1x16_4_1x1_intrawave_v1,2.41,604.38,0.0
256,4,2048,3072,ck,8,0,10.4982,a8w8_blockscale_1x128x128_256x16x64x256_16x16_16x16_1x1_16x16x1_16x16x1_1x16x1x16_4_1x1_intrawave_v1,4.79,602.02,0.0
256,8,2048,3072,ck,8,0,10.5423,a8w8_blockscale_1x128x128_256x16x64x256_16x16_16x16_1x1_16x16x1_16x16x1_1x16x1x16_4_1x1_intrawave_v1,9.55,602.22,0.0
256,16,2048,3072,ck,8,0,10.1562,a8w8_blockscale_1x128x128_256x16x64x256_16x16_16x16_1x1_16x16x1_16x16x1_1x16x1x16_4_1x1_intrawave_v1,19.82,630.76,0.0
256,24,2048,3072,ck,8,0,10.697,a8w8_blockscale_1x128x128_256x16x64x256_16x16_16x16_1x1_16x16x1_16x16x1_1x16x1x16_4_1x1_intrawave_v1,28.23,604.23,0.0
256,32,2048,3072,ck,8,0,10.3874,a8w8_blockscale_1x128x128_256x16x64x256_16x16_16x16_1x1_16x16x1_16x16x1_1x16x1x16_4_1x1_intrawave_v1,38.76,627.76,0.0
256,40,2048,3072,ck,8,0,10.8044,a8w8_blockscale_1x128x128_256x16x64x256_16x16_16x16_1x1_16x16x1_16x16x1_1x16x1x16_4_1x1_intrawave_v1,46.58,608.84,0.0
256,48,2048,3072,ck,8,0,10.4124,a8w8_blockscale_1x128x128_256x16x64x256_16x16_16x16_1x1_16x16x1_16x16x1_1x16x1x16_4_1x1_intrawave_v1,58.01,637.27,0.0
256,56,2048,3072,ck,8,0,10.7012,a8w8_blockscale_1x128x128_256x16x64x256_16x16_16x16_1x1_16x16x1_16x16x1_1x16x1x16_4_1x1_intrawave_v1,65.85,625.43,0.0
256,64,2048,3072,ck,8,0,10.2343,a8w8_blockscale_1x128x128_256x16x64x256_16x16_16x16_1x1_16x16x1_16x16x1_1x16x1x16_4_1x1_intrawave_v1,78.69,659.57,0.0
256,72,2048,3072,ck,8,0,10.6515,a8w8_blockscale_1x128x128_256x16x64x256_16x16_16x16_1x1_16x16x1_16x16x1_1x16x1x16_4_1x1_intrawave_v1,85.06,639.12,0.0
256,80,2048,3072,ck,8,0,10.4435,a8w8_blockscale_1x128x128_256x16x64x256_16x16_16x16_1x1_16x16x1_16x16x1_1x16x1x16_4_1x1_intrawave_v1,96.39,657.34,0.0
256,88,2048,3072,ck,8,0,10.7175,a8w8_blockscale_1x128x128_256x16x64x256_16x16_16x16_1x1_16x16x1_16x16x1_1x16x1x16_4_1x1_intrawave_v1,103.32,645.88,0.0
256,96,2048,3072,ck,8,0,10.2242,a8w8_blockscale_1x128x128_256x16x64x256_16x16_16x16_1x1_16x16x1_16x16x1_1x16x1x16_4_1x1_intrawave_v1,118.15,682.65,0.0
256,104,2048,3072,ck,8,0,10.8273,a8w8_blockscale_1x128x128_256x16x64x256_16x16_16x16_1x1_16x16x1_16x16x1_1x16x1x16_4_1x1_intrawave_v1,120.86,649.92,0.0
256,112,2048,3072,ck,8,0,10.2282,a8w8_blockscale_1x128x128_256x16x64x256_16x16_16x16_1x1_16x16x1_16x16x1_1x16x1x16_4_1x1_intrawave_v1,137.78,693.6,0.0
256,120,2048,3072,ck,8,0,10.7575,a8w8_blockscale_1x128x128_256x16x64x256_16x16_16x16_1x1_16x16x1_16x16x1_1x16x1x16_4_1x1_intrawave_v1,140.36,664.8,0.0
256,128,2048,3072,ck,8,0,10.5461,a8w8_blockscale_1x128x128_256x16x64x256_16x16_16x16_1x1_16x16x1_16x16x1_1x16x1x16_4_1x1_intrawave_v1,152.72,683.57,0.0
256,136,2048,3072,ck,7,0,13.0608,a8w8_blockscale_1x128x128_256x16x128x256_16x16_16x16_1x2_16x16x1_16x16x1_1x16x1x16_8_1x2_intrawave_v1,131.02,556.34,0.0
256,144,2048,3072,ck,7,0,13.6059,a8w8_blockscale_1x128x128_256x16x128x256_16x16_16x16_1x2_16x16x1_16x16x1_1x16x1x16_8_1x2_intrawave_v1,133.17,538.27,0.0
256,152,2048,3072,ck,7,0,13.0915,a8w8_blockscale_1x128x128_256x16x128x256_16x16_16x16_1x2_16x16x1_16x16x1_1x16x1x16_8_1x2_intrawave_v1,146.09,563.8,0.0
256,160,2048,3072,ck,7,0,12.937,a8w8_blockscale_1x128x128_256x16x128x256_16x16_16x16_1x2_16x16x1_16x16x1_1x16x1x16_8_1x2_intrawave_v1,155.62,574.97,0.0
256,168,2048,3072,ck,7,0,13.2072,a8w8_blockscale_1x128x128_256x16x128x256_16x16_16x16_1x2_16x16x1_16x16x1_1x16x1x16_8_1x2_intrawave_v1,160.06,567.54,0.0
256,176,2048,3072,ck,7,0,12.9743,a8w8_blockscale_1x128x128_256x16x128x256_16x16_16x16_1x2_16x16x1_16x16x1_1x16x1x16_8_1x2_intrawave_v1,170.69,582.15,0.0
256,184,2048,3072,ck,7,0,13.3587,a8w8_blockscale_1x128x128_256x16x128x256_16x16_16x16_1x2_16x16x1_16x16x1_1x16x1x16_8_1x2_intrawave_v1,173.31,569.69,0.0
256,192,2048,3072,ck,18,0,12.9245,a8w8_blockscale_1x128x128_256x64x64x256_16x16_32x32_1x1_16x16x1_16x16x1_1x32x1x8_8_1x1_intrawave_v1,186.93,593.27,0.0
256,200,2048,3072,ck,7,0,13.3157,a8w8_blockscale_1x128x128_256x16x128x256_16x16_16x16_1x2_16x16x1_16x16x1_1x16x1x16_8_1x2_intrawave_v1,188.99,580.15,0.0
256,208,2048,3072,ck,7,0,13.0025,a8w8_blockscale_1x128x128_256x16x128x256_16x16_16x16_1x2_16x16x1_16x16x1_1x16x1x16_8_1x2_intrawave_v1,201.29,598.53,0.0
256,216,2048,3072,ck,7,0,13.3787,a8w8_blockscale_1x128x128_256x16x128x256_16x16_16x16_1x2_16x16x1_16x16x1_1x16x1x16_8_1x2_intrawave_v1,203.15,585.99,0.0
256,224,2048,3072,ck,7,0,13.1308,a8w8_blockscale_1x128x128_256x16x128x256_16x16_16x16_1x2_16x16x1_16x16x1_1x16x1x16_8_1x2_intrawave_v1,214.65,601.42,0.0
256,232,2048,3072,ck,7,0,13.4219,a8w8_blockscale_1x128x128_256x16x128x256_16x16_16x16_1x2_16x16x1_16x16x1_1x16x1x16_8_1x2_intrawave_v1,217.5,592.65,0.0
256,240,2048,3072,ck,7,0,13.0885,a8w8_blockscale_1x128x128_256x16x128x256_16x16_16x16_1x2_16x16x1_16x16x1_1x16x1x16_8_1x2_intrawave_v1,230.73,612.12,0.0
256,248,2048,3072,ck,7,0,13.424,a8w8_blockscale_1x128x128_256x16x128x256_16x16_16x16_1x2_16x16x1_16x16x1_1x16x1x16_8_1x2_intrawave_v1,232.46,601.1,0.0
256,256,2048,3072,ck,18,0,12.9524,a8w8_blockscale_1x128x128_256x64x64x256_16x16_32x32_1x1_16x16x1_16x16x1_1x32x1x8_8_1x1_intrawave_v1,248.7,627.41,0.0
256,272,2048,3072,ck,18,0,16.0834,a8w8_blockscale_1x128x128_256x64x64x256_16x16_32x32_1x1_16x16x1_16x16x1_1x32x1x8_8_1x1_intrawave_v1,212.8,512.4,0.0
256,288,2048,3072,ck,12,0,14.8066,a8w8_blockscale_1x128x128_256x32x128x256_16x16_32x32_1x1_16x16x1_16x16x1_1x32x1x8_8_1x1_intrawave_v1,244.75,564.33,0.0
256,304,2048,3072,ck,18,0,16.1275,a8w8_blockscale_1x128x128_256x64x64x256_16x16_32x32_1x1_16x16x1_16x16x1_1x32x1x8_8_1x1_intrawave_v1,237.19,525.22,0.0
256,320,2048,3072,ck,18,0,13.1464,a8w8_blockscale_1x128x128_256x64x64x256_16x16_32x32_1x1_16x16x1_16x16x1_1x32x1x8_8_1x1_intrawave_v1,306.28,653.05,0.0
256,336,2048,3072,ck,18,0,16.1342,a8w8_blockscale_1x128x128_256x64x64x256_16x16_32x32_1x1_16x16x1_16x16x1_1x32x1x8_8_1x1_intrawave_v1,262.04,539.22,0.0
256,352,2048,3072,ck,12,0,15.0536,a8w8_blockscale_1x128x128_256x32x128x256_16x16_32x32_1x1_16x16x1_16x16x1_1x32x1x8_8_1x1_intrawave_v1,294.23,585.55,0.0
256,368,2048,3072,ck,18,0,16.4404,a8w8_blockscale_1x128x128_256x64x64x256_16x16_32x32_1x1_16x16x1_16x16x1_1x32x1x8_8_1x1_intrawave_v1,281.65,543.13,0.0
256,384,2048,3072,ck,18,0,13.2147,a8w8_blockscale_1x128x128_256x64x64x256_16x16_32x32_1x1_16x16x1_16x16x1_1x32x1x8_8_1x1_intrawave_v1,365.64,684.39,0.0
256,400,2048,3072,ck,18,0,16.3974,a8w8_blockscale_1x128x128_256x64x64x256_16x16_32x32_1x1_16x16x1_16x16x1_1x32x1x8_8_1x1_intrawave_v1,306.95,558.54,0.0
256,416,2048,3072,ck,12,0,15.4123,a8w8_blockscale_1x128x128_256x32x128x256_16x16_32x32_1x1_16x16x1_16x16x1_1x32x1x8_8_1x1_intrawave_v1,339.63,601.68,0.0
256,432,2048,3072,ck,18,0,16.3884,a8w8_blockscale_1x128x128_256x64x64x256_16x16_32x32_1x1_16x16x1_16x16x1_1x32x1x8_8_1x1_intrawave_v1,331.69,572.85,0.0
256,448,2048,3072,ck,18,0,13.2871,a8w8_blockscale_1x128x128_256x64x64x256_16x16_32x32_1x1_16x16x1_16x16x1_1x32x1x8_8_1x1_intrawave_v1,424.26,715.18,0.0
256,464,2048,3072,ck,18,0,16.5719,a8w8_blockscale_1x128x128_256x64x64x256_16x16_32x32_1x1_16x16x1_16x16x1_1x32x1x8_8_1x1_intrawave_v1,352.31,580.34,0.0
256,480,2048,3072,ck,12,0,15.3773,a8w8_blockscale_1x128x128_256x32x128x256_16x16_32x32_1x1_16x16x1_16x16x1_1x32x1x8_8_1x1_intrawave_v1,392.77,632.89,0.0
256,496,2048,3072,ck,18,0,16.6435,a8w8_blockscale_1x128x128_256x64x64x256_16x16_32x32_1x1_16x16x1_16x16x1_1x32x1x8_8_1x1_intrawave_v1,374.99,591.63,0.0
256,512,2048,3072,ck,18,0,13.3872,a8w8_blockscale_1x128x128_256x64x64x256_16x16_32x32_1x1_16x16x1_16x16x1_1x32x1x8_8_1x1_intrawave_v1,481.24,744.1,0.0
256,1000,2048,3072,ck,2,0,21.2105,a8w8_blockscale_1x128x128_256x64x128x128_16x16_32x32_1x2_8x32x1_8x32x1_1x32x1x8_8_1x1_intrawave_v3,593.24,634.57,0.0
256,1001,2048,3072,ck,2,0,21.3604,a8w8_blockscale_1x128x128_256x64x128x128_16x16_32x32_1x2_8x32x1_8x32x1_1x32x1x8_8_1x1_intrawave_v3,589.67,630.45,0.0
256,1003,2048,3072,ck,2,0,21.367,a8w8_blockscale_1x128x128_256x64x128x128_16x16_32x32_1x2_8x32x1_8x32x1_1x32x1x8_8_1x1_intrawave_v3,590.66,630.92,0.0
256,3000,2048,3072,ck,0,0,42.5065,a8w8_blockscale_1x128x128_256x128x128x128_16x16_32x32_2x2_8x32x1_8x32x1_1x32x1x8_8_1x1_intrawave_v3,888.07,653.91,0.0
256,4000,2048,3072,ck,0,0,48.161,a8w8_blockscale_1x128x128_256x128x128x128_16x16_32x32_2x2_8x32x1_8x32x1_1x32x1x8_8_1x1_intrawave_v3,1045.07,725.97,0.0
256,52101,2048,3072,cktile,11,0,443.1568,a8w8_blockscale_cktile_192x256x128_4x2x1_16x16x128_intrawave_0x1x0_1,1479.35,856.92,0.0
256,53093,2048,3072,cktile,11,0,441.266,a8w8_blockscale_cktile_192x256x128_4x2x1_16x16x128_intrawave_0x1x0_1,1513.97,876.71,0.0
256,65536,2048,3072,cktile,11,0,539.268,a8w8_blockscale_cktile_192x256x128_4x2x1_16x16x128_intrawave_0x1x0_1,1529.17,882.78,0.0
256,1,3072,3072,ck,8,0,10.7555,a8w8_blockscale_1x128x128_256x16x64x256_16x16_16x16_1x1_16x16x1_16x16x1_1x16x1x16_4_1x1_intrawave_v1,1.75,878.29,0.0
256,1,3072,6144,ck,8,0,18.9025,a8w8_blockscale_1x128x128_256x16x64x256_16x16_16x16_1x1_16x16x1_16x16x1_1x16x1x16_4_1x1_intrawave_v1,2.0,999.16,0.0
256,2,3072,3072,ck,8,0,10.8543,a8w8_blockscale_1x128x128_256x16x64x256_16x16_16x16_1x1_16x16x1_16x16x1_1x16x1x16_4_1x1_intrawave_v1,3.48,871.14,0.0
256,2,3072,6144,ck,8,0,18.8527,a8w8_blockscale_1x128x128_256x16x64x256_16x16_16x16_1x1_16x16x1_16x16x1_1x16x1x16_4_1x1_intrawave_v1,4.0,1002.45,0.0
256,4,3072,3072,ck,8,0,10.7757,a8w8_blockscale_1x128x128_256x16x64x256_16x16_16x16_1x1_16x16x1_16x16x1_1x16x1x16_4_1x1_intrawave_v1,7.01,879.2,0.0
256,4,3072,6144,ck,8,0,19.0206,a8w8_blockscale_1x128x128_256x16x64x256_16x16_16x16_1x1_16x16x1_16x16x1_1x16x1x16_4_1x1_intrawave_v1,7.94,994.9,0.0
256,8,3072,3072,ck,8,0,10.7915,a8w8_blockscale_1x128x128_256x16x64x256_16x16_16x16_1x1_16x16x1_16x16x1_1x16x1x16_4_1x1_intrawave_v1,13.99,881.33,0.0
256,8,3072,6144,ck,8,0,19.0094,a8w8_blockscale_1x128x128_256x16x64x256_16x16_16x16_1x1_16x16x1_16x16x1_1x16x1x16_4_1x1_intrawave_v1,15.89,998.07,0.0
256,16,3072,3072,ck,8,0,10.4225,a8w8_blockscale_1x128x128_256x16x64x256_16x16_16x16_1x1_16x16x1_16x16x1_1x16x1x16_4_1x1_intrawave_v1,28.97,919.61,0.0
256,16,3072,6144,ck,8,0,18.243,a8w8_blockscale_1x128x128_256x16x64x256_16x16_16x16_1x1_16x16x1_16x16x1_1x16x1x16_4_1x1_intrawave_v1,33.11,1045.39,0.0
256,24,3072,3072,ck,8,0,11.0177,a8w8_blockscale_1x128x128_256x16x64x256_16x16_16x16_1x1_16x16x1_16x16x1_1x16x1x16_4_1x1_intrawave_v1,41.11,876.62,0.0
256,24,3072,6144,ck,8,0,19.1327,a8w8_blockscale_1x128x128_256x16x64x256_16x16_16x16_1x1_16x16x1_16x16x1_1x16x1x16_4_1x1_intrawave_v1,47.35,1001.91,0.0
256,32,3072,3072,ck,8,0,10.4957,a8w8_blockscale_1x128x128_256x16x64x256_16x16_16x16_1x1_16x16x1_16x16x1_1x16x1x16_4_1x1_intrawave_v1,57.55,927.25,0.0
256,32,3072,6144,ck,8,0,18.4052,a8w8_blockscale_1x128x128_256x16x64x256_16x16_16x16_1x1_16x16x1_16x16x1_1x16x1x16_4_1x1_intrawave_v1,65.63,1046.86,0.0
256,40,3072,3072,ck,8,0,10.8933,a8w8_blockscale_1x128x128_256x16x64x256_16x16_16x16_1x1_16x16x1_16x16x1_1x16x1x16_4_1x1_intrawave_v1,69.31,900.17,0.0
256,40,3072,6144,ck,8,0,19.087,a8w8_blockscale_1x128x128_256x16x64x256_16x16_16x16_1x1_16x16x1_16x16x1_1x16x1x16_4_1x1_intrawave_v1,79.11,1014.61,0.0
256,48,3072,3072,ck,8,0,10.6115,a8w8_blockscale_1x128x128_256x16x64x256_16x16_16x16_1x1_16x16x1_16x16x1_1x16x1x16_4_1x1_intrawave_v1,85.38,931.02,0.0
256,48,3072,6144,ck,8,0,18.4348,a8w8_blockscale_1x128x128_256x16x64x256_16x16_16x16_1x1_16x16x1_16x16x1_1x16x1x16_4_1x1_intrawave_v1,98.29,1055.84,0.0
256,56,3072,3072,ck,8,0,10.9787,a8w8_blockscale_1x128x128_256x16x64x256_16x16_16x16_1x1_16x16x1_16x16x1_1x16x1x16_4_1x1_intrawave_v1,96.27,906.6,0.0
256,56,3072,6144,ck,8,0,19.1676,a8w8_blockscale_1x128x128_256x16x64x256_16x16_16x16_1x1_16x16x1_16x16x1_1x16x1x16_4_1x1_intrawave_v1,110.29,1020.6,0.0
256,64,3072,3072,ck,8,0,10.6359,a8w8_blockscale_1x128x128_256x16x64x256_16x16_16x16_1x1_16x16x1_16x16x1_1x16x1x16_4_1x1_intrawave_v1,113.57,942.75,0.0
256,64,3072,6144,ck,8,0,18.3441,a8w8_blockscale_1x128x128_256x16x64x256_16x16_16x16_1x1_16x16x1_16x16x1_1x16x1x16_4_1x1_intrawave_v1,131.7,1071.78,0.0
256,72,3072,3072,ck,8,0,10.8581,a8w8_blockscale_1x128x128_256x16x64x256_16x16_16x16_1x1_16x16x1_16x16x1_1x16x1x16_4_1x1_intrawave_v1,125.16,930.25,0.0
256,72,3072,6144,ck,8,0,19.455,a8w8_blockscale_1x128x128_256x16x64x256_16x16_16x16_1x1_16x16x1_16x16x1_1x16x1x16_4_1x1_intrawave_v1,139.7,1015.63,0.0
256,80,3072,3072,ck,8,0,10.7395,a8w8_blockscale_1x128x128_256x16x64x256_16x16_16x16_1x1_16x16x1_16x16x1_1x16x1x16_4_1x1_intrawave_v1,140.6,947.39,0.0
256,80,3072,6144,ck,8,0,18.6511,a8w8_blockscale_1x128x128_256x16x64x256_16x16_16x16_1x1_16x16x1_16x16x1_1x16x1x16_4_1x1_intrawave_v1,161.92,1064.68,0.0
256,88,3072,3072,ck,7,0,13.3775,a8w8_blockscale_1x128x128_256x16x128x256_16x16_16x16_1x2_16x16x1_16x16x1_1x16x1x16_8_1x2_intrawave_v1,124.16,766.08,0.0
256,88,3072,6144,ck,7,0,23.5681,a8w8_blockscale_1x128x128_256x16x128x256_16x16_16x16_1x2_16x16x1_16x16x1_1x16x1x16_8_1x2_intrawave_v1,140.95,846.73,0.0
256,96,3072,3072,ck,7,0,13.0689,a8w8_blockscale_1x128x128_256x16x128x256_16x16_16x16_1x2_16x16x1_16x16x1_1x16x1x16_8_1x2_intrawave_v1,138.65,789.81,0.0
256,96,3072,6144,ck,7,0,23.4096,a8w8_blockscale_1x128x128_256x16x128x256_16x16_16x16_1x2_16x16x1_16x16x1_1x16x1x16_8_1x2_intrawave_v1,154.8,856.66,0.0
256,104,3072,3072,ck,7,0,13.3437,a8w8_blockscale_1x128x128_256x16x128x256_16x16_16x16_1x2_16x16x1_16x16x1_1x16x1x16_8_1x2_intrawave_v1,147.11,779.07,0.0
256,104,3072,6144,ck,7,0,23.6091,a8w8_blockscale_1x128x128_256x16x128x256_16x16_16x16_1x2_16x16x1_16x16x1_1x16x1x16_8_1x2_intrawave_v1,166.29,853.58,0.0
256,112,3072,3072,ck,7,0,13.1292,a8w8_blockscale_1x128x128_256x16x128x256_16x16_16x16_1x2_16x16x1_16x16x1_1x16x1x16_8_1x2_intrawave_v1,161.01,797.41,0.0
256,112,3072,6144,ck,7,0,23.2973,a8w8_blockscale_1x128x128_256x16x128x256_16x16_16x16_1x2_16x16x1_16x16x1_1x16x1x16_8_1x2_intrawave_v1,181.47,869.23,0.0
256,120,3072,3072,ck,7,0,13.3032,a8w8_blockscale_1x128x128_256x16x128x256_16x16_16x16_1x2_16x16x1_16x16x1_1x16x1x16_8_1x2_intrawave_v1,170.25,792.52,0.0
256,120,3072,6144,ck,7,0,23.7067,a8w8_blockscale_1x128x128_256x16x128x256_16x16_16x16_1x2_16x16x1_16x16x1_1x16x1x16_8_1x2_intrawave_v1,191.08,858.36,0.0
256,128,3072,3072,ck,18,0,13.1293,a8w8_blockscale_1x128x128_256x64x64x256_16x16_32x32_1x1_16x16x1_16x16x1_1x32x1x8_8_1x1_intrawave_v1,184.01,808.64,0.0
256,128,3072,6144,ck,18,0,22.7558,a8w8_blockscale_1x128x128_256x64x64x256_16x16_32x32_1x1_16x16x1_16x16x1_1x32x1x8_8_1x1_intrawave_v1,212.33,898.55,0.0
256,136,3072,3072,ck,7,0,13.1379,a8w8_blockscale_1x128x128_256x16x128x256_16x16_16x16_1x2_16x16x1_16x16x1_1x16x1x16_8_1x2_intrawave_v1,195.38,813.72,0.0
256,136,3072,6144,ck,7,0,23.9079,a8w8_blockscale_1x128x128_256x16x128x256_16x16_16x16_1x2_16x16x1_16x16x1_1x16x1x16_8_1x2_intrawave_v1,214.73,859.36,0.0
256,144,3072,3072,ck,7,0,13.3715,a8w8_blockscale_1x128x128_256x16x128x256_16x16_16x16_1x2_16x16x1_16x16x1_1x16x1x16_8_1x2_intrawave_v1,203.26,805.02,0.0
256,144,3072,6144,ck,7,0,23.6636,a8w8_blockscale_1x128x128_256x16x128x256_16x16_16x16_1x2_16x16x1_16x16x1_1x16x1x16_8_1x2_intrawave_v1,229.71,872.39,0.0
256,152,3072,3072,ck,7,0,13.582,a8w8_blockscale_1x128x128_256x16x128x256_16x16_16x16_1x2_16x16x1_16x16x1_1x16x1x16_8_1x2_intrawave_v1,211.23,797.97,0.0
256,152,3072,6144,ck,7,0,24.1523,a8w8_blockscale_1x128x128_256x16x128x256_16x16_16x16_1x2_16x16x1_16x16x1_1x16x1x16_8_1x2_intrawave_v1,237.57,858.81,0.0
256,160,3072,3072,ck,7,0,13.0524,a8w8_blockscale_1x128x128_256x16x128x256_16x16_16x16_1x2_16x16x1_16x16x1_1x16x1x16_8_1x2_intrawave_v1,231.37,836.0,0.0
256,160,3072,6144,ck,7,0,23.5824,a8w8_blockscale_1x128x128_256x16x128x256_16x16_16x16_1x2_16x16x1_16x16x1_1x16x1x16_8_1x2_intrawave_v1,256.11,883.73,0.0
256,168,3072,3072,ck,18,0,16.1149,a8w8_blockscale_1x128x128_256x64x64x256_16x16_32x32_1x1_16x16x1_16x16x1_1x32x1x8_8_1x1_intrawave_v1,196.77,681.7,0.0
256,168,3072,6144,ck,12,0,28.7461,a8w8_blockscale_1x128x128_256x32x128x256_16x16_32x32_1x1_16x16x1_16x16x1_1x32x1x8_8_1x1_intrawave_v1,220.61,728.4,0.0
256,176,3072,3072,ck,18,0,15.8608,a8w8_blockscale_1x128x128_256x64x64x256_16x16_32x32_1x1_16x16x1_16x16x1_1x32x1x8_8_1x1_intrawave_v1,209.44,697.27,0.0
256,176,3072,6144,ck,18,0,28.4221,a8w8_blockscale_1x128x128_256x64x64x256_16x16_32x32_1x1_16x16x1_16x16x1_1x32x1x8_8_1x1_intrawave_v1,233.75,740.17,0.0
256,184,3072,3072,ck,18,0,15.94,a8w8_blockscale_1x128x128_256x64x64x256_16x16_32x32_1x1_16x16x1_16x16x1_1x32x1x8_8_1x1_intrawave_v1,217.87,698.43,0.0
256,184,3072,6144,ck,12,0,28.9783,a8w8_blockscale_1x128x128_256x32x128x256_16x16_32x32_1x1_16x16x1_16x16x1_1x32x1x8_8_1x1_intrawave_v1,239.69,729.35,0.0
256,192,3072,3072,ck,18,0,13.0781,a8w8_blockscale_1x128x128_256x64x64x256_16x16_32x32_1x1_16x16x1_16x16x1_1x32x1x8_8_1x1_intrawave_v1,277.1,856.9,0.0
256,192,3072,6144,ck,18,0,22.9471,a8w8_blockscale_1x128x128_256x64x64x256_16x16_32x32_1x1_16x16x1_16x16x1_1x32x1x8_8_1x1_intrawave_v1,315.85,925.33,0.0
256,200,3072,3072,ck,18,0,16.3587,a8w8_blockscale_1x128x128_256x64x64x256_16x16_32x32_1x1_16x16x1_16x16x1_1x32x1x8_8_1x1_intrawave_v1,230.76,689.56,0.0
256,200,3072,6144,ck,12,0,29.0652,a8w8_blockscale_1x128x128_256x32x128x256_16x16_32x32_1x1_16x16x1_16x16x1_1x32x1x8_8_1x1_intrawave_v1,259.75,733.94,0.0
256,208,3072,3072,ck,18,0,16.2472,a8w8_blockscale_1x128x128_256x64x64x256_16x16_32x32_1x1_16x16x1_16x16x1_1x32x1x8_8_1x1_intrawave_v1,241.63,698.83,0.0
256,208,3072,6144,ck,12,0,28.9579,a8w8_blockscale_1x128x128_256x32x128x256_16x16_32x32_1x1_16x16x1_16x16x1_1x32x1x8_8_1x1_intrawave_v1,271.14,740.05,0.0
256,216,3072,3072,ck,18,0,16.4168,a8w8_blockscale_1x128x128_256x64x64x256_16x16_32x32_1x1_16x16x1_16x16x1_1x32x1x8_8_1x1_intrawave_v1,248.33,696.11,0.0
256,216,3072,6144,ck,12,0,28.8422,a8w8_blockscale_1x128x128_256x32x128x256_16x16_32x32_1x1_16x16x1_16x16x1_1x32x1x8_8_1x1_intrawave_v1,282.7,746.43,0.0
256,224,3072,3072,ck,12,0,14.9713,a8w8_blockscale_1x128x128_256x32x128x256_16x16_32x32_1x1_16x16x1_16x16x1_1x32x1x8_8_1x1_intrawave_v1,282.4,768.24,0.0
256,224,3072,6144,ck,12,0,26.4566,a8w8_blockscale_1x128x128_256x32x128x256_16x16_32x32_1x1_16x16x1_16x16x1_1x32x1x8_8_1x1_intrawave_v1,319.61,817.45,0.0
256,232,3072,3072,ck,18,0,16.24,a8w8_blockscale_1x128x128_256x64x64x256_16x16_32x32_1x1_16x16x1_16x16x1_1x32x1x8_8_1x1_intrawave_v1,269.63,712.76,0.0
256,232,3072,6144,ck,12,0,29.1757,a8w8_blockscale_1x128x128_256x32x128x256_16x16_32x32_1x1_16x16x1_16x16x1_1x32x1x8_8_1x1_intrawave_v1,300.17,744.63,0.0
256,240,3072,3072,ck,18,0,16.2345,a8w8_blockscale_1x128x128_256x64x64x256_16x16_32x32_1x1_16x16x1_16x16x1_1x32x1x8_8_1x1_intrawave_v1,279.03,717.55,0.0
256,240,3072,6144,ck,18,0,28.8632,a8w8_blockscale_1x128x128_256x64x64x256_16x16_32x32_1x1_16x16x1_16x16x1_1x32x1x8_8_1x1_intrawave_v1,313.88,756.1,0.0
256,248,3072,3072,ck,18,0,16.436,a8w8_blockscale_1x128x128_256x64x64x256_16x16_32x32_1x1_16x16x1_16x16x1_1x32x1x8_8_1x1_intrawave_v1,284.79,713.24,0.0
256,248,3072,6144,ck,12,0,29.1783,a8w8_blockscale_1x128x128_256x32x128x256_16x16_32x32_1x1_16x16x1_16x16x1_1x32x1x8_8_1x1_intrawave_v1,320.84,751.3,0.0
256,256,3072,3072,ck,18,0,13.2829,a8w8_blockscale_1x128x128_256x64x64x256_16x16_32x32_1x1_16x16x1_16x16x1_1x32x1x8_8_1x1_intrawave_v1,363.76,888.1,0.0
256,256,3072,6144,ck,18,0,23.0734,a8w8_blockscale_1x128x128_256x64x64x256_16x16_32x32_1x1_16x16x1_16x16x1_1x32x1x8_8_1x1_intrawave_v1,418.82,954.35,0.0
256,272,3072,3072,ck,18,0,16.5583,a8w8_blockscale_1x128x128_256x64x64x256_16x16_32x32_1x1_16x16x1_16x16x1_1x32x1x8_8_1x1_intrawave_v1,310.05,721.33,0.0
256,272,3072,6144,ck,12,0,29.6713,a8w8_blockscale_1x128x128_256x32x128x256_16x16_32x32_1x1_16x16x1_16x16x1_1x32x1x8_8_1x1_intrawave_v1,346.05,748.76,0.0
256,288,3072,3072,ck,12,0,15.2889,a8w8_blockscale_1x128x128_256x32x128x256_16x16_32x32_1x1_16x16x1_16x16x1_1x32x1x8_8_1x1_intrawave_v1,355.54,790.86,0.0
256,288,3072,6144,ck,12,0,26.7134,a8w8_blockscale_1x128x128_256x32x128x256_16x16_32x32_1x1_16x16x1_16x16x1_1x32x1x8_8_1x1_intrawave_v1,406.97,839.03,0.0
256,304,3072,3072,ck,18,0,16.5787,a8w8_blockscale_1x128x128_256x64x64x256_16x16_32x32_1x1_16x16x1_16x16x1_1x32x1x8_8_1x1_intrawave_v1,346.1,738.23,0.0
256,304,3072,6144,ck,12,0,29.7284,a8w8_blockscale_1x128x128_256x32x128x256_16x16_32x32_1x1_16x16x1_16x16x1_1x32x1x8_8_1x1_intrawave_v1,386.02,760.55,0.0
256,320,3072,3072,ck,18,0,13.3394,a8w8_blockscale_1x128x128_256x64x64x256_16x16_32x32_1x1_16x16x1_16x16x1_1x32x1x8_8_1x1_intrawave_v1,452.78,928.55,0.0
256,320,3072,6144,ck,18,0,23.4686,a8w8_blockscale_1x128x128_256x64x64x256_16x16_32x32_1x1_16x16x1_16x16x1_1x32x1x8_8_1x1_intrawave_v1,514.71,971.79,0.0
256,336,3072,3072,ck,2,0,20.8448,a8w8_blockscale_1x128x128_256x64x128x128_16x16_32x32_1x2_8x32x1_8x32x1_1x32x1x8_8_1x1_intrawave_v3,304.24,601.29,0.0
256,336,3072,6144,ck,2,0,36.4088,a8w8_blockscale_1x128x128_256x64x128x128_16x16_32x32_1x2_8x32x1_8x32x1_1x32x1x8_8_1x1_intrawave_v3,348.37,631.8,0.0
256,352,3072,3072,ck,2,0,20.8888,a8w8_blockscale_1x128x128_256x64x128x128_16x16_32x32_1x2_8x32x1_8x32x1_1x32x1x8_8_1x1_intrawave_v3,318.05,607.08,0.0
256,352,3072,6144,ck,2,0,36.6041,a8w8_blockscale_1x128x128_256x64x128x128_16x16_32x32_1x2_8x32x1_8x32x1_1x32x1x8_8_1x1_intrawave_v3,363.01,633.8,0.0
256,368,3072,3072,ck,2,0,21.0186,a8w8_blockscale_1x128x128_256x64x128x128_16x16_32x32_1x2_8x32x1_8x32x1_1x32x1x8_8_1x1_intrawave_v3,330.46,610.35,0.0
256,368,3072,6144,ck,2,0,36.6506,a8w8_blockscale_1x128x128_256x64x128x128_16x16_32x32_1x2_8x32x1_8x32x1_1x32x1x8_8_1x1_intrawave_v3,379.03,638.36,0.0
256,384,3072,3072,ck,3,0,20.4624,a8w8_blockscale_1x128x128_256x64x64x128_16x16_32x32_1x1_8x32x1_8x32x1_1x32x1x8_8_1x1_intrawave_v3,354.2,634.14,0.0
256,384,3072,6144,ck,3,0,35.9244,a8w8_blockscale_1x128x128_256x64x64x128_16x16_32x32_1x1_8x32x1_8x32x1_1x32x1x8_8_1x1_intrawave_v3,403.5,656.74,0.0
256,400,3072,3072,ck,2,0,20.7097,a8w8_blockscale_1x128x128_256x64x128x128_16x16_32x32_1x2_8x32x1_8x32x1_1x32x1x8_8_1x1_intrawave_v3,364.55,633.69,0.0
256,400,3072,6144,ck,2,0,36.2548,a8w8_blockscale_1x128x128_256x64x128x128_16x16_32x32_1x2_8x32x1_8x32x1_1x32x1x8_8_1x1_intrawave_v3,416.48,656.18,0.0
256,416,3072,3072,ck,2,0,20.888,a8w8_blockscale_1x128x128_256x64x128x128_16x16_32x32_1x2_8x32x1_8x32x1_1x32x1x8_8_1x1_intrawave_v3,375.9,635.34,0.0
256,416,3072,6144,ck,2,0,36.5758,a8w8_blockscale_1x128x128_256x64x128x128_16x16_32x32_1x2_8x32x1_8x32x1_1x32x1x8_8_1x1_intrawave_v3,429.34,655.79,0.0
256,432,3072,3072,ck,2,0,21.3814,a8w8_blockscale_1x128x128_256x64x128x128_16x16_32x32_1x2_8x32x1_8x32x1_1x32x1x8_8_1x1_intrawave_v3,381.35,627.58,0.0
256,432,3072,6144,ck,2,0,36.6708,a8w8_blockscale_1x128x128_256x64x128x128_16x16_32x32_1x2_8x32x1_8x32x1_1x32x1x8_8_1x1_intrawave_v3,444.7,659.46,0.0
256,448,3072,3072,ck,2,0,20.815,a8w8_blockscale_1x128x128_256x64x128x128_16x16_32x32_1x2_8x32x1_8x32x1_1x32x1x8_8_1x1_intrawave_v3,406.23,651.74,0.0
256,448,3072,6144,ck,2,0,36.1547,a8w8_blockscale_1x128x128_256x64x128x128_16x16_32x32_1x2_8x32x1_8x32x1_1x32x1x8_8_1x1_intrawave_v3,467.75,674.31,0.0
256,464,3072,3072,ck,2,0,20.4609,a8w8_blockscale_1x128x128_256x64x128x128_16x16_32x32_1x2_8x32x1_8x32x1_1x32x1x8_8_1x1_intrawave_v3,428.02,670.23,0.0
256,464,3072,6144,ck,2,0,36.2667,a8w8_blockscale_1x128x128_256x64x128x128_16x16_32x32_1x2_8x32x1_8x32x1_1x32x1x8_8_1x1_intrawave_v3,482.96,677.65,0.0
256,480,3072,3072,ck,2,0,20.8742,a8w8_blockscale_1x128x128_256x64x128x128_16x16_32x32_1x2_8x32x1_8x32x1_1x32x1x8_8_1x1_intrawave_v3,434.01,664.02,0.0
256,480,3072,6144,ck,2,0,36.1302,a8w8_blockscale_1x128x128_256x64x128x128_16x16_32x32_1x2_8x32x1_8x32x1_1x32x1x8_8_1x1_intrawave_v3,501.5,685.65,0.0
256,496,3072,3072,ck,2,0,21.0093,a8w8_blockscale_1x128x128_256x64x128x128_16x16_32x32_1x2_8x32x1_8x32x1_1x32x1x8_8_1x1_intrawave_v3,445.6,666.77,0.0
256,496,3072,6144,ck,2,0,36.166,a8w8_blockscale_1x128x128_256x64x128x128_16x16_32x32_1x2_8x32x1_8x32x1_1x32x1x8_8_1x1_intrawave_v3,517.71,690.41,0.0
256,512,3072,3072,ck,2,0,20.6467,a8w8_blockscale_1x128x128_256x64x128x128_16x16_32x32_1x2_8x32x1_8x32x1_1x32x1x8_8_1x1_intrawave_v3,468.05,685.62,0.0
256,512,3072,6144,ck,2,0,36.0618,a8w8_blockscale_1x128x128_256x64x128x128_16x16_32x32_1x2_8x32x1_8x32x1_1x32x1x8_8_1x1_intrawave_v3,535.95,697.85,0.0
256,1000,3072,3072,ck,0,0,27.3036,a8w8_blockscale_1x128x128_256x128x128x128_16x16_32x32_2x2_8x32x1_8x32x1_1x32x1x8_8_1x1_intrawave_v3,691.28,683.18,0.0
256,1000,3072,6144,ck,0,0,47.25,a8w8_blockscale_1x128x128_256x128x128x128_16x16_32x32_2x2_8x32x1_8x32x1_1x32x1x8_8_1x1_intrawave_v3,798.92,659.52,0.0
256,1001,3072,3072,ck,0,0,27.312,a8w8_blockscale_1x128x128_256x128x128x128_16x16_32x32_2x2_8x32x1_8x32x1_1x32x1x8_8_1x1_intrawave_v3,691.76,683.3,0.0
256,1001,3072,6144,ck,0,0,47.094,a8w8_blockscale_1x128x128_256x128x128x128_16x16_32x32_2x2_8x32x1_8x32x1_1x32x1x8_8_1x1_intrawave_v3,802.36,661.97,0.0
256,1169,3072,6144,ck,0,0,49.1286,a8w8_blockscale_1x128x128_256x128x128x128_16x16_32x32_2x2_8x32x1_8x32x1_1x32x1x8_8_1x1_intrawave_v3,898.22,676.57,0.0
256,1192,3072,6144,ck,0,0,48.9109,a8w8_blockscale_1x128x128_256x128x128x128_16x16_32x32_2x2_8x32x1_8x32x1_1x32x1x8_8_1x1_intrawave_v3,919.97,685.36,0.0
256,1200,3072,6144,ck,0,0,48.339,a8w8_blockscale_1x128x128_256x128x128x128_16x16_32x32_2x2_8x32x1_8x32x1_1x32x1x8_8_1x1_intrawave_v3,937.1,695.5,0.0
256,1202,3072,6144,ck,0,0,48.777,a8w8_blockscale_1x128x128_256x128x128x128_16x16_32x32_2x2_8x32x1_8x32x1_1x32x1x8_8_1x1_intrawave_v3,930.23,689.76,0.0
256,1205,3072,6144,ck,0,0,49.011,a8w8_blockscale_1x128x128_256x128x128x128_16x16_32x32_2x2_8x32x1_8x32x1_1x32x1x8_8_1x1_intrawave_v3,928.1,687.22,0.0
256,1216,3072,6144,ck,0,0,48.5431,a8w8_blockscale_1x128x128_256x128x128x128_16x16_32x32_2x2_8x32x1_8x32x1_1x32x1x8_8_1x1_intrawave_v3,945.6,696.63,0.0
256,1263,3072,6144,ck,0,0,49.8342,a8w8_blockscale_1x128x128_256x128x128x128_16x16_32x32_2x2_8x32x1_8x32x1_1x32x1x8_8_1x1_intrawave_v3,956.71,690.17,0.0
256,2000,3072,3072,ck,0,0,43.8118,a8w8_blockscale_1x128x128_256x128x128x128_16x16_32x32_2x2_8x32x1_8x32x1_1x32x1x8_8_1x1_intrawave_v3,861.61,636.11,0.0
256,2002,3072,3072,ck,2,0,43.3422,a8w8_blockscale_1x128x128_256x64x128x128_16x16_32x32_1x2_8x32x1_8x32x1_1x32x1x8_8_1x1_intrawave_v3,871.82,643.43,0.0
256,2197,3072,6144,ck,0,0,79.3641,a8w8_blockscale_1x128x128_256x128x128x128_16x16_32x32_2x2_8x32x1_8x32x1_1x32x1x8_8_1x1_intrawave_v3,1044.98,577.98,0.0
256,2200,3072,6144,ck,0,0,79.0033,a8w8_blockscale_1x128x128_256x128x128x128_16x16_32x32_2x2_8x32x1_8x32x1_1x32x1x8_8_1x1_intrawave_v3,1051.19,581.09,0.0
256,2202,3072,6144,ck,0,0,79.1084,a8w8_blockscale_1x128x128_256x128x128x128_16x16_32x32_2x2_8x32x1_8x32x1_1x32x1x8_8_1x1_intrawave_v3,1050.74,580.63,0.0
256,2204,3072,6144,ck,0,0,79.4309,a8w8_blockscale_1x128x128_256x128x128x128_16x16_32x32_2x2_8x32x1_8x32x1_1x32x1x8_8_1x1_intrawave_v3,1047.43,578.58,0.0
256,2216,3072,6144,ck,0,0,77.7874,a8w8_blockscale_1x128x128_256x128x128x128_16x16_32x32_2x2_8x32x1_8x32x1_1x32x1x8_8_1x1_intrawave_v3,1075.38,592.7,0.0
256,2230,3072,6144,ck,0,0,78.278,a8w8_blockscale_1x128x128_256x128x128x128_16x16_32x32_2x2_8x32x1_8x32x1_1x32x1x8_8_1x1_intrawave_v3,1075.39,591.18,0.0
256,3201,3072,6144,cktile,11,0,85.3486,a8w8_blockscale_cktile_192x256x128_4x2x1_16x16x128_intrawave_0x1x0_1,1415.77,682.01,0.0
256,3225,3072,6144,cktile,11,0,84.9423,a8w8_blockscale_cktile_192x256x128_4x2x1_16x16x128_intrawave_0x1x0_1,1433.2,688.74,0.0
256,3227,3072,6144,cktile,11,0,86.564,a8w8_blockscale_cktile_192x256x128_4x2x1_16x16x128_intrawave_0x1x0_1,1407.23,676.12,0.0
256,3242,3072,6144,cktile,11,0,86.1208,a8w8_blockscale_cktile_192x256x128_4x2x1_16x16x128_intrawave_0x1x0_1,1421.04,681.74,0.0
256,4000,3072,3072,cktile,11,0,55.4713,a8w8_blockscale_cktile_192x256x128_4x2x1_16x16x128_intrawave_0x1x0_1,1361.02,834.69,0.0
256,4000,3072,6144,cktile,11,0,91.1795,a8w8_blockscale_cktile_192x256x128_4x2x1_16x16x128_intrawave_0x1x0_1,1656.02,746.07,0.0
256,4197,3072,6144,cktile,11,0,144.5905,a8w8_blockscale_cktile_192x256x128_4x2x1_16x16x128_intrawave_0x1x0_1,1095.73,487.22,0.0
256,4219,3072,6144,cktile,11,0,143.3167,a8w8_blockscale_cktile_192x256x128_4x2x1_16x16x128_intrawave_0x1x0_1,1111.26,493.43,0.0
256,4223,3072,6144,cktile,11,0,143.9971,a8w8_blockscale_cktile_192x256x128_4x2x1_16x16x128_intrawave_0x1x0_1,1107.06,491.44,0.0
256,4250,3072,6144,cktile,11,0,147.0776,a8w8_blockscale_cktile_192x256x128_4x2x1_16x16x128_intrawave_0x1x0_1,1090.8,483.41,0.0
256,5197,3072,6144,ck,0,0,154.8079,a8w8_blockscale_1x128x128_256x128x128x128_16x16_32x32_2x2_8x32x1_8x32x1_1x32x1x8_8_1x1_intrawave_v3,1267.25,534.44,0.0
256,6792,3072,6144,cktile,11,0,166.5247,a8w8_blockscale_cktile_192x256x128_4x2x1_16x16x128_intrawave_0x1x0_1,1539.65,614.53,0.0
256,6830,3072,6144,cktile,11,0,167.4903,a8w8_blockscale_cktile_192x256x128_4x2x1_16x16x128_intrawave_0x1x0_1,1539.34,613.78,0.0
256,7001,3072,6144,cktile,11,0,168.1281,a8w8_blockscale_cktile_192x256x128_4x2x1_16x16x128_intrawave_0x1x0_1,1571.89,623.94,0.0
256,7787,3072,6144,cktile,11,0,169.3066,a8w8_blockscale_cktile_192x256x128_4x2x1_16x16x128_intrawave_0x1x0_1,1736.2,676.65,0.0
256,11001,3072,3072,cktile,11,0,149.4813,a8w8_blockscale_cktile_192x256x128_4x2x1_16x16x128_intrawave_0x1x0_1,1389.05,741.38,0.0
256,11636,3072,6144,cktile,11,0,245.6315,a8w8_blockscale_cktile_192x256x128_4x2x1_16x16x128_intrawave_0x1x0_1,1788.22,658.94,0.0
256,12909,3072,3072,cktile,11,0,190.0779,a8w8_blockscale_cktile_192x256x128_4x2x1_16x16x128_intrawave_0x1x0_1,1281.84,675.55,0.0
256,30553,3072,3072,cktile,11,0,384.4911,a8w8_blockscale_cktile_192x256x128_4x2x1_16x16x128_intrawave_0x1x0_1,1499.82,756.88,0.0
256,30743,3072,6144,cktile,11,0,632.8135,a8w8_blockscale_cktile_192x256x128_4x2x1_16x16x128_intrawave_0x1x0_1,1833.89,626.8,0.0
256,31097,3072,6144,cktile,11,0,649.8193,a8w8_blockscale_cktile_192x256x128_4x2x1_16x16x128_intrawave_0x1x0_1,1806.46,617.09,0.0
256,32065,3072,6144,cktile,11,0,644.4692,a8w8_blockscale_cktile_192x256x128_4x2x1_16x16x128_intrawave_0x1x0_1,1878.16,640.67,0.0
256,35092,3072,6144,cktile,11,0,731.1416,a8w8_blockscale_cktile_192x256x128_4x2x1_16x16x128_intrawave_0x1x0_1,1811.79,615.59,0.0
256,39088,3072,6144,cktile,11,0,799.3541,a8w8_blockscale_cktile_192x256x128_4x2x1_16x16x128_intrawave_0x1x0_1,1845.89,624.49,0.0
256,42723,3072,6144,cktile,11,0,882.3617,a8w8_blockscale_cktile_192x256x128_4x2x1_16x16x128_intrawave_0x1x0_1,1827.75,616.36,0.0
256,48310,3072,6144,cktile,11,0,959.2697,a8w8_blockscale_cktile_192x256x128_4x2x1_16x16x128_intrawave_0x1x0_1,1901.07,638.51,0.0
256,53093,3072,3072,cktile,11,0,619.1104,a8w8_blockscale_cktile_192x256x128_4x2x1_16x16x128_intrawave_0x1x0_1,1618.61,805.58,0.0
256,55349,3072,6144,cktile,11,0,1124.9,a8w8_blockscale_cktile_192x256x128_4x2x1_16x16x128_intrawave_0x1x0_1,1857.37,621.39,0.0
256,57008,3072,6144,cktile,11,0,1150.1598,a8w8_blockscale_cktile_192x256x128_4x2x1_16x16x128_intrawave_0x1x0_1,1871.03,625.47,0.0
256,64564,3072,6144,cktile,11,0,1310.3687,a8w8_blockscale_cktile_192x256x128_4x2x1_16x16x128_intrawave_0x1x0_1,1859.94,619.85,0.0
256,65536,3072,3072,cktile,11,0,763.0407,a8w8_blockscale_cktile_192x256x128_4x2x1_16x16x128_intrawave_0x1x0_1,1621.08,803.91,0.0
256,65536,3072,6144,cktile,11,0,1264.7506,a8w8_blockscale_cktile_192x256x128_4x2x1_16x16x128_intrawave_0x1x0_1,1956.04,651.65,0.0
256,1,4096,3072,ck,8,0,10.3556,a8w8_blockscale_1x128x128_256x16x64x256_16x16_16x16_1x1_16x16x1_16x16x1_1x16x1x16_4_1x1_intrawave_v1,2.43,1216.17,0.0
256,2,4096,3072,ck,8,0,10.4074,a8w8_blockscale_1x128x128_256x16x64x256_16x16_16x16_1x1_16x16x1_16x16x1_1x16x1x16_4_1x1_intrawave_v1,4.84,1211.2,0.0
256,4,4096,3072,ck,8,0,10.45,a8w8_blockscale_1x128x128_256x16x64x256_16x16_16x16_1x1_16x16x1_16x16x1_1x16x1x16_4_1x1_intrawave_v1,9.63,1208.42,0.0
256,8,4096,3072,ck,8,0,10.5801,a8w8_blockscale_1x128x128_256x16x64x256_16x16_16x16_1x1_16x16x1_16x16x1_1x16x1x16_4_1x1_intrawave_v1,19.03,1197.82,0.0
256,16,4096,3072,ck,8,0,10.0186,a8w8_blockscale_1x128x128_256x16x64x256_16x16_16x16_1x1_16x16x1_16x16x1_1x16x1x16_4_1x1_intrawave_v1,40.19,1273.94,0.0
256,24,4096,3072,ck,8,0,10.7328,a8w8_blockscale_1x128x128_256x16x64x256_16x16_16x16_1x1_16x16x1_16x16x1_1x16x1x16_4_1x1_intrawave_v1,56.27,1197.57,0.0
256,32,4096,3072,ck,8,0,10.2671,a8w8_blockscale_1x128x128_256x16x64x256_16x16_16x16_1x1_16x16x1_16x16x1_1x16x1x16_4_1x1_intrawave_v1,78.44,1260.66,0.0
256,40,4096,3072,ck,8,0,10.7171,a8w8_blockscale_1x128x128_256x16x64x256_16x16_16x16_1x1_16x16x1_16x16x1_1x16x1x16_4_1x1_intrawave_v1,93.93,1216.14,0.0
256,48,4096,3072,ck,8,0,10.1705,a8w8_blockscale_1x128x128_256x16x64x256_16x16_16x16_1x1_16x16x1_16x16x1_1x16x1x16_4_1x1_intrawave_v1,118.77,1290.36,0.0
256,56,4096,3072,ck,8,0,10.7586,a8w8_blockscale_1x128x128_256x16x64x256_16x16_16x16_1x1_16x16x1_16x16x1_1x16x1x16_4_1x1_intrawave_v1,130.99,1228.2,0.0
256,64,4096,3072,ck,8,0,10.2137,a8w8_blockscale_1x128x128_256x16x64x256_16x16_16x16_1x1_16x16x1_16x16x1_1x16x1x16_4_1x1_intrawave_v1,157.69,1302.55,0.0
256,72,4096,3072,ck,7,0,13.1617,a8w8_blockscale_1x128x128_256x16x128x256_16x16_16x16_1x2_16x16x1_16x16x1_1x16x1x16_8_1x2_intrawave_v1,137.67,1017.64,0.0
256,80,4096,3072,ck,7,0,13.0297,a8w8_blockscale_1x128x128_256x16x128x256_16x16_16x16_1x2_16x16x1_16x16x1_1x16x1x16_8_1x2_intrawave_v1,154.51,1034.87,0.0
256,88,4096,3072,ck,7,0,13.2081,a8w8_blockscale_1x128x128_256x16x128x256_16x16_16x16_1x2_16x16x1_16x16x1_1x16x1x16_8_1x2_intrawave_v1,167.67,1027.71,0.0
256,96,4096,3072,ck,7,0,12.894,a8w8_blockscale_1x128x128_256x16x128x256_16x16_16x16_1x2_16x16x1_16x16x1_1x16x1x16_8_1x2_intrawave_v1,187.37,1059.74,0.0
256,104,4096,3072,ck,7,0,13.3341,a8w8_blockscale_1x128x128_256x16x128x256_16x16_16x16_1x2_16x16x1_16x16x1_1x16x1x16_8_1x2_intrawave_v1,196.28,1031.52,0.0
256,112,4096,3072,ck,7,0,13.0691,a8w8_blockscale_1x128x128_256x16x128x256_16x16_16x16_1x2_16x16x1_16x16x1_1x16x1x16_8_1x2_intrawave_v1,215.67,1059.33,0.0
256,120,4096,3072,ck,7,0,13.2981,a8w8_blockscale_1x128x128_256x16x128x256_16x16_16x16_1x2_16x16x1_16x16x1_1x16x1x16_8_1x2_intrawave_v1,227.09,1047.86,0.0
256,128,4096,3072,ck,7,0,13.0222,a8w8_blockscale_1x128x128_256x16x128x256_16x16_16x16_1x2_16x16x1_16x16x1_1x16x1x16_8_1x2_intrawave_v1,247.36,1076.98,0.0
256,136,4096,3072,ck,18,0,16.2587,a8w8_blockscale_1x128x128_256x64x64x256_16x16_32x32_1x1_16x16x1_16x16x1_1x32x1x8_8_1x1_intrawave_v1,210.51,868.14,0.0
256,144,4096,3072,ck,18,0,16.249,a8w8_blockscale_1x128x128_256x64x64x256_16x16_32x32_1x1_16x16x1_16x16x1_1x32x1x8_8_1x1_intrawave_v1,223.02,874.2,0.0
256,152,4096,3072,ck,18,0,16.1822,a8w8_blockscale_1x128x128_256x64x64x256_16x16_32x32_1x1_16x16x1_16x16x1_1x32x1x8_8_1x1_intrawave_v1,236.38,883.38,0.0
256,160,4096,3072,ck,12,0,15.0945,a8w8_blockscale_1x128x128_256x32x128x256_16x16_32x32_1x1_16x16x1_16x16x1_1x32x1x8_8_1x1_intrawave_v1,266.75,953.01,0.0
256,168,4096,3072,ck,18,0,16.2963,a8w8_blockscale_1x128x128_256x64x64x256_16x16_32x32_1x1_16x16x1_16x16x1_1x32x1x8_8_1x1_intrawave_v1,259.44,888.25,0.0
256,176,4096,3072,ck,18,0,16.337,a8w8_blockscale_1x128x128_256x64x64x256_16x16_32x32_1x1_16x16x1_16x16x1_1x32x1x8_8_1x1_intrawave_v1,271.11,891.56,0.0
256,184,4096,3072,ck,18,0,16.2627,a8w8_blockscale_1x128x128_256x64x64x256_16x16_32x32_1x1_16x16x1_16x16x1_1x32x1x8_8_1x1_intrawave_v1,284.73,901.17,0.0
256,192,4096,3072,ck,18,0,13.1853,a8w8_blockscale_1x128x128_256x64x64x256_16x16_32x32_1x1_16x16x1_16x16x1_1x32x1x8_8_1x1_intrawave_v1,366.46,1118.34,0.0
256,200,4096,3072,ck,18,0,16.549,a8w8_blockscale_1x128x128_256x64x64x256_16x16_32x32_1x1_16x16x1_16x16x1_1x32x1x8_8_1x1_intrawave_v1,304.14,896.47,0.0
256,208,4096,3072,ck,18,0,16.6348,a8w8_blockscale_1x128x128_256x64x64x256_16x16_32x32_1x1_16x16x1_16x16x1_1x32x1x8_8_1x1_intrawave_v1,314.67,897.27,0.0
256,216,4096,3072,ck,18,0,16.4801,a8w8_blockscale_1x128x128_256x64x64x256_16x16_32x32_1x1_16x16x1_16x16x1_1x32x1x8_8_1x1_intrawave_v1,329.84,911.16,0.0
256,224,4096,3072,ck,12,0,15.172,a8w8_blockscale_1x128x128_256x32x128x256_16x16_32x32_1x1_16x16x1_16x16x1_1x32x1x8_8_1x1_intrawave_v1,371.55,995.65,0.0
256,232,4096,3072,ck,18,0,16.6337,a8w8_blockscale_1x128x128_256x64x64x256_16x16_32x32_1x1_16x16x1_16x16x1_1x32x1x8_8_1x1_intrawave_v1,351.0,913.58,0.0
256,240,4096,3072,ck,18,0,16.768,a8w8_blockscale_1x128x128_256x64x64x256_16x16_32x32_1x1_16x16x1_16x16x1_1x32x1x8_8_1x1_intrawave_v1,360.2,911.63,0.0
256,248,4096,3072,ck,18,0,16.6396,a8w8_blockscale_1x128x128_256x64x64x256_16x16_32x32_1x1_16x16x1_16x16x1_1x32x1x8_8_1x1_intrawave_v1,375.08,924.08,0.0
256,256,4096,3072,ck,18,0,13.5078,a8w8_blockscale_1x128x128_256x64x64x256_16x16_32x32_1x1_16x16x1_16x16x1_1x32x1x8_8_1x1_intrawave_v1,476.94,1145.0,0.0
256,272,4096,3072,ck,2,0,20.9805,a8w8_blockscale_1x128x128_256x64x128x128_16x16_32x32_1x2_8x32x1_8x32x1_1x32x1x8_8_1x1_intrawave_v3,326.26,745.77,0.0
256,288,4096,3072,ck,2,0,21.0045,a8w8_blockscale_1x128x128_256x64x128x128_16x16_32x32_1x2_8x32x1_8x32x1_1x32x1x8_8_1x1_intrawave_v3,345.06,753.5,0.0
256,304,4096,3072,ck,2,0,20.8507,a8w8_blockscale_1x128x128_256x64x128x128_16x16_32x32_1x2_8x32x1_8x32x1_1x32x1x8_8_1x1_intrawave_v3,366.91,767.7,0.0
256,320,4096,3072,ck,2,0,20.6967,a8w8_blockscale_1x128x128_256x64x128x128_16x16_32x32_1x2_8x32x1_8x32x1_1x32x1x8_8_1x1_intrawave_v3,389.1,782.12,0.0
256,336,4096,3072,ck,2,0,20.6152,a8w8_blockscale_1x128x128_256x64x128x128_16x16_32x32_1x2_8x32x1_8x32x1_1x32x1x8_8_1x1_intrawave_v3,410.17,793.96,0.0
256,352,4096,3072,ck,2,0,20.8652,a8w8_blockscale_1x128x128_256x64x128x128_16x16_32x32_1x2_8x32x1_8x32x1_1x32x1x8_8_1x1_intrawave_v3,424.55,793.08,0.0
256,368,4096,3072,ck,2,0,20.8876,a8w8_blockscale_1x128x128_256x64x128x128_16x16_32x32_1x2_8x32x1_8x32x1_1x32x1x8_8_1x1_intrawave_v3,443.37,800.86,0.0
256,384,4096,3072,ck,2,0,20.6865,a8w8_blockscale_1x128x128_256x64x128x128_16x16_32x32_1x2_8x32x1_8x32x1_1x32x1x8_8_1x1_intrawave_v3,467.15,817.36,0.0
256,400,4096,3072,ck,2,0,20.8543,a8w8_blockscale_1x128x128_256x64x128x128_16x16_32x32_1x2_8x32x1_8x32x1_1x32x1x8_8_1x1_intrawave_v3,482.7,819.42,0.0
256,416,4096,3072,ck,2,0,20.9068,a8w8_blockscale_1x128x128_256x64x128x128_16x16_32x32_1x2_8x32x1_8x32x1_1x32x1x8_8_1x1_intrawave_v3,500.75,825.99,0.0
256,432,4096,3072,ck,2,0,20.9537,a8w8_blockscale_1x128x128_256x64x128x128_16x16_32x32_1x2_8x32x1_8x32x1_1x32x1x8_8_1x1_intrawave_v3,518.84,832.74,0.0
256,448,4096,3072,ck,2,0,20.7991,a8w8_blockscale_1x128x128_256x64x128x128_16x16_32x32_1x2_8x32x1_8x32x1_1x32x1x8_8_1x1_intrawave_v3,542.06,847.59,0.0
256,464,4096,3072,ck,2,0,21.0534,a8w8_blockscale_1x128x128_256x64x128x128_16x16_32x32_1x2_8x32x1_8x32x1_1x32x1x8_8_1x1_intrawave_v3,554.63,845.92,0.0
256,480,4096,3072,ck,2,0,21.0767,a8w8_blockscale_1x128x128_256x64x128x128_16x16_32x32_1x2_8x32x1_8x32x1_1x32x1x8_8_1x1_intrawave_v3,573.13,853.53,0.0
256,496,4096,3072,ck,2,0,21.0087,a8w8_blockscale_1x128x128_256x64x128x128_16x16_32x32_1x2_8x32x1_8x32x1_1x32x1x8_8_1x1_intrawave_v3,594.15,864.87,0.0
256,512,4096,3072,ck,2,0,20.7597,a8w8_blockscale_1x128x128_256x64x128x128_16x16_32x32_1x2_8x32x1_8x32x1_1x32x1x8_8_1x1_intrawave_v3,620.67,883.93,0.0
256,1000,4096,3072,ck,0,0,28.3526,a8w8_blockscale_1x128x128_256x128x128x128_16x16_32x32_2x2_8x32x1_8x32x1_1x32x1x8_8_1x1_intrawave_v3,887.6,841.08,0.0
256,1001,4096,3072,ck,0,0,28.3089,a8w8_blockscale_1x128x128_256x128x128x128_16x16_32x32_2x2_8x32x1_8x32x1_1x32x1x8_8_1x1_intrawave_v3,889.86,842.78,0.0
256,2000,4096,3072,ck,0,0,47.479,a8w8_blockscale_1x128x128_256x128x128x128_16x16_32x32_2x2_8x32x1_8x32x1_1x32x1x8_8_1x1_intrawave_v3,1060.08,739.5,0.0
256,2002,4096,3072,ck,0,0,47.1906,a8w8_blockscale_1x128x128_256x128x128x128_16x16_32x32_2x2_8x32x1_8x32x1_1x32x1x8_8_1x1_intrawave_v3,1067.63,744.5,0.0
256,4000,4096,3072,ck,0,0,87.3113,a8w8_blockscale_1x128x128_256x128x128x128_16x16_32x32_2x2_8x32x1_8x32x1_1x32x1x8_8_1x1_intrawave_v3,1152.92,660.15,0.0
256,11001,4096,3072,cktile,11,0,195.9756,a8w8_blockscale_cktile_192x256x128_4x2x1_16x16x128_intrawave_0x1x0_1,1412.67,696.51,0.0
256,12909,4096,3072,cktile,11,0,237.5451,a8w8_blockscale_cktile_192x256x128_4x2x1_16x16x128_intrawave_0x1x0_1,1367.6,665.09,0.0
256,30553,4096,3072,cktile,11,0,483.4915,a8w8_blockscale_cktile_192x256x128_4x2x1_16x16x128_intrawave_0x1x0_1,1590.29,737.82,0.0
256,53093,4096,3072,cktile,11,0,862.9231,a8w8_blockscale_cktile_192x256x128_4x2x1_16x16x128_intrawave_0x1x0_1,1548.38,707.62,0.0
256,65536,4096,3072,cktile,11,0,1054.2943,a8w8_blockscale_cktile_192x256x128_4x2x1_16x16x128_intrawave_0x1x0_1,1564.33,712.12,0.0
256,1,8192,3072,ck,8,0,11.0124,a8w8_blockscale_1x128x128_256x16x64x256_16x16_16x16_1x1_16x16x1_16x16x1_1x16x1x16_4_1x1_intrawave_v1,4.57,2286.99,0.0
256,2,8192,3072,ck,8,0,11.0316,a8w8_blockscale_1x128x128_256x16x64x256_16x16_16x16_1x1_16x16x1_16x16x1_1x16x1x16_4_1x1_intrawave_v1,9.12,2284.78,0.0
256,4,8192,3072,ck,8,0,11.0508,a8w8_blockscale_1x128x128_256x16x64x256_16x16_16x16_1x1_16x16x1_16x16x1_1x16x1x16_4_1x1_intrawave_v1,18.22,2284.33,0.0
256,8,8192,3072,ck,8,0,11.0572,a8w8_blockscale_1x128x128_256x16x64x256_16x16_16x16_1x1_16x16x1_16x16x1_1x16x1x16_4_1x1_intrawave_v1,36.42,2290.04,0.0
256,16,8192,3072,ck,8,0,10.6548,a8w8_blockscale_1x128x128_256x16x64x256_16x16_16x16_1x1_16x16x1_16x16x1_1x16x1x16_4_1x1_intrawave_v1,75.58,2391.14,0.0
256,24,8192,3072,ck,8,0,11.2253,a8w8_blockscale_1x128x128_256x16x64x256_16x16_16x16_1x1_16x16x1_16x16x1_1x16x1x16_4_1x1_intrawave_v1,107.61,2283.48,0.0
256,32,8192,3072,ck,8,0,10.8162,a8w8_blockscale_1x128x128_256x16x64x256_16x16_16x16_1x1_16x16x1_16x16x1_1x16x1x16_4_1x1_intrawave_v1,148.91,2384.24,0.0
256,40,8192,3072,ck,7,0,13.5074,a8w8_blockscale_1x128x128_256x16x128x256_16x16_16x16_1x2_16x16x1_16x16x1_1x16x1x16_8_1x2_intrawave_v1,149.05,1920.73,0.0
256,48,8192,3072,ck,7,0,13.3978,a8w8_blockscale_1x128x128_256x16x128x256_16x16_16x16_1x2_16x16x1_16x16x1_1x16x1x16_8_1x2_intrawave_v1,180.32,1948.06,0.0
256,56,8192,3072,ck,7,0,13.7485,a8w8_blockscale_1x128x128_256x16x128x256_16x16_16x16_1x2_16x16x1_16x16x1_1x16x1x16_8_1x2_intrawave_v1,205.01,1909.69,0.0
256,64,8192,3072,ck,18,0,13.2189,a8w8_blockscale_1x128x128_256x64x64x256_16x16_32x32_1x1_16x16x1_16x16x1_1x32x1x8_8_1x1_intrawave_v1,243.68,1997.97,0.0
256,72,8192,3072,ck,12,0,16.4698,a8w8_blockscale_1x128x128_256x32x128x256_16x16_32x32_1x1_16x16x1_16x16x1_1x32x1x8_8_1x1_intrawave_v1,220.03,1613.05,0.0
256,80,8192,3072,ck,18,0,16.521,a8w8_blockscale_1x128x128_256x64x64x256_16x16_32x32_1x1_16x16x1_16x16x1_1x32x1x8_8_1x1_intrawave_v1,243.72,1617.47,0.0
256,88,8192,3072,ck,18,0,16.245,a8w8_blockscale_1x128x128_256x64x64x256_16x16_32x32_1x1_16x16x1_16x16x1_1x32x1x8_8_1x1_intrawave_v1,272.65,1654.54,0.0
256,96,8192,3072,ck,12,0,15.4478,a8w8_blockscale_1x128x128_256x32x128x256_16x16_32x32_1x1_16x16x1_16x16x1_1x32x1x8_8_1x1_intrawave_v1,312.78,1750.0,0.0
256,104,8192,3072,ck,18,0,16.6055,a8w8_blockscale_1x128x128_256x64x64x256_16x16_32x32_1x1_16x16x1_16x16x1_1x32x1x8_8_1x1_intrawave_v1,315.23,1637.36,0.0
256,112,8192,3072,ck,18,0,16.6302,a8w8_blockscale_1x128x128_256x64x64x256_16x16_32x32_1x1_16x16x1_16x16x1_1x32x1x8_8_1x1_intrawave_v1,338.97,1644.29,0.0
256,120,8192,3072,ck,18,0,16.5063,a8w8_blockscale_1x128x128_256x64x64x256_16x16_32x32_1x1_16x16x1_16x16x1_1x32x1x8_8_1x1_intrawave_v1,365.91,1666.06,0.0
256,128,8192,3072,ck,18,0,13.8405,a8w8_blockscale_1x128x128_256x64x64x256_16x16_32x32_1x1_16x16x1_16x16x1_1x32x1x8_8_1x1_intrawave_v1,465.48,1998.21,0.0
256,136,8192,3072,ck,2,0,21.4093,a8w8_blockscale_1x128x128_256x64x128x128_16x16_32x32_1x2_8x32x1_8x32x1_1x32x1x8_8_1x1_intrawave_v3,319.73,1299.05,0.0
256,144,8192,3072,ck,2,0,21.2828,a8w8_blockscale_1x128x128_256x64x128x128_16x16_32x32_1x2_8x32x1_8x32x1_1x32x1x8_8_1x1_intrawave_v3,340.55,1314.09,0.0
256,152,8192,3072,ck,2,0,21.366,a8w8_blockscale_1x128x128_256x64x128x128_16x16_32x32_1x2_8x32x1_8x32x1_1x32x1x8_8_1x1_intrawave_v3,358.06,1316.26,0.0
256,160,8192,3072,ck,2,0,21.4201,a8w8_blockscale_1x128x128_256x64x128x128_16x16_32x32_1x2_8x32x1_8x32x1_1x32x1x8_8_1x1_intrawave_v3,375.96,1320.2,0.0
256,168,8192,3072,ck,2,0,21.4769,a8w8_blockscale_1x128x128_256x64x128x128_16x16_32x32_1x2_8x32x1_8x32x1_1x32x1x8_8_1x1_intrawave_v3,393.71,1323.95,0.0
256,176,8192,3072,ck,2,0,21.5412,a8w8_blockscale_1x128x128_256x64x128x128_16x16_32x32_1x2_8x32x1_8x32x1_1x32x1x8_8_1x1_intrawave_v3,411.23,1327.23,0.0
256,184,8192,3072,ck,2,0,21.668,a8w8_blockscale_1x128x128_256x64x128x128_16x16_32x32_1x2_8x32x1_8x32x1_1x32x1x8_8_1x1_intrawave_v3,427.41,1326.64,0.0
256,192,8192,3072,ck,2,0,21.418,a8w8_blockscale_1x128x128_256x64x128x128_16x16_32x32_1x2_8x32x1_8x32x1_1x32x1x8_8_1x1_intrawave_v3,451.19,1349.4,0.0
256,200,8192,3072,ck,2,0,21.5168,a8w8_blockscale_1x128x128_256x64x128x128_16x16_32x32_1x2_8x32x1_8x32x1_1x32x1x8_8_1x1_intrawave_v3,467.84,1350.43,0.0
256,208,8192,3072,ck,2,0,21.5155,a8w8_blockscale_1x128x128_256x64x128x128_16x16_32x32_1x2_8x32x1_8x32x1_1x32x1x8_8_1x1_intrawave_v3,486.58,1357.75,0.0
256,216,8192,3072,ck,2,0,21.6053,a8w8_blockscale_1x128x128_256x64x128x128_16x16_32x32_1x2_8x32x1_8x32x1_1x32x1x8_8_1x1_intrawave_v3,503.19,1359.31,0.0
256,224,8192,3072,ck,2,0,21.7178,a8w8_blockscale_1x128x128_256x64x128x128_16x16_32x32_1x2_8x32x1_8x32x1_1x32x1x8_8_1x1_intrawave_v3,519.13,1359.44,0.0
256,232,8192,3072,ck,2,0,21.6499,a8w8_blockscale_1x128x128_256x64x128x128_16x16_32x32_1x2_8x32x1_8x32x1_1x32x1x8_8_1x1_intrawave_v3,539.35,1370.89,0.0
256,240,8192,3072,ck,2,0,21.802,a8w8_blockscale_1x128x128_256x64x128x128_16x16_32x32_1x2_8x32x1_8x32x1_1x32x1x8_8_1x1_intrawave_v3,554.06,1368.46,0.0
256,248,8192,3072,ck,2,0,21.859,a8w8_blockscale_1x128x128_256x64x128x128_16x16_32x32_1x2_8x32x1_8x32x1_1x32x1x8_8_1x1_intrawave_v3,571.03,1372.02,0.0
256,256,8192,3072,ck,2,0,21.6717,a8w8_blockscale_1x128x128_256x64x128x128_16x16_32x32_1x2_8x32x1_8x32x1_1x32x1x8_8_1x1_intrawave_v3,594.55,1391.06,0.0
256,272,8192,3072,ck,0,0,26.5702,a8w8_blockscale_1x128x128_256x128x128x128_16x16_32x32_2x2_8x32x1_8x32x1_1x32x1x8_8_1x1_intrawave_v3,515.25,1146.32,0.0
256,288,8192,3072,ck,0,0,26.7059,a8w8_blockscale_1x128x128_256x128x128x128_16x16_32x32_2x2_8x32x1_8x32x1_1x32x1x8_8_1x1_intrawave_v3,542.78,1152.15,0.0
256,304,8192,3072,ck,0,0,27.0392,a8w8_blockscale_1x128x128_256x128x128x128_16x16_32x32_2x2_8x32x1_8x32x1_1x32x1x8_8_1x1_intrawave_v3,565.88,1149.46,0.0
256,320,8192,3072,ck,0,0,27.3202,a8w8_blockscale_1x128x128_256x128x128x128_16x16_32x32_2x2_8x32x1_8x32x1_1x32x1x8_8_1x1_intrawave_v3,589.53,1149.03,0.0
256,336,8192,3072,ck,0,0,27.5313,a8w8_blockscale_1x128x128_256x128x128x128_16x16_32x32_2x2_8x32x1_8x32x1_1x32x1x8_8_1x1_intrawave_v3,614.26,1151.53,0.0
256,352,8192,3072,ck,0,0,27.9625,a8w8_blockscale_1x128x128_256x128x128x128_16x16_32x32_2x2_8x32x1_8x32x1_1x32x1x8_8_1x1_intrawave_v3,633.59,1144.9,0.0
256,368,8192,3072,ck,0,0,28.1002,a8w8_blockscale_1x128x128_256x128x128x128_16x16_32x32_2x2_8x32x1_8x32x1_1x32x1x8_8_1x1_intrawave_v3,659.14,1150.37,0.0
256,384,8192,3072,ck,0,0,27.2999,a8w8_blockscale_1x128x128_256x128x128x128_16x16_32x32_2x2_8x32x1_8x32x1_1x32x1x8_8_1x1_intrawave_v3,707.96,1195.5,0.0
256,400,8192,3072,ck,0,0,27.5365,a8w8_blockscale_1x128x128_256x128x128x128_16x16_32x32_2x2_8x32x1_8x32x1_1x32x1x8_8_1x1_intrawave_v3,731.13,1196.53,0.0
256,416,8192,3072,ck,0,0,27.4955,a8w8_blockscale_1x128x128_256x128x128x128_16x16_32x32_2x2_8x32x1_8x32x1_1x32x1x8_8_1x1_intrawave_v3,761.51,1209.64,0.0
256,432,8192,3072,ck,0,0,27.9777,a8w8_blockscale_1x128x128_256x128x128x128_16x16_32x32_2x2_8x32x1_8x32x1_1x32x1x8_8_1x1_intrawave_v3,777.16,1199.91,0.0
256,448,8192,3072,ck,0,0,28.3084,a8w8_blockscale_1x128x128_256x128x128x128_16x16_32x32_2x2_8x32x1_8x32x1_1x32x1x8_8_1x1_intrawave_v3,796.53,1196.89,0.0
256,464,8192,3072,ck,0,0,28.5062,a8w8_blockscale_1x128x128_256x128x128x128_16x16_32x32_2x2_8x32x1_8x32x1_1x32x1x8_8_1x1_intrawave_v3,819.26,1199.51,0.0
256,480,8192,3072,ck,0,0,28.8071,a8w8_blockscale_1x128x128_256x128x128x128_16x16_32x32_2x2_8x32x1_8x32x1_1x32x1x8_8_1x1_intrawave_v3,838.65,1197.78,0.0
256,496,8192,3072,ck,0,0,29.1126,a8w8_blockscale_1x128x128_256x128x128x128_16x16_32x32_2x2_8x32x1_8x32x1_1x32x1x8_8_1x1_intrawave_v3,857.52,1195.91,0.0
256,512,8192,3072,ck,0,0,28.0811,a8w8_blockscale_1x128x128_256x128x128x128_16x16_32x32_2x2_8x32x1_8x32x1_1x32x1x8_8_1x1_intrawave_v3,917.69,1250.92,0.0
256,1000,8192,3072,ck,0,0,47.1618,a8w8_blockscale_1x128x128_256x128x128x128_16x16_32x32_2x2_8x32x1_8x32x1_1x32x1x8_8_1x1_intrawave_v3,1067.21,946.14,0.0
256,1001,8192,3072,ck,0,0,49.5374,a8w8_blockscale_1x128x128_256x128x128x128_16x16_32x32_2x2_8x32x1_8x32x1_1x32x1x8_8_1x1_intrawave_v3,1017.05,901.16,0.0
256,1169,8192,3072,cktile,11,0,52.1434,a8w8_blockscale_cktile_192x256x128_4x2x1_16x16x128_intrawave_0x1x0_1,1128.38,918.81,0.0
256,1192,8192,3072,cktile,11,0,52.4591,a8w8_blockscale_cktile_192x256x128_4x2x1_16x16x128_intrawave_0x1x0_1,1143.66,921.81,0.0
256,1200,8192,3072,cktile,11,0,53.2444,a8w8_blockscale_cktile_192x256x128_4x2x1_16x16x128_intrawave_0x1x0_1,1134.35,911.14,0.0
256,1202,8192,3072,cktile,11,0,52.5499,a8w8_blockscale_cktile_192x256x128_4x2x1_16x16x128_intrawave_0x1x0_1,1151.26,923.92,0.0
256,1205,8192,3072,cktile,11,0,52.4398,a8w8_blockscale_cktile_192x256x128_4x2x1_16x16x128_intrawave_0x1x0_1,1156.56,926.97,0.0
256,1216,8192,3072,cktile,11,0,52.7627,a8w8_blockscale_cktile_192x256x128_4x2x1_16x16x128_intrawave_0x1x0_1,1159.97,925.36,0.0
256,1263,8192,3072,cktile,11,0,52.5925,a8w8_blockscale_cktile_192x256x128_4x2x1_16x16x128_intrawave_0x1x0_1,1208.71,945.74,0.0
256,2197,8192,3072,cktile,11,0,97.6892,a8w8_blockscale_cktile_192x256x128_4x2x1_16x16x128_intrawave_0x1x0_1,1131.94,695.17,0.0
256,2200,8192,3072,cktile,11,0,97.8051,a8w8_blockscale_cktile_192x256x128_4x2x1_16x16x128_intrawave_0x1x0_1,1132.15,694.94,0.0
256,2202,8192,3072,cktile,11,0,97.4293,a8w8_blockscale_cktile_192x256x128_4x2x1_16x16x128_intrawave_0x1x0_1,1137.55,698.02,0.0
256,2204,8192,3072,cktile,11,0,97.4521,a8w8_blockscale_cktile_192x256x128_4x2x1_16x16x128_intrawave_0x1x0_1,1138.31,698.26,0.0
256,2216,8192,3072,cktile,11,0,97.6192,a8w8_blockscale_cktile_192x256x128_4x2x1_16x16x128_intrawave_0x1x0_1,1142.55,699.46,0.0
256,2230,8192,3072,cktile,11,0,97.3369,a8w8_blockscale_cktile_192x256x128_4x2x1_16x16x128_intrawave_0x1x0_1,1153.1,704.28,0.0
256,3201,8192,3072,ck,0,0,138.1852,a8w8_blockscale_1x128x128_256x128x128x128_16x16_32x32_2x2_8x32x1_8x32x1_1x32x1x8_8_1x1_intrawave_v3,1165.91,632.81,0.0
256,3225,8192,3072,ck,0,0,141.6829,a8w8_blockscale_1x128x128_256x128x128x128_16x16_32x32_2x2_8x32x1_8x32x1_1x32x1x8_8_1x1_intrawave_v3,1145.65,620.48,0.0
256,3227,8192,3072,ck,0,0,138.9984,a8w8_blockscale_1x128x128_256x128x128x128_16x16_32x32_2x2_8x32x1_8x32x1_1x32x1x8_8_1x1_intrawave_v3,1168.5,632.74,0.0
256,3242,8192,3072,ck,0,0,138.9965,a8w8_blockscale_1x128x128_256x128x128x128_16x16_32x32_2x2_8x32x1_8x32x1_1x32x1x8_8_1x1_intrawave_v3,1173.95,634.85,0.0
256,4000,8192,3072,cktile,11,0,145.4866,a8w8_blockscale_cktile_192x256x128_4x2x1_16x16x128_intrawave_0x1x0_1,1383.82,707.9,0.0
256,4197,8192,3072,cktile,11,0,146.682,a8w8_blockscale_cktile_192x256x128_4x2x1_16x16x128_intrawave_0x1x0_1,1440.14,728.26,0.0
256,4219,8192,3072,cktile,11,0,147.1555,a8w8_blockscale_cktile_192x256x128_4x2x1_16x16x128_intrawave_0x1x0_1,1443.03,728.83,0.0
256,4223,8192,3072,cktile,11,0,146.8016,a8w8_blockscale_cktile_192x256x128_4x2x1_16x16x128_intrawave_0x1x0_1,1447.88,731.11,0.0
256,4250,8192,3072,cktile,11,0,146.1229,a8w8_blockscale_cktile_192x256x128_4x2x1_16x16x128_intrawave_0x1x0_1,1463.9,738.1,0.0
256,5197,8192,3072,cktile,11,0,191.1534,a8w8_blockscale_cktile_192x256x128_4x2x1_16x16x128_intrawave_0x1x0_1,1368.4,660.61,0.0
256,6792,8192,3072,cktile,11,0,240.0892,a8w8_blockscale_cktile_192x256x128_4x2x1_16x16x128_intrawave_0x1x0_1,1423.86,655.22,0.0
256,6830,8192,3072,cktile,11,0,238.6872,a8w8_blockscale_cktile_192x256x128_4x2x1_16x16x128_intrawave_0x1x0_1,1440.23,662.16,0.0
256,7001,8192,3072,cktile,11,0,240.2228,a8w8_blockscale_cktile_192x256x128_4x2x1_16x16x128_intrawave_0x1x0_1,1466.85,671.78,0.0
256,7787,8192,3072,cktile,11,0,281.6807,a8w8_blockscale_cktile_192x256x128_4x2x1_16x16x128_intrawave_0x1x0_1,1391.41,627.2,0.0
256,11636,8192,3072,cktile,11,0,382.2391,a8w8_blockscale_cktile_192x256x128_4x2x1_16x16x128_intrawave_0x1x0_1,1532.18,658.11,0.0
256,30743,8192,3072,cktile,11,0,987.8661,a8w8_blockscale_cktile_192x256x128_4x2x1_16x16x128_intrawave_0x1x0_1,1566.35,630.96,0.0
256,31097,8192,3072,cktile,11,0,991.6181,a8w8_blockscale_cktile_192x256x128_4x2x1_16x16x128_intrawave_0x1x0_1,1578.39,635.52,0.0
256,32065,8192,3072,cktile,11,0,1002.5598,a8w8_blockscale_cktile_192x256x128_4x2x1_16x16x128_intrawave_0x1x0_1,1609.76,647.37,0.0
256,35092,8192,3072,cktile,11,0,1093.6563,a8w8_blockscale_cktile_192x256x128_4x2x1_16x16x128_intrawave_0x1x0_1,1614.98,647.29,0.0
256,39088,8192,3072,cktile,11,0,1236.7621,a8w8_blockscale_cktile_192x256x128_4x2x1_16x16x128_intrawave_0x1x0_1,1590.74,635.26,0.0
256,42723,8192,3072,cktile,11,0,1328.9801,a8w8_blockscale_cktile_192x256x128_4x2x1_16x16x128_intrawave_0x1x0_1,1618.02,644.39,0.0
256,48310,8192,3072,cktile,11,0,1513.8604,a8w8_blockscale_cktile_192x256x128_4x2x1_16x16x128_intrawave_0x1x0_1,1606.17,637.5,0.0
256,55349,8192,3072,cktile,11,0,1748.5497,a8w8_blockscale_cktile_192x256x128_4x2x1_16x16x128_intrawave_0x1x0_1,1593.21,630.26,0.0
256,57008,8192,3072,cktile,11,0,1792.666,a8w8_blockscale_cktile_192x256x128_4x2x1_16x16x128_intrawave_0x1x0_1,1600.58,632.75,0.0
256,64564,8192,3072,cktile,11,0,2050.5679,a8w8_blockscale_cktile_192x256x128_4x2x1_16x16x128_intrawave_0x1x0_1,1584.74,624.86,0.0
256,65536,8192,3072,cktile,11,0,2040.1732,a8w8_blockscale_cktile_192x256x128_4x2x1_16x16x128_intrawave_0x1x0_1,1616.79,637.32,0.0
