aiter/ops/triton/configs/gfx950-MHC_FUSED_LITE-C=512.json
{
    "M_LEQ_1024": {
        "BLOCK_M": 32,
        "BLOCK_K": 128,
        "BLOCK_N": 32,
        "NUM_KSPLIT": 1,
        "num_warps": 4,
        "num_stages": 1,
        "waves_per_eu": 2,
        "HRES_OP": 0
    },
    "M_LEQ_2048": {
        "BLOCK_M": 128,
        "BLOCK_K": 128,
        "BLOCK_N": 32,
        "NUM_KSPLIT": 1,
        "num_warps": 4,
        "num_stages": 1,
        "waves_per_eu": 2,
        "HRES_OP": 0
    },
    "M_LEQ_4096": {
        "BLOCK_M": 128,
        "BLOCK_K": 128,
        "BLOCK_N": 32,
        "NUM_KSPLIT": 1,
        "num_warps": 4,
        "num_stages": 2,
        "waves_per_eu": 2,
        "HRES_OP": 0
    },
    "M_LEQ_8192": {
        "BLOCK_M": 128,
        "BLOCK_K": 64,
        "BLOCK_N": 32,
        "NUM_KSPLIT": 1,
        "num_warps": 4,
        "num_stages": 2,
        "waves_per_eu": 2,
        "HRES_OP": 0
    },
    "M_LEQ_16384": {
        "BLOCK_M": 128,
        "BLOCK_K": 64,
        "BLOCK_N": 32,
        "NUM_KSPLIT": 1,
        "num_warps": 4,
        "num_stages": 1,
        "waves_per_eu": 2,
        "HRES_OP": 0
    },
    "any": {
        "BLOCK_M": 64,
        "BLOCK_K": 64,
        "BLOCK_N": 32,
        "NUM_KSPLIT": 1,
        "num_warps": 4,
        "num_stages": 1,
        "waves_per_eu": 2,
        "HRES_OP": 0
    }
}
