aiter/ops/triton/configs/gfx950-MHC_POST-C=4096.json
{
    "M_LEQ_1024": {
        "BLOCK_M": 8,
        "BLOCK_C": 256,
        "num_warps": 4,
        "num_stages": 1,
        "waves_per_eu": 3
    },
    "M_LEQ_2048": {
        "BLOCK_M": 8,
        "BLOCK_C": 256,
        "num_warps": 2,
        "num_stages": 2,
        "waves_per_eu": 3
    },
    "M_LEQ_4096": {
        "BLOCK_M": 8,
        "BLOCK_C": 256,
        "num_warps": 4,
        "num_stages": 1,
        "waves_per_eu": 1
    },
    "M_LEQ_8192": {
        "BLOCK_M": 8,
        "BLOCK_C": 256,
        "num_warps": 2,
        "num_stages": 3,
        "waves_per_eu": 0
    },
    "M_LEQ_16384": {
        "BLOCK_M": 16,
        "BLOCK_C": 256,
        "num_warps": 2,
        "num_stages": 1,
        "waves_per_eu": 1
    },
    "any": {
        "BLOCK_M": 16,
        "BLOCK_C": 256,
        "num_warps": 2,
        "num_stages": 1,
        "waves_per_eu": 1
    }
}
