aiter/ops/triton/configs/MI300X-ATTN-QK-INT8-PER-BLOCK.json
{
  "small": {
    "BLOCK_SIZE_M": 128,
    "BLOCK_SIZE_N": 32,
    "num_warps": 4,
    "num_stages": 3,
    "waves_per_eu": 2,
    "matrix_instr_nonkdim": 32,
    "cache_modifier": ".ca"
  },
  "medium_M64": {
    "BLOCK_SIZE_M": 128,
    "BLOCK_SIZE_N": 32,
    "num_warps": 4,
    "num_stages": 3,
    "waves_per_eu": 2,
    "matrix_instr_nonkdim": 32,
    "cache_modifier": ".ca"
  },
  "medium_M128": {
    "BLOCK_SIZE_M": 128,
    "BLOCK_SIZE_N": 32,
    "num_warps": 4,
    "num_stages": 3,
    "waves_per_eu": 2,
    "matrix_instr_nonkdim": 32,
    "cache_modifier": ".ca"
  },
  "large": {
    "BLOCK_SIZE_M": 128,
    "BLOCK_SIZE_N": 32,
    "num_warps": 4,
    "num_stages": 3,
    "waves_per_eu": 2,
    "matrix_instr_nonkdim": 32,
    "cache_modifier": ".ca"
  },
  "xlarge": {
    "BLOCK_SIZE_M": 128,
    "BLOCK_SIZE_N": 32,
    "num_warps": 4,
    "num_stages": 3,
    "waves_per_eu": 2,
    "matrix_instr_nonkdim": 32,
    "cache_modifier": ".ca"
  },
  "any": {
    "BLOCK_SIZE_M": 128,
    "BLOCK_SIZE_N": 32,
    "num_warps": 4,
    "num_stages": 3,
    "waves_per_eu": 2,
    "matrix_instr_nonkdim": 32,
    "cache_modifier": ".ca"
  }
}
