op_tests/sample_tuned_grouped_fmoe.csv
gfx,cu_num,token,model_dim,inter_dim,expert,topk,act_type,dtype,q_dtype_a,q_dtype_w,q_type,use_g1u1,doweight_stage1,gate_mode,max_m,tile_m,m_warp,tile_n1,tile_k1,n_warp1,num_buffers1,split_k1,tile_n2,tile_k2,n_warp2,num_buffers2,split_k2,grouped_persistent_m,persistent_workers,stage1_weight_layout,kernelName1,kernelName2,us,tflops,bw
gfx1250,80,1,7168,2048,256,8,ActivationType.Swiglu,torch.bfloat16,torch.float8_e4m3fn,torch.float4_e2m1fn_x2,QuantType.per_1x32,1,0,GateMode.SEPARATED,16,16,1,256,256,4,2,1,512,256,4,2,1,0,,gguu,grouped_gemm1_a8w4_gguu,grouped_gemm2_a8w4,142.61,0,0
gfx1250,80,8,7168,2048,256,8,ActivationType.Swiglu,torch.bfloat16,torch.float8_e4m3fn,torch.float4_e2m1fn_x2,QuantType.per_1x32,1,0,GateMode.SEPARATED,16,16,1,128,256,2,3,1,256,512,4,2,1,0,,gguu,grouped_gemm1_a8w4_gguu,grouped_gemm2_a8w4,158.34,0,0
gfx1250,80,64,7168,2048,256,8,ActivationType.Swiglu,torch.bfloat16,torch.float8_e4m3fn,torch.float4_e2m1fn_x2,QuantType.per_1x32,1,0,GateMode.SEPARATED,16,16,1,256,256,4,2,1,128,256,2,4,1,0,,gguu,grouped_gemm1_a8w4_gguu,grouped_gemm2_a8w4,271.93,0,0
